Index,Sentence
448,ಆದರೆ ವೈಜ್ಞಾನಿಕ ಪ್ರಯೋಗಾಲಯ ಅಧ್ಯಯನಗಳು ಕಾರ್ಪೆಟ್ನಲ್ಲಿ ಅಚ್ಚು ಹೇಗೆ ಬೆಳೆಯುತ್ತವೆ ಮತ್ತು ಸಮಸ್ಯೆಯನ್ನು ಹೇಗೆ ತಪ್ಪಿಸುವುದು ಎಂಬುದರ ಬಗ್ಗೆ ಹೆಚ್ಚು ಸಂಕೀರ್ಣ ಚಿತ್ರಣವನ್ನು ತೋರಿಸಿವೆ.
449,ಜೊತೆಗೆ ಬ್ಯಾಟಿಂಗ್ ಫಿಲ್ಡಿಂಗ್ ಮತ್ತು ಬೌಲಿಂಗ್ ವಿಭಾಗಗಳಲ್ಲಿ ಅಚ್ಚು ಕಟ್ಟಾಗಿ ಕಾರ್ಯ ಮಾಡಿದ್ದರಿಂದ ಎಲ್ಲರ ಶ್ರಮಕ್ಕೆ ತಕ್ಕ ಫಲ ದೊರೆತಿದೆ.
450,ದೇಹಕ್ಕೆ ಅಚ್ಚು ಮತ್ತು ಚಲನೆಯನ್ನು ವರ್ಗಾಯಿಸದ ಮೆಮೊರಿ ಫೋಮ್ ಹಾಸಿಗೆಗಳು ವರ್ಷಗಳಿಂದ ಬಹಳ ಜನಪ್ರಿಯವಾಗಿವೆ.
451,"ಅಚ್ಚು ತುಂಬಿದ ಎಲೆಕೋಸು ಹಾಕಿದ ನಂತರ, ಉಳಿದ ಪದಾರ್ಥಗಳ ಮಿಶ್ರಣವನ್ನು ಆಧರಿಸಿ ಹಿಟ್ಟಿನೊಂದಿಗೆ ಅದನ್ನು ಭರ್ತಿ ಮಾಡಿ."
452,"ಅದು ಕೆಟ್ಟದಾಗಲು ಪ್ರಾರಂಭಿಸಿದರೆ, ಅದು ಕಷ್ಟವಾದರೆ ಮತ್ತು ಅಚ್ಚು ಬೆಳೆಸುತ್ತದೆ ಎಂದು ನಿಮಗೆ ತಿಳಿಯುತ್ತದೆ."
453,"ನಂತರ ನೀವು ಮಾಡಬೇಕು ಒಂದು ನೂರ ಎಪ್ಪತ್ತ ಡಿಗ್ರಿ ಬಿಸಿ ಒಲೆಯಲ್ಲಿ, ಅಚ್ಚು ಕಳುಹಿಸಬಹುದು."
454,ಸಾಧಾರಣವಾಗಿ ಜನರು ಗೊತ್ತಿಲ್ಲ ಮಾಡುವವರ ಲೇಬಲ್ ಕೇವಲ ಏಕೆಂದರೆ ಒಂದು ನಿರ್ದಿಷ್ಟ ಹುಡುಗಿಯ ನಡವಳಿಕೆಅವರು ಇಷ್ಟಪಡದ ಆಫ್ ದೊರೆಯುತ್ತಿಲ್ಲ ಅಚ್ಚು ಯಾರು nymphomaniac.
455,"ಇದರರ್ಥ ಚಕ್ರವನ್ನು ಇನ್ಸ್ಟಾಲ್ ಮಾಡಿದಾಗ, ಹೆಚ್ಚಾಗಿ ಸಂಪರ್ಕ ಸಂಪರ್ಕಕ್ಕೆ ಬದಲಾಗಿ ಅಚ್ಚು ಮತ್ತು ಹಬ್ ನಡುವಿನ ಸ್ಥಳವಿರುತ್ತದೆ."
456,"ಪ್ರಸ್ತುತದ ಮಾದಕದ್ರವ್ಯವನ್ನು 542 ರೊಂದಿಗೆ ಅಚ್ಚು ಮಾಡಲಾಗಿದೆ ಮತ್ತು ಆಲಿವ್ ಹಸಿರು, ಆಯತಾಕಾರದ ಟ್ಯಾಬ್ಲೆಟ್ನಲ್ಲಿ 1-ಮಿಲಿಗ್ರಾಮ್ ಡೋಸ್ ಆಗಿ ಸರಬರಾಜು ಮಾಡಲಾಗಿದ್ದು, ಇದರಲ್ಲಿ ಔಷಧವು ಪಾನೀಯಕ್ಕೆ ಸೇರಿಸಲ್ಪಟ್ಟರೆ ಕಂಡುಬರುವ ಬಣ್ಣವನ್ನು ಹೊಂದಿರುತ್ತದೆ."
457,"ಇತರ ಪಾಕವಿಧಾನಗಳನ್ನು ಭಿನ್ನವಾಗಿ, ಮೃದುಗಿಣ್ಣು ಹಿಟ್ಟನ್ನು ಪಾಲಿನ ಇರುವಂತಿಲ್ಲ ನೀವು ತಕ್ಷಣ ಗರುವಾದ ದೋಸೆಗಳು ಅಚ್ಚು ಮಾಡಬಹುದು."
458,"ವಾಸ್ತವವಾಗಿ, ಎಲ್ಲಾ ಸಿಂಕರ್ಗಳು ಕರಗಿದ ಲೋಹವನ್ನು ಅಚ್ಚು ಆಗಿ ಸುರಿಯುವುದರ ಮೂಲಕ ತಯಾರಿಸಲಾಗುತ್ತದೆ."
459,ಆಂಟಿಸೆಪ್ಟಿಕ್ಸ್ ವಿಶ್ವಾಸಾರ್ಹವಾಗಿ ಕ್ರಿಮಿಗಳು ತಡೆಯುವುದು ಮತ್ತು ಅಚ್ಚು ಮತ್ತು ಶಿಲೀಂಧ್ರ ಬೆಳವಣಿಗೆ ನಿಗ್ರಹಿಸಲು.
460,(ಮೋಹರಂ ರೋಟಿ ಮಾಡುವ ಅಚ್ಚು ಇಲ್ಲದೇ ಇರದೇ ಇದ್ದ ಪಕ್ಷದಲ್ಲಿ)
461,ಇದು ಅಚ್ಚು ಮತ್ತು ಶಿಲೀಂಧ್ರ ವೃದ್ಧಿಗಾಗಿ ಅನುಮತಿಸುವುದಿಲ್ಲ.
462,ಮೆಮೊರಿ ಅಚ್ಚು ಪದ್ಯ ಅಕ್ಟೋಬರ್ 19 ವಿಶೇಷವಾಗಿ ಲಘು.
463,"ಲಾಜಿಕಲ್ ಟೂಲ್ ಎನ್ನುವ ಸುಳ್ಳು ಸುದ್ದಿಗಳನ್ನು ಪತ್ತೆ ಮಾಡುವ ಲಾಗರಿದಮ್ ಬೇಸ್‌ಡ್ ಪ್ರೋಗ್ರಾಂ ಬರೆದಿರುವ ಜೈನ್ ಪ್ರಕಾರ ಜಾಲ ತಾಣದಲ್ಲಿರುವ ಸುಮಾರು 70 ಸಾವಿರ ಡೊಮೈನ್‌ಗಳಲ್ಲಿ ಇರಬಹುದಾದ ಸಂಗ್ರಾಹ್ಯ ಸುದ್ದಿಗಳಿಂದ ಜಾಲಾಡಿ, ಸೋಸಿ ಯಾವುದು ಸುಳ್ಳು ಯಾವುದು ಸತ್ಯ ಮಾಡಲು ರಚಿಸಿ, ಅದರಲ್ಲಿ ನಮ್ಮ ಮೂಲ ಖಾತೆಯ ಶಬ್ದಗಳು ಮತ್ತು ಮಾಡಿರಬಹುದಾದ ಕಿತಾಪತಿ, (ನಾವು ಮೇಲೆ ಮಾಡು ವುದೆಲ್ಲವನ್ನೂ ಅಳಸಿ ಹಾಕಿದ್ದರೂ ಪ್ರತಿ ವಿವರವೂ 0,1,0 ಲೆಕ್ಕದಲ್ಲಿ ಹಿಂಭಾಗದ ಪರದೆಯಲ್ಲಿ ಅಚ್ಚು ಕಟ್ಟಾಗಿ ಸೇವ್ ಆಗುತ್ತಲೇ ಇರುತ್ತದೆ."
464,"ಒಂದು ದೊಡ್ಡ ಚೀಲ; ಕಬ್ಬು, ಬಾಳೆ, ತೆಂಗು ಹಿಡಿಯಲು… ಇನ್ನೊಂದು ಪುಟಾಣಿ ಚೀಲ; ಎಳ್ಳು- ಬೆಲ್ಲ ಅಚ್ಚು ಹಾಕಲು."
465,"ಈಗ, ಅಚ್ಚು ಬಿಡುಗಡೆ ತೈಲ ಮತ್ತು ಅರ್ಧ ಹಿಟ್ಟನ್ನು ಮೇಲೆ ಸುರಿಯುತ್ತಾರೆ."
466,ನಂತರ ನೀವು ಎಣ್ಣೆಯಿಂದ ಅಭಿಷೇಕ ಮತ್ತು ಬ್ರೆಡ್ ಜೊತೆ ಸಿಂಪಡಿಸಿ ಮತ್ತು ಅಚ್ಚು ತನ್ನ ಗಂಜಿ ಇರಿಸಬೇಕಾಗುತ್ತದೆ.
467,ಒಂದು ಹೂಕುಂಡದಲ್ಲಿರುವ ಅಚ್ಚು ಸಂಭವಿಸಿದೆ?
468,"ಈ ತುರಿದ ಚೀಸ್ ಉದುರಿಸಲಾಗುತ್ತದೆ ಮತ್ತು ಸಮವಾಗಿ ಅಚ್ಚು ಮೇಲ್ಮೈ ಮೇಲೆ ಸ್ಥಾನದಲ್ಲಿದೆ ಎಂದು ಖಚಿತಪಡಿಸಿಕೊಳ್ಳಲು, ಮಾಂಸದ ಅವಶೇಷಗಳನ್ನು ಮುಚ್ಚಲಾಗುತ್ತದೆ."
469,"ಒಮ್ಮೆ ಎಲ್ಲಾ ಘಟಕಗಳು ಅಚ್ಚು ಇಡಲಾಗುತ್ತದೆ, ಇದು ಭಕ್ಷ್ಯ ಹಾನಿಯಾಗದಂತೆ, ನಿಖರವಾಗಿ ಪಡೆಯಲು ಅಗತ್ಯವಿದೆ."
470,"ನೀವು ಅಚ್ಚು ಮುಚ್ಚಿದ ಕಪ್ಪು ಟೊಮ್ಯಾಟೊ, ನೋಡಿ, ನಂತರ ಭವಿಷ್ಯದಲ್ಲಿ, ನೀವು ತೊಂದರೆ ತಪ್ಪಿಸಿಕೊಳ್ಳಲು ಸಾಧ್ಯವಿಲ್ಲ."
471,"ಫಾಯಿಲ್ ಕಟ್ಗೆ ಲೆಗ್ ಅನ್ನು ವರ್ಗಾಯಿಸಿ, ಬಿಗಿಯಾಗಿ ಮುಚ್ಚಿ, ಅಚ್ಚು ಅಥವಾ ಬೇಕಿಂಗ್ ಟ್ರೇನಲ್ಲಿ ಹಾಕಿ."
472,ವರ್ಷದ ಹಿರಿಯರಾದ ಪದ್ಮಾ ಅವರಿಗೆ ಸುದೀಪ್ ಅಂದ್ರೆ ಅಚ್ಚು ಮೆಚ್ಚು.
473,ಅರ್ಕಾಮ್ ಒರಿಜಿನ್ಸ್ ಬಗ್ಗೆ ಆಸಕ್ತಿದಾಯಕ ವಿಷಯವೆಂದರೆ ಅಚ್ಚು ಮುರಿಯುವುದರ ಮೂಲಕ ಅದು ತಗ್ಗಿಸುವುದಿಲ್ಲ-ಆಟದ ಮತ್ತು ವಿನ್ಯಾಸ ಅಂಶಗಳು ಹೆಚ್ಚಾಗಿ ಒಂದೇ ಆಗಿರುತ್ತವೆ-ಆದರೆ ಕಥೆ ಹೇಳುವಲ್ಲಿ ಹೊಸ ಅಥವಾ ಆಸಕ್ತಿದಾಯಕ ಏನಾದರೂ ಮಾಡುವುದಿಲ್ಲ.
474,"ನಾಯಕನಾಗಿ, ಆಟಗಾರನಾಗಿ ಉಗ್ರ ಪ್ರತಾಪಿ ಎನಿಸಿಕೊಂಡಿರುವ ಕೊಹ್ಲಿ ಎಂದರೆ ತಂಡದ ಇತರೆ ಆಟಗಾರರಿಗೂ ಅಚ್ಚು ಮೆಚ್ಚು."
475,ಮರಳಿ ಬೆಳೆಯದಂತೆ ಅಚ್ಚು ತಡೆಯಿರಿ.
476,ಶಿಲೀಂಧ್ರ ಮತ್ತು ಅಚ್ಚು ಬೆಳೆಯುವ ಕಾರಣ ಆರ್ದ್ರ ಬಟ್ಟೆಗಳನ್ನು ಪ್ಲಾಸ್ಟಿಕ್ ಚೀಲಗಳಲ್ಲಿ ರಾಶಿಯನ್ನು ಅಥವಾ ಸ್ಥಳದಲ್ಲಿ ಬಿಡಬೇಡಿ.
477,"ಚಿತ್ರಕ್ಕೆ ಅಚ್ಚು ಎಂಬುವವರು ಸಂಗೀತ ನೀಡುತ್ತಿದ್ದು, ಚಿತ್ರದಲ್ಲಿ ಮೂರು ಹಾಡುಗಳಿರಲಿವೆ."
478,"ಈ ಉತ್ಪನ್ನವು ಅಚ್ಚು ಮತ್ತು ಶಿಲೀಂಧ್ರವನ್ನು ತೆಗೆದುಹಾಕುತ್ತದೆ ಎಂದು ಉತ್ಪಾದಕರು ಹೇಳುತ್ತಾರೆ, ಆದರೆ ಅಂತಹ ಯಾವುದೇ ಸಮಸ್ಯೆಗಳಿಲ್ಲ, ಆದ್ದರಿಂದ ನಾನು ಆ ಉತ್ಪನ್ನ ಗುಣಲಕ್ಷಣಗಳನ್ನು ಪರೀಕ್ಷಿಸಲು ಸಾಧ್ಯವಾಗಲಿಲ್ಲ; ಹೇಗಾದರೂ, ಮುಂಭಾಗದ ಲೋಡಿಂಗ್ ಯಂತ್ರಗಳು ಅಚ್ಚು ಸಮಸ್ಯೆಗಳಿಗೆ ಕುಖ್ಯಾತವಾಗಿವೆ, ಆದ್ದರಿಂದ ನಾನು ಈ ಉತ್ಪನ್ನವು ಮೊದಲ ಸ್ಥಾನದಲ್ಲಿ ಉಂಟಾಗದಂತೆ ಇಂತಹ ಸಮಸ್ಯೆಗಳನ್ನು ತಡೆಯುವ ಒಂದು ಪರಿಣಾಮಕಾರಿ ಮಾರ್ಗ ಎಂದು ನಾನು ಭಾವಿಸುತ್ತೇನೆ."
479,"ವಾಲ್ಪೇಪರ್ ಅಡಿಯಲ್ಲಿ ಅಚ್ಚು ರಚಿಸಿದಲ್ಲಿ, ಅಂತಹ ಪಾಕವಿಧಾನಗಳಿಗೆ ಗಮನ ಕೊಡಿ:"
480,"ಅಚ್ಚು ಕೆಳಗೆ ಅದರ ಮೇಲೆ ಮೊದಲ ಕೇಕ್ ಮೊಟ್ಟ - ದಪ್ಪವಾಗಿಸಿದ, ಆದರೆ ಒಂದು ಮೃದು ಕೆನೆ ಸಾಮೂಹಿಕ ಹೊಂದಿದೆ."
481,ಅವುಗಳಲ್ಲಿ ಯುವ ಜನತೆಗೆ ಅಚ್ಚು ಮೆಚ್ಚು ಆಗುವಂತಹ ಅನೇಕ ಟ್ರೆಕ್ಕಿಂಗ್ ಪ್ರದೇಶಗಳ ಕುರಿತು ಲೇಖನದಲ್ಲಿ ತಿಳಿಯೋಣ.
482,ಕಡಿಮೆ ಕೊಬ್ಬಿನ ಮೊಸರು ಬಳಸಿಕೊಂಡು ಕೇಕ್ ಸಿಲಿಕಾನ್ ಅಚ್ಚು ಒಂದು ಸರಳ ಪಾಕವಿಧಾನ
483,ಇದು ತೊಡೆದುಹಾಕಲು ಏನು ಅಚ್ಚು ಮತ್ತು ಹೇಗೆ?
484,"ಮತ್ತು ಎಂದಿನಂತೆ ಮಾಲಿನ್ಯದ ಸೇರಿಸಲಾಗುತ್ತದೆ ಮತ್ತು ಅಧಿಕ ಆರ್ದ್ರತೆ, ಅಚ್ಚು ಮತ್ತು ಶಿಲೀಂಧ್ರ ಕಾರಣವಾಗುತ್ತವೆ ಸ್ನಾನದ."
485,"ಸರಿಯಾಗಿ ಕಾಳಜಿ ವಹಿಸದಿದ್ದಲ್ಲಿ, ತಂಪಾದ ಮಂಜು ಆರ್ದ್ರಕಗಳನ್ನು ಬ್ಯಾಕ್ಟೀರಿಯಾ, ಅಚ್ಚು ಮತ್ತು ಖನಿಜ ನಿಕ್ಷೇಪಗಳನ್ನು ಆವರಿಸಬಹುದು, ನಂತರ ಅವು ಗಾಳಿಯಲ್ಲಿ ಹರಡುತ್ತವೆ."
486,"ಈ ಗ್ರಾಮದಲ್ಲಿ ದೊರೆತ ಶಾಸನಗಳ ಅಚ್ಚು ತೆಗೆದು, ಅವುಗಳಲ್ಲಿ ಓದಬಲ್ಲ ಅಕ್ಷರಗಳನ್ನು ಆಧರಿಸಿ ಶಾಸನ ತಜ್ಞ ಪ್ರೊ."
487,"ಈ ಉಷ್ಣಾಂಶಗಳಲ್ಲಿ, ತಂತಿ ಅಚ್ಚು ಹೊರತೆಗೆಯುವ ಲೂಬ್ರಿಕಂಟ್, ಸ್ಥಗಿತ ನಿರೋಧಿ ಸಂಯುಕ್ತವಾಗಿ, ಗಣಿಗಾರಿಕೆಯ ಯಂತ್ರಗಳಿಗಾಗಿ ಗಿಯರ್‌ ಲೂಬ್ರಿಕಂಟ್ ಹಾಗು ಬೀಗಗಳ ಒಳಗಿನ ಭಾಗಗಳನ್ನು ನಯಗೊಳಿಸಲು ಗ್ರ್ಯಾಫೈಟ್‌ನ್ನು ಬಳಸಲಾಗಿವೆ."
488,ಚರ್ಮಕಾಗದದ ಒಂದು ಅಡಿಗೆ ಹಾಳೆಯ ಸುಗಮಗೊಳಿಸುತ್ತದೆ ಮತ್ತು 180 ಡಿಗ್ರಿ ತುದಿಗಳಲ್ಲಿ ಅಚ್ಚು 3 ಸೆಂ ಪಕ್ಕದ ಗೋಡೆಗೆ ಬಂದ ಹಾಗೆ ಹಿಟ್ಟನ್ನು ಹರಡಿತು.
489,ಕರೆಯೋಲೆಯನ್ನೂ ಅಚ್ಚು ಮಾಡಿಸಿ ನೆಂಟರಿಷ್ಟರಿಗೆ ನೀಡಿದ್ದಾಳೆ.
490,MYT-101 ನೋಂದಣಿ ಸಂಖ್ಯೆಯ ಆಕ್ವಾ ಬ್ಲೂ ಬಣ್ಣದ ಕಾರು ಶ್ರೀಗಳು ಅಚ್ಚು ಮೆಚ್ಚಿನ ಕಾರಾಗಿತ್ತು.
491,ಐದು ಲೀಟರ್ ಎಂಜಿನ್ ಕಾರು ನೆಲೆಗೆ ಹಿಂದಿನ ಅಚ್ಚು ಮುಂಭಾಗದಲ್ಲಿ ಅಳವಡಿಸಿರುವ.
492,ಸೂಟಿ ಅಚ್ಚು ಅಸಹ್ಯಕರವಾಗಿದೆ ಮತ್ತು ದ್ಯುತಿಸಂಶ್ಲೇಷಣೆಗೆ ಸಸ್ಯದ ಸಾಮರ್ಥ್ಯವನ್ನು ಅಡ್ಡಿಪಡಿಸುತ್ತದೆ.
493,"ಇದು ಹಿಂಭಾಗದಲ್ಲಿ ಸ್ಥಾನದಲ್ಲಿರುವ ಹೊಸ 12-ಸಿಲಿಂಡರ್ ಎಂಜಿನ್ ಹೊಂದಿದೆ, ಅಚ್ಚು ಮುಂದೆ."
494,"ಇಡೀ ತಂಡದಲ್ಲಿ ಪ್ರಕೃತಿ ಒಂದೇ ಮಗುವಾಗಿದ್ದರಿಂದ, ಎಲ್ಲರಿಗೂ ಅಚ್ಚು ಮೆಚ್ಚಾಗಿದ್ದಳು, ಇದೇ ಸಂದರ್ಭದಲ್ಲಿ ವೀಣಾ ಸುಂದರ್ ಅವರಿಗೆ ಮದ್ರಾಸ್ ಐ ಆದ ಕಾರಣ, ಅದು ಎಲ್ಲರಿಗೂ ಹರಡದಿರಲಿ ಎಂದು ಬೆಂಗಳೂರಿಗೆ ತೆರೆಳಿದ್ದರು."
495,ಪ್ರಧಾನಿ ನರೇಂದ್ರ ಮೋದಿಗೂ ಸುಬ್ರಹ್ಮಣಿಯನ್ ಸ್ವಾಮಿಯನ್ನು ಕಂಡರೆ ಅಚ್ಚು ಮೆಚ್ಚು.
496,ಅತ್ಯುತ್ತಮ ಅಚ್ಚು ಪ್ರತಿರೋಧ
497,ತೀವ್ರ ಅಥವಾ ಅಚ್ಚು ಜೊತೆ ಚೀಸ್ - 50 ಗ್ರಾಂ
498,ಪ್ರತಿ ತಯಾರಕನು ಅಚ್ಚು ಸಮಸ್ಯೆಯನ್ನು ನಿಭಾಯಿಸುವ ವಿಭಿನ್ನ ಮಾರ್ಗವನ್ನು ಹೊಂದಿದ್ದಾನೆ.
499,"ಕಾರಣ ಸಂಭವನೀಯತೆಯನ್ನು ಹೆಚ್ಚಿನ ಅಚ್ಚು ಅವುಗಳನ್ನು ರಚನೆಗೊಂಡ ಎಂದು ಆಫ್, ನೆವರ್ ಸುಲಿದ ಕೋರ್ ಖರೀದಿಸುವ."
500,ಲೀಡ್ ಫ್ರಂಟ್ ಅಚ್ಚು ನೇರವಾಗಿ ಅರೆಕಾಲಿಕ ಅಡಿಯಲ್ಲಿ ವ್ಯತ್ಯಾಸ ಮತ್ತು ವರ್ಗಾವಣೆ ಪ್ರಕರಣಕ್ಕೆ ಸಂಬಂಧವಿರಲಿಲ್ಲ.
501,ಅಚ್ಚು ಧೂಳು ಅಥವಾ ಭಗ್ನಾವಶೇಷಗಳಿಂದ ಸ್ವಚ್ಛಗೊಳಿಸಬೇಕು ಮತ್ತು ಸಂಪೂರ್ಣವಾಗಿ ಸಿಲಿಕೋನ್ ಗ್ರೀಸ್ನಿಂದ ಸಂಸ್ಕರಿಸಬೇಕು.
502,ಮೊದಲ ಮಹಡಿಯಲ್ಲಿ ಗೋಡೆಗಳ ಮೇಲೆ ಇರುವ ರೂಮ್ ಅಚ್ಚು ಮುಚ್ಚಲಾಗುತ್ತದೆ;
503,ಪಾಕಿಸ್ತಾನದ ಪ್ರಧಾನ ಮಂತ್ರಿಯವರಿಂದ ಎಂಬ ಅಚ್ಚು ಹೊತ್ತಿದ್ದ ಆ ಲಕೋಟೆಯು ಹಲವು ವಾರಗಳ ಕಾಲದ ಪಯಣದ ನಂತರ ನನ್ನನ್ನು ತಲುಪಿದೆ ಎಂಬುದು ಅದನ್ನು ಗಮನಿಸಿದಾಗಲೇ ನನ್ನ ಅರಿವಿಗೆ ಬಂದಿತು.
504,ಕಳೆದ ದಶಕದ ಮಹತ್ತರ ಸಾರ್ವಜನಿಕ ಕಾರ್ಯಕ್ರಮಗಳ ಖ್ಯಾತ ನಿರೂಪಕಿಯಾಗಿ ತಮ್ಮ ವೃತ್ತಿಯನ್ನು ನಿರೂಪಿಸಿಕೊಂಡ ಅಪರ್ಣಾ ಕನ್ನಡವನ್ನು ಅಚ್ಚು ಕಟ್ಟಾಗಿ ಮಾತನಾಡುವ ಕನ್ನಡತಿ ಎಂದು ಪ್ರಖ್ಯಾತಿ ಪಡೆದಿದ್ದಾರೆ.
505,ಆ ಯುವಕನ ಮುಖದ ಅಚ್ಚು ತಯಾರಿಸಲು ಪ್ಲಾಸ್ಟರಿಂಗ್ ಮಟೀರಿಯಲ್ ಅನ್ನು ಮಿಶ್ರಣ ಮಾಡಿ ಅವನ ಮುಖಕ್ಕೆ ಬಳಿದಿದ್ದಾರೆ.
506,"ಹೆಚ್ಚಿನ ಆರ್ದ್ರತೆ ಹೊಂದಿರುವ ದೇಶ ಕೋಣೆಯಲ್ಲಿ, ಪೀಡಿತ ಕಪ್ಪು ಶಿಲೀಂಧ್ರ ಮತ್ತು ಅಚ್ಚು ಏಜೆಂಟ್ ಸಿಂಪರಣೆ ಈ ಸಸ್ಯದಿಂದ ಕೈಗೊಳ್ಳಲಾಗುತ್ತದೆ."
507,"ಅಚ್ಚು ವ್ಯವಹರಿಸುವಂತೆ ಸಾಂಪ್ರದಾಯಿಕ ವಿಧಾನಗಳು, ಹಲವು."
508,"ಇದು ಸರಿಯಾಗಿ ಅರ್ಥವಾಗಿದ್ದು ತೀರ ಇತ್ತೀಚೆಗೆ ಎಂದು ಹೇಳಿದೆ, ತದನಂತರ ಹಲವು ಬಾರಿ ನನ್ನ ಗಮನ ಇದರ ಹತ್ತಿರ ಸುಳಿದು, ಇದರ ಅಸ್ತಿತ್ವ, ಅಸ್ತಿತ್ವದ ಹಿಂದಿರುವ subtle ಸಂಗತಿಗಳು ಮತ್ತೆ ಮತ್ತೆ ಅಚ್ಚು ಒತ್ತಿವೆ."
509,"ಎಳ್ಳು-ಬೆಲ್ಲ, ಸಕ್ಕರೆ ಅಚ್ಚು ಮನೆಮನೆಗೆ ನೀಡುವುದು ಹಬ್ಬದ ವಿಶೇಷತೆಯಾಗಿದೆ."
510,"ವಿನೈಲ್ ವಾಲ್ಪೇಪರ್ ಅಥವಾ ಸೆಣಬಿನ, ವಿಶೇಷ ಅಂಟಿಕೊಳ್ಳುವ ಮೇಲೆ ಜೋಡಿಸಲಾಗಿರುತ್ತದೆ ಮೂಲ ಅಂಶ ಜೊತೆಗೆ ಅದರ ಸಂಯೋಜನೆ ಅಚ್ಚು ರಚನೆಗೆ ಉತ್ಪನ್ನದ ಅಡಿಯಲ್ಲಿ ತಪ್ಪಿಸುವ ಶಿಲೀಂಧ್ರನಾಶಕ ಸೇರ್ಪಡೆಗಳು ಒಳಗೊಂಡಿದೆ."
511,ವುಡ್ ಅಚ್ಚು ಮತ್ತು ಜೌಗು ಸಂಯೋಜನೆ ಸಂಸ್ಕರಿಸಲಾಗುತ್ತದೆ.
512,ಪೇಸ್ಟ್ರಿ ಮತ್ತು ಬೆಣ್ಣೆಯ ಆಧಾರದ ಮೇಲೆ ಅಚ್ಚು ಇರಿಸಲಾಗುತ್ತದೆ ಮತ್ತು 10 ನಿಮಿಷ ಬೇಯಿಸಲಾಗುತ್ತದೆ.
513,"ದುರ್ದೈವವಶಾತ್, ಈ ರಚನೆಯು ಸಾಕಷ್ಟು ಪ್ರಚಲಿತವಿಲ್ಲ, ಅಲ್ಲೊಂದು ಇಲ್ಲೊಂದು ಕೆಲವೊಂದು ಅಚ್ಚು ಪುಸ್ತಕಗಳು ದೊರೆಯಬಹುದಷ್ಟೇ."
514,ರೋಗಿಯಾಗಿ ಆಸ್ಪತ್ರೆ ಸೇರಿದ ಅಚ್ಚರಿ ಆಕರ್ಷ್ ಹೃದಯ ಗೆದ್ದು ಪ್ರೀತಿಯ ಅಚ್ಚು ಆಗುತ್ತಾಳೆ.
515,ಈ ಪ್ರತಿಯೊಂದು ಸಂಪರ್ಕಗಳು ಅಥವಾ ಟಚ್ಪಾಯಿಂಟ್ಗಳು ಬ್ರ್ಯಾಂಡ್ನ ಗ್ರಾಹಕರ ಪ್ರಭಾವವನ್ನು ಅಚ್ಚು ಮಾಡುತ್ತದೆ.
516,"ಬಂಡೀಗಾಲಿಯ ಅಚ್ಚು ಸರದಿತ್ತು, ಹೆದರದ"
517,ನಾವು ನಮ್ಮ ಫ್ರೇಮ್ ಅಚ್ಚು ದೇಹದ ಒಟ್ಟು ತೂಕದ ತೆಗೆದುಕೊಂಡು ಫಿಗರ್ಸ್ ಔಪಚಾರಿಕವಾಗಿ ಸಮರ್ಥಿಸಿಕೊಂಡರು.
518,"ಅಚ್ಚು ಅರ್ಧ ಕೆಳಗೆ ಪರೀಕ್ಷೆ ಸುರಿಯುತ್ತಾರೆ, ಉನ್ನತ ಸಮವಾಗಿ ಪೇರಳೆ ಮತ್ತು ಅವರ ಸಿಪ್ಪೆ ಲೇ ತುಂತುರು."
519,ಹಲವು ಚಲನಚಿತ್ರ ನಟ ನಟಿಯರ ಅಚ್ಚು ಮೆಚ್ಚಿನ ಸ್ಥಳ ಈ ಗೋವಾ.
520,"ಜೊತೆಗೆ, ಕೂದಲು ತೆಂಗಿನ ನಲ್ಲಿ ಅಚ್ಚು ಇರುವಂತಿಲ್ಲ."
521,ನೀವು ಅಚ್ಚು ತೆಗೆದುಹಾಕಬಹುದು.
522,"ತಿನ್ನಲು ಸಂಜೆ ಒಂದಕ್ಕಿಂತ ಹೆಚ್ಚು 30 ಗ್ರಾಂ ತುಣುಕು, ಸುಲಭ, ಮತ್ತು ಆರೋಗ್ಯ ಸುರಕ್ಷಿತವಲ್ಲ ದೊಡ್ಡ ಪ್ರಮಾಣದಲ್ಲಿ ಮೇಲ್ಮೈಯನ್ನು ಆವರಿಸಿರುವ ಅಚ್ಚು ರಕ್ತದ ವಿಷವಾಗಬಹುದು ಒಂದು ವಿಷ ಏಕೆಂದರೆ."
523,"ಎಣಿಕೆ Vyazemsky ನಂತರ ಅವನ ಬಗ್ಗೆ ಬರೆದರು ಮೆಮೊರಿ ಹಂತದವರೆಗೆ, ಗುಪ್ತ ಮತ್ತು ಕಳ್ಳಸಾಗಾಣಿಕೆ, ಒಂದು ಮುದ್ರಣದ ಎಂದು, ಇದು ಸ್ಪಷ್ಟವಾಗಿ ನಾನು ಓದಲು ಅಥವಾ ಉಚ್ಚರಿಸಿದ ಎಲ್ಲದರಿಂದ ಮೆದುಳಿನಲ್ಲಿ ಅಚ್ಚು ಇದೆ."
524,ಸಣ್ಣ ಕುಕೀ ಅಥವಾ ಐಸ್ ಒಂದೇ ಅಚ್ಚು ಹೊಂದಿಸು.
525,"ಮುಖವಾಡಗಳು ಸಾಮಾನ್ಯವಾಗಿ ಕಾಗದವನ್ನು ತುಂಡುಗಳಾಗಿ ನಿರ್ಮಿಸಲಾಗಿದೆ, ಆದರೆ ಇದು ನಿರ್ವಹಿತ ದ್ರವ್ಯರಾಶಿಯ ಅಚ್ಚು ಸಾಧ್ಯ."
526,"ಆದರೆ, ಅದೇ ಸಮಯದಲ್ಲಿ, ಇದು ಕೆಟ್ಟುಹೋಗುವ ಮತ್ತು ತ್ವರಿತವಾಗಿ ಅಚ್ಚು ಮುಚ್ಚಲಾಗುತ್ತದೆ."
527,ಇಂತಹ ಒಂದು ಸಬ್ಸ್ಟ್ರೇಟ್ ಮನೆಯ ವಸ್ತುಗಳು ಕಾರ್ಯಾಚರಣೆಯಿಂದ ಕಂಪನ ಕಡಿಮೆ ಲ್ಯಾಮಿನೇಟ್ ಅಚ್ಚು ರಚನೆಗೆ ತಡೆಯುತ್ತದೆ.
528,"ಹೀಗಾಗಿ, ರಲ್ಲಿ ಹಿಂದಿನ ಚಕ್ರ ಡ್ರೈವ್ ಕಾರುಗಳು ಬಹಳ ಪ್ರಸರಣ - ಇದು ಮುಂಚಕ್ರ ರಲ್ಲಿ ಹಿಂದಿನ ಅಚ್ಚು ಕವಚವನ್ನು ಇಡಲಾಗುತ್ತದೆ."
529,ಅವರ ಬೈಕ್ ಚಕ್ರದ ಅಚ್ಚು ಬೀಳದ ರಸ್ತೆ-ಓಣಿಗಳಿಲ್ಲ.
530,"ನಮ್ಮ ಕಡೆ ಮುಸ್ಲಿಮರು ನಿಮ್ಮಂತೆ ಕೆಂಪಾಗಿ, ಅಚ್ಚು ಹಾಕಿದಂತೆ ರೂಪು ರೇಖೆಗಳಿಂದ ಇರರು."
531,ಈ ರಾಗಗಳನ್ನು ಸೂಚಿಸಿ ಹಾಡಲು ಅನುಕೂಲವಾಗಿರುವಂತೆ ತಮ್ಮ ಸಂಗೀತಾಮೃತ ಪ್ರವಾಹ ಪತ್ರಿಕೆಯಲ್ಲಿ ಇವನ್ನು ಅಚ್ಚು ಮಾಡಿದರು.
532,"ವಸ್ತು ಅಚ್ಚು ಮತ್ತು ಶಿಲೀಂಧ್ರ ತುತ್ತಾಗಿ ಕಾರಣ ಅಕ್ರಿಲಿಕ್ ಕಲ್ಲು, ಆರ್ದ್ರ ಪ್ರದೇಶಗಳಲ್ಲಿ ಬಳಸಬಹುದು."
533,ಅಚ್ಚು ಮಡಕೆ ಅನುಪಸ್ಥಿತಿಯಲ್ಲಿ: ಪಾಕವಿಧಾನವನ್ನು ಒಂದೇ ಬೇಡಿಕೆ.
534,"ಜೊತೆಗೆ, ಕೆಲವು ಪ್ರಕರಣಗಳಲ್ಲಿ, ಸಿಲಿಕಾನ್ ಅಚ್ಚು ಲೋಹದ ಸುರಿದುಕೊಳ್ಳಬಹುದು."
535,ಈ ಕುರಿತು ಎರಡು ಅಭಿಪ್ರಾಯಗಳಿವೆ : ಒಂದು - ತನ್ನ ಡಾಕ್ಟರೇಟ್ ಪ್ರಬಂಧವನ್ನು ಅಚ್ಚು ಹಾಕಿಸಲು ಲೋಹಿಯಾ ಬಳಿ ಹಣ ಇರಲಿಲ್ಲ.
536,ಬಾತ್ರೂಮ್ನಲ್ಲಿ ಅಚ್ಚು ನಾಶಮಾಡಲು ನೀವು ಕೈಗಾರಿಕಾ ವಿಧಾನವನ್ನು ಬಳಸಬಹುದು.
537,"ಆದರಿಂದ ಎಳ್ಳು, ಕೊಬ್ಬರಿ, ಕಡಲೇಕಾಯಿಗಳ ಇದರ ಜತೆಗೆ ಬ್ಲೆಲ ಅಥವಾ ಸಕ್ಕರೆ ಅಚ್ಚು ಸೇರಿಸಿ ಎಲ್ಲರಿಗೂ ಹಂಚಿ ತಿನ್ನುವುದು ವಾಡಿಕೆ."
538,"ಬೆಂಜಮಿನ್ ಫ್ರಾಂಕ್ಲಿನ್ ಚಿತ್ರ ಅಳಿಸಲಾಗದ, ಅಮೆರಿಕನ್ ಆತ್ಮದಲ್ಲಿ, ಆದರೆ ಅಮೇರಿಕಾದ ಖಜಾನೆ ಇಲಾಖೆ ಮಾಡಿದ ದೊಡ್ಡ ಕರೆನ್ಸಿಯಲ್ಲಿ ಕೇವಲ ಅಚ್ಚು ಇದೆ - 100 ಡಾಲರ್."
539,"ಒಂದು ವೇಳೆ, ನಾನೇನಾದರೂ ಅಂದು ಕ್ಯಾಲಿಗ್ರಫಿ ಎಂಬ ಆ ಒಂದು ಕೋರ್ಸ್ ಮಾಡದಿದ್ದರೆ ಮ್ಯಾಕ್ ಎಂದೆಂದೂ ಬಹುವಿಧದ ಅಚ್ಚು ಹಾಗೂ ಸೂಕ್ತ ಅಕ್ಷರ ಜೋಡಣೆಯನ್ನು ಹೊಂದಿರುತ್ತಿರಲಿಲ್ಲ!"
540,ಚಿನ್ನದ ಹುಡುಗಿ ಅಚ್ಚು ಎಂ ಎಂ ಮಧ್ಯಪ್ರದೇಶದ ಭೋಪಾಲ್ ನಲ್ಲಿ ನಡೆಯುತ್ತಿರುವ ಹರ್ಡಲ್ಸ್ ನಲ್ಲಿ ಎಲ್ಲರಿಗಿಂತ ಮುಂದೆ ನಾನೇ ಎಂಬಂತೆ ಓಡುತ್ತಿರುವುದು ಕಂಡಿದ್ದು ಹೀಗೆ.
541,ಯಾಕೆ ಅಂದರೆ ಬೆರಳಿನ ಅಚ್ಚು ಒಬ್ಬೊಬ್ಬರಿಗೂ ಬೇರೆ ಬೇರೆ ಹಾಗೆ ನಿಮ್ಮ ನಾಲಿಗೆಯ ಅಚ್ಚು ಕೂಡ ಬೇರೆಯವರ ತರಹ ಇರುವುದಿಲ್ಲ .
