Index,Sentence
358,"ಅಯೋಡಿನ್ ಆವಿಯನ್ನು, ಹತ್ತಿ ಮೂಲಕ ಜಿನುಗುತ್ತಿರುತ್ತದೆ ಅಚ್ಚು ರಚನೆಗೆ ತಡೆಗಟ್ಟಲು, ಮತ್ತು ಅಯೋಡಿನ್ ಒಂದು ಸಣ್ಣ ಡೋಸ್ ಬ್ರೆಡ್ ರುಚಿ ಪರಿಣಾಮ ಬೀರುವುದಿಲ್ಲ."
359,"ಅತಿಯಾದ ತೇವಾಂಶ ಅಚ್ಚು ರಚನೆಗೆ, ಮುಖ ಮತ್ತು ಮರದ ವಿಕಲ್ಪದಿಂದ ನೀಲಿ ಹಾಗೂ ಕಾರಣವಾಗುತ್ತದೆ."
360,"ಬೇಸಿಗೆ ಮತ್ತು ಶರತ್ಕಾಲದಲ್ಲಿ, ಅಂಕುಡೊಂಕಾದ, ಒಣಗಿಸುವಿಕೆ, ಅಚ್ಚು ವರ್ಜಿಸಿ ವಿಂಗಡಿಸಲಾಗುತ್ತದೆ, ಇತ್ಯಾದಿ, Zimovniki ಅಡುಗೆ ಜೇನುನೊಣಗಳು ಆವಿ ಮತ್ತು ಇಂಗಾಲದ ಡೈಆಕ್ಸೈಡ್ ಸ್ರವಿಸುತ್ತವೆ ಮಾಹಿತಿ ಕೊಠಡಿ, ಗಾಳಿ ಮಾಡಬೇಕು."
361,"ಬಹು ಮುಖ್ಯವಾಗಿ, ಒಂದು ತುಂಡು ಬ್ರೆಡ್ ಅಚ್ಚು ಹೆಚ್ಚಿನ ಸಾಂದ್ರತೆಯನ್ನು ಪ್ರದರ್ಶಿಸುತ್ತದೆ."
362,"ಇರುವ ಒಂದೇ ಸುಂದರ, ಪುಟ್ಟ ಮತ್ತು ಅಚ್ಚು ಕಟ್ಟಾದ ಕಟ್ಟಡಕ್ಕೆ ಪ್ರತಿಸ್ಪರ್ಧಿಯಾಗಿ ಮತ್ತಾವ ಕಟ್ಟಡವೂ ಬಾರದಿರಲಿ."
363,"ಗ್ರೇಡ್ ಪರಿಸರದಲ್ಲಿ ಕೆಳಗೆ ಸಾಮಾನ್ಯವಾಗಿ ಪ್ರವಾಹದಿಂದ ಬಳಲುತ್ತಿದ್ದಾರೆ, ಮತ್ತು ಹೆಚ್ಚಿನ ತೇವಾಂಶ ಸಮಸ್ಯೆಗಳು, ತೇವಾಂಶ ಮತ್ತು ಅಚ್ಚು ನಿರೋಧಕ ವಸ್ತುಗಳನ್ನು ಅಗತ್ಯ."
364,ಈ ಪ್ಲಾಸ್ಟರ್ ಸಿಲಿಕಾನ್ ಅಚ್ಚು ಸುರಿಯುವುದು ಮೊದಲು ನಯಗೊಳಿಸುವ ಅಗತ್ಯವಿರದ ಅರ್ಥ.
365,ಅಚ್ಚು ಅತ್ಯಂತ ಪ್ರಸಿದ್ಧ ಹೋರಾಟಗಾರ - ಪರಿಹಾರ ತಾಮ್ರದ ಸಲ್ಫೇಟ್.
366,"ಇಂತಹ ಲೇಪನ ಆರ್ದ್ರತೆಯ ಪ್ರದೇಶಗಳಲ್ಲಿನ ಬಳಸಬಹುದು, ಗೋಡೆಗಳ ಸೇರಿಕೊಂಡು ಕಂಡೆನ್ಸೇಟ್ ರೂಪುಗೊಂಡ ಅಚ್ಚು ಮಾಡುವುದಿಲ್ಲ."
367,ನರಸಿಂಹಸ್ವಾಮಿ ನನ್ನ ಅಚ್ಚು ಮೆಚ್ಚಿನ ನೆಚ್ಚಿನ ಕಬ್ಬಿಗ.
368,"ಮದುವೆಯ ಉಡುಗೆ, ಆದರೆ ಖ್ಯಾತ ಛಾಯಾಗ್ರಾಹಕ ಸ್ಟುಡಿಯೋದಲ್ಲಿ ತೆಗೆದುಕೊಂಡಿಲ್ಲ ಆದರೂ ಚಿತ್ರಗಳನ್ನು ನಂತರ ನಿಮ್ಮ ಮದುವೆ ಫೋಟೋ ಆಲ್ಬಮ್ ನಿಮ್ಮ ಎಂಗೇಜ್ಮೆಂಟ್ ಅಚ್ಚು ತ್ವರಿತ ಮಾಹಿತಿ ಅಲಂಕರಿಸಲು ಮಾಡಬಹುದು."
369,ಅಚ್ಚು ಅಥವಾ ಬ್ಯಾಕ್ಟೀರಿಯಾ ಹರಡುವುದಿಲ್ಲ ಎಂದು ಖಚಿತಪಡಿಸಿಕೊಳ್ಳಲು ಪ್ಯಾಕೇಜಿಂಗ್ ಮತ್ತು ಆಹಾರಗಳೊಂದಿಗೆ ಸಂಪರ್ಕಕ್ಕೆ ಬರುವ ವಸ್ತುಗಳನ್ನು ಸಹ ಅವರು ಹುಡುಕಬಹುದು.
370,"ಪ್ರಾಸ್ಥಾವಿಕವಾಗಿ ಗ್ರಾಮ ಪಂಚಾಯತ ಸದಸ್ಯರಾದ ಸಿದ್ದರಾಮ ಗೌಡ ಉಪ್ಪಳ ಮಾತನಾಡಿ, ಬಾಲ್ಯ ವಿವಾಹ, ಸಮಾಜದಲ್ಲಿ ಶಾಂತಿ ಮತ್ತು ನ್ಯಾಯ ಕಾಪಾಡುವಲ್ಲಿ ಪೊಲೀಸರ ಪಾತ್ರದ ಬಗ್ಗೆ ಮಕ್ಕಳಿಗೆ ಅಚ್ಚು ಕಟ್ಟಾಗಿ ಮಾಹಿತಿ ನೀಡಿದರು."
371,"ಇದು ಅಹಿತಕಾರಿ ವಾಸನೆಯನ್ನು ಪ್ರಕಾಶಮಾನವಾದ, ನೀರು ಮತ್ತು ತೇವಾಂಶ ಹೆದರುತ್ತಾರೆ ಹೊಂದಿಲ್ಲ, ಬೇಗ ಒಣಗಿ, ಮತ್ತು ಅಚ್ಚು ಮತ್ತು ಶಿಲೀಂಧ್ರ ವಿರುದ್ಧ ರಕ್ಷಿಸುತ್ತದೆ."
372,ನೀರಿನ 10 ಲೀಟರ್ ಫಾರ್ಮಾಲಿನ್ ಕಾಲು (40%): ಇದು ಫಾರ್ಮಾಲಿನ್ ಒಂದು ಅನುಪಾತದಲ್ಲಿ ಸಂಯೋಜನೆಯ ಅಚ್ಚು ಭಾಗಗಳನ್ನು ಅನ್ವಯಿಸಬಹುದು.
373,"ವಿಕ್ಟರ್ ಎಂ ನಿಜವಾಗಿಯೂ ಸ್ವತಃ ಎಲ್ಲವನ್ನೂ ತನ್ನ ವಿದ್ಯಾರ್ಥಿ ಕ್ರೀಡಾಪಟು ಔಟ್ ಅಚ್ಚು ಪ್ರಯತ್ನಿಸುತ್ತಿರುವ ಹೊರತಾಗಿಯೂ, ಒಂದು ಅತ್ಯುತ್ತಮ ಶಿಕ್ಷಕ ಸಾಬೀತಾಯಿತು."
374,ಅವಳ ಮೈ ನಾಲ್ಕು ಬಣ್ಣಗಳಿಂದ ಕೂಡಿದ್ದು ಇಡಿ ಬೀದಿಯ ಜನರಿಗೆಲ್ಲಾ ಅಚ್ಚು ಮೆಚ್ಚಿನವಳು.
375,"ಈ ಔಷಧವು ಡರ್ಮಟೊಫೈಟ್ಗಳು, ಕ್ಯಾಂಡಿಡಾ ಶಿಲೀಂಧ್ರಗಳು ಮತ್ತು ಅಚ್ಚು ಶಿಲೀಂಧ್ರಗಳ ವಿರುದ್ಧ ಸಕ್ರಿಯವಾಗಿದೆ."
376,ಎಲ್ಲಾ ಮೊದಲ ಇದು ಸರಳ ಓವಲ್ ಅಂಕಿ ಅಚ್ಚು ಅಗತ್ಯ.
377,"ಲೇ ಬೇಕರಿ ಅಚ್ಚು ಕೆಳಗೆ ಲಸಾಂಜ ಹಾಳೆಗಳನ್ನು ನಂತರ, ಮಾಂಸದ ಒಂದು ಭಾಗವನ್ನು ಹಾಕಲು ಇದು ಸಾಸ್ ಸುರಿಯುತ್ತಾರೆ ಮತ್ತು ಸಿಂಪಡಿಸುತ್ತಾರೆ ತುರಿದ ಚೀಸ್."
378,"ಬೇಯಿಸಲು ಒಡೆದ ಅಚ್ಚು ತರಕಾರಿ ತೈಲ ತೇವಗೊಳಿಸಲಾದ ಇದು ಹಾಳೆಯ, ಆವರಿಸಿದ್ದವು."
379,ನಿಮಗೆ ಗ್ಯಾಲಿಯಂ ಮತ್ತು ಚಮಚ ಅಚ್ಚು ಅಥವಾ ಬೇಕಾಗಿರುವುದು ಗ್ಯಾಲಿಯಮ್ ಚಮಚ.
380,"ಪರಿಣಾಮವಾಗಿ ಉಂಟಾಗುವ ದ್ರವ್ಯರಾಶಿ ಚೆನ್ನಾಗಿ ಬೆರೆಸಲಾಗುತ್ತದೆ, ಅಚ್ಚು ಇರಿಸಲಾಗುತ್ತದೆ ಮತ್ತು ರಾತ್ರಿಯ ಫ್ರೀಜರ್ ಆಗಿ ಇರಿಸಲಾಗುತ್ತದೆ."
381,ಟ್ವಿಟ್ಟರಲ್ಲಿ ಕ್ರಿಕೆಟ್ ಹುಚ್ಚು : ಭಾರತ-ಪಾಕ್ ಪಂದ್ಯ ಅಚ್ಚು ಮೆಚ್ಚು!
382,ಅದು ಅನುಷ್ಕಾಳ ಅಚ್ಚು ಮೆಚ್ಚಿನ ಲಾಬ್ರಡೋರ್ ನಾಯಿ.
383,ಇದು ಈ ಪ್ರದೇಶಗಳಲ್ಲಿ ಹೆಚ್ಚಾಗಿ ಹೊರಗೆ ಗಾಳಿಯ ನೇರ ಸಂಪರ್ಕ ಅಚ್ಚು ಕೂಡಿಕೊಂಡು ಆಗಿದೆ.
384,"ಸರಿಯಾಗಿ ಸಂಗ್ರಹಿಸದಿದ್ದರೆ ಅಥವಾ ಕಳಪೆ ಸ್ಥಿತಿಯಲ್ಲಿ ಕೊಳೆಯಲು ಅನುಮತಿಸಿದರೆ ಬರ್ಡ್ ಸೀಡ್ ಕೆಟ್ಟದಾಗಿ ಹೋಗಬಹುದು ಮತ್ತು ಹಾಳಾದ ಬೀಜದಲ್ಲಿ ದೋಷಗಳು, ಅಚ್ಚು ಮತ್ತು ಬ್ಯಾಕ್ಟೀರಿಯಾಗಳು ಫೀಡರ್ ಪಕ್ಷಿಗಳ ನಡುವೆ ರೋಗಗಳನ್ನು ಉಂಟುಮಾಡಬಹುದು."
385,ಹೇಳಿಕೇಳಿ ಕಾಂಕ್ರಿಟ್‌ಗೆ ಒಂದು ಮೌಲ್ಡ್‌ – ಅಚ್ಚು ಬೇಕಾಗುತ್ತದೆ.
386,ಒಂದು ಆರ್ದ್ರ ವಾತಾವರಣದಲ್ಲಿ ಸಂಗ್ರಹಿಸಿದ ಕಾರ್ಖಾನೆಯ ಅಚ್ಚು ಮಾಡಬಹುದು.
387,ಕಾರಣ ಫಲಕಗಳು ಮತ್ತು ಗೋಡೆಯ ನಡುವೆ ಈ ಅಚ್ಚು ಅಥವಾ ಶಿಲೀಂಧ್ರ ರಚಿಸುವುದಿಲ್ಲ.
388,"ಅಚ್ಚು ಮತ್ತು ಶಿಲೀಂಧ್ರ ಚಹರೆಯಿಂದ ಛಾವಣಿಯ ರಕ್ಷಿಸಲು, ಸೀಲಿಂಗ್ ಪ್ರೈಮರ್ ಪದರ (ಆದ್ಯತೆ ನುಗ್ಗಿಸುವುದು) ಕಾರಣವಾಗುತ್ತದೆ."
389,"ಅಲ್ಲಿ ಕಲಿಸುವ ಮಾಸ್ತರು, ಅಕ್ಕೋರು(ಟೀಚರ್) ಎಲ್ಲರಿಗೂ ಅಚ್ಚು ಮೆಚ್ಚು."
390,"ಐವತ್ತು ಪ್ರತಿಶತದಷ್ಟು ಕೆಳಗೆ ಲಾಂಡ್ರಿ ಕೋಣೆಯಲ್ಲಿ ತೇವಾಂಶವನ್ನು ಇಟ್ಟುಕೊಂಡು ಅಚ್ಚು ಬೆಳವಣಿಗೆಯನ್ನು ತಡೆಯುವುದು, ನಿಮ್ಮ ಶುಷ್ಕಕಾರಿಯನ್ನು ಶ್ರಮಿಸುವಂತೆ ತಡೆಯಿರಿ ಮತ್ತು ನಿಮಗೆ ಹೆಚ್ಚು ಆರಾಮದಾಯಕವಾಗುವಂತೆ ಮಾಡುತ್ತದೆ."
391,"ಆಶ್ರಯಸ್ಥಾನ Ekostroy ಉಷ್ಣ ನಿರೋಧಕ, ಇದು ಅಚ್ಚು ಮತ್ತು ಶಿಲೀಂಧ್ರ ಪ್ರತಿರೋಧ ಹೊಂದಿದೆ."
392,ಆದರೆ ವಾಲ್ಪೇಪರ್ ಮೇಲೆ ಅವರು ಹೆಚ್ಚು ಪರಿಣಾಮಕಾರಿ ಪರಿಗಣಿಸಲಾಗುವುದಿಲ್ಲ: ಸ್ವಲ್ಪ ನಂತರ ಅಚ್ಚು ಮತ್ತೆ ಕಾಣಿಸಿಕೊಳ್ಳುತ್ತದೆ.
393,"ಅಚ್ಚು ಮೆಚ್ಚಿನದ್ದು , ತಿಳಿ ಹಳದಿಯ, ನೀಳ ಗೊ೦ಚಲಿನ, ದಾಸವಾಳ ಹೂವಿನ ಗಿಡವನ್ನು ನಾನು ಬಹು ಕಾಳಜಿಯಿ೦ದ ಬೆಳೆಸಿದ್ದು; ದಾಸವಾಳ ಗಿಡದ ಮೊಗ್ಗಿನ ಸಮಯದ ಒ೦ದು ದಿನ ದಿಗ್ಗನೆ ಅಭೂತ ಪೂರ್ವ ಯೋಚನೆಯೊ೦ದು ಮನದ ಮೂಲೆಯಿ೦ದ ಎದುರಾಗಿ, ಎನಾದರು ಸರಿಯೆ ದಾಸವಾಳದ ಗಿಡದ ಮೊದಲ ಹೂಗಳಲ್ಲಿ ಒ೦ದನ್ನು ಯಾವುದಾದರು ಹುಡುಗಿಗೆ ಕೊಡಲೇ ಬೇಕು ಎ೦ದುಕೊ೦ಡಿದ್ದು ನಮ್ಮ ಗೆಳೆಯರ ಬಳಗದಲ್ಲಿ ಮಿ೦ಚಿನ ಸ೦ಚಾರವಾಗಿ ನನ್ನನ್ನು ಒ೦ದು ರೀತಿಯಲ್ಲಿ ನೋಡ ತೊಡಗಿದರು."
394,ಒಂದು ಸಸ್ಯದ ಎಲೆಗಳನ್ನು ಒಳಗೊಂಡ ಸೂಟ್ ಅಚ್ಚು ಶಿಲೀಂಧ್ರದ ಪದರದಿಂದ ಸೂರ್ಯನ ಬೆಳಕು ಸರಿಯಾಗಿ ಸಿಗುವುದಿಲ್ಲ.
395,ವಿಸ್ತಾರಕರು ತಾಲೂಕಿನಲ್ಲಿ ಹದಿನೈದು ದಿನಗಳ ಕಾಲ ಅತ್ಯಂತ ಅಚ್ಚು ಕಟ್ಟಾಗಿ ಪಕ್ಷದ ಆದೇಶದಂತೆ ಕಾರ್ಯನಿರ್ವಹಿಸಿ ಬೂತ ಮಟ್ಟದಲ್ಲಿ ಪ್ರತಿಯೊಂದು ಮನೆಗೆ ಭೇಟಿ ಕೊಟ್ಟು ಅದರ ಮಾಹಿತಿ ನಿಡಲು ಸೂಚಿಸಿದರು.
396,ಚೀಸ್ ರೆನಿಟ್ನ ಮತ್ತು ವಿಶೇಷ ಬ್ಯಾಕ್ಟೀರಿಯಾ ಪ್ರಭಾವದಿಂದ ಅಚ್ಚು ಹಣ್ಣಾಗುತ್ತವೆ.
397,ವಸತಿ ಪ್ರದೇಶದಲ್ಲಿ ವಾಯುಗುಣ ಕಾರಣ ಬೇಕಾಬಿಟ್ಟಿಯಾಗಿ ಅಚ್ಚು ಮತ್ತು ಶಿಲೀಂಧ್ರ ಗೈರುಹಾಜರಿಯು ಆರೋಗ್ಯಕರ ಇರುತ್ತದೆ.
398,"ಇಂದು ಸೌಂದರ್ಯ ಉದ್ಯಮದಲ್ಲಿ ಬಹುತೇಕ ನಾಯಕರು ಪ್ರಸಿದ್ಧ sponzhiki ಮೊಟ್ಟೆಯ ಅಚ್ಚು ಬಿಡುಗಡೆ: ಮೂಲ ಬ್ಯೂಟಿ ಬ್ಲೆಂಡರ್ ತನ್ನ ಸಹೋದರ ಗೆ - ಅಮೆರಿಕನ್ ಬ್ರ್ಯಾಂಡ್ ರಿಯಲ್ ಟೆಕ್ನಿಕ್ಸ್ (ಮಿರಾಕಲ್ ಮೈಬಣ್ಣ ಸ್ಪಾಂಜ್), ಹಾಗೂ ಕಂಪನಿ Oriflame ಮತ್ತು ಟಾಪ್ Roshe, ಎಲ್ ETOILE ಮತ್ತು ನದಿಯ ಗೋಷ್ , ಆಸ್ಟ್ರೇಲಿಯನ್ ಮತ್ತು ಚೀನೀ ತಯಾರಕರು."
399,"ಸಹ ಅಚ್ಚು ಯಾವುದೇ ಸ್ಪಷ್ಟ ಲಕ್ಷಣಗಳನ್ನು ಕೂಡ, ಯಾರು ಎಂದು ಎಂದು ಅಚ್ಚು ಇದು ಅಗತ್ಯ, ತೊಡೆದುಹಾಕಲು ವಿಧಾನ ನಿರ್ವಹಿಸಲು."
400,ಆರ್ಗ್ಯಾನಿಕ್ ವಸ್ತುಗಳ ಮೂಲಕ ಪುಟ್ಟ ಕೈ ಕಾಲುಗಳನ್ನು ಪ್ರಶಾಂತ್ ಬಹಳಷ್ಟು ಶ್ರಮವಹಿಸಿ ಅಚ್ಚು ಮಾಡಿ ರಾಕಿಂಗ್ ದಂಪತಿಗೆ ನೀಡಿದ್ದಾರೆ.
401,"ಗಾಜಿನ ಅಚ್ಚು ಟೇಕ್ ಮತ್ತು ದೊಡ್ಡ ರಿಂದ, ಟ್ಯೂಬ್ ಇಡುತ್ತವೆ."
402,10-15 ನಿಮಿಷ ಬಿಟ್ಟು ಮೌಲ್ಡ್‍ನಿಂದ ತೆಗೆದರೆ ಸಕ್ಕರೆ ಅಚ್ಚು ರೆಡಿ.
403,"ಇದು ಮೂರು-ಆಕ್ಸಲ್ ಟ್ರಕ್ ಸರಳ ವಿಸ್ತರಣೆಯನ್ನು SPARS ಮೂಲಕ 200 ನೇ ಮಾದರಿ ತಿರುಗಿಸಿದರು ಎಂದು ಹೇಳಲು ತಪ್ಪಾಗುತ್ತದೆ, ವರ್ಗಾವಣೆ ಸಂದರ್ಭದಲ್ಲಿ ಮತ್ತು ಚಾಲನಾ ಚಕ್ರಗಳು ಮತ್ತು ಅಚ್ಚು ಮತ್ತೊಂದು ಜೋಡಿ ಜೊತೆಗೆ ಸ್ಥಾಪಿಸಿ."
404,ಹಲವು ಜಾಡಿಗಳನ್ನು ಯುಎಸ್ಎ ಮತ್ತು ಕೆಲವೊಮ್ಮೆ ಅಚ್ಚು ಸಂಖ್ಯೆಯೊಂದಿಗೆ ಗುರುತಿಸಲಾಗುತ್ತದೆ.
405,ನಾವು ಮುಂಭಾಗವನ್ನು ಹೊಲಿಯುತ್ತೇವೆ ಕೈಯಿಂದ ತಲೆಯಿಂದ ಕೂಡಿರುತ್ತದೆ ಆದ್ದರಿಂದ ತಲೆ ಅಚ್ಚು ಹಿಡಿಸುತ್ತದೆ.
406,"ಅದರಿಂದ ನೀವು ಗುಲಾಬಿಗಳು, ಸಣ್ಣ ಕ್ರಿಟ್ಟರ್ಸ್ ಅಚ್ಚು ಅಥವಾ ಸಿಹಿ ಮೇಲ್ಮೈ ಪೂರ್ತಿ ವ್ಯಾಪಿಸಬಹುದು."
407,ಅವರು ಔಷಧೀಯ ಗುಣಗಳನ್ನು ಮತ್ತು ಅಚ್ಚು ಮತ್ತು ಶಿಲೀಂಧ್ರ ತಡೆಗಟ್ಟಲು ಅಗತ್ಯವಿದೆ.
408,"ಮಣ್ಣಿನ ತೇವಗೊಳಿಸಲಾದ ವೇಳೆ, ಯಾವಾಗಲೂ ಶಿಲೀಂಧ್ರ ಬ್ಯಾಕ್ಟೀರಿಯಾ ಮತ್ತು ಅಚ್ಚು ಬೆಳೆಯುತ್ತದೆ."
409,ಎಲ್ಲರೊಡನೆ ಸಮನಾಗಿ ಬೆರೆಯುತ್ತಿದ್ದ ಸುಷ್ಮಾ ಅವರು ಹಿರಿಯ ಕಿರಿಯರೆಲ್ಲರಿಗೂ ಅಚ್ಚು ಮೆಚ್ಚು ಎಂದು ಪತ್ರಕರ್ತ ಶಿವ್ ಅರೂರ್ ಅವರಿಂದ ಟ್ವೀಟ್.
410,ಈಗ ಹಿಟ್ಟನ್ನು ಸಿದ್ಧವಾಗಿದೆ ಮತ್ತು ಅಚ್ಚು ಮೇಲೆ ಸುರಿದುಕೊಳ್ಳಬಹುದು.
411,"ಆರ್ಮಿಲಾರಿಯಾ ಶರತ್ಕಾಲದಲ್ಲಿ ಸಂತೋಷವನ್ನು ವಾಸನೆ, ಆದರೆ ಅಚ್ಚು ವಾಸನೆ ಸುಳ್ಳು ನೀಡುತ್ತದೆ."
412,ಒಂದು ಗ್ರೀಸ್ ಕೇಕ್ ಪ್ಯಾನ್ ಅಚ್ಚು ಪರ್ಯಾಯವಾಗಿ ಮತ್ತು ದಟ್ಟ ಪದರದ ಇರಿಸಲಾಗುತ್ತದೆ.
413,"ಬಾತ್ ರೂಂಗೆ ಅಚ್ಚು ಅಥವಾ ಶಿಲೀಂಧ್ರ, ರಚಿಸಲಾಗಿಲ್ಲ ಸಸ್ಯ ಒಣ ಮಿಶ್ರಣವನ್ನು ನೀರಿನ ಬದಲಿಗೆ ಲ್ಯಾಟೆಕ್ಸ್ ಪ್ಲಾಸ್ಟೀಕೃತವು ಇರಬೇಕು."
414,ಒಂದು ಅಚ್ಚು ಆಗಿ ಹಿಟ್ಟನ್ನು ಸುರಿಯಿರಿ ಮತ್ತು 10 ನಿಮಿಷಗಳ ಕಾಲ ಮೈಕ್ರೊವೇವ್ನಲ್ಲಿ ಮೊಸರು ಕೇಕ್ ತಯಾರಿಸಲು.
415,ಅಚ್ಚು ಮತ್ತು ಶಿಲೀಂಧ್ರ ಪ್ರಸಾರಕ್ಕೆ ಪ್ರತಿರೋಧ;
416,ಕುರಳ್ ಗ್ರಂಥವನ್ನು ಲಕ್ಷಗಟ್ಟಲೆ ಅಚ್ಚು ಹಾಕಿಸಿದರು.
417,ಈ ಕಾರಣದಿಂದಾಗಿ ರಂದ್ರ ಗೆ ಸೆರಾಮಿಕ್ ಅಚ್ಚು ಲೋಹದ ಎಂದು ಬಾಳಿಕೆ ಅಲ್ಲ.
418,"ಇಲ್ಲದಿದ್ದರೆ, ಇಡೀ ಕೋಣೆಯಲ್ಲಿ ಶಿಲೀಂಧ್ರ ಮತ್ತು ಅಚ್ಚು ಮುಚ್ಚಬಹುದು."
419,ಮರದ ಉಪಸ್ಥಿತಿ ನೀಲಿ ಅಚ್ಚು ಮತ್ತು ಮೇಲ್ಮೈಯಲ್ಲಿ ರಾಸಾಯನಿಕ ಬ್ಲೀಚಿಂಗ್ ಸಂಯೋಜನೆಗಳೊಂದಿಗೆ ಸಂಸ್ಕರಿಸಬೇಕು.
420,ಸಂಘದ ಪ್ರತಿಯೋರ್ವ ಪದಾಧಿಕಾರಿಯೂ ಒಂದೊಂದು ಜವಾಬ್ದಾರಿಯನ್ನು ವಹಿಸಿಕೊಂಡು ಕಾರ್ಯಕ್ರಮವನ್ನು ಅಚ್ಚು ಕಟ್ಟಾಗಿಸುವಲ್ಲಿ ಸಹಕಾರ ನೀಡಬೇಕು.
421,ಅಚ್ಚು ಉತ್ಪನ್ನದ ಉತ್ಪಾದನೆಯ ಪ್ರಕ್ರಿಯೆಯಲ್ಲಿ ಮೊಸರು ರಾಶಿಯಾಗಿ ವಿಶೇಷ ಟ್ಯೂಬ್ಗಳ ಮೂಲಕ ಸೇರಿಸಲಾಗುತ್ತದೆ.
422,ಅತ್ಯಾಧುನಿಕ ವ್ಯವಸ್ಥೆ: ಕನ್ನಡ ಸಾಹಿತ್ಯ ಪರಿಷತ್ತಿಗೆ ಸಾಹಿತ್ಯ ಚಟುವಟಿಕೆಗಳನ್ನು ನಡೆಸಲು ಅನುಕೂಲವಾಗುವಂತೆ ಅಚ್ಚು ಕಟ್ಟಾದ ಸಭಾಂಗಣ ವ್ಯವಸ್ಥೆ ಮಾಡಲಾಗಿದೆ.
423,"ತೇವಾಂಶ ರಕ್ಷಣೆ ಜೊತೆಗೆ, ಅವರು ಹೆಚ್ಚುವರಿ ಸೂಕ್ಷ್ಮಕ್ರಿಮಿಗಳ ವಿರುದ್ಧ ಪ್ರಭಾವಗಳನ್ನು ಲ್ಯಾಮಿನೇಟ್ ನೀಡಲು: ಶಿಲೀಂಧ್ರಗಳು ಹುಟ್ಟು, ಅಚ್ಚು ತಡೆಗಟ್ಟಲು."
424,"ಚಿಕನ್ ಕುಡಿಕೆ, ಅಚ್ಚು ಇದನ್ನು ತೆಗೆದುಹಾಕಲು ಹೋಳುಗಳಾಗಿ ಕತ್ತರಿಸಿ ಮತ್ತು ಸೇವೆ, ಸಿದ್ಧವಾಗಿದೆ."
425,ಬ್ರೈಟ್ ಕಲೆಗಳು ಅಥವಾ ಅಚ್ಚು ಹೊಪ್ಪಳೆಗಳಂತೆ ಇರುತ್ತವೆ ಇರುವಂತಿಲ್ಲ.
426,"ಕೇರಳ ಮಾಸ್ಟರ್ ಬ್ಲಾಸ್ಟರ್ ಪಂದ್ಯವನ್ನು ನೋಡಲು ಸಚಿನ್ ತೆಂಡೂಲ್ಕರ್ ಅವರು ಕೊಚ್ಚಿಗೆ ಬರುತ್ತಾರೆ ಎಂದು ತಿಳಿಯುತ್ತಿದ್ದಂತೆ, ತನ್ನ ಆಸೆಯನ್ನು ಅಚ್ಚು ಗಂಡನ ಮುಂದಿಟ್ಟಿದ್ದಾರೆ."
427,"ಗಂಡು ಮೆಟ್ಟಿನ ನಾಡು ಬೈಲಹೊಂಗಲದಲ್ಲಿ ಶತಮಾನಗಳ ಹಿಂದೆ ಪಶು, ಪಕ್ಷಿ, ಜನ, ಜಾನುವಾರಗಳಿಗೆ ಅನೂಕೂಲವಾಗುವ ನಿಟ್ಟಿನಲ್ಲಿ ನಿರ್ಮಾಣವಾದ ಪುರಾತನ ಕಾಲದ ಹಳೇ ಹಣಮಂತ ದೇವಸ್ಥಾನ ಹಿಂಭಾಗದಲ್ಲಿ, 12 ನೇ ಶತಮಾನದ ಬಸವಾದಿಶರಣ ಬೋವಿವಡ್ಡರ ಸಮಾಜದ ಸಿದ್ದರಾಮೇಶ್ವರವರ ವಚನಗಳ ಪ್ರೇರಣೆಯಿಂದ ಮಲ್ಲನಾಯ್ಕ ಲಿಂಗನಾಯ್ಕ ಪಾಟೀಲ ಇವರು ಅಂದಾಜು 30 ಎಕರೆ ಜಮೀನಲ್ಲಿ ಬೃಹತ ಕೆರೆ ನಿರ್ಮಾಣ ಮಾಡಿ ಅರ್ಧ ಭಾಗ ಜನತೆಗೆ, ಇನ್ನೊಂದು ಭಾಗ ದನ ಕರುಗಳಿಗೆ ಕುಡಿಯುವ ನೀರಿನ ವ್ಯವಸ್ಥೆ ಕಲ್ಪಿಸಿ ಒಬ್ಬ ಕಾವಲುಗಾರನನ್ನು ನೇಮಕ ಮಾಡಿ, ಅಚ್ಚು ಕಟ್ಟಾಗಿ ನಿರ್ವಹಣೆ ಮಾಡಿಕೊಂಡ ಬಂದ ಇವರನ್ನು ಬ್ರೀಟಿಷರ ಅಧಿಕಾರಿಗಳು ರಾವ ಬಹಾದ್ದೂರ ಎಂಬ ಬಿರುದು ನೀಡಿದ್ದರು."
428,"ಮೊಲಕ್ಕೆ ಮೂರು ಕೊಂಬುಗಳ ತುದಿಯಲ್ಲಿ ಕಣ್ಣುಗಳಿವೆ ಎಂದು ಬೇಕಾದರೂ ಅಚ್ಚು ಮಾಡಬಹುದು ಎಂಬ ಸಂಗತಿ, ಪಾಪ ಆ ಹಳ್ಳಿಗರಿಗೇನು ಗೊತ್ತು?"
429,ಬೆಂಗಳೂರು: ಸಿಲಿಕಾನ್ ಸಿಟಿ ಮಂದಿಯ ಅಚ್ಚು ಮೆಚ್ಚಿನ ಟ್ರಾನ್ಸ್‌ಪೋರ್ಟ್‌ ಅಂದರೆ ನಮ್ಮ ಮೆಟ್ರೋ.
430,"ಶಾಸನದ ಅಚ್ಚು ತೆಗೆಯುವಲ್ಲಿ ಶಿವಾನಂದ ಕರ್ಕಿ, ಕೆ."
431,"ಕೇಕ್ ತಂಪಾಗುವ ಯಾವಾಗ, ಇದು ತಲೆಕೆಳಗಾಗಿ ಮಾಡಿ, ಅಚ್ಚು ತೆಗೆದುಹಾಕಲು ಮತ್ತು ಸೇವೆ."
432,ತೈಲ ಸುಮಾರು 20 ಗ್ರಾಂ ಅಚ್ಚು ನಯಗೊಳಿಸುವ ಫಾರ್;
433,ಎಲ್ಲವನ್ನೂ ಬೆರೆಸಿ ಮತ್ತು ಅಚ್ಚು ಹಾಕಿಸಿ.
434,ನವರಾತ್ರಿ ಸ್ಪೆಷಲ್: ಸಕ್ಕರೆ ಅಚ್ಚು
435,ಈ ಕಾರ್ಯವನ್ನು ಕಳೆದ ಹಲವು ವರ್ಷಗಳಿಂದ ನಾಗರತ್ನಾ ಸಿಸ್ಟರ್ ಅಚ್ಚು ಕಟ್ಟಾಗಿ ನಡೆಸಿಕೊಂಡು ಬಂದಿದ್ದಾರೆ.
436,ಆದರೆ ಎಲ್ಲವನ್ನೂ ಅಚ್ಚು ಕಟ್ಟಾದ ಸ್ಥಿತಿಯಲ್ಲಿ ನೋಡಲು ನನಗೆ ಮೊದಲಿನಿಂದಲೂ ಇಷ್ಟ.
437,ಇದು ಅಚ್ಚು ಪದರಗಳಲ್ಲಿ ಇರಿಸಲಾಗಿದೆ.
438,"ಅಂಟು ಮತ್ತು ನೀಲಿ ಚೀಸ್ ನಡುವಿನ ಒಂದು ಉತ್ತಮ ಸಮಾನಾಂತರವಾಗಿದ್ದು , ಇದು ಅಂಟು ಬೀಜಕ್ಕೆ ಬಂದಾಗ ನೀಲಿ ಬಣ್ಣವನ್ನು ತಯಾರಿಸಲು ಬಳಸಲಾಗುವ ಅಚ್ಚು ಗ್ಲುಟನ್ ಧಾನ್ಯಗಳ ಮೇಲೆ ಬೆಳೆಸಬಹುದು ಮತ್ತು ಕೆಲವು ನಿರ್ದಿಷ್ಟವಾಗಿ ಸೂಕ್ಷ್ಮ ಜನರಿಗೆ ಸೆಲಿಯಾಕ್ ಕಾಯಿಲೆ ಅಥವಾ ಸೆಲಿಯಕ್ ಗ್ಲುಟನ್ ಸೂಕ್ಷ್ಮತೆಯು ನೀಲಿ ಚೀಸ್ಗೆ ಪ್ರತಿಕ್ರಿಯಿಸುತ್ತದೆ."
439,ಇದಕ್ಕೆ ಸಣ್ಣ ತುಂಡುಗಳಿಗೆ ಸಿಲಿಕೋನ್ ಅಚ್ಚು ಅಗತ್ಯವಿರುತ್ತದೆ.
440,"ಮೇಕೆ, ಆಹಾರ ಆಯ್ಕೆ ತುಂಬಾ ಸರಳವಾದ ಆದರೆ ಇನ್ನೂ ಅಚ್ಚು ಹಾನಿ ಉತ್ಪನ್ನಗಳು ನಿರಾಕರಿಸುತ್ತಾರೆ."
441,ಊರವರಿಗೆ ಮತ್ತು ಪಾರಿಜಾತಾ -ಅಪರಾಜಿತಾಗೆ ಗಾಂಗೇಯ ಅಚ್ಚು ಮೆಚ್ಚು.
442,"ಅವರು ಪ್ರತ್ಯೇಕ ಸಿಲಿಕಾನ್ ಅಚ್ಚು ಟ್ರಾನ್ಸಿಸ್ಟರ್ಗಳಂತೆ ಇದರಲ್ಲಿ, ಒಂದು ಏಕ ಹರಳಿನ ರೂಪಿಸುವ ಬಿಲ್ಲೆಗಳನ್ನು ಹಲವಾರು ಛಾಯಾಶಿಲಾಮುದ್ರಣ ಉತ್ಪಾದನೆಯಾಗುತ್ತದೆ."
443,ಭಾರತ ಪಂದ್ಯಗಳನ್ನು ವೀಕ್ಷಿಸಲು ಬರುವ ಬಷೀರ್ ತಮ್ಮ ಟೀ ಶರ್ಟ್ ಮೇಲೆ ಐ ಲವ್ ಯೂ ಧೋನಿ ಎಂದು ಬರಹ ಅಚ್ಚು ಹಾಕಿಸಿಕೊಂಡು ಬರುತ್ತಾರೆ.
444,ಗೋಡೆಗಳ ಮೇಲೆ ಅಚ್ಚು ವ್ಯವಹರಿಸಲು ಹೇಗೆ?
445,"ಕಾಂಕ್ರೀಟ್ ಸ್ತಂಭಗಳ ಮಾಡಿದ ದೀಪ, ಸರಂಧ್ರ ಆದ್ದರಿಂದ ಶಿಲೀಂಧ್ರಗಳು ಮತ್ತು ಅಚ್ಚು ಪ್ರಭಾವ ಒಳಪಟ್ಟಿರುತ್ತದೆ ಉಳಿಯುತ್ತದೆ."
446,"ಸುಧಾಕರ ಮಾತನಾಡಿ, ವಸತಿ ನಿಲಯದ ಮಕ್ಕಳು ಅಚ್ಚು ಕಟ್ಟಾಗಿ ಕಲಿಯುತ್ತಿರುವದು ಸಂತಸದ ವಿಷಯವಾಗಿದೆ."
447,ಬೊಮ್ಮನಹಳ್ಳಿ ಅವರು ಧಾರವಾಡದಲ್ಲಿ ಅಚ್ಚು ಒತ್ತಿದಂತಹ ಕೆಲಸ ಮಾಡಿದ್ದಾರೆ.
