Index,Sentence
175,"ಸ್ನಾನಗೃಹದ ಪಿವಿಸಿ ಫಲಕಗಳ ಸೀಲಿಂಗ್ ಅನ್ನು ಗುಣಾತ್ಮಕವಾಗಿ ಮಾಡಬೇಕಾಗಿದೆ, ಆದ್ದರಿಂದ ಫಲಕಗಳ ನಡುವೆ ಅಂತರವಿರುವುದಿಲ್ಲ, ಇಲ್ಲದಿದ್ದರೆ ಅಚ್ಚು ರಚಿಸಬಹುದು."
176,ಒಡಕು ಅಚ್ಚು ಮಾರ್ಷ್ಮ್ಯಾಲೋ ಪದರವನ್ನು ಬಿಂಬಿಸಲಾಗಿದೆ.
177,"ಆರ್ದ್ರತೆ ಸಹ ಹೆಚ್ಚಿನ ತೇವಾಂಶ ಬದಲಿಗೆ ಅಣಬೆಗಳು ಬೆಳವಣಿಗೆ ಅಚ್ಚು ಕಾರಣವಾಗುತ್ತದೆ, ನಿಯಂತ್ರಿಸಬೇಕಿದೆ."
178,"ಇದನ್ನು ಮಾಡಲು, ಪೀಟ್ ¼, ಮಿಶ್ರಣವನ್ನು ತಯಾರು ¼ ಮತ್ತು ಅರ್ಧ ಮರಳಿನ ಎಲೆಯ ಅಚ್ಚು ಅಥವಾ ತೋಟಗಳಲ್ಲಿ."
179,ಶೈಕ್ಷಣಿಕ ಚಟುವಟಿಕೆಗೆ ಪೂರಕವಾದ ಪರಿಸರ ಹೊಂದಿರುವುದ ರಿಂದಲೇ ವಿದೇಶಿ ವಿದ್ಯಾರ್ಥಿಗಳಿಗೆ ಮೈಸೂರು ವಿವಿ ಅಚ್ಚು ಮೆಚ್ಚಿನ ವಿವಿಯಾಗಿ ಪರಿಣಮಿಸಿದೆ.
180,ಅಚ್ಚು ಬೆಲ್ಲ – 2 3.
181,"ಒಂದು ಉದಾತ್ತ ಅಚ್ಚು ಉತ್ಪನ್ನ, ಸೂರ್ಯನ ಬರೆಯುವ ಚರ್ಮದ ಉರಿಯೂತ ಮತ್ತು ಮೆಲನೋಮವು ಅಪಾಯ ತಗ್ಗಿಸುತ್ತದೆ ಚರ್ಮದ ರಕ್ಷಿಸಲು ಇದು ಮೂಲ ವಸ್ತುಗಳು, ಶ್ರೀಮಂತವಾಗಿರುತ್ತವೆ ಇದೆ."
182,ಈ ಪ್ರಕ್ರಿಯೆಯು ಅಚ್ಚು ಶಿಲೀಂಧ್ರಗಳು ಮತ್ತು ಹಾನಿಕಾರಕ ಬ್ಯಾಕ್ಟೀರಿಯಾಗಳಿಂದ ಪರಾಗ ರಕ್ಷಿಸುತ್ತದೆ.
183,ಇಷ್ಟಕ್ಕೇ ನಿಲ್ಲದೆ ಆಟೋ ಓಡಿಸುತ್ತಿದ್ದ 20 ಜನ ಅಸ್ಪೃಶ್ಯರ ಆಟೋ ನಂಬರುಗಳನ್ನು ಅಚ್ಚು ಮಾಡಿಸಿ ಅವುಗಳನ್ನು ಯಾರೂ ಹತ್ತಬಾರದು ಎಂದು ಪ್ರಚಾರ ಮಾಡಿದ್ದರು.
184,ಸೆಕ್ಷನ್ 7: ತಂಬಾಕು ಉತ್ಪನ್ನಗಳ ಪ್ಯಾಕೆಟ್ ಮೇಲೆ ಶೇ 85ರಷ್ಟು ಆರೋಗ್ಯದ ಎಚ್ಚರಿಕೆ ಚಿತ್ರ: ಸಿಗರೇಟ್‌ ಹಾಗೂ ತಂಬಾಕು ಉತ್ಪನ್ನ ಇರುವ ಪ್ಯಾಕೆಟ್‌ಗಳ ಮೇಲೆ ಕಡ್ಡಾಯವಾಗಿ ದೊಡ್ಡದಾದ ಚಿತ್ರ ಅಚ್ಚು ಹಾಕಿರಬೇಕು.
185,"ಈ ವಸ್ತುಗಳ ಗಾತ್ರ ಬದಲಿಸುವ ಇಲ್ಲ ಬಂದಿವೆ, ಇದು ಅಚ್ಚು ನೋಟವನ್ನು ಒಂದು ಒಲವನ್ನು ಹೊಂದಿದೆ ಏಕೆಂದರೆ ಅದೇ ಸಮಯದಲ್ಲಿ ಆರ್ದ್ರ ಶುದ್ಧೀಕರಣ ನಂತರ, ಸಂಪೂರ್ಣವಾಗಿ ಡ್ರೈ ಅಗತ್ಯವಿದೆ ಆದಾಗ್ಯೂ ಇದು ವಿಘಟನೆಯನ್ನು ನಡೆಸಿದಾಗ ತೇವಾಂಶ ಒಡ್ಡಿಕೊಂಡಾಗ ಎಂಬುದಲ್ಲ."
186,"ಆದ್ದರಿಂದ, ಮಕ್ಕಳ ಸಂಸ್ಥೆಗಳಲ್ಲಿ (ಶಾಲೆಗಳು, ಉದ್ಯಾನಗಳು) ಎಚ್ಚರಿಕೆಯಿಂದ ಎಲ್ಲಾ ಪ್ರದೇಶಗಳಲ್ಲಿ, ಅಚ್ಚು ಮತ್ತು ಬೆಚ್ಚಗಿನ ಮತ್ತು ಒದ್ದೆಯಾದ ಪ್ರದೇಶಗಳಲ್ಲಿ ಬಹುಬೇಗನೆ ಗುಣಿಸಿ ಇದು ರೋಗಕಾರಕ ಶಿಲೀಂಧ್ರಗಳು, ಕಾಣಿಸಿಕೊಳ್ಳಲು ಅವಕಾಶ ನಿರ್ವಹಿಸಲು ಮಾಡಬೇಕು."
187,"ಅಹಿತಕರ ಮತ್ತು ಅಪಾಯಕಾರಿ ಅಚ್ಚು ಕಾಣುತ್ತಿಲ್ಲ ನಿಮ್ಮ ಮನೆ ಸಲುವಾಗಿ, ಈ ಸರಳ ನಿಯಮಗಳನ್ನು ಅನುಸರಿಸಿ:"
188,"ಇದು ಶಿಲೀಂಧ್ರ, ಅಚ್ಚು ರೂಪವನ್ನು ತಡೆಯುತ್ತದೆ; ಧೂಳು ಸಂಗ್ರಹಿಸುವುದಿಲ್ಲ."
189,ಯೀಸ್ಟ್ ಕೆಳಗೆ ಅಚ್ಚು ಮೇಲೆ ಸುರಿಯುತ್ತಾರೆ.
190,ಇದು ಮರದ ಮೇಲಿರುವ ಕೆಲವು ಅಚ್ಚು ಮತ್ತು ಪರಾಗವನ್ನು ತೆಗೆದುಹಾಕುತ್ತದೆ.
191,"ತಮ್ಮ ಪಾಂಡಿತ್ಯ\, ವಾಗ್ಮಿತೆಗಳಿಂದ ವಿದ್ಯಾರ್ಥಿಗಳ ಅಚ್ಚು ಮೆಚ್ಚಿನ ಅಧ್ಯಾಪಕರು."
192,"ಸಕ್ಕರೆ ಹೋಗಿ ಬಂದರೆ, ಕರಂಟ್ಸ್ ಸಕ್ಕರೆಯ ಒಂದು ತೆಳುವಾದ ಸುರಿಯುವುದು ಪೂರ್ವ ಈಡಾದರು ಜಾರ್, ಉನ್ನತ ಪರಿಭಾಷೆಯಲ್ಲಿ ವಿಸ್ತರಿಸಬೇಕು ಎಂದು ಶೇಖರಣಾ ರೆಫ್ರಿಜರೇಟರ್ನಲ್ಲಿ, ಕಾರ್ಕ್ ಮುಚ್ಚಳಗಳು ಮತ್ತು ಸ್ಥಳದಲ್ಲಿ (ಈ ಅಚ್ಚು ರಚನೆಗೆ ತಡೆಯಲು ಸಹಾಯ ಮಾಡುತ್ತದೆ)."
193,"BC ಯಲ್ಲಿ, ಈಜಿಪ್ಟಿನವರು ಬಿಸಿ ಮತ್ತು ಅಚ್ಚು ತಾಮ್ರವನ್ನು ಆಕಾರಗಳಾಗಿ ಬಿಡಿಸಿದರು."
194,"ರೌಂಡ್ ಬಿಲ್ಲೆಗಳನ್ನು ಅಲಂಕರಿಸಲು, ಅವುಗಳನ್ನು ಮರಿಗಳು, ಅಚ್ಚು ಅವುಗಳನ್ನು ಪುಟ್."
195,ಸಿಲಿಕಾನ್ ಅಚ್ಚು ಸರಳ ಕೇಕ್ ರೆಸಿಪಿ
196,"ಹೊಲ, ಬದುಗಳಲ್ಲಿ ಹುಲ್ಲು ಮುಗಿಯುವ ಈ ವೇಳೆಗೆ ಸರಿಯಾಗಿ ಇನ್ನೂ ಹಸಿರು ಉಳಿಸಿಕೊಂಡು ಬಿಳಿ ಹೂ ಮುಡಿದಿರುವ ಅಣ್ಣೆ ಸೊಪ್ಪು ರಾಸುಗಳಿಗೆ ಬಲು ಅಚ್ಚು ಮೆಚ್ಚು."
197,ಶ್ರೀನಿವಾಸನ ಹಚ್ಚಮನಸ್ಸಿನ ಮೇಲೆ ಇದರ ದೃಶ್ಯ ಶಾಶ್ವತ ಮತ್ತು ಹೊಚ್ಚ ಹೊಸ ಅಚ್ಚು ಒತ್ತಿತು; ಮತ್ತು ರಾಮಾಯಣದ ವಿಚಾರ ತೀವ್ರ ಆಸಕ್ತಿ ಮೊಳೆಯುವಂತೆ ಮಾಡಿತು.
198,"ಕೊನೆಯಲ್ಲಿ, ಪಾಕಕ್ಕೆ ಹಣ್ಣು ಸೇರಿಸಲು ಮತ್ತು ಎಲ್ಲಾ ಅಚ್ಚು ಆರಂಭವಾಯಿತು."
199,ಎರಕ ವರಸೆ ಅಥವಾ ಅಚ್ಚು ಲೇಪನವೆಂಬುದು ಅರೂಪ ಅಥವಾ ಸಣ್ಣ ಕಣಗಳ ಗ್ರ್ಯಾಫೈಟ್‌ನ ನೀರು-ಆಧಾರಿತ ಬಣ್ಣವಾಗಿದೆ.
200,ನಮ್ಮ ಗ್ರಾಹಕರು ಸಿಹಿ ಸಿಹಿಯಾದ ದ್ರಾಕ್ಷಿಯನ್ನು ಕೇಳಿದರೆ ವಿದೇಶಿ ಗ್ರಾಹಕರಿಗೆ ಹುಳಿ ದ್ರಾಕ್ಷಿಯೇ ಅಚ್ಚು ಮೆಚ್ಚು.
201,ಅಚ್ಚು ತಯಾರಿ ನಂತರ ಪಫ್ ಪೇಸ್ಟ್ರಿ ಔಟ್ ರೋಲಿಂಗ್ ಪ್ರಾರಂಭಿಸಿ ಸಾಕಾಗುತ್ತದೆ.
202,"ಬೆಲ್ಲದ ಅಚ್ಚು ; ಕುಲದೇವರ ಬಲ, ದಾರಿದ್ರ್ಯ ನಿವಾರಣೆ, ಇಷ್ಟಾರ್ಥ ಸಿದ್ಧಿ, ಶುಗರ್ control, ಆಗುತ್ತೆ, ಅಧಿಕ ಲಾಭವಾಗುತ್ತೆ, ಅಪಮೃತ್ಯು ನಿವಾರಣೆಯಾಗುತ್ತದೆ ."
203,ಆರೋಗ್ಯ ಅಚ್ಚು ಫಾರ್ ಎಂಬುದನ್ನು ಅಪಾಯಕಾರಿ?
204,"ಚಿತ್ರ ಸರಳ, ವಿಂಟೇಜ್ ದೈತ್ಯಾಕಾರದ ಚಲನಚಿತ್ರ ಅಚ್ಚು - ಅಪರಿಚಿತ ಜೀವಿ, ದೂರಸ್ಥ ಅನಿಲ ನಿಲ್ದಾಣದಲ್ಲಿ ಸಿಲುಕಿದ ಅಸಹಾಯಕ ಬಲಿಪಶುಗಳು ತೆಗೆದುಕೊಳ್ಳುತ್ತದೆ - ಮತ್ತು ಇದು ಒಂದು ಭರ್ಜರಿಯಾದ ಆಧುನಿಕ ಅಂಚಿನ ಮತ್ತು ಹಾಸ್ಯ ತೊಡಗಿರುವ ಅರ್ಥದಲ್ಲಿ infuses."
205,ನವದೆಹಲಿ: ಬಾಲಿವುಡ್ ಬ್ಯೂಟಿ ಕತ್ರೀನಾ ಕೈಫ್ ಇಡೀ ಪ್ರಪಂಚದಲ್ಲಿಯೇ ಒಬ್ಬರೇ ಒಬ್ಬರು ಮಾತ್ರ ಈಕೆಗೆ ಅಚ್ಚು ಮೆಚ್ಚಂತೆ.
206,"ಸೀರೆಗಳ ಮೇಲೆ ಅಚ್ಚು ಹಾಕುವಾಗ ನಾವು ಆಯ್ಕೆ ಮಾಡಿಕೊಳ್ಳುವ ಕವನವಾಗಲಿ, ಚಿತ್ರವಾಗಲೀ ಆಯಾ ಕವಿಗಾಗಲೀ, ಸಮುದಾಯಕ್ಕಾಗಲೀ ಮುಜುಗರವನ್ನುಂಟು ಮಾಡಬಾರದು."
207,"ಮುಂದಿನ ಹಂತದಲ್ಲಿ, ಮಾಂತ್ರಿಕ ಅಚ್ಚು ಎಂದು."
208,"ಆದಾಗ್ಯೂ, ಕಾಲಕಾಲಕ್ಕೆ ಫಿಲ್ಟರ್ಗಳನ್ನು ಬದಲಾಯಿಸುವ ಅವಶ್ಯಕತೆಯಿರುತ್ತದೆ, ಇದರಿಂದಾಗಿ ಅಚ್ಚು ಮತ್ತು ಬ್ಯಾಕ್ಟೀರಿಯವನ್ನು ಯಶಸ್ವಿಯಾಗಿ ನಿಭಾಯಿಸಲು ಅವುಗಳು ಅವುಗಳ ಮೇಲೆ ಸಮೂಹ ಸಂತಾನೋತ್ಪತ್ತಿ ಪ್ರಾರಂಭಿಸುವುದಿಲ್ಲ."
209,೧೮೯೦ರ ಸೌತ್‌ಇಂಡಿಯನ್‌ಇನ್‌ಸ್ಕ್ರಿಪ್ಷ್‌ನ್ಸ್ ಸಂಪುಟದ ಮೊದಲನೇ ಭಾಗದಲ್ಲಿ ಅಚ್ಚು ಮಾಡಲಾದ ಈ ಶಾಸನದ ಅನುವಾದದಲ್ಲಿ ಪಾನ್‌ಸುಪಾರಿ ಬಜಾರ ಎಂದೇ ಕಾಣಿಸಿದೆ.
210,ರಥದ ಅಚ್ಚು ಮುರಿದ ಕಾಲಕ ತಾನು
211,"ಡಿಸ್ಟಿಂಗ್ವಿಶ್ಡ್ ಕಾಗದದ ಬಿಳಿಯ ಮತ್ತು ಬಾಳಿಕೆ, ಹಾಗೂ ಇತರ ಕಾಗದದ ಕಾರ್ಖಾನೆಗಳು, ಅಚ್ಚು ಯಾವುದೇ ಕುರುಹುಗಳು ವಿರುದ್ಧವಾಗಿ."
212,*ಕೇರಳದಲ್ಲಿ ಅಚ್ಚು ಅಚ್ಚರಿ!
213,ಅಚ್ಚು ಕಿರಿದಲ್ಲ ಅಚ್ಚುಗಳು ಕಿರಿದಲ್ಲ
214,ಅಕಸ್ಮಾತ್ತಾಗಿ ಆರ್ದ್ರವಾದರೆ ಬ್ಯಾಕ್ಟೀರಿಯಾವನ್ನು ಅಚ್ಚು ಅಥವಾ ಆಶ್ರಯಿಸದ ವಸ್ತುಗಳನ್ನು ನೋಡಿ.
215,ಅಚ್ಚು ನಂತರ preheated ಒಲೆಯಲ್ಲಿ 40 ನಿಮಿಷಗಳ ಕಾಲ ಇದು ಒಂದು ಪುಡಿಂಗ್ ಮತ್ತು ನೀರಿನ ಸ್ನಾನ ತಯಾರು ಸಾಧ್ಯ ಇಡಲಾಗುತ್ತದೆ.
216,ಇದರಿಂದಾಗಿ ಅಚ್ಚು ಕಟ್ಟಾಗಿ ಪಡಿಯಚ್ಚು ತೆಗೆಯಬಹುದಾದ ಶಾಸನಗಳು ದೊರೆಯುವುದು ನೂರಕ್ಕೆ ಹತ್ತರಷ್ಟು ಮಾತ್ರ.
217,ಅದರಲ್ಲೂ ಸ್ವತಃ ಪಾರ್ವತಿಯೇ ಈ ಮರದ ಎಲೆಗಳಾಗಿರುವುದರಿಂದಾಗಿ ಆ ಎಲೆಗಳೆಂದರೆ ಶಿವನಿಗೆ ಇನ್ನೂ ಅಚ್ಚು ಮೆಚ್ಚು.
218,"ಅಳಿಸುವುದರ ಅಪಾರ್ಟ್ಮೆಂಟ್ ನಲ್ಲಿ ಅಚ್ಚು ಸಾಕಷ್ಟು ಕಷ್ಟ ಆದ್ದರಿಂದ, ನೀವು ಸಕ್ರಿಯವಾಗಿ ಅದರ ಸಂಭವಿಸುವುದನ್ನು ನಿರ್ಬಂಧಿಸಲು ಅಗತ್ಯವಿದೆ."
219,"ಅಷ್ಟೇ ಕೆಟ್ಟದಾಗಿದೆ, ಫೌಲ್-ವಾಸಲಿಂಗ್ ಕೈಗವಸುಗಳು ಅಚ್ಚು ಮತ್ತು ಸೂಕ್ಷ್ಮಜೀವಿಗಳು ಅವುಗಳೊಳಗೆ ಅಂಗಡಿಯನ್ನು ಸ್ಥಾಪಿಸಿವೆ."
220,ಸಂಪರ್ಕ ಮುಂದೆ ಅಚ್ಚು ಜೊತೆಗೆ ಖಾಯಂ ಚಕ್ರ ಚಾಲನೆಯ ಹೆಚ್ಚಿನ ಪ್ರವೇಶಸಾಧ್ಯತೆಯನ್ನು ಒದಗಿಸುತ್ತದೆ.
221,ಸೌರವ್ ಗಂಗೂಲಿ ನನ್ನ ಅಚ್ಚು ಮೆಚ್ಚಿನ ಕ್ರಿಕೆಟ್ ಆಟಗಾರ.
222,"ಒಲೆಯಲ್ಲಿ ಹೊರಗೆ ಎಳೆಯುವ ಅಂತ್ಯ ಉತ್ಪನ್ನದಲ್ಲಿ ತಂಪಾಗಿಸಲು, ಮತ್ತು ಅಚ್ಚು ತೆಗೆದುಹಾಕಲು ಬಿಟ್ಟು ಮಾಡಬೇಕು."
223,ಮತ್ತು ಇದು ಒಂದು ಬೂದು ನಯವಾದ ಅಚ್ಚು ತೋರುತ್ತಿದೆ.
224,10): ರೈಲ್ವೇ ಇಲಾಖೆ ತನ್ನ ಸೇವೆಯನ್ನು ಅಚ್ಚು ಕಟ್ಟಾಗಿ ನಿಭಾಯಿಸಲು ಬಹಳಷ್ಟು ಶ್ರಮ ವಹಿಸುತ್ತಿದೆ.
225,ನಾಯಕನ ಇತಿಹಾಸ: ಅಚ್ಚು ನಾಯಕ ಅಂಜಿಗೇರಿ ನಾಡಿನ ಪಾಳೆಗಾರನಾಗಿದ್ದ ಕಟ್ಟೆಮನೆ ಚಿಟ್ಟಿಯಪ್ಪ ನಾಯಕನ ಮಗ.
226,"ಅವರು ಏನೇ ಬರೆಯಲಿ, ಮಾತನಾಡಲಿ ಅಲ್ಲಿ ನಾಯಕರ ನಾಯಕತ್ವದ ಅಚ್ಚು ಮೂಡುತ್ತಿತ್ತು."
227,"ಜೊತೆಗೆ, ಯಾವುದೇ ಒಂದು ಹೆಚ್ಚು ಲಾಭ ಬೂಟ್ಸ್ಟ್ರ್ಯಾಪ್ ಇತ್ತು - ಇದು, ಒಂದು ವೃತ್ತಿಪರ ವಿನ್ಯಾಸ ರಚಿಸಲು, ಒಂದು ಉನ್ನತ ಮಟ್ಟದಲ್ಲಿ ಮಾರ್ಕ್ಅಪ್ ಸಿಎಸ್ಎಸ್ ರಚಿಸಲು ಕೌಶಲ್ಯಗಳನ್ನು ಗೊತ್ತಿಲ್ಲ ಕೆಲವರು ಸಹಾಯ ಮಾಡುವ ಒಂದು ಮಾರ್ಗವಾಗಿದೆ ಏಕೆಂದರೆ ಒಂದು ಅಚ್ಚು ಮಾಡುವ ನೆರವಾಗಬಹುದು ಎಲ್ಲಾ ವಾದ್ಯಗಳು ಟೆಂಪ್ಲೇಟ್ ಇದು ಈಗಾಗಲೇ ಭಾಷಣ."
228,ಆ ಹಾದಿಯಲ್ಲಿ ಹಾಗೇ ಮತ್ತು ಯಾವುದೇ ಅಚ್ಚು ಹೊಂದಿವೆ ಮಾತ್ರ ಹಣ್ಣುಗಳು ಇವೆ ಇದು ಗಮನಿಸಬೇಕು.
229,ಕನ್ನಡೇತರರಿಗೆಲ್ಲ ಈಗ ಕನ್ನಡ ಹಾಡುಗಳೆಂದರೆ ಅಚ್ಚು ಮೆಚ್ಚು.
230,"ಕಳೆದ ವಾರ ಉತ್ತಮ ಗುಣಮಟ್ಟದ ಕ್ವಿಂಟಲ್‌ ಅಚ್ಚು ಬೆಲ್ಲಕ್ಕೆ ₹ 4,400 ದರ ಇತ್ತು."
231,"ಸಾಮಾನ್ಯ ಕುಟುಂಬ ಹಿನ್ನೆಲೆಹೊಂದಿರುವ ಝೈರಾಗೆ ನಟನೆ ಅಚ್ಚು ಮೆಚ್ಚಂತೆ, ಆದರೆ ಇದು ಹೆತ್ತವರಿಗೆ ಇಷ್ಟವಿರಲಿಲ್ಲ."
232,ಕಳೆದ ಮದ್ಯ ವರ್ಜನ ಶಿಬಿರದಲ್ಲಿ ಮದ್ಯ ಸೇವನೆ ಬಿಟ್ಟ ನವಜೀವನ ಸಮಿತಿ ಸದಸ್ಯರು ಅಚ್ಚು ಕಟ್ಟಾಗಿ ಕಾರ್ಯ ನಿರ್ವಹಿಸಿದರು.
233,ಇದು ಎಲ್ಲಾ ವಸ್ತುಗಳ ಉತ್ತಮ ವಾತಾಯನ ಒದಗಿಸುತ್ತದೆ ಮತ್ತು ಅಚ್ಚು ಮತ್ತು ಶಿಲೀಂಧ್ರ ರಚನೆಯನ್ನು ತಡೆಗಟ್ಟುತ್ತದೆ.
234,ವಲಯಗಳಲ್ಲಿ ಆಲೂಗಡ್ಡೆ ಕತ್ತರಿಸಿ ಅಚ್ಚು ಕೆಳಗೆ ಸಮವಾಗಿ ಇರಿಸಿ.
235,ಅಚ್ಚು ಮತ್ತು ಶಿಲೀಂಧ್ರ ಬೆಳವಣಿಗೆಯನ್ನು ತಡೆಗಟ್ಟಲು ಸಂಗ್ರಹಿಸುವ ಮೊದಲು ಸಂಪೂರ್ಣವಾಗಿ ಒಣಗಲು ಗಾಳಿಯನ್ನು ತೆಗೆದುಹಾಕಿ ಮತ್ತು ಅನುಮತಿಸಿ.
236,ಲೆಕ್ಕಾಚಾರ ಮಾಡಲು ದೃಢವಾಗಿ ಹಾಳೆಯಲ್ಲಿ ಅಚ್ಚು ಮಾಡಲಾಯಿತು ಉತ್ಪಾದನೆ ಪ್ರಕ್ರಿಯೆ ಮುದ್ರಿತ ಸರ್ಕ್ಯೂಟ್ ಬೋರ್ಡ್ಗಳು ಪರಿಹಾರ ಬಳಕೆಯನ್ನು ಒಳಗೊಂಡಿದೆ ಫೆರಿಕ್ ಕ್ಲೋರೈಡ್.
237,ವಾಹನ ಮತ್ತು ವಾಹನಯೇತರ ವಲಯಕ್ಕೆ ಬಿಡಿಭಾಗಗಳ ಅಲ್ಯುಮಿನಿಯಂ ಅಚ್ಚು ತಯಾರಿಸುವ ಸುಂದರಂ ಕ್ಲೇಟನ್‌ ಕೂಡ ಇದೇ ಬಗೆಯ ನಿರ್ಧಾರ ಕೈಗೊಂಡಿದೆ.
238,"ಬಹುಮಖ ಪ್ರತಿಭೆಯ ಕು| ವಿಭಾಲಿ ಶೆಟ್ಟಿ ಯ ವಿವಿಧ ಚಟುವಟಿಕೆಗಳಲ್ಲಿ ತನ್ನ ಪ್ರತಿಭೆಯ ಮೂಲಕ ತನ್ನ ಪೋಷಕರಿಗೂ, ವಿದ್ಯಾಸಂಸ್ಥೆಗೂ ಹೆಸರು ಗಳಿಸಿರುವವುದನ್ನು ವಿದ್ಯಾ ಸಂಸ್ಥೆಯ ಆಡಳಿತ ಮಂಡಳಿಗೆ ಅಚ್ಚು ಮೆಚ್ಚಿನ ವಿದ್ಯಾರ್ಥಿನಿಯಾಗಿದ್ದಾಳೆ."
239,ಅದರ ಮುಚ್ಚಳಗಳನ್ನು ಅಚ್ಚು ಕಟ್ಟಾಗಿ ನಿರ್ಮಿಸಬೇಕು ಎಂದು ಮೇಯರ್‌ ಸೂಚಿಸಿದರು.
240,"ಹೆಚ್ಚಿನ ನಲ್ಲಿ ಅಚ್ಚು ಚಿನ್ನದ ಮಾದರಿ, ಕಡಿಮೆ ಗಾಢವಾಗುತ್ತದೆ."
241,"ಫ್ಯಾಶನ್, ಅಚ್ಚು ಉಣ್ಣೆ ಮತ್ತು ಕ್ಯಾಶ್ಮೀರ್ ಜಾಕೆಟ್ಗಳು ಮತ್ತು ಆಕ್ಟನ್ನೊಂದಿಗೆ ಸೂಕ್ಷ್ಮ ಪೂರ್ವ-ಕಟ್ ಶೈಲಿಗಳು."
242,ಬ್ಲಾಕ್ ಅಚ್ಚು ಮತ್ತು ಅದರ ವಿರುದ್ಧ ಹೋರಾಟ
243,ವಾಸ್ತವವಾಗಿ ಒಳಾಂಗಣ ಗಾಳಿಯಲ್ಲಿ ದೊಡ್ಡ ಸಂಖ್ಯೆಯಲ್ಲಿ ತಮ್ಮ ವಿವಾದಗಳನ್ನು ಎಸೆಯುತ್ತಾರೆ ಅಚ್ಚು ಬೆಳವಣಿಗೆಯೊಂದಿಗೆ ಎಂಬುದು.
244,ಇಂತದೇ ಮತ್ತೊಂದು ಉಲ್ಪಿ ಹಣ್ಣಿನ ಗಿಡ: ದನಗಾಹಿಗಳು ತಿನ್ನುವ ಹಣ್ಣಾದರೂ ವಿಶೇಷವಾಗಿ ಕರಡಿಗಳಿಗೆ ಅಚ್ಚು ಮೆಚ್ಚಾದ ಹಣ್ಣು.
245,ಅಚ್ಚು ಬೆಲ್ಲ – 2
246,"ಆದರೆ, ಚಿತ್ರಗಳನ್ನು ಕೇವಲ ಮೊದಲ ಸಂಕಲನದ ಹತ್ತಿಪ್ಪತ್ತು ಪದ್ಯಗಳಿಗೆ ಮಾತ್ರ ಬಳಸಿಕೊಂಡು ಉಳಿದ ಸುಮಾರು 50 ಪದ್ಯಗಳನ್ನು ಹಾಗೆಯೇ ಅಚ್ಚು ಹಾಕಿರುವುದು ಪುಸ್ತಕದ ಉತ್ಪಾದನಾ ಗುಣಮಟ್ಟದ ದೃಷ್ಟಿಯಿಂದ ಸರಿಯಾದುದಲ್ಲ."
247,"ವಿಶೇಷವಾಗಿ ಹೇಗೆ ಅಚ್ಚು ಆಹಾರ ಇರಿಸಿಕೊಳ್ಳಲು ವಿಷಯದ ಬಗ್ಗೆ ಬಗೆಗೆ ಯಾರು ಶಿಲೀಂಧ್ರವನ್ನು ವಿರುದ್ಧ ಹೋರಾಟದಲ್ಲಿ ತುಂಬಾ ಕಷ್ಟ, ಇಲ್ಲದಿದ್ದರೆ ಅಸಾಧ್ಯ ಎಂದು ಅರಿವನ್ನು."
248,ನೂಲಿಗೆ ಬಣ್ಣ ಹಾಕುವುದು ಹಾಗೂ ಬಟ್ಟೆಗೆ ಅಚ್ಚು ಹಾಕುವ ವಿಭಾಗ.
249,"ಕೇಕ್, ತೈಲ ಸುಟ್ಟು ನಿಖರವಾಗಿ ಒಣಗಿಸಿದ ನಿರ್ಮಿಸಲಾಗಿತ್ತು, ಆದ್ದರಿಂದ ದೀರ್ಘಕಾಲ ಅಚ್ಚು ವ್ಯಾಪ್ತಿಯ."
250,"ಕೆಲವೊಮ್ಮೆ, ಹಿಮವು ಕರಗಿದಾಗ, ಮತ್ತು ಅಚ್ಚು ನೆಲದ ಮೇಲೆ ಗೋಚರಿಸಿದರೆ, ಸುಗ್ಗಿಯ ಕಾಲ ಕಾಯಿರಿ."
251,ಮೋಲ್ಡ್ ಇನ್ಸ್ಪೆಕ್ಷನ್ ಮತ್ತು ಅಬಾಟ್ಮೆಂಟ್: ಅಚ್ಚುಗಳು ಇರುವುದರಿಂದ ಅಚ್ಚು ಇನ್ಸ್ಪೆಕ್ಟರ್ ಮತ್ತು ಮೊಲ್ಡ್ ಅಬಾಟ್ಮೆಂಟ್ ಕಂಪನಿಯಲ್ಲಿ ಕರೆ ಮಾಡಲು ಹಿಂದಿನ ಮಡಕೆ ಬೆಳೆಯುವ ಮನೆಗಳು ಪಠ್ಯಪುಸ್ತಕದಲ್ಲಿವೆ.
252,"ಸೆಮಿಫೈನಲ್‌ ಹೋರಾಟದಲ್ಲಿ ಎಸ್‌ಬಿಎಂ ತಂಡ ಬೆಂಗಳೂರಿನ ಆರ್‌ಎಫ್‌ಡಬ್ಲ್ಯೂ ಎದುರೂ, ವಿಜಯ ಬ್ಯಾಂಕ್‌ ಬೆಂಗಳೂರಿನ ಅಚ್ಚು ಮತ್ತು ಗಾಲಿ ಕಾರ್ಖಾನೆ ವಿರುದ್ಧವೂ ಗೆದ್ದು ಫೈನಲ್‌ ಪ್ರವೇಶಿಸಿದ್ದವು."
253,"ಮುಂದೆ, ಹಲ್ಲಿನ ಅಚ್ಚು ತೆಳು ಪಡಿಸುವುದಕ್ಕೆ ಉತ್ಪಾದಿಸಲು ತರುವಾಯ ಆಗಿದೆ."
254,"ಪೂರ್ವಾಪೇಕ್ಷಿತ: ಅಚ್ಚು ಸುಮಾರು ಪ್ರತಿ ಗಂಟೆ ನೀವು ನಮ್ಮ ಭವಿಷ್ಯದ ಐಸ್ ಕ್ರೀಮ್ ಅನ್ನು ಪಡೆಯಬೇಕು ಮತ್ತು ಮಿಶ್ರಣ ಮಾಡಬೇಕಾಗುತ್ತದೆ, ಆದ್ದರಿಂದ ಐಸ್ನೊಂದಿಗೆ ಶೆರ್ಬೆಟ್ ಅನ್ನು ಪಡೆಯದೆ, ನಾವು ಕೃತಕ ಸೇರ್ಪಡೆಗಳನ್ನು ಬಳಸುವುದಿಲ್ಲ."
255,ಸ್ಥಿತಿಸ್ಥಾಪಕ ಅಲಂಕಾರಿಕ ಪ್ಲಾಸ್ಟರ್ ಗೋಡೆಗಳನ್ನು ಉಸಿರಾಡಲು ಮತ್ತು ಅಚ್ಚು ಮತ್ತು ಶಿಲೀಂಧ್ರಗಳ ಮೇಲೆ ಕಾಣಿಸಿಕೊಳ್ಳುವುದನ್ನು ತಡೆಯಲು ಅನುಮತಿಸುವ ಒಂದು ಉಸಿರಾಡುವಂತಹ ರಚನೆಯನ್ನು ಹೊಂದಿದೆ.
256,"ಆ ಬೆಳಸೆ ಏರು ಎಂದರೆ, ಅದೊಂದು ಯಮನ ಅಚ್ಚು ಮೆಚ್ಚಿನ ಸ್ಥಳ, ವರ್ಷಕ್ಕೆ ಕನಿಷ್ಟ ಹತ್ತಾರು ಅಪಘಾತಗಳಾದರೂ ಸಂಭವಿಸುತ್ತಿದ್ದವು ಅಲ್ಲಿ."
257,ಪೀಠೋಪಕರಣ ಕುಶನ್ಗಳಲ್ಲಿ ಅತಿಯಾದ ತೇವಾಂಶವು ಶಿಲೀಂಧ್ರ ಮತ್ತು ಅಚ್ಚು ಬೆಳವಣಿಗೆಗೆ ಕಾರಣವಾಗಬಹುದು.
258,ಕರೆಯಲ್ಪಡುವ ಸೆಲ್ಯುಲೋಸ್ ಹತ್ತಿ ಉಣ್ಣೆಯು ಕಡಿಮೆ ಚೆನ್ನಾಗಿ ಉಸಿರಾಡುವುದಿಲ್ಲ ಮತ್ತು ಅಚ್ಚು ಶಿಲೀಂಧ್ರದ ನೋಟವನ್ನು ತಡೆಯುತ್ತದೆ.
259,"ನಮ್ಮ ದೇಶದಲ್ಲಿ ಹೆಚ್ಚು ಕಡಿಮೆ ಗಲ್ಲಿ ಗಲ್ಲಿಯಲ್ಲೂ ದೇವಸ್ಥಾನಗಳು ಕಾಣಸಿಗುತ್ತವೆ, ಅದರಲೂ ಹನುಮಂತನೆಂದರೆ ಎಲ್ಲರಿಗೂ ಅಚ್ಚು ಮಚ್ಚು… ಹಿಂದೂ ಧರ್ಮದಲ್ಲಿ ಮುಕ್ಕೋಟಿ ದೇವರುಗಳಿದ್ದಾರೆ ಎನ್ನುತ್ತವೆ ಪುರಾಣಗಳು."
260,"ಬಳಕೆಯಲ್ಲಿಲ್ಲದಷ್ಟು ಸಮಯದವರೆಗೆ ಸಾಧನದಲ್ಲಿ ನೀರು ಬಿಟ್ಟಲ್ಲಿ, ಅಚ್ಚು ರಚನೆಗೆ ಹೆಚ್ಚು ಸಾಧ್ಯತೆ ಇದೆ."
261,"ತಲೆಕೆಳಗಾದ ರಾಜಪರಿಣಾಮಗಳು ಮತ್ತು ಅಚ್ಚು ಕ್ಯಾಪ್ಗಳಂತಹ ವಿಷಯಗಳೊಂದಿಗೆ, ಸಿಲ್ವರ್ ಟ್ರಕ್ಕುಗಳು ತಮ್ಮ ಧ್ಯೇಯವಾಕ್ಯವನ್ನು ಶೈಲಿಯೊಂದಿಗೆ ಸಾಮರ್ಥ್ಯ ವನ್ನು ತಳ್ಳುತ್ತದೆ."
262,"ಕೀಟಗಳ ಬಿಡುಗಡೆ ಸಿಹಿ ಜೇನುಕರಬೂಜ, ಕೇವಲ ಕಂದುಬಣ್ಣದ ಅಚ್ಚು ಬೆಳವಣಿಗೆಗೆ ಒಂದು ಅನುಕೂಲಕರವಾದ ವಾತಾವರಣವನ್ನು ಕಾರ್ಯನಿರ್ವಹಿಸುತ್ತದೆ."
263,"ಬಿಂದು, ಮೂಲ ಕಾರಣವಾಗಿದ್ದಾನೆ ಬೆಂಬಲ ಫ್ರೇಮ್ ಮತ್ತು ಸ್ಥಾನವನ್ನು ಹೋಲ್ಡರ್ - ಪೆಡಲ್ ಅಲ್ಲಿ ಸ್ಥಳಕ್ಕೆ ವಿಸ್ತರಿಸಿರುವ ಹಿಂಬದಿ ಚಕ್ರ ಅಚ್ಚು ಬಣ್ಣಿಸುವ ಸರ್ಕ್ಯೂಟ್ ಸುಮಾರು."
264,"ಮುದ್ರಣ ವೆಚ್ಚ ಹೆಚ್ಚಾಗುತ್ತಿದೆ ಎಂಬ ಕಾರಣದಿಂದ ಭಾರತೀಯ ರಿಸರ್ವ್‌ ಬ್ಯಾಂಕ್‌ (ಆರ್‌ಬಿಐ) ₹1 ಮತ್ತು ₹2 ಹಾಗೂ ₹5 ಮುಖಬೆಲೆ ನೋಟುಗಳ ಮುದ್ರಣವನ್ನು ಈ ಮೊದಲೇ ನಿಲ್ಲಿಸಿದ್ದು, ಬದಲಾಗಿ ನಾಣ್ಯಗಳನ್ನು ಅಚ್ಚು ಹಾಕಿಸುತ್ತಿದೆ ಎಂದು ಅವರು ಸದನಕ್ಕೆ ವಿವರಿಸಿದ್ದಾರೆ."
265,ಆಗಿನ ಕಾಲದಲ್ಲಿಯೇ ಎಲ್ಲಾ ಪತ್ರಗಳನ್ನೂ ಇಂಗ್ಲೀಷಿನಲ್ಲಿ ಅಚ್ಚು ಹಾಕಿಸಿ ಅವುಗಳನ್ನು ಮುದ್ರಿಸಿ ಕಳಿಸುತ್ತಿದ್ದರು.
