Index,Sentence
103,ರಸ್ತೆ ಗುಂಡಿ ಮುಚ್ಚುವ ನೆಪದಲ್ಲಿ ಅಧಿಕಾರಿಗಳು ಪಾಲಿಕೆ ಹಣವನ್ನು ಲೂಟಿ ಹೊಡೆಯುತ್ತಿದ್ದಾರೆ.
104,"ಅಲ್ಲೇನಿದ್ದರೂ ವಿದೇಶದಲ್ಲಿ ಕುಳಿತ ಪ್ರೇಕ್ಷಕರು, ವಿಮರ್ಶಕರು ಭಾರತದ ಕೊಳಚೆ ಗುಂಡಿ ನೋಡಿ ಪಾಪ ಅನ್ನಬೇಕು, ಇದು ಸಾಕ್ಷಾತ್ ಭಾರತದ ದರ್ಶನ ಎಂದುಕೊಂಡು ಪ್ರಶಸ್ತಿ ಕೊಡಬೇಕು."
105,ರಸ್ತೆ ಗುಂಡಿ ಮುಚ್ಚಲು ಆಗ್ರಹಿಸಿ ಅಟೊ ಚಾಲಕರ ಪ್ರತಿಭಟನೆ
106,ರಾಜ್ಯದ ಜನತೆಗೆ ಸಿಎಂ ಸಿದ್ದರಾಮಯ್ಯ ಅವರಿಂದ ರಸ್ತೆ ಗುಂಡಿ ಭಾಗ್ಯ : ಯಡಿಯೂರಪ್ಪ ಲೇವಡಿ
107,"ಅಲ್ಲದೆ ಅದೇ ಸಮ್ಮೇಳನದ ಸಮಾರೋಪ ಸಮಾರಂಭದಲ್ಲಿ ಕನ್ನಡದ ಹೋರಾಟಗಾರ ಮುಖ್ಯಮಂತ್ರಿ ಚಂದ್ರು ಅವರು ಜಿಲ್ಲಾ ಕನ್ನಡ ಸಾಹಿತ್ಯ ಪರಿಷತ್ ಅನ್ನು ಟಾಯ್ಲೆಟ್ ಗುಂಡಿ ಎಂದು ಹೋಲಿಕೆ ಮಾಡಿರುವುದು ಸರಿಯಾಗಿಯೇ ಇದೆ, ನಾವು ಅವರನ್ನು ಅಭಿನಂದಿಸುತ್ತೇವೆ ಎಂದರು."
108,ಮುಚ್ಚಿದ ರಸ್ತೆ ಗುಂಡಿ ಪರಿಶೀಲಿಸಲು ನ್ಯಾಯಾಲಯದ ಆಯೋಗ ರಚನೆ
109,ಮಾಗಡಿ ಪುರಸಭೆ ವ್ಯಾಪ್ತಿ ರಸ್ತೆ ಗುಂಡಿ ಮುಚ್ಚಲು ಒತ್ತಾಯ
110,ಕೆ.ಎನ್.ಪಿ.ಆ್ಯಪ್ ಗಾಗಿ ಈ ಗುಂಡಿ ಒತ್ತಿರಿ
111,ರಸ್ತೆ ಗುಂಡಿ ಮುಚ್ಚಲು ಬಿಬಿಎಂಪಿಗೆ ಮೂರು ದಿನ ಗಡುವು ನೀಡಿದ ಹೈಕೋರ್ಟ್‌
112,ಮುಚ್ಚಿದ ರಸ್ತೆ ಗುಂಡಿ ಪರಿಶೀಲಿಸಲು ನ್ಯಾಯಾಲಯದ ಆಯೋಗ ರಚನೆ
113,ಮಾರ್ಪಡಿಸಿ ಗುಂಡಿ ಒತ್ತಿ ಮತ್ತು ಪ್ಲೇಪಟ್ಟಿ ಐಟಂಗಳನ್ನು ಸೇರಿಸಬಹುದು.
114,ಮುಚ್ಚಿದ ರಸ್ತೆ ಗುಂಡಿ ಪರಿಶೀಲಿಸಲು ನ್ಯಾಯಾಲಯದ ಆಯೋಗ ರಚನೆ
115,‘15 ದಿನಗಳಲ್ಲಿ ಗುಂಡಿ ಮುಕ್ತ ಅವಳಿ ನಗರ’
116,ನಂತರ ಪೊಲೀಸರು ಮೂರು ಸುತ್ತು ಗಾಳಿಯಲ್ಲಿ ಗುಂಡಿ ಹಾರಿಸಿದರು.
117,"ಅದರ ಎದುರಿನ ರಸ್ತೆಯಲ್ಲಿ ಒಂದು ಅರಳಿ ಮರ, ಅದರ ಹಿಂದೆ ರಾಮರಾಯನ ಗುಂಡಿ ಎಂದು ಕರೆಯಲಾಗುತ್ತಿದ್ದ ತಗ್ಗು ಪ್ರದೇಶ."
118,"ಗುಂಡಿ ತುಂಬಿದರೆ ಇಳಿದು ಖಾಲಿ ಮಾಡಲು, ಅವನ್ನು ಸ್ವಚ್ಛಗೊಳಿಸಲು ಮತ್ತೆ ಸಫಾಯಿ ಕರ್ಮಚಾರಿಗಳೇ ಗುಂಡಿಗಿಳಿಯಬೇಕಾಗಿದೆ."
119,ಮುಂಬಯಿ ಎಕ್ಸ್‌ಪ್ರೆಸ್‌ ವೇ- ಗುಂಡಿ ಮು..
120,"ಬೆಂಗಳೂರು: ಕಸ ವಿಲೇವಾರಿ ಮಾಡದೆ, ರಸ್ತೆಯ ಗುಂಡಿ ಮುಚ್ಚದೆ ಸಿಲಿಕಾನ್ ಸಿಟಿ ಅಂತಾರಾಷ್ಟ್ರೀಯ ಮಟ್ಟದಲ್ಲಿ ಸುದ್ದಿಯಾದ ಬೆನ್ನಲ್ಲೇ, ಈಗ ಬೆಂಗಳೂರಿನಲ್ಲಿ ಮತ್ತೊಂದು ಪ್ರಮಾದ ನಡೆದಿದ್ದು, ಸರ್ಕಾರ, ವಿವಿ ಆಡಳಿತ ಮಂಡಳಿ ಏನು ಮಾಡುತ್ತಿದೆ ಎಂಬ ಮಾತುಕೇಳಿಬಂದಿವೆ."
121,"ಹೊಸ ವರ್ಷದ ಸಂದರ್ಭದಲ್ಲಿ ದೇಶವನ್ನುದ್ದೇಶಿಸಿ ಭಾಷಣ ಮಾಡಿದ ಕಿಮ್, ತನ್ನ ದೇಶ ಶಸ್ತ್ರಾಸ್ತ್ರ ತಡೆಯನ್ನು ನಿರ್ಮಿಸಿದೆ ಎಂದು ಹೇಳಿಕೊಂಡರು ಹಾಗೂ ಪರಮಾಣು ಗುಂಡಿ ತನ್ನ ಕೈಯಲ್ಲೇ ಇದೆ ಎಂದರು."
122,ಬಾವಿ ಪಕ್ಕದಲ್ಲಿಯೇ 14 ಅಡಿ ಆಳದ ಗುಂಡಿ ತೆಗೆಸಿ ಮಳೆ ನೀರು ಸಂಗ್ರಹಿಸಿದ್ದಾರೆ.
123,ಬೆಂಗಳೂರು: ನಗರದ ರಸ್ತೆ ಗುಂಡಿ ಗಳನ್ನು ಮುಚ್ಚಲು ಬಿಬಿಎಂಪಿ ಕಾಳಜಿ ವಹಿಸಿದೆ.
124,"ಒಳಗೆ ಕುಳಿತು ನಂತರ ಒಳಗಿರುವ ಗುಂಡಿ ಒತ್ತಿದರೆ, ಡೋರ್‌ಗಳು ಸ್ವತಃ ತಾವೇ ಮುಚ್ಚಿಕೊಳ್ಳುತ್ತವೆ."
125,ಕೆ.ಎನ್.ಪಿ.ಫೇಸ್ಬುಕ್ ಅಕೌಂಟ್ ಗಾಗಿ ಈ ಗುಂಡಿ ಒತ್ತಿರಿ
126,ಎದೆಗೆ ಎರಡು ಗುಂಡಿ ಬಿಟ್ಟ ಅಂಗಿ ನೋಡಿಕೊಂಡ.
127,"ಅದು ಹೇಗೆ ಹರಿಯಿತು ಅನ್ನೋದನ್ನು ನೋಡಿರಲಿಲ್ಲ, ಹಾಗಾಗಿ ಮತ್ತೊಂದು ಚಾನೆಲ್ಲಿನ ಗುಂಡಿ ಒತ್ತಿದೆ."
128,"ರಸ್ತೆ ಗುಂಡಿ ಮುಚ್ಚುವಂತೆ ಸುಪ್ರೀಂಕೋರ್ಟ್‌ ಮತ್ತು ಹೈಕೋರ್ಟ್ ಆದೇಶ ನೀಡಿರುವ ಬೆನ್ನಲ್ಲೇ ಎಚ್ಚೆತ್ತುಕೊಂಡ ಬಿಬಿಎಂಪಿ ಬೆಂಗಳೂರಿನ ರಸ್ತೆಗುಂಡಿಗಳನ್ನು ಮುಚ್ಚಲು ಮುಂದಾಗಿದ್ದು, ಒಟ್ಟಾರೆ ಇನ್ನು 35 ಗುಂಡಿ ಮಾತ್ರ ಇದೆ ಎಂದು ವರದಿ ನೀಡಿದೆ."
129,"ಹೊಲದ ಬದುಗಳಲ್ಲಿ ಅಲ್ಲಲ್ಲಿ ಸಣ್ಣ ಸಣ್ಣ ಗುಂಡಿ ಮಾಡಿ, ಸಂಗ್ರಹವಾದ ಮಣ್ಣನ್ನು ಮತ್ತೆ ಹೊಲಕ್ಕೆ ಸೇರಿಸಿ."
130,ಗಿಡದ ಬಳಿ ಸಣ್ಣ ಗುಂಡಿ ನಿರ್ಮಿಸಿ ಏಪ್ರಿಲ್‌- ಮೇ ತಿಂಗಳಲ್ಲಿ 2ರಿಂದ 3 ಬುಟ್ಟಿ ಕೊಟ್ಟಿಗೆ ಗೊಬ್ಬರ ನೀಡುತ್ತಾರೆ.
131,ಕೆ.ಎನ್.ಪಿ.ಆ್ಯಪ್ ಗಾಗಿ ಈ ಗುಂಡಿ ಒತ್ತಿರಿ
132,"ಮತದಾನದ ಅಂಕಣಕ್ಕೆ ತೆರಳಿದ ಆತ, ಕಾಂಗ್ರೆಸ್‌ಗೆ ಮತ ಹಾಕುವಂತೆ ವೃದ್ಧೆ ಕೇಳಿಕೊಂಡರೂ ಅವರ ಮಾತು ಮೀರಿ ಜೆಡಿಎಸ್‌ ಗುಂಡಿ ಒತ್ತಿದ್ದಾನೆ."
133,ರೈತರ ಪಂಪ್‌ಸೆಟ್‌ಗಳಿಂದ ನೀರು ಪಡೆದು ಗುಂಡಿ ತುಂಬಿಸುತ್ತಿರುವುದು ವಿಶೇಷ.
134,ವಾಹನ ಸವಾರರಿಗೆ ದುಃಸ್ವಪ್ನವಾದ ರಸ್ತೆ ಗುಂಡಿ
135,ಕೆ.ಎನ್.ಪಿ.ಆ್ಯಪ್ ಗಾಗಿ ಈ ಗುಂಡಿ ಒತ್ತಿರಿ
136,"ಮೊದಲು ಗುಂಡಿ ತೋಡುತ್ತಾರೆ, ಅದರ ಸೆಮೆಂಟಿಂಗ್ ಆಗುತ್ತದೆ, ನಂತರ ಕಲ್ಲು ಮುಚ್ಚುತ್ತಾರೆ ಮತ್ತು ಅಲ್ಲಲ್ಲಿ ಓಪನಿಂಗ್ ಅಂದರೆ ರಂಧ್ರಗಳನ್ನು ಬಿಟ್ಟಿರುತ್ತಾರೆ."
137,ಗುಂಡಿ ಮುಚ್ಚಲು ಬಳಸಿಕೊಳ್ಳಲು ಶಾಸಕರ ಮೂರು ತಿಂಗಳ ಸಂಬಳ ಹಾಗೂ ಪಾಲಿಕೆ ಸದಸ್ಯರ ಗೌರವಧನವನ್ನು ಬಿಬಿಎಂಪಿಗೆ ನೀಡುತ್ತೇವೆ’ ಎಂದು ಶಾಸಕ ಆರ್.ಅಶೋಕ್ ತಿಳಿಸಿದರು.
138,ಕೆ.ಎನ್.ಪಿ.ಯುಟ್ಯೂಬ್ ಚಾನಲ್ ಗಾಗಿ ಈ ಗುಂಡಿ ಒತ್ತಿರಿ
139,ಒಂದೇ ರಾತ್ರಿಯಲ್ಲಿ 871 ಗುಂಡಿ ಮುಚ್ಚಿದ್ದೇವೆ : ಮೇಯರ್
140,"ಆಗ ವಾಸ್ತವಕ್ಕೆ ಬಂದ ವಿಶ್ವ, ಯಾರಿಗೋ ಫೋನ್ ಮಾಡಿ ಬರುತ್ತೇನೆಂದು ಹೇಳಿ ಮೊಬೈಲ್ ಗುಂಡಿ ಒತ್ತುತ್ತಾ ಹೊರಗೆ ಹೋದನು."
141,ಕೆ.ಎನ್.ಪಿ.ಯುಟ್ಯೂಬ್ ಚಾನಲ್ ಗಾಗಿ ಈ ಗುಂಡಿ ಒತ್ತಿರಿ
142,ಬೆಳಗಿನ ಜಾವ 3 ಗಂಟೆ ಸುಮಾರಿಗೆ ಮರ್ಸಿಡಿಸ್ ಬೆಂಜ್ ಕಾರಿನಲ್ಲಿ ಮನೆಗೆ ವಾಪಸ್ಸಾಗುತ್ತಿರುವಾಗ ರಸ್ತೆಯಲ್ಲಿ ನೀರು ತುಂಬಿದ ಗುಂಡಿ ತಪ್ಪಿಸಲು ಹೋಗಿ ಮೆಟ್ರೋ ರೈಲು ಲಂಬಕ್ಕೆ ಡಿಕ್ಕಿ ಹೊಡೆದಿದ್ದಾನೆ.
143,ಮಳೆ ನೀರು ಹಿಡಿದಿಡಲು ನಿಗದಿಪಡಿಸಿದ ಪ್ರದೇಶಕ್ಕೆ ಅನುಗುಣವಾಗಿ ಸಾಮಾನ್ಯ ಗಾತ್ರದ ಗುಂಡಿ ತೋಡಿಕೊಳ್ಳಬೇಕು.
144,ಪತಿ ಹಾಗೂ ಪತ್ನಿಯ ದೇಹವನ್ನು ಅವರ ಜಮೀನಿನಲ್ಲಿ ಅಕ್ಕ ಪಕ್ಕ ಗುಂಡಿ ತೋಡಿ ಅಂತ್ಯಸಂಸ್ಕಾರ ಮಾಡಲಾಯಿತು.
145,ರಾತ್ರಿ ಬಾಗಿಲಿನಲ್ಲೇ ಕಾಯುತ್ತಿದ್ದ ಗುಂಡಿ ಇವನಿಗೆ ಸರ್ಪ್ರೈಸ್ ಕೊಡಬೇಕಂತ ಅಲ್ಲೇ ಅವನ ಕಣ್ಣಿಗೆ ಪಟ್ಟಿ ಕಟ್ಟಿ ಡೈನಿಂಗ್ ಹಾಲಿಗೆ ಕರೆದುಕೊಂಡು ಬಂದು ಕೂರಿಸುತ್ತಾಳೆ.
146,ಪ್ರತಿಯೊಂದು ವಿಗ್ರಹದ ಎದುರು ಒಂದು ವಿದ್ಯುತ್ ಗುಂಡಿ ಇದೆ.
147,"ಬೆಟ್ಟ, ಗುಟ್ಟಗಳು, ಪರ್ವತಗಳನ್ನು ಹೊರತುಪಡಿಸಿ ನೀವು ಕುದುರೆಮುಖದಲ್ಲಿ ಹನುಮನ್ ಗುಂಡಿ ಫಾಲ್ಸ್‍ನ್ನು ಕೂಡಾ ನೋಡಬಹುದು."
148,ಕೆ.ಎನ್.ಪಿ.ಆ್ಯಪ್ ಗಾಗಿ ಈ ಗುಂಡಿ ಒತ್ತಿರಿ
149,"June 18, 2018 ರಸ್ತೆ ಗುಂಡಿ ಮುಚ್ಚಲು ಅಧಿಕಾರಿಗಳಿಗೆ ಖಾಲಿ ಚೆಕ್"
150,ರಸ್ತೆ ಗುಂಡಿಗಳನ್ನು ಮುಚ್ಚಲು ಹೈಕೋರ್ಟ್‌ ಚಾಟಿ ಬೀಸಿದ ಬೆನ್ನಲ್ಲೇ ಬಿಬಿಎಂಪಿಯು ಸಮರೋಪಾದಿಯಲ್ಲಿ ನಗರದೆಲ್ಲೆಡೆ ಗುಂಡಿ ದುರಸ್ತಿ ಕಾರ್ಯಾಚರಣೆಯನ್ನು ತೀವ್ರಗೊಳಿಸಿದೆ.
151,"ನಂತರ ನ್ಯೂ ಬಿಇಎಲ್ ರಸ್ತೆಯಲ್ಲಿ ಫೈಥಾನ್ ಯಂತ್ರದಿಂದ ಗುಂಡಿ ಮುಚ್ಚುವ ಕಾರ್ಯ ನಡೆಯುತ್ತಿದ್ದು, ಅದನ್ನು ವೀಕ್ಷಿಸಿದರು."
152,ಆದರೂ ಈ ತಿಂಗಳ ಬಜೆಟ್ಟಿನಲ್ಲಿ ಒಂದೆರಡಾದರೂ ಗುಂಡಿ ತುಂಬಿಸದಿದ್ದರೆ ನಾನೆಂಬ ಪ್ರಜೆಗೆ ಊಟ ಮಾಡುವುದಕ್ಕೂ ತೊಂದರೆಯಾಗುವುದು ನಿಶ್ಚಿತವಿತ್ತು.
153,ಕೆ.ಎನ್.ಪಿ.ಆ್ಯಪ್ ಗಾಗಿ ಈ ಗುಂಡಿ ಒತ್ತಿರಿ
154,"ಫ್ಲೆಕ್ಸ್​, ಗುಂಡಿ ಆಯ್ತು, ಈಗ ಕಸದ ಸಮಸ್ಯೆನಾ..?"
155,ಗುಂಡಿ ಮಹಾಪ್ರಾಣಿ.
156,ಮಳೆ ನೀರು ಸರಾಗವಾಗಿ ಕಾಲುವೆಗೆ ಹರಿದು ಹೋಗುವುದರಿಂದ ರಸ್ತೆಯಲ್ಲಿ ಗುಂಡಿ ಬೀಳುವುದು ಕಡಿಮೆ ಆಗಲಿದೆ.
157,ಹುಬ್ಬಳ್ಳಿ–ಧಾರವಾಡ: ರಸ್ತೆ ಗುಂಡಿ ಮುಚ್ಚುವ ಕಾಮಗಾರಿ ವಾರದಲ್ಲಿ ಆರಂಭ
158,ಬೇರೆ ವಿಭಾಗದ ಅಧಿಕಾರಿಗಳನ್ನು ರಸ್ತೆ ಗುಂಡಿ ಮುಚ್ಚುವ ಕಾರ್ಯಕ್ಕೆ ಬಳಸಿಕೊಳ್ಳುತ್ತಿದ್ದೇವೆ.
159,ತನ್ನ ಗುಂಡಿ ತಾನೇ ತೋಡಿಕೊಂಡಿದ್ದ ಟೀಂ ಇಂಡಿಯಾ!
160,"ಗುಂಡಿ ಇರುವ ರಸ್ತೆಗಳ ಕಾರಣದಿಂದಾಗಿ 2016ರಲ್ಲಿ ಮರಣ ಹೊಂದಿರುವ ಸಂಖ್ಯೆಯನ್ನು ಹೋಲಿಸಿದರೆ, 2017ರಲ್ಲಿ ಎರಡರಷ್ಟು ಅಧಿಕಗೊಂಡಿದೆ."
161,ಕೆಲ ಹಳ್ಳಗಳಲ್ಲಿ ಆನೆಗಳು ಗುಂಡಿ ತೋಡಿ ನೀರು ಕುಡಿದು ಹೋಗಿರುತ್ತವೆ.
162,ಮುಚ್ಚಿದ ರಸ್ತೆ ಗುಂಡಿ ಪರಿಶೀಲಿಸಲು ನ್ಯಾಯಾಲಯದ ಆಯೋಗ ರಚನೆ
163,"ಕನಿಷ್ಠ ಪಕ್ಷ ಗುಂಡಿ ಮುಚ್ಚಿ, ಡಾಂಬರು ಹಾಕುವಷ್ಟು ಅನುದಾನವೂ ಪಾಲಿಕೆ ಬಳಿಯಿಲ್ಲವೇ ?"
164,ಅನುದಾನದ ಲಭ್ಯತೆಯನುಸಾರ ಆದ್ಯತೆಯ ಮೇಲೆ ಗುಂಡಿ ಮುಚ್ಚುವ ಕಾಮಗಾರಿಗಳನ್ನು ಕೈಗೆತ್ತಿಕೊಂಡು ಸುಗಮ ವಾಹನ ಸಂಚಾರಕ್ಕೆ ಅನುವು ಮಾಡಿಕೊಡಲಾಗುತ್ತಿದೆ.
165,ಈ ಗುಂಡಿ ಇವತ್ತು ಕಿತ್ತು ಹೋಗುತ್ತೆ ಅನ್ನಿಸಿತು.
166,ಕೆ.ಎನ್.ಪಿ.ಫೇಸ್ಬುಕ್ ಅಕೌಂಟ್ ಗಾಗಿ ಈ ಗುಂಡಿ ಒತ್ತಿರಿ
167,ಪ್ರಸ್ತುತ ಮರು-ಟ್ವೀಟ್‌ಗಾಗಿ ಗುಂಡಿ (ಬಟನ್) ಒಂದನ್ನು ಒದಗಿಸಲಾಗಿದೆ.
168,ಇಂಗು ಗುಂಡಿ ಹೇಗೆ?
169,ಗಂಭೀರ ಸಮಸ್ಯೆಯಾಗಿ ಪರಿಣಮಿಸಿರುವ ನಗರದ ರಸ್ತೆಗಳ ಗುಂಡಿ ಮುಚ್ಚುವ ಕಾರ್ಯವನ್ನು ಶೀಘ್ರದಲ್ಲಿ ಮಾಡುವುದಾಗಿ ಅಧ್ಯಕ್ಷರು ಭರವಸೆ ನೀಡಿದ್ದಾರೆ ಎಂದು ಶಿವುಮಾದಪ್ಪ ತಿಳಿಸಿದರು.
170,"ಇಲ್ಲಿನ ಅರಣ್ಯ, ಹನುಮಾನ ಗುಂಡಿ ಫಾಲ್ಸ್ ಮತ್ತಷ್ಟು ಸುಂದರವಾಗಿದೆ."
171,ಹೋಟೆಲ್​’ಗಳಿಗೆ ಪೈಪ್’ಲೈನ್ ಅಳವಡಿಸಲು ರಸ್ತೆ ಅಗೆಯಲು ಪರವಾನಿಗೆ ಕೊಟ್ಟ ಅಧಿಕಾರಿಗಳು ನಂತರ ಗುಂಡಿ ಮುಚ್ಚಿಸಿದ್ದಾರಾ ಎನ್ನುವ ಬಗ್ಗೆ ವಿಚಾರಿಸಿಲ್ಲ.
172,ಕೆಲವರು ಮನೆಗಳಿಗೆ ಕುಡಿಯುವ ನೀರಿನ ಸಂಪರ್ಕ ಪಡೆಯಲು ಗುಂಡಿ ತೆಗೆದು ಹಾಗೇ ಬಿಟ್ಟಿರುವುದರಿಂದ ರಾತ್ರಿ ವೇಳೆ ಓಡಾಲು ಕಷ್ಟವಾಗಿದೆ.
173,"ಬಾಗೇಪಲ್ಲಿ, ಫೆ.14: ಪಟ್ಟಣದ ಗೂಳೂರು ರಸ್ತೆಯ ಸ್ಪಂದನ ಅಸ್ಪತ್ರೆ ಹತ್ತಿರ ರಸ್ತೆಯ ಮಧ್ಯಭಾಗದಲ್ಲಿ ಒಳಚರಂಡಿ ಗುಂಡಿ ಮುರಿದಿರುವರಿಂದ ದ್ವಿಚಕ್ರವಾಹನ ಸವಾರರು ಪ್ರಾಣವನ್ನು ಮುಷ್ಟಿಯಲ್ಲಿಟ್ಟುಕೊಂಡು ಸಂಚರಿಸುವಂತಾಗಿದ್ದು, ಮ್ಯಾನ್ ಹೋಲ್ ದುರಸ್ತಿಗೆ ಸಾರ್ವಜನಿಕರು ಒತ್ತಾಯಿಸಿದ್ದಾರೆ."
174,ಒಂದೇ ರಾತ್ರಿಯಲ್ಲಿ 871 ಗುಂಡಿ ಮುಚ್ಚಿದ್ದೇವೆ : ಮೇಯರ್
175,ಮಕ್ಕಳನ್ನು ಗುಂಡಿ ತೋಡಲು ಬಳಸಿಕೊಳ್ಳಬಾರದು~ ಎಂದು ಆದೇಶಿಸಿದರು.
176,"ಶಾಸಕ ಆರ್.ಅಶೋಕ ಮಾತನಾಡಿ, ಗುಂಡಿ ಮುಚ್ಚದಿದ್ದರೆ ಚುನಾವಣೆಯಲ್ಲಿ ಬೆಂಗಳೂರಿಗರು ಬೇರೆ ಪಕ್ಷಗಳಿಗೆ ಎಲೆಕ್ಟ್ರಾನಿಕ್ ಮತಯಂತ್ರದ ಗುಂಡಿ ಒತ್ತುವ ಮೂಲಕ ಕಾಂಗ್ರೆಸ್‌ಗೆ ‘ಗುಂಡಿ’ ತೋಡುವುದು ನಿಶ್ಚಿತ."
177,ಬಿಳಿ ಬೆಕ್ಕು ಬಂದು ಗುಂಡಿ ತೋಡಿ ಮುಚ್ಚಿದ್ದ ಮಣ್ಣನ್ನು ಪಂಜದಿಂದ ಒಕ್ಕಿ ಚಿಕ್ಕದೊಂದು ಗುಂಡಿ ಮಾಡಿ ಆ ಗುಂಡಿಗೆ ಕಕ್ಕಸು ಬೀಳುವಂತೆ ಬುಕ್ಕಿತು.
178,ಕೆ.ಎನ್.ಪಿ.ಫೇಸ್ಬುಕ್ ಅಕೌಂಟ್ ಗಾಗಿ ಈ ಗುಂಡಿ ಒತ್ತಿರಿ
179,"ನಗರಸಭೆ ಆಯುಕ್ತ ರಾಮದಾಸ್ ಅವರನ್ನು ಸಂಪರ್ಕಿಸಿದಾಗ, `ಲಭ್ಯವಿರುವ ಗಟ್ಟಿಯಾದ ಇಟ್ಟಿಗೆ ಚೂರು, ಕಲ್ಲುಗಳಿದ್ದಲ್ಲಿ ಹೆಚ್ಚಿನ ಪ್ರಮಾಣದಲ್ಲಿ ಗುಂಡಿ ಇರುವ ರಸ್ತೆಗಳಲ್ಲಿ ಹಾಕಿ, ಸರಿಪಡಿಸಬೇಕು ಎಂದು ಸಿಬ್ಬಂದಿಗೆ ಸೂಚಿಸಲಾಗಿತ್ತು."
180,"ಆದರೆ, ಶೌಚಾಲಯ ಗುಂಡಿ ಮತ್ತು ಒಳಚರಂಡಿಗಳ ಸ್ವಚ್ಛತೆಗೆ ಮಾನವ ಬಳಕೆಗೆ ಕಡಿವಾಣ ಹಾಕಲು ಅಗತ್ಯ ಕ್ರಮಗಳನ್ನು ಕೈಗೊಳ್ಳಲು ಸರ್ಕಾರದ ಬಳಿ ಹಣವಿಲ್ಲ!"
181,ಸದನಕ್ಕೆ ಬರುವಾಗ ಸರಿಯಾಗಿ ಶರ್ಟ್​ ಗುಂಡಿ ಹಾಕಿ: ನೂತನ ಶಾಸಕರಿಗೆ ಸ್ಪೀಕರ್​ ಕ್ಲಾಸ್​ - Kannada Today - ಕನ್ನಡ ಟುಡೇ - Digital News
182,ಅರಣ್ಯ ಇಲಾಖೆಯಿಂದ ಸಸಿಗಳನ್ನು ನೆಡುವುದಕ್ಕೆ ಗುಂಡಿ ತೋಡಿದ ಕೆಲಸದಲ್ಲಿ ಎಡವಟ್ಟಾಗಿದೆ.
183,"ಗುಂಡಿ ಸತೋಡುವ ಚರ್ಚೆ ಸಾಕಷ್ಟು ಹೊತ್ತು ನಡೆದದ್ದು ಗಮನಿಸಿದ ಜಿಲ್ಲಾ ಪಂಚಾಯಿತಿ ಅಧ್ಯಕ್ಷ ಡಾ.ಬಿ.ಎನ್.ರವಿ, `ಗುಂಡಿ ತೋಡಲು ಜೆಸಿಬಿ ಬಳಸಬಹುದು."
184,ಆಸ್ಟ್ರೇಲಿಯಾದ ಕ್ವೀನ್ಸ್ ಲ್ಯಾಂಡ್‍ದ ನಿವಾಸಿಯಾದ ವನ್ಯಜೀವಿ ಉತ್ಸಾಹಿ ಬ್ಯೂ ಗ್ರೀವ್ಸ್ ಎಂಬಾತನಿಗೆ ಸಮುದ್ರದ ದಂಡೆಯ ಬಳಿ ಒಂದು ಗುಂಡಿ ಕಾಣಿಸಿಕೊಂಡಿದೆ.
185,ಕೆ.ಎನ್.ಪಿ.ಆ್ಯಪ್ ಗಾಗಿ ಈ ಗುಂಡಿ ಒತ್ತಿರಿ
186,ಕೆ.ಎನ್.ಪಿ.ಯುಟ್ಯೂಬ್ ಚಾನಲ್ ಗಾಗಿ ಈ ಗುಂಡಿ ಒತ್ತಿರಿ
187,"ಕಳೆದ ರಾತ್ರಿ ಶೂಟಿಂಗ್ ಮುಗಿಸಿಕೊಂಡು ರೇಂಜ್ ರೋವರ್ ಕಾರಿನಲ್ಲಿ ವಾಪಸ್ ಬರುತ್ತಿದ್ದ ವೇಳೆ ಈ ಅಪಘಾತ ಸಂಭವಿಸಿದ್ದು, ರಸ್ತೆಯಲ್ಲಿದ್ದ ಗುಂಡಿ ಕಾಣದ ಕಾರಣ ಈ ಅಪಘಾತ ನಡೆದಿದೆ ಎನ್ನಲಾಗಿದೆ."
188,ನನ್ನ ನಾ ನೋಡುವ ಗುಂಡಿ ಒತ್ತು
189,ಕೆ.ಎನ್.ಪಿ.ಫೇಸ್ಬುಕ್ ಅಕೌಂಟ್ ಗಾಗಿ ಈ ಗುಂಡಿ ಒತ್ತಿರಿ
190,2014-15 9 ವಾರ್ಡ್ ನಂ.7ರ ಕಮಲಮ್ಮನ ಗುಂಡಿ ಕಾವೇರಿ ಉದ್ಯಾನವನದ ಆಟದ ಮೈದಾನ ಅಭಿವೃದ್ಧಿ.
191,ಜಿಲ್ಲಾಧಿಕಾರಿ ಕಚೇರಿ ಹಿಂದಿನ ರಸ್ತೆಯಲ್ಲೆ ಗುಂಡಿ
192,ರಸ್ತೆ ಗುಂಡಿ ಮುಚ್ಚಲು ಬಿಬಿಎಂಪಿಗೆ ಮೂರು ದಿನ ಗಡುವು ನೀಡಿದ ಹೈಕೋರ್ಟ್‌
193,ಪೈಥಾನ್‌ ಯಂತ್ರಗಳ ಬಳಕೆ ಮಾಡಿ ಪಾಲಿಕೆಯು ಗುಂಡಿ ಮುಚ್ಚುವ ಕೆಲಸ ಆರಂಭಿಸಿದ್ದೇವೆ ಎಂದು ಬಿಬಿಎಂಪಿಯ ಮಾಹಿತಿ ತಂತ್ರಜ್ಞಾನ ವಿಭಾಗದ ಅಧಿಕಾರಿಯೊಬ್ಬರು ತಿಳಿಸಿದರು.
194,ಕೆ.ಎನ್.ಪಿ.ಯುಟ್ಯೂಬ್ ಚಾನಲ್ ಗಾಗಿ ಈ ಗುಂಡಿ ಒತ್ತಿರಿ
195,ಗುಂಡಿ ಯನ್ನು ತೋಡುವವನು ತಾನೇ ಅದರಲ್ಲಿ ಬೀಳುತ್ತಾನೆ; ಕಲ್ಲು ಹೊರಳಿಸುವವನ ಮೇಲೆಯೇ ಅದು ತಿರಿಗಿ ಹೊರಳುವದು.
196,ಮುಚ್ಚಿದ ರಸ್ತೆ ಗುಂಡಿ ಪರಿಶೀಲಿಸಲು ನ್ಯಾಯಾಲಯದ ಆಯೋಗ ರಚನೆ
197,ಗುಂಡಿ - ವಿಕಿಪೀಡಿಯ
198,"ಒಮ್ಮೆ ದುರಸ್ತಿ ಮಾಡಿ, ಬಳಿಕ ಅಲ್ಲೇ ಮತ್ತೊಂದು ಕಾಮಗಾರಿಗೆ ಗುಂಡಿ ಅಗೆದು ಹಾಳು ಮಾಡುವುದೂ ನಡೆಯುತ್ತಲೇ ಇರುತ್ತದೆ."
199,ಡಾಂಬರಿನ ಮೇಲ್ಪದರ ಕಿತ್ತು ಹೋಗಿದ್ದರೆ ಅದನ್ನು ರಸ್ತೆ ಗುಂಡಿ ಎಂದೇ ಪರಿಗಣಿಸಲಾಗುತ್ತದೆ.
200,ಹಳಿಯಾಳ ರಸ್ತೆಯ ಪಕ್ಕದಲ್ಲಿರುವ ಹಳ್ಳಿಗೇರಿಯಲ್ಲಿ ಕಾಡು ಪ್ರಾಣಿ-ಪಕ್ಷಿಗಳಿಗೆ ಮೀಸಲಿಟ್ಟು ಪುಟ್ಟ ನೀರಿನ ಗುಂಡಿ ನಿರ್ಮಿಸಿದ್ದಾರೆ.
201,ಈ ಗ್ರಾಮದ ಪ್ರತಿಯೊಬ್ಬರು ಇಂಗು ಗುಂಡಿ ಮತ್ತು ಸಿಮೆಂಟ್‌ನಿಂದ ತಯಾರಾದ ಟ್ಯಾಂಕ್‌ಗಳಲ್ಲಿ ಮಳೆ ನೀರನ್ನು ಸಂಗ್ರಹಿಸುವ ಮೂಲಕ ಮಳೆ ನೀರನ್ನು ಸಂರಕ್ಷಿಸುತ್ತಾರೆ.
202,ಅದರ ನಂತರ 2012 ರಲ್ಲಿ ಒಂದು ಬಾರಿ ಅಲ್ಲಲ್ಲಿ ಹೊಂಡ- ಗುಂಡಿ ಬಿದ್ದ ಕಡೆಗೆ ಪ್ಯಾಚ್‌ವರ್ಕ್‌ ಮಾಡಲಾಗಿತ್ತು.
203,ಸೆ.24ರೊಳಗೆ ಗುಂಡಿ ಮುಕ್ತ ಬೆಂಗಳೂರು: ಹೈಕೋರ್ಟ್ ಡೆಡ್ ಲೈನ್
204,"ಊರು ಪಕ್ಕದ ನದಿಯಲ್ಲಿ ನೀರು ಬತ್ತಿದಾಗ, ನದಿ ಪಾತ್ರದಲ್ಲಿ ಗುಂಡಿ ತೋಡಿ ‘ಒರ್ತಿ ತೆಗೆಯುವುದು’ ನೀರನ್ನು ಪಡೆಯುವ ವಿಧಾನ ನಮ್ಮ ಕಣ್ಣ ಮುಂದಿದೆ."
205,ಕೆ.ಎನ್.ಪಿ.ಫೇಸ್ಬುಕ್ ಅಕೌಂಟ್ ಗಾಗಿ ಈ ಗುಂಡಿ ಒತ್ತಿರಿ
206,ಕನ್ನಡ: ಗುಂಡಿ
207,"ದೇವಾಲಯದ ಆವರಣದಲ್ಲಿ ನಿಧಿ ಇದೆ ಎಂದು ಜೋತಿಷಿಯೊಬ್ಬರು ಹೇಳಿದ್ದಾರೆ ಎಂದು ಹಾರೆ, ಸಲಾಕೆಗಳಿಂದ ಗುಂಡಿ ತೆಗೆಯುತ್ತಿದ್ದಾಗ ಆರೋಪಿಗಳು ಗ್ರಾಮಸ್ಥರ ಕಣ್ಣಿಗೆ ಬಿದ್ದಿದ್ದಾರೆ."
208,ಇಂಗು ಗುಂಡಿ ನಿರ್ಮಾಣ ಎಲ್ಲರ ಜವಾಬ್ದಾರಿ: ವಿಜಯ್ ಕುಮಾರ್
209,ಒಂದು ಗುಂಡಿ ತೋಡಿ ಒಂದಿಷ್ಟು ಕಡ್ಡಿ ರಾಶಿ ಹಾಕಿ ಸೀಮೆಎಣ್ಣೆ ಸುರಿದು ಬೆಂಕಿಹಚ್ಚಿದರು‘ ಎಂಬುದು ಪೊಲೀಸ್‌ ಮೂಲಗಳ ಮಾಹಿತಿ.
210,ಮುಚ್ಚಿದ ರಸ್ತೆ ಗುಂಡಿ ಪರಿಶೀಲಿಸಲು ನ್ಯಾಯಾಲಯದ ಆಯೋಗ ರಚನೆ
211,"ಆದರೆ ಬರೀ ನೆಲದಲ್ಲಿ ಗುಂಡಿ ತೋಡಿ ಅಲ್ಲಿ ವೇದಿಕೆ ಸೃಷ್ಟಿಸಿ, ಸಾವಿರಾರು ಜನರನ್ನು ಸೇರಿಸಿ, ಅವರಿಗೆ ಸತ್ಯದ ಪಾಠ ಹೇಳುವ ಕೆಲಸ ಇದೆಯಲ್ಲ, ಅದು ಲಕ್ಷದಲ್ಲಿ ಒಬ್ಬರಿಂದ ಮಾತ್ರ ಸಾಧ್ಯ."
212,ಸೆ.24ರೊಳಗೆ ಗುಂಡಿ ಮುಕ್ತ ಬೆಂಗಳೂರು: ಹೈಕೋರ್ಟ್ ಡೆಡ್ ಲೈನ್
213,ಅಮ್ಮ ನಸುನಗುತ್ತಾ ಕುತೂಹಲದಿಂದ ಗುಂಡಿ ಒತ್ತಿದರು.
214,ಮಳೆ ನೀರು ಹಿಡಿದಿಡಲು ನಿಗದಿಪಡಿಸಿದ ಪ್ರದೇಶಕ್ಕೆ ಅನುಗುಣವಾಗಿ ಸಾಮಾನ್ಯ ಗಾತ್ರದ ಗುಂಡಿ ತೋಡಿಕೊಳ್ಳಬೇಕು.
215,ಕೊಚ್ಚೆ ಗುಂಡಿ ನಿರ್ಮಿಸೋದು ಅಸ್ಟು ಸುಲಭ ಅಲ್ಲ ಅಲ್ವ ?
216,"ಗ್ರಾಮಾಂತರ ಪ್ರದೇಶಗಳಲ್ಲಿ ಅಲ್ಲಲ್ಲಿ ಕೇವಲ ಗುಂಡಿ ತೋಡಿ, ಕಾಲುವೆಗಳ ಮೂಲಕವೂ ಹಾಗೆಯೇ ನೀರಿಂಗಿಸಲಡ್ಡಿಯಿಲ್ಲ."
