Index,Sentence
217,"ಶರ್ಟ್​ಗಳ ಗುಂಡಿ ಹಾಕಿಕೊಂಡು ಬರಬೇಕು ಎಂದು ಶಾಸಕರಿಗೆ ಶಿಸ್ತಿನ ಪಾಠ ಮಾಡಿದ್ದಾರೆ, ಮೊದಲ ಬಾರಿಗೆ 61 ಶಾಸಕರು ಆಯ್ಕೆಯಾಗಿದ್ದು, ವಿಧಾನ ಪರಿಷತ್‌ನ 17 ಸದಸ್ಯರು ಸೇರಿ ಒಟ್ಟು 78 ಶಾಸಕರಿಗೆ ವಿಧಾನಸಭೆ, ಪರಿಷತ್‌ ನಡಾವಳಿಗಳ ಬಗ್ಗೆ ಹಿರಿಯ ಶಾಸಕರೂ ಆದ ಸ್ಪೀಕರ್ ಪಾಠ ಮಾಡಿದರು."
218,ಕೆ.ಎನ್.ಪಿ.ಆ್ಯಪ್ ಗಾಗಿ ಈ ಗುಂಡಿ ಒತ್ತಿರಿ
219,ಕೆ.ಎನ್.ಪಿ.ಆ್ಯಪ್ ಗಾಗಿ ಈ ಗುಂಡಿ ಒತ್ತಿರಿ
220,ಡಿಪೋ ಕಂಪೌಂಡ್ ಕಟ್ಟಲು ಗುಂಡಿ ತಗೆಯಲಾಗಿತ್ತು.
221,ಇದನ್ನು ಬಳಸುವುದರಿಂದ ನಮ್ಮಷ್ಟಕ್ಕೇ ನಾವೇ ಗುಂಡಿ ತೋಡಿಕೊಂಡ ರೀತಿ.
222,ರಸ್ತೆ ಗುಂಡಿ ಮುಚ್ಚಲು ಬಿಬಿಎಂಪಿಗೆ ಮೂರು ದಿನ ಗಡುವು ನೀಡಿದ ಹೈಕೋರ್ಟ್‌
223,ತನ್ನ ಗುಂಡಿ ತಾನೇ ತೋಡಿಕೊಂಡಿದ್ದ ಟೀಂ ಇಂಡಿಯಾ!
224,"ಮಧ್ಯಾನ ಊಟವಾದ ಮೇಲೆ, ಕುರ್ಚಿಯಲ್ಲಿ ಕುಳಿತು ಕೆಲಸ ಮಾಡುತಿದ್ದಾಗ, ಶರಟಿನ ಮಧ್ಯದ ಭಾಗ ಮುಂದೆ ಬಂದು ಒಳಗಿನ ಬನಿಯನ್ ಕಾಣಿಸುತಿತ್ತು, ಗುಂಡಿ ಕಿತ್ತು ಹೋಗಿದೆ ಎಂಬ ಅರಿವು ಬಂದ ತಕ್ಷಣ, ನಾನು ಕುಳಿತಿದ್ದ ಕುರ್ಚಿಯ ಸುತ್ತಾಮುತ್ತಾ ನೋಡಿದೆ, ನನ್ನ ಟೇಬಲ್ ಕೆಳಗಡೆ ಬಗ್ಗಿ ನೋಡಿದೆ ಎಲ್ಲೂ ಗುಂಡಿ ಕಾಣಿಸಲಿಲ್ಲ, ನಾನು ಸಾಮಾನ್ಯ ನಡೆಯುವ ದಾರಿಗಳಲ್ಲೆಲ್ಲಾ ಹೋಗಿ ಬಂದೆ, ಎಲ್ಲೂ ಕಾಣಿಸಲಿಲ್ಲಾ."
225,ರಾಷ್ಟ್ರೀಯ ಹೆದ್ದಾರಿ ಸೀತಾನದಿಯಲ್ಲಿ ರಸ್ತೆಯ ಮಧ್ಯೆ ಬೃಹತ್ ಗುಂಡಿ ಬಿದ್ದಿದೆ.
226,ಸ್ಟ್ರೀಮಿಂಗ್‌ ಗುಂಡಿ ಒತ್ತಿ.
227,ಕೆ.ಎನ್.ಪಿ.ಆ್ಯಪ್ ಗಾಗಿ ಈ ಗುಂಡಿ ಒತ್ತಿರಿ
228,ಕೆ.ಎನ್.ಪಿ.ಯುಟ್ಯೂಬ್ ಚಾನಲ್ ಗಾಗಿ ಈ ಗುಂಡಿ ಒತ್ತಿರಿ
229,"ಅನಂತಪದ್ಮನಾಭನ ಕಡುಶರ್ಕರ ಪಾಕದ ಮೂಲವಿಗ್ರಹ, ಆತನ ಗರ್ಭ ಗುಡಿಯಲ್ಲಿರುವ ಸಾವಿರಾರು ವರ್ಷಗಳ ಹಿಂದಿನ ಬಣ್ಣದ ಚಿತ್ರ ಚಿತ್ತಾರಗಳು, ದೇವಸ್ಥಾನದ ಸುತ್ತ ಇರುವ ಸರ್ಪಕೋಟೆ, ಗುಂಡಿ ಬಟ್ಟಲಿನಾಕಾರದ ಅಲ್ಲಿನ ಪರಿಸರ ಎಲ್ಲವೂ ನನ್ನನ್ನು ಸಂಪೂರ್ಣ ಆವರಿಸಿಕೊಂಡುಬಿಟ್ಟಿತು."
230,"ಕರಾವಳಿ, ಮಲೆನಾಡು ಸೇರಿದಂತೆ ನಾನಾ ಕಡೆ ಮಳೆ ಸುರಿದು ರಸ್ತೆಗಳು ಹಾಳಾಗಿ ಅನೇಕ ಕಡೆ ಗುಂಡಿ ಬಿದ್ದಿವೆ, ಮನೆ ಕುಸಿದು ಬಿದ್ದಿವೆ."
231,ಕೆ.ಎನ್.ಪಿ.ಯುಟ್ಯೂಬ್ ಚಾನಲ್ ಗಾಗಿ ಈ ಗುಂಡಿ ಒತ್ತಿರಿ
232,"ರಸ್ತೆ ಬದಿಯಿದ್ದ ಗುಂಡಿ ತಪ್ಪಿಸಲು ಹೋಗಿ ಬೈಕ್ ಮೇಲೆ ಬಿದ್ದ ಟ್ರಕ್ , ಟ್ರಕ್ ಬಿದ್ದ ಪರಿಣಾಮ ಸವಾರರಿಬ್ಬರು ಸ್ಥಳದಲ್ಲೇ ದುರ್ಮರಣ ಶಂಕೆ, ದೊಡ್ಡಬಳ್ಳಾಪುರ ತಾಲೂಕಿನ ಕೋಲಿಗೆರೆ ಗೇಟ್ ಬಳಿ ನಡೆದ ಘಟನೆ , ಬೆಂಗಳೂರು ಗ್ರಾಮಾಂತರ ಜಿಲ್ಲೆ ದೊಡ್ಡಬಳ್ಳಾಪುರ ತಾಲೂಕಿನ ಗ್ರಾಮ."
233,"ಸುಮಾರು ಹದಿನೈದು ವರ್ಷಗಳ ಹಿಂದೆ ಗೌಡ್ರು ಮನೆತನದವರು ತಮ್ಮ ಮನೆಯಲ್ಲಿ ಶೌಚಾಯಲ ಕಟ್ಟಿಿಸಿಬೇಕೂಂತ ತೀರ್ಮಾನ ಮಾಡಿ, ಮನೆಮುಂದೆ ಗುಂಡಿ ತೋಡಿದ್ದರು."
234,ಕೆ.ಎನ್.ಪಿ.ಆ್ಯಪ್ ಗಾಗಿ ಈ ಗುಂಡಿ ಒತ್ತಿರಿ
235,"ಶಾಶ್ವತ ಪರಿಹಾರಕ್ಕೆ ಡೆಂಡರ್‌ ಶ್ಯೂರ್ ರಸ್ತೆ ಗುಂಡಿಗಳನ್ನು‌ ಮುಚ್ಚುವುದು ಒಂದೆಡೆಯಾದರೆ, ಗುಂಡಿ ಬೀಳದಂತಹ ರಸ್ತೆ ನಿರ್ಮಾಣ ಕಾರ್ಯ ಕೂಡ ನಡೆಯುತ್ತಿದೆ."
236,ಕೆ.ಎನ್.ಪಿ.ಯುಟ್ಯೂಬ್ ಚಾನಲ್ ಗಾಗಿ ಈ ಗುಂಡಿ ಒತ್ತಿರಿ
237,ಕೆ.ಎನ್.ಪಿ.ಫೇಸ್ಬುಕ್ ಅಕೌಂಟ್ ಗಾಗಿ ಈ ಗುಂಡಿ ಒತ್ತಿರಿ
238,ಮುಚ್ಚಿದ ರಸ್ತೆ ಗುಂಡಿ ಪರಿಶೀಲಿಸಲು ನ್ಯಾಯಾಲಯದ ಆಯೋಗ ರಚನೆ
239,"ಜನರ ಒತ್ತಡ, ಮಾಧ್ಯಮಗಳಲ್ಲಿ ನಿತ್ಯವೂ ರಸ್ತೆ ಸಮಸ್ಯೆ ಬಿತ್ತರವಾಗುತ್ತಿರುವುದರ ಪರಿಣಾಮ ಬಿಬಿಎಂಪಿ ಗುಂಡಿ ಮುಚ್ಚಲು ಮುಂದಾಗಿದೆ."
240,"ವಿಜಯಪುರದ ಸಿಂದಗಿ ಮೂಲದ ಪರಶುರಾಮ್ ವಾಗ್ಲೋರೆ(25) ಎಂಬಾತನನ್ನು ಪೊಲೀಸರು ಬಂಧಿಸಿದ್ದು, ಈತನೇ ಗೌರಿ ಲಂಕೇಶ್ ಅವರಿಗೆ ಗುಂಡಿ ಹರಿಸಿದವ ಎಂದು ಪೊಲೀಸರು ಶಂಕೆ ವ್ಯಕ್ತಪಡಿಸಿದ್ದಾರೆ."
241,‘ಬಸ್‌ ನಿಲ್ದಾಣ ಮುಂಭಾಗದ ಗುಂಡಿ ಮುಚ್ಚಿ.
242,ಮಳೆಗಾಲದಲ್ಲಿ ಕಾಫಿ ತೋಟದ ಮರದ ದಿಮ್ಮಿಗಳನ್ನು ಇದೇ ರಸ್ತೆಯ ಮೂಲಕ ಸಾಗಿಸುವುದರಿಂದ ರಸ್ತೆ ಗುಂಡಿ ಬಿದ್ದಿದೆ.
243,"ಹೀಗಾಗಿ ರಸ್ತೆಗಳು ಗುಂಡಿ ಬೀಳುತ್ತಿದ್ದು, ರಸ್ತೆ ಅಕ್ಕಪಕ್ಕದಲ್ಲಿ ದೂಳು ತುಂಬಿಕೊಳ್ಳುತ್ತಿದೆ."
244,ಅದ್ರಲ್ಲಿ ಮಧ್ಯ ಮಧ್ಯ ಒಂದು ೩ ಸೆಂಟೀ ಮೀಟರ್ ಅಷ್ಟು ಆಳದ ಗುಂಡಿ ಕೊರದ್ದ ೨-೩ ಅಡಿ ಬಿಟ್ಬಿಟ್ಟು..
245,ಒಂದೇ ರಾತ್ರಿಯಲ್ಲಿ 871 ಗುಂಡಿ ಮುಚ್ಚಿದ್ದೇವೆ : ಮೇಯರ್
246,ಕೆ.ಎನ್.ಪಿ.ಯುಟ್ಯೂಬ್ ಚಾನಲ್ ಗಾಗಿ ಈ ಗುಂಡಿ ಒತ್ತಿರಿ
247,ಕೆ.ಎನ್.ಪಿ.ಆ್ಯಪ್ ಗಾಗಿ ಈ ಗುಂಡಿ ಒತ್ತಿರಿ
248,← ಒಂದೇ ರಾತ್ರಿಯಲ್ಲಿ 871 ಗುಂಡಿ ಮುಚ್ಚಿದ್ದೇವೆ : ಮೇಯರ್
249,ಹಾಟ್‍ಮಿಕ್ಸ್ ಬಳಸಿ ಗುಂಡಿ ಮುಚ್ಚಿದರೆ ಕನಿಷ್ಠ ಒಂದೆರಡು ವರ್ಷ ರಸ್ತೆಗಳು ಚೆನ್ನಾಗಿರುತ್ತವೆ.
250,"ಟೆಕ್ಸಾಸ್ ಎ ಮತ್ತು M ಯೂನಿವರ್ಸಿಟಿ TAMU ಸಮಗ್ರತಾ ದೃಷ್ಟಿ ಗಾರ್ಡನ್ನಲ್ಲಿ Larkdaisy (ಬ್ರೆಜಿಲ್ ಗುಂಡಿ ಫ್ಲೋವೆರ್, Centratherum ಮಾಧ್ಯಮ, Centratherum punctatum)."
251,ರಸ್ತೆ ಗುಂಡಿ ಮುಚ್ಚಲು ಬಿಬಿಎಂಪಿಗೆ ಮೂರು ದಿನ ಗಡುವು ನೀಡಿದ ಹೈಕೋರ್ಟ್‌
252,ರಸ್ತೆ ಗುಂಡಿ ಮುಚ್ಚಲು ಕ್ರಿಸ್ಮಸ್‌ ಗಡುವು
253,ನೀವು ಗುಂಡಿ ಒತ್ತಿದ ತಕ್ಷಣವೇ ಗಣಕ ತನ್ನಲ್ಲಿ ಈ ಕಾರ್ಯಾಚರಣ ವ್ಯವಸ್ಥೆ ಎಲ್ಲಿ ಶೇಖರವಾಗಿದೆ ಎಂದು ಹುಡುಕಿ ಅದನ್ನು ಪ್ರಾರಂಭಿಸುತ್ತದೆ.
254,ಕೆ.ಎನ್.ಪಿ.ಆ್ಯಪ್ ಗಾಗಿ ಈ ಗುಂಡಿ ಒತ್ತಿರಿ
255,ಮೊದಲೇ ಸೆಟ್‌ ಆಗಿರುವ ಚಾನೆಲ್‌ ಬರಲು ಸ್ಟ್ರೀಮಿಂಗ್‌ ಎಂಬ ಗುಂಡಿ ಒತ್ತಿ ಅಥವಾ ಸ್ಟ್ರೀಮಿಂಗ್‌ ಎಂದು ಬರೆದಿರುವುದರ ಬಲಗಡೆಯಲ್ಲಿ ಡೌನ್‌ ಆ್ಯರೊ (ಕೆಳಗೆ ಮುಖಮಾಡಿರುವ ಬಾಣದ ಗುರುತು) ಒತ್ತಿ.
256,ಕೆ.ಎನ್.ಪಿ.ಫೇಸ್ಬುಕ್ ಅಕೌಂಟ್ ಗಾಗಿ ಈ ಗುಂಡಿ ಒತ್ತಿರಿ
257,"ನಿಮ್ಮ ಪಕ್ಕದ ಮನೆ ಮುಂದೆ ಒಂದು ಗುಂಡಿ ತೋಡಿ, ಅದರಲ್ಲಿ ಒಂದು ಬೀದಿ ನಾಯಿ ನ ಹಾಕಿ."
258,ಕೆ.ಎನ್.ಪಿ.ಆ್ಯಪ್ ಗಾಗಿ ಈ ಗುಂಡಿ ಒತ್ತಿರಿ
259,ಹುಬ್ಬಳ್ಳಿ : ವರ್ಷದಿಂದ ವರ್ಷಕ್ಕೆ ಕುಸಿತ ಕಾಣುತ್ತಿರುವ ಅಂತರ್ಜಲ ಮಟ್ಟ ಹೆಚ್ಚಿಸುವ ನಿಟ್ಟಿನಲ್ಲಿ ರಾಜ್ಯದಲ್ಲಿ ಇದೇ ಪ್ರಪ್ರಥಮ ಬಾರಿಗೆ ಧಾರವಾಡ ಜಿಲ್ಲಾ ಪಂಚಾಯಿತಿ ಪ್ರತಿ ಮನೆಯಂಗಳದಲ್ಲಿ ಇಂಗು ಗುಂಡಿ ಸ್ಥಾಪಿಸುವ ಇಂಗು ಗುಂಡಿ ಮಾದರಿ ಗ್ರಾಮ ಎನ್ನುವ ಮಹತ್ವದ ಯೋಜನೆ ರೂಪಿಸಿದೆ.
260,ಕೆ.ಎನ್.ಪಿ.ಫೇಸ್ಬುಕ್ ಅಕೌಂಟ್ ಗಾಗಿ ಈ ಗುಂಡಿ ಒತ್ತಿರಿ
261,"ಸ್ವಲ್ಪ ಪಕ್ಕದಲ್ಲೇ ಇನ್ನೊಂದು ಗುಂಡಿ ತೋಡಿದೆ, ಒಂದೆರೆಡು ಅಡಿ ಗುಂಡಿ ತೆಗೆದೊಡನೆ ನೀರು ಜಿನುಗಲು ಪ್ರಾರಂಭಿಸಿತು."
262,ನಿನ್ನೆಯೇ ಗುಂಡಿ ತೋಡುವ ಕೆಲಸ ಮುಗಿದಿತ್ತು.
263,ಕೆ.ಎನ್.ಪಿ.ಯುಟ್ಯೂಬ್ ಚಾನಲ್ ಗಾಗಿ ಈ ಗುಂಡಿ ಒತ್ತಿರಿ
264,ಒಡೆದ ನೀರಿನ ಕೊಳವೆ: ಹೆದ್ದಾರಿಯಲ್ಲಿ ಗುಂಡಿ
265,ಬೆಂಗಳೂರಿನ ರಸ್ತೆ ಗುಂಡಿ ಮುಚ್ಚುವ ಅಭಿಯಾನ ನಡೆಸುತ್ತಿರುವ ಬಿ.ಪ್ರತಾಪ್
266,ಬೆಂಗಳೂರಿನ ಯಾವ ಏರಿಯಾದಲ್ಲಿ ಗುಂಡಿ ಇದ್ದರೂತಪ್ಪದೆ ಆ ಗುಂಡಿ ಇರುವ ಲೋಕೆಷನ್ ಮತ್ತು ಪೋಟೋ ವನ್ನು ನಮ್ಮ ಈ ನಂಬರಿಗೆ ಕಳಿಸಿಕೊಡಿ 9164881858 ನಾವು ಆ ಗುಂಡಿಯನ್ನು ಮುಚ್ಚುತ್ತೇವೆ.
267,ಒಂದು ಗುಂಡಿ ಒತ್ತಿದರೆ ಸಾಕು.
268,ಕೆ.ಎನ್.ಪಿ.ಫೇಸ್ಬುಕ್ ಅಕೌಂಟ್ ಗಾಗಿ ಈ ಗುಂಡಿ ಒತ್ತಿರಿ
269,ಗುಂಡಿ ಬೀಳದಂಥ ರಸ್ತೆ‌ ನಿರ್ಮಾಣಕ್ಕೆ ಈಗಾಗಲೇ ವೈಟ್‌ಟಾಪಿಂಗ್ ಮಾಡಿಸಲಾಗುತ್ತಿದೆ.‌ ಈ ರಸ್ತೆ 25 ವರ್ಷಕ್ಕೂ ಹೆಚ್ಚು ವರ್ಷ ಬಾಳಿಕೆ ಬರಲಿದೆ.
270,ಬೆಂಗಳೂರು ನಗರದ ರಸ್ತೆಗಳ ಗುಂಡಿ ಮುಚ್ಚಲು ವಿಫಲವಾದ ಬಿಬಿಎಂಪಿಯ ಕ್ರಮವನ್ನು ಹೈಕೋರ್ಟ್‌ ಮಂಗಳವಾಗ ಹಿಗ್ಗಾಮುಗ್ಗಾ ತರಾಟೆಗೆ ತೆಗೆದುಕೊಂಡಿದೆ.
271,ಅಗೆದ ಭಾಗವನ್ನು ಸರಿಯಾಗಿ ಮುಚ್ಚದ ಕಾರಣ ಮಳೆ ನೀರು ನಿಂತು ಗುಂಡಿ ನಿರ್ಮಾಣವಾಗುತ್ತದೆ.
272,ಟಾಯ್ಲೆಟ್ ಗುಂಡಿ ತೋಡಿದ ಅಕ್ಷಯ್ ಕುಮಾರ್
273,"‘ಬೇರು ಸಹಿತ ಮರವನ್ನು ಕಿತ್ತು, ನಿಗದಿತ ಜಾಗದಲ್ಲಿ ಗುಂಡಿ ತೋಡಿ, ಗೊಬ್ಬರ ಹಾಗೂ ರೂಟ್ ಪ್ಲಾಂಟೇಶನ್ ಮಾಡಿ ನೆಡಲಾಯಿತು."
274,"ಅಲ್ಲದೆ, ಈಗಾಗಲೇ ಗುಂಡಿ ಮುಚ್ಚಿರುವ ಕಾಮಗಾರಿಯ ಗುಣಮಟ್ಟ ಪರಿಶೀಲನೆ ನಡೆಸಲು ಇಬ್ಬರು ಕಮಿಷನರ್‌ಗಳನ್ನು ನೇಮಿಸಿ ಸಮಗ್ರ ವರದಿ ನೀಡುವಂತೆ ಆದೇಶಿಸಿದೆ."
275,ಗುಂಡಿ ಕಂಡಲ್ಲಿ ತಕ್ಷಣವೇ ಕ್ರಮ ಕೈಗೊಳ್ಳುವಂತೆ ಅಧಿಕಾರಿಗಳಿಗೆ ನಿರ್ದೇಶಿಸಿದ್ದೇವೆ.
276,ಕೆ.ಎನ್.ಪಿ.ಆ್ಯಪ್ ಗಾಗಿ ಈ ಗುಂಡಿ ಒತ್ತಿರಿ
277,"dining hallನಲ್ಲಿ ನಮ್ಮ study hours,ಪವರ್ ಇಲ್ಲದ ರಾತ್ರಿ ಮತ್ತು ಸೂಪರ್ ಶ್ರುತಿಯವರ fitting ಗುಂಡಿ :)"
278,ಸತತ ಮಳೆ ಸುರಿಯುತ್ತಿದ್ದ ಕಾರಣ ರಸ್ತೆ ಗುಂಡಿ ಮುಚ್ಚುವ ಕಾಮಗಾರಿಯನ್ನು ಮುಂದೂಡಲಾಗುತ್ತಿತ್ತು.
279,ಅನಗತ್ಯವಾಗಿ ಹರಿದು ಹೋಗುವ ನೀರನ್ನು ಗುಂಡಿ ಮೂಲಕ ಭೂಮಿಗೆ ಇಂಗುವಂತೆ ಮಾಡಬೇಕು.
280,ಮಾನವನಾಗಿ ಹುಟ್ಟಿದ ಮೇಲೆ ಏನೇನ್ ಕಂಡಿ ಸಾಯದ್ರಲ್ಲಿ ಒಮ್ಮೆ ನೋಡು ಜೋಗದ ಗುಂಡಿ ಎಂಬ ನಟ ಗಾಯಕ ಡಾ.
281,ಆದರೆ ಈಗ ಏಕಾಏಕಿ ಕೇಬಲ್ ಅಳವಡಿಸಲು ಕಾಂಕ್ರಿಟ್ ರಸ್ತೆಯ ಇಕ್ಕೆಲಗಳಲ್ಲಿ ಗುಂಡಿ ತೋಡುತ್ತಿರುವುದು ಸಾರ್ವಜನಿಕರ ಆಕ್ರೋಶಕ್ಕೆ ಕಾರಣವಾಗಿದೆ.
282,"ಗುಂಡಿ ಮುಚ್ಚುವ ಕಾರ್ಯ, ಬಿಬಿಎಂಪಿಗೆ ಸೋಮವಾರವೇ ಡೆಡ್​ಲೈನ್​..!"
283,ಉತ್ತರ ಪ್ರದೇಶದ ಪೌರಸಂಸ್ಥೆಗಳ ಚುನಾವಣಾ ಮತಗಟ್ಟೆಗಳಲ್ಲಿ ಇವಿಎಂ ಯಂತ್ರಗಳಲ್ಲಿನ ದೋಷದಿಂದಾಗಿ ಯಾವ ಗುಂಡಿ ಒತ್ತಿದರೂ ಬಿಜೆಪಿಗೆ ಮತ.
284,"ಹತ್ತಿರದಲ್ಲೇ ಎಲ್ಲಾದರೂ ಗುಂಡಿ ತೋಡ ಹೂಣಬೇಕೆಂದರೆ ಆರಡಿ ಉದ್ದದ, ನಾಲ್ಕಡಿ ಆಳದ ಗುಂಡಿ ತೋಡಲು ಜನರು ಸಿಗುವುದಿಲ್ಲ."
285,"ಶ್ರೀನಗರ, ಜ.16-ಕಾಶ್ಮೀರ ಕಣಿವೆಯ ಅನಂತ್‍ನಾಗ್ ಜಿಲ್ಲೆಯಲ್ಲಿ ನಿನ್ನೆ ರಾತ್ರಿಯಿಡೀ ನಡೆದ ಭೀಕರ ಗುಂಡಿ ಕಾಳಗದಲ್ಲಿ ನಿಷೇಧಿತ ಹಿಜ್‍ಬುಲ್ ಮುಜಾಹಿದ್ದೀನ್ (ಎಚ್‍ಎಂ) ಉಗ್ರಗಾಮಿ ಸಂಘಟನೆಯ ಮೂವರು ಉಗ್ರರನ್ನು ಭದ್ರತಾ"
286,"ತೋಟಗಾರಿಕೆ ಚಟುವಟಿಕೆಗೆ ಬೇಕಾದ ಟ್ರ್ಯಾಕ್ಟರ್‌, ಪವರ್ ಟಿಲ್ಲರ್, ಸ್ಪ್ರೇಯರ್, ಬಾಳೆ ಗುಂಡಿ ಕೀಳುವ ಸಾಧನ, ಮಲ್ಚಿಂಗ್ ಶೀಟ್, ಕ್ರೇಟ್ಸ್‌ ಸೇರಿ ಹಲವು ಸವಲತ್ತುಗಳನ್ನು ರಿಯಾಯಿತಿ ದರದಲ್ಲಿ ಬಾಡಿಗೆ ಮತ್ತು ಮಾರಾಟ ಮಾಡಲಾಗುತ್ತಿದೆ."
287,ರಾಜ್ಯದ ಜನತೆಗೆ ಸಿಎಂ ಸಿದ್ದರಾಮಯ್ಯ ಅವರಿಂದ ರಸ್ತೆ ಗುಂಡಿ ಭಾಗ್ಯ : ಯಡಿಯೂರಪ್ಪ ಲೇವಡಿ
288,"ಬೆಂಗಳೂರು, ಅ.11- ನಗರದ ರಸ್ತೆಗಳು ಗುಂಡಿ ಬಿದ್ದು 8 ಅಮಾಯಕರು ಪ್ರಾಣ ಕಳೆದುಕೊಂಡಿದ್ದರೂ ಕಣ್ಮುಚಿ ಕುಳಿತಿರುವ ಕಾಂಗ್ರೆಸ್ ಆಡಳಿತ ಧೋರಣೆಯನ್ನು ಖಂಡಿಸಿ ಮಾಜಿ ಡಿಸಿಎಂ ಆರ್.ಅಶೋಕ್ ನೇತೃತ್ವದಲ್ಲಿ ಬಿಜೆಪಿ ಕಾರ್ಯಕರ್ತರು ಬಿಬಿಎಂಪಿ ಕೇಂದ್ರ ಕಚೇರಿ ಮುಖ್ಯದ್ವಾರಕ್ಕೆ ಬೀಗ ಜಡಿದು ಆಕ್ರೋಶ ವ್ಯಕ್ತಪಡಿಸಿದರು."
289,ಕೆ.ಎನ್.ಪಿ.ಫೇಸ್ಬುಕ್ ಅಕೌಂಟ್ ಗಾಗಿ ಈ ಗುಂಡಿ ಒತ್ತಿರಿ
290,ವಿಕ್ಶನರಿಯ ಬಲ ಮೇಲ್ತುದಿಯಲ್ಲಿರುವ ’ಹುಡುಕು’ ಗುಂಡಿಯಲ್ಲಿ ಪದ ಹಾಕಿ ಕೀಲಿಮಣೆಯಲ್ಲಿನ ’ಸೇರು’ (enter) ಗುಂಡಿ ಒತ್ತಿದರೆ ಪದದ ಹುರುಳು ತೆರೆದುಕೊಳ್ಳುತ್ತದೆ.
291,"ಹುಬ್ಬಳ್ಳಿ ಧಾರವಾಡದಲ್ಲಿ ಗುತ್ತಿಗೆದಾರರು ರಸ್ತೆ, ಗಟಾರು, ತಗ್ಗು ಗುಂಡಿ ಮುಚ್ಚುವುದು, ಯುಜಿಡಿ ಕಾಮಗಾರಿಗಳನ್ನೇ ಹೆಚ್ಚಾಗಿ ನಿರ್ವಹಿಸುತ್ತಿದ್ದಾರೆ.ಆ ಕಾಮಗಾರಿ ಗುಣಮಟ್ಟದ ಬಗ್ಗೆ ವ್ಯಾಪಕ ಆಕ್ಷೇಪಗಳಿವೆ."
292,ಕೆ.ಎನ್.ಪಿ.ಫೇಸ್ಬುಕ್ ಅಕೌಂಟ್ ಗಾಗಿ ಈ ಗುಂಡಿ ಒತ್ತಿರಿ
293,ಮಡಿಕೇರಿ-ಭಾಗಮಂಡಲ-ತಲಕಾವೇರಿ ನಡುವಿನ ಸಂಪರ್ಕ ರಸ್ತೆಯಲ್ಲಿನ ಗುಂಡಿ ಮುಚ್ಚುವ ಮತ್ತು ರಸ್ತೆಯ ಬದಿಯಲ್ಲಿ ಬೆಳೆ ದಿರುವ ಗಿಡಗಳನ್ನು ತೆಗೆಯುವ ಕಾರ್ಯ ಭರ ದಿಂದ ನಡೆಯುತ್ತಿದೆ ಎಂದು ಅವರು ಮಾಹಿತಿ ನೀಡಿದರು.
294,"ಬೆಳಿಗ್ಗೆ ನನಗೆ ತುಂಬಾ ಇಷ್ಟವಾದ ಶರಟನ್ನು ಇಸ್ತ್ರೀ ಮಾಡುತ್ತಿರುವಾಗ, ಶರಟಿನ ಮಧ್ಯದ ಒಂದು ಗುಂಡಿ ಸಡಿಲವಾಗಿದ್ದು ಕಾಣಿಸಿತು, ಗುಂಡಿಯನ್ನು ಸ್ವಲ್ಪ ಎಳೆದು ನೋಡಿದೆ, ನಾಲ್ಕೋ ಐದೊ ದಾರಗಳಿದ್ದು ಸ್ವಲ್ಪ ಲೂಸಾಗಿದ್ದುದು ಕಂಡುಬಂತು."
295,"ಎಲ್ಲರೂ ಒಟ್ಟಿಗೆ ಸೇರಿ ಹೊಲದ ಬದಿಯಲ್ಲಿ ಗುಂಡಿ ತೋಡಿ, ಅದರೊಳಗೆ ಕುಳ್ಳು, ಕಟ್ಟಿಗೆ ಹಾಕಿ ಗಟ್ಟಿ ಕೆಂಡ ಮಾಡಿ ಜೋಳದ ತೆನೆ ಸುಡಲು ಸಜ್ಜಾಗುವುದು ವಿಶೇಷ."
296,ಕೆ.ಎನ್.ಪಿ.ಆ್ಯಪ್ ಗಾಗಿ ಈ ಗುಂಡಿ ಒತ್ತಿರಿ
297,ಕೆ.ಎನ್.ಪಿ.ಯುಟ್ಯೂಬ್ ಚಾನಲ್ ಗಾಗಿ ಈ ಗುಂಡಿ ಒತ್ತಿರಿ
298,ನಿನ್ನೆಯೇ ಗುಂಡಿ ತೋಡುವ ಕೆಲಸ ಮುಗಿದಿತ್ತು.
299,ರಸ್ತೆಗೆ ಹಾಕಿದ ಟಾರು ಕಿತ್ತು ಹೋಗಿ ರಸ್ತೆ ತುಂಬಾ ಗುಂಡಿ ಬಿದ್ದಿವೆ.
300,"June 18, 2018 ರಸ್ತೆ ಗುಂಡಿ ಮುಚ್ಚಲು ಅಧಿಕಾರಿಗಳಿಗೆ ಖಾಲಿ ಚೆಕ್"
301,ಕೆಲವೆಡೆ ಕಾಮಗಾರಿ ಮುಗಿದರೂ ಗುಂಡಿ ಮುಚ್ಚದ ಕಾರಣ ಸಂಚಾರ ಕಷ್ಟವಾಗಿದೆ.
302,‘ಬಸ್‌ ನಿಲ್ದಾಣ ಮುಂಭಾಗದ ಗುಂಡಿ ಮುಚ್ಚಿ.
303,ಬಲ ಮೌಸ್ ಗುಂಡಿ ಒತ್ತಿ ಮತ್ತು ನೀವುನೋಡುತ್ತಾರೆ ಮಾಡುತ್ತದೆ.
304,"“ಅವುಗಳ ಚಲನವಲನದ ‘ಕಾರಿಡಾರ್’ ಮಧ್ಯೆ, ಈ ಗುಂಡಿ ನಿರ್ಮಿಸಿರುವುದು, ನೀರ್ಗುಂಡಿಯ ‘ಅಡ್ರೆಸ್’ ಹುಡುಕುವ ಪರಿಪಾಟಲು ತಪ್ಪಿಸಿದಂತಾಗಿದೆ” ಎಂಬುದು, ನೇಚರ್ ರಿಸರ್ಚ್ ಸೆಂಟರ್‌ನ ಪ್ರಕಾಶ ಗೌಡರ ಅನಿಸಿಕೆ."
305,ವಾರ್ಡ್ 10 ರ ಬಡಾವಣೆ ವ್ಯಾಪ್ತಿ ಸೇರಿದಂತೆ ಬಹುತೇಕ ವಾರ್ಡ್‌ಗಳಲ್ಲಿ ಒಳ ಚರಂಡಿ ಕಾಮಗಾರಿ ನೆಪದಡಿ ರಸ್ತೆಯನ್ನು ಮನಬಂದಂತೆ ಅಗೆದು ಗುಂಡಿ ಸಮತಟ್ಟು ಮಾಡದೇ ಅಪೂರ್ಣಕ್ಕೆ ಸಂಬಂಧಪಟ್ಟ ಗುತ್ತೇದಾರರು ಕಾರಣರಾಗಿದ್ದಾರೆ.
306,ಜೋಗದ ಗುಂಡಿ
307,‘ಸತತ ಮಳೆಯಿಂದ ಗುಂಡಿ ಬೀಳುವುದು ಸಾಮಾನ್ಯ.
308,"ಅಲ್ಲದೇ, ಸ್ವತ: ತಾವೇ ಶೌಚಾಲಯದ ಗುಂಡಿ ತೋಡಿ ಹಣ ಪಡೆಯಬಹುದಿತ್ತು."
309,"Connection Manager ಕಿಟಕಿಯಲ್ಲಿ , Configure ಗುಂಡಿಯ ಮೇಲೆ ಕ್ಲಿಕ್ ಮಾಡಿ, Add ಗುಂಡಿ ಮೇಲೆ ಕ್ಲಿಕ್ ಮಾಡಿ."
310,ಉಚಿತ ಗುಂಡಿ ತೆಗೆದುಕೊಟ್ಟಾಗ ಉಳಿದ ಕೆಲಸವನ್ನು ಫಲಾನುಭವಿಗಳು ಪೂರ್ಣಗೊಳಿಸಿದ್ದಾರೆ.
311,"ಈ ವಿಷಯ ಕುರಿತು ವಿಚಾರಣೆ ನಡೆಸಿದ ಹೈಕೋರ್ಟ್‌, ಗುಂಡಿ ಮುಚ್ಚುವ ಗಡುವನ್ನು ಒಂದು ವಾರದ ವರೆಗೆ ವಿಸ್ತರಿಸಿದೆ."
312,ಕೆ.ಎನ್.ಪಿ.ಯುಟ್ಯೂಬ್ ಚಾನಲ್ ಗಾಗಿ ಈ ಗುಂಡಿ ಒತ್ತಿರಿ
313,"ಇದೀಗ ಮುಖ್ಯಮಂತ್ರಿ ಭೇಟಿ ನೀಡಲಿದ್ದಾರೆ ಎನ್ನುತ್ತಿದ್ದಂತೆ ಒಂದೇ ರಾತ್ರಿಯಲ್ಲಿ ಗುಂಡಿ ಮುಚ್ಚಿ, ಡಾಂಬರು ಲೇಪಿಸಿ, ಬಣ್ಣ ಬಳಿದಿದ್ದಾರೆ."
314,"ಅಲ್ಲದೆ ಅದೇ ಸಮ್ಮೇಳನದ ಸಮಾರೋಪ ಸಮಾರಂಭದಲ್ಲಿ ಕನ್ನಡದ ಹೋರಾಟಗಾರ ಮುಖ್ಯಮಂತ್ರಿ ಚಂದ್ರು ಅವರು ಜಿಲ್ಲಾ ಕನ್ನಡ ಸಾಹಿತ್ಯ ಪರಿಷತ್ ಅನ್ನು ಟಾಯ್ಲೆಟ್ ಗುಂಡಿ ಎಂದು ಹೋಲಿಕೆ ಮಾಡಿರುವುದು ಸರಿಯಾಗಿಯೇ ಇದೆ, ನಾವು ಅವರನ್ನು ಅಭಿನಂದಿಸುತ್ತೇವೆ ಎಂದರು."
315,"ಬೆಂಗಳೂರು, ಜು.24-ಬೆಂಗಳೂರು ನಗರದ ರಸ್ತೆಗಳ ಗುಂಡಿ ಮುಚ್ಚುವ ನೆಪದಲ್ಲಿ ನಾಗರಿಕ ತೆರಿಗೆ ಹಣವನ್ನು ಪೋಲು ಮಾಡಲಾಗುತ್ತಿದೆ ಎಂದು ಬಿಬಿಎಂಪಿ ಆಡಳಿತ ಪಕ್ಷದ ಮಾಜಿ ನಾಯಕ ಎನ್.ಆರ್.ರಮೇಶ್ ಗಂಭೀರ ಆರೋಪ ಮಾಡಿದ್ದಾರೆ."
316,ಶುಕ್ರವಾರ ರಾತ್ರಿಯಿಡಿ ಸುರಿದ ಭಾರೀ ಮಳೆಯಿಂದ ಐಟಿ ಸಿಟಿ ಈಗ ಗುಂಡಿ ಸಿಟಿಯಾಗಿದೆ.
317,"ಸರ್ವರ್ ಅನ್ನು on ಮಾಡಿ, ಕ್ಲಯಂಟ್ ಕಂಪ್ಯೂಟರ್ ಶುರುವಾದಾಗ ಈ ಮಾಹಿತಿಯನ್ನು ನಮೂದಿಸಿ.username – adminpassword – hclpdConnection Manager ಕಿಟಕಿಯಲ್ಲಿ , Configure ಗುಂಡಿಯ ಮೇಲೆ ಕ್ಲಿಕ್ ಮಾಡಿ, Add ಗುಂಡಿ ಮೇಲೆ ಕ್ಲಿಕ್ ಮಾಡಿ."
318,ಮುಚ್ಚಿದ ರಸ್ತೆ ಗುಂಡಿ ಪರಿಶೀಲಿಸಲು ನ್ಯಾಯಾಲಯದ ಆಯೋಗ ರಚನೆ
319,ಎರಡು ಸಾವರಿಕ್ಕೂ ಹೆಚ್ಚು ಮಂದಿ ಪ್ರತಿಭಟನೆಯಲ್ಲಿ ಪಾಲ್ಗೊಂಡು ರಸ್ತೆ ಗುಂಡಿ ಮುಚ್ಚುವರೆಗೂ ನಾವು ಹೋರಾಟ ಮಾಡುತ್ತೇವೆ ಎಂದು ಆಕ್ರೋಶ ವ್ಯ್ಕತಪಡಿಸಿದರು.
320,ಕೆ.ಎನ್.ಪಿ.ಯುಟ್ಯೂಬ್ ಚಾನಲ್ ಗಾಗಿ ಈ ಗುಂಡಿ ಒತ್ತಿರಿ
321,ಐಫೋನ್ನ ಇನ್ನೊಂದು ಅದ್ಭುತ ಸಂಶೋಧನೆಯೆಂದರೆ ಇದರಲ್ಲಿ ಇತರೆ ಫೋನುಗಳಲ್ಲಿರುವಂತೆ ಯಾವುದೇ ಅಂಕಿ ಗುಂಡಿ (ಬಟನ್) ಇಲ್ಲ.
322,ಮಾತೃಭೂಮಿ ಸೇವಾ ತಂಡ ಮೂರು ದಿನಕೊಮ್ಮೆ ಗುಂಡಿ ಮುಚ್ಚುವ ಕೆಲಸವನ್ನು ಮಾಡುತ್ತಿದೆ.
