Index,Sentence
201,ತುರಿದ ಚೀಸ್ 300 ಗ್ರಾಂ ತುರಿ ಮತ್ತು ಮೊಸರು 100 ಗ್ರಾಂ ಮಿಶ್ರಣ.
202,"ನಂತರ ಕೊತ್ತಂಬರಿ ಸೊಪ್ಪು, ಕ್ಯಾರೆಂಟ್, ತೆಂಗಿನ ತುರಿ ಹಾಕಿ ಹುರಿದುಕೊಂಡು."
203,"ಚೀಸ್, ಮೇಲಾಗಿ ಪಾರ್ಮ, ತುರಿ ತುಂಬಿಸುವುದರ ರಕ್ಷಣೆ."
204,"ಈ ಸವಿಯಾದ ಬಿಸಿ ಮೆಣಸು, ಮೇಯನೇಸ್, ಸಂಸ್ಕರಿಸಿದ ಚೀಸ್ ತುರಿ ಸೇರಿಸಿ ಎಲ್ಲವನ್ನೂ ಮತ್ತು pritrusit ತೆಂಗಿನ ಮಿಶ್ರಣ ಮಾಡಬೇಕಾಗುತ್ತದೆ."
205,ಕತ್ತರಿಸಿದ ಈರುಳ್ಳಿ ಸೇರಿಸಿ ಮತ್ತು ಕ್ಯಾರೆಟ್ ಅನ್ನು ಮತ್ತೊಂದು 20 ನಿಮಿಷಕ್ಕೆ ತುರಿ ಮಾಡಿ.
206,"ದಂಡ ತುರಿಯುವ ಮಣೆ ಮೇಲೆ ತುರಿ ಚೀಸ್, ಗೊರ್ಗೊನಜೊಲಾ ಹಾಟ್ ಸಾಸ್ ಸುರಿಯುತ್ತಾರೆ ಮತ್ತು ಚೀಸ್ ವಿಸರ್ಜಿಸಲು ಸ್ಫೂರ್ತಿದಾಯಕ, ಕುದಿಯುತ್ತವೆ ತನ್ನಿ."
207,"ಕೊತ್ತಂಬರಿ ಚಟ್ನಿ – ಕೊತ್ತಂಬರಿ ಸೊಪ್ಪು 2 ಕಟ್ಟು, ಒಣ ಮೆಣಸಿನಕಾಯಿ-2, ಕಡಲೆಬೇಳೆ 2 ಚಮಚೆ, ಉದ್ದಿನಬೇಳೆ 2 ಚಮಚೆ, ಜೀರಿಗೆ 2 ಚಮಚೆ, ಹುಣಸೆ ರಸ ಸ್ವಲ್ಪ, ಒಣ ಕೊಬ್ಬರಿ ತುರಿ ಸ್ವಲ್ಪ, ರುಚಿಗೆ ತಕ್ಕಷ್ಟು ಉಪ್ಪು, ಬೇಕೆನಿಸಿದಲ್ಲಿ ಬೆಲ್ಲ, ಎಣ್ಣೆ ಸ್ವಲ್ಪ."
208,"ತುರಿ ಅಡಿಯಲ್ಲಿ, ಇಂಧನ ದಹನವನ್ನು ಖಚಿತಪಡಿಸಿಕೊಳ್ಳಲು ಅಗತ್ಯವಾದ ಗಾಳಿಯನ್ನು ಸರಬರಾಜು ಮಾಡಲಾಗುತ್ತದೆ."
209,"ಕಿತ್ತಳೆ ಸಿಪ್ಪೆಯನ್ನು ತುರಿ ಮಾಡಿ, ಗುಳ್ಳೆಗಳನ್ನು ಮತ್ತು ಬಿಳಿ ಚಿತ್ರವಿಲ್ಲದೆ ತಿರುಳನ್ನು ದೊಡ್ಡದಾಗಿ ಕತ್ತರಿಸಿ."
210,• ತುರಿ 30 ಗ್ರಾಂ ಹಾರ್ಡ್ ಚೀಸ್.
211,"ಪದರಗಳನ್ನು ಸಲುವಾಗಿ ಕೇವಲ ನೀವು ತುರಿ ಮತ್ತು ಸೇಬುಗಳು ನಂತರ ಇರಿಸಲು ಬೇಕಾಗುವಂತಹಾ ಕ್ರೀಮ್ ಚೀಸ್ ಸೇರಿಸಿ, ಹಿಂದಿನ ಪಾಕವಿಧಾನ ರಲ್ಲಿ ಒಂದೇ."
212,"ಇದನ್ನು ಮಾಡಲು, 2-3 ತಾಜಾ ಸೌತೆಕಾಯಿ, ತುರಿ ತೆಗೆದುಕೊಳ್ಳಬಹುದು."
213,"ಮೂಲಂಗಿ ತುರಿ ಮತ್ತು ರಸ ಹೈಲೈಟ್ ಇಲ್ಲ ರವರೆಗೆ ನಿಂತು, ನೀವು ವಿಲೀನಗೊಳ್ಳಲು ಬಯಸುವ ಅವಕಾಶ ಮಾಡಬೇಕು."
214,"ಪಶ್ಚಿಮ ಮುಂಡ ವರ್ಗ : ಭಿರ್ಜಿಯ, ಭೂಮಿಜ್, ಜುಅಂಗ್, ಕಿಸಾನ್‌ಭೂಮಿಕ್, ಕೊರಬು, ಮುಂಡಾರಿ, ಸಂತಾಲಿ ತುರಿ ಮುಂತಾದವು ಈ ಭಾಷಾವರ್ಗದ ಮುಖ್ಯಭಾಷೆಗಳಾಗಿದ್ದು ಬಿಹಾರ, ಒರಿಸ್ಸಾ, ಪಶ್ಚಿಮಬಂಗಾಳ, ಮಧ್ಯಪ್ರದೇಶ, ಅಸ್ಸಾಮ್‌ಗಳಲ್ಲಿ ಈ ಭಾಷೆಗಳನ್ನಾಡುತ್ತಾರೆ."
215,ಇದು ಸೇಬುಗಳು ಒಂದು ತುರಿಯುವ ಮಣೆ ಮೇಲೆ ತುರಿ ವೇಳೆ ಹೆಚ್ಚು ವೇಗವಾಗಿ ಅಡುಗೆ ಪ್ರಕ್ರಿಯೆಯಲ್ಲಿ ಹೋಗುತ್ತದೆ.
216,ಹಾಳೆಯಲ್ಲಿ ಒಲೆಯಲ್ಲಿ ನೀವು ಕೆತುವನ್ನು ಬೇಯಿಸುವ ಮೊದಲು ಬೆಳ್ಳುಳ್ಳಿಯ ಅರ್ಧವನ್ನು ರುಬ್ಬಿಸಿ ಉಪ್ಪು ಪಿಂಚ್ನೊಂದಿಗೆ ಸ್ಟೀಕ್ಗಳನ್ನು ತುರಿ ಮಾಡಿ.
217,ಅನಂತರ ಪುಟ್ಟು ಮಾಡುವ ಕೊಳವೆಯಾಕೃತಿಯ ಪಾತ್ರೆಗೆ ತೆಂಗಿನ ತುರಿ ಹಾಗೂ ಅಕ್ಕಿ ಹುಡಿಯನ್ನು ಲೇಯರ್‌ ಲೇಯರ್‌ಗಳಾಗಿ ಹಾಕಿ ಬೇಯಿಸಬೇಕು.
218,"ಘನ ಚೀಸ್ ಮತ್ತು ಬೆಳ್ಳುಳ್ಳಿ ಫಾರ್ ಎಂದು, ನಂತರ ಅವರು ಕ್ರಮವಾಗಿ ದೊಡ್ಡ ಮತ್ತು ಸಣ್ಣ ತುರಿಯುವ ಮಣೆ ಮೇಲೆ ತುರಿ ಅಗತ್ಯವಿದೆ."
219,"ಆದ್ದರಿಂದ ಬೆಳ್ಳುಳ್ಳಿ ಮೇಯನೇಸ್ ತುರಿ ಕೋಳಿ ಮೃತ ದೇಹಗಳ ಒಳಗೆ ಮತ್ತು ಔಟ್, ಮ್ಯಾರಿನೇಡ್ ಬಿಡಿ."
220,"ಉತ್ತಮ ತುರಿಯುವ ಮಣ್ಣಿನಲ್ಲಿ, ಕೆನೆ ಚೀಸ್ ಮತ್ತು ಬೆಳ್ಳುಳ್ಳಿ ಲವಂಗವನ್ನು ತುರಿ ಮಾಡಿ."
221,"ವಿಷಯಗಳನ್ನು ಮಧ್ಯಮ ಗಾತ್ರದ ಕಚ್ಚಾ ತರಕಾರಿಗಳು - ಗೆಣಸು, ಆಲೂಗಡ್ಡೆಗಳು ಮತ್ತು ಕ್ಯಾರೆಟ್ - ತುರಿ ಅಥವಾ ಆಹಾರ ಸಂಸ್ಕಾರಕದ ಕೊಚ್ಚು, ನಂತರ ಬಹಳ ನುಣ್ಣಗೆ ಕತ್ತರಿಸಿದ ಹೆರಿಂಗ್ ಮತ್ತು ನೇರಳೆ ಈರುಳ್ಳಿ ಗೆ."
222,ಅಕ್ಕಿಹಿಟ್ಟು ಮತ್ತು ತೆಂಗಿನ ತುರಿ ಪದರಗಳನ್ನು ಹಬೆಯಲ್ಲಿ ಬೇಯಿಸುವ ಸಿಲಿಂಡರ್ ಆಕೃತಿಯ ವಿಶಿಷ್ಟ ಹಾಗೂ ಕೇರಳದ ಜನಪ್ರಿಯ ಖಾದ್ಯ ಇದು.
223,"(*ರುಬ್ಬಲು ಮಸಾಲೆ: 5-6 ಒಣಮೆಣಸು, ಧನಿಯಾ, ಉದ್ದಿನಬೇಳೆ, ಕಡಲೇಬೇಳೆ – ತಲಾ ಒಂದು ಚಮಚ, ಜೀರಿಗೆ, ಎಳ್ಳು- ತಲಾ ಅರ್ಧ ಚಮಚ, ಒಂದು ಕಾಳು ಇಂಗು…ಇವೆಲ್ಲವನ್ನೂ ಹುರಿದು, ಅರ್ಧ ಕಪ್ ತೆಂಗಿನಕಾಯಿಯ ತುರಿ ಸೇರಿಸಿ ರುಬ್ಬಬೇಕು)."
224,", ಕ್ಯಾರೆಟ್ ತುರಿ ಈರುಳ್ಳಿ ಕತ್ತರಿಸಿ ಅವುಗಳನ್ನು ಫ್ರೈ."
225,"ಇದನ್ನು ಮಾಡಲು, ನೀವು, ಜೇನಿನಂಟು ತುರಿ ಬೆಣ್ಣೆ ಜೊತೆ ಬೆರೆತು ನೀರಿನ ಸ್ನಾನ ಕರಗಿ ಅಗತ್ಯವಿದೆ."
226,"ಕ್ಯಾರೆಟ್ ಸಿಪ್ಪೆ ಮತ್ತು ತುರಿ ಮುಕ್ತವಾದ, ಬೇಯಿಸಿದ."
227,ತುರಿ ಚೀಸ್.
228,ತುರಿ ಕ್ಯಾರೆಟ್ ಅಥವಾ ಕ್ರೌಟ್ ತಾಜಾ ಎಲೆಕೋಸು ಬದಲಿಸಿದಾಗ ಕೇವಲ ರುಚಿಕರವಾದ ಉಪಯುಕ್ತ ಮತ್ತು ಔಟ್ ತೃಪ್ತಿ.
229,ತಾಜಾ ಮೂಲಂಗಿ ತುರಿ 1:10 ಅನುಪಾತದಲ್ಲಿ ಹಾಲಿನ ಜೊತೆ ದುರ್ಬಲಗೊಳಿಸುವ.
230,"ಬ್ಯಾಫಲ್ನ ವಿಪರೀತ ಕಂಪನವು ಕೆಲವು ಹಕ್ಕಿಗಳನ್ನು ಹೆದರಿಸುವ ಮತ್ತು ಆಹಾರ ತಟ್ಟೆಯ ಮೇಲೆ ತುರಿ ಮಾಡಿಕೊಳ್ಳುವುದಾದರೂ, ಸಣ್ಣ ಜಾತಿಗಳಿಗೆ ಅನಪೇಕ್ಷಿತ ತಡೆಗೋಡೆಯಾಗಿರಬಹುದು, ಅದರ ಅಗ್ಗದ ಬೆಲೆಗೆ, ಈ ಫೀಡರ್ ಆಶ್ಚರ್ಯಕರ ಬಹುಮುಖ ಮತ್ತು ಉತ್ತಮವಾದ, ಸಕ್ರಿಯ ಬಳಕೆಯ ಹಲವಾರು ಋತುಗಳಲ್ಲಿ ಯೋಗ್ಯ ಗುಣಮಟ್ಟವಾಗಿದೆ."
231,"ಈಗ, ಈರುಳ್ಳಿ ಮತ್ತು ಕ್ಯಾರೆಟ್ ತುಂಡುಗಳು ಅಥವಾ ತುರಿ ಕೊಚ್ಚು."
232,ತುರಿ ಹಳೆಯ ಒಲೆಯಲ್ಲಿ ಸಾಲ ಅಥವಾ ಹೊಸದನ್ನು ಖರೀದಿಸಬಹುದು.
233,ಪ್ರತ್ಯೇಕವಾಗಿ ಹಾರ್ಡ್ ಚೀಸ್ ತುರಿ ಅಗತ್ಯವಿದೆ.
234,"ಕ್ಯಾರೆಟ್ ತುರಿ ಮಾಡಬಹುದು, ಮತ್ತು ಇದು ಸಣ್ಣ ತುಂಡುಗಳನ್ನು ಕತ್ತರಿಸಿ ಉತ್ತಮ."
235,"ಬೇಕಾಗುವ ಸಾಮಗ್ರಿ: ಗುಜ್ಜೆ ಹೋಳು- 4 ಕಪ್‌, ಖಾರದ ಪುಡಿ-ಅರ್ಧ ಚಮಚ , ಅರಿಶಿನಪುಡಿ-ಕಾಲು ಚಮಚ , ಹುಣಸೆಹಣ್ಣು -ಸಣ್ಣ ಗೋಲಿಯಷ್ಟು, ಉಪ್ಪು-ರುಚಿಗೆ ತಕ್ಕಷ್ಟು, ತೆಂಗಿನ ತುರಿ - ಒಂದು ಕಪ್‌, ಜೀರಿಗೆ- ಒಂದು ಚಮಚ , ಹಸಿರು ಮೆಣಸು - 2."
236,ಪ್ಲಸ್ ನೀವು ಪಾರ್ಮ ಒಂದು ಬ್ಲಾಕ್ ತುರಿ ಮಾಡಬಹುದು ಒಂದು ವಿನ್ಯಾಸ ಸಿಕ್ಕಿತು ವಿಶೇಷವೇನು.
237,"ಈಗ ಹುರಿದ ರವೆಗೆ ಸಕ್ಕರೆ ಪುಡಿ, ಏಲಕ್ಕಿ ಪುಡಿ, ಕೊಬ್ಬರಿ ತುರಿ ಸೇರಿಸಿ ಮಿಕ್ಸ್ ಮಾಡಿ."
238,ನಾಲ್ಕು ಬೇಯಿಸಿದ ಮೊಟ್ಟೆಗಳು ನಿರಂಕುಶವಾಗಿ ಅಥವಾ ತುರಿ ಕತ್ತರಿಸಿ.
239,"3–4 ಗಂಟೆ ಕಾಲ ನೆನೆದ ಅಕ್ಕಿಗೆ ಸಿಹಿಯದ್ದಾದರೆ ಬೆಲ್ಲ, ಸ್ವಲ್ಪ ತೆಂಗಿನ ತುರಿ (ತೆಂಗಿನಕಾಯಿ ಎಲ್ಲದಕ್ಕೂ ಇರಲೇಬೇಕು), ಏಲಕ್ಕಿ ಪುಡಿ ಸೇರಿಸಿ ನುಣ್ಣಗೆ ರುಬ್ಬಬೇಕು."
240,"ಬೇಕಾಗುವ ಸಾಮಗ್ರಿಗಳು: ಅಕ್ಕಿ – ಒಂದು ಕಪ್ ಅಥವಾ ಒಂದು ಪಾವು, ತೆಂಗಿನಕಾಯಿ ತುರಿ – ಒಂದು ಕಪ್, ಬೆಲ್ಲ – ಅರ್ಧ ಕಪ್, ಏಲಕ್ಕಿ ಪುಡಿ – ಒಂದು ಟೀ ಚಮಚ, ತುಪ್ಪ – ಎರಡು ಚಮಚ, ನೀರು – ಕಾಲು ಬಟ್ಟಲು, ಎಳ್ಳು – ಐದರಿಂದ ಆರು ಟೀ ಚಮಚ"
241,"ದೋಸೆ ಅಕ್ಕಿ 1 ಕಪ್, ಒಂದು ಹಿಡಿ ಉದ್ದಿನ ಬೆಳೆ, ಕಾಯಿ ತುರಿ ಒಂದು ಕಪ್, ಬೆಲ್ಲ 2 ಕಪ್, ಒಂದು ಚಿಟಿಕೆ ಉಪ್ಪು, ಕರಿಯಲು ಎಣ್ಣೆ."
242,ತಣ್ಣಗಾದ ನಂತರ ತೆಂಗಿನ ತುರಿ ಸೇರಿಸಿ ನ್ಣ್ಣಗೆ ರುಬ್ಬಿ.
243,"ವಿಧಾನ: ಹಿಂದಿನ ರಾತ್ರಿ ಹೆಸರುಬೇಳೆಗೆ ಅಕ್ಕಿ, ತೆಂಗಿನ ತುರಿ ಹಾಕಿ ರುಬ್ಬಿ ಉಪ್ಪು ಹಾಕಿಡಿ."
244,"ಟೊಮ್ಯಾಟೋಸ್ ತುರಿ ಅಥವಾ ಬಳಸಿದ ಟೊಮೆಟೊ ಪೇಸ್ಟ್ ಬದಲಿಯಾಗಿ, ಒಂದು ಬ್ಲೆಂಡರ್ ಬಳಸಿ."
245,"ಕ್ಯಾರೆಟ್ ಮತ್ತು ಈರುಳ್ಳಿ ಫ್ರೈ, ಮೂಲಂಗಿ ಮತ್ತು ಮಾಂಸ ತೆಳುವಾಗಿ ಕತ್ತರಿಸು, ಮೊಟ್ಟೆಗಳನ್ನು ತುರಿ ಮಾಡಿ."
246,ನಂತರ ತೆಂಗಿನ ತುರಿ ಮತ್ತು ಉಪ್ಪನ್ನು ಬೆರೆಸಿ.
247,"ಬೆಂದ ಮೇಲೆ ಸ್ವಲ್ಪ ತೆಂಗಿನಕಯಿ ತುರಿ ಹಾಕಿದರೆ ರುಚಿಯಾದ ಪಲ್ಯ ತಯಾರ್…ಹಾಗೆಯೇ,ಯಾವುದೇ ಪಲ್ಯ ಮಾಡುವಾಗ ಅದಕ್ಕೇ ಹಚ್ಚಿಟ್ಟ ಚಿಗುರನ್ನು ಹಾಕಿ ಪಲ್ಯ ಮಾಡಿದರೆ ತುಂಬಾ ರುಚಿಯಾಗಿರುತ್ತದೆ."
248,ತೆಂಗಿನ ತುರಿ ಮತ್ತು ಹುಣಸೆ ಹಣ್ಣಿನೊಂದಿಗೆ ರುಬ್ಬಿ.
249,"ಘನ ಹಾಲಿನ ಉತ್ಪನ್ನದ ದೊಡ್ಡ ತುರಿ ತುರಿಯುವ ಸೂಚಿಸಲಾಗುತ್ತದೆ ಇದರಲ್ಲಿ, ಅಡುಗೆ ತೈಲ ಸ್ವಲ್ಪ ಕೊಠಡಿ ತಾಪಮಾನದಲ್ಲಿ ಕರಗಿ, ಮತ್ತು ಪಾರ್ಸ್ಲಿ ಮತ್ತು ಸಬ್ಬಸಿಗೆ - ಜಾಲಾಡುವಿಕೆಯ ಮತ್ತು ನುಣ್ಣಗೆ ಕತ್ತರಿಸಿದ."
250,ತೆಂಗಿನ ತುರಿ - ಸ್ವಲ್ಪ
251,ಕ್ರೀಮ್ ಚೀಸ್ ನೊಂದಿಗೆ ಚೀಸ್ ತುರಿ ಮತ್ತು ಮಿಶ್ರಣವನ್ನು.
252,"ನೀವು ತುರಿ ಅನಿಲ ಒಲೆ ಗ್ರೀಸ್ ಮತ್ತು ಇಲ್ಲಣ ತೊಳೆಯುವುದು ಮೊದಲು, ಎಚ್ಚರಿಕೆಯಿಂದ ಸೂಚನೆಗಳನ್ನು ಮತ್ತು ಆಯ್ಕೆಮಾಡಿದ ನಿಧಿಗಳ ಸಂಯೋಜನೆ ಓದಲು ಅಗತ್ಯ."
253,"ಸಮಾನಾಂತರವಾಗಿ, ನೀವು ಸಣ್ಣ ತುಂಡುಗಳನ್ನು ಈರುಳ್ಳಿ ಕತ್ತರಿಸು ಮತ್ತು ಅಗತ್ಯವಾಗಿ ಒರಟಾದ ತುರಿಯುವ ಮಣೆ ಮೇಲೆ ಕ್ಯಾರೆಟ್ ತುರಿ ಮಾಡಬಹುದು."
254,ಈ ಪಾಕವಿಧಾನ ಮಾಡುತ್ತೇವೆ ಸೌತೆಕಾಯಿ ತುರಿ ದಂಡ ತುರಿಯುವ ಮಣೆ ಅಗತ್ಯವಿದೆ.
255,", ಸ್ಟಿಕ್ಗಳನ್ನು ಈರುಳ್ಳಿ - - ತುರಿ (ದೊಡ್ಡ) - ಮೇಲೆ ಅರ್ಧ ಉಂಗುರಗಳು, ಮತ್ತು ಕ್ಯಾರೆಟ್ ಟೊಮ್ಯಾಟೋಸ್ ಮತ್ತು eggplants, ಕುಂಬಳಕಾಯಿಯನ್ನು ಹೋಲುವ ಚೀನೀಕಾಯಿ ತುಂಡುಗಳನ್ನು ಕತ್ತರಿಸಿ ಅಗತ್ಯವಿದೆ."
256,"ತಾಜಾ ಕ್ಯಾರೆಟ್ ಹಾಗೆ, ತುರಿ (ಮೇಲಾಗಿ ದೊಡ್ಡ) ಬೇಕು."
257,"ಆದ್ದರಿಂದ, ನೀವು ಮನೆಯಲ್ಲಿ ಒಂದು ಹೃತ್ಪೂರ್ವಕ ಸಲಾಡ್ ಅಡುಗೆ ಮೊದಲು, ಈರುಳ್ಳಿ ಮತ್ತು ಕ್ಯಾರೆಟ್ ಸ್ವಚ್ಛಗೊಳಿಸಲು ನಂತರ ದೊಡ್ಡ ತುರಿಯುವ ಮಣೆ ಮೇಲೆ ಅರ್ಧ ಉಂಗುರಗಳು ಮತ್ತು ತುರಿ ಕತ್ತರಿಸಿ ಕ್ರಮವಾಗಿ ಅಗತ್ಯವಿದೆ."
258,ಅರಿವಿಲ್ಲದೇ ನಾಲ್ಕು ಸಲ ಅಡ್ಡಾದಿಡ್ಡೀ ಕಡಿ ಆಡಿಸಿದ್ದಕ್ಕೆ ಸ್ವಲ್ಪ ತುರಿ ಬೀಳುವುದು ಇರಬಹುದು.
259,ಬೀಟ್ಗೆಡ್ಡೆಗಳು ಮತ್ತು ಕ್ಯಾರೆಟ್ ತುರಿ ಮತ್ತು ಎಲೆಕೋಸು ಮತ್ತು ಗ್ರೀನ್ಸ್ ಕತ್ತರಿಸು ಮತ್ತು ಎಲ್ಲಾ ಪದಾರ್ಥಗಳನ್ನು ಮಿಶ್ರಣ ಮಾಡಬೇಕು.
260,"ಪಾರ್ಮ ಗಿಣ್ಣು ಅಥವಾ ಯಾವುದೇ ಹಾರ್ಡ್ ಚೀಸ್ ತುರಿ ಫಿಫ್ಟಿ ಗ್ರಾಂ, ದೀರ್ಘ ಸುಂದರ ಪಟ್ಟೆಗಳು ಪಡೆಯಲು."
261,ಒಣ ತೆಂಗಿನಕಾಯಿ ತುರಿ ಅಲಂಕಾರಕ್ಕೆ
262,"ತುಂಬುವುದು ತಯಾರಿ, ನೀವು, ಪಾಸ್ಟಾ ಸ್ವತಃ ಕುದಿ ಹರಿಸುತ್ತವೆ ಜಾಲಾಡುವಿಕೆಯ ಮತ್ತು ಚೀಸ್ ಪ್ರಭೇದಗಳ ಒಂದು (ತುಂಡು ಪ್ರತಿ ತುರಿ ತುರಿಯುವ ಮಣೆ ಮೇಲೆ) ಜೊತೆ ಮಿಶ್ರಣ ಮಾಡಬೇಕಾಗುತ್ತದೆ."
263,"ಚೀಸ್ (ನೀವು ತುರಿ ಮಾಡಬಹುದು) ಸಣ್ಣ ತುಂಡುಗಳನ್ನು ಕತ್ತರಿಸಿ, ಏಡಿ ಕೋಲುಗಳ, ಬೆಳ್ಳುಳ್ಳಿ, ಮೇಯನೇಸ್ ಸೇರಿಸಿ."
264,ಅರ್ಧ ಕಪ್ ತೆಂಗಿನ ತುರಿ
265,ಮೃದುವಾದ ಬೆಣ್ಣೆಯೊಂದಿಗೆ ಬೆರೆಸಿ ಅಥವಾ ಹಣ್ಣುಗಳನ್ನು ತುರಿ ಮಾಡಿ.
266,ತಯಾರು ಹಣ್ಣು ಇದರಿಂದ ತಯಾರಾದ ಲೇಪವನ್ನು ತುರಿ ಅಥವಾ (ಕ್ಯಾಂಡಿ ತೆಳುವಾದ ಹಾಗೆಯೇ) ಅವುಗಳನ್ನು ಹಿಸುಕಿದ ಅಡುಗೆ ಮಾಡಬಹುದು.
267,"ಮತ್ತಷ್ಟು ಯಾವುದೇ ಹಾರ್ಡ್ ಚೀಸ್ ತುರಿ ಮತ್ತು ಸಲಾಡ್ ಮತ್ತೆ ಮೇಯನೇಸ್ ಮೇಲೆ ರಕ್ಷಣೆ ಮತ್ತೊಂದು ಪದರ, ಮೊಟ್ಟ."
268,"ಕ್ಯಾರೆಟ್ ರಸ ಇದನ್ನು ಅತ್ಯಂತ ಹಿಂಡುವ, ಅತ್ಯುತ್ತಮ ತುರಿಯುವ ಮಣೆ ಮೇಲೆ ತುರಿ ಅಗತ್ಯವಿದೆ."
269,"ತಯಾರಿಸುವ ವಿಧಾನ: ಬಾಣಲೆಯಲ್ಲಿ ತುಪ್ಪವನ್ನು ಕಾಯಿಸಿ, ಕ್ಯಾರೆಟ್ ತುರಿ ಹಾಕಿ ಬಾಡಿಸಿ ಹಾಲು ಸೇರಿಸಿ ಕುದಿಸಿ."
270,"ಮತ್ತು ಮಿಶ್ರಣವನ್ನು obsushennuyu ಅವಶೇಷದೊಂದಿಗೆ ತುರಿ ಮಸಾಲೆಗಳೊಂದಿಗೆ ತೊಳೆದು: ಕೆಂಪುಮೆಣಸು (2 ಟೇಬಲ್ಸ್ಪೂನ್), ಉಪ್ಪು (2 ಟೇಬಲ್ಸ್ಪೂನ್), ಸಕ್ಕರೆ (2 ಟೇಬಲ್ಸ್ಪೂನ್), ಕಪ್ಪು ಮೆಣಸು (1 ಟೀಚಮಚ), ಒಣ ಸಾಸಿವೆ (1 ಟೀಚಮಚ)."
271,"ಒಂದು ದೊಡ್ಡ ಕ್ಯಾರಟ್, ತುರಿ ಕತ್ತರಿಸಿದ ಈರುಳ್ಳಿ ಮಿಶ್ರಣ ಮಾಡಬೇಕಾಗುತ್ತದೆ."
272,ತೆಂಗಿನ ತುರಿ - 1 ಕಪ್
273,ವುಡ್ ಗ್ಯಾರೇಜ್ನಲ್ಲಿ ಒಲೆ ಬರೆಯುವ slotted ಕುಳಿಗಳ ಬದಲಿಗೆ ವಿಭಿನ್ನ ಗಾತ್ರದೊಂದಿಗೆ ತುರಿ ಹೊಂದಬಹುದು.
274,"ತುರಿ ಕ್ಯಾರೆಟ್, ಹುಳಿ-ಸಿಹಿ ಸೇಬುಗಳು,, ಎಲೆಕೋಸು ಅತಿಯಾದ ರಸ ಹರಿಸುತ್ತವೆ ಎಲ್ಲಾ ಉತ್ಪನ್ನಗಳು ಮಿಶ್ರಣ."
275,"ಗಸಗಸೆ 50 ಗ್ರಾಂ, ಅಕ್ಕಿ 50 ಗ್ರಾಂ, ಕೊಬ್ಬರಿ ತುರಿ ಅರ್ಧ ಕಪ್‌, ಬೆಲ್ಲ ಸಿಹಿ ಬೇಕಾದಷ್ಟು, ಅರ್ಧ ಕಪ್‌ ಬೇಕಾಗುತ್ತದೆ."
276,"ಚೀಸ್ ದೊಡ್ಡದಾದ ತುರಿ ಮತ್ತು ಸಣ್ಣದಾಗಿ ಕೊಚ್ಚಿದ ಸಬ್ಬಸಿಗೆಯನ್ನು ಮಿಶ್ರಣ ಮಾಡಿ, ಸ್ಕಿಸ್ನ ಉಳಿದ ಭಾಗವನ್ನು ಸ್ನಿಗ್ಧತೆಗಾಗಿ ಸೇರಿಸಿ."
277,"ಏತನ್ಮಧ್ಯೆ ಕಜ್ಜೀ ಕುರು, ತುರಿ ಆದ್ರೆ"
278,"ಮೇಕೆ ಚೀಸ್ ತುರಿ ನುಣ್ಣಗೆ ಬೀಜಗಳು ಕೊಚ್ಚು, ಮತ್ತು ಬೇಯಿಸಿದ ಮೊಟ್ಟೆಗಳು ಚಾಪ್ ಮಾಡಬೇಕು."
279,"ತುರಿ ಕೆಳಗಿನಿಂದ, ಏರ್ ದಹನ ಕೊಠಡಿಯ ಪ್ರವೇಶಿಸುತ್ತದೆ."
280,"ಕ್ಯಾರೆಟ್, ತಂಪಾದ, ಸಿಪ್ಪೆ ಮತ್ತು ತುರಿ ಹುಣ್ಣು."
281,ತೆಂಗಿನ ತುರಿ – ಸ್ವಲ್ಪ
282,"ಇದು ತುರಿ (ಮೇಲಾಗಿ ಸಣ್ಣ) ಚೀಸ್, ಮೇಯನೇಸ್ ಮತ್ತೆ, ಮತ್ತು ಕತ್ತರಿಸಿದ ವಾಲ್್ನಟ್ಸ್ ಕೊನೆಗೆ (ಅವರು ಅನಾನಸ್ ಚರ್ಮದ ಹೋಲುತ್ತವೆ)."
283,"ದೋಸೆ ಹಿಟ್ಟಿಗೆ ಕ್ಯಾರೆಟ್‌ ತುರಿ ಸೇರಿಸಿದರೆ, ದೋಸೆಯ ಬಣ್ಣವೂ ಬದಲಾಗುತ್ತದೆ, ರುಚಿಯೂ ಹೆಚ್ಚುತ್ತದೆ."
284,ಚೀಸ್ (100 ಗ್ರಾಂ) ನುಣ್ಣಗೆ ತುರಿ ಸಣ್ಣ ತುಣುಕು.
285,ಎರಡು ಕ್ಯಾರೆಟ್ ಮತ್ತು ಸೆಲರಿ ಮೂಲ ತುರಿ ಒಂದೆರಡು ಮತ್ತು ಹುರಿಯಲು ಪ್ಯಾನ್ ಕಂದು ಕಳುಹಿಸಿ.
286,"ಸಾಂಬಾರ ಪದಾರ್ಥಗಳು, ತೆಂಗಿನಕಾಯಿ ತುರಿ ಹಾಗೂ ಕರಿಬೇವಿನ ಸೊಪ್ಪಿನ ಜತೆ ಸಣ್ಣ ಉರಿಯಲ್ಲಿ ರೋಸ್ಟ್ ಮಾಡಿರುವ ಉಲರ್ತಿಯತ್ತು ಬೀಫ್ ಅತ್ಯಂತ ಉತ್ಕ್ರಷ್ಟವಾದ ಖಾದ್ಯವಾಗಿದೆ."
287,"ಕೆಲವೊಂದು ಈಳಿಗೆಯ ತುದಿಗೆ ತೆಂಗಿನ ಕಾಯಿ, ಸೌತೆ ಮುಂತಾದುವನ್ನು ತುರಿಯಲು ತುರಿ ಯನ್ನೂ ನಿರ್ಮಿಸಿರುತ್ತಾರೆ."
288,ಚೀಸ್ ತುರಿ ಮತ್ತು ಕತ್ತರಿಸಿದ ಬೆಳ್ಳುಳ್ಳಿ ಸೇರಿ.
289,ಮಾರ್ಗರೀನ್ ತುರಿ ಮತ್ತು ಅಲ್ಲಿ ಕಳುಹಿಸಿ.
290,ಇಂದಿನ ಎರಡು ರೀತಿಯ ನಾಯಿ ಟ್ರೇಗಳು ಇವೆ - ಒಂದು ತುರಿ ಮತ್ತು ಡೈಪರ್ ಹೀರಿಕೊಳ್ಳುವ ತೇವಾಂಶದೊಂದಿಗೆ.
291,ಆರಿದ ನಂತರ ಇದಕ್ಕೆ ತೆಂಗಿನ ತುರಿ ಹಾಗೂ ಮೇಲೆ ತಿಳಿಸಿದ ಎಲ್ಲಾ ಸಾಮಗ್ರಿಗಳು ಹಾಗೂ ಸ್ವಲ್ಪಮಜ್ಜಿಗೆ ಸೇರಿಸಿ ನುಣ್ಣಗೆ ರುಬ್ಬಿ.
292,"malosochen ಆ ಸಲಾಡ್ ಕೊಳದಲ್ಲಿ ಮೀನು ಹಕ್ಕು, ಮತ್ತು ಒಂದು ಚೀಸ್ ತುರಿ ತಾಜಾ ಎಲೆಕೋಸು ಅಥವಾ ಸೌತೆಕಾಯಿ ನೀಡುವ ಷೆಫ್ಸ್ ಇವೆ."
293,ನಾವು ತನಕ ತರಕಾರಿಗಳನ್ನು ತುರಿ (ಅಥವಾ ಸ್ಕೀಯರ್ಗಳ ಮೇಲೆ ಸ್ಟ್ರಿಂಗ್) ಮತ್ತು ಮರಿಗಳು ಮೇಲೆ ಹಾಕಿದ ನಂತರ.
294,ಮೂಲತಃ ಗುಜರಾತ್‌ನವರಾದ ಅಶ್ವಿನ್‌ ಕುಮಾರ್‌ ಷಾ(60) ತಿಪಟೂರಿನಲ್ಲಿ ಕೊಬ್ಬರಿ ತುರಿ ಘಟಕ ನಡೆಸುತ್ತಿದ್ದರು.
295,* ಮೂರು ಕಪ್ ತೆಂಗಿನಕಾಯಿ ತುರಿ
296,"ಶುಂಠಿಯ ಮೂಲವನ್ನು ಸ್ವಚ್ಛಗೊಳಿಸಿ ಮತ್ತು ತುರಿ ಮಾಡಿ (ಎಲ್ಲರೂ ಅಲ್ಲ, ಆದರೆ 3-5 ಸೆ."
297,"ಸಾಧನದ ದೀರ್ಘಾಯಸ್ಸಿಗೆ ಮತ್ತು ಗುಣಮಟ್ಟದ ವ್ಯವಸ್ಥೆಯನ್ನು ಸುಧಾರಿಸುವ ಅತ್ಯಂತ ವಿಶ್ವಾಸಾರ್ಹ ಘಟಕಗಳನ್ನು - ನೀವು ತುರಿ ಕೂಲಿಂಗ್ ಕೆಳಗೆ ನೋಡಿದರೆ, ನಾವು ಎನ್ವಿಡಿಯದ ಯಾವುದೇ ಗ್ರಾಫಿಕ್ಸ್ ಕಾರ್ಡ್ ಹೆಮ್ಮೆಯ ನೋಡಬಹುದು."
298,"ಮಾಡುವ ವಿಧಾನ: ಪಾತ್ರೆಯಲ್ಲಿ ನೀರನ್ನು ಕುದಿಯಲು ಇಟ್ಟು, ಹುರಿಗಡಲೆ, ಕೊತ್ತಂಬರಿಸೊಪ್ಪು, ಶುಂಠಿ, ಒಣಮೆಣಸು,ತೆಂಗಿನ ತುರಿ ಹಾಕಿ ರುಬ್ಬಿಕೊಳ್ಳಿ."
299,ಕ್ಯಾರೆಟ್ ಅದೇ ಪ್ರಮಾಣದ ಈರುಳ್ಳಿ ತುರಿ ಮತ್ತು ಸ್ಟ್ಯೂ ಒರಟಾಗಿ.
300,"ನಂತರ ನೀವು ಒಂದು ಉತ್ತಮ ತುರಿಯುವ ಮಣೆ ಮೇಲೆ ಅಗತ್ಯವಿದೆ, ಚೀಸ್ ತುರಿ ಅವುಗಳನ್ನು ಸುಮಾರು ಸಿದ್ಧಪಡಿಸಿದ ಭಕ್ಷ್ಯ ಸಿಂಪಡಿಸಿ, ಮತ್ತೆ ತಯಾರಿಸಲು ಕಳುಹಿಸಿ (ಎರಡು ನಿಮಿಷಗಳಲ್ಲಿ), ಮತ್ತು ನಂತರ ನೀವು ಮೇಜಿನ ತರುತ್ತವೆ."
301,"ಮುಂದೆ, ನೀವು ದೊಡ್ಡ ತುರಿಯುವ ಮಣೆ ಮೇಲೆ ಕ್ಯಾರೆಟ್ ತುರಿ ಮತ್ತು ಘನಗಳು ಆಗಿ ಈರುಳ್ಳಿ ಕತ್ತರಿಸಿ ಅಗತ್ಯವಿದೆ."
302,ನಂತರ ನೀವು ಸೇಬುಗಳು ತುರಿ ಅಗತ್ಯವಿದೆ.
303,ಕೇವಲ ಬೇರಿನ ತುಂಡು ತೆಗೆದುಕೊಂಡು ತುರಿ ಮತ್ತು ಕುದಿಯುವ ನೀರಿನಿಂದ ಭರ್ತಿ 12-15 ನಿಮಿಷಗಳ ನಿಲ್ಲಲು ಅವಕಾಶ.
