Index,Sentence
169,ಕಂಬಳ ಗದ್ದೆಯಲ್ಲಿ ಮುಖ್ಯವಾಗಿ ಎರಡು ವಿಧಗಳಿವೆ.
170,"ಆಮಂತ್ರಣ ಪತ್ರಿಕೆ ಬಿಡುಗಡೆಗೊಳಿಸಿ ಮಾತನಾಡಿದ ಕಂಬಳ ಸಮಿತಿಯ ಅಧ್ಯಕ್ಷ ಅಶೋಕ್ ಕುಮಾರ್ ರೈ ಕೋಡಿಂಬಾಡಿ, ತುಳುನಾಡಿನ ಜನಪದ ಕಲೆ ಕಂಬಳವನ್ನು ಪ್ರವಾಸೋದ್ಯಮವಾಗಿ ಬೆಳೆಸಲು ಸರಕಾರಕ್ಕೆ ಒತ್ತಾಯಿಸಲು ವಿಜಯ- ವಿಕ್ರಮ ಕಂಬಳ ಸಮಿತಿ ನಿರ್ಧರಿಸಿದ್ದು, ಉಪ್ಪಿನಂಗಡಿ ಕಂಬಳಕ್ಕೆ ಮುಖ್ಯಮಂತ್ರಿ ಬಿ."
171,ಈ ಹಿನ್ನೆಲೆಯಲ್ಲಿ ಈಗಾಗಲೇ ನಿಗದಿಯಾಗಿರುವ ಪುತ್ತೂರಿನ ಕೋಟಿ-ಚೆನ್ನಯ ಜೋಡುಕರೆ ಕಂಬಳ ಹಾಗೂ ಉಪ್ಪಿನಂಗಡಿಯ ವಿಜಯ-ವಿಕ್ರಮ ಜೋಡುಕರೆ ಕಂಬಳ ಕೂಟಕ್ಕೆ ಅಡಚಣೆಯಾಗಬಹುದೆಂಬ ಭೀತಿ ಇದ್ದ ನಿಟ್ಟಿನಲ್ಲಿ ಉಪ್ಪಿನಂಗಡಿಯ ವಿಜಯ-ವಿಕ್ರಮ ಜೋಡುಕರೆ ಕಂಬಳ ಸಮಿತಿ ಅಧ್ಯಕ್ಷರಾಗಿರುವ ಕೋಡಿಂಬಾಡಿ ರೈ ಎಸ್ಟೇಟ್ ಮಾಲಕ ಅಶೋಕ್ ಕುಮಾರ್ ರೈಯವರು ನ್ಯಾಯವಾದಿ ರಾಜಶೇಖರ್ ಇಲ್ಯಾರ್‌ರವರ ಮೂಲಕ ಹೈಕೋರ್ಟ್‌ಗೆ ಫೆ.
172,23: ರಾಜ್ಯದಲ್ಲಿ ಕಂಬಳ ಕ್ರೀಡೆ ಆಯೋಜನೆಗೆ ಹೈಕೋರ್ಟ್ ನಿರ್ಬಂಧ ಹೇರಿರುವ ಹಿನ್ನೆಲೆಯಲ್ಲಿ ದಕ್ಷಿಣ ಕನ್ನಡ ಮತ್ತು ಉಡುಪಿ ಜಿಲ್ಲಾ ಕಂಬಳ ಸಮಿತಿಯ ನೇತೃತ್ವದಲ್ಲಿ ಇಂದು ಸಂಜೆ ನಗರದ ಖಾಸಗಿ ಹೊಟೇಲ್‌ನಲ್ಲಿ ಸಭೆ ನಡೆಸಿ ಕಾನೂನು ಹೋರಾಟಕ್ಕೆ ನಿರ್ಣಯ ಕೈಗೊಳ್ಳಲಾಯಿತು.
173,"ಆದರೆ, ಕಂಬಳ ಕ್ರೀಡೆಯಲ್ಲಿ ಹಿಂದೆಂದೂ ಸಾವುನೋವು ಸಂಭವಿಸಿರುವ ಉದಾಹರಣೆ ಇಲ್ಲ ಎಂದರು."
174,ಮಂಗಳವಾರ ವಿಧಾನಸಭೆಯಲ್ಲಿ ಕಂಬಳ ಸಂಬಂಧಿತ ವಿಧೇಯಕ ಪಾಸ್ ಆಗಿದೆ.
175,ಕೃಷಿಸಿರಿಯ ಕಾರ್ಯಕ್ರಮಗಳಲ್ಲಿ ಒಂದಾದ ಕಂಬಳ ಓಟದ ಕೋಣಗಳ ಸೌಂದರ್ಯ ಸ್ಪರ್ಧೆಯಲ್ಲಿ ಸುಮಾರು 8 ಜೋಡಿ ಕೋಣಗಳು […]
176,ಪನಿ ಕುಲ್ಲುನು ಅಂದರೆ ಕೊರಗರು ತಮ್ಮ ಹೆಂಡತಿ ಮಕ್ಕಳ ಜೊತೆ ಇಡೀ ರಾತ್ರಿ ಕಂಬಳ ಗದ್ದೆಯನ್ನು ಕಾಯಬೇಕು.
177,ಹೆಚ್ಚಾದ ಕಂಬಳ ಕಿಚ್ಚು: ಜ.
178,ಜತೆಗೆ ತುಳುನಾಡಿನ ಸಂಸ್ಕೃತಿ-ಆಚಾರ-ವಿಚಾರಗಳನ್ನು ಉಳಿಸಿಕೊಂಡು ಹೋಗಲು ಕಂಬಳ ಕ್ರಿಡೆ ಅಗತ್ಯಗತ್ಯ ಎಂದು ಮಾಜಿ ಸಚಿವ ಕೃಷ್ಣ ಜೆ.
179,"ಆದರೆ, ಇದೀಗ ಕಂಬಳ ನಡೆಸಲು ಇರುವ ಅಡ್ಡಿಗಳನ್ನು ಶಾಶ್ವತ ವಾಗಿ ನಿವಾರಿಸಲು ವಿಧಾನಮಂಡಲ ಅಂಗೀಕರಿಸಿದ್ದ ಮಸೂದೆ ಯಾವಾಗ ಜಾರಿಗೆ ಬರಲಿದೆ ಎಂಬ ಪ್ರಶ್ನೆಗಳು ಕಂಬಳ ಪ್ರಿಯರನ್ನು ಕಾಡತೊಡಗಿವೆ."
180,ಕಾವೇರುತ್ತಿದೆ ಕಂಬಳ ಕಾಪಾಡಿ ಕೂಗು
181,"ಕಂಬಳ ಗ್ರಾಮೀಣ ಕ್ರೀಡೆ, ಆಚರಣೆಗೆ ಅಭ್ಯಂತರವೇನಿಲ್ಲ."
182,ಒಂಟಿ ಗದ್ದೆಯ ಕಂಬಳ
183,"ದಕ್ಷಿಣ ಕನ್ನಡ, ಉಡುಪಿ, ಕಾಸರಗೋಡು ಸಹಿತ ಸಮಗ್ರ ತುಳುನಾಡಿನ ಮೂಲೆ ಮೂಲೆಗಳಿಂದ 133 ಜೋಡಿ ಕೋಣಗಳು ಪಾಲ್ಗೊಂಡಿದ್ದು, ದೇವಸ್ಥಾನದ ಎದುರಿನ 14 ಎಕರೆ ವಿಶಾಲ ದೇವರಮಾರು ಗದ್ದೆಯಲ್ಲಿ ಜನ ಸಾಗರದ ನಡುವೆ ಕಂಬಳ ಭಾರಿ ಯಶಸ್ಸು ಕಂಡಿತು."
184,"ಈ ಪ್ರದೇಶದಲ್ಲಿರುವ ಜಾನಪದ, ಬುಡಕಟ್ಟು ಸಂಸ್ಕೃತಿ, ಯಕ್ಷಗಾನ, ಕಂಬಳ ಇಂತಹವನ್ನೆಲ್ಲಾ ಇಂದಿಗೂ ಬೆಳೆಸಿಕೊಂಡು ಅದು ಇಂದಿಗೂ ಜೀವಂತವಾಗಿರುವುದಕ್ಕೆ ಅಲ್ಲಿನ ಪರಂಪರೆಯೇ ಮುಖ್ಯ ಕಾರಣ ಎನ್ನಬಹುದು."
185,ಬೇರೆ ಬೇರೆ ಊರಿನ ಜನರು ಒಂದೆಡೆ ಸೇರಿ ತಮ್ಮ ಕೃಷಿ ಕಾರ್ಯಗಳ ಬಗ್ಗೆ ಮಾತುಕತೆ ನಡೆಸಲು ಕಂಬಳ ಪೂರಕವಾಗಿದೆ ಎಂದರು.
186,"ಈ ವಿಧೇಯಕದ ನಂತರ ಅಂದರೆ, ಮುಂದಿನ ಶನಿವಾರ-ಭಾನುವಾರದಿಂದ ಕಂಬಳ ನಡೆಸಬಹುದೇ ?"
187,ಬಂಟ್ವಾಳ: ತುಳುನಾಡಿನಿಂದ ದೂರ ಸರಿಯುವ ಸಾಂಪ್ರದಾಯಿಕ ಆಚರಣೆಗಳ ಪೈಕಿ ಕಂಬಳ ಕೋರಿ ಎಂಬ ಗದ್ದೆಪೂಜೆ ಪ್ರಮುಖ.
188,ಬೆಂಗಳೂರಿನಲ್ಲಿ ಅತ್ಯಂತ ವೇಗದ ಕಂಬಳ ಓಟಗಾರ ಎಂದು ಶ್ರೀನಿವಾಸ್ ಗೌಡ ಸನ್ಮಾನ ಸ್ವೀಕರಿಸುತ್ತಿದ್ದಂತೆ ಬಂದ ಹೊಸ ಸುದ್ದಿ ಗೌಡರ ದಾಖಲೆಯನ್ನು ಮತ್ತೋರ್ವ ಕಂಬಳ ಓಟಗಾರ ಜೋಗಿಬೆಟ್ಟು ನಿಶಾಂತ್ ಶೆಟ್ಟಿ ಮುರಿಯುವ ಮೂಲಕ ಮತ್ತೊಂದು ದಾಖಲೆ ಬರೆದಿದ್ದಾರೆ ಎಂದಾಗಿತ್ತು.
189,: ಕಂಬಳ ಕ್ರೀಡೆಯಲ್ಲಿ ಪ್ರಾಣಿಗಳಿಗೆ ಹಿಂಸೆ ನೀಡಲಾಗುತ್ತದೆ.
190,ಶನಿವಾರ ಬೆಳಿಗ್ಗೆ ೧೧ ಗಂಟೆಗೆ ಆರಂಭವಾದ ಕಂಬಳ ಆದಿತ್ಯವಾರ ಬೆಳಿಗ್ಗೆ ೯ ಗಂಟೆಗೆ ಕೊನೆಗೊಂಡಿತು.
191,ರಾಜ್ಯ ಸರ್ಕಾರ ಆದೇಶ ನೀಡಿದ ಪ್ರಕಾರವೇ ದಕ್ಷಿಣ ಕನ್ನಡ ಜಿಲ್ಲೆಯಲ್ಲಿ ಕಂಬಳ ಶರತ್ತುಬದ್ಧವಾಗಿಯೇ ನಡೆಯುತ್ತಿದೆ.
192,ಕಂಬಳ ಉಳಿವಿಗಾಗಿ ನಡೆದ ಹೋರಾಟದಲ್ಲಿ ವಿನು ವಿಶ್ವನಾಥ್ ಶೆಟ್ಟಿ ಅವರು ಸಕ್ರಿಯವಾಗಿ ಪಾಲ್ಗೊಂಡಿದ್ದರು.
193,ಕಂಬಳ ವೀರ ರಾಕೆಟ್‌ ಮೋಡೆಗೆ ಅಮೃತ ಶಿಲೆಯ ಗೋರಿ
194,ಮಂಗಳೂರು: ಕಂಬಳ ಮಸೂದೆಗೆ ಶೀಘ್ರ ರಾಷ್ಟ್ರಪತಿಗಳ ಅಂಕಿತ ಬೀಳುವ ನಿರೀಕ್ಷೆ ಇದೆ.
195,"ತುಳು ಚಿತ್ರರಂಗ ನಿರ್ದೇಶಕ, ರಂಗಕರ್ಮಿ ವಿಜಯಕುಮಾರ್ ಕೊಡಿಯಾಲ್‍ಬೈಲ್, ಕಂಬಳ ಸಮಿತಿ ಅಧ್ಯಕ್ಷ ಅಶೋಕ್ ರೈ ಮುಂತಾದವರು ಮತನಾಡಿದರು."
196,"ಮತ್ತು ಉಡುಪಿ ಜಿಲ್ಲೆಯ ಕಂಬಳ ವೀಕ್ಷಕರ ಪಾಲಿಗೆ ಕಂಬಳ ಎನ್ನುವುದು ಧಾರ್ಮಿಕ ನಂಬಿಕೆ, ಸಂಪ್ರದಾಯಿಕ ಕ್ರೀಡೆಯ ಜೊತೆಗೆ ಮನೋರಂಜೆನಯೂ ಆಗಿತ್ತು."
197,ಜಮೀನ್ದಾರಿ ಕುಟುಂಬಗಳ ಮಧ್ಯೆ ನಡೆಯುವ ಪಕ್ಕಾ ಫ್ಯೂಡಲ್ ಕ್ರೀಡೆಯಾಗಿರುವ ಕಂಬಳ ಈಗ ಸ್ವರೂಪದಲ್ಲಿ ಸ್ವಲ್ಪ ಮಾರ್ಪಾಡುಗಳನ್ನು ಹೊಂದಿದೆಯಾದರೂ ಆಳದಲ್ಲಿ ಫ್ಯೂಡಲ್ ವ್ಯವಸ್ಥೆಯನ್ನು ಜಾರಿಯಲ್ಲಿಡುವ ತಂತ್ರವೇ ಆಗಿದೆ.
198,"ಕಾರ್ಯಕ್ರಮದಲ್ಲಿ ಕಂಬಳ ಸಮಿತಿಯ ಕೋಶಾಧಿಕಾರಿ ಪ್ರಸನ್ನ ಕುಮಾರ್ ಶೆಟ್ಟಿ ಸಿಜ್ಲರ್ ಸಾಮೆತ್ತಡ್ಕ,ಕಾರ್ಯದರ್ಶಿ ದಿನೇಶ್ ಕುಲಾಲ್ ಪಿ."
199,"ಕಂಬಳ ಕರಾವಳಿ ಕರ್ನಾಟಕದ ಸಂಸ್ಕೃತಿಯ ಅವಿಭಾಜ್ಯ ಅಂಗವಾಗಿದ್ದು, ಸುಮಾರು 800 ವರ್ಷಗಳ ಇತಿಹಾಸವನ್ನು ಹೊಂದಿದೆ."
200,ಕಂಬಳ ಮಸೂದೆ ನಾಳೆ ಮಂಡನೆ
201,ಕಂಬಳ ಹೋರಾಟ ಸಮಿತಿಯ ವಿನಂತಿಯಂತೆ ನ್ಯಾಯಾಲಯದಲ್ಲಿ ಕಂಬಳದ ಪರವಾಗಿ ತೀರ್ಪು ಬರುವಂತೆ ಮಾಡಲು ಅಗತ್ಯವಿರುವ ಸರಕಾರಿ ಆದೇಶ ಹೊರಡಿಸಲಾಗಿದೆ ಎಂದರು.
202,ಇದಕ್ಕೆ ಅಡ್ಡಲಾಗಿ ಕದ್ರಿ ಕಂಬಳ ಜಂಕ್ಷನ್‌ನಲ್ಲಿ ಆಟೊವೊಂದು ಪಿಯೊ ಮಾಲ್ ಕಡೆಗೆ ತಿರುಗುವುದನ್ನು ಕಂಡ ಲಾರಿ ಚಾಲಕನು ತೀರಾ ಬಲಭಾಗಕ್ಕೆ ಲಾರಿ ಚಲಾಯಿಸಿ ಮುಂದೆ ಸಾಗಿದ್ದಾನೆ.
203,ಕಂಬಳ ವಿಚಾರದಲ್ಲಿ ರಾಜ್ಯ ಸರ್ಕಾರ ಇಕ್ಕಟ್ಟಿಗೆ ಸಿಲುಕಿದೆ.
204,ಆಗ ಜಿಲ್ಲಾಧಿಕಾರಿಗಳು ಕಂಬಳ ನಡೆಸಲು ಯಾವುದೇ ತೊಂದರೆ ಇಲ್ಲಾ ಎಂದು ಹೇಳಿದ್ದರು.
205,"ಕಂಬಳಕ್ಕೆ ಸುಪ್ರೀಂ ಕೋರ್ಟ್ ನಿಷೇಧ ಹೇರಿದ 2016-17ರಲ್ಲಿ ಅರಮನೆ ಕುಟುಂಬದ ಕೋಣನ ಜೋಡಿಯನ್ನು ಗದ್ದೆಗೆ ಇಳಿಸಿ ಒಂದು ಸುತ್ತು ನಡೆಸಿ ಸಂಪ್ರದಾಯವನ್ನು ಕಾಪಾಡಿದ್ದೇವೆ ಎಂದು ಜಿಲ್ಲಾ ಕಂಬಳ ಸಮಿತಿಯ ಸದಸ್ಯರೂ, ಕಂಬಳದ ತೀರ್ಪುಗಾರರೂ ಆದ ವಿಜಯಕುಮಾರ್ ಕಂಗಿನಮನೆ ಕಂಬಳದ ಸಂದರ್ಭದಲ್ಲಿ ಸುದ್ದಿಗಾರರಿಗೆ ತಿಳಿಸಿದರು."
206,ಕಾರ್ಕಳ: ಈದು ಕಂಬಳ ಸಂಪನ್ನ
207,ಕರಾವಳಿ ಕರ್ನಾಟಕದ ಬೈಂದೂರಿನಿಂದ ಕೇರಳದ ಕಾಸರಗೋಡಿನವರೆಗೆ ನೂರಾರು ಕಂಬಳ ಗದ್ದೆಗಳಿರುತ್ತವೆ.
208,Home ಕನ್ನಡ ವಾರ್ತೆಗಳು ಕರ್ನಾಟಕ ಕಂಬಳ ಕೋಣಗಳನ್ನು ಸಾಕುವ ಪರಿಯನ್ನು ಪೆಟಾದವರು ನೋಡಬೇಕು!
209,"ಕಂಬಳ ಸಮಿತಿ ನೂತನ ಅಧ್ಯಕ್ಷ, ಶಾಸಕ ಉಮಾನಾಥ ಕೋಟ್ಯಾನ್‌ ನೇತೃತ್ವದಲ್ಲಿ…"
210,"ಪಿ ಸುಚರಿತ ಶೆಟ್ಟಿ, ತಹಶೀಲ್ದಾರ್‌ ಅನಿತಾಲಕ್ಷ್ಮೀ, ಕಂಬಳ ಸಮಿತಿಯ ಗೌರವ ಸಲಹೆಗಾರ, ಆಳ್ವಾಸ್‌ ಪ್ರವರ್ತಕ ಡಾ| ಎಂ."
211,"ಬೆಂಗಳೂರು: ತಮಿಳುನಾಡಿನಲ್ಲಿ ಜಲ್ಲಿಕಟ್ಟು ಪರ ನಡೆದ ಹೋರಾಟ ಯಶಸ್ವಿಯಾಗುತ್ತಿದ್ದಂತೆ, ರಾಜ್ಯದ ಜನಪದ ಕ್ರೀಡೆ ಕಂಬಳ ಪರ ಧ್ವನಿ ಹೆಚ್ಚಾಗಿದೆ."
212,"3: ಕಂಬಳ ವಿಶೇಷ ವಿಧೇಯಕಕ್ಕೆ ರಾಷ್ಟ್ರಪತಿ ಪ್ರಣವ್ ಮುಖರ್ಜಿ ಸಹಿ ಹಾಕಿದ್ದು, ಇದರಿಂದಾಗಿ ಕರಾವಳಿಯ ಜಾನಪದ ಕ್ರೀಡೆಯ ಉಳಿವಿಗಾಗಿ ನಡೆಸಿದ ಹೋರಾಟಕ್ಕೆ ಜಯ ಸಿಕ್ಕಂತಾಗಿದೆ."
213,"ಪತ್ರಿಕಾಗೋಷ್ಠಿಯಲ್ಲಿ ಕಂಬಳ ಸಮಿತಿಯ ಪದಾಧಿಕಾರಿಗಳಾದ ಭಾಸ್ಕರ್ ಕೊಟ್ಯಾನ್, ಮಿಥುನ್ ರೈ, ದೇವಿ ಪ್ರಸಾದ್ ಶೆಟ್ಟಿ ಮತ್ತಿತ್ತರರು ಉಪಸ್ಥಿತರಿದ್ದರು."
214,ಅರ್ಜಿಯನ್ನು ಪರಿಶೀಲನೆ ನಡೆಸಿ ವಾದವನ್ನು ಆಲಿಸಿದ ಹೈಕೋರ್ಟು ವಿಭಾಗೀಯ ಪೀಠವು ಕಳೆದ ಬಾರಿಯ ಷರತ್ತುಗಳನ್ನು ಪಾಲಿಸಿಕೊಂಡು ಯಥಾಸ್ಥಿತಿಯಲ್ಲಿ ಕಳೆದ ವರ್ಷದ ಮಾನದಂಡದಂತೆ ಕಂಬಳ ಕೂಟವನ್ನು ಆಯೋಜಿಸಬಹುದಾಗಿದೆ ಎಂದು ತನ್ನ ಆದೇಶದಲ್ಲಿ ತಿಳಿಸಿದೆ.
215,ಪ್ರತೀ ಬಾರಿಯೂ ವ್ಯವಸ್ಥಿತ ರೀತಿಯಲ್ಲಿ ಜರಗುವ ಪುತ್ತೂರು ಕಂಬಳವು ಕಂಬಳ ಸಮಿತಿಯ ಹಾಗೂ ಕಂಬಳ ಪ್ರೇಮಿಗಳ ಸರ್ವರ ಸಹಕಾರದಿಂದ ಯಶಸ್ವಿಯಾಗಿದೆ –ಎನ್.
216,"ಕಂಬಳ , ಭತ್ತದ ಮೈದಾನದಲ್ಲಿ ಮಣ್ಣಿನ ಟ್ರ್ಯಾಕ್ನಲ್ಲಿರುವ ಎಮ್ಮೆ ಓಟದ ಒಂದು ರೂಪವನ್ನು ಜಿಲ್ಲೆಯ 16 ಸ್ಥಳಗಳಲ್ಲಿ ಆಯೋಜಿಸಲಾಗಿದೆ."
217,Home ಕನ್ನಡ ವಾರ್ತೆಗಳು ರಾಷ್ಟ್ರೀಯ ಉಪರಾಷ್ಟ್ರಪತಿಯಿಂದ ಕಂಬಳ ಓಟಗಾರ ಶ್ರೀನಿವಾಸ ಗೌಡರಿಗೆ ಕನ್ನಡದಲ್ಲಿ ಶುಭ ಹಾರೈಕೆ
218,"ಇದೀಗ ಕಂಬಳ ಕೋಣಗಳ ಜೊತೆ ಓಡಿ ವಿಶಿಷ್ಟ ದಾಖಲೆ ಮಾಡಿರೋ ಶ್ರೀನಿವಾಸ್ ಗೌಡ ಈ ಬಗ್ಗೆ ಮಾತನಾಡಿದ್ದು, ಜನರೆಲ್ಲಾ ನನ್ನನ್ನು ಉಸೈನ್‌ ಬೋಲ್ಟ್‌ಗೆ ಹೋಲಿಸುತ್ತಿದ್ದಾರೆ."
219,ಬಂಟ್ವಾಳ: ತುಳುನಾಡಿನಲ್ಲಿ ಅನಾದಿ ಕಾಲದಿಂದ ಕೖಷಿಕರು ನಡೆಸಿಕೊಂಡು ಬರುತ್ತಿರುವ ಸಾಂಪ್ರದಾಯಿಕ ಮತ್ತು ಅಹಿಂಸಾತ್ಮಕ ಕಂಬಳ ವಿಶೇಷ ಧಾಮಿ೯ಕ ನಂಟು ಮತ್ತು ನಂಬಿಕೆ ಆಧಾರದಲ್ಲಿ ನಡೆಯುತ್ತಿದೆ ಎಂದು ಪೂಂಜ ಶ್ರೀ.
220,ಬೆಳ್ತಂಗಡಿ : ಬಂಗಾಡಿ-ಕೊಲ್ಲಿಯಲ್ಲಿ ಜರಗಿದ 22ನೇ ವರ್ಷದ ಸೂರ್ಯ- ಚಂದ್ರ ಜೋಡುಕರೆ ಕಂಬಳ ಕೂಟದ ಫಲಿತಾಂಶ ಪ್ರಕಟಗೊಂಡಿದೆ.
221,ಮಂಗಳೂರು: ರಾಮ-ಲಕ್ಷ್ಮಣ ಜೋಡುಕರೆ ಕಂಬಳ ಫಲಿತಾಂಶ
222,ಜಿಲ್ಲಾ ಕಂಬಳ ಸಮಿತಿಯ ಮೂಲಕ ಅ.
223,"ಕಂಬಳ ಗ್ರಾಮೀಣ ಕ್ರೀಡೆ ಕುರಿತಂತೆ ಟ್ವಿಟರ್‌ನಲ್ಲಿ ಹೇಳಿಕೆ ನೀಡಿರುವ ಅವರು, ಕಂಬಳ ಕ್ರೀಡೆಯ ಬಗ್ಗೆ ಕನ್ನಡಿಗರಲ್ಲಿ ಒಗ್ಗಟ್ಟಿನ ಕೊರತೆಯಿದ್ದು, ಈ ಸಂದರ್ಭದಲ್ಲಾದರೂ ಎಲ್ಲರೂ ಒಂದಾಗಬೇಕು."
224,ಗ್ರಾಮೀಣ ಕ್ರೀಡೆಗಳ ಪ್ರಾಮುಖ್ಯೆತೆಗಳನ್ನು ಮನಗಂಡು ಕೇಂದ್ರ ಸರಕಾರವು ಕಂಬಳ ಹಾಗೂ ಕಂಬಳದಂತಹ ಜಾನಪದ ಕ್ರೀಡೆಗಳನ್ನು ನಡೆಸಲು ಅನುಮತಿ ನೀಡುವುದಲ್ಲದೆ ಸರಕಾರವೇ ಇಂತಹ ಕ್ರೀಡೆಗಳನ್ನು ನಡೆಸಲು ಪ್ರೋತ್ಸಾಹವನ್ನು ನೀಡಬೇಕು.
225,": ಕರಾವಳಿಯ ಹೆಮ್ಮೆಯ ಜಾನಪದ ಕ್ರೀಡೆ ಕಂಬಳವನ್ನು ನವೆಂಬರ್ 26ರ ವರೆಗೆ ನಡೆಸದಂತೆ ರಾಜ್ಯ ಹೈಕೋರ್ಟ್ ಮಧ್ಯಂತರ ತಡೆ ನೀಡಿದ್ದು, ಇದರಿಂದ ಕಂಬಳ ಆಯೋಜಕರಿಗೆ ಸಂಕಷ್ಟ ತಂದಿದೆ."
226,ಕರಾವಳಿಯ ಸ್ಟಾರ್ ಕಂಬಳ ಓಟಗಾರರಾಗಿರುವ ಅವರು ಈಗ ದೇಶದ ಜನಪದ ಕ್ರೀಡಾ ಸ್ಟಾರ್.
227,ದಕ್ಷಿಣ ಕನ್ನಡ ಜಿಲ್ಲೆಯ ಮೂಡಬಿದ್ರೆಯ ಅಶ್ವಥಪುರ ನಿವಾಸಿ ಕಂಬಳ ಕೋಣದ ಓಟಗಾರ ಶ್ರೀನಿವಾಸ ಗೌಡ ಈಗ ಹೊಸ ದಾಖಲೆಯನ್ನು ಬರೆದಿದ್ದಾರೆ.
228,ವವರೆಗೂ ಹೋರಾಟ ನಿಲ್ಲಿಸಬೇಡಿ ಎಂದು ರಾಜ್ಯಪಾಲ ವಜುಭಾಯಿ ವಾಲಾ ಕಂಬಳ ಪ್ರಿಯರನ್ನು ಹುರಿದುಂಬಿಸಿದರು.
229,ಕಂಬಳ ಪೂರ್ವಭಾವಿಯಾಗಿ ನಡೆಯವ ಈ ಕ್ರಿಯೆಯನ್ನು ಕುದಿಕಂಬಳ ಎಂದು ಕಂಬಳ ಕೂಟದ ಸಂದರ್ಭದಲ್ಲಿ ಕರೆಯುತ್ತಾರೆ.
230,21): ಕರಾವಳಿಯಲ್ಲಿ ಕಂಬಳ ಕೋಣದ ಓಟಕ್ಕೆ ಮತ್ತೆ ಬ್ರೇಕ್ ಬೀಳುವ ಅಪಾಯ ಕಂಡು ಬರುತ್ತಿದೆ.
231,ಕಂಬಳ ನಿಲ್ಲಲು ಸಾಧ್ಯವಿಲ್ಲ.
232,"2: ಜಿಲ್ಲಾ ಕಂಬಳ ಸಮಿತಿ ಅಧ್ಯಕ್ಷ ಬಾರ್ಕೂರು ಶಾಂತಾರಾಮ ಶೆಟ್ಟಿ ಅವರ ಅಧ್ಯಕ್ಷತೆಯಲ್ಲಿ ಶನಿವಾರ ಮೂಡುಬಿದಿರೆ ಸ್ವರ್ಣ ಮಂದಿರದಲ್ಲಿ ನಡೆದ ಮಹಾಸಭೆಯಲ್ಲಿ ಕಂಬಳ ಉಳಿಸಿ, ಮುಂದುವರಿಸುವ ಕುರಿತು ಚರ್ಚೆ, ಸಮಾಲೋಚನೆ ನಡೆಯಿತು."
233,ಪಶ್ಚಿಮ ಬಂಗಾಳ ಕಂಬಳ
234,ಕಡಲಕೆರೆ: ಕೋಟಿ-ಚೆನ್ನಯ ಕಂಬಳ
235,ಕಂಬಳದುದ್ದಕ್ಕೂ ಕೆಂಪು ಶಾಲು ಹಾಕಿಕೊಂಡ ಕಂಬಳ ಸಮಿತಿಯ ಪದಾಧಿಕಾರಿಗಳು ಹಾಗೂ ಸದಸ್ಯರು ರಾರಾಜಿಸುತ್ತಿದ್ದರು
236,"ಸರಳ, ಸಜ್ಜನಿಕೆಯ ವ್ಯಕ್ತಿತ್ವದ ಹರೀಶ್ಚಂದ್ರ ಆಚಾರ್ಯರವರು ಉಪ್ಪಿನಂಗಡಿಯಲ್ಲಿರುವ ಶಿಲ್ಪಾ ಗ್ಲಾಸ್ ಆಂಡ್ ಪ್ಲೈವುಡ್ ಸಂಸ್ಥೆಯ ಮಾಲಕರಾಗಿದ್ದು, ಉಪ್ಪಿನಂಗಡಿಯ ರಾಮನಗರದ ಶ್ರೀ ಶಾರದೋತ್ಸವ ಸಮಿತಿ, ಶ್ರೀ ಕಾಳಿಕಾಂಬಾ ಯಕ್ಷಗಾನ ಕಲಾ ಸಂಘ, ಶ್ರೀ ಗಣೇಶೋತ್ಸವ ಸಮಿತಿ, ಉಪ್ಪಿನಂಗಡಿ ವಿಜಯ- ವಿಕ್ರಮ ಕಂಬಳ ಸಮಿತಿ ಸೇರಿದಂತೆ ಹಲವು ಸಂಘ ಸಂಸ್ಥೆಗಳಲ್ಲಿ ತನ್ನನ್ನು ತೊಡಗಿಸಿಕೊಂಡಿದ್ದರು."
237,"ಮೈಸೂರು: ಕಂಬಳ ವಿಚಾರಕ್ಕೆ ಅಗತ್ಯಬಿದ್ದರೆ ಸುಗ್ರೀವಾಜ್ಞೆ ಹೊರಡಿಸಲ ಸಿದ್ದ, 6ನೇ ತಾರೀಖು ಕೋರ್ಟ್ ನಲ್ಲಿ ವಿಚಾರಣೆ ಇದ್ದು ಕಾದು ನೋಡುತ್ತೇವೆ."
238,ಕಂಬಳ ತೀರ್ಪುಗಾರ ಹಾಗೂ ಕಂಬಳ ಸಮಿತಿಯ ಉಪಾಧ್ಯಕ್ಷ ನಿರಂಜನ್ ರೈ ಮಠಂತಬೆಟ್ಟು ಕಾರ್ಯಕ್ರಮ ನಿರೂಪಿಸಿದರು.
239,ಕಾರ್ಕಳ : ಬಜಗೋಳಿಯ ಲವ-ಕುಶ ಜೋಡುಕೆರೆ ಕಂಬಳ ಫೆಬ್ರವರಿ ನಾಲ್ಕರಂದು ನಡೆಯಲಿದೆ.
240,ಕಂಬಳದ ಕುರಿತು ವಿಶೇಷಜ್ಞರಾಗಿರುವ ಹಾಗೂ 30 ವರ್ಷಗಳಿಂದ ಪ್ರತಿಷ್ಠಿತ ಬಾರಾಡಿ ಸೂರ್ಯಚಂದ್ರ ಜೋಡುಕೆರೆ ಕಂಬಳ ಸಂಘಟಕ ಡಾ.
241,*ತುಳುನಾಡಿನ ಜನಪದ ಕ್ರೀಡೆ ಕಂಬಳವನ್ನು ಕಾಂಗ್ರೆಸ್-ಕಮ್ಯುನಿಸ್ಟ್ ಮುಖವಾಡ ಹೊತ್ತುಕೊಂಡಿದ್ದ ಪೇಟಾ ನಿಷೇಧ ಮಾಡಲು ಮುಂದಾದಾಗ ತುಳುವರನ್ನು ಒಗ್ಗೂಡಿಸಿ ಕಂಬಳದ ಪರವಾಗಿ ಧ್ವನಿ ಎತ್ತಿ ಯಾವುದೇ ಕಾರಣಕ್ಕೂ ಕಂಬಳ ನಿಷೇಧ ಮಾಡು ಬಿಡೋದಿಲ್ಲ ಎಂದು ಬೀದಿಗಿಳಿದು ಹೋರಾಡಿದ್ದರು.
242,"ಇದಕ್ಕಿಂತಲೂ ಅಮಾನುಷವೆಂದರೆ, ಕಂಬಳ ನಡೆಯುವ ಒಂದೆರಡು ಗಂಟೆಗಳ ಮೊದಲು ಕಂಬಳ ಗದ್ದೆಯಲ್ಲಿ ಕೊರಗರು ಓಡಬೇಕು."
243,"ರಾಜ್ಯದ ಜನರ ಬೇಡಿಕೆಯಂತೆ ಕಂಬಳ ಕ್ರೀಡೆಗೆ ಅಧಿಕೃತ ಮಾನ್ಯತೆ ನೀಡಲು ಮುಂದಾಗಿರುವ ಸರ್ಕಾರ, ಇದಕ್ಕೆ ಪೂರಕವಾಗಿ ಕರ್ನಾಟಕ ಪ್ರಾಣಿ ಹಿಂಸಾಚಾರ ತಡೆ ಕಾಯ್ದೆಯಿಂದ ಕಂಬಳ ಸೇರಿದಂತೆ ಮೂರು ಬಗೆಯ ಕ್ರೀಡೆಗಳಿಗೆ ವಿನಾಯ್ತಿ ನೀಡಿ ತಿದ್ದುಪಡಿ ಮಸೂದೆ ರೂಪಿಸಿದೆ."
244,ಕಂಬಳ ಸಂಘಟಕರು ಇಂತಹ ಘಟನೆಗಳು ಮರುಕಳಿಸದಂತೆ ಜಾಗ್ರತೆ ವಹಿಸಬೇಕೆಂಬ ಅಭಿಪ್ರಾಯ ವ್ಯಕ್ತವಾಗಿದೆ.
245,"ದೀಪಕ್‌ ಮಿಶ್ರಾ ನೇತೃತ್ವದ ಪೀಠ, ಕಂಬಳ ಕ್ರೀಡೆಗೆ ಮಧ್ಯಂತರ ತಡೆ ನೀಡಲು ಸಾಧ್ಯವಿಲ್ಲ ಎಂದಿದ್ದಾರೆ."
246,ಕಂಬಳ ನಡೆಯುವ ಒಂದು ಹಂತದ ದಿನಾಂಕವನ್ನು ಅಂತಿಮಗೊಳಿಸಲಾಗಿದೆ.
247,ಈ ನಡುವೆ ಕರ್ನಾಟಕ ಹೈಕೋರ್ಟ್ ನಿಷೇಧ ವಿಧಿಸಿದ ಹಲವು ತಿಂಗಳುಗಳ ಬಳಿಕ ಕಂಬಳಕ್ಕೆ ಸಿಕ್ಕಿದ ಜಯವನ್ನು ನವೆಂಬರ್ 11ರಂದು ಮೂಡುಬಿದಿರೆಯಲ್ಲಿ ಕಂಬಳ ಆಯೋಜಿಸುವ ಮೂಲಕ ಸಂಭ್ರಮಿಸಲು ನಿರ್ಧರಿಸಲಾಗಿದೆ.
248,ಪುತ್ತೂರಿನ ಕಂಬಳಕ್ಕೆ ಜನಸ್ತೋಮ ಸೇರಿದ ಹಾಗೆ ಜಿಲ್ಲೆಯಲ್ಲಿನ ಯಾವುದೇ ಕಂಬಳಕ್ಕೆ ಸೇರುವುದಿಲ್ಲ ಎನ್ನುವುದಕ್ಕೆ ಕಂಬಳ ಎನ್ನುವುದು ಇಲ್ಲಿನ ಜನರ ಹೃದಯದೊಳಗೆ ಹಾಸುಹೊಕ್ಕಿದೆ ಎಂದರೆ ತಪ್ಪಾಗಲಿಕ್ಕಿಲ್ಲ.
249,ಮಂಗಳೂರು ಕಂಬಳ ಸಮಿತಿ ಗೌರವಾಧ್ಯಕ್ಷ ಕೆ.
250,"(ಕನೆಹಲಗೆ: 2 ಜೊತೆ, ಅಡ್ಡಹಲಗೆ: 6 ಜೊತೆ, ಹಗ್ಗ ಹಿರಿಯ: 16 ಜೊತೆ, ನೇಗಿಲು ಹಿರಿಯ: 24 ಜೊತೆ, ಹಗ್ಗ ಕಿರಿಯ: 14 ಜೊತೆ, ನೇಗಿಲು ಕಿರಿಯ: 100 ಜೊತೆ, ಒಟ್ಟು 162 ಜೋಡಿ) ಆದರೂ ಅಚ್ಚುಕಟ್ಟಿನ ವ್ಯವಸ್ಥೆಯಿಂದಾಗಿ ಬೆಳಕು ಮೂಡುವ ಮೊದಲೇ ಕಂಬಳ ಸಂಪನ್ನವಾಯಿತು."
251,ಯುವವಾಹಿನಿಯ ಇತಿಹಾಸದಲ್ಲಿ ಅಚ್ಚಳಿಯದೆ ಉಳಿಯಬಲ್ಲ ಒಂದು ಯಶಸ್ಸಿನ ಚಟುವಟಿಕೆಯ ಸಾಕ್ಷಾತ್ಕಾರಕ್ಕೆ ಆ ಕಂಬಳ ಗದ್ದೆ ಸಾಕ್ಷಿಯಾಗಿ ನಿಂತಿದೆ.
252,ಕಂಬಳ ಮೇಲಿನ ನಿಷೇಧ ತೆರವುಗೊಳಿಸಿ: ಬಳಕೆದಾರರ ವೇದಿಕೆ
253,ಕಂಬಳ ಒಂದು ಗ್ರಾಮೀಣ ಕ್ರೀಡೆ ಆಗಿದೆ.
254,ಆದರೆ ಕಂಬಳ ಅಪ್ಪಟ ಗ್ರಾಮೀಣ ಕ್ರೀಡೆ.
