Index,Sentence
0,ದಕ್ಷಿಣ ಕನ್ನಡ ಜಿಲ್ಲೆಯ ಮೂಡಬಿದರೆಯ ಶ್ರೀನಿವಾಸ ಗೌಡ ಎಂಬುವರು ಕಂಬಳ ಸ್ಪರ್ಧೆಯಲ್ಲಿ 100 ಮೀಟರ್​ಅನ್ನು ಕೇವಲ 9.
1,ಸೂರ್ಯ-ಚಂದ್ರ ಇರುವ ತನಕ ಕಂಬಳ ಇರಬೇಕೆಂದು ನನ್ನ ಆಸೆ.
2,ಸೋಶಿಯಲ್ ಮಿಡಿಯಾದಲ್ಲಿ ಈ ವಿಚಾರ ವೈರಲ್ ಆಗುತ್ತಿರುವಾಗ ಕಂಬಳ ಓಟಗಾರ ಶ್ರೀನಿವಾಸ್
3,"ಜಯಕರ್ನಾಟಕ ಬೀಡಿ ಕಂಟ್ರಾಕ್ಟ್‌ದಾರರ ಸಂಘದ ಗಂಗಾಧರ್ ಶೆಟ್ಟಿ ಕೈಕಾರ, ತಾಲೂಕು ಇಂಟಕ್ ಅಧ್ಯಕ್ಷ ಜಯಪ್ರಕಾಶ್ ಬದಿನಾರು, ಉದ್ಯಮಿ ರೋಶನ್ ರೈ ಬನ್ನೂರು, ಕಂಬಳ ಸಮಿತಿ ಉಪಾಧ್ಯಕ್ಷ ರಿಚರ್ಡ್ ಲೂವಿಸ್ ಡಾಯಸ್, ಪ್ರಗತಿಪರ ಕೃಷಿಕ ದಿವಾಕರ್ ರೈ ಸಣಂಗಲ, ಮಾರಪ್ಪ ಶೆಟ್ಟಿ ಬೈಲುಗುತ್ತು, ಮಾನಕ ಜ್ಯುವೆಲ್ಸ್‌ನ ಸಿದ್ಧಾರ್ಥ್, ವಿಜಯಾ ಬ್ಯಾಂಕ್‌ನ ರಾಜೀವ್ ಶೆಟ್ಟಿ, ಸತೀಶ್ ಗೌಡ, ರಾಷ್ಟ್ರೀಯ ಕಬಡ್ಡಿ ಆಟಗಾರ ಪ್ರಶಾಂತ್ ಕುಮಾರ್ ರೈ, ಉದ್ಯಮಿ ಪ್ರವೀಣ್ ಶೆಟ್ಟಿ ಅಳಕೆಮಜಲು, ಜೋಕಿಂ ಡಿಸೋಜ ಬನ್ನೂರು, ಪುತ್ತೂರು ಬ್ಯಾಂಕ್ ಆಫ್ ಬರೋಡದ ಸೀನಿಯರ್ ಮ್ಯಾನೇಜರ್ ಅವಿನಾಶ್ ಚೌಟ, ಉದ್ಯಮಿ ಅಜಿತ್ ಶೆಟ್ಟಿ ಕಡಬ, ಕೃಷ್ಣಪ್ರಸಾದ್ ಆಳ್ವ, ಶಶಿಕಿರಣ್ ರೈ ನೂಜಿಬೈಲು, ವಿಕ್ರಂ ಶೆಟ್ಟಿ ಅಂತರ ಕೋಡಿಂಬಾಡಿ, ಗಣೇಶ್‌ರಾಜ್ ಬಿಳಿಯೂರು, ಸುಧೀರ್ ಶೆಟ್ಟಿ ನೆಹರುನಗರ ಸಹಿತ ಹಲವರು ಈ ಸಂದರ್ಭದಲ್ಲಿ ಉಪಸ್ಥಿತರಿದ್ದರು."
4,"ಆದರೆ ಇದಕ್ಕೆ ಆಕ್ಷೇಪಣೆ ಸಲ್ಲಿಸಿದ ಪೇಟಾ, ಕಂಬಳ ಕಾನೂನು ಬಾಹಿರ ಎಂದು ಮತ್ತೆ 2016ರಲ್ಲಿ ಹೈ ಕೋರ್ಟ್ ಮೊರೆ ಹೋಗಿತ್ತು."
5,ಈಗ ಜಲ್ಲಿಕಟ್ಟುಗೆ ಮಾಡಿದಂತೆ ಕಂಬಳ ಕ್ರೀಡೆಗೂ ಸುಗ್ರೀವಾಜ್ಞೆ ತರಬೇಕು ಎಂದು ಒಂದು ಹೋರಾಟ.
6,ಕೃಷಿ ಕೆಲಸಗಳಿಗೆ ಬಳಸುವ ಕೋಣಗಳು ಅನಾದಿ ಕಾಲದ ಕಂಬಳ ಕ್ರೀಡೆಯ ಕೇಂದ್ರ ಬಿಂದುಗಳೂ ಹೌದು.
7,"ಜಲ್ಲಿಕಟ್ಟು ಮತ್ತು ಕಂಬಳ ಕ್ರೀಡೆಯು ಪ್ರತ್ಯೇಕವಾಗಿದ್ದು, ಈ ಬಗ್ಗೆ ನ್ಯಾಯಾಲಯಕ್ಕೆ ಮನವರಿಕೆ ಮಾಡುವ ಬಗ್ಗೆ ಸಭೆಯಲ್ಲಿ ನಿರ್ಧರಿಸಲಾಯಿತು."
8,22: ಬಂಟ್ವಾಳ ತಾಲೂಕು ಹೊಕ್ಕಾಡಿಗೋಳಿ ಮಹಿಷಮರ್ಧಿನಿ ಕಂಬಳ ಸಮಿತಿ ವತಿಯಿಂದ ಇತಿಹಾಸ ಪ್ರಸಿದ್ಧ ವೀರ-ವಿಕ್ರಮ ಜೋಡುಕರೆ ಬಯಲು ಕಂಬಳಕ್ಕೆ ಶನಿವಾರ ಚಾಲನೆ ನೀಡಲಾಯಿತು.
9,ಕಂಬಳ ಆಚರಣೆ ರದ್ದು ಮಾಡಿರುವುದರಿಂದ ತುಳುನಾಡಿನ ಸಂಸ್ಕೃತಿಯೇ ನಾಶವಾದಂತೆ ಭಾಸವಾಗುತ್ತಿದೆ.
10,ನನಗೆ ಒಂದೇ ಒಂದು ಆಸೆ ಇದ್ದದ್ದು ಅದು ಕಂಬಳ ನೋಡಲು.
11,ಮುಂದೆ ಪ್ರತಿ ಶನಿವಾರವೂ ಒಂದೊಂದು ಕಡೆ ಕಂಬಳ ನಡೆಯಲಿದೆ.
12,ಬಲ್ಲಾಳರಿಂದ ಬೀಳ್ಕೊಂಡು ಕಂಬಳ ಗದ್ದೆಗೆ ಬಂದಾಗ ಪ್ರಸವ ವೇದನೆ ತೋರಿತು.
13,ತೆಕ್ಕಟ್ಟೆ : ಉಡುಪಿ ಜಿಲ್ಲೆಯ ಇತಿಹಾಸ ಪ್ರಸಿದ್ಧ ಮಣೂರು ಕಂಬಳ ಮಹೋತ್ಸವವು ನ.
14,1421ರ ಬಾರ್ಕೂರು ಶಾಸನದಲ್ಲಿ ಕಂಬಳ ಗದ್ದೆಯ ಮೇಲೆ ಎಂದು ಹೇಳಲಾಗಿದೆ
15,"ಆದರೆ ನಾಳೆ ಮತ್ತೊಂದೆಡೆ, ಮುಂದಿನ ವಾರ ಇನ್ನೊಂದೆಡೆ ಕಂಬಳ ಇದ್ದೇ ಇರುತ್ತದೆ, ಅದೇ ಸಂಭ್ರಮ, ನಿರೀಕ್ಷೆಗಳೊಂದಿಗೆ, ಎಲ್ಲ ಕಡೆ ಮುಗಿಯಿತು ಎಂದಾದರೂ ಸಹಿತ ಮುಂದಿನ ವರ್ಷ ಇದ್ದೇ ಇರುತ್ತದೆ."
16,ಜನಪದೀಯ ದೇವರ ಕಂಬಳ ನಡೆಯಬೇಕು ಅಧರ್ಮದ ವಿರುದ್ದ ಹೋರಾಡುವ ಗುಣವನ್ನು ನಾವು ಬೆಳೆಸಿಕೊಳ್ಳ ಬೇಕು ಎಂದರು.
17,ಕಂಬಳ ಸಂರಕ್ಷಣೆ…
18,ಕರಾವಳಿಯಲ್ಲಿ ಕಂಬಳ ಪ್ರತಿವರ್ಷ ಡಿಸೆಂಬರ್ ನಲ್ಲಿ ಆರಂಭವಾಗಿ ಮಾರ್ಚ್ ವರೆಗೆ ನಡೆಯುತ್ತದೆ.
19,ಆರು ವಿಭಾಗದಲ್ಲಿ ಕಂಬಳ ಸ್ಪರ್ಧೆಗಳು ನಡೆಯುವುದು.
20,ಕಂಬಳ ನಿಷೇಧ ತೆರವಿಗಾಗಿ ಕಾರ್ಯಕಾರಿಣಿಯಲ್ಲಿ ನಿರ್ಣಯಿಸಿದ್ದೇವೆ.
21,ಪುಂಜಾಲಕಟ್ಟೆ: ತುಳುನಾಡಿನ ಜಾನಪದ ಕ್ರೀಡೆ ಕಂಬಳ ಉಳಿಸಿ ಬೆಳೆಸುವಲ್ಲಿ ಕೇಂದ್ರ ಸರಕಾರದ ವತಿಯಿಂದ ಸಂಪೂರ್ಣ ಸಹಕಾರ ದೊರಕಿಸಿಕೊಡಲಾಗುವುದು ಎಂದು ಸಂಸದ ನಳಿನ್‌ ಕುಮಾರ್‌ ಕಟೀಲು ಅವರು ಹೇಳಿದರು.
22,ಈಗ ನಟ ಶಿವರಾಜ್ ಕುಮಾರ್ ಕಂಬಳ ಪರ ನಿಂತಿದ್ದಾರೆ.
23,"ಹಸನಾದ ಗದ್ದೆಯ ಮಣ್ಣನ್ನು ಹಾಕಿ, ಜಿಗುಟಾಗದಿರಲು ಅಗತ್ಯವಿರುವಷ್ಟು ಮರಳನ್ನು ಹಾಕಿ ಅದರ ಮೇಲೆ ನೀರು ನಿಲ್ಲಿಸಿ ಮಾಡಿದ ಕೆಸರು ಗದ್ದೆಯೇ ಕಂಬಳ ಓಟದ ಕರೆ."
24,27ನೇ ವರ್ಷದ ಅಡ್ವೆ ನಂದಿಕೂರು ಕೋಟಿ ಚೆನ್ನಯ ಜೋಡುಕರೆ ಕಂಬಳ ಫೆ.
25,ಕಂಬಳ ಕ್ರೀಡೆ ಆಡಿಯೇ ತೀರುತ್ತೇವೆ
26,ಕಂಬಳ ಕ್ರೀಡೆಗಳು ಸೌಹಾರ್ದತೆಯ ಕೂಟವಿದ್ದಂತೆ.
27,"2011ರಲ್ಲಿ ಕಾರ್ಕಳದ ಶಿರ್ಲಾಲಿನಲ್ಲಿ ಕಂಬಳ ಅಕಾಡೆಮಿಯ ಮೊದಲ ತರಬೇತಿ ಶಿಬಿರದಲ್ಲಿ ಭಾಗವಹಿಸಿ, ಯಶಸ್ವಿ ಶಿಬಿರಾರ್ಥಿಯಾಗಿ ಹೊರಬಂದರು."
28,ಸಾಂಪ್ರದಾಯಿಕ ನಾಟಿ ಓಟಕ್ಕೆ ಚಾಲನೆ ನೀಡಿ ಮಾತನಾಡಿದ ದೇವಸ್ತೂರು ಪಟ್ಟೆದಾರ ಕುಕ್ಕೇರ ತಮ್ಮಯ್ಯ ಹಿಂದೆ ಎಲ್ಲರೂ ಕೂಡಿಕೊಂಡು ನಾಟಿ ಮಾಡಿ ಕಂಬಳ ಮಾಡುತ್ತಿದ್ದರು.
29,ಕಂಬಳ ಋತು ಆರಂಭಗೊಳ್ಳುತ್ತಿರು ವಂತೆ ಪ್ರಾಣಿ ದಯಾ ಸಂಘ(ಪೆಟಾ)ದವರು ಮತ್ತೆ ಕೋರ್ಟ್‌ ಮೆಟ್ಟಿಲೇರಿದ್ದು ಕಂಬಳ ಪ್ರೇಮಿಗಳ ಆತಂಕಕ್ಕೆ ಕಾರಣವಾಗಿದೆ.
30,"ಇದನ್ನೂ ಓದಿ: ಕಂಬಳ ಮಸೂದೆಗೆ ರಾಷ್ಟ್ರಪತಿ ಅಂಕಿತ, ಎಲ್ಲ ಅಡೆ ತಡೆ ನಿವಾರಣೆ"
31,ಇನ್ನು ಕಂಬಳ ಉಳಿವಿಗಾಗಿ ಸುವರ್ಣನ್ಯೂಸ್​ ವಿಶೇಷ ಅಭಿಯಾನ ಕೂಡಾ ನಡೆಸಿತ್ತು.
32,"ಈ ಸಂಬಂಧ ಪ್ರಾಣಿ ದಯಾ ಸಂಘಟನೆ (ಪೇಟಾ) ಸಲ್ಲಿಸಿದ್ದ ದೂರನ್ನು ಆಧರಿಸಿ, ಪೈವಳಿಕೆ ಕಂಬಳ ನಡೆಸದಂತೆ ಕಾಸರಗೋಡು ಎಸ್‌ಪಿ ಎ."
33,"ಶೆಟ್ಟಿ, ವಿಜಯ-ವಿಕ್ರಮ ಕಂಬಳ ಸಮಿತಿ ಉಪ್ಪಿನಂಗಡಿ ಇದರ ಅಧ್ಯಕ್ಷ ಅಶೋಕ್ ಕುಮಾರ್ ರೈ, ಸಾಂಪ್ರದಾಯಿಕ ಕಂಬಳ ಸಮಿತಿ ಅಧ್ಯಕ್ಷ ಸುಧಾಕರ ಶೆಟ್ಟಿ, ಕಂಬಳ ಸಮಿತಿಗಳ ಪದಾಧಿಕಾರಿಗಳು ಸಭೆಯಲ್ಲಿ ಉಪಸ್ಥಿತರಿದ್ದರು."
34,ಕಂಬಳ ಹಾಗೂ ಇತರೆ ಗೂಳಿ ಮತ್ತು ಎತ್ತಿನ ಗಾಡಿ ಸ್ಪರ್ಧೆಗಳಿಗೆ ಅನುಮತಿ ನೀಡಿದ್ದ ರಾಜ್ಯ ವಿಧಾನ ಮಂಡಲ ಅಂಗೀಕರಿಸಿದ್ದ ಪ್ರಾಣಿ ಹಿಂಸೆ (ಕರ್ನಾಟಕ ತಿದ್ದುಪಡಿ) ತಡೆ ಕಾಯ್ದೆ - 2017ಕ್ಕೆ ಪೆಟಾ ಮತ್ತೆ ತಗಾದೆ ತೆಗೆದಿದೆ.
35,ಜೋಡುಕರೆ ಕಂಬಳ ಇತಿಹಾಸದಲ್ಲೇ ದಾಖಲೆ ಬರೆದ ಮೂಡಬಿದಿರೆ ಕಂಬಳ
36,ಈ ಕಂಬಳ ಯಾವುದೇ ಕ್ರಿಕೆಟ್ ಆಟಕ್ಕೆ ಕಡಿಮೆ ಇಲ್ಲ.
37,ಕಂಬಳ ಆಚರಣೆ ಕಾನೂನು ಬದ್ಧಗೊಳಿಸುವ ಸಂಬಂಧ ಇಂದು ನಡೆದ ಸಭೆಯ ನಂತರ ಮಾತನಾಡಿದ ಸಚಿವರು ಕಂಬಳ ಅಧಿಕೃತಗೊಳಿಸುವ ಕಾನೂನನ್ನು ಜಾರಿಗೆ ತರುವ ಸಂಬಂಧ ಪಶುಸಂಗೋಪನಾ ಇಲಾಖೆಗೆ ಪ್ರಸ್ತಾವನೆ ಸಲ್ಲಿಸಲು ಸೂಚಿಸಲಾಗಿದೆ.
38,"ನಾಗಾರಾಧನೆ, ಕಂಬಳ ಕೋರಿ, ಪ್ರತಿ ತಿಂಗಳ ಸಂಕ್ರಮಣ ಆಚರಣೆ, ವನಭೋಜನ, ಗುಳಿಕ ದೈವಕ್ಕೆ ಅಗೇಲು ಸೇವೆ, ಮಹಾಮ್ಮಾಯಿ ಅಮ್ಮನಿಗೆ ಗೊಂದೋಳು ಸೇವೆ ಹೀಗೆ ಗ್ರಾಮದಲ್ಲಿ ಹತ್ತು ಹಲವು ಧಾರ್ಮಿಕ ಕಾರ್ಯಗಳು ನಡೆಯುತ್ತಲೇ ಇರುತ್ತದೆ."
39,ಕಂಬಳ ಕ್ರೀಡೆಯಲ್ಲಿ ಅತ್ಯಂತ ವೇಗವಾಗಿ ಓಡುವ ಮೂಲಕ ಶ್ರೀನಿವಾಸ ಗೌಡ ನಾಡಿನ ಗಮನ ಸೆಳೆದಿದ್ದಾರೆ.
40,ಕಂಬಳ ಮತ್ತು ಕೋಳಿ ಅಂಕಕ್ಕೆ ಅವಕಾಶ ನೀಡಿ :
41,"ನಾನಾ ರೀತಿಯ ಅಡೆತಡೆ, ಕಾನೂನು ಸಮರದ ನಡುವೆಯೂ ಕಂಬಳ ಈ ಬಾರಿ ನಿರ್ವಿಘ್ನವಾಗಿ ಮುಕ್ತಾಯಗೊಳ್ಳುತ್ತಿರುವುದು ಅಭಿಮಾನಿಗಳು ಹಾಗೂ ಆಯೋಜಕರಲ್ಲಿ ಸಮಾಧಾನ ಮೂಡಿಸಿದೆ."
42,"ಸರ್ವ ಪ್ರಯತ್ನ: ಕಾಂಗ್ರೆಸ್‌ ಜಿಲ್ಲಾ ಘಟಕ ಕಂಬಳ ಆಚರಣೆಗೆ ಸರ್ವ ಪ್ರಯತ್ನ ಮಾಡಲು ಸರ್ವಾನುಮತದ ನಿರ್ಣಯ ಕೈಗೊಂಡಿದ್ದು, ಅಗತ್ಯ ಬಿದ್ದರೆ, ಸುಗ್ರೀವಾಜ್ಞೆ ಹೊರಡಿಸಲು ರಾಜ್ಯ ಸರ್ಕಾರದ ಮೂಲಕ ಕೇಂದ್ರ ಸರ್ಕಾರವನ್ನು ಒತ್ತಾಯಿಸಲಾಗುವುದು ಎಂದು ಜಿಲ್ಲಾ ಉಸ್ತುವಾರಿ ಸಚಿವ ಬಿ."
43,"– ಗುಣಪಾಲ ಕಡಂಬ, ಸಂಚಾಲಕರು, ಕಂಬಳ ಅಕಾಡೆಮಿ"
44,"ಅಚ್ಚರಿ ಎಂದರೆ, ಈಗ ಶ್ರೀನಿವಾಸ್​ ಗೌಡ ಅವರ ದಾಖಲೆಯನ್ನೇ ಮತ್ತೋರ್ವ ಕಂಬಳ ಸ್ಪರ್ಧಿ ಮುರಿಯುವ ಮೂಲಕ ಮತ್ತೊಂದು ದಾಖಲೆ ಬರೆದಿದ್ದಾರೆ."
45,"ನೂರಾರು ರೈತರು ಇದರಲ್ಲಿ ಭಾಗಿಗಳಾಗುತ್ತಿದ್ದು, ಕಂಬಳ ಯಶಸ್ವಿಯಾಗಿ ನಡೆಯುವಂತಾಗಲಿ ಎಂದರು."
46,"ಚಿತ್ತರಂಜನ್ ಕಂಬಳ ಉದ್ಘಾಟಿಸಲಿದ್ದು, ಮೇಯರ್ ಭಾಸ್ಕರ್ ಕೆ."
47,"ಹೀಗಾಗಿ, ಕಂಬಳ ಕ್ರೀಡೆಗೆ ಅನುಮತಿ ನೀಡಬೇಕು ಎಂದರೆ?"
48,ಕಂಬಳ ಸಮಿತಿ ಅಧ್ಯಕ್ಷ ಎನ್ ಚಂದ್ರಹಾಸ ಶೆಟ್ಟಿ ಬಹುಮಾನ ವಿತರಿಸಿದರು.
49,ಆದ್ದರಿಂದ ಅವರಿಗೂ ನಗರದಲ್ಲಿ ನಡೆಯುತ್ತಿರುವ ಈ ಕಂಬಳ ಅತ್ಯಂತ ಖುಷಿಯನ್ನು ತಂದಿದೆ.
50,"ಸನ್ಮಾನ…ಯಕ್ಷಗಾನ ಕ್ಷೇತ್ರದಲ್ಲಿ ರಾಜ್ಯೋತ್ಸವ ಪ್ರಶಸ್ತಿ ಪುರಸ್ಕೃತ ಡಾ|ಶ್ರೀಧರ ಭಂಡಾರಿ, ಕಂಬಳ ಕ್ಷೇತ್ರದ ಸುಧೀಶ್ ಕುಮಾರ್ ಆರಿಗ ಬಂಗಾಡಿ ಹಾಗೂ ಕ್ರೀಡಾ ಕ್ಷೇತ್ರದ ಅಂತರ್ರಾಷ್ಟ್ರೀಯ ವಿಜೇತ ಬಾಡಿ ಬಿಲ್ಡರ್ ಸಚಿನ್ ರೈಯವರನ್ನು ಈ ಸಂದರ್ಭದಲ್ಲಿ ಶಾಲು ಹೊದಿಸಿ ಸನ್ಮಾನಿಸಲಾಯಿತು."
51,ಕೋಣಗಳ ಸಮೇತ ಬೀದಿಗಳಿದ ಸಾವಿರಾರು ಸಂಖ್ಯೆಯ ಕಂಬಳ ಪ್ರಿಯರು ಮೂಡಬಿದರೆಯ ಸ್ವರಾಜ್ ಮೈದಾನದಿಂದ ಪ್ರತಿಭಟನೆ ಜಾಥಾ ಪ್ರಾರಂಭಿಸಿದರು.
52,"ವಿ, ಕೋಶಾಧಿಕಾರಿ ಪ್ರಸನ್ನ ಕುಮಾರ್ ಶೆಟ್ಟಿ ಸಹಿತ ಕಂಬಳ ಸಮಿತಿಯ ಪದಾಧಿಕಾರಿಗಳು, ಸದಸ್ಯರು ಈ ಸಂದರ್ಭದಲ್ಲಿ ವೇದಿಕೆಯಲ್ಲಿ ಉಪಸ್ಥಿತರಿದ್ದರು."
53,ಈ ಮೂಲಕ ಸುವರ್ಣ ನ್ಯೂಸ್ ಕೈಗೊಂಡಿದ್ದ ಕಂಬಳ ಕಾಪಾಡಿ ಅಭಿಯಾನಕ್ಕೆ ಗೆಲುವು ದೊರಕಿದೆ.
54,ಗ್ರಾಮೀಣ ಕ್ರೀಡೆಗಳಾದ ಕಂಬಳ ಮತ್ತು ಎತ್ತಿನಗಾಡಿ ಓಟಕ್ಕೆ ರಾಜ್ಯಸರ್ಕಾರದಿಂದ ಗ್ರೀನ್ ಸಿಗ್ನಲ್ ಸಿಕ್ಕಿದೆ.
55,ಬೂದಿಹಾಳ್‌ರವರಿದ್ದ ಹೈಕೋರ್ಟ್‌ನ ದ್ವಿಸದಸ್ಯ ಪೀಠವು ಕಂಬಳಕ್ಕೆ ತಡೆಯಾಜ್ಞೆ ವಿಧಿಸಿದ್ದು ಅವಿಭಜಜಿತ ದಕ್ಷಿಣ ಕನ್ನಡ ಜಿಲ್ಲೆಯಲ್ಲಿ ನಿಗದಿಯಾಗಿದ್ದ ಕಂಬಳ ಕೂಟದ ವೇಳಾಪಟ್ಟಿ ಅನೂರ್ಜಿತಗೊಂಡಿದೆ.
56,"ಪುತ್ತೂರು: ಇತಿಹಾಸ ಪ್ರಸಿದ್ಧ ಪುತ್ತೂರು ಕೋಟಿ ಚೆನ್ನಯ ಜೋಡುಕರೆ ಕಂಬಳಕ್ಕೆ ಕ್ಷಣಗಣನೆ ಪ್ರಾರಂಭವಾಗಿದೆ, ಈ ಬಾರಿ ಜನವರಿ ೧೯ ರಂದು ಕಂಬಳ ನಡೆಯಲಿದ್ದು."
57,"ಬಾಂಧವ್ಯದ ಇತಿಹಾಸ : ಕಂಬಳ ಯಾಕೆ ಉಳಿಯಬೇಕು ಎಂದು ಹೇಳುವಾಗ ಅದರ ನೂರಾರು ವರ್ಷಗಳ ಇತಿಹಾಸ, ಜನರ ಜೀವನ, ಸಂಸ್ಕೃತಿಯೊಂದಿಗೆ ಬೆಸೆದುಕೊಂಡ ಬಾಂಧವ್ಯವನ್ನೂ ಗಮನಿಸಬೇಕಾಗುತ್ತದೆ."
58,ಕೃಷಿ ನುಡಿಸಿರಿಯಲ್ಲಿ ಕಂಬಳ ಕೋಣಗಳ ಚಮಕ್-ಎಲ್ಲೆಲ್ಲೂ ಸಂಭ್ರಮ-ಸಡಗರ
59,ತಮಿಳುನಾಡಿನ ಜಲ್ಲಿಕಟ್ಟುವಿಗೆ ಕೇಂದ್ರ ಸುಗ್ರಿವಾಜ್ಞೆ ಜಾರಿಗೊಳಿಸಿದಂತೆ ಕಂಬಳ ಬಗ್ಗೆಯೂ ಹೋರಾಟಗಾರರು ಸರ್ಕಾರಕ್ಕೆ ಬೇಡಿಕೆಯನ್ನಿಡುವ ಮೂಲಕ ಗಮನಕ್ಕೆ ಬರಬೇಕು.
60,Home ಕನ್ನಡ ವಾರ್ತೆಗಳು ಕರಾವಳಿ ಕಂಬಳ ನಿಷೇಧದ ವಿರುದ್ಧ ಸುಪ್ರೀಂ ಕೋರ್ಟ್‌ನಲ್ಲಿ ಮೇಲ್ಮನವಿ ಸಲ್ಲಿಸಲು ನಿರ್ಧಾರ – ಜನಾಂದೋಲನಕ್ಕೆ ಸಿದ್ದತೆ
61,"ಬೆಂಗಳೂರು, ಫೆ 17 [ಯುಎನ್ಐ] ದಕ್ಷಿಣ ಕನ್ನಡ ಜಿಲ್ಲೆಯ ಕಂಬಳ ಜಾನಪದ ಕ್ರೀಡೆಯಲ್ಲಿ ಅತ್ಯಂತ ವೇಗವಾಗಿ ಓಡಿ ನಾಡಿನ ಗಮನ ಸೆಳೆದ ಶ್ರೀನಿವಾಸ ಗೌಡ ಅವರನ್ನು ಮುಖ್ಯಮಂತ್ರಿ ಬಿ."
62,"ಕಾಸರಗೋಡು: ಆತಂಕ, ಗೊಂದಲದ ನಡುವೆ ಪೈವಳಿಕೆ ಬೋಳಂಗಳದಲ್ಲಿ ಪ್ರಥಮ ಅಣ್ಣ - ತಮ್ಮ ಜೋಡುಕರೆ ಕಂಬಳ ಸಾಂಗವಾಗಿ ನೆರವೇರಿತು."
63,"ವಿಜಯ- ವಿಕ್ರಮ ಜೋಡುಕರೆ ಕಂಬಳ ಸಮಿತಿಯ ಗೌರವಾಧ್ಯಕ್ಷ ಉಮೇಶ್‌ ಶೆಣೈ ನಂದಾವರ, ಪ್ರಧಾನ ಕಾರ್ಯದರ್ಶಿ ಬೆಳ್ಳಿಪ್ಪಾಡಿ ಕೈಪ ಕೇಶವ ಭಂಡಾರಿ, ಕೋಶಾಧಿಕಾರಿ ಸೀತಾರಾಮ ಶೆಟ್ಟಿ ಹೆಗ್ಡೆಹಿತ್ಲು, ಕಾರ್ಯದರ್ಶಿ ಚಂದ್ರಶೇಖರ ಮಡಿವಾಳ, ಉಪಾಧ್ಯಕ್ಷ ರಾಮಚಂದ್ರ ಮಣಿಯಾಣಿ, ಗೌರವ ಸಲಹೆಗಾರ ಹರಿಶ್ಚಂದ್ರ ಇಳಂತಿಲ, ಉಪ್ಪಿನಂಗಡಿ ಗ್ರಾ."
64,Home › ಬಿಗ್ ನ್ಯೂಸ್ ›ಕಂಬಳಕ್ಕೆ ಮತ್ತೆ ನಿಷೇಧದ ಭೀತಿ ; ಈ ಬಾರಿಯೂ ಕಂಬಳ ನಡೆಯುವುದು ಅನುಮಾನ
65,2014ರಿಂದ ಕಂಬಳಕ್ಕೆ ಎದುರಾಗಿದ್ದ ಕಾನೂನಿನ ಅಡೆತಡೆಯಿಂದಾಗಿ ಕರಾವಳಿಯ ಕಂಬಳ ನೀರಸವಾಗಿ ನಡೆದಿತ್ತು.
66,ಈ ಸುಗ್ರಿವಾಜ್ಞೆ ಅವಧಿ ಮುಗಿದಿರುವ ಕಾರಣ ಕಂಬಳ ಕ್ರೀಡೆಗೆ ಅನುಮತಿಯನ್ನು ನೀಡಬಾರದೆಂದು ಪೇಟಾ ಸಂಸ್ಥೆಯು ಸುಪ್ರೀಂ ಕೋರ್ಟ್ ನಲ್ಲಿ ವಾದವನ್ನು ಮಂಡನೆ ಮಾಡಿತ್ತು.
67,"ಯುವ ಜನಾಂಗದ ಕೃಷಿಕರಿಗೆ ಒಂದು ದಿನ ತರಬೇತಿ ಮಾಡಿದರೆ ಸಾಲದು, ಅವರಿಗೆ ನಿರಂತರ ಪ್ರೋತ್ಸಾಹ ನೀಡಬೇಕು ಎಂದ ಅವರು ಕಂಬಳ ತುಳುನಾಡಿನ ಜನಪದ ಕ್ರೀಡೆ."
68,1ರಂದು ಮಂಗಳೂರು ಸಮೀಪದ ಐಕಳ ಎಂಬಲ್ಲಿ ನಡೆದ ಕಂಬಳ ಕ್ರೀಡಾಕೂಟದಲ್ಲಿ ಪಾಲ್ಗೊಂಡಿದ್ದ ಮೂಡಬಿದಿರೆ ಮೀಯಾರಿನ ಶ್ರೀನಿವಾಸಗೌಡ ಅವರು 142.
69,ಒಟ್ಟಿನಲ್ಲಿ ಕರಾವಳಿಯ ಜಾನಪದ ಕ್ರೀಡೆಯ ಸಂಭ್ರಮ ಮತ್ತೆ ಮೇಳೈಸಿದೆ ಎಂದು ಕಂಬಳ ಕೋಣದ ಮಾಲೀಕ ರಾಬರ್ಟ್ ತಿಳಿಸಿದ್ದಾರೆ.
70,"ಹೆಗ್ಗಡೆ, ದಿನಕರ ಶೆಟ್ಟಿ ಕನ್ಯಾನ ಬಾಳೆಕೋಡಿ ಶಶಿಕಾಂತ ಮಣಿ ಸ್ವಾಮೀಜಿ, ಸತ್ಯಜಿತ್ ಸುರತ್ಕಲ್ ಸೇರಿದಂತೆ ವಿವಿಧ ಧಾರ್ಮಿಕ, ಸಾಮಾಜಿಕ, ಶೈಕ್ಷಣಿಕ ಸಂಘಟನೆಗಳ ಮುಖ್ಯಸ್ಥರು, ತುಳು-ಕನ್ನಡ ಚಿತ್ರರಂಗದ ಕಲಾವಿದರು, ಎಬಿವಿಪಿ, ಎನ್‌ಎಸ್‌ಯುಐ, ಸರ್ವ ಕಾಲೇಜು ವಿದ್ಯಾರ್ಥಿ ಸಂಘದ ನೇತೃತ್ವದ ಸಾವಿರಾರು ವಿದ್ಯಾರ್ಥಿಗಳು, ಪುತ್ತೂರು ಕೋಟಿ-ಚೆನ್ನಯ ಜೋಡುಕರೆ ಕಂಬಳ ಸಮಿತಿ, ಉಪ್ಪಿನಂಗಡಿ ವಿಜಯ-ವಿಕ್ರಮ ಜೋಡುಕರೆ ಕಂಬಳ ಸಮಿತಿಯ ಪದಾಧಿಕಾರಿಗಳು ಸೇರಿದಂತೆ ಸಹಸ್ರಾರು ಮಂದಿ ಭಾಗವಹಿಸಿದ್ದರು."
71,ಕಂಬಳ ಮಸೂದೆ ಗ್ರೀನ್ ಸಿಗ್ನಲ್ ಖಚಿತ
72,ಕಂಬಳ ಓಟವನ್ನು ಕಾನೂನುಬದ್ಧ ಗೊಳಿಸಲು ರಾಜ್ಯ ಸಚಿವ ಸಂಪುಟ ಒಪ್ಪಿಗೆ ನೀಡಿದೆ.
73,ಕಂಬಳ ಗದ್ದೆಯ ಸಂಪೂರ್ಣ ಮರು ನಿರ್ಮಾಣವಾಗದೆ ಕಾರ್ಯಕ್ರಮ ಆಯೋಜನೆ ಕಷ್ಟ.
74,"ಕಂಬಳ ಕಾರ್ಯಕ್ರಮಕ್ಕೆ ಆಗಮಿಸಿದ್ದ ಅವರು ಶನಿವಾರ ರಾತ್ರಿ ಶಾಸಕ ರಾಜೇಶ್ ನಾಯ್ಕ್ ಅವರ ಮನೆಯಲ್ಲಿ ವಾಸ್ತವ್ಯ ಹೂಡಿದ್ದು, ಭಾನುವಾರ ಬೆಳಗ್ಗೆ ಬೆಂಗಳೂರಿಗೆ ತೆರಳಿದರು."
75,"ದಸರಾ, ರಾಜ್ಯೋತ್ಸವ ಪ್ರಶಸ್ತಿ ಸಂದರ್ಭ ಕಂಬಳಕ್ಕೆ ಓಟಗಾರರನ್ನು ಗುರುತಿಸುವ ಪದ್ಧತಿ ಇದೆ ಎಂಬಿತ್ಯಾದಿ ಮಾಹಿತಿಯೊಂದಿಗೆ ಕಂಬಳದ ಹಿನ್ನೆಲೆಯನ್ನು ರಾಜ್ಯಪಾಲರಿಗೆ ಸಲ್ಲಿಸಲಾದ ಮನವಿ ಪತ್ರದಲ್ಲಿ ವಿವರಿಸಿರುವ ಅಶೋಕ್ ರೈಯವರು, ಮಾರ್ಚ್‌ನಲ್ಲಿ ಕೆಲವು ಕಂಬಳ ಕೂಟಗಳು ನಡೆಯಲಿದ್ದು, ಮಸೂದೆ ಜಾರಿಗೆ ಬಂದಲ್ಲಿ ಕಂಬಳ ಆಯೋಜನೆಗೆ ಸಹಕಾರಿಯಾಗುತ್ತದೆ ಎಂದು ಉಲ್ಲೇಖಿಸಿದ್ದಾರೆ."
76,ಜಲ್ಲಿಕಟ್ಟು ವಿವಾದ ಭುಗಿಲೆದ್ದ ಬೆನ್ನಲ್ಲೇ ರಾಜ್ಯದಲ್ಲಿ ಕಂಬಳ ಪ್ರಿಯರು ಹೋರಾಟ ಆರಂಭಿಸಿದ್ದರು.
77,"ಬೆಂಗಳೂರು,ಫೆ 17 [ಯುಎನ್ಐ] ಕಂಬಳ ಕ್ರೀಡೆಯಲ್ಲಿ ದಾಖಲೆ ವೇಗದಲ್ಲಿ ಓಡಿ ಭಾರತದ ಉಸೇನ್ ಬೋಲ್ಟ್ ಎಂದು ಕರೆಸಿಕೊಂಡಿರುವ ದಕ್ಷಿಣ ಕನ್ನಡ ಜಿಲ್ಲೆ ಮೂಡಬಿದರೆಯ ಶ್ರೀನಿವಾಸಗೌಡ ಅವರಿಗೆ ಉಪಮುಖ್ಯಮಂತ್ರಿ ಡಾ."
78,"ದೀಪಾವಳಿ ಬಳಿಕ ಕಂಬಳ ಕೂಟಗಳು ಆರಂಭಗೊಳ್ಳಲಿರುವುದರಿಂದ, ಅದೇ ಸಮಯಕ್ಕೆ ಪೇಟ ನ್ಯಾಯಾಲಯದ ಕದ ತಟ್ಟುವುದು ಪ್ರಶ್ನಾರ್ಹ ಎನಿಸಿದೆ."
79,"ಶೆಟ್ಟಿ ಕೂಳೂರು ಪೊಯ್ಯೊಲು ಮಾತನಾಡಿ, ಸುಪ್ರೀಂ ಕೋರ್ಟ್‌ನ ನಿರ್ದೇಶನದಂತೆ ಜಿಲ್ಲೆಯಲ್ಲಿ ಅಹಿಂಸಾತ್ಮಕ ಕಂಬಳ ನಡೆಸಲು ಜಿಲ್ಲಾ ಸಮಿತಿ ಕಟ್ಟುನಿಟ್ಟಿನ ಕ್ರಮ ಕೈಗೊಂಡಿದೆ."
80,"ಯಾತ್ರೆಯು ಕಂಬಳ ರಸ್ತೆಯಾಗಿ ಲೇಡಿಹಿಲ್, ಲಾಲ್ಬಾಗ್, ಬಲ್ಲಾಳ್ಬಾಗ್, ಕೊಡಿಯಾಲ್ಬೈಲ್, ಹಂಪನಕಟ್ಟೆ, ವಿವಿ ಕಾಲೇಜು, ಗಣಪತಿ ಹೈಸ್ಕೂಲ್, ಕಾರ್ಸ್ಟ್ರೀಟ್, ಚಿತ್ರಾ ಟಾಕಿಸ್ ಅಳಕೆ ಮಾರ್ಗವಾಗಿ ಅ."
81,"ಉಪ್ಪಿನಂಗಡಿ: ತುಳುನಾಡಿನ ಪರಿಸರಕ್ಕೂ, ಇಲ್ಲಿನ ಸಂಸ್ಕೃತಿ, ಆಚರಣೆಗಳಿಗೂ ಅನೋನ್ಯ ಸಂಬಂಧವಿದ್ದು, ಇಲ್ಲಿನ ಸಂಸ್ಕೃತಿಯಾದ ಕಂಬಳ ಉಳಿಯುವುದರೊಂದಿಗೆ ಜೀವನದಿ ನೇತ್ರಾವತಿಯೂ ಉಳಿಯಲಿ ಎಂದು ಚಲನಚಿತ್ರ ನಟ ಸುಂದರ ರೈ ಮಂದಾರ ತಿಳಿಸಿದರು."
82,ಕಾಪು: ಕಂಬಳ ಋತು ಆರಂಭಗೊಳ್ಳುತ್ತಿರು ವಂತೆ ಪ್ರಾಣಿ ದಯಾ ಸಂಘ(ಪೆಟಾ)ದವರು ಮತ್ತೆ ಕೋರ್ಟ್‌ ಮೆಟ್ಟಿಲೇರಿದ್ದು ಕಂಬಳ ಪ್ರೇಮಿಗಳ ಆತಂಕಕ್ಕೆ ಕಾರಣವಾಗಿದೆ.
83,ಕರಾವಳಿಯ ಜನಪದ ಕ್ರೀಡೆ ಕಂಬಳಕ್ಕೆ ಕಳೆದ ಬಾರಿ ನಿಷೇಧದ ಗೊಂದಲದಿಂದ ಎಲ್ಲಿಯೂ ಕಂಬಳ ನಡೆಯಲೇ ಇಲ್ಲ.
84,ಅದ್ದರಿಂದ ತುಳುನಾಡಿನ ಜಾನಪದ ಕ್ರೀಡೆ ಕಂಬಳ ನಿಷೇಧವನ್ನು ಕೂಡಲೇ ತೆರವುಗೊಳಿಸ ಬೇಕು ಎಂದು ಪ್ರತಿಭಟನಕಾರರು ಆಗ್ರಹಿಸಿದರು.
