Index,Sentence
305,ಪ್ರತಿಭಟನೆ: ಬೆಳಗ್ಗೆ ವಿಷಯ ಹರಡುತ್ತಿದ್ದಂತೆ ಗಾಂಧಿನಗರದ ನೂರಾರು ಮಂದಿ ಸ್ಥಳಕ್ಕೆ ಆಗಮಿಸಿ ಕಿಡಿಗೇಡಿಗಳನ್ನು ಬಂಧಿಸಬೇಕೆಂದು ಒತ್ತಾಯಿಸಿ ಧರಣಿ ನಡೆಸಿದರು.
306,ಬೆಂಗಳೂರು: ಮಗನ ಸಾವಿನ ನ್ಯಾಯಕ್ಕಾಗಿ ಆಗ್ರಹಿಸಿ ಇಲ್ಲಿನ ಗಾಂಧಿ ಗಾಂಧಿಪ್ರತಿಮೆ ಬಳಿ ಅಹೋರಾತ್ರಿ ಧರಣಿ ನಡೆಸುತ್ತಿದ್ದ ಸಂದರ್ಭ ಡಿಕೆ ರವಿ ತಾಯಿ ಗೌರಮ್ಮ ಕುಸಿದು ಬಿದ್ದಿದ್ದಾರೆ.
307,"ಈ ಪ್ರಕರಣದ ಬಗ್ಗೆ ಸೂಕ್ತ ನ್ಯಾಯ ದೊರಕಿಸುವಂತೆ ಗುರುವಾರ ಎಸ್‌ಎಫ್‌ಐ ಕಾರ್ಯಕರ್ತರು, ಬಾಲಕಿಯ ಸಂಬಂಧಿ ಸೇರಿದಂತೆ ಹಲವರು ಧರಣಿ ನಡೆಸಿದರು."
308,ನನಗೆ ನ್ಯಾಯ ಬೇಕು ಎಂದು ಯುವಕನ ಮನೆಯ ಮುಂದೆ ಧರಣಿ ಕೂತಿದ್ದಾರೆ.
309,ಗ್ರಾಮ ಪಂಚಾಯಿತಿ ನೌಕರರ ಸಂಬಳಕ್ಕಾಗಿ ಸರ್ಕಾರ ಅನುಧಾನ ನೀಡಬೇಕೆಂದು 2017 ಮಾರ್ಚ್ 6 ರಿಂದ 29 ರವರೆಗೆ 24 ದಿವಸಗಳು ಬೆಂಗಳೂರಿನ ಫ್ರೀಡಂಪಾರ್ಕ್ನಲ್ಲಿ ಹಗಲು ರಾತ್ರಿ ಅನಿರ್ದಿಷ್ಟ ಧರಣಿ ನಡೆಸಲಾಯಿತು.
310,ಆದರೆ ಇನ್ನೂವರೆಗೂ ಸರಕಾರ ಪ್ರತಿಮೆ ಸ್ಥಾಪನೆಗೆ ನಿರ್ಧಾರ ಕೈಗೊಳ್ಳದಿರುವ ಕಾರಣ ಗುರುವಾರದಿಂದ ಇಲ್ಲಿನ ಸುವರ್ಣಸೌಧ ಎದುರು ಧರಣಿ ನಡೆಸಲಾಗುತ್ತದೆ.
311,"ಎಸ್ ವೃತ್ತದಿಂದ ಪಾದಯಾತ್ರೆಯಲ್ಲಿ ತೆರಳಿದ ನೂರಾರು ಕಾರ್ಯಕರ್ತರು, ಯಲಹಂಕ ವಲಯಕಚೇರಿಯ ಮುಂಭಾಗದಲ್ಲಿ ಧರಣಿ ನಡೆಸಿದರು."
312,ರಾಷ್ಟ್ರೀಯ ಹೆದ್ದಾರಿಯಲ್ಲಿ ಧರಣಿ ನಡೆಸುವ ವೇಳೆ ಪೊಲೀಸರು ಪ್ರತಿಭಟನಾಕಾರರನ್ನು ಪೊಲೀಸರು ಬಂಧಿಸುವಾಗ ಹಿರಿಯ ಕನ್ನಡ ಚಳವಳಿಗಾರ ಶಾ.
313,"ಸಂಸದರಿಲ್ಲದ ಮನೆಗೆ ಮುತ್ತಿಗೆ ಹಾಕುವುದರಲ್ಲಿ ಅರ್ಥವಿಲ್ಲ ಎಂದು ತೀರ್ಮಾನಿಸಿದ ರೈತ ಸಂಘದ ಮುಖಂಡರು, ಉದ್ಯಾನ ಮುಂಭಾಗದ ರಸ್ತೆಯಲ್ಲೇ ಕುಳಿತು ಸಾಂಕೇತಿಕ ಧರಣಿ ನಡೆಸಿದರು."
314,ಬಿಡಿಎ ಕಚೇರಿ ಎದುರು ರೈತರ ಧರಣಿ
315,ಅಹೋರಾತ್ರಿ ಯಡಿಯೂರಪ್ಪ ಧರಣಿ
316,ಇನ್ನು 15 ದಿನಗಳಲ್ಲಿ ಈ ಬಗ್ಗೆ ಕ್ರಮವಹಿಸದಿದ್ದಲ್ಲಿ ವಿದ್ಯಾರ್ಥಿಗಳೊಂದಿಗೆ ಜಿಲ್ಲಾಧಿಕಾರಿ ಕಚೇರಿ ಎದುರು ಧರಣಿ ನಡೆಸಲಾಗುವುದು.
317,ಕಸ ಸಂಗ್ರಹ ಕಾರ್ಮಿಕರ ಧರಣಿ : ಮಂಗಳೂರು ಮಹಾನಗರ ಪಾಲಿಕೆ ಕಸ ಸಂಗ್ರಹ ಕಾರ್ಮಿಕರು ಸರಿಯಾಗಿ ವೇತನ ಸಿಗದೆ ಬೇಸತ್ತು ಮನೆ-ಮನೆ ಕಸ ಸಂಗ್ರಹವನ್ನು ಸ್ಥಗಿತಗೊಳಿಸಿ ನಗರದ ಬಂಟ್ಸ್ ಹಾಸ್ಟೆಲ್ ಬುಧವಾರ ಬೆಳಗ್ಗೆ ಪ್ರತಿಭಟನೆ ನಡೆಸಿದರು.
318,ಭಾರತ ಸ್ವಾಭಿಮಾನಿಗಳಿಂದ ನ್ಯಾಯಕ್ಕಾಗಿ ಧರಣಿ
319,ದಯಾಶಂಕರ್ ಬಂಧನಕ್ಕೆ ಆಗ್ರಹಿಸಿ ಧರಣಿ
320,ಇದರಿಂದ ಭಾನುವಾರ ಧರಣಿ ಅಂತ್ಯಗೊಳಿಸಲಾಯಿತು.
321,ಬೆಂಗಳೂರಿನ ಫ್ರೀಡಂ ಪಾರ್ಕ್ ನಲ್ಲಿ ವಿವಿಧ ಜಿಲ್ಲೆಗಳಿಂದ ಆಗಮಿಸಿರುವ ಉಪನ್ಯಸಕರು ಧರಣಿ ಕುಳಿತಿದ್ದಾರೆ.
322,ಯಡಿಯೂರಪ್ಪ ನೇತೃತ್ವದಲ್ಲಿ ನಗರದ ಧರಣಿ ಸ್ಥಳದಲ್ಲೇ ನಡೆದ ಕಾರ್ಯಕಾರಿಣಿ ಸಭೆಯಲ್ಲಿ ಈ ಬಗ್ಗೆ ತೀರ್ಮಾನ ತೆಗೆದುಕೊಳ್ಳಲಾಗಿದೆ.
323,ವಿವಿಧ ಬೇಡಿಕೆಗಳ ಈಡೇರಿಕೆಗೆ ಒತ್ತಾಯಿಸಿ ಅಂಗನವಾಡಿ ಕಾರ್ಯಕರ್ತೆಯರ ಧರಣಿ
324,ಉದ್ಯೋಗದಲ್ಲಿ ಕನ್ನಡಿಗರಿಗೆ ಮೀಸಲಾತಿ ಕಲ್ಪಿಸುವಂತೆ ಶಿಫಾರಸು ಮಾಡಿರುವ ಸರೋಜಿನಿ ಮಹಿಷಿ ವರದಿಯನ್ನು ಜಾರಿಗೊಳಿಸಬೇಕೆಂದು ಬೆಂಗಳೂರಿನ ಮೌರ್ಯ ವೃತ್ತದಲ್ಲಿ ಕನ್ನಡಪರ ಸಂಘಟನೆಗಳು 100 ದಿನಗಳಿಂದ ನಡೆಸುತ್ತಿದ್ದ ಧರಣಿ ನಡೆಸುತ್ತಿದ್ದರು.
325,ಕಾಸರಗೋಡಿನಲ್ಲಿ ಖಾಸಗಿ ಬಸ್ಸು ಮಾಲಕರ ಧರಣಿ ಸತ್ಯಾಗ್ರಹ
326,ದಲಿತ ಸಂಘರ್ಷ ಸಮಿತಿಯ ಜಿಲ್ಲಾ ಘಟಕದ ಪದಾಧಿಕಾರಿಗಳ ಧರಣಿ
327,ಪ್ರತಿಭಟನಕಾರರು ರೈಲು ಹಳಿಯಲ್ಲಿ ಧರಣಿ ಕುಳಿತ ಪರಿಣಾಮ ಅಸ್ಸಾಂನಾದ್ಯಂತ ರೈಲು ಸಂಚಾರಕ್ಕೆ ಅಡ್ಡಿ ಉಂಟಾಯಿತು ಎಂದು ರೈಲ್ವೇ ವಕ್ತಾರರು ಹೇಳಿದ್ದಾರೆ.
328,ಧರಣಿ ಮಂಡಲ ಕತ್ತಲೊಳಗೆ!
329,"ಟೋಲ್ ಗೇಟ್ ವಿರೋಧಿ ಹೋರಾಟ ಸಮಿತಿ, ಸುರತ್ಕಲ್ ಇದರ ವತಿಯಿಂದ ಅಕ್ರಮ ಟೋಲ್ ಗೇಟ್ ಮುಚ್ಚಲು ಒತ್ತಾಯಿಸಿ ವಿವಿಧ ಅಕ್ಟೋಬರ್ 22 ರಿಂದ ನಡೆಯುವ ಅನಿರ್ಧಿಷ್ಟಾವಧಿ ಧರಣಿ ಸಿದ್ದತಾ ಸಭೆ, ಹಾಗೂ ಪೋಸ್ಟರ್ ಬಿಡುಗಡೆ ಕಾರ್ಯಕ್ರಮ ಸುರತ್ಕಲ್ ಸಮೀಪದ ತಡಂಬೈಲ್‌ನ ಸುಪ್ರೀಮ್ ಹಾಲ್ ನಲ್ಲಿ ನಡೆಯಿತು."
330,ಧರಣಿ ಗುರುವಾರವೂ ಮುಂದುವರಿಯಲಿದೆ.
331,"ಜಿಂದಾಲ್ಗೆ ಭೂಮಿ ನೀಡುವ ರಾಜ್ಯ ಸರ್ಕಾರದ ನಿರ್ಧಾರ ವಿರೋಧಿಸಿ ಅಹೋರಾತ್ರಿ ಧರಣಿ ನಡೆಸಿದ್ದ ಬಿಜೆಪಿ ರಾಜ್ಯಾಧ್ಯಕ್ಷ ಯಡಿಯೂರಪ್ಪ ಅವರು, ರಾಜ್ಯ ಸರ್ಕಾರ ಜಿಂದಾಲ್ ಕಂಪನಿಯಿಂದ ಕಿಕ್‌ಬ್ಯಾಕ್‌ ಪಡೆದಿರುವ ಅನುಮಾನಗಳಿವೆ ಎಂದು ಆರೋಪಿಸಿದ್ದರು."
332,ಉಡುಪಿ ಜಿಲ್ಲೆಯಾದ್ಯಂತ ನಿವೇಶನ ರಹಿತರಿಗೆ ಭೂಮಿ ಹಕ್ಕು ಪತ್ರ ಕೊಡಬೇಕೆಂದು ಒತ್ತಾಯಿಸಿ ನವಂಬರ್18 ರಿಂದ ಉಡುಪಿ ಜಿಲ್ಲಾಧಿಕಾರಿ ಕಚೇರಿ ಎದುರು ನಿವೇಶನ ರಹಿತರ ಅನಿಧಿ೯ಷ್ಟಾವಧಿ ಧರಣಿ ಮುಷ್ಕರ ಹೋರಾಟ ಕಾಯ೯ಕ್ರಮ ಯಶಸ್ವಿ ಗಳಿಸಲು ಪೂವ೯ಭಾವಿ ಸಿದ್ಧತಾ ಸಭೆ ಕುಂದಾಪುರ ಕಾಮಿ೯ಕ ಭವನದಲ್ಲಿ ಯಶಸ್ವಿಯಾಗಿ ಜರುಗಿತು.
333,25ಕ್ಕೆ ಅಹೋರಾತ್ರಿ ಧರಣಿ ಕೈಗೊಳ್ಳಲು ರೈತರು ಈಗಾಗಲೇ ಸಜ್ಜಾಗಿದ್ದಾರೆ.
334,ಮಹದಾಯಿ ಯೋಜನೆ ಜಾರಿಗೆ ಹೋರಾಡುತ್ತಿರುವವರನ್ನು ಬಿಜೆಪಿ ಕಚೇರಿ ಮುಂದೆ ಧರಣಿ ಕೂರಲು ಕಾಂಗ್ರೆಸ್ ಪಕ್ಷ ಸಂಚು ರೂಪಿಸಿದೆ ಎಂದು ಬಿಎಸ್ ವೈ ಹೇಳಿದ್ದಾರೆ.
335,ಸಚಿವರ ಭೇಟಿ: ಧರಣಿ ಸ್ಥಳಕ್ಕೆ ಆಗಮಿಸಿದ ಅಬಕಾರಿ ಸಚಿವ ಎಂ.
336,ಕಳೆದ 1 ವಾರದಿಂದ ಪಂಚಾಯ್ತಿ ಮುಂಭಾಗ ಫಲಾನುಭವಿಗಳು ಧರಣಿ ಕೈಗೊಂಡಿದ್ದಾರೆ.
337,ಸಾಲ ಮನ್ನಾಕ್ಕೆ ಆಗ್ರಹ: ರೈತರ ಧರಣಿ
338,"ಸುಬ್ಬಾರೆಡ್ಡಿ ಮಾತನಾಡಿ, ಅನಿರ್ದಿಷ್ಟಾವಧಿ ಧರಣಿ ನಡೆದಿರುವುದು ಸರ್ಕಾರದ ಗಮನದಲ್ಲಿದೆ."
339,ಯೋಗೇಶ್ವರ್ ಸ್ಥಳಕ್ಕೆ ಬಂದು ನಮಗೆ ಭರವಸೆ ನೀಡುವವರೆಗೂ ಧರಣಿ ಸತ್ಯಾಗ್ರಹ ನಿಲ್ಲುವುದಿಲ್ಲ ಎಂದು ಧರಣಿನಿರತರು ಪಟ್ಟು ಹಿಡಿದು ಕುಳಿತರು.
340,ಜಿಲ್ಲಾಡಳಿತ ಕೂಡಲೇ ರೈತರ ಬಾಕಿ ಕೊಡಿಸದಿದ್ದರೆ ಇಲ್ಲಿಯೇ ಆಹೋರಾತ್ರಿ ಧರಣಿ ನಡೆಸಬೇಕಾಗುತ್ತದೆ ಎಂದು ಎಚ್ಚರಿಕೆ ನೀಡಿದರು.
341,"ಪಾವತಿಯಾಗದಿರುವ ಕಾಮಗಾರಿ ಬಿಲ್‌ಗಳ ₨63 ಕೋಟಿಯನ್ನು ಕೂಡಲೇ ಬಿಡುಗಡೆ ಮಾಡಬೇಕು ಎಂದು ಆಗ್ರಹಿಸಿ ಜಿಲ್ಲಾ ಗುತ್ತಿಗೆದಾರರ ಸಂಘದ ಸದಸ್ಯರು ನಗರದಲ್ಲಿ ಪ್ರತಿ­ಭಟನಾ ಮೆರವಣಿಗೆ ನಡೆಸಿ, ಲೋಕೋ­ಪ­ಯೋಗಿ ಇಲಾಖೆ ಕಾರ್ಯಪಾಲಕ ಎಂಜಿನಿಯರ್ ಕಚೇರಿ ಮುಂದೆ ಧರಣಿ ನಡೆಸಿದರು."
342,ಒಂದು ವೇಳೆ ಧರಣಿ ನಡೆಸಿದರೆ ನನ್ನ ಅಭ್ಯಂತರ ಇಲ್ಲ.
343,ಇನ್ನು ಧರಣಿ ಮಧ್ಯೆ ಭಜನೆ ಮಾಡುವ ಮೂಲಕ ಪ್ರತಿಭಟನಾಕಾರರು ಗಮನಸೆಳೆದರು.
344,* ಯಡಿಯೂರಪ್ಪ ಧರಣಿ ನಡೆಯುತ್ತಿದ್ದರೂ ಕಲಾಪ ಮುಂದುವರೆಸಲು ಕಾಂಗ್ರೆಸ್ ಶಾಸಕಾಂಗ ಪಕ್ಷದ ಸಭೆಯಲ್ಲಿ ತೀರ್ಮಾನಿಸಲಾಗಿದೆ.
345,ಕಳೆದ ತಿಂಗಳು 13 ದಿನಗಳ ಕಾಲ ರೈತರು ಬೆಳಗಾವಿ ಜಿಲ್ಲಾಧಿಕಾರಿ ಕಚೇರಿ ಆವರಣದಲ್ಲಿ ಉಪವಾಸ ಧರಣಿ ನಡೆಸಿ ಜಿಲ್ಲಾಧಿಕಾರಿಗಳಿಗೆ ಮನವಿ ಸಲ್ಲಿಸಿದ್ದರು.
346,22ನೇ ದಿನಕ್ಕೆ ಕಾಲಿಟ್ಟ ಅನಿರ್ದಿಷ್ಟಾವಧಿ ಧರಣಿ
347,"ರಾಜ್ಯದಲ್ಲಿ ಬರ ಪರಿಹಾರ ನಿರ್ವಹಣೆ, ರೈತರ ಸಾಲ ಮನ್ನಾ ಯೋಜನೆ ಹಾಗೂ ಜಿಂದಾಲ್‌ ಸಂಸ್ಥೆಗೆ ಭೂಮಿ ಮಾರಾಟ ಕುರಿತಂತೆ ರಾಜ್ಯ ಸರ್ಕಾರದ ಕ್ರಮಗಳನ್ನು ಪ್ರತಿಭಟಿಸಿ ತಮ್ಮ ನಾಯಕತ್ವದಲ್ಲಿ ಅಹೋರಾತ್ರಿ ಧರಣಿ ನಡೆಸುತ್ತಿರುವುದನ್ನು ರಾಜ್ಯ ಸರ್ಕಾರ ಗಂಭೀರವಾಗಿ ಪರಿಗಣಿಸಿದೆ."
348,ಇದಕ್ಕೆ ಒಪ್ಪದ ಧರಣಿ ನಿರತರು ನಮ್ಮಲ್ಲಿ ಮದ್ಯ ಪೂರೈಕೆಯಾಗಿರುವ ಬಗ್ಗೆ ವಿಡಿಯೋ ದಾಖಲೆಗಳಿವೆ.
349,"ಸೋಮವಾರ ಇಲ್ಲಿನ ನೀರಾವರಿ ಇಲಾಖೆ ಎದುರು ಧರಣಿ ನಡೆಸಿದ ಅವರು, ನಿಯಮದ ಪ್ರಕಾರ ₹ 50 ಲಕ್ಷ ಒಳಗಿನ ಕಾಮಗಾರಿಯಲ್ಲಿ ಶೇ 24."
350,23ರಿಂದ ಜಿಲ್ಲಾಧಿಕಾರಿಗಳ ಕಛೇರಿ ಎದುರು ಟೆಂಟ್ ಹಾಕಿ ಧರಣಿ ಹಾಗೂ ಉಪವಾಸ ಆರಂಭಿಸಿ ಸೋಮವಾರ 12ನೇ ದಿನಕ್ಕೆ ಕಾಲಿರಿಸಿದೆ.
351,ಧರಣಿ ಮುಂದುವರಿಕೆ: ಹೈದರಾಬಾದ್ ಕರ್ನಾಟಕ ವಿಭಾಗದ (6-8ನೇ ತರಗತಿ) ಪದವೀಧರ ಹಿರಿಯ ಪ್ರಾಥಮಿಕ ಶಾಲಾ ಶಿಕ್ಷಕರ ನೇಮಕಾತಿ ಸಂಬಂಧ 371 ಜೆ ಮೀಸಲಾತಿ ಅಡಿ ಜ್ಯೇಷ್ಠತೆ ಆಧಾರದಲ್ಲಿ 2ನೇ ಪಟ್ಟಿ ಬಿಡುಗಡೆಗೊಳಿಸುವಂತೆ ಒತ್ತಾಯಿಸಿ ಕಲಬುರಗಿ ಮೂಲದ ಹೈದರಾಬಾದ್ ಕರ್ನಾಟಕ ಪದವೀಧರ ನಿರುದ್ಯೋಗ ಶಿಕ್ಷಕರ ಸಂಘವು ಬುಧವಾರದಿಂದ ನಡೆಸುತ್ತಿರುವ ಧರಣಿಯನ್ನು ಗುರುವಾರ ಮುಂದುವರಿಸಿತು.
352,"ನಗರದ ವಿವಿಧ ಸ್ಥಳಗಳಲ್ಲಿನ ವಿವಿಧ ಸಮಸ್ಯೆಗಳನ್ನು ಪುರಸಭೆ ಅಧಿಕಾರಿಗಳ ಗಮನಕ್ಕೆ ತಂದು, ಪಟ್ಟಣದ 12ನೇ ವಾರ್ಡ್‌ನ ಕುಡಿಯುವ ನೀರಿನ ಸಮಸ್ಯೆ 6ನೇ ವಾರ್ಡ್‌ನಲ್ಲಿ ನಡೆದ ಕಳಪೆ ಸಿಸಿ ರಸ್ತೆ ಕಾಮಗಾರಿ ಪರಿಶೀಲಿ, ಸಂಬಂಧಿಸಿದ ಗುತ್ತಿಗೆದಾರನಿಗೆ ಬಿಲ್ ನೀಡದಂತೆ ಎಚ್ಚರಿಕೆ ನೀಡಿದರಲ್ಲದೆ, ಒಂದು ವಾರದಲ್ಲಿ ಬೇಡಿಕೆಗಳು ಈಡೇರದಿದ್ದಲ್ಲಿ ಆಗಸ್ಟ್ ಕೊನೆಯಲ್ಲಿ ಧರಣಿ ಸತ್ಯಾಗ್ರಹ ಆರಂಭಿಸುವುದಾಗಿ ಎಚ್ಚರಿಕೆ ನೀಡಿದರು."
353,ಗ್ರಾಪಂ ಸಭಾಂಗಣದಲ್ಲಿ ಸಾಮಾನ್ಯ ಸಭೆ ನಡೆಯುತ್ತಿದ್ದ ಸಂದರ್ಭ ಕಚೇರಿ ಮುಂದೆ ಜಮಾಯಿಸಿದ ಕಾರ್ಯಕರ್ತರು ಗ್ರಾಪಂ ಅಧ್ಯಕ್ಷ ಹಾಗೂ ಆಡಳಿತ ಮಂಡಳಿ ವಿರುದ್ಧ ಧಿಕ್ಕಾರ ಘೋಷಣೆಗಳನ್ನು ಕೂಗಿದ ಬಳಿಕ ಇಡೀ ಸಿದ್ದಾಪುರದಲ್ಲಿ ದುರ್ನಾತ ಬೀರುತ್ತಿದೆ ಎಂದು ಮೂಗಿಗೆ ಬಟ್ಟೆ ಕಟ್ಟಿ ಧರಣಿ ನಡೆಸಿದರು.
354,"ಅಲ್ದೆ, ಸ್ವತಃ ಷಾ ಅವರೇ ಧಾರವಾಡ ಜಿಲ್ಲಾಧಿಕಾರಿ ಕಚೇರಿ ಎದುರು ಧರಣಿ ಮಾಡ್ತಿರೋದ್ರಿಂದ ಹಲವು ಕಾಂಗ್ರೆಸ್ ನಾಯಕಿಗೆ ನಡುಕ ಪ್ರಾರಂಭವಾಗಿದೆ ಎಂದ್ರೆ ತಪ್ಪಾಗಲಾರದು."
355,"ಬನ್ನಿಕೋಡ್ ಅವರ ಪುತ್ರ ಚಂದ್ರು, ರಟ್ಟಹಳ್ಳಿಯ ತುಂಗಾ ಮೇಲ್ದಂಡೆ ಯೋಜನೆ ಕಚೇರಿ ಎದುರು ರಾತ್ರೋರಾತ್ರಿ ಧರಣಿ ನಡೆಸಿ, ದಶಕಕ್ಕೂ ಹಳೆಯದಾದ ಪ್ರತಿಭಟನೆಗೆ ಹೊಸ ಹುರುಪು ತಂದರು."
356,ಅನುದಾನ ಆಗ್ಲಿಲ್ಲ ಅಂದ್ರೆ ಮುಖ್ಯಮಂತ್ರಿ ಮನೆ ಮುಂದೆ ಧರಣಿ ಮಾಡ್ಲಿ.
357,ಹೀಗಾಗಿ ಇಲ್ಲಿನ ಧರಣಿ ವೇದಿಕೆಯಿಂದಲೇ ಮತ್ತೊಮ್ಮೆ ಪತ್ರ ಚಳವಳಿ ಪ್ರಾರಂಭಿಸಿದ್ದೇವೆ ಎಂದು ರೈತ ಸೇನೆ ರಾಜ್ಯ ಘಟಕದ ಅಧ್ಯಕ್ಷ ವಿರೇಶ ಸೊಬರದಮಠ ಹೇಳಿದರು.
358,"ಕಳೆದೆರಡು ದಿನಗಳಿಂದ ಸ್ವಾತಂತ್ರ್ಯ ಉದ್ಯಾನದಲ್ಲಿ ಧರಣಿ ನಡೆಸುತ್ತಿರುವ ಬಿಸಿಯೂಟ ತಯಾರಕರು, ಸರ್ಕಾರ ಇದುವರೆಗೆ ಸ್ಪಂದಿಸದ ಹಿನ್ನೆಲೆಯಲ್ಲಿ ಅನಿರ್ದಿಷ್ಟಾವಧಿ ಮುಷ್ಕರಕ್ಕೆ ಸಂಘ ಕರೆ ನೀಡಿದೆ."
359,ಧರಣಿ ಈರೇಳುಗಳಾ | ತನ್ನುದರದಿ | ಧರಿಸಿ ರಕ್ಷಿಪನೀಗಳು ||
360,"ಗೋಯಲ್ ಪ್ರತಿಭಟನೆ ಕೂರುವ ವಿಚಾರವನ್ನು ಮುಖ್ಯಮಂತ್ರಿ ಕಮಲನಾಥ್ ಅವರಿಗೆ ಲಿಖಿತವಾಗಿ ಸಲ್ಲಿಸಿದ್ದು, ಶುಕ್ರವಾರ ಧರಣಿ ಘೋಷಿಸಿದ್ದರು ಕೂಡ."
361,ಸ್ಥಳಕ್ಕೆ ಜಿಲ್ಲಾಧಿಕಾರಿ ಅಥವಾ ಉಪವಿಭಾಗಾಧಿಕಾರಿ ಆಗಮಿಸಿ ಕೃಷಿ ಭೂಮಿಗೆ ನೀರು ಹರಿಸುವ ಭರವಸೆ ನೀಡಬೇಕು ಎಂದು ಪಟ್ಟು ಹಿಡಿದು ಸಂಜೆಯಾದರೂ ರೈತರು ಧರಣಿ ಮುಂದುವರೆಸಿದ್ದರು.
362,ಧರಣಿ ಸ್ಥಳಕ್ಕೆ ಬಂದವರೇ ಏಕಾಏಕಿ ಜಿಲ್ಲಾಧಿಕಾರಿ ಕಚೇರಿಗೆ ಮುತ್ತಿಗೆ ಹಾಕುವ ಸಲುವಾಗಿ ಓಡಲಾ­ರಂಭಿಸಿದರು.
363,ರೈತರಿಂದ ಅಹೋರಾತ್ರಿ ಧರಣಿ 27ರಿಂದ
364,Home ಪ್ರಾದೇಶಿಕ ಮುಂಬೈ ಕರ್ನಾಟಕ ಬೆಳಗಾವಿ ವಿಧಾನಸಭೆಯಲ್ಲಿ ಪ್ರತಿಧ್ವನಿಸಿದ ಚಾಮುಂಡೇಶ್ವರಿ ದೇವಾಲಯದ ಧರಣಿ ವಿಚಾರ
365,ಧರಣಿ ಅಂತ್ಯ: ಷೇರು ಮಾರುಕಟ್ಟೆ ಆಧರಿತ ಪಿಂಚಣಿ ಯೋಜನೆ ಕೈಬಿಟ್ಟು ಶಾಶ್ವತ ಪಿಂಚಣಿ ಯೋಜನೆ ಜಾರಿಗೊಳಿಸಬೇಕು ಎಂದು ಆಗ್ರಹಿಸಿ ಅಂಗನವಾಡಿ ನೌಕರರು ನಗರದ ಮಹಿಳಾ ಮತ್ತು ಮಕ್ಕಳ ಅಭಿವೃದ್ಧಿ ಇಲಾಖೆ ಕಚೇರಿ ಎದುರು 5 ದಿನಗಳಿಂದ ನಡೆಸುತ್ತಿದ್ದ ಧರಣಿಯು ಶುಕ್ರವಾರ ಕೊನೆಗೊಂಡಿತು.
366,ಜಾರ್ಜ್ ರಾಜೀನಾಮೆಗೆ ಆಗ್ರಹಿಸಿ ಕಳೆದ ಎರಡೂ ದಿನದಿಂದ ವಿಧಾನಸಭೆಯಲ್ಲಿ ಧರಣಿ ಸತ್ಯಾಗ್ರಹ ಕೈಗೊಂಡಿದ್ದ ಬಿಜೆಪಿ ತನ್ನ ಧರಣಿ ಹಿಂಪಡೆದಿದೆ.
367,23: ಸಾರ್ವಜನಿಕರಿಗೆ ಸೂಕ್ತ ರೀತಿಯಲ್ಲಿ ಮರಳು ವಿತರಣೆಗೆ ಒತ್ತಾಯಿಸಿ ಜಿಲ್ಲಾಧಿಕಾರಿ ಕಚೇರಿ ಆವರಣದಲ್ಲಿ ಧರಣಿ ನಡೆಸಿದ ಸಂದರ್ಭ ಸರಕಾರಿ ಕರ್ತವ್ಯಕ್ಕೆ ಅಡ್ಡಿ ಪಡಿಸಿದ ಪ್ರಕರಣ ಸಂಬಂಧ ಶಾಸಕ ಸಿ.
368,ಆರು ಪದಾಧಿಕಾರಿಗಳಿಗೆ ಶಿಸ್ತಿನ ಕ್ರಮವಾಗಿ ಶೋಕಾಸ್ ಪತ್ರ ನೀಡಲಾಗಿದೆ ಈ ಎಲ್ಲ ಕ್ರಮ ಖಂಡಿಸಿ ಸಾಂಕೇತಿಕ ಧರಣಿ ನಡೆಸಲಾಗುತ್ತಿದೆ ಎಂದು ಪ್ರಕಟಣೆಯಲ್ಲಿ ತಿಳಿಸಿದ್ದಾರೆ.
369,ಮನೆ ಕಟ್ಟಲು ಬಿಡದಿದ್ದರೆ ಇಲ್ಲೇ ಅಹೋ ರಾತ್ರಿ ಧರಣಿ ಮುಂದುವರಿಸುತ್ತೇವೆ.
370,ಶಿಷ್ಯವೇತನಕ್ಕಾಗಿ ಜೆಜೆಎಂಸಿ ಕಾಲೇಜಿನ ಕಿರಿಯ ವೈದ್ಯರ ಧರಣಿ ಆರಂಭ
371,ಕಾವೇರಿ ನಿರ್ವಹಣಾ ಮಂಡಳಿ ರಚನೆಗೆ ಬಿಗಿಪಟ್ಟು ಮುಂದುವರಿಸಿರುವ ಎಐಎಡಿಎಂಕೆ ಸದಸ್ಯರು ಧರಣಿ ಮುಂದುವರಿಸಿದರು.
372,ಧರಣಿ ನಡೆಯುತ್ತಿದ್ದ ಸ್ಥಳಕ್ಕೆ ಬಂದ ಹೆಚ್ಚುವರಿ ಜಿಲ್ಲಾಧಿಕಾರಿ ಚನ್ನಬಸಪ್ಪ ಅವರು ಧರಣಿ ನಿರತರಿಂದ ಮನವಿ ಸ್ವೀಕರಿಸಿದರು.
373,ಯಡಿಯೂರಪ್ಪ ಅವರ ನೇತೃತ್ವದಲ್ಲಿ ಮಂಗಳವಾರ ಧರಣಿ ನಡೆಸಿದರು.
374,8) ಜಿಲ್ಲೆಯ ಶಾಸಕರು ಮತ್ತು ಸಚಿವರ ಮನೆ ಎದುರು ಧರಣಿ ನಡೆಸಲು ನಿರ್ಧರಿಸಲಾಗಿದೆ.
375,ರಂದು ನಡೆಯುವ ಶಿಕ್ಷಕರ ದಿನಾಚರಣೆಯ ಒಳಗೆ ಈಡೇರಿಸದೆ ಇದ್ದಲ್ಲಿ ಶಿಕ್ಷಕರ ದಿನಾಚರಣೆಯನ್ನ ಬಹಿಷ್ಕರಿಸಿ ವಿಧಾನ ಸಭೆ ಮುಂದೆ ಧರಣಿ ಕೂರಲಿದ್ದೇವೆ ಎಂದರು.
376,"ವೃತ್ತದಲ್ಲಿ ಮಾನವ ಸರಪಳಿ ನಿರ್ಮಿಸಿ ನಂತರ ತಾಲೂಕು ಕಛೇರಿ ಮುಂಭಾಗದಲ್ಲಿ ಒಂದು ದಿನದ ಸಾಂಕೇತಿಕ ಧರಣಿ ನಡೆಸಿ, ತಹಶೀಲ್ದಾರರಿಗೆ ಮನವಿ ಸಲ್ಲಿಸಿದರು."
377,27: ಕಟ್ಟಡ ಮತ್ತು ಇತರ ನಿರ್ಮಾಣ ಕಾರ್ಮಿಕರ ಜೀವನ ಭದ್ರತೆಗೆ ಅಗತ್ಯವಾದ ಕಾನೂನು ಬದ್ಧ ಸೌಲಭ್ಯಗಳನ್ನು ಒದಗಿಸುವಂತೆ ಸರಕಾರವನ್ನು ಒತ್ತಾಯಿಸಿ ಜಿಲ್ಲಾ ಕಟ್ಟಡ ಕಾರ್ಮಿಕರ ಸಂಘದ ಸದಸ್ಯರು ಗುರುವಾರ ನಗರದಲ್ಲಿ ಧರಣಿ ನಡೆಸಿದರು.
378,ಇದರಿಂದ ಬೆಳೆಗಾರರ ಮೇಲೆ ಆರ್ಥಿಕ ಹೊರೆ ಬೀಳುತ್ತಿದೆ ಎಂದು ಧರಣಿ ನಿರತರು ದೂರಿದರು.
379,ಮೆರವಣಿಗೆಯಲ್ಲಿ ಬಂದವರಿಗೆ ಸಮಾಧಾನ ಪಡಿಸಿ ಕಚೇರಿ ಮುಂಭಾಗದ ಬಯಲಿನಲ್ಲಿ ಮತ್ತು ರಸ್ತೆಯ ಮೇಲೆ ಧರಣಿ ಕುಳಿತುಕೊಳ್ಳವಂತೆ ಮಾಡಲು ಕಾರ್ಯಕರ್ತರು ಹರಸಾಹಸ ಪಡಬೇಕಾಯಿತು.
380,ಕಾರ್ಯಾಲಯದ ಮುಂಭಾಗದಲ್ಲಿ ಧರಣಿ ಕುಳಿತ ಸದಸ್ಯ ಕರೆಪ್ಪ ಮಂಟೂರ.
381,ಯಾದಗಿರಿ: ಸಕ್ಕರೆ ಕಾರ್ಖಾನೆಗೆ ಭೂಮಿ ನೀಡಿದ ರೈತರಿಗೆ ನ್ಯಾಯ ಒದಗಿಸಬೇಕು ಎಂದು ಆಗ್ರಹಿಸಿ ಮುಷ್ಟೂರಿನ ರೈತರು ಜಿಲ್ಲಾಧಿಕಾರಿ ಕಚೇರಿ ಎದುರು ಸೋಮವಾರ ಧರಣಿ ನಡೆಸಿದರು.
382,"ಶನಿವಾರ ಜಿಲ್ಲಾದ್ಯಂತ ಧರಣಿ ತೀವ್ರಗೊಳಿಸಲಾಗುವುದು ಎಂದು ರೈತ ಸಂಘದ ಚೂನಪ್ಪ‌ ಪೂಜೇರಿ, ರಾಘವೇಂದ್ರ ನಾಯಕ ಎಚ್ಚರಿಕೆ ನೀಡಿದ್ದಾರೆ."
383,ಕೊಪ್ಪಳ: ಆಗಸ್ಟ್ 14ರ ಒಳಗೆ ರೈತರ ಎಲ್ಲ ರೀತಿಯ ಸಾಲ ಮನ್ನಾ ಮಾಡದಿದ್ದರೆ ಜೆಡಿಎಸ್ ಶಾಸಕರ ಮನೆ ಎದುರು ಧರಣಿ ನಡೆಸಲಾಗುವುದು ಎಂದು ರೈತ ಮುಖಂಡ ದರ್ಶನ್ ಪುಟ್ಟಣ್ಣಯ್ಯ ಎಚ್ಚರಿಕೆ ನೀಡಿದರು.
384,ನಂಜುಂಡ ಸ್ವಾಮಿ ಪ್ರಕಟಿಸಿ ಧರಣೆ ಕುಳಿತಿದ್ದು ಧರಣಿ ಗುರುವಾರವೂ ಮುಂದುವರೆಯಲಿದೆ.
385,ದೇವರಪುರ ಪೈಸಾರಿ ಹಾಡಿ ಮೂಲಭೂತ ಸೌಲಭ್ಯದಿಂದ ವಂಚಿತ : ಗಾಂಧಿ ಮೈದಾನದಲ್ಲಿ ಅಹೋರಾತ್ರಿ ಧರಣಿ ಸತ್ಯಾಗ್ರಹ ಆರಂಭ : ಬೇಡಿಕೆ ಈಡೇರಿಕೆಗೆ ಆಗ್ರಹ
386,ಇತ್ತೀಚೆಗೆ ಹುಬ್ಬಳ್ಳಿಯಲ್ಲಿ ಮಹದಾಯಿ ಹೋರಾಟಗಾರರು ವಿರೊಧ ಪಕ್ಷದ ನಾಯಕ ಜಗದೀಶ್ ಶೆಟ್ಟರ್ ಮನೆ ಮುಂದೆ ಧರಣಿ ನಡೆಸಿದ್ದರು.
387,ಪರಿಷತ್‌ನಲ್ಲಿ ಪ್ರತಿಪಕ್ಷಗಳ ಧರಣಿ ಮುಂದುವರಿದ ಹಿನ್ನೆಲೆಯಲ್ಲಿ ದಿನದ ಕಲಾಪವನ್ನೇ ಮುಂದೂಡಲಾಯಿತು.
388,"ರಾಜಣ್ಣ, ಧರಣಿ ಮೋಟಾರ್ಸ್ ಮಾಲೀಕ ಮಂಜುನಾಥ್, ವಕೀಲ ಕುಮಾರ್ ಗೌಡ, ನಿವೃತ್ತ ಪೊಲೀಸ್ ಅಧಿಕಾರಿ ಸಮೀವುಲ್ಲಾ, ವಿವಿಧ ತಂಡಗಳ ಅಧ್ಯಕ್ಷರಾದ ಅಂಜಿನಪ್ಪ, ಎನ್‌."
389,ನಾಳೆ ಅಗಸ್ಟ್ ೧೧ ರಿಂದ ಬೆಂಗಳೂರಿನ ಫ್ರೀಡಂ ಪಾರ್ಕ್ ನಲ್ಲಿ ರೈತರು ಧರಣಿ ಆರಂಭಿಸಲಿದ್ದಾರೆ.
