Index,Sentence
339,ಹಿರಿಯರ EBV- ಧನಾತ್ಮಕ ವಿಭಿನ್ನ ದೊಡ್ಡ B- ಕೋಶ ಲಿಂಫೋಮಾ
340,ಕಳೆದ ಐದು ವರ್ಷಗಳ ಅವಧಿಯಲ್ಲಿ ಜಾನಪದ ವಿವಿ ಕೇವಲ 13 ಜಿಲ್ಲೆಗಳ ಗ್ರಾಮ ಚರಿತ್ರೆ ಕೋಶ ಪ್ರಕಟಿಸಿ ಬಿಡುಗಡೆಗೊಳಿಸಿದೆ.
341,ಜಿಲ್ಲಾ ನಗರಾಭಿವೃದ್ದಿ ಕೋಶ ಯೋಜನಾ ನಿರ್ದೆಶಕರಾಗಿ ಕೆ.
342,ದ್ರಾಕ್ಷಿಯು ಆಕ್ಸಿಡೇಟಿವ್ ಒತ್ತಡವನ್ನು ನೇರವಾಗಿ ಪ್ರತಿರೋಧಿಸಿ ಕೋಶ ಮಟ್ಟದಲ್ಲಿ ಪರಿವರ್ತನೆಗಳಿಗೆ ಕಾರಣವಾಗಿ ನೇತ್ರ ಆರೋಗ್ಯವನ್ನು ವೃದ್ದಿಸಿದೆ ಎಂಬು ಅಬ್ಯಗಲ್ ಹ್ಯಾಕಂ ಹೇಳಿದ್ದಾರೆ.
343,ಶಿಲೀಂಧ್ರಗಳು ಅತಿಥೇಯ ಕೋಶ ಮತ್ತು ಬಿಡುಗಡೆ ಕೋಶಗಳಲ್ಲಿ ಸಂತಾನೋತ್ಪತ್ತಿ ಮಾಡುತ್ತವೆ.
344,"ಜೀರ್ಣಕ್ರಿಯೆ ಆರೋಗ್ಯ, ಹೃದಯ ಸರಿಯಾಗಿ ಕಾರ್ಯನಿರ್ವಹಿಸಲು, ಸ್ನಾಯುಗಳ ಕೋಶ ಸರಿಪಡಿಸಲು ಮತ್ತು ನರವ್ಯವಸ್ಥೆಗೆ ಇದು ಅಗತ್ಯವಾಗಿ ಬೇಕು."
345,ದಕ್ಷಿಣ ಭಾರತೀಯ ಜಾನಪದ ಕೋಶ (ತ)(೯೧)
346,ದೇಶ ಸುತ್ತು ಕೋಶ ಓದು ಎನ್ನುವ ಮಾತೊಂದಿದೆ.
347,"ಹೊಸ ಜಿಲ್ಲೆಗಳು ವಿಭಾಗ ಮಟ್ಟದಲ್ಲಿ, ಪ್ರಾದೇಶಿಕ ಮಟ್ಟದಲ್ಲಿ ಹಾಗೂ ರಾಜ್ಯ ಮಟ್ಟದಲ್ಲಿ ಯಾವ ಸ್ಥಾನದಲ್ಲಿವೆ ಎಂಬುದನ್ನು ಗುರುತಿಸಲು ನಮ್ಮ ಮಾಹಿತಿ ಕೋಶ ನೆರವಾಗುತ್ತದೆ."
348,ಚಂದ್ರಹಾಸ ನಾಟಕವನ್ನು ಮಾನವೀಯ ಭಾವನೆಗಳ ಕೋಶ ವೆಂದೇ ಮಳಲಿಯವರು ಕರೆದಿದ್ದಾರೆ.
349,ಈ ವಿಷಯವನ್ನು ಆಚಾರ್ಯ ಮಧ್ವರು ತಮ್ಮ ತಾತ್ಪರ್ಯ ನಿರ್ಣಯದಲ್ಲಿ ಕೋಶ ಸಹಿತ ವಿವರಿಸಿರುವುದನ್ನು ನಾವು ಕಾಣಬಹುದು.
350,ಅಂಗಾಂಗಗಳ ದಾನ ಪ್ರೋತ್ಸಾಹಕ್ಕೆ ವಿಶೇಷ ಕೋಶ ಅನುದಾನ
351,"ಮೈಸೂರು: ಔಷಧೀಯ ಸಸ್ಯಗಳ ಗಿಡಮೂಲಿಕೆ ಔಷಧ ಕೋಶ ಉಪಯೋಗಕ್ಕಾಗಿ ಹೆಗ್ಗಡೆದೇವನ ಕೋಟೆ ತಾಲೂಕಿನಲ್ಲಿ ಪ್ರಾಯೋಗಿಕ ಯೋಜನೆಯ ಪೈಲಟ್ ಯೋಜನೆ, 250 ಹಾಸಿಗೆಗಳ ಸಾಮರ್ಥ್ಯದ ಸೂಪರ್ ಸ್ಪೆಷಾಲಿಟಿ ಆಸ್ಪತ್ರೆ, ಮೈಸೂರು ಸುತ್ತಲಿನ ರಸ್ತೆಗಳ ಅಭಿವೃದ್ಧಿ, ಕಂದಾಯ ವಿಭಾಗದಲ್ಲಿ 250 ಹಾಸಿಗೆಗಳ ಸಾಮರ್ಥ್ಯದ ಸೂಪರ್ ಸ್ಪೆಷಾಲಿಟಿ ಆಸ್ಪತ್ರೆ, ಮುಸ್ಲಿಂ ಬಾಲಕ ಹಾಗೂ ಬಾಲಕಿಯರ ಅನಾಥಾಲಯ ಸಂಸ್ಥೆಯ ಶೈಕ್ಷಣಿಕ ಹಾಗೂ ಮೂಲಭೂತ ಸೌಕರ್ಯಕ್ಕೆ 2 ಕೋಟಿ ರು."
352,"ಜೀವಕೋಶಗಳು ತಂಬಾಕು ಹೊಗೆಯಿಂದ ಹಾನಿಗೊಳಗಾದಂತಹಾ ಹಾನಿಗೊಳಗಾದ ಜೀವಕೋಶಗಳನ್ನು ಮತ್ತೆ ತುಂಬಲು ಜೀವಕೋಶಗಳು ಹೆಚ್ಚಾಗಿ ವಿಭಜನೆಯಾಗಬೇಕಾದರೆ, ಕೋಶ ವಿಭಜನೆಯಲ್ಲಿನ ಈ ತಪ್ಪುಗಳಲ್ಲಿ ಒಂದಾದ ಒಂದು ರೂಪಾಂತರವು ನಡೆಯುತ್ತದೆ ಎಂದು ಹೆಚ್ಚಿನ ಅವಕಾಶವಿದೆ."
353,"ಈ ಸಂಭವಿಸುವುದಕ್ಕೆ ಹೆಚ್ಚಾಗಿ ಕಾರಣವೆಂದರೆ, ತಪ್ಪಾದ ಕೋಶ ಉಲ್ಲೇಖವು ಸೂತ್ರದಲ್ಲಿ ನಮೂದಿಸಲ್ಪಟ್ಟಿದೆ ಅಥವಾ, ಮೇಲಿನ ಚಿತ್ರದಲ್ಲಿನ 3 ನೇ ಸಾಲಿನಲ್ಲಿ ತೋರಿಸಿರುವಂತೆ, ಸೂತ್ರವನ್ನು ಫಿಲ್ ಹ್ಯಾಂಡಲ್ ಬಳಸಿ ಮತ್ತೊಂದು ಸ್ಥಳಕ್ಕೆ ನಕಲಿಸಲಾಗಿದೆ ಮತ್ತು ದೋಷದ ಬದಲಾಗುವ ಸೆಲ್ ಉಲ್ಲೇಖಗಳು ಫಲಿತಾಂಶಗಳು ."
354,ಈ ಹಿನ್ನಲೆಯಲ್ಲಿ ಆಯಾ ಸ್ಥಳಿಯ ಸಂಸ್ಥೆಗಳು ಬಿಡಾಡಿ ದನಕರುಗಳನ್ನು ಗೋ ಶಾಲೆಗೆ ಸೇರಿಸಬೇಕು ಮತ್ತು ಬೀದಿ ನಾಯಿಗಳ ನಿಯಂತ್ರಣಕ್ಕೆ ಜಿಲ್ಲಾ ನಗರಾಭಿವೃದ್ಧಿ ಕೋಶ ಟೆಂಡರ್ ಕರೆದು ಏಜನ್ಸಿಗಳ ಮೂಲಕ ಸಂತಾನಹರಣ ಮಾಡಬೇಕೆಂಬ ಸಲಹೆ ಸೂಚಿಸಿದರು.
355,"ಮೇಲಿನ ಚಿತ್ರದಲ್ಲಿ ತೋರಿಸಿರುವಂತೆ, ಈ ಉದಾಹರಣೆಯು ಜೀವಕೋಶದ C4 ನಲ್ಲಿ ಸೂತ್ರವನ್ನು ರಚಿಸುತ್ತದೆ ಅದು A5 ನಲ್ಲಿನ ಡೇಟಾದಿಂದ ಕೋಶ A4 ನಲ್ಲಿನ ಡೇಟಾವನ್ನು ಗುಣಿಸುತ್ತದೆ."
356,"ಸೆಲ್ ಗೋಡೆಯ ಹೊರಗಿನ ಪದರದಿಂದ, ಈ ಪದರಗಳನ್ನು ಮಧ್ಯದ ಲ್ಯಾಮೆಲ್ಲಾ, ಪ್ರಾಥಮಿಕ ಕೋಶ ಗೋಡೆ, ಮತ್ತು ದ್ವಿತೀಯಕ ಕೋಶ ಗೋಡೆ ಎಂದು ಗುರುತಿಸಲಾಗುತ್ತದೆ."
357,ಬೆಂಗಳೂರು: ನಗರವನ್ನು ಬೆಂಬಿಡದೆ ಕಾಡುತ್ತಿರುವ ಕಸದ ಸಮಸ್ಯೆಗೆ ಪರಿಹಾರ ಕಂಡುಕೊಳ್ಳಲು ಬೃಹತ್‌ ಬೆಂಗಳೂರು ಮಹಾನಗರ ಪಾಲಿಕೆ (ಬಿಬಿಎಂಪಿ) ಪ್ರತಿ ವಲಯದಲ್ಲೂ ಘನತ್ಯಾಜ್ಯ ನಿರ್ವಹಣಾ ಕೋಶ ಸ್ಥಾಪನೆಗೆ ಒಲವು ವ್ಯಕ್ತಪಡಿಸಿದೆ.
358,"ಸೀಡರ್ ಬ್ಯಾರೆಲ್, ಮೊದಲ ಕಾರ್ಯವಿಧಾನದ ನಂತರ ಕಂಡುಬರುವ ಪರಿಣಾಮವನ್ನು ಚಯಾಪಚಯ ಕ್ರಿಯೆಯ ಸಕ್ರಿಯಗೊಳಿಸುವಿಕೆಯನ್ನು ಉತ್ತೇಜಿಸುತ್ತದೆ, ರಕ್ತದ ಹರಿವನ್ನು ಹೆಚ್ಚಿಸುತ್ತದೆ, ಅಂತಃಸ್ರಾವಕ ವ್ಯವಸ್ಥೆಯನ್ನು ಬಲಪಡಿಸುತ್ತದೆ ಮತ್ತು ಕೋಶ ವಿಭಜನೆಯ ಪ್ರಕ್ರಿಯೆಯನ್ನು ಹೆಚ್ಚಿಸುತ್ತದೆ."
359,"ಸಭೆಯಲ್ಲಿ ಜಿಲ್ಲಾ ಪಂಚಾಯತ್ ಉಪ ಕಾರ್ಯದರ್ಶಿ ಬಸವರಾಜಪ್ಪ, ನಗರಾಭಿವೃದ್ದಿ ಕೋಶ ಯೋಜನಾ ನಿರ್ದೇಶಖ ರಾಜಶೇಖರ್, ಜಿಲ್ಲಾ ಸಮಾಜ ಕಲ್ಯಾಣಾಧಿಕಾರಿ ನಾಗರಾಜ್ ಹಾಗೂ ವಿವಿಧ ಇಲಾಖೆ ಅಧಿಕಾರಿಗಳು ಉಪಸ್ಥಿತರಿದ್ದರು."
360,"ಸಾಮಾನ್ಯವಾಗಿ ಇವುಗಳಲ್ಲಿ ಸೆಲ್ಯುಲೋಸ್ಯುಕ್ತ ಕೋಶ ಗೋಡೆಯು ಹೊರಪದರವಾಗಿದ್ದು, ಒಳಪದರವು ಕೋಶಪೊರೆ ಆಗಿರುತ್ತದೆ."
361,ಕೆಲವು ಪೂರ್ವಗಾಮಿ ಪ್ಲಾಸ್ಮಾ ಕೋಶ ರೋಗಗಳೊಂದಿಗಿನ ಅನೇಕ ಜನರು ಅಂತಿಮವಾಗಿ ಬಹು ಮೈಲೋಮಾವನ್ನು ಅಭಿವೃದ್ಧಿಪಡಿಸುತ್ತಾರೆ.
362,ರಲ್ಲಿ ಎಫ್ಡಿಎ ಸ್ತನ ಕಸಿ-ಸಂಬಂಧಿತ ಅನಾಪ್ಲಾಸ್ಟಿಕ್ ಬೃಹತ್ ಕೋಶ ಲಿಂಫೋಮಾ (ಎಎಲ್ಸಿಎಲ್) ಬಗ್ಗೆ ಕೆಳಗಿನ ಹೇಳಿಕೆಗಳನ್ನು ಮಂಡಿಸಿತ್ತು:
363,"ಈ ಅಧ್ಯಯನದ ಪ್ರಕಾರ, ಲುಪಿಯೋಲ್ ನೀಡಿದ ಡೋಸ್ನ ಮೇಲೆ ಅವಲಂಬಿತವಾಗಿರುವ ರೀತಿಯಲ್ಲಿ ಕೋಶ ನ್ಯೂಕ್ಲಿಯಗಳಲ್ಲಿನ ಬದಲಾವಣೆಗಳು ಮತ್ತು ಡಿಎನ್ಎ ವಿಭಜನೆ (ಅಪೊಪ್ಟೋಸಿಸ್ನ ವಿಶಿಷ್ಟ ಲಕ್ಷಣ) ಗಳನ್ನು ಉಂಟುಮಾಡುತ್ತದೆ ಎಂದು ಈ ಅಧ್ಯಯನವು ತೋರಿಸಿದೆ."
364,ಉದ್ಯೋಗಾರ್ಥಿಗಳಿಗೂ ಇದು ಉತ್ತಮ ಅವಕಾಶವಾಗಿದೆ ಎಂದು ಕಾಲೇಜು ಶಿಕ್ಷಣ ಇಲಾಖೆ ಉದ್ಯೋಗ ಮಾಹಿತಿ ಕೋಶ ಸಂಯೋಜನ ಅಧಿಕಾರಿ ಡಾ.
365,ದಕ್ಷಿಣ ಭಾರತೀಯ ಜಾನಪದ ಕೋಶ (ನಂ)(೧೮)
366,ಕೋಶ I1 ಗೆ ಕೆಳಗಿನವುಗಳನ್ನು ಟೈಪ್ ಮಾಡಿ:
367,"ದೆಶ ಸುತ್ತು ಕೋಶ ಓದು, ಮೈಮೇಲೆ ಹರಕು ಬಟ್ಟೆಯಿದ್ದರೂ ಕೈಯಲ್ಲೊಂದು ಪುಸ್ತಕವಿರಲಿ, ಪುಸ್ತಕವಿಲ್ಲದ ಮನೆ ಜೀವವಿಲ್ಲದ ದೇಹ ಎರಡೂ ಒಂದೇ, ಪುಸ್ತಕಗಳು ಆಯಾಕಾಲದ ಸಂಸ್ಕ್ರತಿಯ ಜೀವಂತ ಜೀವಾಳಗಳು, ಮನುಷ್ಯನನ್ನು ಅರ್ಥಮಾಡಿಕೊಳ್ಳಲು ಪ್ರಯತ್ನಿದಷ್ಟು ನಾವು ಬುದ್ಧಿಹೀನರಾಗುತ್ತೇವೆ; ಅದೇ ಪುಸ್ತಕವನ್ನು ಅರ್ಥಮಾಡಿಕೊಳ್ಳಲು ಪ್ರಯತ್ನಿದಷ್ಟು ನಾವು ಬುದ್ಧಿವಂತರಾಗುತ್ತೇವೆ ಮುಂತಾದ ನುಡಿಮುತ್ತುಗಳು ಪುಸ್ತಕಗಳು ಮಹತ್ವವನ್ನು ಬಿಂಬಿಸುತ್ತವೆ."
368,"ಗಾಳಿಗುಳ್ಳೆಯ ಕ್ಯಾನ್ಸರ್, ಸಣ್ಣ-ಅಲ್ಲದ ಜೀವಕೋಶದ ಶ್ವಾಸಕೋಶದ ಕ್ಯಾನ್ಸರ್, ಮತ್ತು ಮೆರ್ಕೆಲ್ ಕೋಶ ಚರ್ಮದ ಕ್ಯಾನ್ಸರ್ ಮುಂತಾದ ವಿವಿಧ ಕ್ಯಾನ್ಸರ್ಗಳಿಗೆ ಚಿಕಿತ್ಸೆ ನೀಡಲು ಈ ಔಷಧಿಗಳು ಸಹಾಯ ಮಾಡುತ್ತವೆ."
369,(1) ಅನ್ನಮಯಕೋಶ (2) ಪ್ರಾಣಮಯಕೋಶ (3) ಮನೋಮಯ ಕೋಶ (4) ವಿಜ್ಞಾನಕೋಶ ಮತ್ತು (5) ಆನಂದಮಯ ಕೋಶ.
370,ಡಲವನನುಪಮ ಕೋಶ ವರ್ಗದ
371,ಸ್ಕ್ಯಾನಿಂಗ್ ಎಲೆಕ್ಟ್ರಾನ್ ಮೈಕ್ರೊಸ್ಕೋಪ್ ಮತ್ತು ಟ್ರಾನ್ಸ್ಮಿಷನ್ ಎಲೆಕ್ಟ್ರಾನ್ ಮೈಕ್ರೊಸ್ಕೋಪ್ನಂತಹ ಇಂದಿನ ಮುಂಚಿತ ಸೂಕ್ಷ್ಮ ದರ್ಶಕಗಳ ಜೊತೆಗೆ ಜೀವಕೋಶ ಜೀವಶಾಸ್ತ್ರಜ್ಞರು ಅತ್ಯಂತ ಚಿಕ್ಕ ಕೋಶ ರಚನೆಗಳ ವಿವರವಾದ ಚಿತ್ರಗಳನ್ನು ಪಡೆಯಲು ಸಮರ್ಥರಾಗಿದ್ದಾರೆ.
372,"ಜಿಲ್ಲಾ ಆಡಳಿತ, ಜಿಲ್ಲಾ ಪಂಚಾಯತ, ಜಿಲ್ಲಾ ಆರೋಗ್ಯ ಮತ್ತು ಕುಟುಂಬ ಕಲ್ಯಾಣ ಇಲಾಖೆ ಹಾಗೂ ಜಿಲ್ಲಾ ತಂಬಾಕು ನಿಯಂತ್ರಣ ಕೋಶ ಬೆಳಗಾವಿ ಇವರುಗಳ ಸಂಯುಕ್ತಾಶ್ರಯದಲ್ಲಿ ಸರಕಾರಿ ಸದರ್ಾರ ಪದವಿ ಪೂರ್ವ ಕಾಲೇಜಿನ ಸಭಾಂಗಣದಲ್ಲಿ ಸೋಮವಾರ (ಅ."
373,"ಇದು ಹಲವಾರು ಕ್ಯಾನ್ಸರ್ (ಸ್ತನ, ಮೂತ್ರಪಿಂಡದ ಕೋಶ ಕಾರ್ಸಿನೋಮಾ, ನರವಿಜ್ಞಾನದ ಗೆಡ್ಡೆಗಳು, ಇತ್ಯಾದಿ) ಚಿಕಿತ್ಸೆಯಲ್ಲಿ ಮತ್ತು ಆರ್ಗನ್ ಕಸಿ (ಪಿತ್ತಜನಕಾಂಗ ಅಥವಾ ಮೂತ್ರಪಿಂಡ) ಸ್ವೀಕರಿಸಿದ ಜನರಲ್ಲಿ ಆರ್ಗನ್ ನಿರಾಕರಣೆ ತಡೆಗಟ್ಟಲು ಎಫ್ಡಿಎ (ಫುಡ್ ಅಂಡ್ ಡ್ರಗ್ ಅಡ್ಮಿನಿಸ್ಟ್ರೇಷನ್) ಆಗಿದೆ."
374,ಸತ್ತ ಚರ್ಮದ ಕೋಶ ತಡೆಯುವುದು
375,ಕೋಶ A2 ಯಲ್ಲಿರುವ ಡೇಟಾವು 50 ಕ್ಕಿಂತ ಕಡಿಮೆಯಿಲ್ಲ;
376,ಧ್ವಜಕೋಶ : ಕೋಶ ಚಲನೆಗೆ ನೆರವಾಗುವ ವಿಶೇಷ ಮೈಕ್ರೋಟ್ಯೂಬುಲ್ಗಳ ಗುಂಪುಗಳಿಂದ ರಚಿಸಲ್ಪಟ್ಟ ಕೋಶೀಯ ಮುಂಚಾಚುವಿಕೆ
377,ಕಿಟಲ್ ಕೋಶ ಮಂಗಳೂರು ಬಾಸೆಲ್ ಮಿಷನ್ ಬುಕ್ 1894 (ಲಂಡನ್).
378,"ಮೇಳ ಸುತ್ತಿ ನೋಡು, ಕೋಶ ಓದಿ ನೋಡು ಹೇಳಿದಂತೆ ಮೇಳದ ನಡುವೆ ಯಂತ್ರ ಮೇಳದ ಸಂಕ್ಷಿಪ್ತ ಮಾಹಿತಿ ಕುಂಚವನ್ನು ವಿಶೇಷ ಸಂಚಿಕೆಯೊಂದಿಗೆ ತೃತೀಯ ವರ್ಷದ ವಿವೇಕಾನಂದ ಕಾಲೇಜಿನ ಪ್ರತಿಕೋದ್ಯಮ ವಿಭಾಗದ ವಿದ್ಯಾರ್ಥಿಗಳ ವಿಕಸನ ವೈವಿಧ್ಯಮಯ ಬರಹದ ಸಂಚಿಕೆ ನನ್ನ ಕೈ ಸೇರಿದ್ದು ಸಂತಸ ತಂದಿತು."
379,"ಪಿ ಸಭಾಂಗಣದಲ್ಲಿ ಇಂದು ಪೌರಾಡಳಿತ ನಿರ್ದೇಶನಾಲಯ, ರಾಜ್ಯ ನಗರಾಭಿವೃದ್ದಿ ಸಂಸ್ಥೆ ಹಾಗೂ ನಗರಾಭಿವೃದ್ದಿ ಕೋಶ ಸಂಯುಕ್ತಾಶ್ರಯದಲ್ಲಿ ನಡೆದ ದೀನ್ ದಯಾಳ್ ಅಂತ್ಯೋದಯ ಯೋಜನೆ ರಾಷ್ಟ್ರೀಯ ನಗರ ಜೀವನೋಪಾಯ ಅಭಿಯಾನ(ಡೇ-ನಲ್ಮ್) ಕಾರ್ಯಕ್ರಮದಡಿ ಬೀದಿ ಬಿದಿ ವ್ಯಾಪಾರಿಗಳ ಸಂರಕ್ಷಣೆ, ಜೀವನೋಪಾಯ ಹಾಗೂ ನಿಯಂತ್ರಣ ಅಭಿಯಾನ ಕುರಿತು ಪಟ್ಟಣ ಮಾರಾಟ ಸಮಿತಿ ಸದಸ್ಯರಿಗೆ ಆಯೋಜಿಸಿದ್ದ ಜಿಲ್ಲಾ ಮಟ್ಟದ ಕಾರ್ಯಗಾರ ಉದ್ಘಾಟಿಸಿ ಅವರು ಮಾತನಾಡಿದರು."
380,"ನಿರ್ದಿಷ್ಟ ಚರ್ಮ ಕೋಶ ಜೀನ್ಗಳನ್ನು ಸಕ್ರಿಯಗೊಳಿಸುವ ಮೂಲಕ, ಫೈಬ್ರೊಬ್ಲಾಸ್ಟ್ಗಳನ್ನು ಕರೆಯುವ ಸಂಯೋಜಕ ಅಂಗಾಂಶದ ಕೋಶಗಳನ್ನು ನರಕೋಶಗಳಾಗಿ ಅಭಿವೃದ್ಧಿಪಡಿಸಲು ಮರುಪ್ರಸಾರ ಮಾಡಬಹುದಾಗಿದೆ."
381,ರಂದು ಪುರಸಭೆಯಲ್ಲಿ ನಡೆದ ಪ್ರಗತಿ ಪರಶೀಲನಾ ಸಭೆಯಲ್ಲಿ ಟ್ಯಾಂಕರ್ ಮಾಲಿಕರೆಲ್ಲರೂ ಸೇರಿ ಬಿಲ್ ಪಾವತಿಸಲು ಜಿಲ್ಲಾ ನಗರಾಭಿವೃದ್ಧಿ ಕೋಶ ಯೋಜನಾ ನಿರ್ದೇಶಕ ಎನ್.
382,ಜೈಂಟ್ ಕೋಶ ಆರ್ಟರಿಟೈಸ್ ಸಾಮಾನ್ಯವಾಗಿ ವಯಸ್ಕರಿಗೆ 50 ವರ್ಷಕ್ಕಿಂತ ಹೆಚ್ಚು ವಯಸ್ಕರ ಮೇಲೆ ಪರಿಣಾಮ ಬೀರುತ್ತದೆ.
383,ಎ ಕೋಶ ಇವರ ಆಶ್ರಯದಲ್ಲಿ ಕಳೆದೆರಡು ದಿನಗಳಿಂದ ಸ್ವರ್ಣ ಜಯಂತಿ ಗ್ರಾಮ ಸ್ವರೋಜ್‌ಗಾರ್ ಯೋಜನೆಯ ಫಲಾನುವಿಗಳಿಗೆ ನಡೆದ ಮಾಹಿತಿ ಅರಿವು ಮತ್ತು ತರಬೇತಿ ಶಿಬಿರದ ಮುಕ್ತಾಯ ಸಮಾರಂಭದಲ್ಲಿ ಅವರು ಮಾತನಾಡಿದರು.
384,ಶ್ವಾಸಕೋಶದ ಕ್ಯಾನ್ಸರ್ನ ಎರಡು ಪ್ರಮುಖ ವರ್ಗಗಳಿವೆ: ಸಣ್ಣದಲ್ಲದ ಜೀವಕೋಶದ ಶ್ವಾಸಕೋಶದ ಕ್ಯಾನ್ಸರ್ (ಎನ್ಎಸ್ಸಿಎಲ್ಸಿ) ಮತ್ತು ಸಣ್ಣ ಕೋಶ ಶ್ವಾಸಕೋಶದ ಕ್ಯಾನ್ಸರ್ (ಎಸ್ಸಿಎಲ್ಸಿ).
385,"ಇಂತಹ ಪುಸ್ತಕಾಲಯದಲ್ಲಿ ಕನ್ನಡದಲ್ಲಿ ಮುದ್ರಿತವಾದ ಎಲ್ಲ ಪುಸ್ತಕಗಳೂ, ವೃತ್ತಪತ್ರಗಳ, ನಿಯತಕಾಲಿಕ ಪತ್ರಿಕೆಗಳ ಪ್ರತಿವರ್ಷದ ಕಟ್ಟುಗಳೂ ಸಂಶೋಧಕರಿಗೂ ಅಭ್ಯಾಸಿಗಳಿಗೂ ದೊರೆಯಬೇಕಲ್ಲದೆ ಬೇರೆಬೇರೆ ಭಾಷೆಗಳ ನಿಘಂಟು, ಕೋಶ ಇನ್ನಿತರ (Reference) ಉಪಯುಕ್ತ ಗ್ರಂಥಗಳೂ ಶಿಲಾಶಾಸನ ಮೊದಲಾದವುಗಳ ಪ್ರತಿಕೃತಿಗಳೂ ಬೇಕಾದಾಗ ಕೈಗೆ ಸಿಕ್ಕುವಂತಿರಬೇಕು."
386,"ಉತ್ತರ 2 ಕೋಶ ಡಿ 1 ನಲ್ಲಿ ಇರಬೇಕು, 20 ರಿಂದ 10 ಭಾಗಿಸಿ 2 ಕ್ಕೆ ಸಮಾನವಾಗಿರುತ್ತದೆ;"
387,ಕರೋಯೋಸೈಟ್ (ಕ್ಯಾರಿಯೋ- ಸೈಟೆ ) - ಬೀಜಕಣವನ್ನು ಹೊಂದಿರುವ ಕೋಶ .
388,ಸೇರಿಸುವ ಚಿಹ್ನೆಯ ನಂತರ ಆ ಕೋಶ ಉಲ್ಲೇಖವನ್ನು ಸೂತ್ರಕ್ಕೆ ಸೇರಿಸಲು ಮೌಸ್ ಪಾಯಿಂಟರ್ನೊಂದಿಗೆ ಸೆಲ್ B3 ಅನ್ನು ಕ್ಲಿಕ್ ಮಾಡಿ;
389,"ಅವರು ಲೂಸಿ ಬರ್ನ್ಸ್ ಅವರನ್ನು ಸೋಲಿಸಿದರು, ಅವಳ ತಲೆಯ ಮೇಲೆ ಕೋಶ ಬಾರ್ಗಳಿಗೆ ಆಕೆಯ ಕೈಗಳನ್ನು ಬೆರೆಸಿದರು, ಮತ್ತು ರಾತ್ರಿಯಲ್ಲಿ ಅವಳನ್ನು ಅಲ್ಲಿ ಬಿಟ್ಟು ಹೋದರು."
390,ಉಲ್ಲೇಖದ ರೂಪವು ನಿರ್ದಿಷ್ಟ ಕಾಲಮ್ ಮತ್ತು ಸಾಲುಗಳ ಛೇದಕ ಬಿಂದುವಿನ ಕೋಶ ಉಲ್ಲೇಖವನ್ನು ಹಿಂದಿರುಗಿಸುತ್ತದೆ.
391,ಕರ್ನಾಟಕ ಜಾನಪದ ಪರಿಷತ್ತು ಜಿಲ್ಲಾ ಘಟಕ ಯಾದಗಿರಿ ವತಿಯಿಂದ ಹಮ್ಮಿಕೊಂಡಿದ್ದ ಸಮಾರಂಭದಲ್ಲಿ ಕೇಂದ್ರ ಸಮಿತಿ ಬೆಂಗಳೂರು ವತಿಯಿಂದ ಕಲಾವಿಧರಿಗಾಗಿ ಮಾಹಿತಿ ಕೋಶ ನಿಟ್ಟಿನಲ್ಲಿ ರಚಿಸಿರುವ ದಿನದರ್ಶಿಕೆ ಬಿಡುಗಡೆಗೊಳಿಸಿ ಮಾತನಾಡಿದ ಅವರು ಕರ್ನಾಟಕ ಜಾನಪದ ಪರಿಷತ್ತು ಹೆಚ್.
392,ನಂತರ ಚರ್ಮವನ್ನು ಕಳಚಿ ತನ್ನ ಸುತ್ತ ಕೋಶ ನಿರ್ಮಿಸಿಕೊಳ್ಳುತ್ತದೆ.
393,"ದೊಡ್ಡ ಮಟ್ಟದಲ್ಲಿ ತಯಾರಿಗೆ ಚಿಂತನೆ: ತ್ಯಾಜ್ಯದಿಂದ ಇಟ್ಟಿಗೆ ತಯಾರಿ ಮಾಡುವ ಪ್ರಯೋಗ ಯಶಸ್ವಿಯಾಗಿದ್ದು, ಈಗ ಅದನ್ನು ದೊಡ್ಡ ಮಟ್ಟದಲ್ಲಿ ಅನುಷ್ಠಾನಕ್ಕೆ ತರುವ ಪ್ರಯತ್ನಕ್ಕೆ ನಗರಾಭಿವೃದ್ಧಿ ಕೋಶ ಚಿಂತನೆ ನಡೆಸಿದೆ."
394,"ಕನ್ನಡದಲ್ಲಿ ವಿಜ್ಞಾನನಿಘಂಟು, ಶಿಷ್ಟೀಕೃತಪಾರಿಭಾಷಿಕ ಪದಕೋಶ, ಪದವಿವರಣ ಕೋಶ ಮುಂತಾದವುಗಳು ಅಗತ್ಯವಿದೆ."
395,"ಈ ಅಂಶಗಳ ಆಧಾರದ ಮೇಲೆ, ಆಹಾರಕ್ರಮದ ಬದಲಾವಣೆಗಳು ಅಥವಾ ಪೂರಕಗಳು, ವರ್ಗಾವಣೆಗಳು, ಔಷಧಿಗಳು, ರಕ್ತ ಮತ್ತು ಮಜ್ಜೆಯ ಕೋಶ ಕಸಿಗಳಂತಹ ವಿಧಾನಗಳು ಅಥವಾ ರಕ್ತದ ನಷ್ಟವನ್ನು ಗುಣಪಡಿಸಲು ಶಸ್ತ್ರಚಿಕಿತ್ಸೆಗೆ ಒಳಗಾಗಬಹುದು."
396,ಜನಸ್ಪಂದನ ಕೋಶ ಜಡ್ಡುಗಟ್ಟಿದೆ.
397,* ಕ್ರೀಡಾಪಟುಗಳ ಸ್ವವಿವರಗಳನ್ನು ಡಿಜಟಲೀಕರಣ ಮಾಡಲು ಕ್ರೀಡಾ ಐಟಿ ಕೋಶ ಸ್ಥಾಪನೆ.
398,"ಹಾವೇರಿ೨೪: ರಾಷ್ಟ್ರೀಯ ತಂಬಾಕು ನಿಯಂತ್ರಣ ಕಾರ್ಯಕ್ರಮದಡಿ ಜಿಲ್ಲಾ ತಂಬಾಕು ನಿಯಂತ್ರಣ ಕೋಶ ಹಾಗೂ ವಿವಿಧ ಅಧಿಕಾರಿಗಳನ್ನೊಳಗೊಂಡ ತಂಡ ಗುರುವಾರ ನಗರದ ಪಾನ್ಶಾಪ್, ಬೇಕರಿ ಮತ್ತು ಹೋಟೆಲ್ ಮೇಲೆ ದಾಳಿ ನಡೆಸಿ ರೂ."
399,"ಯೋಗದ ದೃಷ್ಟಿಯಲ್ಲಿ ದೇಹವು ಅನ್ನಮಯ ಕೋಶ, ಪ್ರಾಣಮಯ ಕೋಶ, ಮನೋಮಯ ಕೋಶ, ವಿಜ್ಞಾನಮಯ ಕೋಶ ಮತ್ತು ಆನಂದಮಯ ಕೋಶಗಳಿಂದ ಕೂಡಿದೆ."
400,"ದೇಶ ಸುತ್ತಿ ನೋಡು, ಕೋಶ ಓದಿ ನೋಡು ಎಂಬ ಗಾದೆ ಮಾತಿನಂತೆ ಮಕರ ರಾಶಿಯವರು ನಡೆದುಕೊಳ್ಳುತ್ತಾರೆ."
401,ರಾಷ್ಟ್ರೀಯ ಭಾರತೀಯ ನಾಗರಿಕರ ನೋಂದಣಿ ಮಾಹಿತಿ ಕೋಶ ನಿರ್ಮಿಸಲು ಕೇಂದ್ರ ಸಚಿವ ಸಂಪುಟ ಅಂಗೀಕಾರ ನೀಡುವ ಸಾಧ್ಯತೆಯಿದೆ.
402,"ಕಾಲೇಜಿನ ಆಂತರಿಕ ಗುಣಮಟ್ಟ ಭರವಸಾ ಕೋಶ ಮತ್ತು ಇಂಡಿಯಾ ಪೋಸ್ಟ್ ಪೇಮೆಂಟ್ಸ್ ಬ್ಯಾಂಕ್, ಮಂಗಳೂರು ಇವುಗಳ ಸಂಯುಕ್ತ ಆಶ್ರಯದಲ್ಲಿ ಜರುಗಿದ ಈ ಕಾರ್ಯಕ್ರಮದಲ್ಲಿ ವಿದ್ಯಾರ್ಥಿಗಳಿಗೆ ಭಾರತೀಯ ಅಂಚೆ ಇಲಾಖೆಯ ವಿವಿಧ ಸವಲತ್ತುಗಳ ಬಗ್ಗೆ ಮಾಹಿತಿ ನೀಡಲಾಯಿತು."
403,ದಕ್ಷಿಣ ಭಾರತೀಯ ಜಾನಪದ ಕೋಶ (ರಂ)(೬೦)
404,"ಬದಲಾಗಿ, ಸಯನೋಬ್ಯಾಕ್ಟೀರಿಯಾ ದ್ಯುತಿ ಸಂಶ್ಲೇಷಣೆಯಲ್ಲಿ ಬಳಸಲಾಗುವ ಎರಡು ಹೊರಗಿನ ಕೋಶ ಪೊರೆ ಮತ್ತು ಒಳಗಿನ ಥೈಲಾಕೋಯಿಡ್ ಪೊರೆಗಳನ್ನು ಹೊಂದಿರುತ್ತದೆ."
405,ಅನ್ನನಾಳದ ಸ್ಕ್ವಾಮಸ್ ಕೋಶ ಕಾರ್ಸಿನೋಮಾದ ಚಿಕಿತ್ಸೆಯನ್ನು ಗಾಯದಿಂದ ಮತ್ತು ಶಿಕ್ಷಣದ ಸ್ಥಾನದ ಆಧಾರದ ಮೇಲೆ ವೈದ್ಯರು ನಿರ್ಧರಿಸುತ್ತಾರೆ:
406,ದಕ್ಷಿಣ ಭಾರತೀಯ ಜಾನಪದ ಕೋಶ (ಗಾ)(೬೭)
407,ಕನ್ನಡದಲ್ಲಿ ವಿಜ್ಞಾನ ಕೋಶ ರಚನೆ ಮಾಡುವವರು ಈ ಕೃತಿಯನ್ನು ಧಾರಾಳವಾಗಿ ಬಳಸಿಕೊಳ್ಳಬಹುದು.
408,"ಇದು ಸಾಮಾನ್ಯವಾಗಿ ಮೆದುಳು ಮತ್ತು ಬೆನ್ನುಹುರಿಗಳನ್ನು ಒಳಗೊಳ್ಳುತ್ತದೆ ಮತ್ತು ತೀವ್ರ ಪ್ರಸರಣದ ಎನ್ಸೆಫಾಲೋಮೈಲೈಟಿಸ್ (ADEM) ಎಂದು ಕರೆಯಲಾಗುವ ಸ್ಥಿತಿಯನ್ನು ಉಂಟುಮಾಡಬಹುದು, ಇದರಲ್ಲಿ ಮೈಲಿನ್ ಕೋಶ ಎಂದು ಕರೆಯಲ್ಪಡುವ ನರ ಕೋಶಗಳ ಸುತ್ತ ರಕ್ಷಣಾತ್ಮಕ ಹೊದಿಕೆಯನ್ನು ಹಾನಿಗೊಳಿಸಲಾಗುತ್ತದೆ."
409,ಹಾಸನ ಆ18: ಜಿಲ್ಲೆಯಲ್ಲಿ ಅತವೃಷ್ಠಿ ಸಂಕಷ್ಟದ ದೂರು ಸಹಾಯ ಕೋರಿಬರುವ ಕರೆಗಳನ್ನು ಸ್ವೀಕರಿಸಲು ಜಿಲ್ಲಾಡಳಿತದಿಂದ ಈಗಾಗಲೇ ವಿಪತ್ತು ನಿರ್ವಹಣ ಕೋಶ ತೆರೆದಿದ್ದು ಅದು ದಿನದ 24 ಗಂಟೆಗಳು ಕಾರ್ಯನಿರ್ವಹಿಸುತ
410,"ಹಾನಿಗೊಳಗಾದ ದೊಡ್ಡ B- ಕೋಶ ಲಿಂಫೋಮಾವು ಹಾಡ್ಗ್ಕಿನ್ನಲ್ಲದ ಲಿಂಫೋಮಾ (NHL) ಅಲ್ಲದ ಸಾಮಾನ್ಯ ವಿಧವಾಗಿದೆ, ಇದು B ಲಿಂಫೋಸೈಟ್ಸ್ನ ಲಿಂಫೋಮಾ ಅಥವಾ B ಜೀವಕೋಶಗಳು ಆಗಿದೆ."
411,"ಭಾರತೀಯ ರಿಸರ್ವ್ ಬ್ಯಾಂಕ್ ಮಹಾರಾಷ್ಟ್ರದ ನಾ ಗ್ಪುರ ಮತ್ತು ಲಂಡನ್‌ನಲ್ಲಿ ವಿದೇಶಿ ಮೀಸಲು ಕೋಶ ಹೊಂದಿದ್ದು, ಅಲ್ಲಿ ಚಿನ್ನ ಹಾಗೂ ಡಾಲರ್‌ಗಳನ್ನು ಸಂಗ್ರಹಿಸಿಡುತ್ತದೆ."
412,ಕೋಶ ಪೇರಿಸುತ್ತ ಜಗದ
