Index,Sentence
170,"ಜೊತೆಗೆ ಅನಿವಾಸಿ ಭಾರತೀಯ ಕೋಶ ಬಂಡವಾಳ ಆಕರ್ಷಿಸಲು ಮಾತ್ರ ಸೀಮಿತವಾಗಿದ್ದು, ಅದನ್ನು ಅನಿವಾಸಿ ಭಾರತೀಯರ ಕ್ಷೇಮಾಭಿವೃದ್ಧಿಗೂ ಕ್ರಮಕೈಗೊಳ್ಳುವಂತೆ ಸೂಚನೆ ನೀಡಬೇಕು."
171,"ಕಾರ್ಯದ ವಾದದಂತೆ ಬಳಸಲಾದ ಉಲ್ಲೇಖ ಪಠ್ಯ ಕೋಶವನ್ನು ಒಳಗೊಂಡಿರುವ ಕೋಶಕ್ಕೆ ಸೂಚಿಸಿದರೆ , ಕೋಶ ಉಲ್ಲೇಖವು ಪಠ್ಯ ಲೇಬಲ್ಗೆ ಸೂಚಿಸಿದ ಉದಾಹರಣೆಯ ಐದು: ಕೋನ (ರೇಡಿಯನ್ಸ್) ."
172,ಕೋಶ : ಈ ಯೌವನವನ್ನು ಏಕೆ ವೃಥಾ ನಷ್ಟಮಾಡಿಕೊಳ್ಳುತ್ತೀರಾ; ನನ್ನ ಕೂಡ ಆನಂದದಿಂದ ವಿಲಾಸದಿಂದ ಬಾಳಿರಿ.
173,"ಇದಕ್ಕೂ ಮುಖ್ಯವಾಗಿ, ಅರ್ಜಿ ಸಲ್ಲಿಕೆ ಇತ್ಯಾದಿ ಪ್ರಕ್ರಿಯೆಗಳಿಗೆ ಕೈಪಿಡಿ ಕೋಶ ವೆಬ್‌ಸೈಟ್‌ನಲ್ಲಿ ಅಳವಡಿಸಿರುವುದು ಫಲ ನೀಡಿದೆ."
174,ವೈದ್ಯ ಪದಗಳ ಅರ್ಥ ವಿವರಣಾ ಕೋಶ
175,ಇದರಲ್ಲಿ ಫೊಲಿಕ್ ಆಸಿಡ್ ಅಧಿಕ ಪ್ರಮಾಣದಲ್ಲಿರುವುದರಿಂದ ಗರ್ಭಾವಧಿಯಲ್ಲಿ ಭ್ರೂಣದ ಕೋಶ ಮತ್ತು ಕೋಶಗಳ ಬೆಳವಣಿಗೆಗೆ ಸಹಕರಿಸುತ್ತದೆ.
176,"ತಲಾಧಾರವನ್ನು ಸರಾಗವಾಗಿಸುವುದಾದರೆ ನಿಮ್ಮ ಏಕೈಕ ಗುರಿಯೆಂದರೆ, ನೀವು ಕಡಿಮೆ ಖರ್ಚಿನ ಫ್ಲೋರಿಂಗ್ ಉತ್ಪನ್ನಕ್ಕಾಗಿ ಮುಚ್ಚಿದ ಕೋಶ ಪಾಲಿಥೀನ್ ಹೊದಿಕೆ ಖರೀದಿಸಬಹುದು."
177,"ಕಾರ್ಯಕ್ರಮದಲ್ಲಿ ಉಪ ನಿವಾಸಿ ಆಯುಕ್ತರಾದ ಮೋನಿಕಾ ಕಷ್ಕರಿ, ಸಹಾಯಕ ನಿವಾಸಿ ಆಯುಕ್ತರಾದ ಶೈಲೇಂದ್ರ ಸಿಂಗ್, ಸಮನ್ವಯಾಧಿಕಾರಿ, ಸಂಸದರ ಕೋಶ ಬಿ."
178,"ಉಸಿರಾಟದ ತೊಂದರೆ, ಮೂತ್ರ ಕೋಶ ಸೋಂಕಿನಿಂದ ಬಳುತ್ತಿರುವ ಅವರು ಸದ್ಯ ಐಸಿಯುನಲ್ಲಿ ಚಿಕಿತ್ಸೆ ಪಡೆಯುತ್ತಿದ್ದು, ಚಿಕಿತ್ಸೆಗೆ ಸ್ಪಂದಿಸುತ್ತಿದ್ದಾರೆ ಎಂದು ವೈದ್ಯರು ಹೇಳಿದ್ದಾರೆ."
179,"ಕೋಶ ಓದು, ದೇಶ ಸುತ್ತು ಹಳೇ ಕಾಲದ ಮುತ್ಸದ್ದಿಗಳು, ಹಿರಿಯರು ಹೇಳಿದ್ದು."
180,"ನೀವು ಎಲ್ಲಾ ಮಕ್ಕಳನ್ನು ಪರೀಕ್ಷಿಸುವ ಮೊದಲು ನೀವು ಜನಿಸಿದರೆ ಅಥವಾ ನಿಮಗೆ ತಿಳಿದಿಲ್ಲವಾದರೆ, ಕುಡಗೋಲು ಕೋಶ ಲಕ್ಷಣಕ್ಕಾಗಿ ನಿಮ್ಮ ವೈದ್ಯರು ನಿಮ್ಮನ್ನು ಪರೀಕ್ಷಿಸಬಹುದಾಗಿದೆ."
181,ಸುತ್ತಿನಲ್ಲಿ ಆವರಣದಲ್ಲಿರುವ ಸೆಲ್ ಉಲ್ಲೇಖವು ಕೋಶ A2 ನ ವಿಷಯಗಳನ್ನು ಓದಲು ಕಾರ್ಯವನ್ನು ಹೇಳುತ್ತದೆ - ಇದು ಮತ್ತೊಂದು ಕೋಶ ಉಲ್ಲೇಖವನ್ನು ಹೊಂದಿದೆ - B2;
182,ಇದು ಮೆದುಳಿನ ಕೋಶ ಪೊರೆಗಳನ್ನು ಕಾಪಾಡಲು ನೆರವಾಗುವುದು.
183,ಕ್ಯಾಲ್ಸಿಯಂ ಕೊರತೆಯ ಪರಿಣಾಮವಾಗಿ ವರ್ಣತಂತುವಿನ ರಚನೆ ಹಾಗೂ ಸ್ಥಿರತೆಯ ಕಾರಣದಿಂದ ಅಸಹಜ ಕೋಶ ವಿಭಜನೆಗೆ ಕಾರಣವಾಗುತ್ತದೆ.
184,ದಕ್ಷಿಣ ಭಾರತೀಯ ಜಾನಪದ ಕೋಶ (ಆ)(೬)
185,ಮೆಮಿಯೊಸಿಸ್ ಎಂಬ ಎರಡು-ಭಾಗದ ಕೋಶ ವಿಭಜನಾ ಪ್ರಕ್ರಿಯೆಯಿಂದ ಗ್ಯಾಮೆಟ್ಗಳನ್ನು ಉತ್ಪಾದಿಸಲಾಗುತ್ತದೆ.
186,ರಕ್ತದಲ್ಲಿನ ಸಕ್ಕರೆ ಮಟ್ಟವು ಹೆಚ್ಚಾದಾಗ ಅದು ದೇಹದಲ್ಲಿ ಉತ್ತಮ ಕೊಲೆಸ್ಟ್ರಾಲ್(ಎಚ್ ಡಿಎಲ್) ಮಟ್ಟವನ್ನು ಕಡಿಮೆ ಮಾಡುವುದು ಮತ್ತು ಅನಾರೋಗ್ಯಕರ ಕೊಬ್ಬಿನ ಕೋಶ ಮತ್ತು ಕೊಲೆಸ್ಟ್ರಾಲ್ ಮಟ್ಟ ಹೆಚ್ಚಿಸುವುದು.
187,"9:- ರಾಷ್ಟ್ರೀಯ ಸೇವಾ ಯೋಜನಾ ಕೋಶ ಕರ್ನಾಟಕ ಸರ್ಕಾರದ ಅಡಿಯಲ್ಲಿ ಗುರುನಾನಕ್ ಭವನ, ವಸಂತನಗರ, ಬೆಂಗಳೂರು ಇಲ್ಲಿ ನಡೆದಂತಹ ಪ್ರಶಸ್ತಿ ಪ್ರದಾನ ಸಮಾರಂಭದಲ್ಲಿ ಶ್ರೀ ನಟರಾಜ ಮಹಿಳಾ ಪದವಿ ಪೂರ್ವ ಕಾಲೇಜಿನ ರಾಷ್ಟ್ರೀಯ ಸೇವಾ ಯೋಜನಾ ಘಟಕಕ್ಕೆ ಅತ್ಯುತ್ತಮ ರಾಷ್ಟ್ರೀಯ ಸೇವಾ ಯೋಜನಾ ಘಟಕ ಎಂದು ಪ್ರಶಸ್ತಿ ಪ್ರದಾನಿಸಲಾಯಿತು."
188,"ದೇಶ ಸುತ್ತು, ಕೋಶ ಓದು ಎಂದು ದೊಡ್ಡವರೇ ಹೇಳಿಲ್ಲವೇ?"
189,ಈ ಕೋಶ ಮಾರ್ಗದಿಂದ ಮೇಲೇಳಲು ಅಯಸ್ಕಾಂತೀಯ ತೇಲುವಿಕೆಯನ್ನು (ಮ್ಯಾಗ್ನೆಟಿಕ್‌ ಲೆವಿಟೇಶನ್‌) ಬಳಸಲಾಗುವುದು.
190,ಕೋಶ ಸಂಸ್ಕೃತಿಗಳ ಅಧ್ಯಯನವು ಕ್ವೆರ್ಸೆಟಿನ್ ಕೆಲವು ವಿಧದ ಕ್ಯಾನ್ಸರ್ ಜೀವಕೋಶಗಳ ಬೆಳವಣಿಗೆಯನ್ನು ನಿಧಾನಗೊಳಿಸಲು ಸಹಾಯ ಮಾಡುತ್ತದೆ ಎಂದು ತೋರಿಸಿದೆ.
191,ಮೋಹನಗೌಡ ಪಾಟೀಲ ಮಾತನಾಡಿಮುಂಬರುವ ದಿನಗಳಲ್ಲಿ ರಾಮದುರ್ಗ ತಾಲೂಕಿನ ಸಾಹಿತಿ ಮಾಹಿತಿ ಕೋಶ ಹೊರಬರುವಂತಾಗಲಿ.
192,"ಪ್ರಸ್ತುತ ಮಂಡ್ಯ, ಮೈಸೂರು ಹಾಗೂ ಹಾಸನ ಜಿಲ್ಲೆಗೆಳ ಗ್ರಾಮ ಚರಿತ್ರೆ ಕೋಶ ಮುದ್ರಣ ಹಂತದಲ್ಲಿದ್ದು ಇನ್ನುಳಿದ 14 ಜಿಲ್ಲೆಗಳ ಗ್ರಾಮ ಚರಿತ್ರೆ ಕೋಶ ಸಿದ್ಧಗೊಳ್ಳಬೇಕಾಗಿದೆ."
193,ಭದ್ರತಾ ಕೋಶ ಉದ್ಘಾಟನೆ: ಭದ್ರತಾ ಕೋಶ ಉದ್ಘಾಟಿಸಿದ ಕಲ್ಲುಗುಡ್ಡೆ ಜೆ.
194,ಡಿಜಿಟಲ್‌ ಇಮೇಜ್‌ ಮೂಲಕ ಕ್ಯಾನ್ಸರ್‌ ಕೋಶ ಹೌದೋ ಅಲ್ಲವೋ ಎಂಬುದನ್ನು ಎಲ್ಲಿಯೋ ಕುಳಿತ ಡಾಕ್ಟರ್ ಓರ್ವರು ರಿಪೋರ್ಟ್ ಪರಿಶೀಲಿಸಿ ಖಚಿತ ಅಭಿಪ್ರಾಯ ನೀಡಬಹುದಾಗಿದೆ.
195,"ಕೆಂಟ್‌ನ ಔಷಧಿ ಕೋಶ ನಿಘಂಟುವಿನಲ್ಲಿ ಅಸಂಖ್ಯ ಔಷಧಿಗಳನ್ನು ಸೂಚಿಸಲಾಗಿದೆ; ಮೂತ್ರದಲ್ಲಿಯ ಸಕ್ಕರೆಗೆ 63, ಬಹುಮೂತ್ರಕ್ಕೆ 230, ವಿಪರೀತ ಹಸಿವಿದೆ 140, ಬಾಯಾರಿಕೆಗೆ 230 ಔಷಧಿಗಳನ್ನು ಸೂಚಿಸಲಾಗಿದೆ."
196,"ಬಹುಶಃ ಅದು, ಬಾಲ್ಯ ತನ್ನ ಮುಗ್ಧತೆಯ ಕೋಶ ಒಡೆದುಕೊಂಡು, ಕಟುವಾಸ್ತವಗಳಿಗೆ ಮುಖಾಮುಖಿಯಾಗಿ ನಿಲ್ಲುವ ಕಠೋರ ಕ್ಷಣ!"
197,ಸುತ್ತೋಲೆಯಿಂದ ಹೊರಬಿದ್ದ 55 ಅಭ್ಯರ್ಥಿಗಳು: ಹೈದರಾಬಾದ್‌– ಕರ್ನಾಟಕ ಮೀಸಲಾತಿಗೆ ಸಂಬಂಧಿಸಿದಂತೆ 2016ರ ನವೆಂಬರ್‌ 16ರಂದು ಹೈದರಾಬಾದ್‌ ಕರ್ನಾಟಕ ವಿಶೇಷ ಕೋಶ ಹೊರಡಿಸಿದ ಸುತ್ತೋಲೆಯಿಂದಾಗಿ ಕೆಇಎ ಪರಿಷ್ಕೃತ ತಾತ್ಕಾಲಿಕ ಆಯ್ಕೆ ಪಟ್ಟಿ ಪ್ರಕಟಿಸಿತ್ತು.
198,ಕ್ಯಾರೆಟ್ಗಳನ್ನು ತಿನ್ನುವುದು ವಿಟಮಿನ್ ಎ ಪಡೆಯಲು ನಿಮ್ಮ ದೇಹವು ಸಾಮಾನ್ಯ ದೃಷ್ಟಿ ಮತ್ತು ಕೋಶ ವಿಭಜನೆಗೆ ಅಗತ್ಯವಾಗಿರುತ್ತದೆ.
199,"ಇಂಧನ ಕೋಶ ಸಂವೇದಕಗಳನ್ನು ಸೇರ್ಪಡೆಗೊಳಿಸುವುದರ ಮೂಲಕ ನಿಖರತೆ ಹೆಚ್ಚಾಗುತ್ತದೆ, ಇದು ಯು."
200,"ಸಲಹೆ: ನೀವು ಪ್ರಶ್ನಾರ್ಹ ವೆಬ್ಸೈಟ್ ಅನ್ನು ನಿರ್ವಹಿಸಿದರೆ ಮತ್ತು ಈ ಸಂದರ್ಭಗಳಲ್ಲಿ 403 ದೋಷಗಳನ್ನು ನೀವು ತಡೆಯಲು ಬಯಸಿದರೆ, ನಿಮ್ಮ ವೆಬ್ ಸರ್ವರ್ ಸಾಫ್ಟ್ವೇರ್ನಲ್ಲಿ ಕೋಶ ಬ್ರೌಸಿಂಗ್ ಅನ್ನು ಸಕ್ರಿಯಗೊಳಿಸಿ."
201,"ವಿಭಿನ್ನ ಘಟಕಗಳನ್ನು ಬಳಸಿಕೊಂಡು ಮೌಲ್ಯಗಳನ್ನು ಪರಿವರ್ತಿಸಲು, ಜೀವಕೋಶಗಳು D3 ಮತ್ತು D4 ಮತ್ತು ಕೋಶ E3 ನಲ್ಲಿ ಪರಿವರ್ತಿಸಬೇಕಾದ ಮೌಲ್ಯದಲ್ಲಿನ ಘಟಕಗಳ ಕಿರುಸಂಕೇತವನ್ನು ನಮೂದಿಸಿ."
202,"ಕನ್ನಡ ನಿಘಂಟು, ಗ್ರಾಮ ಚರಿತ್ರಾ ಕೋಶ, ದೇಸಿ ಕೃಷಿ ವಿಜ್ಞಾನ ಕೋಶ ಸೇರಿದಂತೆ ಅನೇಕ ಮಹತ್ವದ ಯೋಜನೆ­ಗಳನ್ನು ವಿಶ್ವವಿದ್ಯಾಲಯ ಕೈಗೆತ್ತಿ­ಕೊಂ­ಡಿದೆ."
203,ನೀವು ರೋಮೆಕ್ಸ್ ಕೋಶ ಕತ್ತರಿಸುವುದು ಉಪಕರಣ ಅಥವಾ ರೇಜರ್ ಚಾಕುವನ್ನು ಬಳಸಿದಾಗ ತಂತಿಯ ಒರೆಸುವಿಕೆಯನ್ನು ತುಂಡು ಮಾಡುವುದು ತುಂಬಾ ಸುಲಭ.
204,ಕೋಶ ಉಲ್ಲೇಖಗಳಲ್ಲಿ ಸೂಚಿಸುತ್ತದೆ
205,"ಅದರಲ್ಲಿ ನಾರಾಯಣರು ಮೊದಲ ಭಾರಿಗೆ ಅಧುನಿಕ ಕೋಶ ರಚನೆಗೆ ಕೆಲವು ಪರಿಭಾಷೆಗಳನ್ನು, ಪರಿಕಲ್ಪನೆಗಳನ್ನು ಒದಗಿಸಿಕೊಟ್ಟಿದ್ದಾರೆ."
206,"ಸಸ್ಯ ಕೋಶಗಳಲ್ಲಿ, ಕೋಶ ತಟ್ಟೆಯನ್ನು ನಿರ್ಮಿಸಲಾಗುತ್ತದೆ, ಇದು ಜೀವಕೋಶವನ್ನು ಎರಡು ಭಾಗಗಳಾಗಿ ವಿಭಜಿಸುತ್ತದೆ."
207,ಅವರು ನಗರದ ರಂಗನಾಥ ಅಡಿಟೋರಿಯಂನಲ್ಲಿ ಸೋವiವಾರಂದು ಸ್ಥಳೀಯ ಸರ್ಕಾರಿ ಪ್ರಥಮ ದರ್ಜೆ ಕಾಲೇಜು ಹಾಗೂ ಬಂಗೂರನಗರ ಪದವಿ ಮಹಾ ವಿದ್ಯಾಲಯಗಳ ಸಂಯಕ್ತಾಶ್ರಯದಲ್ಲಿ ಹಮ್ಮಿಕೊಳ್ಳಲಾದ ಆಂತರಿಕ ಗುಣಮಟ್ಟ ಭರವಸಾ ಕೋಶ ಉದ್ಘಾಟನಾ ಸಮಾರಂಭದಲ್ಲಿ ಮುಖ್ಯ ಅತಿಥಿಗಳಾಗಿ ಭಾಗವಹಿಸಿ ಕೋಶ ಉದ್ಘಾಟಿಸಿ ಮಾತನಾಡಿದರು.
208,ಮೈಟಾಸಿಸ್ ಕೋಶ ವಿಭಜನೆಯಿಂದ ಉಂಟಾಗುವ ಮರಿಕೋಶಗಳು ನೂರಕ್ಕೆ ನೂರು ತಾಯಿ ಕೋಶವನ್ನು ಹೋಲುತ್ತವೆ.
209,ಈ ವಿಷಯದಲ್ಲಿರುವ ಎಲ್ಲ ಗೊಂದಲಗಳ ನಿವಾರಣೆಗಾಗಿ ಅನುಷ್ಠಾನ ಕೋಶ ಆರಂಭಿಸುವ ಅಗತ್ಯವಿದೆ ಎಂದು ಪದಾಧಿಕಾರಿಗಳು ಪ್ರತಿಪಾದಿಸಿದ್ದಾರೆ.
210,ಮೂತ್ರಪಿಂಡದ ಕೋಶ ಕಾರ್ಸಿನೋಮಕ್ಕೆ ಧೂಮಪಾನವು ಪ್ರಬಲ ಅಪಾಯಕಾರಿ ಅಂಶವಾಗಿದೆ.
211,"ಬೆಂಗಳೂರು: ಕ್ರೈಸ್ತ ಧರ್ಮಕ್ಕೆ ಮತಾಂತರ ಹೊಂದಿದ ದಲಿತರ ಬಗ್ಗೆ ಅಧ್ಯಯನ, ಕನ್ನಡದಲ್ಲಿನ ಎಲ್ಲ ಸಾಹಿತಿಗಳನ್ನು ಪರಿಚಯಿಸುವ ಸಮಗ್ರ ಕೋಶ ಹೊರತರುವುದು ಸೇರಿ ಕರ್ನಾಟಕ ಸಾಹಿತ್ಯ ಅಕಾಡೆಮಿಯಿಂದ ಐದು ಪ್ರಮುಖ ಯೋಜನೆಗಳನ್ನು ಹಮ್ಮಿಕೊಳ್ಳಲಾಗಿದೆ ಎಂದು ಅಧ್ಯಕ್ಷ ಅರವಿಂದ ಮಾಲಗತ್ತಿ ಹೇಳಿದರು."
212,ಆದರೆ ಮಹಿಳೆಯರಲ್ಲಿ ಈ ಕೋಶ ಹೊಟ್ಟೆಯ ಕೆಳಭಾಗದಲ್ಲಿರುವ ಕಾರಣ ನಾನೂರು ಮಿಲಿ ಮೀ ನಷ್ಟು ತುಂಬಿಕೊಳ್ಳುತ್ತಿದ್ದಂತೆಯೇ ಸೂಚನೆ ಹೋಗುತ್ತದೆ.
213,"ಬಲ್ಲವರ ಮಾತಿನಂತೆ ದೇಶ ಸುತ್ತಬೇಕು, ಕೋಶ ಓದಬೇಕು."
214,ಕಳೆದ ಕೆಲ ತಿಂಗಳುಗಳಲ್ಲಿ ಆಗಿರುವ ಪ್ರಮುಖ ಬದಲಾವಣೆ ಎಂದರೆ ಬಿಜೆಪಿ ಐಟಿ ಕೋಶ ನಿಷ್ಕ್ರಿಯವಾಗಿದೆ.
215,"ನಗರದ ಸರ್ಕಾರಿ ಪ್ರಥಮ ದರ್ಜೆ ಕಾಲೇಜು ಸಭಾಂಗಣದಲ್ಲಿ ಮಂಗಳವಾರ ಸರ್ಕಾರಿ ಪ್ರಥಮ ದರ್ಜೆ ಕಾಲೇಜು ಹಾಗೂ ಸ್ನಾತಕೋತ್ತರ ಕೇಂದ್ರ, ಯುವ ರೆಡ್‍ಕ್ರಾಸ್ ಘಟಕ ಮತ್ತು ವಿದ್ಯಾರ್ಥಿ ಆಪ್ತ ಸಲಹಾ ಕೋಶ ಇವುಗಳ ಸಂಯುಕ್ತಾಶ್ರಯದಲ್ಲಿ ಏರ್ಪಡಿಸಿದ್ದ ವ್ಯಕ್ತಿತ್ವ ವಿಕಸನ ಕಾರ್ಯಕ್ರಮದಲ್ಲಿ ಭಾಗವಹಿಸಿ ಅವರು ಮಾತನಾಡಿದರು."
216,ಎಲ್ಲಾ ಕೋಶ ಚಲನೆಯು ಒಂದು ಸ್ಥಳದಿಂದ ಇನ್ನೊಂದಕ್ಕೆ ಕೋಶವನ್ನು ಸ್ಥಳಾಂತರಿಸುವುದನ್ನು ಒಳಗೊಂಡಿರುವುದಿಲ್ಲ.
217,"ಇದರ ಜೊತೆಗೆ, ತಾಪಮಾನವು ಕೋಶ ವಿಭಜನೆಯ ಪ್ರಕ್ರಿಯೆಯನ್ನು ಅಡ್ಡಿಪಡಿಸುತ್ತದೆ, ಇದು ನಿಯೋಪ್ಲಾಸ್ಮ್ನ ಶೀಘ್ರ ಬೆಳವಣಿಗೆಗೆ ಕಾರಣವಾಗುತ್ತದೆ."
218,ಹಾವೇರಿ: ರಾಷ್ಟ್ರೀಯ ತಂಬಾಕು ನಿಯಂತ್ರಣ ಕಾರ್ಯಕ್ರಮದಡಿ ಜಿಲ್ಲಾ ತಂಬಾಕು ನಿಯಂತ್ರಣ ಕೋಶ ಹಾಗೂ ವಿವಿಧ ಅಧಿಕಾರಿಗಳನ್ನೊಳಗೊಂಡ ತಂಡ ರಾಣೇಬೆನ್ನೂರು ನಗರದ ಆಯ್ದ 18 ಅಂಗಡಿಗಳ ಮೇಲೆ ದಾಳಿ ನಡೆಸಿ ರೂ.
219,ರಾಜ್ಯ ಸರ್ಕಾರದ ಸಾಧನೆಯನ್ನು ಬಿಂಬಿಸುವ ಮಾಹಿತಿ ಕೋಶ ತಾಣವಾದ ಪ್ರತಿಬಿಂಬ ಕತ್ತಲೆ ಬಿಂಬವಾಗಿದೆ.
220,"ಹಿಸ್ಟಾಲೋಜಿಕ್ ಉಪಟೈಪ್, ಪಿ 16 (ಇನ್ಎನ್ 4 ಎ) ಅಭಿವ್ಯಕ್ತಿ, ಮತ್ತು ಪೆನೆಲ್ ಸ್ಕ್ವಾಮಸ್ ಕೋಶ ಕಾರ್ಸಿನೋಮದಲ್ಲಿ ಮಾನವ ಪ್ಯಾಪಿಲೋಮವೈರಸ್ ಡಿಎನ್ಎ ಇರುವಿಕೆ."
221,ಡೌನ್ ಸಿಂಡ್ರೋಮ್ ಅಸಹಜ ಕೋಶ ವಿಭಜನೆಯಿಂದಾಗಿ ಉಂಟಾಗುವ ಕ್ರೋಮೋಸೋಮ್ 21 ರ ದೋಷದಿಂದ ಉಂಟಾಗುವ ಒಂದು ಆನುವಂಶಿಕ ಅಸ್ವಸ್ಥತೆಯಾಗಿದೆ.
222,ಮರ್ಕೆಲ್ ಕೋಶ ಕಾರ್ಸಿನೋಮ
223,ದೇಹದಲ್ಲಿ ಹಲವಾರು ಚಟುವಟಿಕೆಗಳು ಸಂಭವಿಸುವುದಕ್ಕೆ ಕೋಶ ಚಲನೆ ಅಗತ್ಯವಾಗಿರುತ್ತದೆ.
224,ಉತ್ತರ: ಎಂಡೋಸೈಟೋಸಿಸ್ - ಕೋಶ ಪೊರೆಯ ಮೂಲಕ ಸರಿಹೊಂದದ ದೊಡ್ಡ ಅಣುಗಳಲ್ಲಿ ಜೀವಕೋಶಗಳು ತೆಗೆದುಕೊಳ್ಳುವ ಪ್ರಕ್ರಿಯೆ.
225,"ಕೆಲವು ನಿದರ್ಶನಗಳಲ್ಲಿ, ಕೋಶ ಉಲ್ಲೇಖದ ಮೌಲ್ಯವನ್ನು ಲೆಕ್ಕ ಹಾಕಲು ಪ್ರಯತ್ನಿಸುವ ಮೊದಲು ಸೂತ್ರಗಳು ಯಶಸ್ವಿಯಾಗಿ ಚಲಾಯಿಸಬಹುದು."
226,D ಕೋಶವನ್ನು ಸೂಚಿಸುತ್ತದೆ ಮತ್ತು ಖಾತೆಗಳು ಕೋಶ ಎಂದು ನಮಗೆ ತಿಳಿಸುತ್ತದೆ.
227,ಬೆಳವಣಿಗೆ - ನೀರಿನ ಹೀರುವಿಕೆ ಮತ್ತು ಕೋಶ ಗೋಡೆಯ ಮೇಲೆ ಉಸಿರಾಟದ ಒತ್ತಡವನ್ನು ಬೀರುವ ಮೂಲಕ ಜೀವಕೋಶದ ಉದ್ದನೆಯ ಕೇಂದ್ರ ವಿಕ್ವೋಲ್ ಸಹಾಯಕಗಳು.
228,"ಸೆಲ್ಯುಲೋಸ್ ಮತ್ತು ಸಿಲಿಕಾದಿಂದ ಮಾಡಿದ ಕೋಶ ಗೋಡೆಗಳಿಂದ ಅವು ಏಕಕೋಶೀಯ ಜೀವಿಗಳಾಗಿವೆ, ಮತ್ತು ಅವುಗಳು ಚಲನೆಗೆ ಒಂದು ಅಥವಾ ಎರಡು ಫ್ಲಾಜೆಲ್ಲಾಗಳನ್ನು ಹೊಂದಿರುತ್ತವೆ."
229,ಕೋಶ E10 - ಸೂತ್ರದ ಫಲಿತಾಂಶಗಳನ್ನು ಪ್ರದರ್ಶಿಸುವ ಸ್ಥಳವನ್ನು ಕ್ಲಿಕ್ ಮಾಡಿ.
230,"ಇದಕ್ಕೆ ವಿರುದ್ಧ ಎಂಬಂತೆ, ದೇಶ ಸುತ್ತಲಿಲ್ಲ, ಕೋಶ ಓದಲಿಲ್ಲ."
231,ಕೆಲವು ಸಾಮಾನ್ಯ ಸ್ಕ್ವಾಮಸ್ ಕೋಶ ಕಾರ್ಸಿನೋಮ ಅಪಾಯಕಾರಿ ಅಂಶಗಳು:
232,ಈ ಕಾರ್ಯವನ್ನು ಸಂಬಂಧಿತ ಕೋಶ ಉಲ್ಲೇಖವಾಗಿ ನಮೂದಿಸಲಾಗಿದೆ.
233,"ವೆಚ್ಚದಲ್ಲಿ ಸಿದ್ಧಪಡಿಸಲಾದ ಬೃಹತ್‌ ಕೋಶ 9 ಸಂಪುಟಗಳಲ್ಲಿ 3,500 ಪುಟಗಳಲ್ಲಿ ಮೂಡಿಬಂದಿದೆ."
234,"ದೇಶ ಸುತ್ತು, ಕೋಶ ಓದು ಎಂಬ ಗಾದೆಮಾತಿನ ಮೊದಲಾರ್ಧವನ್ನು ತೀರಾ ಹಚ್ಚಿಕೊಂಡಿರುವ ಬೆಂಗಳೂರಿನ ಐ."
235,"ರಿಂದ, ಈ ಸ್ಥಿತಿಯ ಬಗ್ಗೆ ನಮ್ಮ ತಿಳುವಳಿಕೆಯನ್ನು ನಾವು ಬಲಪಡಿಸಿದ್ದೇವೆ ಮತ್ತು ಸ್ತನ ಕಸಿ-ಸಂಬಂಧಿತ ಅನಾಪ್ಲಾಸ್ಟಿಕ್ ದೊಡ್ಡ ಕೋಶ ಲಿಂಫೋಮಾ (ಬಿಐಎ- ಎಎಲ್ಸಿಎಫ್) ವಿಶ್ವ ಆರೋಗ್ಯ ಸಂಸ್ಥೆಗೆ ಸ್ತನ ಸ್ತಂಭವನ್ನು ಬೆಳೆಸಿಕೊಳ್ಳುವ ಅಪರೂಪದ ಟಿ-ಕೋಶ ಲಿಂಫೋಮಾ ಎಂದು ಒಪ್ಪಿಕೊಳ್ಳುತ್ತೇವೆ."
236,"ವಯಸ್ಸಾದ ರೋಗಿಗಳಲ್ಲಿ ವಯಸ್ಸಾದ ರೋಗಿಗಳಲ್ಲಿ ವಯಸ್ಸಾದ ರೋಗಿಗಳಲ್ಲಿ 80 ವರ್ಷಗಳಿಗಿಂತಲೂ ಹೆಚ್ಚು ವಯಸ್ಸಾದ ದೊಡ್ಡ B- ಕೋಶ ಲಿಂಫೋಮಾವನ್ನು ಹೊಂದಿರುವ ಎಟಿನ್ಯೂಯೆಟೆಡ್ ಇಮ್ಯುನೊಕೆಮೊಥೆರಪಿ ಕಟ್ಟುಪಾಡು (ಆರ್-ಮಿನಿ CHOP): ಒಂದು ಮಲ್ಟಿಸೆಂಟ್ರೆ, ಏಕೈಕ-ತೋಳು, ಹಂತ 2 ಪ್ರಯೋಗ."
237,ಉಡುಪಿ: ರಾಜ್ಯ ಆರೋಗ್ಯ ಮತ್ತು ಕುಟುಂಬ ಕಲ್ಯಾಣ ಇಲಾಖೆಯ ಜಾಗೃತ ಕೋಶ (ವಿಜಿಲೆನ್ಸ್ ಸ್ಕ್ವಾಡ್)ದ ಮುಖ್ಯ ಜಾಗೃತಾಧಿಕಾರಿ ಡಾ.
238,"16ಕ್ಕೆ ರೆಡ್ ಕ್ರಾಸ್, ಉದ್ಯೋಗ ಮಾಹಿತಿ ಕೋಶ ಉದ್ಘಾಟನೆ"
239,"ಮುಚ್ಚಿದ ಕೋಶ ಪಾಲಿಸ್ಟೈರೀನ್ (ಹೊರಸೂಸಲ್ಪಟ್ಟ ಪಾಲಿಸ್ಟೈರೀನ್ ಫೋಮ್ ಎಂದು ಕರೆಯಲ್ಪಡುತ್ತದೆ), ಮತ್ತೊಂದೆಡೆ, ಉತ್ಪಾದಿಸಲು ಹೆಚ್ಚು ದುಬಾರಿ ಆದರೆ ಕಡಿಮೆ ನೀರನ್ನು ಹೀರಿಕೊಳ್ಳುತ್ತದೆ ಮತ್ತು ಬಿಳಿ ಮತ್ತು ಪೂರ್ಣ ಜೀವನ ವನ್ನು ಹೆಚ್ಚು ಕಾಲ ಉಳಿಯುತ್ತದೆ."
240,ಪಂಚ ಕೋಶ ವಿವೇಕ
241,"ಕಡಿಮೆ ಅಥವಾ ಅಧಿಕ ಕೆಂಪು ರಕ್ತ ಕೋಶ ಎಣಿಕೆ ಸ್ವತಃ ಮತ್ತು ಅದರ ಸ್ಥಿತಿಯಲ್ಲ, ಆದರೆ ಮತ್ತೊಂದು ಸಮಸ್ಯೆ ಎಣಿಕೆ ಪ್ರಮಾಣಕ್ಕಿಂತಲೂ ಕಡಿಮೆಯಿರುತ್ತದೆ ಎಂಬ ಸಂಕೇತವಾಗಿದೆ."
242,"ಕೆಲವೊಮ್ಮೆ ಮಣಿಕಟ್ಟು ಮುರಿತದಂತಹ ಗಾಯಗೊಂಡ ನಂತರ, ಈ ಸ್ನಾಯುರಜ್ಜು ಕೋಶ ಅಸ್ಥಿರವಾಗಬಹುದು."
243,ಇಂತಹ ಅಭ್ಯಾಸ ವರ್ಗಕ್ಕಾಗಿ ಪ್ರಶ್ನಾವಳಿ ಕೋಶ ಸಿದ್ಧಪಡಿಸಲಾಗುತ್ತಿದೆ ಎಂದು ತಿಳಿಸಿದ್ದಾರೆ.
244,ಅದು ಕನ್ನಡದಿಂದಲೇ ಬಂತೆಂದು ತೆಲುಗು ಕೋಶ ಹೇಳುತ್ತದೆ.
245,"ಚುನಾವಣಾ ಅಕ್ರಮಗಳನ್ನು ತಡೆಯುವ ನಿಟ್ಟಿನಲ್ಲಿ ಜಿಲ್ಲಾಡಳಿತ ಕೈಗೊಂಡ ವಿವಿಧ ಕಾರ್ಯಕ್ರಮಗಳಾದ ಮಾಧ್ಯಮ ಮೇಲ್ವಿಚಾರಣೆ, ಸಾಮಾಜಿಕ ಜಾಲತಾಣಗಳ ಮೇಲೆ ನಿಗಾ ವಹಿಸುವ ಘಟಕ, ಸಿ ವಿಜಿಲ್, ಕಂಟೋಲ್ ರೂಮ್ ದೂರು ಕೋಶ ಹಾಗೂ ಸಿಸಿಟಿವಿ ವೀಕ್ಷಣೆಯಲ್ಲಿ ಒಂದೇ ಸೂರಿನಡಿ ವ್ಯವಸ್ಥೆ ಮಾಡಿರುವ ಕ್ರಮಕ್ಕೆ ಮೆಚ್ಚುಗೆ ವ್ಯಕ್ತಪಡಿಸಿದರು."
246,"ಸ್ಥಳೀಯ ಜಿಲ್ಲಾ ಪೋಲಿಸ ವರಿಷ್ಠಧಿಕಾರಿಗಳ ಸಭಾ ಭವನದಲ್ಲಿ ರಾಷ್ಟಿçÃಯ ಆರೋಗ್ಯ ಅಭಿಯಾನ ಜಿಲ್ಲಾ ಆಡಳಿತ, ಜಿಲ್ಲಾ ಪಂಚಾಯತ, ವಾರ್ತಾ ಮತ್ತು ಸಾರ್ವಜನಿಕ ಸಂಪರ್ಕ ಇಲಾಖೆ, ಪೋಲಿಸ ಇಲಾಖೆ ಆರೋಗ್ಯ ಮತ್ತು ಕುಟುಂಬ ಕಲ್ಯಾಣ ಇಲಾಖೆ ವತಿಯಿಂದ ಆಯೋಜಿದಲಾಗಿದ್ದ ತಂಬಾಕು ನಿಯಂತ್ರಣ ಕೋಶ ಹಾಗೂ ತಂಬಾಕಿನಿಂದಾಗುವ ದುಷ್ಪರಿಣಾಮದ ಒಂದು ದಿನದ ತರಬೇತಿ ಕಾರ್ಯಾಗಾರದ ಕಾರ್ಯಕ್ರಮ ಕುರಿತು ಮಾತನಾಡಿದ ಅವರು,"
247,"ದೇವರಾಜ ಅರಸು ಅಭಿವೃದ್ಧಿ ನಿಗಮ, ಮೀನುಗಾರಿಕೆ, ಕೈಮಗ್ಗ ಮತ್ತು ಜವಳಿ, ಸಹಕಾರ ಸಂಘ, ಪ್ರವಾಸೋದ್ಯಮ, ಜಿಲ್ಲಾ ನಗರಾಭಿವೃದ್ಧಿ ಕೋಶ ಇಲಾಖೆ ಸೇರಿದಂತೆ ವಿವಿಧ ಇಲಾಖೆಗಳ ಪ್ರಗತಿ ಪರಿಶೀಲನೆ ನಡೆಸಲಾಯಿತು."
248,"ವೀರ್ಯ ಕೋಶವು ಮಾನವನ ದೇಹದ ಎಲ್ಲಾ ಇತರ ಜೀವಕೋಶಗಳಿಗಿಂತ ವಿಭಿನ್ನವಾಗಿದೆ, ಅದು ಏಕೈಕ ಕೋಶ ಪ್ರಕಾರವಾಗಿದ್ದು, ಇದು ಒಂದು ಜೋಡಿ ಕ್ರೋಮೋಸೋಮ್ಗಳನ್ನು ಹೊಂದಿರುತ್ತದೆ, ಆದರೆ ಎಲ್ಲಾ ಜೀವಕೋಶಗಳು ಪ್ರತಿಯೊಂದು ಕ್ರೊಮೊಸೋಮ್ನ ಎರಡು ಸೆಟ್ಗಳನ್ನು ಹೊಂದಿರುತ್ತವೆ."
249,ಇಂದಿನ ಲೇಖನದಲ್ಲಿ ಮಹಿಳೆಯರಲ್ಲಿ ಎದುರಾಗುವ ವೃಂತ ಕೋಶ ಅಥವಾ ಯೋನಿನಾಳದ ಶಿಲೀಂಧ್ರದ ಸೋಂಕಿನ ಬಗ್ಗೆ ನೋಡೋಣ:.
250,"ನಿಗದಿತ ನಮೂನೆಯ ಅರ್ಜಿಗಳನ್ನು ಹಾಗೂ ಯೋಜನೆ ಬಗ್ಗೆ ಹೆಚ್ಚಿನ ಮಾಹಿತಿಗಾಗಿ, ಬೆಳಗಾವಿ ಮಹಾನಗರ ಪಾಲಿಕೆಯ ನಗರ ಬಡತನ ನಿರ್ಮೂಲನ ಕೋಶ ಹಾಗೂ ನಗರ ಮಟ್ಟದ ತಾಂತ್ರಿಕ ಕೋಶ (ರಾ."
251,ಉದ್ಧತಾಭಿನಯ : ಪೌರುಷ ಪ್ರಧಾನವಾದ ಅಭಿನಯ-ರಭಸವಾದ ಪಾದಗತಿ (ಭರತ ಕೋಶ – ಶಾರದಾತನಯ)
