Index,Sentence
413,ದಕ್ಷಿಣ ಭಾರತೀಯ ಜಾನಪದ ಕೋಶ (ರಾ)(೬೧)
414,ಫೋಲಿಕ್ಯುಲರ್ ಅಥವಾ ಹರ್ಥಲ್ ಕೋಶ ಥೈರಾಯ್ಡ್ ಕ್ಯಾನ್ಸರ್ (ಸುಮಾರು 15 ಪ್ರತಿಶತ ಪ್ರಕರಣಗಳು)
415,"ಜಾರ್ಜ್ ಟೌನ್ ಯುನಿವರ್ಸಿಟಿ ಮೆಡಿಕಲ್ ಸೆಂಟರಿನ ಜೀವ ತಂತ್ರಜ್ಞಾನ, ಅಣುಗಳು ಮತ್ತು ಕೋಶ ಜೀವಶಾಸ್ತ್ರದ ಸಹಾಯಕ ಪ್ರೊಫೆಸರ್ ಜೊನ್ನ ಕಿಟ್ಲಿನ್ಸ್ಕಾ ಅವರು ತಮ್ಮ ಈ ಅಧ್ಯಯನದ ವಿವರಗಳನ್ನು ನೀಡಿದ್ದಾರೆ."
416,"ಒಂದು ವೇಳೆ ತಿಳಿದುಕೊಳ್ಳೋಣ ಅಂದುಕೊಂಡರೂ, ಅದರ ಬಗ್ಗೆ ಸ್ಪಷ್ಟ ಮಾಹಿತಿ ನೀಡುವ ಯಾವುದೇ ಕೋಶ ಇಲ್ಲ."
417,ಜಿಲ್ಲಾ ತಂಬಾಕು ನಿಯಂತ್ರಣ ಕೋಶ
418,ನಮ್ಮ ನೆನಪಿನ ಕೋಶ ಎಷ್ಟು ಬರಿದಾಗಿದೆ ಎಂದರೆ ಅಲ್ಲಿ ಬೇಕಾದ್ದು ಒಂದೂ ಇಲ್ಲ.
419,ಸಂತಾನೋತ್ಪತ್ತಿ ಕೋಶ ವೀರ್ಯಗಳ ಬಗ್ಗೆ ಇಲ್ಲಿದೆ ಸಂಪೂರ್ಣ ವಿವರ…
420,ಕಾಲೇಜಿನಲ್ಲಿ ಆಂತರಿಕ ಗುಣಮಟ್ಟ ಭರವಸೆ ಕೋಶ ಮತ್ತು ವೃತ್ತಿ ಮಾರ್ಗದರ್ಶನ ವಿಭಾಗದ ವತಿಯಿಂದ ಅಂತಿಮ ಬಿಎ ಮತ್ತು ಬಿಕಾಂ.
421,"ಹಾಗೆನೇ, ದೇಶ ಸುತ್ತಿ ನೋಡು, ಕೋಶ (ಪುಸ್ತಕ) ಓದಿ ನೋಡು ಎನ್ನುವುದು ಹಳೆಯ ಮಾತು."
422,"ಕೋಶ ವಿಭಜನೆಯು ಸಂತಾನೋತ್ಪತ್ತಿಯ ಕಾರ್ಯವಿಧಾನವಾಗಿದೆ, ಇದರಿಂದ ಜೀವಂತ ಜೀವಿಗಳು ಬೆಳೆಯುತ್ತವೆ, ಬೆಳೆಸುತ್ತವೆ, ಮತ್ತು ಸಂತತಿಯನ್ನು ಉತ್ಪಾದಿಸುತ್ತವೆ."
423,ಎಚ್ಐವಿ ಸೋಂಕಿತ ಟಿ ಕೋಶ (ಫೋಟೋ: ಎನ್ಐಐಐಡಿ | ವಿಕಿಮೀಡಿಯ ಕಾಮನ್ಸ್)
424,"ಮೇಲಿನ ಹಂತದ ಅಲ್ಗೆ ಸಂಕೀರ್ಣ ಕೋಶ ರಚನೆಯನ್ನು ಹೊಂದಿದ್ದು, ಕೆಲ್ಪ್ನಂತಹಕೆಲವಂತೂ ಹಲವಾರು ಮೀಟರ್ಗಳಷ್ಟು ಉದ್ದದ ದೇಹಗಳನ್ನು ಹೊಂದಿರುತ್ತವೆ."
425,ಇನ್ನು ದೇಶ ಕೋಶ ಬಿಟ್ಟು ಪ್ರಪಂಚ ಪರ್ಯಟನೆಗಿಳಿದವರಿಗಂತೂ ಬೇರೆ ದಾರಿಯೂ ಇಲ್ಲ.
426,"ಈ ಸಂದರ್ಭದಲ್ಲಿ ಜಿಲ್ಲಾ ಪೊಲೀಸ್ ವರಿಷ್ಠಾಧಿಕಾರಿ ನಿಶಾ ಜೇಮ್ಸ್, ಅಪರ ಜಿಲ್ಲಾಧಿಕಾರಿ ವಿದ್ಯಾ ಕುಮಾರಿ, ಜಿಲ್ಲಾ ನಗರಾಭಿವೃದ್ದಿ ಕೋಶ ಯೋಜನಾ ನಿರ್ದೇಶಕ ಸಂತೋಷ್ ಕುಮಾರ್ ಮತ್ತಿತರರು ಇದ್ದರು."
427,ಕೋಶ ವಿಭಜನೆಯ ಎಲ್ಲಾ ಹಂತಗಳಲ್ಲಿ ಆಡಲು ಸೆಂಟೇರಿಯೊಗಳು ಬಹಳ ಮುಖ್ಯವಾದ ಪಾತ್ರವನ್ನು ಹೊಂದಿವೆ.
428,"ಇದೀಗ ಪೆಟ್ರೋಲಿಯಂ ಮತ್ತು ನೈಸರ್ಗಿಕ ಅನಿಲ ಸಚಿವಾಲಯದಡಿ ಕಾರ್ಯ ನಿರ್ವಹಿಸುವ ಪೆಟ್ರೋಲಿಯಂ ಯೋಜನೆ ಮತ್ತು ವಿಶ್ಲೇಷಣೆ ಕೋಶ (ಪಿಪಿಎಸಿ) ಕೂಡಾ ಇದನ್ನು ದೃಢಪಡಿಸಿದ್ದು, ಸರ್ಕಾರ ಪಾವತಿಸಿರುವುದು ಕೇವಲ 3,500 ಕೋಟಿ ರೂಪಾಯಿ ಎಂದು ಹೇಳಿದೆ."
429,"ಫೌಜಿಯಾ ತರನ್ನುಮ್‌, ಜಿಲ್ಲಾ ನಗರಾಭಿವೃದ್ಧಿ ಕೋಶ ಯೋಜನಾಧಿಕಾರಿ ರೇಣುಕಾ ಹಾಗೂ ಜಿಲ್ಲಾ ಮತ್ತು ತಾಲೂಕು ಮಟ್ಟದ ಅಧಿಕಾರಿಗಳು ಕಾರ್ಯಾಗಾರದಲ್ಲಿ ಭಾಗವಹಿಸಿದ್ದರು."
430,"ಸಭೆಯಲ್ಲಿ ಆಡಳಿತ ಪಕ್ಷದ ನಾಯಕ ಮುನೀಂದ್ರ ಕುಮಾರ್, ವಿರೋಧ ಪಕ್ಷದ ನಾಯಕ ಅಬ್ದುಲ್ ವಾಜೀದ್, ಜೆಡಿಎಸ್ ಪಕ್ಷದ ನಾಯಕಿ ನೇತ್ರಾ ನಾರಾಯಣ್, ಕಾನೂನು ಕೋಶ ವಿಭಾಗದ ಮುಖ್ಯಸ್ಥ ದೇಶಪಾಂಡೆ, ಜಂಟಿ ಆಯುಕ್ತ ವೆಂಕಟೇಶ್, ವಲಯ ಜಂಟಿ ಆಯುಕ್ತ ಬಾಲಶೇಖರ್, ರಾಮಕೃಷ್ಣ, ವೆಂಕಟಾಚಲಪತಿ, ವೀರಭದ್ರಸ್ವಾಮಿ, ಅಶೋಕ್ ಉಪಸ್ಥಿತರಿದ್ದರು."
431,ಮೆಯಿಲಿನ್ ಕೋಶ ನಾಶವಾದ ಪ್ರದೇಶಗಳನ್ನು ಗಾಯಗಳು ಎಂದು ಕರೆಯಲಾಗುತ್ತದೆ.
432,"ಜಿಲ್ಲೆಯಲ್ಲಿ ಸುಮಾರು 75ಸಾವಿರ ವಿಧವೆಯರನ್ನು ಹೊಂದಿದ್ದು, ವಿಧವಾ ವೇತನ ಹಾಗೂ ಇತರ ಸೌಲಭ್ಯ ವಂಚಿತರನ್ನು ಗುರುತಿಸಿ ಅವರಿಗೆ ಸಿಗುವ ವಿವಿಧ ಸೌಲಭ್ಯಗಳನ್ನು ನೀಡುವ ಮೂಲಕ ಉತ್ತಮ ಜೀವನ ನಡೆಸಲು ಅವಕಾಶ ಕಲ್ಪಿಸುವ ಉದ್ದೇಶವನ್ನು ವಿಧವಾ ಕೋಶ ಹೊಂದಿದ್ದು, ಅದರ ಸದುಪಯೋಗ ಪಡೆದುಕೊಳ್ಳಬೇಕೆಂದು ತಿಳಿಸಿದರು."
433,ರಾಜೇಶ್ವರಿ ದೇವಿ ಹಾಗೂ ಜಿಲ್ಲಾ ಅಸಾಂಕ್ರಾಮಿಕ ರೋಗಗಳ ಕೋಶ ಮತ್ತು ಜಿಲ್ಲಾ ತಂಬಾಕು ನಿಯಂತ್ರಣ ಕೋಶ ದಕ್ಷಿಣ ಕನ್ನಡ ಇದರ ಕಾರ್ಯಕ್ರಮ ಅನುಷ್ಠನಾಧಿಕಾರಿಯಾದ ಡಾ.
434,ಪೇಶಿ ಎಂದರೆ ಕೋಶ ಎಂದೂ ಅರ್ಥವಿದೆ.
435,ವರಭೋಗಿಗಳು ಭೋಗಿಪ ವಸ್ತುವಿನ ಕೋಶ | ಸಿರಿಯಿರವಿಗೆ ಏಕದೇಶ || ೫೭ ||
436,ನಗರದ ಹೃದಯ ಭಾಗದಲ್ಲಿರುವ ಚಿಕ್ಕಪೇಟೆ ವಿಭಾಗದಲ್ಲಿ ನಡೆದಿರುವ ಹಗರಣವನ್ನು ಆಯುಕ್ತರ ತಾಂತ್ರಿಕ ಜಾಗೃತ ಕೋಶ (ಟಿವಿಸಿಸಿ) ಬಯಲಿಗೆಳೆದಿದೆ.
437,"ಏಕೆಂದರೆ, ನಮ್ಮ ಬೌದ್ಧಿಕ ಕೋಶ ಅಮೆರಿಕಾದತ್ತ ಎಳೆದರೆ ನಮ್ಮ ಭಾವಕೋಶ ಭಾರತದತ್ತ (ಕರ್ನಾಟಕದತ್ತ) ಎಳೆಯುತ್ತದೆ."
438,ಅಲ್ಲದೆ ಕಲಬುರಗಿಯಲ್ಲಿ ಹೈದರಾಬಾದ್ ಕರ್ನಾಟಕ ವಿಶೇಷ ಕೋಶ ಸ್ಥಾಪಿಸುವ ಕುರಿತು ಸಹ ಪರಿಶೀಲಿಸುವುದಾಗಿ ತಿಳಿಸಿದರು.
439,"ಈ ಯೋಜನೆಯಲ್ಲಿ ಈಗಾಗಲೇ ಕರ್ನಾಟಕ ದೇವಾಲಯ ಕೋಶ ಯೋಜನೆಯಡಿ, ಬಳ್ಳಾರಿ ಜಿಲ್ಲೆ, ಹಾವೇರಿ ಜಿಲ್ಲೆ, ಕೊಪ್ಪಳ ಜಿಲ್ಲೆ, ಬಿಜಾಪುರ ಜಿಲ್ಲೆ, ಧಾರವಾಡ ಜಿಲ್ಲೆ ಕೋಶವು ಪ್ರಕಟವಾಗಿವೆ."
440,"ಮೇಲಿನ ಚಿತ್ರದಲ್ಲಿ ಜೀವಕೋಶದ A8 ನಲ್ಲಿ ಕಂಡುಬರುವಂತೆ, ಆದಾಗ್ಯೂ, ಒಂದು ಬೂಲಿಯನ್ ಮೌಲ್ಯದ ಸ್ಥಳಕ್ಕೆ ಕೋಶ ಉಲ್ಲೇಖವು ಮೌಲ್ಯ ವಾದಗಳಲ್ಲಿ ಒಂದಾಗಿ ನಮೂದಿಸಲ್ಪಟ್ಟಿದ್ದರೆ, ಬೂಲಿಯನ್ ಮೌಲ್ಯವನ್ನು ಕಾರ್ಯದ ಮೂಲಕ ಸಂಖ್ಯೆಯಂತೆ ಪರಿಗಣಿಸಲಾಗುವುದಿಲ್ಲ."
441,ಅಲ್ಲದೆ ಕೋಶ ಓದು ದೇಶ ನೋಡು ಎಂಬ ಬಳಕೆಯ ಮಾತು ರೂಢಿಗೆ ಬಂದಿದೆ.
442,"ಇದು ಸಾಮಾನ್ಯ ದೃಷ್ಟಿಕೋನ, ಸಾಕಷ್ಟು ಬೆಳವಣಿಗೆ, ಮತ್ತು ಕೋಶ ವಿಭಜನೆ ಮತ್ತು ವಿಭಿನ್ನತೆಗೆ ಮುಖ್ಯವಾಗಿದೆ."
443,ಡೌನ್ ಸಿಂಡ್ರೋಮ್ ಸೇರಿದಂತೆ ಹೆಚ್ಚಿನ ವರ್ಣತಂತು ಅಸ್ವಸ್ಥತೆಗಳು ಕೋಶ ವಿಭಜನೆಯಲ್ಲಿ ಯಾದೃಚ್ಛಿಕ ಸಮಸ್ಯೆಗಳ ಫಲಿತಾಂಶವೆಂದು ನಂಬಲಾಗಿದೆ.
444,ಕರ್ನಾಟಕ ದೇವಾಲಯ ಕೋಶ – ಧಾರವಾಡ ಜಿಲ್ಲೆ: ಪ್ರಸ್ತಾವನೆ
445,ದಕ್ಷಿಣ ಭಾರತೀಯ ಜಾನಪದ ಕೋಶ (ಗೋ)(೬೯)
446,ಮೆಟಾಸ್ಟೇಸ್ಗಳನ್ನು ಅನುಮತಿಸುವ ಕೆಲವು ಹಾನಿಕರವಲ್ಲದ ಕೋಶ ಸಮೂಹಗಳಲ್ಲಿ ಒಂದಾಗಿದೆ.
447,ಜಿಲ್ಲಾ ತಂಬಾಕು ನಿಷೇಧ ಕೋಶ ಜಿಲ್ಲಾ ಸಲಹೆಗಾರ ಜಿ.
448,ವಿಜ್ಞಾನಮಯ ಕೋಶ (ಜ್ಞಾನ)
449,ತ್ಯಾಜ್ಯ ನಿರ್ವಹಣಾ ಕೋಶ ರಚನೆಗೆ ಚಿಂತನೆ
450,"ಸಾರ್ಕೋಮಾಗಳನ್ನು ಮಾರಣಾಂತಿಕ ಗೆಡ್ಡೆಗಳು ಎಂದು ಕರೆಯುತ್ತಾರೆ, ಆದರೆ ಅಸಂಕೇತೀಕರಿಸುವ ಅಂಗಾಂಶದಿಂದ ರಚನೆಯಾಗುತ್ತವೆ, ಇದು ಸಕ್ರಿಯ ಕೋಶ ವಿಭಜನೆಯಿಂದ ನಿರೂಪಿಸಲ್ಪಡುತ್ತದೆ."
451,* ಬಂಡೀಪುರದಲ್ಲಿ ಹುಲಿ ಕೋಶ (ಟೈಗರ್ ಸೆಲ್) ಸ್ಥಾಪಿಸಬೇಕು.
452,ವಸತಿ ಪ್ರದೇಶ ಕಂದಾಯ ಗ್ರಾಮ ಘೋಷಣೆಗೆ ರಾಜ್ಯ ಸರಕಾರ ಪ್ರತ್ಯೇಕ ಕೋಶ ಸ್ಥಾಪನೆ
453,"ಆಮ್ಲಜನಕದ ಉಪಸ್ಥಿತಿಯಲ್ಲಿ, ಪೈರೊವೇಟ್ ಕೋಶ ಮೈಟೋಕಾಂಡ್ರಿಯದ ಆಂತರಿಕ ಮ್ಯಾಟ್ರಿಕ್ಸ್ ಅನ್ನು ಪ್ರವೇಶಿಸುತ್ತದೆ ಮತ್ತು ಕ್ರೆಬ್ಸ್ ಚಕ್ರದಲ್ಲಿ ಮತ್ತಷ್ಟು ಉತ್ಕರ್ಷಣಕ್ಕೆ ಒಳಗಾಗುತ್ತದೆ."
454,"ಥಾಣೆ ಮುನ್ಸಿಪಲ್ ಕಾರ್ಪೊರೇಶನ್‌ನ (ಟಿಎಂಸಿ) ಪ್ರಾದೇಶಿಕ ವಿಪತ್ತು ನಿರ್ವಹಣಾ ಕೋಶ (ಆರ್‌ಡಿಎಂಸಿ) ಮುಖ್ಯಸ್ಥ ಸಂತೋಷ್ ಕದಮ್ ಅವರ ಪ್ರಕಾರ, ಬೆಂಕಿಯನ್ನು ನಿಯಂತ್ರಿಸಲು ನೆರೂಲ್, ಸಿಬಿಡಿ ಬೆಲಾಪುರ ಮತ್ತು ವಾಶಿ ಅಗ್ನಿಶಾಮಕ ಕೇಂದ್ರಗಳಿಂದ ಆರು ಅಗ್ನಿಶಾಮಕ ಯಂತ್ರಗಳನ್ನು ಸ್ಥಳಕ್ಕೆ ಕಳುಹಿಸಲಾಗಿದೆ."
455,ಹಾಲಿ ಸಚಿವರು ಪ್ರತಿನಿಧಿಸುವ ಕ್ಷೇತ್ರಗಳೂ ಸೇರಿದಂತೆ ಐದು ವಿಧಾನಸಭಾ ಕ್ಷೇತ್ರ ವ್ಯಾಪ್ತಿಯಲ್ಲಿ ನಡೆದ ಅಕ್ರಮವನ್ನು ಆಯುಕ್ತರ ತಾಂತ್ರಿಕ ಜಾಗೃತ ಕೋಶ (ಟಿವಿಸಿಸಿ) ಪತ್ತೆ ಹಚ್ಚಿದೆ.
456,"ಕೋಶ ವಿಭಜನೆಯ ವೇಳೆ, ಟ್ಯುಬ್ಯುಲಿನ್ ಎನ್ನುವ ಕೋಶದ ಪ್ರೊಟೀನ್, ಸೂಕ್ಷ್ಮನಾಲೆಗಳನ್ನು ರಚಿಸುವುದಕ್ಕೆ ಸಹಾಯಮಾಡುತ್ತದೆ."
457,ನಿಲುವಂಗಿಯ ಕೋಶ ಲಿಂಫೋಮಾದಲ್ಲಿ ಸ್ಥಳಾಂತರಿಸುವ ಸ್ಥಳ.
458,ಜೊತೆಗೆ ಕೋಶ ಚಲಿಸುವಾಗ ಶೇ 30ರಷ್ಟು ಶಕ್ತಿಯನ್ನೂ ಉತ್ಪಾದಿಸುತ್ತದೆ.
459,"ಚರ್ಮವನ್ನು ಉಜ್ಜಿ ಸ್ವಚ್ಛ ಮಾಡಲು ಸ್ಕ್ರಬ್ ತರಹ ಬಳಸಿದರೆ, ಅದು ನಿಮಗೆ ಮೃದು ಚರ್ಮವನ್ನು ನೀಡುತ್ತದೆ, ಸತ್ತ ಕೋಶ ಗಳನ್ನೆಲ್ಲಾ ತೆಗೆದುಹಾಕುತ್ತದೆ."
460,ಯುವಸಬಲೀಕರಣ ಮತ್ತು ಕ್ರೀಡಾ ಇಲಾಖೆ ರಾಷ್ಟ್ರೀಯ ಸೇವಾ ಯೋಜನಾ ಕೋಶ ವಿಕಾಸಸೌಧದಲ್ಲಿ ಹಮ್ಮಿಕೊಂಡಿದ್ದ ಸಭೆಯಲ್ಲಿ ಮಾತನಾಡಿದರು.
461,ಇಂದಿನ ದಿನಮಾನದಲ್ಲಿ ದೇಶ ಸುತ್ತುವುದಾಗಲೀ ಕೋಶ ಓದುವುದಾಗಲೀ ಮಹಾ ದೊಡ್ಡ ಕೆಲಸವೇನಲ್ಲ.
462,ಕೆಳಗಿನ ಹಂತಗಳು ಸಂವಾದ ಪೆಟ್ಟಿಗೆಯನ್ನು ಕೋಶ C2 ಗೆ ಪ್ರವೇಶಿಸುವ ಕಾರ್ಯವನ್ನು ಪ್ರವೇಶಿಸುತ್ತವೆ.
463,ಶೆವಾನೆಲ್ಲಾ ಮತ್ತು ಬಿ ಸಬ್ಟಿಲಿ ಎಂಬ ಚೀನಿ ವಿದ್ಯಾರ್ಥಿಗಳ ತಂಡವೊಂದು ಬ್ಯಾಕ್ಟಿರಿಯಾದಿಂದ ಸೂಕ್ಷ್ಮಜೀವಿಯ ಇಂಧನ ಕೋಶ ರಚಿಸುವಲ್ಲಿ ಯಶಸ್ವಿಯಾಗಿದ್ದಾರೆ.
464,"ಶ್ವಾಸಕೋಶದ ಅಡಿನೊಕಾರ್ಸಿನೋಮದ ಪ್ರಮಾಣ ಕೂಡ ಪುರುಷರಲ್ಲಿ ಹೆಚ್ಚಾಗುತ್ತಿದೆ, ಆದರೆ ಪುರುಷರು ಶ್ವಾಸಕೋಶದ ಸ್ಕೆಮಾಸ್ ಸೆಲ್ ಕ್ಯಾನ್ಸರ್ ಮತ್ತು ಸಣ್ಣ ಕೋಶ ಶ್ವಾಸಕೋಶದ ಕ್ಯಾನ್ಸರ್ ಅನ್ನು ಬೆಳೆಸಿಕೊಳ್ಳುವ ಸಾಧ್ಯತೆಗಳಿರುತ್ತವೆ."
465,ದೇಶ ಸುತ್ತುವುದು ಎಷ್ಟು ಮುಖ್ಯವೊ ಕೋಶ ಓದುವುದು ಅಷ್ಟೆ ಮುಖ್ಯ ಎಂದರು.
466,"ಪಿತ್ತ ಕೋಶ -ರೂ 81,790"
467,"ದೇಶದ ಯಾವುದೇ ಸಣ್ಣ ಪಟ್ಟಣವೊಂದರ ವ್ಯಕ್ತಿಯೊಬ್ಬ ಕ್ಯಾನ್ಸರ್‌ ಕಾಯಿಲೆಯ ಸಂದೇಹದಿಂದ ದೇಹದ ಕೋಶವನ್ನು ಪರೀಕ್ಷೆಗೆ ಒಳಪಡಿಸಿದರೆ, ಕೋಶದ ಸ್ಯಾಂಪಲ್‌ ಆನ್ನು ವಿಶ್ವದ ಅತಿರಥ ಮಹಾರಥ ತಜ್ಞರು ಏಕಕಾಲದಲ್ಲಿ ಪರಿಶೀಲಿಸಿ ಅದು ಕ್ಯಾನ್ಸರ್‌ ಕೋಶ ಹೌದೋ ಅಲ್ಲವೋ ಎಂಬ ನಿರ್ಧಾರಕ್ಕೆ ಬರಬಹುದು."
468,ಸೋದರಿ ಕ್ರೊಮ್ಯಾಟಿಡ್ಗಳು ಕೋಶ ವಿಭಜನೆಯ ಸಮಯದಲ್ಲಿ ರೂಪುಗೊಳ್ಳುವ ಕ್ರೋಮೋಸೋಮ್ಗಳನ್ನು ಪುನರಾವರ್ತಿಸುವ ಎರಡು-ಸ್ಟ್ಯಾಂಡೆಡ್ಗಳಾಗಿವೆ.
469,"ಕೋಶ ವಿಭಜನೆಯಾದಾಗ, ಪ್ರತಿ ಜೋಡಿ ಕ್ರೋಮೋಸೋಮ್ಗಳು ಪ್ರತಿ ಮಗಳು ಕೋಶಕ್ಕೆ ಹೋಗುತ್ತದೆ."
470,"ಇತರ ಕಾರಣಗಳಂತೆ ಸಾಮಾನ್ಯವಾಗದಿದ್ದರೂ, ತಳದ ಕೋಶ ಚರ್ಮದ ಕ್ಯಾನ್ಸರ್ ಚರ್ಮದ ಮೇಲೆ ಒಂದು ಮುತ್ತಿನ ಬಿಳಿ ಬಂಪ್ನಂತೆ ತೋರಿಸುತ್ತದೆ."
471,ಕರೀಂಖಾನರನ್ನು ನಡೆದಾಡುತ್ತಿದ್ದ ಜಾನಪದ ಕೋಶ ಎಂದು ಹರಿಯವರು ಕರೆದಿದ್ದಾರೆ.
472,"ಹೇಗಾದರೂ, ನ್ಯಾಷನಲ್ ಇನ್ಸ್ಟಿಟ್ಯೂಟ್ ಆಫ್ ಹೆಲ್ತ್ ಪ್ರಕಾರ, ಮಧುಮೇಹ ಹೊಂದಿರುವ ಎಚ್ಚರಿಕೆಯಿಂದ ಆಯ್ದ ಜನರಿಗೆ ಬಳಸಲಾಗುವ ಎರಡು ವಿಧದ ಹೆಚ್ಚು ಐಲೆಟ್ ಕೋಶ ಕಸಿ ಮಾಡುವಿಕೆಗಳಿವೆ."
473,ಬುಧವಾರ ನಗರದ ಬೆಂಗಳೂರು ನಗರ ಜಿಲ್ಲಾ ಕಾರಿಗಳ ಕಚೇರಿ ಸಭಾಂಗಣದಲ್ಲಿ ರಾಷ್ಟ್ರೀಯ ತಂಬಾಕು ನಿಯಂತ್ರಣ ಕೋಶ ಹಾಗೂ ಆರೋಗ್ಯ ಇಲಾಖೆ ಆಶ್ರಯದಲ್ಲಿ ಏರ್ಪಡಿಸಿದ್ದ ತಂಬಾಕು ನಿಯಂತ್ರಣ; ಕಾನೂನುಗಳ ಪರಿಣಾಮಕಾರಿ ಅನುಷ್ಠಾನ ಕುರಿತ ಕಾರ್ಯಾಗಾರದಲ್ಲಿ ಉಪನ್ಯಾಸ ನೀಡಿದರು.
474,ಇದಕ್ಕಾಗಿ ರಾಜ್ಯ ಸರ್ಕಾರದ ಭೂಮಿ ಉಸ್ತುವಾರಿ ಕೋಶ ವತಿಯಿಂದ ಬೆಳೆಸಾಲ ಮನ್ನಾ ವ್ಯವಸ್ಥೆ ವೆಬ್ ಸೈಟ್ ಸಿದ್ಧಗೊಳಿಸಲಾಗಿದೆ.
475,"ಹೇಗಾದರೂ, ಹೃದಯ ಕೋಶ ಹಾನಿ ಪತ್ತೆಹಚ್ಚಲು ಬಳಸುವ ಪ್ರಮುಖ ರಕ್ತ ಪ್ರೋಟೀನ್ ಟ್ರಾಪ್ರೊನಿನ್ ಆಗಿ ಮಾರ್ಪಟ್ಟಿದೆ ಮತ್ತು ಟ್ರೋಪೋನಿನ್ ಕಿಣ್ವವಲ್ಲ."
476,"ಟಿ ಕೋಶ ಸೋಂಕಿನಂತಲ್ಲದೆ, ಮ್ಯಾಕ್ರೋಫೇಜ್ಗಳ ಎಚ್ಐವಿ ಸೋಂಕು ಮ್ಯಾಕ್ರೋಫೇಜ್ ಕೋಶ ಸಾವುಗೆ ಕಾರಣವಾಗುತ್ತದೆ."
477,ಆದ್ದರಿಂದ ಒಬ್ಬ ಹಿರಿಯ ಪೊಲೀಸ್ ಅಧಿಕಾರಿಯವರ ನೇತೃತ್ವದಲ್ಲಿ ಸತರ್ಕತಾ ಕೋಶ ರಚಿಸಿ ಅನುಷ್ಠಾನಕ್ಕೆ ತರಲು ಅಗತ್ಯ ಕ್ರಮವಿಡುವಂತೆ ಸೂಚಿಸಿದೆ.
478,ಈ ದಾಳಿಯು ನರಗಳ ಮೈಲಿನ್ ಕೋಶ ಅಥವಾ ಆಕ್ಸಾನ್ನ ನಾಶವನ್ನು ಉಂಟುಮಾಡುತ್ತದೆ.
479,ಕರ್ನಾಟಕ ಸಹಸ್ರ ಕ್ರೀಡಾ ಪ್ರತಿಭಾ ಯೋಜನೆ ಪ್ರಾರಂಭಿಸಿ ರಾಜ್ಯದ ಒಂದು ಸಾವಿರ ಪ್ರತಿಭಾವಂತ ಯುವ ಕ್ರೀಡಾಪಟುಗಳನ್ನು ಗುರುತಿಸಿ ಪೂರ್ಣ ಮಾಹಿತಿಗಳನ್ನೊಳಗೊಂಡ ದತ್ತಾಂಶ ಕೋಶ ಸ್ಥಾಪನೆ.
480,"ಹಾಗೆಯೇ ಹಸ್ತ್ಯಾಯುರ್ವೇದ ಟೀಕೆಯ ಪ್ರಕಟನೆ ಮುಗಿದ ಬಳಿಕ, ಅದರ ಸಹಾಯದಿಂದ ಗಜಶಾಸ್ತ್ರಶಬ್ದ ಕೋಶ ಇನ್ನಷ್ಟು ಪರಿಷ್ಕಾರಗೊಳ್ಳಬೇಕು."
481,"ವಾಸ್ತವವಾಗಿ, ಸಸ್ಯದ ಕೋಶ ಸೈಟೋಕಿನೈಸಿಸ್ನಲ್ಲಿ ಯಾವುದೇ ಸೀಳು ತುಪ್ಪನ್ನು ರಚಿಸಲಾಗುವುದಿಲ್ಲ."
482,"ಜಾತಿ, ವರ್ಗ, ಭಾಷೆಯ ಭಿನ್ನತೆಗಳನ್ನು ಈ ಪದ ಸಂಸ್ಕೃತಿ ಕೋಶ ಹೊಂದಿದೆ."
483,ಕೋಶ ವಿಭಜನೆಯ ಪ್ರಕ್ರಿಯೆಯಲ್ಲಿ ಭಾಗವಹಿಸುತ್ತದೆ;
484,"ನೀರನ್ನು ಇಂಧನವಾಗಿ ಬಳಸಿಕೊಳ್ಳುವ ಪ್ರಕ್ರಿಯೆ ಸರಳ ವಿದ್ಯುತ್ ಇಂಧನ ಕೋಶ ತಂತ್ರಜ್ಞಾನ ಆಧರಿಸಿದ್ದು, ವಿದ್ಯುತ್ ಉತ್ಪಾದನೆಗೆ ಎಲೆಕ್ಟ್ರೋಕೆಮಿಕಲ್ ಪ್ರತಿಕ್ರಿಯೆಯನ್ನು ಬಳಸುತ್ತದೆ."
485,"ದತ್ತು ಕೋಶ ವರ್ಗಾವಣೆಯಂತೆ, ನಿಮ್ಮ ಗೆಡ್ಡೆಯ ಪ್ರದೇಶದಿಂದ ಟಿ-ಕೋಶಗಳನ್ನು ಮೊದಲು ಸಂಗ್ರಹಿಸಲಾಗುತ್ತದೆ."
486,ಹಾಗೂ ಭದ್ರತಾ ಕೋಶ ಕೋಣೆಯನ್ನು ದಕ್ಷಿಣ ಕನ್ನಡ ಹಾಲು ಉತ್ಪಾದಕರ ಒಕ್ಕೂಟ ನಿ ಮಂಗಳೂರು ಇದರ ಅಧ್ಯಕ್ಷ ಕೆ.
487,ಸಮಪದಗಳುಳ್ಳ ಸಮಪದ ಕೋಶ ರಚಿಸಿದ್ದು ನುಡಿಕಿಡಿಗಳ ಸಂಗ್ರಹ ಕನ್ನಡ ಪದಗಳ ಹುಟ್ಟು ರಚನೆ- ಬಹು ಅಪರೂಪದ ಕೊಡುಗೆಗಳು.
488,ದಕ್ಷಿಣ ಭಾರತೀಯ ಜಾನಪದ ಕೋಶ (ತೆ)(೧)
489,ಮೂಲ ಕೋಶ ಕಾರ್ಸಿನೋಮವು ಹೆಚ್ಚು ಸಾಮಾನ್ಯವಾಗಿದೆ - ಆದರೆ ಎಲ್ಲಾ ಕ್ಯಾನ್ಸರ್ಗಳಲ್ಲಿಯೂ ಸಹ ಅತ್ಯಂತ ವಾಸಿಮಾಡಬಹುದಾದದು.
490,"ರಕ್ತ ಪರಿಚಲನೆಯು ಜೀವಕೋಶಗಳು, ಕೋಶ ಉತ್ಪನ್ನಗಳು, ಮತ್ತು ದ್ರವಗಳ ಮಿಶ್ರಣವನ್ನು ಹೊಂದಿರುತ್ತದೆ."
491,ಮೂತ್ರಪಿಂಡದ ಕೋಶ ಕಾರ್ಸಿನೋಮಕ್ಕೆ ಅಪಾಯಕಾರಿ ಅಂಶವನ್ನು ಧೂಮಪಾನ ಮಾಡುವುದು ಮಾತ್ರವಲ್ಲದೆ ಧೂಮಪಾನವನ್ನು ಮುಂದುವರೆಸುವುದರಿಂದ ಚಿಕಿತ್ಸೆ ಕಡಿಮೆ ಪರಿಣಾಮಕಾರಿಯಾಗಿದೆ.
492,ಅಲ್ಪ ಪ್ರಮಾಣದ ಕ್ಯಾಲ್ಸಿಯಂ ಸಾಮಾನ್ಯ ಕೋಶ ವಿಭಜನೆಗೆ ಅತ್ಯಗತ್ಯ.
493,"ಸದಾ ಒಂದಿಲ್ಲೊಂದು ಚಟುವಟಿಕೆಯಲ್ಲಿ ತೊಡಗಿದ್ದ ಸರಿತಾರವರು ಕನ್ನಡ ಕಾನೂನು ಪದ ಕೋಶ ರಚನಾ ಸಮಿತಿ\, ಭಾರತೀಯ ಗೆಜೆಟಿಯರ‍್ ಕನ್ನಡ ಆವೃತ್ತಿ ಸಮಿತಿ\, ವಿಶ್ವಕನ್ನಡ ಸಾಹಿತ್ಯ ಸಮ್ಮೇಳನದ ಸಾಹಿತ್ಯ ಸಮಿತಿ ಕನಾಟಕ ಸಾಹಿತ್ಯ ಅಕಾಡಮಿ (೧೯೮೦-೮೨) ಮುಂತಾದವುಗಳ ಸದಸ್ಯೆಯಾಗಿ ರಚನಾತ್ಮಕ ಕಾರ್ಯಗಳಲ್ಲಿ ಭಾಗಿ."
494,ಕಾಯರ್ಾಗಾರದಲ್ಲಿ ಪೋಲಿಸ ಸಿಬ್ಬಂದಿ ವರ್ಗದವರು ಹಾಜರಿದ್ದರು ಜಿಲ್ಲಾ ತಂಬಾಕು ನಿಯಂತ್ರಣ ಕೋಶ ಸಮಾಜ ಕಾರ್ಯಕತರ್ೆಯಾದ ಕುಮಾರಿ ಕವಿತಾ ರಾಜನ್ನವರ ನಿರೂಪಿಸಿದರು.
495,ಕೋಶ ರಚನೆಗೆ ಸಂಬಂಧಿಸಿದಂತೆ ಎಂ.
496,ದಕ್ಷಿಣ ಭಾರತೀಯ ಜಾನಪದ ಕೋಶ (ಕೊ)(೫೭)
497,ಆದರೆ ಅವರವರ ವೈಯಕ್ತಿಕ ಜಗಳದಿಂದಾಗಿ ಇದುವರೆಗೂ ಈ ಗ್ರಾಮದೇವತೆಗಳ ಕೋಶ ಹೊರಗೆ ಬರಲೇ ಇಲ್ಲ.
498,"ಬಸವರಾಜ ಜಗಜಂಪಿ ಅವರು, ದೇಶ ಸುತ್ತುವುದರಿಂದ ಹಾಗೂ ಕೋಶ ಓದುವುದರಿಂದ ನಾವು ಅನುಭವ ಪಡೆದುಕೊಳ್ಳಲು ಸಾಧ್ಯವಾಗುತ್ತದೆ."
499,"ರಲ್ಲಿ, ನೆಬ್ರಸ್ಕಾದಲ್ಲಿ ವಾಸಿಸುತ್ತಿದ್ದ ಹೆರಾಲ್ಡ್ ಕುಕ್ ಎಂಬ ರೈತ ಮತ್ತು ಅರೆಕಾಲಿಕ ಭೂವಿಜ್ಞಾನಿಗಳು ಒಂದು ಕೋಶ ಅಥವಾ ಮಾನವ ಮೋಲಾರ್ಗೆ ಗಮನಾರ್ಹವಾಗಿ ಹೋಲುವ ಏಕೈಕ ಹಲ್ಲು ಕಂಡುಕೊಂಡರು."
500,ಮೈಸೂರು ವಿಶ್ವವಿದ್ಯಾನಿಲಯದ ಸೆನೆಟ್ ಭವನದಲ್ಲಿ ವಿವಿ ವತಿಯಿಂದ ಸೋಮವಾರ ಹಿಂದುಳಿದ ವರ್ಗಗಳ ಕೋಶ ಮತ್ತು ವೃತ್ತಿ ಕೌಶಲ್ಯ ಮತ್ತು ವ್ಯಕ್ತಿತ್ವ ವಿಕಸನ ಕುರಿತು ಹಮ್ಮಿಕೊಳ್ಳಲಾದ ಕಾರ್ಯಕ್ರಮದಲ್ಲಿ ಪಾಲ್ಗೊಂಡು ಮಾತನಾಡಿದರು.
501,ಈ ಕೋಶವು ಒಂದು ಕೋಶ (ಅಥವಾ ಮರ) ವನ್ನು ತೆಗೆದುಹಾಕಬೇಕೆಂದು ಸೂಚಿಸುತ್ತದೆ.
502,"ದೇಶ ಸುತ್ತಿ ನೋಡು, ಕೋಶ (ಪುಸ್ತಕ) ಓದಿ ನೋಡು ಎನ್ನುವುದು ಹಳೆಯ ಮಾತು."
503,ಇಂಧನ ಕೋಶ ಸಂವೇದಕಗಳು ಎಸ್ 80 ಸಾವಿರಾರು ಪರೀಕ್ಷೆಗಳಿಗೆ ಉಂಟಾಗುತ್ತದೆ ಎಂದರ್ಥ ಮತ್ತು ಇದು ಒಂದು ವರ್ಷದ ಖಾತರಿಯಿಂದ ಬೆಂಬಲಿತವಾಗಿದೆ.
504,ದಕ್ಷಿಣ ಭಾರತೀಯ ಜಾನಪದ ಕೋಶ (ಇ)(೮)
505,ಪುರುಷರಲ್ಲಿಯೂ ಕೂಡ ಹಲವು ಬಗೆಯ ಧರ್ಮ ಸಂಬಂಧಿ ಸಾಹಿತ್ಯ ಚಟುವಟಿಕೆ ಈ ಕಾಲದಲ್ಲಿ ಮುಂದುವರಿದಿದೆ ಎಂಬುದನ್ನು ಸಿರಿಗನ್ನಡ ಗ್ರಂಥಕರ್ತರ ಕೋಶ ಹಾಗೂ ಅನುಕ್ತ ಕೃತಿ ಸೂಚಿಯ ದಾಖಲೆಗಳು ಎತ್ತಿ ತೋರಿಸುತ್ತವೆ.
