Index,Sentence
330,ನಟಿ ಮೇಲಿನ ಲೈಂಗಿಕ ದೌರ್ಜನ್ಯಕ್ಕೆ ಸುಪಾರಿ ಪಡೆದಿಲ್ಲ ಎಂದು ಸುನಿ ಹೇಳಿರುವುದಾಗಿ ಮಾಧ್ಯಮಗಳು.
331,06): ಶುಕ್ರವಾರ ನಡೆದಿದ್ದ ದಾಸನಪುರ ಎಪಿಎಂಸಿ ಅಧ್ಯಕ್ಷ ಕಡಬಗೆರೆ ಶ್ರೀನಿವಾಸ್‌ ಶೂಟೌಟ್‌ ಪ್ರಕರಣಕ್ಕೆ ಸಂಬಂಧಿಸಿದಂತೆ ವೈಯಕ್ತಿಕ ದ್ವೇಷದ ಹಿನ್ನೆಲೆಯಲ್ಲಿ ಕೊಲೆಗೆ ಪ್ರಭಾವಿ ಶಕ್ತಿಗಳು ಸುಪಾರಿ ನೀಡಿರಬಹುದು ಎಂಬ ಅನುಮಾನ ವ್ಯಕ್ತವಾಗಿದೆ.
332,"ಆತನ ಹತ್ಯೆಗೆ ನಾನು ಸುಪಾರಿ ನೀಡಿಲ್ಲ, ರಾಜಕೀಯಕ್ಕೋಸ್ಕರ ಈ ಆರೋಪ ಮಾಡಿದ್ದಾರೆ."
333,ದೀಪಕ್ ಹತ್ಯೆಗೆ ಮಂಗಳೂರಿನ ಸ್ಥಳೀಯ ಬಿಜೆಪಿ ಕಾರ್ಪೋರೇಟರ್ ಸುಪಾರಿ ಕೊಟ್ಟಿರುವುದಾಗಿ ಮಾಜಿ ಸಿಎಂ ಎಚ್ ಡಿ ಕುಮಾರಸ್ವಾಮಿ ಆರೋಪಿಸಿದ್ದಾರೆ.
334,ಮಣಿಶಂಕರ್‌ ಅಯ್ಯರ್‌ ನನ್ನನ್ನು ದಾರಿಯಿಂದ ಸರಿಸಲು ಪಾಕಿಸ್ತಾನಕ್ಕೆ ಸುಪಾರಿ ನೀಡಿದ್ದರು.
335,ವಿಜಯಪುರ: ಸುನೀಲ್ ಹೆಗ್ಗರವಳ್ಳಿ ಹತ್ಯೆಗೆ ಸುಪಾರಿ ಕೊಟ್ಟ ಪ್ರಕರಣದಲ್ಲಿ ಮೂರನೇ ಆರೋಪಿಯಾಗಿರುವ ವಿಜು ಬಡಿಗೇರನನ್ನು ಮಹಾರಾಷ್ಟ್ರದಲ್ಲಿ ಸಿಸಿಬಿ ಪೊಲೀಸರು ಬಂಧಿಸಿದ್ದಾರೆ.
336,ಬೆಂಗಳೂರು: ಪತ್ರಕರ್ತ ಸುನಿಲ್ ಹೆಗ್ಗರವಳ್ಳಿ ಕೊಲೆ ಸುಪಾರಿ ಪ್ರಕರಣ ಹಿನ್ನೆಲೆ ಸಿಸಿಬಿ ವಶದಲ್ಲಿರುವ ರವಿ ಬೆಳಗರೆ ವಿಚಾರಣೆ ಇಂದು ಮುಂದುವರಿಕೆಯ ಸಾಧ್ಯತೆ ಇದೆ.
337,ದೀಪಕ್ ಕೊಲೆಗೆ ಬಿಜೆಪಿ ಕಾರ್ಪೋರೇಟರ್ ಒಬ್ಬರು ಸುಪಾರಿ ನೀಡಿದ್ದಾರೆ.
338,"ಈ ಕೊಲೆಗೆ ರಾಜೇಶ ರುದ್ರಪಾಟಿ ಸುಪಾರಿ ನೀಡಿದ್ದು, ಕಳೆದ ವರ್ಷ ನಡೆದಿದ್ದ ನಗರ ಸಭೆ ಚುನಾವಣೆಯಲ್ಲಿ ಶ್ಯಾಮಸುಂದರ ತನ್ನ ಅತ್ತಿಗೆಯನ್ನು ಚುನಾವಣೆಗೆ ನಿಲ್ಲಿಸಿ ರಾಜೇಶ ರುದ್ರಪಾಟಿಯನ್ನು ಎದುರು ಹಾಕಿಕೊಂಡಿದ್ದ."
339,"ಸುಪಾರಿ ನೀಡಿ ಮಾವನೇ ಅಳಿಯನ ಹತ್ಯೆ ಮಾಡಿಸಿರುವ ಪ್ರಕರಣವನ್ನು ಭೇದಿಸಿರುವ ಹೊಳೆನರಸೀಪುರ ನಗರ ಠಾಣೆ ಪೊಲೀಸರು, ಈ ಸಂಬಂಧ ಆರು ಮಂದಿ…"
340,"ಶಶಿಭೂಷಣ್‌ ಹಾಗೂ ಅವರು ಕಾರ್ಯನಿರ್ವಹಿಸುವ ಶಾಲೆ, ನಿತ್ಯ ಸಂಚರಿಸುವ ಮಾರ್ಗದ ಛಾಯಾಚಿತ್ರಗಳನ್ನು ಸುಪಾರಿ ಹಂತಕರಿಗೆ ಮೊಬೈಲ್‌ ಮೂಲಕ ಕಳುಹಿಸಿದ್ದು ತನಿಖೆಯಿಂದ ಗೊತ್ತಾಗಿದೆ ಎಂದು ಜಿಲ್ಲಾ ಪೊಲೀಸ್‌ ವರಿಷ್ಠಾಧಿಕಾರಿ ಸುಧೀರ್‌ಕುಮಾರ್‌ ರೆಡ್ಡಿ ಪ್ರಜಾವಾಣಿಗೆ ತಿಳಿಸಿದ್ದಾರೆ."
341,ಈ ಪ್ರಕರಣವನ್ನೂ ಸಹ ದಾಖಲಿಸಿಕೊಂಡ ತುಂಗಾನಗರ ಪೊಲೀಸರು ಈ ಹಿಂದೆ ಹಬೀಬ್ ಖಾನ್ ರ ಜೊತೆ ಪಾರ್ಟನರ್ ಆಗಿದ್ದ ಕಲೀಂ ಪಾಷ ಖಾನ್ ಸಾಹೇಬರನ್ನ ಕೊಲೆ ಮಾಡುವುದಾಗಿ ಬೆದರಿಸಿದ್ದರ ಹಿನ್ನಲೆಯಲ್ಲಿ ಹಾಗೂ ಸಾತು ಮತ್ತು ಗ್ಯಾಂಗ್ ಗೆ ಕಲೀಂ ಪಾಷ ಸುಪಾರಿ ನೀಡಿರುವ ಕಾರಣ ಆತನನ್ನ ಬಂಧಿಸಿದ್ದಾರೆ.
342,ಸಹೋದರಿಯಿಂದ ಸುಪಾರಿ ಹತ್ಯೆಗೊಳಗಾದ ಕೊಣಾಜೆಯ ಕಾರ್ತಿಕ್ ರಾಜ್ ಹತ್ಯೆ ಪ್ರಕರಣವನ್ನು ಮುಂದಿಟ್ಟು ಒಂದು ಸಮು ದಾಯವನ್ನು ಗುರಿಯಾಗಿಸಿ ಬಿಜೆಪಿ ಅಲ್ಲಲ್ಲಿ ಪ್ರತಿಭಟನೆ ನಡೆಸಿತು.
343,ಸುಪಾರಿ ಪ್ರಕರಣ; ಸ್ಥಳೀಯ ಪತ್ರಿಕೆ ಸಂಪಾದಕನ ವಿಚಾರಣೆ
344,"ಭದ್ರಾದ್ರಿ: 40 ವರ್ಷದ ಮಹಿಳೆಯೊಬ್ಬಳು ತನ್ನ ಅತ್ತೆಯನ್ನ ಕೊಲ್ಲಲು ಸುಪಾರಿ ನೀಡಿ, ನಂತರ ದಿಂಬಿನಿಂದ ಉಸಿರುಗಟ್ಟಿಸಿ ಕೊಲೆ ಮಾಡಿರೋ ಘಟನೆ ತೆಲಂಗಾಣದ ಭದ್ರಾದ್ರಿ ಜಿಲ್ಲೆಯ ಪಾಲ್ವಂಚಾದಲ್ಲಿ ನಡೆದಿದೆ."
345,ಆದ್ರೆ ಆ ನಾಲ್ಕು ಜನಕ್ಕೆ ಸುಪಾರಿ ಕೊಟ್ಟಿದ್ದವರು ಯಾರೆಂಬುದನ್ನು ಸರ್ಕಾರಕ್ಕೆ ಇನ್ನು ಪತ್ತೆ ಹಚ್ಚುತ್ತಿಲ್ಲ ಎಂದು ಸರ್ಕಾರದ ವಿರುದ್ಧ ಟೀಕಿಸಿದರು.
346,ಬೆಂಗಳೂರು: ಬಾಡಿಗೆಗಿದ್ದ ಮನೆ ಮಾಲೀಕನ ಮಗನೊಡನೆ ಪ್ರೇಮಸಂಬಂಧ ಹೊಂದಿದ್ದ ಮಹಿಳೆಯೊಬ್ಬಳು ತನ್ನ ಪತಿಯ ಹತ್ಯೆಗಾಗಿ ಸುಪಾರಿ ನೀಡಿದ್ದ ಘಟನೆ ಬೆಂಗಳೂರಿನಲ್ಲಿ ನಡೆದಿದೆ.
347,"ಗರುಡನನ್ನ ಕೊಲ್ಲುವ ಸುಪಾರಿ ಪಡೆದು ಬಂದಿದ್ದ ರಾಕಿ ಭಾಯ್, ಕೆಜಿಎಫ್ ನ ನಿಜವಾದ ಹಿನ್ನಲೆ ಮತ್ತು ಅಲ್ಲಿ ಬೆಲೆ ಬಾಳುವ ಆಸ್ತಿಯ ಬಗ್ಗೆ ತಿಳಿದ ಬಳಿಕ, ಅಲ್ಲಿಗೆ ನಾನೇ ಕಿಂಗ್ ಆಗಬೇಕು ಆಸೆಯಿಂದ ಅಲ್ಲಿಯೇ ಉಳಿದುಕೊಳ್ಳಬಹುದು."
348,ಬಿಜೆಪಿ ಕಾರ್ಯಕರ್ತನ ಹತ್ಯೆಗೆ ಸುಪಾರಿ ಕೊಟ್ಟಿದ್ದು ಸಿಎಂ
349,"ನಮ್ಮ ತಂದೆ ಅತಿದೊಡ್ಡ ವ್ಯಕ್ತಿಯಾಗಿದ್ದು , ಇಷ್ಟೆಲ್ಲ ಸಾಧನೆ ಮಾಡಿದ ಮೇಲೆ ಸುಪಾರಿ ಕೊಟ್ಟು ಕೊಲೆ ಮಾಡಿಸುವ ಮಟ್ಟಕ್ಕೆ ಇಳಿಯುವವರಲ್ಲ."
350,ಬೆಂಗಳೂರು: ಹಿರಿಯ ಪತ್ರಕರ್ತ ದಿನೇಶ್‌ ಅಮೀನ್‌ ಮಟ್ಟು ಕೊಲೆ ಸುಪಾರಿ ನೀಡಿದ್ದಾರೆ ಎಂದು ಸಮಾಜಿಕ ಜಾಲತಾಣಗಳಲ್ಲಿ ಬಿತ್ತರಿಸಿದ್ದ ಭಾಸ್ಕರ್‌ ಪ್ರಸಾದ್‌ ಅವರನ್ನು ಡಿಜೆ ಹಳ್ಳಿ ಪೊಲೀಸರು ಬಂಧಿಸಿದ್ದಾರೆ.
351,ಈ ವೇಳೆ ಆರೋಪಿ ಯೋಗೇಶ್ ನಾನು ಬಾಂಬೆಯಲ್ಲಿದ್ದಾಗ ಕೊಲೆ ಮಾಡುವುದ್ದಕ್ಕೆ ಸದಾನಂದ ಸುಪಾರಿ ಕೊಟ್ಟಿದ್ದನು.
352,"ಬೆಂಗಳೂರು: ಪತ್ರಕರ್ತ ಸುನಿಲ್ ಹೆಗ್ಗರವಳ್ಳಿ ಅವರ ಹತ್ಯೆಗೆ ಸುಪಾರಿ ನೀಡಿದ ಆರೋಪದಡಿ ಬಂಧಿತರಾಗಿರುವ, ರವಿ ಬೆಳಗೆರೆ ಅವರಿಗೆ ಮತ್ತೊಂದು ಸಂಕಷ್ಟ ಎದುರಾಗಿದೆ."
353,ರಾಜೇಂದ್ರ ಅಗರ್ವಾಲ್ ಕನ್ನಯ್ಯ ಕೊಲೆಗೆ ಬಿಹಾರದ ಶಾರ್ಪ್​ ಶೂಟರ್ ಗಳಿಗೆ 30 ಲಕ್ಷ ರೂಗಳ ಸುಪಾರಿ ಕೊಟ್ಟಿದ್ದ.
354,ಈ ವೇಳೆ ತಾಹಿರ್ ರವಿ ಬೆಳಗೆರೆಯವರು ಸುನಿಲ್ ಹೆಗ್ಗರವಳ್ಳಿ ಕೊಲೆಗೆ 30 ಲಕ್ಷ ಸುಪಾರಿ ನೀಡಿದ್ದರು ಎಂಬ ವಿಷಯ ಬಹಿರಂಗಪಡಿಸಿದ್ದ.
355,"ಆರೋಪಿ ಗೋವಿಂದರಾಜು, ಲಿಂಗರಾಜು ಕೊಲೆಗೆ ರೂ 7 ಲಕ್ಷಕ್ಕೆ ಸುಪಾರಿ ಒಪ್ಪಿಸಿದ್ದ."
356,ಈ ಯುವಕ ತನ್ನ ತಂದೆಯನ್ನೇ ಕೊಲ್ಲಲು ಸುಪಾರಿ ನೀಡಿದ್ದೇಕೆ ಗೊತ್ತಾ ?
357,ಇನ್ನು ಸುಪಾರಿ ಹತ್ಯೆ ಕುರಿತಂತೆ ಇದರ ಹಿಂದಿನ ಸತ್ಯಾಸತ್ಯತೆ ಬಗ್ಗೆ ವಿಚಾರಣೆಯ ಬಳಿಕ ತಿಳಿಯಲಿದೆ ಎಂದು ಸುನಿಲ್ ಕುಮಾರ್ ಅವರು ಮಾಹಿತಿ ನೀಡಿದರು.
358,: ದಶಕದ ಹಿಂದೆ ವಿಜಯಪುರ ಭಾಗದಲ್ಲಿ ಸುಪಾರಿ ಕಿಲ್ಲರ್‌ಗಳಿಂದ ಕುಖ್ಯಾತಿಯಾಗಿದ್ದ ಟೈಗರ್ ಗ್ಯಾಂಗ್ ಮತ್ತೆ ಸಕ್ರಿಯವಾಗಿರುವ ಅನುಮಾನಗಳು ಶುರುವಾಗಿವೆ.
359,ಕೊಲೆಯಾದವ ಹಾಗೂ ಸುಪಾರಿ ನೀಡಿದ ಚಿಕ್ಕಪ್ಪ ಮುಂಡಗನೂರು ಗ್ರಾಮದ‌ ನಿವಾಸಿಗಳು.
360,ಪತ್ರಕರ್ತ ಸುನೀಲ್ ಹೆಗ್ಗರವಳ್ಳಿ ಹತ್ಯೆಗೆ ಸುಪಾರಿ ಪಡೆದಿದ್ದ ಶಶಿಧರ್ ಮೇಲೆ ಫೈರಿಂಗ್
361,"ಗುರುವಾರ ರಾತ್ರಿ ಪೊಲೀಸರು ಶಶಿಧರ್‌ನನ್ನು ವಶಕ್ಕೆ ಪಡೆದು ವಿಚಾರಣೆ ನಡೆಸಿದಾಗ, ಸುಪಾರಿ ಸಂಗತಿ ಬಹಿರಂಗಗೊಂಡಿದೆ."
362,ಬೆಂಗಳೂರು: ಖ್ಯಾತ ಪತ್ರಕರ್ತ ರವಿಬೆಳಗೆರೆ ತನ್ನ ಸಹೋದ್ಯೋಗಿ ಸುನಿಲ್ ಹೆಗ್ಗರವಳ್ಳಿ ಹತ್ಯೆಗೆ ಸುಪಾರಿ ಕೊಟ್ಟಿದ್ದರು ಎಂಬ ಭಯಾನಕ ಸತ್ಯವೊಂದು ಎಸ್ ಐಟಿ ತನಿಖೆಯ ವೇಳೆ ಬೆಳಕಿಗೆ ಬಂದಿದೆ.
363,ನಮಗೆ ಇಬ್ಬರು ಆರ್‍ಎಸ್‍ಎಸ್ ಕಾರ್ಯಕರ್ತರನ್ನ ಹತ್ಯೆ ಮಾಡಲು ಸುಪಾರಿ ಕೊಟ್ಟಿದ್ದರು.
364,ಆದ್ರೆ ಈ ಸುಪಾರಿ ಹತ್ಯೆ ಯತ್ನ ನಡೆದಿರುವುದು ಹಳೇ ದ್ವೇಷದಿಂದಲೋ ಅಥವಾ ಕಾಂಗ್ರೆಸ್ ಟಿಕೆಟ್ ಆಕ್ಷಾಂಕಿಯಾಗಿರುವುದರಿಂದಲೋ ಅನ್ನೋದು ಪೊಲೀಸರ ತನಿಖೆಯಿಂದ ಬಯಲಾಗಬೇಕಿದೆ.
365,"ಅದಕ್ಕಾಗಿ ಈಕೆ ಸುನೀಲ್ ಕುಮಾರ್, ಸುನೀಲ್, ಪುನೀತ್, ಪುಟ್ಟರಾಜು, ರಾಘವೇಂದ್ರ, ರಮೇಶ್ ಎಂಬ ಆರೋಪಿಗಳಿಗೆ 10 ಲಕ್ಷ ರೂಪಾಯಿಗೆ ತನ್ನ ಗಂಡನನ್ನು ಕೊಲೆ ಮಾಡುವಂತೆ ಸುಪಾರಿ ಕೊಟ್ಟಿದ್ದರು ಎನ್ನಲಾಗಿದೆ."
366,"ADG ನೀಡಿರುವ ಮಾಹಿತಿ ಪ್ರಕಾರ, ರಾಜಸ್ಥಾನದ ಸಂಪತ್ ನೆಹ್ರಾ ಜೊತೆ ಸೇರಿ ರವಿ 2018ರಲ್ಲಿ ಹೈದರಾಬಾದ್ ನಲ್ಲಿ ನಟ ಸಲ್ಮಾನ್ ಖಾನ್ ಹತ್ಯೆಗೆ ಸುಪಾರಿ ಪಡೆದಿರುವುದು ಆತ ಒಪ್ಪಿಕೊಂಡಿದ್ದಾನೆ."
367,ಬೆಂಗಳೂರು: ಸಹೋದ್ಯೋಗಿ ಹತ್ಯೆಗೆ ಸುಪಾರಿ ನೀಡಿದ ಪ್ರಕರಣಕ್ಕೆ ಸಂಬಂಧಿಸಿದಂತೆ ಬಂಧನಕ್ಕೀಡಾದ ಹಾಯ್ ಬೆಂಗಳೂರು ಸಂಪಾದಕ ರವಿ ಬೆಳಗೆರೆ ಅವರಿಗೆ ಸೆಷನ್ಸ್ ಕೋರ್ಟ್ ಜಾಮೀನು ಮಂಜೂರು ಮಾಡಿದೆ.
368,"ಅಲ್ಲದೇ ಕೆಲ ತಿಂಗಳ ಹಿಂದೆಯೇ ಪತಿ ಹತ್ಯೆಗೆ ಪುಟ್ಟರಾಜು, ರಾಘವೇಂದ್ರ, ರಮೇಶ್‌ ಎಂಬುವರಿಗೂ ಸುಪಾರಿ ಕೊಟ್ಟಿದ್ದಳು."
369,15] ಸಹೋದ್ಯೋಗಿ ಸುನೀಲ್ ಹೆಗ್ಗರವಳ್ಳಿ ಕೊಲೆಗೆ ಸುಪಾರಿ ನೀಡಿದ ಪ್ರಕರಣ ಮತ್ತು ಅಕ್ರಮ ಅಕ್ರಮವಾಗಿ ಶಸ್ತಾಸ್ತ್ರ ಹೊಂದಿದ ಪ್ರಕರಕಣ ಸಂಬಂಧ ಪತ್ರಕರ್ತ ರವಿ ಬೆಳಗೆರೆ ಮೇಲೆ ಆರೋಪಪಟ್ಟಿ ಸಲ್ಲಿಕೆಯಾಗಿದ್ದು ಸೆಷನ್ಸ್ ಕೋರ್ಟ್ ವಿಚಾರಣೆಗೆ ಬರಬೇಕಿದೆ.
370,ಜತೆಗೆ ಸುಪಾರಿ ಕಿಲ್ಲಿಂಗ್‌!
371,ಅಲಿ ಹತ್ಯೆಗೆ ಸಂಚು ರೂಪಿಸಿದ ಅಸ್ಗರ್ ಉಳಿದ ಪುಡಿ ರೌಡಿಗಳಿಗೆ ಮಾರಾಕಾಸ್ತ್ರಗಳನ್ನು ಬಳ್ಳಾರಿಯಿಂದಲೇ ರವಾನಿಸಿ ಸುಪಾರಿ ಕೊಟ್ಟಿದ್ದಾನೆ.
372,"ಇದಕ್ಕೂ ಮುನ್ನವೇ 3005ರಲ್ಲಿ ಪ್ರೀತಿ, ಮಧುರ್ ಭಂಡಾರ್ಕರ್ ಕೊಲೆಗೆ ನರೇಶ್ ಪರ್ದೇಶಿಗೆ ಸುಪಾರಿ ಕೊಟ್ಟಿದ್ದಳು."
373,"ಬೆಂಗಳೂರು, ಮಾರ್ಚ್ 10: ಚಂದನವನ(ಕನ್ನಡ ಚಿತ್ರರಂಗ)ದಲ್ಲಿ ಸುಪಾರಿ ಸಂಸ್ಕೃತಿ ಇಲ್ಲ, ಎಲ್ಲಾ ನನ್ನ ಅಣ್ತಮ್ಮಂದಿರು ಎಂದು ರಾಕಿಂಗ್ ಸ್ಟಾರ್ ಎಂದು ಕರೆಸಿಕೊಳ್ಳುವ ನಟ ಯಶ್ ಅಲಿಯಾಸ್ ನವೀನ್ ಅವರು ಸುದ್ದಿಗೋಷ್ಠಿ ನಡೆಸಿ, ಸ್ಪಷ್ಟನೆ ನೀಡಿದ್ದಾರೆ."
374,ಲಕ್ಷ ಸುಪಾರಿ ಕೊಟ್ಟು ಪತ್ನಿಯಿಂದ ಪತಿ ಕೊಲೆ.
375,ಕೆಎಸ್ ಭಗವಾನ್ ಅವರನ್ನು ಕೂಡ ಹತ್ಯೆಗೈಯಲು ಸುಪಾರಿ ನೀಡಲಾಗಿತ್ತು ಎಂಬುದು ತನಿಖೆಯಲ್ಲಿ ತಿಳಿದುಬಂದಿದೆ.
376,"ಮನೆ ಬಿಟ್ಟು ವರ್ಷಗಳೇ ಕಳೆದಿದ್ದ ದಿನೇಶ್, ನಿರ್ಮಾಣ ಹಂತದ ಕಟ್ಟಡಗಳಲ್ಲಿ ತಂಗುವುದು, ಪೊಲೀಸರಿಗೆ ತನ್ನ ಬಗ್ಗೆ ಯಾವುದೇ ಸುಳಿವು ಸಿಗದಂತೆ ನೋಡಿಕೊಳ್ಳುವುದಲ್ಲದೆ, ಸುಪಾರಿ ಕೊಲೆ, ಕೊಲೆಯತ್ನ, ಬೆದರಿಕೆಗಳಿಂದ ಭಯದ ವಾತಾವರಣ ಸೃಷ್ಟಿಸಿದ್ದ."
377,ಅಂಗವಿಕಲ ಮಗನ ಕೊಲೆಗೆ ಸುಪಾರಿ ಕೊಟ್ಟಿದ್ದ ತಂದೆ!
378,"Exclusive: ರವಿಬೆಳಗೆರೆ ರಾಕ್ಷಸ, ನನ್ನ ವಿರುದ್ಧ ಸುಪಾರಿ ನೀಡಿರುವುದು ಅತ್ಯಂತ ಕೆಟ್ಟ ಕೆಲಸ: ಸುನೀಲ್ ಹೆಗ್ಗರವಳ್ಳಿ"
379,ಇದನ್ನೂ ಓದಿ: ಶನಿ ಮುಖಿ ಕೊಲೆಗೆ ಸುಪಾರಿ ಒಂದು ಕೇಡು – ನೋಟ್ಸ್ ಫ್ರಮ್ ಸೆಂಟ್ರಲ್ ಜೈಲ್ ಇತ್ತೀಚೆಗಷ್ಟೇ 65ನೇ ಸಿಟಿ ಸಿವಿಲ್ ನ್ಯಾಯಾಲಯ ರವಿ ಬೆಳಗೆರೆಗೆ.
380,"ಶಿವಮೂರ್ತಿ ಹತ್ಯೆಗೆ ಮೂರ್ತಿ ಸುಪಾರಿ ನೀಡಿದ್ದು, ಜೂನ್ 25 ರಂದು ಶಿವಮೂರ್ತಿಯನ್ನು ಅವರದ್ದೇ ಕಾರಿನಲ್ಲಿ ಅಪಹರಿಸಿದ್ದ ಮೂವರು ದುಷ್ಕರ್ಮಿಗಳು ಹತ್ಯೆಗೈದಿದ್ದರು."
381,"ಬೆಂಗಳೂರು: ಕೌಟುಂಬಿಕ ಕಲಹದ ಹಿನ್ನೆಲೆಯಲ್ಲಿ ಗಂಡನೇ ಸುಪಾರಿ ನೀಡಿ ಪತ್ನಿಯನ್ನು ಕೊಲೆ ಮಾಡಿಸಿದ್ದ ಪ್ರಕರಣವನ್ನು ಭೇದಿಸಿರುವ ವೈಯಾಲಿಕಾವಲ್‌ ಠಾಣೆ ಪೊಲೀಸರು, ಮೂವರು ಆರೋಪಿಗಳನ್ನು ಬಂಧಿಸಿದ್ದಾರೆ."
382,"ಈ ಕಾರಣದಿಂದ ಆಸ್ತಿಗಾಗಿಯೋ, ವೈಯಕ್ತಿಕ ದ್ವೇಷಕ್ಕಾಗಿಯೋ ಇಲ್ಲಿಂದಲೇ ಸುಪಾರಿ ಕೊಟ್ಟು ಹತ್ಯೆ ಮಾಡಿಸಲಾಗಿದೆ ಎಂಬ ಅನುಮಾನ ದಟ್ಟವಾಗಿದೆ."
383,ರವಿ ಬೆಳಗೆರೆ ಸುನಿಲ್‍ನನ್ನು ಕೊಲೆ ನಡೆಸಲೆಂದು ಸುಪಾರಿ ನೀಡಲು ಆತನಿಗೆ ತನ್ನ ಎರಡನೇ ಪತ್ನಿ ಯಶೋಮತಿಯೊಂದಿಗೆ ಇದ್ದ ಅಕ್ರಮ ಸಂಬಂಧವೇ ಕಾರಣ ಎನ್ನುವುದು ಮಾಧ್ಯಮಗಳಲ್ಲಿ ವರದಿಯಾಗಿತ್ತು.
384,"ಅಷ್ಟೇ ಅಲ್ಲ, ಮಾದಕ ವಸ್ತು ಸಾಗಣೆ, ಹವಾಲಾ ದಂಧೆ, ಸುಪಾರಿ ಕೊಲೆ, ಸುಲಿಗೆಯಂಥ ಪೈಶಾಚಿಕ ಕೃತ್ಯಗಳನ್ನುನಡೆಸಲು ಈ ಉಭಯ ನಾಯಕರು ಪ್ರತ್ಯೇಕವಾದರೆ ಕಷ್ಟ ಗ್ಯಾಂಗಸ್ಟರ್‌ಗಳಾದ ಅಬು ಸಲೇಂ, ಛೋಟಾ ರಾಜನ್, ಫಾಹೀಮ್ ಮಚ್ಮಚ್ ಸೇರಿ ಅನೇಕರು ದಾವೂದ್‌ನಿಂದ ಬೇರ್ಪಟ್ಟು, ತಮ್ಮದೇ ಗ್ಯಾಂಗ್ ರಚಿಸಿಕೊಂಡಿದ್ದು, ಅಕ್ರಮ ದಂಧೆಗಳಲ್ಲಿ ಭಾಗಿಯಾಗಿದ್ದಾರೆ."
385,ಬೆಂಗಳೂರು : ಪತ್ರಕರ್ತ ಸುನಿಲ್ ಹೆಗ್ಗರವಳ್ಳಿ ಅವರ ಹತ್ಯೆಗೆ ಸುಪಾರಿ ಕೊಟ್ಟ ಪ್ರಕರಣ ಸಂಬಂಧ ಪತ್ರಕರ್ತ ರವಿ ಬೆಳಗೆರೆ ಅವರ ವಿರುದ್ದ ಐಪಿಸಿ ಸೆಕ್ಷನ್‌ 307 ಹಾೂ
386,"ಹಂತಕರು ಭೀಕರವಾದ ಇತಿಹಾಸ ಹೊಂದಿದ್ದು, ದೇಶದ ವಿವಿಧೆಡೆ ಸುಮಾರು 25 ಸುಪಾರಿ ಹತ್ಯೆ ಮಾಡಿದ್ದಾರೆ."
387,"ವಿದೇಶದಲ್ಲಿದ್ದುಕೊಂಡೇ ಕ್ಯಾಂಡಲ್ ಸಂತು ಕೊಲೆಗೆ ಸ್ಕೆಚ್ ಹಾಕಿ, ಆರೋಪಿಗಳಿಗೆ ಸುಪಾರಿ ನೀಡಿದ್ದ ಮಾಡೂರು ಇಸುಬು ಈ ಪ್ರಕರಣದ ಆರೋಪಿಯಾಗಿದ್ದು, 2015ರಲ್ಲಿ ನಗರ ಜೈಲ್‌ನಲ್ಲಿ ಕೊಲೆಯಾಗಿದ್ದ."
388,ಕೊಚ್ಚಿ: ನಾನು ಈ ಮೊದಲೇ ಹೇಳಿದಂತೆ ಸುಪಾರಿ ನೀಡಿದ್ದು ಮೇಡಂ.
389,ಹಾಯ್ ಬೆಂಗಳೂರು ಸಂಸ್ಥಾಪಕ ರವಿ ಬೆಳಗೆರೆ ಅವರು ಪತ್ರಕರ್ತ ಸುನಿಲ್ ಹೆಗ್ಗರವಳ್ಳಿ ಹತ್ಯೆಗೆ ಸುಪಾರಿ ನೀಡಿದ ಪ್ರಕರಣದಲ್ಲಿ ಮತ್ತೊಬ್ಬ ಆರೋಪಿ ವಿಜು ಬಡಿಗೇರನನ್ನು ಪೊಲೀಸರು ಬಂಧಿಸಿದ್ದಾರೆ.
390,ಇದನ್ನೂ ಓದಿ: ತನ್ವೀರ್ ಸೇಠ್​​ಗೆ ಸ್ಕೆಚ್ – ಸುಪಾರಿ ಬಗ್ಗೆ ಮೈಸೂರು ಪೊಲೀಸರಿಂದ ತನಿಖೆ ಆರಂಭ
391,ಸದ್ಯ ಕೊಲೆಗೆ ಸುಪಾರಿ ನೀಡಿದ ಪ್ರಕರಣ ಸಂಬಂಧ ಬ್ಯಾಟರಾಯನಪುರ ಪೊಲೀಸ್ ಠಾಣೆಯಲ್ಲಿ ಪ್ರಕರಣ ದಾಖಲಾಗಿದೆ.
392,ನಕ್ಸಲರು ಕೊಂದಿರಬಹುದಾ ಅಥವಾ ಬಲಪಂಥೀಯರು ಹತ್ಯೆಗೈದಿರಬಹುದಾ ಅಥವಾ ಇದು ಸುಪಾರಿ ಕಿಲ್ಲರ್ಸ್ ಗಳ ಕೈವಾಡವಾ ಅಥವಾ ಕಲಬುರ್ಗಿ ಹಂತಕರೇ ಇವರನ್ನೂ ಗುಂಡಿಟ್ಟರಾ ಎಂಬ ತಲೆಬುಡವಿಲ್ಲದ ವ್ಯಾಖ್ಯಾನಗಳು ತೇಲಿಬರುತ್ತಿರುವಾಗಲೇ ತನಿಖಾ ದಳದವರು ಇಂಚಿಂಚೇ ಆಗಿ ವಿವರಗಳನ್ನು ಕಲೆಹಾಕುತ್ತಿದ್ದಾರೆ.
393,"ವಿಚಾರಣೆ ವೇಳೆ ವಿಜಯಪುರ ಮೂಲದ ಶಶಿಧರ್, ರವಿ ಬೆಳಗೆರೆ ಅವರು 30 ಲಕ್ಷ ರು ಸುಪಾರಿ ನೀಡಿ, ಸುನಿಲ್ ಹೆಗ್ಗರವಳ್ಳಿಯನ್ನು ಕೊಲ್ಲಲು ಸೂಚಿಸಿದ್ದರು ಎಂದು ಹೇಳಿದ್ದರು."
394,ಇದರಿಂದ ರೊಚ್ಚಿಗೆದ್ದ ಧನಲಕ್ಷ್ಮಿ ಪುಡಿ ರೌಡಿ ಸಂತು ಎಂಬಾತನಿಗೆ ಸುಪಾರಿ ಕೊಟ್ಟಿದ್ದಾರೆ.
395,ಮುಂಬೈನ ಶಾರ್ಪ್ ಶೂಟರ್ಸ್ ಗಳಿಗೆ ನಿಮ್ಮ ಹತ್ಯೆಗೆ ಸುಪಾರಿ ನೀಡಲಾಗಿದೆ.
396,ಹೀಗಾಗಿ ಪತ್ನಿಯೇ ಸುಪಾರಿ ಕೊಟ್ಟು ಕೊಲೆ ಮಾಡಿಸಿರುವ ಶಂಕೆ ವ್ಯಕ್ತವಾಗಿದೆ.
397,ಸಹೋದ್ಯೋಗಿ ಸುನೀಲ್ ಹೆಗ್ಗರವಳ್ಳಿ ಕೊಲೆಗೆ ಸುಪಾರಿ ನೀಡಿದ ಪ್ರಕರಣ ಮತ್ತು ಅಕ್ರಮ ಅಕ್ರಮವಾಗಿ ಶಸ್ತಾಸ್ತ್ರ ಹೊಂದಿದ ಪ್ರಕರಕಣ ರದ್ದು ಕೋರಿ ಪತ್ರಕರ್ತ ರವಿ ಬೆಳಗೆರೆ ಹೈಕೋರ್ಟ್ ಮೆಟ್ಟಿಲು ಏರಿದ್ದಾರೆ.
398,ರವಿ ಬೆಳಗೆರೆ ಬಂಧನ ಹಿನ್ನೆಲೆಯಲ್ಲಿ ತಾಹೀರ್ನನ್ನು ಪೊಲೀಸರು ಬಂಧಿಸಿದಾಗ ಸುಪಾರಿ ಕಿಲ್ಲರ್ ಶಶಿಧರ್ ಮುಂಡೇವಾಡಗೆ ಗನ್ ಮಾರಿದ್ದ ಎಂಬುದು ಮಾಹಿತಿ ಸಿಕ್ಕಿದೆ.
399,"ಬೆಂಗಳೂರು:ಮಾ-25: ಸ್ಯಾಂಡಲ್‌‌ವುಡ್‌‌ ನಟ, ಕಾಂಗ್ರೆಸ್ ಕಾರ್ಯಕರ್ತ ಅರ್ಜುನ್ ದೇವ್ ತನ್ನ ಹತ್ಯೆಗೆ ರೌಡಿಶೀಟರ್ ಕಾಸಿಫ್ ಎಂಬಾತನಿಗೆ ಸುಪಾರಿ ನೀಡಿದ್ದಾರೆ ಹಾಗಾಗಿ ತನಗೆ ರಕ್ಷಣೆ ನೀಡುವಂತೆ ಬ್ಯಾಟರಾಯನಪುರ ಪೊಲೀಸ್ [more]"
400,"ಬ್ಯಾಡಗಿ: ತಾಲೂಕಿನ ಗುಡ್ಡದ ಮಲ್ಲಾಪುರ ಗ್ರಾಮದ ಹೊರವಲಯದಲ್ಲಿ ಇತ್ತೀಚೆಗೆ ನಡೆದಿದೆ ಎನ್ನಲಾದ ಸುಪಾರಿ ಕೊಲೆ ಪ್ರಕರಣಕ್ಕೆ ಸಂಬಂಧಿಸಿದಂತೆ ಕೆಲ ಪ್ರಭಾವಿ ವ್ಯಕ್ತಿಗಳ ಕೈವಾಡವಿರುವ ಶಂಕೆಯಿದ್ದು, ಬಂಧಿತ ಆರೋಪಿಯಾದ ಸಾದಿಕ್, ವಿರೇಶ್ ಬೆಸ್ತರ ಹಾಗೂ ಚನ್ನಬಸಪ್ಪ ಪೂಜಾರ ಇವರುಗಳನ್ನು ಇನ್ನಷ್ಟು ವಿಚಾರಣೆಗೊಳಪಡಿಸಿ ಅವರನ್ನು ಬಂಧಿಸುವ ಮೂಲಕ ತಪ್ಪಿತಸ್ಥರ ವಿರುದ್ಧ ಸೂಕ್ತ ಕಾನೂನು ಕ್ರಮ ಜರುಗಿಸುವಂತೆ ಮಾಜಿ ಶಾಸಕ ಸುರೇಶಗೌಡ ಆಗ್ರಹಿಸಿದರು."
401,ಲಕ್ಷ್ಮಣ್ ಕುಮಾರ್ ಕೊಲೆ ಮಾಡಿದ ನಂತರ ಸುಪಾರಿ ಪಡೆದ ಪ್ರಮುಖ ಆರೋಪಿ ದಿನೇಶ್ ಗೆ 15ಲಕ್ಷರೂ ಹಾಗೂ ಹೈದರಾಬಾದ್ ನಲ್ಲಿ ಒಂದು ಮನೆ ಕೊಡಿಸುವುದಾಗಿ ಸತ್ಯ ಒಪ್ಪಂದ ಮಾಡಿಕೊಂಡಿದ್ದ ಎಂದು ಪೊಲೀಸರು ತಿಳಿಸಿದ್ದಾರೆ.
402,"ಬೆಂಗಳೂರು: ಬನ್ನೇರುಘಟ್ಟ ಉದ್ಯಾನವನ ವ್ಯಾಪ್ತಿಯ ಬೆಟ್ಟದಲ್ಲಿ ಯುವಕನ ಕೈ ಕತ್ತರಿಸಿದ್ದ ಪ್ರಕರಣಕ್ಕೆ ಟ್ವಿಸ್ಟ್​ ಸಿಕ್ಕಿದ್ದು, ಕೈ ಕತ್ತರಿಸಲು ಪ್ರೇಯಸಿಯೇ ಸುಪಾರಿ ಕೊಟ್ಟಿರುವ ಸಂಗತಿ ತನಿಖೆಯಿಂದ ಬೆಳಕಿಗೆ ಬಂದಿದೆ."
403,ಅತ್ತೆಯನ್ನ ಕೊಲ್ಲಲು ಸುಪಾರಿ ಕೊಟ್ಳು- ದಿಂಬಿನಿಂದ ಉಸಿರುಗಟ್ಟಿಸಿ ಕೊಂದೇಬಿಟ್ಳು!
404,"ಮತ್ತೊಬ್ಬರ ಬಗ್ಗೆ ಬರೆಯುವ, ವಿಮರ್ಶೆ ಮಾಡುವ ಪತ್ರಕರ್ತರು ತಾವೇ ಸುಪಾರಿ ಕಿಲ್ಲರ್ ಗಳಾಗುತ್ತಿದ್ದಾರೆ."
