Index,Sentence
405,ಬೆಂಗಳೂರು: ತಮ್ಮ ಹತ್ಯೆಗೆ ರವಿ ಬೆಳಗೆರೆ ಸುಪಾರಿ ಕೊಟ್ಟಿದ್ದ ಆರೋಪದ ಬೆನ್ನಲ್ಲೇ ಪತ್ರಕರ್ತ ಸುನೀಲ್ ಹೆಗ್ಗರವಳ್ಳಿ ಅವರು ರಕ್ಷಣೆ ಒದಗಿಸುವಂತೆ ಪೊಲೀಸರಿಗೆ ಮನವಿ ಮಾಡಿದ್ದಾರೆ.
406,ಮಾಧ್ಯಮಗಳಲ್ಲಿ ಭಿತ್ತರವಾದ ಹತ್ಯೆ ಸುಪಾರಿ ವರದಿ ನೋಡಿ ಸ್ವತಃ ತಾವೇ ಮೌಖಿಕವಾಗಿ ಯಶ್​ ಪೊಲೀಸರಿಗೆ ದೂರು ನೀಡಿದ್ದರು.
407,11-ಸಹೋದ್ಯೋಗಿ ಸುನೀಲ್ ಹೆಗ್ಗರವಳ್ಳಿ ಅವರನ್ನು ಹತ್ಯೆ ಮಾಡಲು ಸುಪಾರಿ ಕೊಟ್ಟಿದ್ದಾರೆ ಎಂಬ ಪ್ರಕರಣ ವಿಚಾರಣೆ ನಡೆಸಿದ ಒಂದನೇ ಎಸಿಎಂಎಂ ನ್ಯಾಯಾಲಯ ಖ್ಯಾತ ಪತ್ರಕರ್ತ ರವಿಬೆಳಗೆರೆ ಅವರಿಗೆ ಡಿ.
408,ಮೊದಲು ಓರ್ವ ಮಹಿಳೆ ತನಗೆ ಸುಪಾರಿ ನೀಡಿದ್ದಳು ಎಂದಿದ್ದ.
409,"ಅಲೋಕ್ ಕುಮಾರ್ ಮುಂದೆ ನಿಂತು ಜೀವಕ್ಕೆ ಅಪಾಯವಿದ್ದು, ಸುಪಾರಿ ಬಗ್ಗೆ ಎಳೆಎಳೆಯಾಗಿ ಬಿಚ್ಚಿಟ್ಟಿದ್ದಾರಂತೆ ಆ ನಟ."
410,ಈ ಪ್ರಕರಣದಲ್ಲಿ ಬಂಧಿತನಾಗಿರುವ ಉರುಂಡಾಡಿಗುಡ್ಡೆಯ ಶಿವ ಅಲಿಯಾಸ್ ಶಿವಪ್ರಸಾದ್‌ನ ಮೂಲಕ ಹಂತಕರನ್ನು ಸಂಪರ್ಕಿಸಿ ವಿನಾಯಕ ಬಾಳಿಗ ಕೊಲೆಗೆ ಸುಪಾರಿ ನೀಡಿದ ಆರೋಪ ಶ್ರೀಕಾಂತ್ ಮೇಲಿದೆ.
411,"ಬೆಂಗಳೂರು: ತಾನು ಇರುವಾಗಲೇ ಪರ ಸ್ತ್ರೀಯರನ್ನು ಮನೆಗೆ ಕರೆದುಕೊಂಡು ಬರುತ್ತಿದ್ದ ಪತಿಯ ವರ್ತನೆಯಿಂದ ರೋಸಿ ಹೋದ ಮಹಿಳೆ, ₹ 30 ಲಕ್ಷಕ್ಕೆ ಸುಪಾರಿ ಕೊಟ್ಟು ಗಂಡನನ್ನು ಕೊಲೆ ಮಾಡಿಸಿದ್ದರು."
412,ಆರೋಪಿಗೆ ಸುಪಾರಿ ನೀಡಿ ಈ ರೀತಿ ನಡೆದುಕೊಳ್ಳುವಂತೆ ಹೇಳಿದ್ದರಂತೆ!
413,ಮುಚಖಂಡಿ ಇವರಿಗೆ ಸುಪಾರಿ ಕೊಟ್ಟು ಪರಮಾನಂದ ಮಲ್ಲಪ್ಪ ಹುಂಡೆಕಾರ ಇತನ ಮೂಲಕ ಗೋವಾದಲ್ಲಿ ಸೇಕ್ಯೂರಿಟಿ ಕೆಲಸ ಕೊಡಿಸುವುದಾಗಿ ನಂಬಿಸಿ ಮುಧೋಳಕ್ಕೆ ಕರೆದುಕೊಂಡು ಹೊಗಿ ಅಲ್ಲಿ ಅವನಿಗೆ ಸರಾಯಿಯಲ್ಲಿ ನಿದ್ರೆ ಮಾತ್ರೆ ಹಾಕಿ ಕುಡಿಸಿ ಅವನ ಪ್ರಜ್ಞೆ ತಪ್ಪಿಸಿ ಬಾಡಿಗೆ ಕಾರಿನಲ್ಲಿ ಮುಧೋಳ ದಿಂದ ಬಾಗಲಕೋಟ ಮಾಗ್ರವಾಗಿ ಗೋವಾದ ಕಡೆಗೆ ಕರೆದುಕೊಂಡು ಹೊಗಿ ಅದೆ ದಿನ ರಾತ್ರೆ ದಾರಿ ಮದ್ಯದಲ್ಲಿ ಅನಮೋಡ ಹತ್ತಿರ ಕಾರಿನಲ್ಲೆ ಸಿದ್ದಪ್ಪನ ಕತ್ತುಹಿಚುಕಿ ಕೊಲೆ ಮಾಡಿ ದೂದ ಸಾಗರ ಘಾಟನಲ್ಲಿ ಶವವನ್ನು ಎಸೆದು ಬಂದಿರುವುದಾಗಿ ಆರೋಪಿ ಹೇಳಿಕೆ ನೀಡಿರುತ್ತಾನೆ.
414,"ಈ ತಪಾಸಣೆಯನ್ನು ಹೊಸ ವರ್ಷಾಚರಣೆ ಹಿನ್ನೆಲೆಯಲ್ಲಿ ಭಯೋತ್ಪಾದಕರು, ಸುಪಾರಿ ಕಿಲ್ಲರ್ಸ್, ಗ್ಯಾಂಗ್ಸ್ ಮತ್ತು ವಿದೇಶಿಗರ ಅಕ್ರಮ ವಾಸ್ತವ್ಯ ಮತ್ತು ಇತರೇ ಅಕ್ರಮ ಚಟುವಟಿಕೆಗಳ ಪತ್ತೆಗಾಗಿ ನಡೆಸಲಾಗಿದೆ."
415,"ಸುಪಾರಿ ಪಡೆದ ಕೊಲೆಗಡುಕರು ಹಲವು ಬಾರಿ ಪೊಲೀಸಪ್ಪನ ಪತ್ನಿಯನ್ನು ಕೊಲೆ ಮಾಡಲು ಯತ್ನಿಸಿದರೂ, ಅದು ಅವರಿಂದ ಸಾಧ್ಯವಾಗಲಿಲ್ಲ."
416,"ಬಾಹುಬಲಿ ಹಾಡಿನೊಂದಿಗೆ ಮೋದಿ ಎಂಟ್ರಿ – ಮಲ್ಲಿಗೆ ಹಾರ, ಸುಪಾರಿ ಮಾಲೆ ಪೇಟದೊಂದಿಗೆ ಸ್ವಾಗತ"
417,ಈ ವಿಷಯವನ್ನು ಬಹಿರಂಗಪಡಿಸುತ್ತಾಳೆ ಎಂದು ಹೆದರಿ ಆಕೆಯನ್ನು ಕೊಲ್ಲಲು ಗಿರೀಶ್ ಸುಪಾರಿ ಕೊಟ್ಟಿದ್ದ ಎಂಬ ಆರೋಪವಿದೆ.
418,ಚಿತ್ರ : ಸುಪಾರಿ ಸೂರ್ಯ
419,ಗೌರಿ ಲಂಕೇಶ್ ಹತ್ಯೆಗೆ ಮುಂಬೈನಿಂದ ಬಂದಿದ್ರಾ ಸುಪಾರಿ ಕಿಲ್ಲರ್ಸ್?
420,ಕಂಪ್ಲಿ ಕೇತ್ರದ ಬಿಎಸ್‌ಆರ್ ಕಾಂಗ್ರೆಸ್ ಪಕ್ಷದ ಶಾಸಕ ಸುರೇಶ್ ಬಾಬು ತಮ್ಮ ಹತ್ಯೆಗೆ ಸುಪಾರಿ ಕೊಟ್ಟಿದ್ದಾರೆ.
421,"ಸುಪಾರಿ ಪಡೆದಿದ್ದ ತಂಡ ಬುಳ್ಳನಾಗ ಮತ್ತು ತಂಡ ಪ್ರಯಾಣಿಸುತ್ತಿದ್ದ ಕಾರನ್ನು ಅಡ್ಡಗಟ್ಟಿ ಮಾರಕಾಯುಧಗಳಿಂದ ದಾಳಿ ನಡೆಸಿದ್ದು, ಕಾರನ್ನು ಶರವೇಗದಲ್ಲಿ ಚಲಾಯಿಸಿದ್ದರಿಂದ ಕಾರಿನಲ್ಲಿದ್ದ ಮೂವರು ಪ್ರಾಣಾಪಾಯದಿಂದ ಪಾರಾಗಿದ್ದಾರೆ."
422,ಆದರೆ ಇವರ ಪ್ರೇಮ ವಿವಾಹಕ್ಕೆ ವಿರೋಧ ವ್ಯಕ್ತಪಡಿಸಿದ್ದ ತಂದೆ ಅಂದೊಂದು ದಿನ ಮಗಳ ಅಪಹರಣಕ್ಕೆ ಸುಪಾರಿ ನೀಡಿದ್ದರು.
423,"ಪರಿಣತ ಸುಪಾರಿ ಕಿಲ್ಲರ್‌ ಆಗಿದ್ದ ಆತ ಯಾವುದಾದರೊಂದು ಕಾರಣ ಕೊಟ್ಟು ದಾವೂದ್‌ ಬಂಟರನ್ನು ಗುಜರಾತ್‌ಗೆ ಕರೆಸಿಕೊಂಡು ಅಲ್ಲಿ ಹೆದ್ದಾರಿಯಲ್ಲೇ ಗುಂಡಿಟ್ಟು ಸಾಯಿಸುತ್ತಿದ್ದ, ಕೊಂದವನು ನಾನೇ ಎಂದು ಘಂಟಾಘೋಷವಾಗಿ ಹೇಳುತ್ತಿದ್ದ."
424,ಹಿಂದೂಪರ ಸಂಘಟನೆಯ ಮದ್ದೂರಿನ ನವೀನ್ ಕುಮಾರ್ ಅಲಿಯಾಸ್ ಹೊಟ್ಟೆ ಮಂಜ ಎಂಬಾತನೇ ಭಗವಾನ್ ಹತ್ಯೆಗೆ ಅನಿಲ್ ಎಂಬ ಯುವಕನಿಗೆ ಸುಪಾರಿ ನೀಡಿದ್ದ ಎಂಬುದು ಈಗ ಬಹಿರಂಗಗೊಂಡಿದೆ.
425,"ಲೂನಾವಾಡ (ಗುಜರಾತ್): ನನ್ನನ್ನು ಪದಚ್ಯುತಿಗೊಳಿಸಲು ಹಿರಿಯ ಕಾಂಗ್ರೆಸ್ಸಿಗ ಮಣಿಶಂಕರ್ ಅಯ್ಯರ್ ಅವರು ಪಾಕಿಸ್ತಾನದಲ್ಲಿ ಸುಪಾರಿ ನೀಡಿದ್ದಾರೆ ಎಂದು ಹೇಳಿದ ಮರುದಿನವೇ ಪ್ರಧಾನಿ ನರೇಂದ್ರ ಮೋದಿ ಅವರು, ಕಾಂಗ್ರೆಸ್ಸಿಗರು ನನ್ನ ತಂದೆ, ತಾಯಿ ಯಾರೆಂದು ಕೇಳುತ್ತಿದ್ದಾರೆ ಎಂದು ತರಾಟೆ ತೆಗೆದುಕೊಂಡಿದ್ದಾರೆ."
426,ಸುಧೀರ್ ಆವತ್ತು ಇಬ್ಬರ ಹತ್ಯೆಗೆ ಸುಪಾರಿ ನೀಡಿದ್ದ.
427,"ಆರೋಪಿಗಳಿಗೆ 15 ಲಕ್ಷ ಸುಪಾರಿ ನೀಡಿದ್ದ ಹೆಸರುಘಟ್ಟದ ತಮ್ಮೇನಹಳ್ಳಿಯ ಆರ್‍ಸಿ ಇಂಟರ್ ನ್ಯಾಷನಲ್ ಸ್ಕೂಲ್‍ನ ಮಾಲೀಕ ರಾಮಚಂದ್ರರೆಡ್ಡಿ ಹಾಗೂ ಮತ್ತೊಬ್ಬ ಆರೋಪಿ ಮೋಹನ್ ತಲೆಮರೆಸಿಕೊಂಡಿದ್ದು, ಅವರಿಬ್ಬರ ಬಂಧನಕ್ಕೆ ವಿಶೇಷ ತಂಡ ರಚಿಸಿ ತೀವ್ರ ಶೋಧ ನಡೆಸಲಾಗಿದೆ."
428,ಮಹಾದೇವ್ ಸಾಹುಕಾರ ಭೈರಗೊಂಡನಿಂದ 5 ಕೋಟಿ ಸುಪಾರಿ ಪಡೆಯಲಾಗಿದೆ ಎಂಬ ಆರೋಪ ಇದೆ.
429,"ಗೌರಿ ಲಂಕೇಶ್ ಹತ್ಯೆ ಸಂಬಂಧ ತನಿಖೆ ನಡೆಸುವ ವೇಳೆ ಎಸ್‌ಐಟಿ ತಂಡ ಸುಪಾರಿ ಕಿಲ್ಲರ್‌, ಶಾರ್ಪ್‌ ಶೂಟರ್‌ ಶಶಿ ಮುಂಡೇವಾಡಗಿ ಅವರನ್ನು ಬಂಧಿಸಲಾಗಿತ್ತು."
430,ಶನಿಮುಖಿ ಕೊಲೆಗೆ ಸುಪಾರಿ ಒಂದು ಕೇಡು;ಬೆಳಗರೆ ಬಾಂಬ್‌ !
431,ಬೆಂಗಳೂರು: ಸಹೋದ್ಯೋಗಿ ಸುನಿಲ್‌ ಹೆಗ್ಗರವಳ್ಳಿ ಕೊಲೆಗೆ ಸುಪಾರಿ ನೀಡಿದ ಪ್ರಕರಣದಲ್ಲಿ ಬಂಧನಕ್ಕೊಳಗಾಗಿ 3 ದಿನಗಳ ಮಧ್ಯಾಂತರ ಜಾಮೀನಿನ ಮೇಲೆ ಬಿಡಗುಡೆಯಾಗಿರುವ ರವಿ ಬೆಳಗರೆ ಅವರು ಜೈಲಿನಲ್ಲಿರುವಾಗಲೇ ತಮ್ಮ ಹಾಯ್‌ ಬೆಂಗಳೂರು ಪತ್ರಿಕೆಗೆ ರಹಸ್ಯಗಳಿಂದ ಕೂಡಿರುವ ಲೇಖನವೊಂದನ್ನು ಬರೆದಿದ್ದಾರೆ.
432,ನನ್ನ ಕೊಲೆಗೆ ಸುಪಾರಿ ನೀಡಿರುವ ರವಿ ಬೆಳಗೆರೆ ಪ್ರಭಾವಿ ವ್ಯಕ್ತಿಯಾಗಿದ್ದು ಅವರಿಗೆ ಭೂಗತ ಲೋಕದ ನಂಟಿದೆ.
433,ಬೆಂಗಳೂರು: ಪತ್ರಕರ್ತ ಸುನೀಲ್ ಹೆಗ್ಗರವಳ್ಳಿ ಕೊಲೆಗೆ ಸುಪಾರಿ ನೀಡಿದ ಪ್ರಕರಣಕ್ಕೆ ಸಂಬಂಧಿಸಿದಂತೆ ಬಂಧಿತರಾಗಿರುವ ರವಿ ಬೆಳಗೆರೆಗೆ ಅವರ ಎರಡನೇ ಪತ್ನಿ ಯಶೋಮತಿ ಅವರು ನಾಪತ್ತೆಯಾಗಿದ್ದಾರೆ ಎಂದು ತಿಳಿದು ಬಂದಿದೆ.
434,ನಾರಾಯಣ ಗೌಡ ಬಿಚ್ಚಿಟ್ಟರು ಹತ್ಯೆಗೆ ಸುಪಾರಿ ಕೊಟ್ಟ ಸುದ್ದಿ
435,ಸುಪಾರಿ ಪಡೆದ ಹಂತಕರು ಗಣೇಶನನ್ನು ನರ್ಸರಿ ಗಿಡಗಳ ವ್ಯಾಪಾರದ ನೆಪ ಹೇಳಿ ರಾಮನಗರಕ್ಕೆ ಕರೆಸಿಕೊಂಡು ರಾಮನಗರದ ಜೈನ್​ ದೇವಾಲಯದ ರೈಲು ಹಳಿ ಬಳಿ ಮಾರಕಾಸ್ತ್ರಗಳಿಂದ ಕೊಚ್ಚಿ ಕೊಲೆ ಮಾಡಿದ್ದರು.
436,ವಯಸ್ಸಿನ ಹುಡುಗನೊಂದಿಗೆ ಕಳ್ಳಾಟವಾಡುತ್ತಿದ್ದ 10 ವರ್ಷದ ಮಗನಿರುವ ಆಂಟಿ ಪತಿ ಕೊಲೆಗೆ ಸುಪಾರಿ ಕೊಟ್ಟು ಕೊಲೆ ಮಾಡಿಸಿರುವ ಘಟನೆ ನಡೆದಿದೆ.
437,ಭೀಮಾತೀರದ ಸುಪಾರಿ ಕಿಲ್ಲರ್ ಶಶಿಧರ್ ಮುಂಡವಾಡೆ ನಿಮಗೆ ಹೇಗೆ ಪರಿಚಯ?
438,ಈ ಸುಪಾರಿ ಕೊಲೆ ಮಾಡಲು ನೀಡಿದ್ದ ಹಣ ಹಾಗೂ ಪಿಸ್ತೂಲನ್ನು ಪೊಲೀಸರು ವಶಪಡಿಸಿಕೊಂಡಿದ್ದಾರೆ.
439,ಈ ಬಗ್ಗೆ ಸುನೀಲ್ ಹತ್ಯೆ ಮಾಡಲು ನಿರ್ಧರಿಸಿದ್ದ ಬೆಳಗೆರೆ ಶಾರ್ಪ್ ಶೂಟರ್ ಶಶಿ ಮುಂಡೇವಾಡಗಿಗೆ 30 ಲಕ್ಷ ರುಪಾಯಿ ಸುಪಾರಿ ಕೊಟ್ಟಿದ್ದರು ಎಂಬುದಾಗಿ ತಿಳಿದುಬಂದಿತ್ತು.
440,ಹೀಗೆ ಸುಪಾರಿ ಪಡೆದು ಕೊಲೆಗೈಯ್ಯುತ್ತಿದ್ದ ಈ ಕ್ರಿಮಿನಲ್‌ಗಳ ತಂಡವನ್ನ ಆಂಧ್ರ ಪೊಲೀಸರು ಖೆಡ್ಡಾಗೆ ಕೆಡವಿದ್ದಾರೆ.
441,"ಬೆಂಗಳೂರು: ಹತ್ಯೆಗೆ ಸುಪಾರಿ ನೀಡಿದ ಪ್ರಕರಣದಲ್ಲಿ ಪತ್ರಕರ್ತ ರವಿ ಬೆಳಗೆರೆ ಬಂಧಿತರಾಗಿದ್ದು, ಸಿ."
442,ಒಟ್ಟಿನಲ್ಲಿ ಗೌರಿ ಹತ್ಯೆಯ ತನಿಖೆಯ ವೇಳೆ ಮತ್ತೊಂದು ಹತ್ಯೆಗೆ ಸುಪಾರಿ ನೀಡಿರುವ ವಿಚಾರ ಬೆಳಕಿಗೆ ಬಂದಿದೆ.
443,"ಭೀಮಾ ತೀರದ ಹಂತಕರಿಗೆ ಸಹಪತ್ರಕರ್ತನ ಹತ್ಯೆಗೆ ಸುಪಾರಿ ನೀಡಿರುವ ರವಿ ಬೆಳಗೆರೆಯವರ ಒಡನಾಟ ಹಂತಕರಿಂದ ಹಿಡಿದು, ಎಲ್ಲಾ ಭೂಗತ ಪಾತಕಿಗಳ ಜೊತೆಗಿದೆ ಎಂಬುದಕ್ಕೆ ಸಾಕ್ಷಿಗಳು ಅವರು ವಿಸ್ತೃತವಾಗಿ ಬರೆದಿರುವ ಕಾದಂಬರಿಗಳು."
444,ಬಳಿಕ ವಿಚಾರಣೆ ವೇಳೆ ಆತ ಸುಪಾರಿ ಸಂಗತಿ ಬಾಯ್ಬಿಟ್ಟಿದ್ದಾನೆ ಎನ್ನಲಾಗಿದೆ.
445,ಮಗಳ ಮೇಲೆ ಕಣ್ಣಾಕ್ಕಿದ್ದಕ್ಕೆ ತಾಯಿ ಕೊಟ್ಟಿದ್ದು ಸುಪಾರಿ
446,"ಕೆ ಟವರ್ಸ್ ನ ಮಾಲಕ ಖಲಂದರ್, ಉದ್ಯಮಿ ಇಸ್ಮಾಯಿಲ್ ಪೆರ್ಲಂಪಾಡಿ, ಬೆಳ್ಳಾರೆ ಪ್ರಗತಿ ಸುಪಾರಿ ಮಾಲಕ ಅಬ್ದುಲ್ ಖಾದರ್ , ಕಡಬ ಎಪ್."
447,"ಅಲಯನ್ಸ್ ವಿವಿ ಎಕ್ಸಿಕ್ಯೂಟಿವ್ ಹಾಗೂ ಶಿವಸೇನೆಯ ಕಾರ್ಯಕರ್ತನಾಗಿದ್ದ ಸೂರಜ್ ಸುಪಾರಿ ಪಡೆದ ನಂತರ ಗ್ಯಾಂಗ್ ರಚನೆ ಮಾಡಿ ಮಧುಕರ್ ಅಂಗೂರ್ ಹಾಗೂ ಅಯ್ಯಪ್ಪ ದೊರೆ ಇಬ್ಬರ ನಡಾವಳಿ ಬಗ್ಗೆ, ಚಟುವಟಿಕೆಗಳ ಮೇಲೆ ನಿಗಾ ಇಟ್ಟಿದ್ದ."
448,ಕ್ಯಾರಕಾಸ್ : ಅಮೆರಿಕ ಅಧ್ಯಕ್ಷ ಡೊನಾಲ್ಡ್​ ಟ್ರಂಪ್​ ಕೊಲಂಬಿಯಾದ ಸರ್ಕಾರಕ್ಕೆ ಮತ್ತು ಅಲ್ಲಿನ ಕೆಲ ಮಾಫಿಯಾಗಳಿಗೆ ನನ್ನನ್ನು ಹತ್ಯೆ ಮಾಡಲು ಸುಪಾರಿ ನೀಡಿದ್ದಾರೆ ಎಂದು ವೆನಿಜುವೆಲಾ ಅಧ್ಯಕ್ಷ [more]
449,ಅನೈತಿಕ ಸಂಬಂಧಕ್ಕೆ ಅಡ್ಡಿಯಾದ ಪತಿಯನ್ನು ಸುಪಾರಿ ನೀಡಿ ಕೊಲೆ ಮಾಡಲು ಸಂಚು ರೂಪಿಸಿದ್ದ ಪತ್ನಿ ಆಕೆಯ ಪ್ರಿಯಕರ ಅಲ್ಲದೇ ಕೊಲೆಗೆ ಸುಫಾರಿ ಪಡೆದಿದ್ದ ಅಪ್ರಾಪ್ತ ಯುವಕ ಸೇರಿ 6ಮಂದಿ ಆರೋಪಿಗಳನ್ನು ಹುಳಿಮಾವು ಬಂಧಿಸುವಲ್ಲಿ ಯಶಸ್ವಿಯಾಗಿದ್ದಾರೆ.
450,ಮಂತ್ರಿ ರೋಷನ್ ಬೇಗ್ ಸುಪಾರಿ ಕೊಟ್ಟು ರುದ್ರೇಶ್ ಹತ್ಯೆ ಮಾಡಲಾಗಿದೆ.
451,ಕಾಂಗ್ರೆಸ್ ಪಕ್ಷದ ಅಧ್ಯಕ್ಷರೂ ಆಗಿರುವ ನಟ ಅರ್ಜುನ್ ದೇವ್ ರನ್ನು ಕೊಲ್ಲಲು ಕಾಶೀಫ್ ಎಂಬಾತ ಸುಪಾರಿ ಪಡೆದಿದ್ದಾನೆ ಎಂದು ಆರೋಪಿಸಲಾಗಿದೆ.
452,ಬೆಂಗಳೂರು: ಎರಡು ವರ್ಷಗಳಿಂದ ತಲೆ ಮರೆಸಿಕೊಂಡಿದ್ದ ಸುಪಾರಿ ಕಿಲ್ಲರ್‌ ಮತ್ತು ಕಿಡ್ನ್ಯಾಪರ್‌ ಒಬ್ಬನ ಕಾಲಿಗೆ ಗುಂಡು ಹೊಡೆದು ಪೂರ್ವ ಡಿಸಿಪಿ ವಿಭಾಗದ ಅಧಿಕಾರಿಗಳು ಬಂಧಿಸಿದ್ದಾರೆ.
453,ಧಾರವಾಡ: ಅನೈತಿಕ ಸಂಬಂಧ ಹೊಂದಿರುವ ಸಂಶಯದ ಹಿನ್ನಲೆಯಲ್ಲಿ ವ್ಯಕ್ತಿಯೊಬ್ಬನ ಕೊಲೆಗೆ ಸುಪಾರಿ ನೀಡಿದ್ದ ಪ್ರಕರಣಕ್ಕೆ ಸಂಬಂಧಿಸಿದಂತೆ ಶಿಕ್ಷೆಗೆ ಒಳಗಾಗಿರುವ ಅಪರಾಧಿಗಳ ಪೈಕಿ ಇಬ್ಬರು ಸಲ್ಲಿಸಿದ್ದ ಜಾಮೀನು ಅರ್ಜಿಯನ್ನು ಇಲ್ಲಿನ ಹೈಕೋರ್ಟ್ ತಿರಸ್ಕರಿಸಿದೆ.
454,"ಸುಪಾರಿ ಹಂತಕರು ಕ್ಲೋಸ್ ರೇಂಜ್ ಅಲ್ಲಿ ಇರೋವಾಗ ಡ್ರೈವರ್, ಪಿಎಸ್ ಇಬ್ಬರು ಪರಾರಿಯಾಗಿದ್ದರು."
455,ನನ್ನ ಕೊಲೆಗೆ ಸುಪಾರಿ ಎಂಬ ಸುದ್ದಿಗಳಿಂದ ನನಗೆ ಬೇಸರವಾಗಿದೆ.
456,"ಈ ಸಂಬಂಧ ಪ್ರಕರಣ ದಾಖಲಿಸಿಕೊಂಡು ತನಿಖೆ ನಡೆಸಿದಾಗ ಕೊಲೆ ಸುಪಾರಿ ರಹಸ್ಯ ಬಯಲಾಗಿದ್ದು, ಅಳಿಯ ನಾಗೇಶ್‌ ಕೈವಾಡ ಗೊತ್ತಾಗಿತ್ತು."
457,11: ಸಹೋದ್ಯೋಗಿಯ ಹತ್ಯೆಗೆ ಸುಪಾರಿ ನೀಡಿದ ಆರೋಪದ ಮೇಲೆ ಬಂಧನವಾಗಿರುವ ಹಾಯ್ ಬೆಂಗಳೂರು ಸಂಸ್ಥಾಪಕ ರವಿ ಬೆಳಗೆರೆ ಕನ್ನಡಕ್ಕೆ ಬಾಲಿವುಡ್ ಚಿತ್ರನಟಿ ಸನ್ನಿ ಲಿಯೋನ್ ಇದ್ದಂತೆ ಎಂದು ಅಗ್ನಿ ಪತ್ರಿಕೆ ಸಂಪಾದಕ ಅಗ್ನಿ ಶ್ರೀಧರ್ ಟೀಕಿಸಿದರು.
458,ಈ ಹಿಂದೆ ಗೌರಿ ಲಂಕೇಶ್‍ರನ್ನು ಖ್ಯಾತ ಪತ್ರಕರ್ತ ಹಾಗೂ ಹಾಯ್ ಬೆಂಗಳೂರು ಪತ್ರಿಕೆಯ ಸಂಪಾದಕ ರವಿ ಬೆಳಗೆರೆಯವರು ಸುಪಾರಿ ಕೊಟ್ಟು ಹತ್ಯೆ ಮಾಡಿಸಿದ್ದಾರೆ ಎಂಬ ಊಹಾಪೋಹವೂ ಎಬ್ಬಿತ್ತು.
459,ಶಿವಕುಮಾರ್ ಮಾವಲಿ ಸುಪಾರಿ ಕೊಲೆ ರಚಿಸಿದ್ದು
460,ಸುಪಾರಿ ಹವಾಲ ಹಣವನ್ನು ಮುಟ್ಟುಗೋಲು ಹಾಕಲಾಗಿತ್ತು.
461,ಸುಪಾರಿ ಹಂತಕರ ಸಹಾಯ ಪಡೆಯುವ ಆತುರದಲ್ಲಿ ಆ ಮೆಸೇಜ್ ಅನ್ನು ತನ್ನ Read more…
462,ಖ್ಯಾತ ಪತ್ರಕರ್ತ ರವಿ ಬೆಳಗೆರೆ ತಮ್ಮ ಸಹೋದ್ಯೋಗಿ ಸುನೀಲ್ ಹೆಗ್ಗರವಳಿಯವರ ಹತ್ಯೆ ಮಾಡಲು ಸುಪಾರಿ ಹಂತಕರನ್ನು ನಿಯೋಜಿಸಿದ್ದರೆಂಬ ಮಾಹಿತಿ ಹೊರ ಬೀಳುತ್ತಿದ್ದಂತೆಯೇ ರಾಜ್ಯದ ಜನತೆ ಬೆಚ್ಚಿ ಬಿದ್ದಿದ್ದಾರೆ.
463,ಶಿವಾಜಿನಗರದಲ್ಲಿ ವೇಗವಾಗಿ ಬಿಜೆಪಿ ಪಕ್ಷವನ್ನು ಮತ್ತು ಆರೆಸ್ಸೆಸ್ ಸಂಘಟನೆಯನ್ನು ಸಂಘಟಿಸುತ್ತಿರುವದನ್ನು ಸಹಿಸದ ಸಚಿವ ರೋಷನ್ ಬೇಗ್ ಸುಪಾರಿ ಕೊಟ್ಟು ರುದ್ರೇಶ್ ಹತ್ಯೆ ಮಾಡಿಸಿದ್ದಾರೆ ಎಂದು ಸಂಸದೆ ಶೋಭಾ ಕರಂದ್ಲಾಜೆ ಗಂಭೀರವಾಗಿ ಆರೋಪಿಸಿದ್ದರು.
464,"ಕಾರವಾರ: ಸಹೋದ್ಯೋಗಿ ಪತ್ರಕರ್ತ ಸುನೀಲ್ ಹೆಗ್ಗರವಳ್ಳಿ ಹತ್ಯೆಗೆ ಸುಪಾರಿ ನೀಡಿದ್ದ ಆರೋಪದಡಿ ಬಂಧಿಸಲಾಗಿರುವ ಹಾಯ್ ಬೆಂಗಳೂರು ಪತ್ರಿಕೆ ಸಂಪಾದಕ ರವಿ ಬೆಳೆಗೆರೆ ವಿರುದ್ಧದ ತನಿಖೆ ತೀವ್ರಗೊಂಡಿದ್ದು, ಶನಿವಾರ ಉತ್ತರ ಕನ್ನಡ ಜಿಲ್ಲೆಯ ಜೋಯಿಡಾದ ಜಗಲಪೇಟ್‌ನಲ್ಲಿರುವ ಅವರ ನಿವಾಸಕ್ಕೆ ತೆರಳಿ ಸಿಸಿಬಿ ಪೊಲೀಸರು ಶೋಧ ನಡೆಸಿದ್ದಾರೆ."
465,"ಹಾಸನ, ಮೇ 31: ನಗರದ ಸಮೀಪ ದೊಡ್ಡಮಂಡಿಗನಹಳ್ಳಿ ಬಳಿ ಇರುವ ಸುಭಾಷ್ ನಗರದ ಗ್ರಾನೈಟ್ ವ್ಯಾಪಾರಿ ಅಪ್ಪಣ್ಣಗೌಡ ಕೊಲೆಯನ್ನು ಮೊದಲ ಪತ್ನಿಯೇ ಸುಪಾರಿ ಮೂಲಕ ಗಂಡನ ಕೊಲೆ ಪ್ರಕರಣದಲ್ಲಿ ಭಾಗಿಯಾಗಿದ್ದ ಎಲ್ಲಾ ಆರೋಪಿಗಳನ್ನು ಹಾಸನ ನಗರ ಪೊಲೀಸ್ ಠಾಣೆ ಯಶಸ್ವಿ ಕಾರ್ಯಚರಣೆ ನಡೆಸುವ ಮೂಲಕ ಆರೋಪಿಗಳನ್ನು ಬಂಧಿಸಿದ್ದಾರೆ ಎಂದು ಜಿಲ್ಲಾ ಪೊಲೀಸ್ ವರಿಷ್ಠಾಧಿಕಾರಿ ಚೇತನ್ ಸಿಂಗ್ ರಾಥೋಡ್ ತಿಳಿಸಿದ್ದಾರೆ."
466,ಸುಪಾರಿ ಪಡೆದಿದ್ದ ಈ ಯುವಕರು ಕಬ್ಬಿಣದ ರಾಡ್‍ನಲ್ಲಿ ಗೌರಿ ಶಂಕರ್‍‍ನ ತಲೆಗೆ ಹೊಡೆದಿದ್ದಾರೆ.
467,ಶಿವಮೊಗ್ಗ: ತನ್ನ ಅನೈತಿಕ ಸಂಬಂಧಕ್ಕೆ ಮಗ ಅಡಚಣೆಯಾಗ್ತಾನೆಂದು ತಾಯಿಯೇ ಸುಪಾರಿ ಕೊಟ್ಟು ಮಗನನ್ನು ಕೊಲೆ ಮಾಡಿಸಿರುವ ಅಮಾನವೀಯ ಘಟನೆ ಶಿಕಾರಿಪುರ ತಾಲೂಕು ಕಲ್ಮನೆ ಗ್ರಾಮದಲ್ಲಿ ನಡೆದಿದೆ.
468,ರಾಜಶೇಖರ್ ಸಹೋದರಿಯಾದ ಗೌರಮ್ಮ ಸುಪಾರಿ ಕೊಟ್ಟು ತನ್ನ ಅಣ್ಣನನ್ನೇ.
469,ಸುಪಾರಿ ಪಡೆದು ಸ್ನೇಹಿತ ಯುವಕನೊಬ್ಬನನ್ನು ಹತ್ಯೆ ಮಾಡಿದ್ದಾಗಿ ಬಾಯ್ಬಿಟ್ಟಿದ್ದಾನೆ.
470,ಬೆಂಗಳೂರು: ಸಹೋದ್ಯೋಗಿ ಸುನೀಲ್‌ ಹೆಗ್ಗರವಳ್ಳಿ ಹತ್ಯೆಗೆ ಸುಪಾರಿ ಕೊಟ್ಟ ಆರೋಪದ ಮೇಲೆ ಬಂಧನಕ್ಕೊಳಗಾಗಿರುವ ಹಾಯ್‌ ಬೆಂಗಳೂರು ವಾರ ಪತ್ರಿಕೆಯ ಸಂಪಾದಕ ರವಿಬೆಳಗೆರೆಯನ್ನು 14 ದಿನಗಳ ಕಾಲ ನ್ಯಾಯಾಂಗ ಬಂಧನಕ್ಕೆ ಒಪ್ಪಿಸಲಾಗಿದೆ.
471,ಅವರಿಲ್ಲಿ ಸುಪಾರಿ ಕಿಲ್ಲರ್‌ ಆಗಿ ನಟಿಸಿದ್ದಾರಂತೆ.
472,"ಬೆಂಗಳೂರು: ನಾಲ್ಕು ಕೊಲೆ, ಆರುಕೊಲೆ ಯತ್ನ ಸೇರಿದಂತೆ 16 ಗಂಭೀರಅಪರಾಧ ಪ್ರಕರಣಗಳಲ್ಲಿ ಭಾಗಿಯಾಗಿ, ಮೂರು ರಾಜ್ಯಗಳ ಪೊಲೀಸರಿಗೆ ಬೇಕಾಗಿದ್ದ ಸುಪಾರಿ ಹಂತಕ ದಿನೇಶ್‌ ಅಲಿಯಾಸ್ ಗುಜರಿ (36) ಎಂಬಾತನನ್ನು ಬಾಣಸವಾಡಿ ಪೊಲೀಸರು ಕಾಲುಗಳಿಗೆ ಗುಂಡು ಹೊಡೆದು ಬಂಧಿಸಿದ್ದಾರೆ."
473,ಇನ್ನೊಬ್ಬ ನಟ ಯಾರೋ ಸುಪಾರಿ ಕೊಟ್ಟಿರಬಹುದು ಎಂಬ ಮಾತುಗಳು ಚರ್ಚೆಯಾಗ್ತಿದೆ.
474,"ಆದರೆ, ಸುಪಾರಿ ತೆಗೆದುಕೊಂಡ ವ್ಯಕ್ತಿ ನನ್ನನ್ನು ನೋಡಿಯೇ ತನ್ನ ಮನಸ್ಸು ಬದಲಾಯಿಸಿಕೊಂಡ."
475,ಫೇಸ್‍ ಬುಕ್ ಗೆಳತಿಗಾಗಿ ಸುಪಾರಿ ಕೊಟ್ಟು ಪೋಷಕರ ಹತ್ಯೆಗೈದ!
476,ಮಂಗಳೂರು: ಮಾಹಿತಿ ಹಕ್ಕು ಕಾರ್ಯಕರ್ತ ವಿನಾಯಕ ಪಾಂಡುರಂಗ ಬಾಳಿಗ ಅವರನ್ನು ಸುಪಾರಿ ನೀಡಿ ಕೊಲೆ ಮಾಡಿಸಿದ ಆರೋಪದ ಮೇಲೆ ಬಂಧಿಸಲಾಗಿದ್ದ ಉದ್ಯಮಿ ಹಾಗೂ ನಮೋ ಬ್ರಿಗೇಡ್ ಮುಖಂಡ ನರೇಶ್‌ ಶೆಣೈಯನ್ನು ಜಾಮೀನಿನ ಮೇಲೆ ಸೋಮವಾರ ಜಿಲ್ಲಾ ಕಾರಾಗೃಹದಿಂದ ಬಿಡುಗಡೆ ಮಾಡಲಾಗಿದೆ.
477,"ಅದಕ್ಕೆ, ಭಾರತೀಯ ಕಮಾಂಡೋಗಳನ್ನು ಆಪರೇಷನ್ನಿಗಿಳಿಸದೇ, ದಾವೂದ್ ನ ಕಟ್ಟರ್ ಶತ್ರುವಾದ ಚೋಟಾ ರಾಜನ್ ನನ್ನು ನಿಯೋಜಿಸಿದ ಅಜಿತ್ ದೋವಲ್, ರಾಜನ್ ನ ಎರಡು ಜನ ಹುಡುಗರಾದ ವಿಕಿ ಮಲ್ಹೋತ್ರಾ ಮತ್ತು ಫರೀದ್ ತನಾಶಾ ನನ್ನು ದಾವೂದ್ ನನ್ನು ಮುಗಿಸಲು ಸುಪಾರಿ ಕೊಟ್ಟಿದ್ದರು!"
478,ಇತನ ಸ್ನೇಹಿತ ರಿಜ್ವಾನ್ ಎನ್ನುವಾತನೇ ಇಬ್ಬರಿಗೆ ಸುಪಾರಿ ನೀಡಿ ಹತ್ಯೆ ಮಾಡಿಸಿದ್ದಾನೆ ಎಂದು ಪೊಲೀಸರ ತನಿಖೆಯಿಂದ ಪತ್ತೆಯಾಗಿದೆ.
479,ಇವರ ದೋಸ್ತಿ ಸುಪಾರಿ ಘಟಕದಲ್ಲಿ ತಯಾರಾದ ಸೊಳ್ಳೆಬತ್ತಿಗಳು ದೇಶ– ವಿದೇಶಗಳಿಗೆ ಹಾರಿವೆ.
