Index,Sentence
0,ನ 7ರ ರಾತ್ರಿ ಮೇಯರ್ ಸಹೋದರನ ಪುತ್ರ ಫಯಾಜ್‌ ಮುಶ್ರೀಫ್‌ನನ್ನು ಸುಪಾರಿ ಹಂತಕರು ಕೊಲೆಗೈದ ರೀತಿ ಜಿಲ್ಲೆಯನ್ನೇ ಬೆಚ್ಚಿ ಬೀಳಿಸಿತ್ತು.
1,ಬೆಳಗಾವಿ: ಕೈಹಿಡಿದು ಬಾಳಪೂರ್ತಿ ಜೀವನ ಸಂಗಾತಿಯಾಗಿರುವೆ ಎಂದು ಸಪ್ತಪದಿ ತುಳಿದ ಹೆಂಡತಿಯೇ ಗಂಡನನ್ನು ಕೊಲ್ಲಿಸಲು ಸುಪಾರಿ ನೀಡಿದ ಭಯಾನಟಕ ಘಟನೆ ಬೆಳಗಾವಿಯ ಗೋಕಾಕ ಹೊರವಲಯದ ಕಡಬಗಟ್ಟಿ ಗ್ರಾಮದಲ್ಲಿ ನಡೆದಿದೆ.
2,ಹೆಗ್ಗರವಳ್ಳಿ ಹತ್ಯೆಗೆ ಸುಪಾರಿ ನೀಡಿಲ್ಲ ಎನ್ನುತ್ತಿರುವ ಪತ್ರಕರ್ತ
3,ಅಂತಹ ನಾನು 15 ವರ್ಷಗಳಿಂದ ಜತೆಗಿರುವವನನ್ನು ಕೊಲ್ಲಲು ಸುಪಾರಿ ಕೊಡಬೇಕಾ ಎಂದು ಪ್ರಶ್ನಿಸಿದ್ದಾರೆ.
4,ಚನ್ನರಾಯಪಟ್ಟಣ: ಮಂಡ್ಯ ಜಿಲ್ಲೆ ನಾಗಮಂಗಲ ಪೊಲೀಸ್ ಠಾಣಾ ವ್ಯಾಪ್ತಿಯಲ್ಲಿ ವ್ಯಕ್ತಿಯೊಬ್ಬರನ್ನು ಕೊಲೆಗೈದ ರಿವಾಲ್ವರ್ ಇರಿಸಿದ್ದ ಬ್ಯಾಗನ್ನು ಸಾರಿಗೆ ಬಸ್ಸಿನಲ್ಲಿ ಮರೆತು ಹೋಗಿದ್ದ ರಿವಾಲ್ವರ್ ಉತ್ತರ ಭಾರತ ಮೂಲದ ಇಬ್ಬರು ಸುಪಾರಿ ಕೊಲೆಗಾರರು ಚನ್ನರಾಯಪಟ್ಟಣ ನಗರ ಪೊಲೀಸರಿಗೆ ಸಿಕ್ಕಿಬಿದ್ದಿದ್ದಾರೆ.
5,11): ಪತ್ರಕರ್ತ ಸುನಿಲ್ ಹೆಗ್ಗರವಳ್ಳಿ ಅವರ ಹತ್ಯೆಗೆ ಪತ್ರಕರ್ತ ರವಿ ಬೆಳಗೆರೆ ಅವರು ಸುಪಾರಿ ನೀಡಿದ್ದಾರೆನ್ನಲಾದ ಪ್ರಕರಣಕ್ಕೆ ಸಂಬಂಧಿಸಿದಂತೆ 3ನೇ ಆರೋಪಿ ವಿಜು ಬಡಿಗೇರ್‍ನನ್ನು ಪೊಲೀಸರು ಬಂಧಿಸಿದ್ದಾರೆ.
6,ಈ ಎಲ್ಲಾ ಘಟನೆಗಳನ್ನು ಅವಲೋಕಿಸಿದರೆ ಹತ್ಯೆ ಒಂದು ರೀತಿ ಸುಪಾರಿ ಕೊಲೆಯ ರೀತಿಯಲ್ಲಿದೆ.
7,09): ಸಹೋದ್ಯೋಗಿ ಸುನೀಲ್ ಹೆಗ್ಗರವಳ್ಳಿ ಅವರ ಸುಪಾರಿ ಹತ್ಯೆ ಮಾಡಲು ಉದ್ದೇಶಿಸಿದ ಪ್ರಕರಣದಲ್ಲಿ ಹಾಯ್ ಬೆಂಗಳೂರು ವಾರಪತ್ರಿಕೆಯ ಸಂಪಾದಕ ರವಿ ಬೆಳಗೆರೆ ಬಂಧನದ ನಂತರ ಪ್ರಕರಣ ಮತ್ತೊಂದು ತಿರುವು ಪಡೆದುಕೊಂಡಿದ್ದು ಅವರ 2ನೇ ಪತ್ನಿ ಕೂಡ ನಾಪತ್ತೆಯಾಗಿದ್ದಾರೆ .
8,ನಟರಾಜ್ ಹತ್ಯೆಗೆ ಸುಪಾರಿ ನೀಡಿದ್ದವರು ಯಾರೆಂಬ ರಹಸ್ಯ ಬಯಲಾಗಲೇ ಇಲ್ಲ.
9,ಇದಕ್ಕೆ ಕಾರಣ ಸಿದ್ದರಾಮಯ್ಯ ಅವರು ಇಂಥ ಸಂಘಟನೆಗಳಿಗೆ ಸುಪಾರಿ ಕೊಟ್ಟು ರಾಜ್ಯದಲ್ಲಿ ಮಾಸ್ ಕಿಲ್ಲರ್ ಆಗಿ ಗುರುತಿಸಿಕೊಂಡಿದ್ದಾರೆ ಎಂದು ವಾಗ್ದಾಳಿ ನಡೆಸಿದರು.
10,ಈ ಧಾರಾವಾಹಿಗಳ ಖಳನಾಯಕಿಯರು ಸುಪಾರಿ ಕೊಟ್ಟು ಕೊಲೆ ಮಾಡಿಸಲೂ ಹಿಂಜರಿಯುವುದಿಲ್ಲ.
11,"ಪತ್ರಕರ್ತ ಸುನೀಲ ಹೆಗ್ಗರವಳ್ಳಿ ಕೊಲೆಗೆ ಸುಪಾರಿ ಪಡೆದಿದ್ದಾನೆ ಎನ್ನಲಾದ ಶಶಿಧರ ಮುಂಡೇವಾಡಿ ಈಗ ಮತ್ತೆ ಸುದ್ದಿಯಾಗಿದ್ದು, ಪೊಲೀಸರ ಮೇಲೆ ಹಲ್ಲೆ ನಡೆಸಿದ್ದಾನೆ."
12,ಆತನ ವಿಚಾರಣೆ ವೇಳೆ ರವಿ ಬೆಳೆಗೆರೆ ಅವರು ಸಹೋದ್ಯೋಗಿ ಸುನೀಲ್ ಹೆಗ್ಗರವಳ್ಳಿ ಹತ್ಯೆಗೆ ಸುಪಾರಿ ನೀಡಿರುವ ಆರೋಪ ಕೇಳಿಬಂದಿತ್ತು.
13,20ರಂದು ಇಲ್ಲಿನ ವಿಜಯ ಸುಪಾರಿ ಸಂಸ್ಥೆಯಲ್ಲಿ ಪೂರ್ವ ತಯಾರಿ ಸಭೆ ನಡೆಯಿತು.
14,ಸುನಿಲ್ ಹೆಗ್ಗರವಳ್ಳಿರನ್ನ ಸಾಯಿಸಲು ನನ್ನ ತಂದೆ ಕೊಲೆಗೆ ಸುಪಾರಿ ಕೊಟ್ಟಿರುವುದು ಸುಳ್ಳು.
15,"ಸತ್ಯಪ್ರಸಾದ್‌ನಿಂದ ಸುಪಾರಿ ಪಡೆದಿದ್ದ ಆರೋಪಿಗಳಾದ ಹಳೇ ಬೈಯ್ಯಪ್ಪನಹಳ್ಳಿಯ ಕ್ಯಾಬ್‌ ಚಾಲಕ ಪ್ರಶಾಂತ್‌(20), ಕಗ್ಗದಾಸಪುರದ ಪ್ರೇಮ್‌(31), ಹೊಸಕೋಟೆಯ ದಿನೇಶ್‌(26), ಶಿಡ್ಲಘಟ್ಟದ ಲೋಕೇಶ್‌(28), ಕಗ್ಗದಾಸಪುರದ ಕುಶಾಂತ್‌(30), ಸಂತೋಷ್‌(25), ಮಲ್ಲೇಶಪಾಳ್ಯದ ರವಿ(37) ಮತ್ತು ದಿನೇಶನ ಪತ್ನಿ ಸಯೀದಾ(25) ಬಂಧಿತರು."
16,"ಸಹಿಷ್ಣು ಎಂದರೆ ತಾಳ್ಮೆ, ಸಹನೆಗೆ ಇನ್ನೊಂದು ಹೆಸರು, ಹಿರಿಯ ನಟ, ವಿಶ್ವನಾಥ್, ಅಶೋಕ್ ಹಾಗೂ ಸಂಪತ್ ಪ್ರಮುಖ ಪಾತ್ರಗಳಲ್ಲಿ ಕಾಣಿಸಿಕೊಂಡಿರುವ ಈ ಚಿತ್ರದಲ್ಲಿ ವಿಚಾರವಾದಿಯೊಬ್ಬನನ್ನು ಹತ್ಯೆ ಮಾಡಲು ಸುಪಾರಿ ತೆಗೆದುಕೊಳ್ಳುವ ಸುಪಾರಿಕಿಲ್ಲರ್ಸ್ ಹಾಗೂ ವಿಚಾರವಾದಿಯ ಕಥೆಯನ್ನು ಹೇಳಲಾಗಿದೆ."
17,21: ಗಂಡನನ್ನು ಬಿಟ್ಟು ಪ್ರಿಯಕರನ ಜೊತೆ ಚಲ್ಲಾಟವಾಡುತ್ತಿದ್ದ ಮಗಳಿಗೆ ತಂದೆ ಸಹಕರಿಸಲಿಲ್ಲ ಎಂಬ ಕಾರಣಕ್ಕೆ ಸುಪಾರಿ ನೀಡಿ ಕೊಲೆಮಾಡಿಸಿರುವ ಘಟನೆ ಬೆಳಗಾವಿಯ ಗೋಕಾಕ ಹೊರವಲಯದ ಕಡಬಗಟ್ಟಿ ಗ್ರಾಮದಲ್ಲಿ ನಡೆದಿದೆ.
18,Home ಕನ್ನಡ ವಾರ್ತೆಗಳು ರಾಷ್ಟ್ರೀಯ ಮಗನ ಕೊಲೆಗೆ ಸುಪಾರಿ ಕೊಟ್ಟ ತಾಯಿ
19,ಬೆಂಗಳೂರು: ಗಂಡನೇ ಸುಪಾರಿ ಕೊಟ್ಟು ಹೆಂಡತಿಯನ್ನು ಕೊಲೆ ಮಾಡಿಸಿರುವ ಘಟನೆ ಬೆಂಗಳೂರಿನ ವೈಯಾಲಿಕಾವಲ್ ಠಾಣೆ ವ್ಯಾಪ್ತಿಯಲ್ಲಿ ನಡೆದಿದೆ.
20,ಬಂಧಿತರ ಪೈಕಿ ಒಬ್ಬ ಬಾಯ್ಬಿಟ್ಟು ಆಸಿಫ್ ಅಲಿ ಎಂಬುವರು ನಮಗೆ ಸುಪಾರಿ ನೀಡಿದ್ದರು ಎಂದಿದ್ದಾನೆ.
21,ಫೆಬ್ರವರಿ 5ರಂದು ಮಹದೇವಪುರ ರಿಂಗ್ ರೋಡ್​ ಫ್ಲೈ ಓವರ್ ಸಮೀಪ ಲಕ್ಷ್ಮಣ್ ಎಂಬ ವ್ಯಕ್ತಿಯನ್ನ ಸುಪಾರಿ ಹಂತಕರು ಕೊಲೆ ಮಾಡಿದ್ದರು.
22,ರಾಕಿಂಗ್​ ಸ್ಟಾರ್​ ಯಶ್​ ಹತ್ಯೆಗೆ ಸುಪಾರಿ ನೀಡಲಾಗಿದೆ ಎಂಬ ಸುದ್ದಿಗಳ ಹಿನ್ನೆಲೆಯಲ್ಲಿ ತುರ್ತು ಸುದ್ದಿಗೋಷ್ಠಿ ನಡೆಸಿದ ಯಶ್​ ಈ.
23,"ಇನ್ನು ಸುಪಾರಿ ಹತ್ಯೆ-ದೇಶಿ ಅಕ್ರಮ ಶಸ್ತ್ರಾಸ್ತ್ರಗಳಂಥ ಅಪರಾಧ ಕೃತ್ಯಗಳಿಂದ ಜಿಲ್ಲೆಗೆ ಕುಖ್ಯಾತಿ ತಂದಿರುವ ಜನರಿಂದ ಭಾಗಪ್ಪ ಹರಿಜನ ಮೇಲೆ ನಗರದ ಕೋರ್ಟ್‌ ಆವರಣಲ್ಲಿಯೇ ಗುಂಡಿನ ದಾಳಿ ನಡೆದು, ಐದು ಗುಂಡು ದೇಹ ಹೊಕ್ಕರೂ ಜೀವಾಪಾಯದಿಂದ ಪಾರಾಗಿದ್ದಾನೆ."
24,ಮೂವರೂ ಸುಪಾರಿ ಕೊಡುವುದು ಅವನೊಬ್ಬನಿಗೆ.
25,ಮೈಸೂರಿನಲ್ಲಿ ಪತ್ನಿಯಿಂದಲೇ ಪತಿಯ ಕೊಲೆಗೆ ಸುಪಾರಿ
26,"ಸಹಪತ್ರಕರ್ತನಾದ ಸುನಿಲ್ ಹೆಗ್ಗರವಳ್ಳಿಗೆ ಸುಪಾರಿ ಕೊಟ್ಟ ಆಪಾದನೆ ಮೇರೆಗೆ ಬಂಧಿಸಿದ ಸಿಸಿಬಿ ಪೋಲಿಸರು ವಿಚಾರಣೆ ನಡೆಸುತ್ತಿರುವಾಗಲೇ, ಫೋನ್ ಕರೆ ಮಾಡಿ, ಸುನಿಲ್ ಹೆಗ್ಗರವಳ್ಳಿಗೆ ಬೆದರಿಕೆ ಹಾಕಿದ್ದೂ ಸೇರಿಕೊಂಡು, ಇನ್ನಷ್ಟು ವಿವಾದ ಸೃಷ್ಟಿಸಿದ ರವಿ ಬೆಳಗೆರೆಗೆ ಅನಾರೋಗ್ಯದ ಹಿನ್ನೆಲೆಯಲ್ಲಿ, ಡಿಸೆಂಬರ್ 23 ರ ತನಕ ನ್ಯಾಯಾಂಗ ಬಂಧನದಲ್ಲಿಡಲು ಆದೇಶಿಸಿರುವ ನ್ಯಾಯಾಧೀಶ ಜಗದೀಶ್, ಹೆಚ್ಚಿನ ವಿಚಾರಣೆ ನಡೆಸಲು ಆದೇಶಿಸಿದ್ದಾರೆ!"
27,"ಮಂಗಳೂರು : ಬಾಳಿಗಾ ಹತ್ಯೆ ಪ್ರಕರಣ, ಸುಪಾರಿ ಹಂತಕ ಶಿವ ಬಂಧನ?"
28,ಕೊಲೆಗೆ ಹಫ್ತಾ ಅಥವಾ ಸುಪಾರಿ ಕೊಟ್ಟರೆ […]
29,ಪತ್ನಿ ಹತ್ಯೆಗೆ ಸುಪಾರಿ ಕೊಟ್ಟು ಆರೋಪಿಗಳ ಗುಂಡಿಗೆ ತಾನೇ ಗಾಯಗೊಂಡ ಪತಿ ಮಹಾಶಯ
30,ಕಳೆದ ನಾಲ್ಕು ದಿನಗಳ ಹಿಂದೆ ನಗರದಲ್ಲಿ ಠಿಕಾಣಿ ಹೂಡಿದ್ದ ಹಂತಕರ ತಂಡ ಸೋಮವಾರ ರಾತ್ರಿ ಎಸ್‍ಎಸ್ ಹೈಟೆಕ್ ಆಸ್ಪತ್ರೆಯ ಬಸವರಾಜ್ ಡಾಬಾ ಹಿಂಭಾಗದಲ್ಲಿ ಹೊಂಚು ಹಾಕುತ್ತಿರುವ ಬಗ್ಗೆ ಬಂದ ಮಾಹಿತಿ ಮೇರೆಗೆ ಕೆಟಿಜೆ ನಗರ ಠಾಣಾ ಪಿಎಸ್ಸೈ ರಾಜು ಮತ್ತು ಸಿಬ್ಬಂದಿ ದಾಳಿ ನಡೆಸಿ ಎಲ್ಲ 7 ಜನರನ್ನು ವಶಕ್ಕೆ ಪಡೆದು ವಿಚಾರಣೆಗೆ ಗುರಿಪಡಿಸಿದಾಗ ಬುಳ್‍ ನಾಗನ ಹತ್ಯೆಗೆ ಸುಪಾರಿ ಪಡೆದಿರುವುದು ಬೆಳಕಿಗೆ ಬಂದಿದೆ ಎಂದರು.
31,ಸುಪಾರಿ ಹಂತಕರ ಕೈವಾಡವಿರಲಾರದು
32,"ಕೊಲೆಗಡುಕರ ಹಜ್ಜೆಗುರುತು ಹಿಡಿದು ತನಿಕೆ ನಡೆಸಿದ ವಿವರ: ತನಿಖಾ ತಂಡದವರು ಕೊಲೆಯ ಪ್ರಕರಣದ ಬಗ್ಗೆ ತನಿಖೆಯನ್ನು ಕೈಕೊಂಡು ಆ ದಿನ ಕೊಲೆಯಾದ ಸ್ಥಳದ ಟಾವರ ಡಿಟೆಲ್ಸ ಸಂಗ್ರಹಿಸಿ ಸಂಶಯಾಸ್ಪದವಾದ ಕಾಲ ಡಿಟೇಲ್ಸಗಳನ್ನು ಕಲೆಹಕಿ ಮಾಹಿತಿ ಸಂಗ್ರಹಿಸಿ ಸಂಶಯಾಸ್ಪದ ವ್ಯಕ್ತಿಗಳನ್ನು ವಿಚಾರಣೆಗೆ ಒಳಪಡಿಸಿದಾಗ ಅದರಲ್ಲಿ 1್ವ ಪ್ರಕಾಶ ಶಂಕರ ಸಿಂಗಡೆ ಸಾ: ಬಿಕ್ಕೇರಿ ತಾ: ರಾಯಬಾಗ ಇತನ ಕಾಲ ಡಿಟೇಲ್ಸ ನೋಡಲಾಗಿ ಇತನೊಂದಿಗೆ ಗುನ್ನೆ ನಡೆದ 5 ದಿನಗಳ ಹಿಂದಿನಿಂದಾ ಘಟನೆಯ ನಡೆದ ದಿನದವರೆಗೆ ಸಂಪರ್ಕವಾದ ಮೋಬೈಲ್ ನಂಬರಗಳನ್ನು ಪರೀಶೀಲನೆ ಮಾಡಿದಾಗ ಅದರಲ್ಲಿ 1್ವ ಅಜೀತ ಬಜಂತ್ರಿ 2್ವ ಕಾಶಿನಾಥ 3್ವ ಶ್ರೀಕಾಂತ ಗಂಡೋಸಿ 4್ವ ನಾಗರಾಜ ಪೂಜಾರಿ ಇವರು ಪ್ರಕಾಶ ಶಂಕರ ಸಿಂಗಡೆ ಇತನೊಂದಿಗೆ ಸತತವಾಗಿ ಸಂಪರ್ಕದಲ್ಲಿರುವದು ತಿಳಿದು ಬಂದಿದ್ದು, ಅದರಂತೆ ಅಜೀತ ಬಜಂತ್ರಿಯನ್ನು ವಿಚಾರಣೆಗೆ ಒಳಪಡಿಸಿದಾಗ ಅಜೀತನು ತಾನು ಹಾಗೂ ಪ್ರಕಾಶ, ಕಾಶಿನಾಥ ಶ್ರೀಕಾಂತ, ನಾಗರಾಜ ಎಲ್ಲರೂ ಕೂಡಿ ಹನಮಂತ ಕಡ್ಲಿಮಟ್ಟಿ ಹಾಗೂ ಉಮೇಶ ಪೂಜಾರಿ ಇವರ ಮಧ್ಯ ಇದ್ದ ಆಸ್ತಿಯ ವಿವಾದದಕ್ಕೆ ಸಂಬಂಧಿಸಿದಂತೆ ರಾಮಾಸ್ವಾಮಿ ದೇವದುರ್ಗ ಇತನನ್ನು ಕೊಲೆ ಮಾಡಲು ಹನಮಂತ ಯಮನಾಳ ಇತನು ಶ್ರೀಕಾಂತನ ಮೂಲಕ ಕೊಲೆ ಮಾಡಲು ಸುಪಾರಿ ಹಣ ಕೊಟ್ಟಿದ್ದು ಇರುತ್ತದೆ."
33,"ಒಟ್ಟಾರೆ ಯಾವುದೇ ಪ್ರಕರಣಕ್ಕೆ ಸಂಬಂಧಿಸಿ ಸುಪಾರಿ ತಂಡದಿಂದಲೇ ಈ ಕೊಲೆ ಕೃತ್ಯ ನಡೆಸಲಾಗಿದೆ ಎಂದು ಪೊಲೀಸರು ಶಂಕಿಸಿದ್ದು, ತನಿಖೆ ಕೈಗೊಂಡಿದ್ದಾರೆ."
34,"ದೀಪಕ್ ರಾವ್ ಹತ್ಯೆಗೆ ಬಿಜೆಪಿ ಕಾರ್ಪೋರೇಟರ್ ಸುಪಾರಿ ಕೊಟ್ಟಿದ್ದಾರೆ ಎಂಬ ಜೆಡಿಎಸ್ ರಾಜ್ಯಾಧ್ಯಕ್ಷ ಕುಮಾರಸ್ವಾಮಿ ಬಾಂಬ್ ಸಿಡಿಸಿದ ಬೆನ್ನಲ್ಲೇ, ದೀಪಕ್ ಹತ್ಯೆಗೆ ಎಸ್ ಡಿಪಿಐ ನಿಂದ 50 ಲಕ್ಷ ರೂ."
35,ಅದರಂತೆ ಕಶ್ಯಪ್ ಸುಪಾರಿ ಕಿಲ್ಲರ್ ಆದ ರೋಹನ್ ಕುಮಾರ್ ಗೆ ವರ್ಮಾರನ್ನು ಕೊಲೆ ಮಾಡುವ ಜವಾಬ್ದಾರಿ ವಹಿಸಿದ್ದ.
36,ಡೋರಿನ್ ಅವರು ₹ 30 ಲಕ್ಷಕ್ಕೆ ನಮಗೆ ಸುಪಾರಿ ಕೊಟ್ಟರು.
37,ಇದನ್ನೂ ಓದಿ: ಶನಿ ಮುಖಿ ಕೊಲೆಗೆ ಸುಪಾರಿ ಒಂದು ಕೇಡು – ನೋಟ್ಸ್.
38,ಗೃಹ ಸಚಿವರೂ ನನ್ನ ಹತ್ಯೆಗೆ ಸುಪಾರಿ ನೀಡಲಾಗಿದೆ ಎಂಬ ಸುದ್ದಿಯನ್ನು ನಿರಾಕರಿಸಿದ್ದಾರೆ.
39,ಸುಪಾರಿ ಕಿಲ್ಲರ್‌ಗಳ ಆರ್ಭಟವಿದೆ.
40,ಈ ಬಾರಿ ರಾಜಸ್ಥಾನದಲ್ಲಿ ಪಾನ್ ಮಸಾಲ ಮತ್ತು ಸುವಾಸಿತ ಸುಪಾರಿ ಉತ್ಪನ್ನಗಳ ತಯಾರಿ ಮತ್ತು ಮಾರಾಟಕ್ಕೆ ನಿರ್ಬಂಧ ಹೇರಿರುವುದರಿಂದ ರಾಜ್ಯದ ಅಡಕೆ ಮಾರುಕಟ್ಟೆಯಲ್ಲಿ ಬೆಲೆ ಇಳಿಕೆಯಾಗುವ ಸಾಧ್ಯತೆ ಇದೆ ಎಂದು ಹೇಳಲಾಗಿದೆ.
41,ಸಹೋದ್ಯೋಗಿ ಹತ್ಯೆಗೆ ಸುಪಾರಿ ನೀಡಿದ್ದೇಕೆ ಮತ್ತು ಶಾರ್ಪ್ ಶೂಟರ್ ಶಶಿಧರ್ ಮುಂಡೆವಾಡನಿಗೂ ಹಾಗೂ ರವಿಬೆಳಗೆರೆಗೂ ಇರುವ ಸಂಪರ್ಕದ ಬಗ್ಗೆ ಮಾಹಿತಿ ಸಂಗ್ರಹಿಸಿದ್ದಾರೆ.
42,ಅದಾದ ಎರಡು ದಿನಗಳ ಬಳಿಕ ಪಾನ್‌ ಸುಪಾರಿ ಬಜಾರ್‌ನಲ್ಲಿ ಅಂತಹುದೇ ಕೃತ್ಯ ನಡೆದಿತ್ತು.
43,"ಪತಿ ನಾಗರಾಜ್ ಬದುಕಿದ್ದರೆ ನಮ್ಮ ಅಕ್ರಮ ಸಂಬಂಧ ಮುಂದುವರೆಸುವುದು ಸಾಧ್ಯವಿಲ್ಲ ಎನ್ನುವ ನಿರ್ಧಾರಕ್ಕೆ ಬಂದ ಮಮತಾ ಪ್ರಿಯಕರ ಪ್ರಶಾಂತ್ ಜೊತೆ ಚರ್ಚಿಸಿ ಇಬ್ಬರು ಸೇರಿ ಕೊಲೆಗೆ ಸಂಚು ರೂಪಿಸಿದರು ಅದರಂತೆ ಕೊಲೆಗಾರರಿಗೆ ಸುಪಾರಿ ಕೊಡಲು ಎರಡು ತಾಳಿ, ಎರಡು ಚಿನ್ನದ ಕಾಸು, ಚಿನ್ನದ ಗುಂಡುಗಳಿರುವ ಮಾಂಗಲ್ಯಸರವನ್ನು ನೀಡಲು ಮುಂದಾಗಿ ಒಂದೂವರೆ ಲಕ್ಷ ಹಣ ಸೇರಿಸಿದ್ದರು."
44,ನಂತರ ಅವರಿಂದ ಸುಪಾರಿ ಕೊಲೆಯ ಕತೆಯನ್ನು ನಾನು ಕೇಳುತ್ತಿದ್ದಂತೆಯೇ ಇದನ್ನು ಪುಸ್ತಕ ಮಾಡುವುದಾಗಿ ಹೇಳಿದ್ದೆ.
45,"ಬಾಡಿಗೆ ಹಂತಕರನ್ನು ಬಂಧಿಸಿದರೆ ಸಾಲದು, ಸುಪಾರಿ ಕೊಟ್ಟವರನ್ನೂ ಬಂಧಿಸಬೇಕು: ಅಮೃತ್ ಶೆಣೈ"
46,ಇನ್ನು ಪತ್ರಕರ್ತ ಸುನೀಲ್ ಹೆಗ್ಗರವಳ್ಳಿ ಸುಪಾರಿ ಕೊಲೆಗೆ ಪ್ರಯತ್ನಿಸಿದ್ದರು ಎಂಬ ಈಗಿನ ಆರೋಪದ ಬಗ್ಗೆ ಅವರೇ ಉತ್ತರ ನೀಡುತ್ತಾರೆ ಎಂದು ಮಾಧ್ಯಮಗಳಿಗೆ ತಿಳಿಸಿದ್ದಾರೆ.
47,ಅತ್ತಿಗೆಯನ್ನು ಕೊಲ್ಲಲು ಸುಪಾರಿ ಕೊಟ್ಟ ಮೈದುನ; ಕಾಫಿ ಎಸ್ಟೇಟ್​ ಆಸೆಗೆ ಮಡಿಕೇರಿಯಲ್ಲೊಂದು ಕೊಲೆ ಸಂಚು
48,ಸದ್ಯ ಸುಪಾರಿ ಕಿಲ್ಲರ್ ನನ್ನು ಪೊಲೀಸರು ತೀವ್ರ ವಿಚಾರಣೆಗೆ ಒಳಪಡಿಸುತ್ತಿದ್ದಾರೆ.
49,ತಾನು ಪ್ರೀತಿಸುತ್ತಿದ್ದ ಎನ್ನಾರೈ ಯುವಕನ ಮದುವೆಯಾಗಲು ಕಾನ್‌ಸ್ಟೇಬಲ್ ಪತಿಯನ್ನು ಸುಪಾರಿ ಹಂತಕರ ಮೂಲಕ ಮುಗಿಸಿದ ಪತ್ನಿ
50,ಕಳೆದ ವರ್ಷ ಸೈಕಲ್ ರವಿ ಬಂಧನವಾದಾಗ ಸಿಸಿಬಿ ಪೋಲಿಸರ ತನಿಖೆಯಲ್ಲಿ ನಟ ಯಶ್ ಅವರ ಹತ್ಯೆಗೆ ಸೈಕಲ್ ರವಿ ಮತ್ತು ಸ್ಲಂ ಭರತ್ ನಿಗೆ ಸುಪಾರಿ ಕೊಟ್ಟಿದ್ದ ವಿಚಾರ ಹೊರ ಬಿದ್ದಿತ್ತು.
51,"ನೀರಿಕ್ಷಿತ ಎಂಬಂತೆ ರವಿ ಬೆಳಗೆರೆ ಶನಿಮುಖಿ ಕೊಲೆಗೆ ಸುಪಾರಿ ಒಂದು ಕೇಡು ಎಂಬ ತಲೆಬರಹದಡಿ ವರದಿ ಪ್ರಕಟಿಸಿದ್ದು, ನೋಟ್ಸ್​ ಫ್ರಮ್​ ಸೆಂಟ್ರಲ್​​ ಜೈಲ್​ ಎಂದು ಬರೆದುಕೊಂಡಿದ್ದಾರೆ."
52,"February 10, 2017 Sri Raghav Brutal Murder, Prabha, Scene, Sydney, ಪ್ರಭಾ ಅರುಣ್‍ಕುಮಾರ್, ಸಿಡ್ನಿ, ಸುಪಾರಿ"
53,"ಸುಪಾರಿ ಹಂತಕ: ಸುಪಾರಿ ಹಂತಕನಾಗಿದ್ದ ಬಿಡ್ಡ, 2016ರಲ್ಲಿ ₹50 ಲಕ್ಷ ಸುಪಾರಿ ಪಡೆದು ಕಾಡುಗೋಡಿಯಲ್ಲಿ ವ್ಯಕ್ತಿಯೊಬ್ಬರನ್ನು ಕೊಲೆ ಮಾಡಿದ್ದ."
54,ಅತ್ತಿಗೆಯ ಕೊಲೆಗೆ 2 ಲಕ್ಷ ಸುಪಾರಿ ಕೊಟ್ಟಿದ್ದ ಕಗ್ಗಲಹಳ್ಳಿಯ ನಾಗೇಶ್ ಹಾಗೂ ಸುಪಾರಿ ಪಡೆದು ಕೊಲೆ ಮಾಡಿದ್ದ ಲಕ್ಷ್ಮೀಶನನ್ನು ಬಂಧಿಸಿ ಮುಂದಿನ ತನಿಖೆ ಕೈಗೊಳ್ಳಲಾಗಿದೆ.
55,ಸಾಮಾನ್ಯವಾಗಿ ಸುಪಾರಿ ತೆಗೆದುಕೊಳ್ಳುವವರು ಮಾತ್ರ ಒಂದೇ ಮಾದರಿಯಲ್ಲಿ ಹತ್ಯೆಗೈಯಲ್ಲು ಸಾಧ್ಯವಿರುತ್ತದೆ.
56,ಸುಪಾರಿ ಕೊಟ್ಟ ಟೀಂ ಕೊಲೆ ಆರೋಪಿಗಳ ಜೊತೆ ನೇರ ಸಂಪರ್ಕದಲ್ಲಿರಲಿಲ್ಲ.
57,ರುದ್ರೇಶ್ ಕೊಲೆಗೆ ಕಾಂಗ್ರೆಸ್ ಸುಪಾರಿ ಕೊಟ್ಟಿದೆ ಎನ್ನುವುದಕ್ಕೆ ಇವರ ಬಳಿ ಸಾಕ್ಷಿ ಇದೆಯೇ ಎಂದು ಪ್ರಶ್ನಿಸಿದರು.
58,ಸ್ಥಳೀಯ ರೌಡಿಗಳು ಸುಪಾರಿ ಪಡೆದು ಶ್ರೀನಿವಾಸ್ ಅವರನ್ನು ಕೊಲೆ ಮಾಡಿರುವ ಅನುಮಾನ ದಟ್ಟವಾಗಿದೆ ಎಂದು ಸಿಸಿಬಿ ಅಧಿಕಾರಿಗಳು ಹೇಳಿ ದ್ದಾರೆ.
59,ಗೌರಿ ಲಂಕೇಶ್ ಹತ್ಯೆಗೆ ಸುಪಾರಿ ಕೊಟ್ಟಿದ್ದು ಯಾರು ಎಂಬ ಶೋಧವನ್ನೂ ಪೊಲೀಸರು ಮಾಡುತ್ತಿದ್ದಾರೆ.
60,"ಬೆಂಗಳೂರು, ಡಿಸೆಂಬರ್ 11: ಪತ್ರಕರ್ತ ಸುನೀಲ್ ಹೆಗ್ಗರವಳ್ಳಿ ಅವರನ್ನು ಕೊಲ್ಲಲು ಸುಪಾರಿ ನೀಡಿದ ಪ್ರಕರಣಕ್ಕೆ ಸಂಬಂಧಿಸಿದಂತೆ ಹಾಯ್ ಬೆಂಗಳೂರು ಸಂಪಾದಕ ರವಿ ಬೆಳಗೆರೆ ಅವರು 14 ದಿನಗಳ ಕಾಲ ನ್ಯಾಯಾಂಗ ಬಂಧನಕ್ಕೊಳಪಟ್ಟಿದ್ದಾರೆ."
61,"ವೈಯಕ್ತಿಕ ದ್ವೇಷದಿಂದ ನಡೆದ ಕೃತ್ಯ, ಸುಪಾರಿ ಕಿಲ್ಲರ್ಸ್ ಬಳಕೆಯಾಗಿದೆ ಎಂದು ಪೊಲೀಸರು ಹೇಳಿದ್ದಾರೆ."
62,ಸುನೀಲ್ ನ ಹತ್ಯೆಗೆ ನಾನು 30 ಲಕ್ಷ ಸುಪಾರಿ ಕೊಟ್ಟೆನಂತೆ.
63,"2012ರಲ್ಲಿ ತಂಬಾಕು, ಅಡಿಕೆಯಲ್ಲದೆ ಕೃತಕ ಸುವಾಸನೆ ಹೊಂದಿದ ಸುಪಾರಿ ಉತ್ಪನ್ನಗಳ ಮೇಲೆ ವಿಧಿಸಲಾಗಿದ್ದ ನಿಷೇಧವನ್ನು ಮಹಾರಾಷ್ಟ್ರ ಸರ್ಕಾರ ಜುಲೈನಿಂದ ಪುನಃ ಜಾರಿಗೊಳಿಸಿದೆ."
64,ಸ್ಯಾಂಂಡಲ್ ವುಡ್ ಖ್ಯಾತ ನಟರೊಬ್ಬರ ಹತ್ಯೆಗೆ ಸುಪಾರಿ ಪಡೆದು ಹತ್ಯೆಗೆ ಸಂಚು ರೂಪಿಸಿದ್ದ ರೌಡೀ ಶೀಟರ್ ಗಳನ್ನು ಅರೆಸ್ಟ್ ಮಾಡಲಾಗಿದೆ.
65,ಬೆಂಗಳೂರು: ಮುಂದಿನ ಎಲೆಕ್ಷನ್‍ ನಲ್ಲಿ ಶಾಸಕ ಜಮೀರ್ ಎದುರಾಳಿಯಾಗಿ ಸ್ಪರ್ಧೆ ಮಾಡಲು ತಯಾರಾಗಿದ್ದ ವ್ಯಕ್ತಿಯ ಹತ್ಯೆಗೆ ಸುಪಾರಿ ನೀಡಿದ್ದ ಪ್ರಕರಣ ಬೆಳಕಿಗೆ ಬಂದಿದೆ.
66,ಗಂಗಾವತಿ; ಆಸ್ತಿ ವಿವಾದ ಹಿನ್ನೆಲೆಯಲ್ಲಿ ವ್ಯಕ್ತಿಯೊಬ್ಬರನ್ನು ಕೊಲೆಮಾಡಿ ತಲೆ ಮರೆಸಿಕೊಂಡಿದ್ದ ಆರೋಪಿಗಳು ಮತ್ತು ಕೊಲೆಗೆ ಸುಪಾರಿ ನೀಡಿದವರನ್ನು ಇಲ್ಲಿನ ಗ್ರಾಮೀಣ ಠಾಣೆ ಪೊಲೀಸರು ಭಾನುವಾರ ಬಂಧಿಸಿದ್ದಾರೆ.
67,"ಸುಪಾರಿ ಕೇಸ್ನಲ್ಲಿ ಬಂಧನವಾಗಿರುವ ರವಿ ಬೆಳಗೆರೆ ಬಗ್ಗೆ ಸುದ್ದಿಗಾರರೊಂದಿಗೆ ಮಾತನಾಡಿದ ಅಗ್ನಿ ಶ್ರೀಧರ್, ಬೆಳಗೆರೆ ಪಾಪಿಗಳ ಲೋಕದಲ್ಲಿ ಎಂದು ರೌಡಿಗಳ ಬಗ್ಗೆ ಬರೆಯುತ್ತಿದ್ದ, ಬರಹದ ಮೂಲಕವೇ ರೌಡಿಗಳ ನಡುವೆ ದ್ವೇಷ ಹುಟ್ಟು ಹಾಕ್ತಾಯಿದ್ದ ಎಂದು ಶ್ರೀಧರ್ ಆರೋಪ ಮಾಡಿದ್ದಾರೆ."
68,ಸಿದ್ಧಾರ್ಥ ಸಾಂಘ್ವಿಯವರಿಗೆ ಇತ್ತೀಚೆಗೆ ಬ್ಯಾಂಕ್‌ನ ಉಪಾಧ್ಯಕ್ಷ ಹುದ್ದೆಗೆ ಭಡ್ತಿ ದೊರೆತಿದ್ದು ಇದರಿಂದ ಮತ್ಸರಗೊಂಡಿದ್ದ ಸಹೋದ್ಯೋಗಿಗಳೇ ಕೊಲೆಗೆ ಸುಪಾರಿ ನೀಡಿದ್ದರು ಎಂದು ವರದಿಯಾಗಿದೆ.
69,ಕಾಂಗ್ರೆಸ್ ನಾಯಕರು ಸುಪಾರಿ ನೀಡಿದ್ದಾರೆ ಎಂಬ ಮಾಹಿತಿ ಇದ್ದಿದ್ದರೆ ತನಿಖೆ ನಡೆಸಿ ಕ್ರಮಕೈಗೊಳ್ಳಬಹುದಿತ್ತು.
70,"ಈ ಪ್ರಕರಣ ಸಂಬಂಧ ಮೃತಳ ಪತಿ ಪೀಣ್ಯದ ನರೇಂದ್ರ ಬಾಬು, ಸುಪಾರಿ ಹಂತಕರಾದ ಆಟೋ ಚಾಲಕ ಪ್ರಶಾಂತ್‌ ಹಾಗೂ ಹೆಬ್ಬಾಳ ಕೆಂಪಾಪುರದ ಜಗನ್ನಾಥ್‌ ಎಂಬುವರನ್ನು ಬಂಧಿಸಲಾಗಿದೆ."
71,"ಸುಪಾರಿ ಕಿಲ್ಲರ್ ಗಳ ಜೊತೆ ಮಾತನಾಡಿದ ತಕ್ಷಣ ಯಾರೂ ಕೊಲೆಗಡುಕರಲ್ಲ, ಎಲ್ಲವೂ ತನಿಖೆಯಾಗಲಿ ಅಪ್ಪ ಯಾವುದೇ ತಪ್ಪು ಮಾಡಿಲ್ಲ."
72,"ನೋಡು ಮಗಾ ಸೂಪರ್ ಫಿಗರ್ ಅವಳ ಅಣ್ಣ ದೊಡ್ಡ ಪಂಟರ್ ಗೊತ್ತಾದ್ರೆ ಕಾಲು ಕೈ ಸ್ಕ್ರಾಪ್ ಹಂಗೇ ಮಾಂಜಾ ಒಂದು ಡಿಚ್ಚಿ ಇಷ್ಟೆಲ್ಲಾ ರಿಸ್ಕಾ, ಸಿಂಪಲ್ ಪೊಲೀಸ್ಗೆ ಸುಪಾರಿ ಎನ್ ಕೌಂಟರ್."
