Index,Sentence
162,ಸುಪಾರಿ ಪಡೆದು ಮಹದೇವ್ ಸಾಹುಕಾರ್ ಜೊತೆ ಸೇರಿ ನನ್ನ ಮಗನನ್ನು ಎನ್‌ಕೌಂಟರ್ ಮಾಡಿರುವುದಾಗಿ ಭೀಮಾತೀರದ ಧರ್ಮರಾಜ್‌ನ ತಾಯಿ ವಿಮಲಾಬಾಯಿ ಆರೋಪ ಮಾಡಿದ್ದಾರೆ.
163,ಪೊಲೀಸರು ತನಿಖೆ ಮಾಡುತ್ತಿದ್ದ ವೇಳೆ ಅನುಮಾನಗೊಂಡು ಆರೋಪಿ ಮೈದುನ ನಾಗೇಶ್‌ನನ್ನು ವಶಕ್ಕೆ ಪಡೆದು ವಿಚಾರಣೆ ಮಾಡಿದಾಗ ಸತ್ಯ ಬಯಲಾಗಿದ್ದು ಆತನನ್ನು ಹಾಗೂ ಸುಪಾರಿ ಪಡೆದಿದ್ದ ಲಕ್ಷ್ಮೀಶನನ್ನ ಬಂಧಿಸಿದ್ದಾರೆ.
164,ಆದ್ರೆ ಮೂರು ವರ್ಷ ಕಳೆದ್ರೂ ಇನ್ನೂ ಫರ್ಸಾನ ಮನೆಯವರು ವರದಕ್ಷಿಣೆ ಕೊಟ್ಟಿಲ್ಲ ಅನ್ನೋ ಕಾರಣಕ್ಕೆ ಅಹಮ್ಮದ್​ ಹಾವು ಹಿಡಿಯುವವರಿಗೆ ಸುಪಾರಿ ಕೊಟ್ಟಿದ್ದಾನೆ.
165,"ಈ ವೇಳೆ ಆರೋಪಿ ಅಂಬಿಕಾಳನ್ನು ವಿವಾಹವಾಗಲು ಬಯಸಿದ್ದ, ಹೀಗಾಗಿ ಸುದೀಂದ್ರನನ್ನು ಕೊಲೆ ಮಾಡಲು ನಿರ್ಧರಿಸಿ, ತೇಜೇಶ್ವರಿ ಮತ್ತು ಪ್ರಕಾಶ್ ಕುಮಾರ್ ಎಂಬುವರಿಗೆ ಸುಪಾರಿ ನೀಡಿದ್ದ, ಇದಕ್ಕೆ ಆಪರೇಷನ್ ಊಟ ಆಯ್ತಾ ಎಂಬ ಕೋಡ್ ವರ್ಡ್ ನೀಡಿದ್ದರು."
166,"ಪ್ರಗತಿಪರರು ಯಾರು ಎಂದು ಪ್ರಶ್ನೆ ಮಾಡುತ್ತಾ, ದಿನೇಶ್ ಅಮಿನ್ ಮಟ್ಟು ಅವರು ರೋಹಿತ್ ಚಕ್ರತೀರ್ಥ ವಿರುದ್ಧ ಸುಪಾರಿ ಹತ್ಯೆಗೆ ಸಂಚು ನಡೆಸಿದ್ದರು ಎಂದು ಆರೋಪಿಸಿ, ಭಾಸ್ಕರಪ್ರಸಾದ್ ಫೇಸ್ ಬುಕ್ ನಲ್ಲಿ ಹಾಕಿದ್ದ ಪೋಸ್ಟ್ ಭಾರೀ ಚರ್ಚೆ ಹುಟ್ಟುಹಾಕಿದೆ."
167,ಬೆಂಗಳೂರು: ಪತ್ರಕರ್ತ ಸುನಿಲ್ ಹೆಗ್ಗರವಳ್ಳಿ ಹತ್ಯೆಗೆ ಸುಪಾರಿ ನೀಡಿದ್ದ ಪ್ರಕರಣದ ತನಿಖೆಯನ್ನು ಸಿ.
168,ಸಹೋದ್ಯೋಗಿ ಕೊಲೆಗೆ ಸುಪಾರಿ ಆರೋಪ: ರವಿಬೆಳಗೆರೆ ವಿಚಾರಣೆ ಬಹುತೇಕ ಪೂರ್ಣ?
169,ಅಚ್ಚರಿ ಅಂದರೆ ಪ್ರಭಾ ಹತ್ಯೆಗೆ ಬೆಂಗಳೂರಿನಿಂದಲೇ ಸುಪಾರಿ ನೀಡಲಾಗಿದೆ ಎಂಬ ಅನುಮಾನದ ಮೇಲೆ ನ್ಯೂ ಸೌತ್ ವೇಲ್ಸ್ ಪೊಲೀಸರು ಹಲವರನ್ನು ವಿಚಾರಣೆ ನಡೆಸಿದ್ದಾರೆ.
170,ರಾಜಕೀಯ ಕಾರಣಗಳಿಗಾಗಿ ಸುಪಾರಿ ಕೊಟ್ಟು ಕೊಲ್ಲಿಸಲಾಗಿದೆಯೇ?
171,"Home ಕನ್ನಡ ವಾರ್ತೆಗಳು ಕರ್ನಾಟಕ ಎರಡನೇ ಪತ್ನಿ, ಪುತ್ರಿ ಹತ್ಯೆಗೆ ಸುಪಾರಿ ನೀಡಿದ ಉದ್ಯಮಿ?"
172,ಅವರು ನೀಡಿರುವ ಹೇಳಿಕೆಯ ಪ್ರಕಾರ ಸುಪಾರಿ ಕೊಟ್ಟಿರುವುದು ಸ್ಯಾಂಡಲ್ ವುಡ್ ನ ನಟನೊಬ್ಬನ ಕೊಲೆಗೆ ಆದರೂ ಅದು ಯಶ್ ಅವರಿಗಾಗಿ ಎಂಬುದು ವಾಸ್ತವ ಅಲ್ಲ.
173,ಕೊಲೆಗೆ ಮಾಡೂರು ಇಸುಬು ಸುಪಾರಿ :
174,ಇಲ್ಲೊಬ್ಬ ಮಹಾಶಯ ತನ್ನ ಹತ್ಯೆಗೆ ಸುಪಾರಿ ಕೊಟ್ಟು ಕೊಲ್ಲಿಸಿಕೊಂಡ!
175,ಅಬ್ರಾಹಂ ಎಂಬುವವರು ಸುಪಾರಿ ನೀಡಿದ್ದಾರೆ ಎಂದು ತಿಳಿಸಿದ್ದರು.
176,"ಸುಪಾರಿ ನೀಡಿ ಮಾವನೇ ಅಳಿಯನ ಹತ್ಯೆ ಮಾಡಿಸಿರುವ ಪ್ರಕರಣವನ್ನು ಭೇದಿಸಿರುವ ಹೊಳೆನರಸೀಪುರ ನಗರ ಠಾಣೆ ಪೊಲೀಸರು, ಈ ಸಂಬಂಧ ಆರು ಮಂದಿ ಆರೋಪಿಗಳನ್ನು ಬಂಧಿಸಿದ್ದಾರೆ."
177,ಮೋದಿ ಮುಗಿಸಲು ಪಾಕ್‌ನಲ್ಲಿ ಸುಪಾರಿ ಕೊಟ್ಟಿದ್ದ ಮಣಿಶಂಕರ್‌!
178,"ನಂತರದಲ್ಲಿ ಮತ್ತೆ ಕೆಲಸಕ್ಕೆ ಸೇರಿಕೊಂಡಿದ್ದು, ವೈಯಕ್ತಿಕ ಕಾರಣದಿಂದ ಸುನಿಲ್ ಹತ್ಯೆಗೆ ರವಿ ಬೆಳಗೆರೆ ಸುಪಾರಿ ಕೊಟ್ಟಿದ್ದಾರೆ ಎನ್ನಲಾಗಿದೆ."
179,ಮಹಾಲಿಂಗಪುರ: ಕೊಲೆ ಸುಪಾರಿ ಪಡೆದು ಪ್ರತಿಷ್ಠಿತ ವ್ಯಕ್ತಿಯೊಬ್ಬನನ್ನು ಹತ್ಯೆ ಮಾಡಲು ಸಂಚು ನಡೆಸಿದ ಇಬ್ಬರನ್ನು ಪೊಲೀಸರು ಬಂಧಿಸಿದ ಘಟನೆ ಮಹಾಲಿಂಗಪುರ ಠಾಣೆ ವ್ಯಾಪ್ತಿಯಲ್ಲಿ ನಡೆದಿದೆ.
180,ಕಾಂಗ್ರೆಸ್ ಅನ್ನು ಮುಗಿಸಲು ಸಿದ್ದರಾಮಯ್ಯನವರಿಗೆ ಯಾರೋ ಸುಪಾರಿ ಕೊಟ್ಟಿದ್ದಾರೆ
181,ಬೆಂಗಳೂರು ಬಳ್ಳಾರಿ ಗಣಿಗಾರಿಕೆ ವಿಚಾರದಲ್ಲಿ ಮುಂಬೈನಿಂದ ಸುಪಾರಿ ಕೊಟ್ಟು ಕೊಲೆ ಮಾಡುವುದಾಗಿ ಅನಿಲ್ ಲಾಡ್‍ಗೆ ಉದ್ಯಮಿ ಆರ್.
182,ಆರೋಪಿಗಳನ್ನು ತೀವ್ರ ವಿಚಾರಣೆಗೊಳಪಡಿಸಿದಾಗ ರೌಡಿಶೀಟರ್ ಸುನೀಲ್ ಕೊಲೆಗೆ ನಟಿ ಪ್ರಿಯಾಂಕ ಸುಪಾರಿ ನೀಡಿದ್ದಾರೆ ಎಂಬ ಅಂಶ ಬೆಳಕಿಗೆ ಬಂದಿದೆ ಎಂದು ಅಧಿಕಾರಿಗಳು ತಿಳಿಸಿದ್ದಾರೆ.
183,ಗೆ ಸುಪಾರಿ ನೀಡಿದ್ದನು ಎಂಬುವುದು ತನಿಖೆ ವೇಳೆ ಬೆಳಕಿಗೆ ಬಂದಿದೆ.
184,ನನ್ನ ಹತ್ಯೆಗೆ 50 ಲಕ್ಷ ಸುಪಾರಿ ನೀಡಲಾಗಿತ್ತು- ಸ್ಪೋಟಕ ಹೇಳಿಕೆ ನೀಡಿದ ಅನರ್ಹ ಶಾಸಕ.
185,"ಮೈಸೂರಿನಲ್ಲಿ ಸುದ್ದಿಗಾರರೊಂದಿಗೆ ಮಾತನಾಡಿದ ಹೆಚ್ ಡಿ ಕುಮಾರಸ್ವಾಮಿ ಅವರು, ದೀಪಕ್ ಹತ್ಯೆಗೆ ಬಿಜೆಪಿ ಕಾರ್ಪೋರೇಟರ್ ಸುಪಾರಿ ಕೊಟ್ಟಿದ್ದು ಈ ವಿಷಯ ಸರ್ಕಾರಕ್ಕೂ ತಿಳಿದಿದೆ."
186,ಸುಪಾರಿ ತೆಗೆದುಕೊಂಡು ಗರುಡನನ್ನು ಕೊಂದು ಇಡೀ ಕೆಜಿಎಫ್ ನನ್ನೇ ವಶಕ್ಕೆ ತೆಗೆದುಕೊಂಡಿದ್ದಾನೆ ರಾಕಿ ಭಾಯ್.
187,ಇಂಥಾ ಗೃಹಿಣಿಯ ಕೊಲೆಗೆ ಅದ್ಯಾರೋ ಸುಪಾರಿ ಕೊಡೋ ಮೂಲಕ ಪೊಲೀಸ್ ಅಧಿಕಾರಿಯ ಪ್ರವೇಶವಾಗುತ್ತೆ.
188,[ ಹತ್ಯೆ ರಹಸ್ಯ: ಇಸ್ಮಾಯಿಲ್ ರನ್ನು ಕೊಂದಿದ್ದು ಸುಪಾರಿ ಕಿಲ್ಲರ್ಸ್!
189,← ಬಿಜೆಪಿ ಕಾರ್ಯಕರ್ತನ ಕೊಲೆಗೆ ಸುಪಾರಿ ಕೊಟ್ಟಿದ್ದ ಬಿಬಿಎಂಪಿ ಮಾಜಿ ಕಾರ್ಪೊರೇಟರ್ ಮತ್ತು ಪತ್ನಿ ಸೇರಿದಂತೆ 9 ಮಂದಿ ಬಂಧನ
190,ಶಿವಮೊಗ್ಗ: ಉದ್ಯಮಿಯ ಕೊಲೆಗೆ ಸುಪಾರಿ ಕೊಟ್ಟಿದ್ದ ಕಾಂಗ್ರೆಸ್ ಮುಖಂಡನ ಬಂಧಿಸಿರುವ ಘಟನೆ ಶಿವಮೊಗ್ಗದಲ್ಲಿ ನಡೆದಿದೆ.
191,ಚಂದ್ರಶೇಖರ್ ಶಾಸ್ತ್ರೀ ಅವರು ಸುಪಾರಿ ಕೊಲೆಯ ರಂಗರೂಪ ಹಾಗೂ ನಿರ್ದೇಶಕತನದ ಜವಬ್ದಾರಿಯನ್ನ ವಹಿಸಿಕೊಂಡಿದ್ದಾರೆ.
192,"ಅಸತ್ಯ-ಸುಳ್ಳುಗಳಿಗೆ ಪ್ರಚಾರ ಕೊಟ್ಟು, ಟಿಆರ್‌ಪಿ ಹೆಚ್ಚಿಸಿಕೊಂಡ ಮಾಧ್ಯಮಗಳೇ ಕಲಬುರ್ಗಿ ಅವರ ಹತ್ಯೆಗೆ ಸುಪಾರಿ ಕೊಟ್ಟಿದ್ದು ಎಂದು ಆರ್."
193,ಬೆಂಗಳೂರು: ಸಹೋದ್ಯೋಗಿ ಸುನೀಲ್ ಹೆಗ್ಗರವಳ್ಳಿ ಕೊಲೆಗೆ ಸುಪಾರಿ ನೀಡಿದ ಆರೋಪದ ಮೇಲೆ ಹಾಯ್ ಬೆಂಗಳೂರು ಸಂಪಾದಕ ರವಿ ಬೆಳಗೆರೆ ಬಂಧನವಾದ ಬೆನ್ನಲ್ಲೇ ಅವರ 2ನೇ ಪತ್ನಿ ನಾಪತ್ತೆಯಾಗಿದ್ದಾರೆ.
194,ಯಾವಿದೋ ಡ್ಯಾನಿಷ್ ಕಾರ್ಟೂನಿಷ್ಟ್ ನ ತಲೆಗೆ ೫೧ ಕೋಟಿಯನ್ನು ಸುಪಾರಿ ಕೊಡುವವರು ಇನ್ನೂ ಸರ್ಕಾರದಲ್ಲಿ ಸಚಿವರಾಗಿದ್ದಾರೆ.
195,"ಇದನ್ನೂ ಓದಿ: ತಲೆಯಿಲ್ಲ, ಕಾಲೂ ಇಲ್ಲ; ಬೆಡ್​​ಶೀಟ್​ನೊಳಗಿದ್ದ ಮಹಿಳೆಯ ಮೃತದೇಹ ನೋಡಿದ ಪೊಲೀಸರು ಶಾಕ್ ಆಸ್ತಿಯ ಆಸೆಗಾಗಿ ಅತ್ತಿಗೆಯನ್ನು ಕೊಲ್ಲಲು ನಿರ್ಧರಿಸಿದ ಸುಬ್ಬಯ್ಯ ಆಕೆಯನ್ನು ಸಾಯಿಸಲು ತನ್ನದೇ ತೋಟದ ಕಾರ್ಮಿಕರಿಗೆ ಸುಪಾರಿ ನೀಡಲು ಮುಂದಾಗಿದ್ದ."
196,ಅಸಲಿಗೆ ಸ್ಟಾರ್ ನಟನ ಹತ್ಯೆಗೆ ಸುಪಾರಿ ಪಡೆದಿದ್ದು ರೌಡಿಶೀಟರ್ ಭರತ ಅಂಡ್ ಗ್ಯಾಂಗ್ ಗೆ ಸುಪಾರಿ ನೀಡಲಾಗಿದೆ.
197,10): ರವಿ ಬೆಳಗೆರೆ ಸುಪಾರಿ ಪ್ರಕರಣದ ಬೆನ್ನತ್ತಿ ಹೊರಟ ಸಿಸಿಬಿ ನಿರಂತರವಾಗಿ ಬೆಳಗೆರೆ ವಿಚಾರಣೆ ನಡೆಸುತ್ತಿದೆ.
198,ನಂತರ ಹಣ ಕೇಳಿದ ರಾಜೇಶ್​ ಮುಗಿಸುವಂತೆ ದೃಶ್ಯ ಸುಪಾರಿ ನೀಡಿದ್ದರು.
199,ಅಷ್ಟೇ ಅಲ್ಲದೆ ನನ್ನ ವಿರುದ್ಧ ಸುಪಾರಿ ಕೊಡಲಾಗಿದೆ.
200,ಲಕ್ಷಕ್ಕೆ ಸುಪಾರಿ ಕೊಟ್ಟು 15 ಸಾವಿರ ಅಡ್ವಾನ್ಸ್​ ಕೊಟ್ಟಿದ್ನಂತೆ.
201,ಪತ್ನಿಯ ಹತ್ಯೆಗೆ ಸುಪಾರಿ ನೀಡುವ ಸಂಬಂಧ ಪರಿಚಿತರ ಮೂಲಕ ವ್ಯಕ್ತಿಗಾಗಿ ಹುಡುಕಾಟ ನಡೆಸುತ್ತಿದ್ದರು.
202,ಸಹೋದ್ಯೋಗಿ ಸುನೀಲ್ ಹೆಗ್ಗರವಳ್ಳಿ ಕೊಲೆಗೆ ಸುಪಾರಿ ನೀಡಿದ ಪ್ರಕರಣಕ್ಕೆ ಸಂಬಂಧಿಸಿದಂತೆ ಹಿಂದಿನ ವೈದ್ಯಕೀಯ ದಾಖಲೆಗಳನ್ನು ಕೋರ್ಟ್ಗೆ ನೀಡಿ ಜಾಮೀನು ಪಡೆದಿದ್ದಾರೆ.
203,ಸುಪಾರಿ ನೀಡಿ ಹತ್ಯೆ ಮಾಡಿದ್ದು ಹೀಗೆ …
204,ಸುದ್ದಿಗೋಷ್ಠಿಯಲ್ಲಿ ಎಚ್ ಡಿ ಕೆ ಕೊಲೆಗೆ ಸುಪಾರಿ ನೀಡಿದ್ದಾರೆ ಆರೋಪಿಸಿರುವ ಕಾರ್ಪೋರೇಟರ್ ತಿಲಕ್ ಚಂದ್ರ ಕೂಡ ಉಪಸ್ಥಿತರಿದ್ದರು.
205,ಭೀಮಾ ತೀರದ ರೌಡಿ ಧರ್ಮರಾಜ ಚಡಚಣನನ್ನು ಎನ್‌ಕೌಂಟರ್‌ ಮಾಡಲು ಪೊಲೀಸರೇ ಸುಪಾರಿ ಪಡೆದಿದ್ದಾರೆ ಎಂಬುದು ಜನರಲ್ಲಿ ಆತಂಕ ಮೂಡಿಸಿದೆಯಲ್ಲಾ ಎಂದು ಐಜಿಪಿಗೆ ಪತ್ರಕರ್ತರು ಇನ್ನೊಂದು ಪ್ರಶ್ನೆಯನ್ನು ಎಸೆದರು.
206,ಸುಪಾರಿ ಕೊಲೆ ಪ್ರಕರಣ
207,ನನ್ನ ಚಿತ್ರದ ಹೀರೋ ಸುಪಾರಿ ಪಡೆಯುವ ರೌಡಿ.
208,ಇನ್ನೊಬ್ಬರಿಗೆ ಸುಪಾರಿ ನೀಡುವಂತಹ ಮನಃಸ್ಥಿತಿ ಕನ್ನಡ ಸಿನಿಮಾ ಕ್ಷೇತ್ರದಲ್ಲಿ ಯಾರಲ್ಲೂ ಇಲ್ಲ ಎಂದರು.
209,ಸುಪಾರಿ ಕೊಟ್ಟವರು ಯಾರು ಗೊತ್ತಿಲ್ಲ.
210,"ವಿಚಾರಣೆ ವೇಳೆ ವಿಜಯಪುರ ಮೂಲದ ಶಶಿಧರ್, ರವಿ ಬೆಳಗೆರೆ ಅವರು 30 ಲಕ್ಷ ರು ಸುಪಾರಿ ನೀಡಿ, ಸುನಿಲ್ ಹೆಗ್ಗರವಳ್ಳಿಯನ್ನು ಕೊಲ್ಲಲು ಸೂಚಿಸಿದ್ದರು ಎಂದು ಹೇಳಿದ್ದ."
211,"ಗೌರಿ ಲಂಕೇಶ್‌ ಹತ್ಯೆ ಪ್ರಕರಣದ ತನಿಖೆ ನಡೆಸುತ್ತಿದ್ದ ಸಂದರ್ಭದಲ್ಲಿ ರವಿ ಬೆಳಗೆರೆ, ಸುನಿಲ್‌ ಹೆಗ್ಗರವಳ್ಳಿ ಕೊಲೆಗೆ ಸುಪಾರಿ ಕೊಟ್ಟಿದ್ದ ವಿಷಯ ತಿಳಿದುಬಂದಿತ್ತು."
212,ಆದರೀಗ ಚಿಕ್ಕಮಗಳೂರಿನಲ್ಲೂ ಸುಪಾರಿ ಕಿಲ್ಲರ್ ಗಳ ಹಾವಳಿ ಆರಂಭವಾಗಿರುವುದು ಆಂಕಪಡುವ ಸಂಗತಿ.
213,ಪ್ರೇಯಸಿಯೊಂದಿಗೆ ಮದುವೆಯಾಗಲು ಕಟ್ಟಿಕೊಂಡ ಪತ್ನಿಗೆ ಐದು ಲಕ್ಷಕ್ಕೆ ಸುಪಾರಿ ಕೊಟ್ಟಿದ್ದ ಕಿರಾತಕ ಪೊಲೀಸ್ ಹೆಡ್ ಕಾನ್ಸ್ ಸ್ಟೆಬಲ್ ಅಂದರ್ ಆಗಿದ್ದಾನೆ.
214,ಸುಪಾರಿ ಕೊಟ್ಟರೆ ಎಂಥದ್ದೇ ದೊಡ್ಡ ಮರವನ್ನಾದರೂ ಎರಡು ವಾರಗಳಲ್ಲಿ ಒಣಗಿಸಬಲ್ಲ ದುರುಳರು ಇವರು.
215,ಕೋಟಿ ಮೌಲ್ಯದ ಆಸ್ತಿಯ ಒಡೆಯರಾಗಿದ್ದ ದೀಪಕ್ ಭಾರದ್ವಾಜ್ ಹತ್ಯೆಗೆ ಅವರ ಪುತ್ರನೇ ಐದು ಕೋಟಿ ರೂಪಾಯಿ ಬೃಹತ್ ಮೊತ್ತದ ಸುಪಾರಿ ನೀಡಿದ್ದ ಆಘಾತಕಾರಿ ವಿಷಯ ಪೊಲೀಸರ ವಿಚಾರಣೆಯ ವೇಳೆ ಬಹಿರಂಗವಾಗಿದೆ.
216,ಕಾಮದ ಮಾಯೆಯಾಟಕ್ಕೆ ಗಂಡನೇ ಬಲಿ | Love affair | Supari killing | Extramarital affair | Magadi | ಅನೈತಿಕ ಸಂಬಂಧ | ಸುಪಾರಿ ಕೊಲೆ | ಕಾಮದಾಟ - Kannada Oneindia
217,5:ಪತ್ನಿಯೇ ಸುಪಾರಿ ನೀಡಿ ಸ್ಕೂಟರ್‌ಗೆ ಲಾರಿಯಿಂದ ಡಿಕ್ಕಿ ಹೊಡೆಸಿ ಪತಿಯನ್ನು ಹತ್ಯೆ ಮಾಡಿಸಿದ್ದ ಅಂಶ ಬೆಳಕಿಗೆ ಬಂದು ಅಪಘಾತದ ತನಿಖೆ ನಡೆಸಿದ ಪೊಲೀಸರನ್ನೇ ದಿಗ್ಭ್ರಮೆಗೊಳ್ಳುವಂತೆ ಮಾಡಿದೆ.
218,"ಕಮಲ ಮಹಲ್‌, ಕುದುರೆ ಮಂಟಪ, ಸಾಲು ಮಂಟಪ, ಪಾನ್‌ ಸುಪಾರಿ ಬಜಾರ್‌ ಜಲಾವೃತ­ಗೊಂಡಿವೆ."
219,ವಿವಾಹಿತ ಪುತ್ರಿಯ ಅನೈತಿಕ ಸಂಬಂಧ ಪ್ರಶ್ನಿಸಿದ ತಂದೆಯನ್ನೇ ಮಗಳು ಸುಪಾರಿ ನೀಡಿ ಕೊಲೆಗೈದು ನಾಪತ್ತೆ ಕಥೆ ಕಟ್ಟಿದ ಬೆಚ್ಚಿ ಬೀಳಿಸುವ ಘಟನೆ ಗೋಕಾಕ್‌ನ ಕಡಬಗಟ್ಟಿ ಬಳಿ ನಡೆದಿದೆ.
220,"ಮತ್ತೊಬ್ಬ ಸುಪಾರಿ ಕಿಲ್ಲರ್‌ಗೆ ಶೋಧ : ರವಿ ಬೆಳಗೆರೆ ವಿರುದಟಛಿ ಸುಪಾರಿ ಕೊಲೆ ಪ್ರಕರಣದ ತನಿಖೆ ಮುಂದುವರೆಸಿರುವ ಸಿಸಿಬಿ ಅಧಿಕಾರಿಗಳು, ಈ ಕೃತ್ಯದ ಮತ್ತೊಬ್ಬ ಭೀಮಾತೀರದ ಸುಪಾರಿ ಕಿಲ್ಲರ್ ವಿಜುಬಡಿಗೇರ್‌ಪತ್ತೆಗೆಉತ್ತರಕರ್ನಾಟಕದಲ್ಲಿತೀವ್ರ ಶೋಧ ನಡೆಸಿದ್ದಾರೆ."
221,ಸುಪಾರಿ ಕಿಲ್ಲರ್ ವಶಕ್ಕೆ ಪಡೆದ ಸುದ್ದಿಯನ್ನು ಪಬ್ಲಿಕ್ ಟಿವಿ ಶನಿವಾರ ಮೊದಲು ಬ್ರೇಕ್ ಮಾಡಿತ್ತು.
222,"ಸುಪಾರಿ ಹಂತಕರಿಗೆ ಮಹಾರಾಷ್ಟ್ರ, ಉತ್ತರ ಪ್ರದೇಶದಿಂದ ಶಸ್ತ್ರಾಸ್ತ್ರ ಬರುತ್ತಿವೆ."
223,18- ಪ್ರೀತಿಸಿದ ಹುಡುಗಿಯನ್ನು ಮದುವೆ ಆಗಲು ಪೋಷಕರು ಅಡ್ಡಿ ಪಡಿಸಿದ್ದರಿಂದ ಹೆತ್ತ ತಂದೆ-ತಾಯಿಯನ್ನೇ ಸುಪಾರಿ ನೀಡಿ ಕೊಲೆ ಮಾಡಿಸಿದ ಏಕೈಕ ಪುತ್ರ ಸೇರಿ 6 ಮಂದಿಯನ್ನು ತಿಲಕ್‌ಪಾರ್ಕ್ ವೃತ್ತ ಪೊಲೀಸರು ಬಂಧಿಸಿದ್ದಾರೆ.
224,"ಆದರೆ, ಸುಪಾರಿ ಕೊಟ್ಟಿದ್ದೇಕೆ ಎಂದು ಕೇಳಿದಾಗಲೆಲ್ಲ, ಮೌನಕ್ಕೆ ಶರಣಾಗುತ್ತಿದ್ದರು ಎಂದು ಸಿಸಿಬಿ ಅಧಿಕಾರಿಯೊಬ್ಬರು ಪ್ರಜಾವಾಣಿಗೆ ತಿಳಿಸಿದರು."
225,"ಪತ್ರಕರ್ತೆ ಗೌರಿ ಲಂಕೇಶ್ ಹತ್ಯೆ ಪ್ರಕರಣದ ತನಿಖೆಯ ವೇಳೆ ಈ ಪ್ರಕರಣ ಬೆಳಕಿಗೆ ಬಂದಿದ್ದು, ಮತ್ತೊಬ್ಬ ಪತ್ರಕರ್ತ ಸುನೀಲ್ ಹೆಗ್ಗರವಳ್ಳಿ ಅವರ ಹತ್ಯೆಗೆ ಸುಪಾರಿ ನೀಡಿದ ಆರೋಪದ ಮೇಲೆ ರವಿ ಬೆಳಗೆರೆ ಅವರನ್ನು ಇಂದು ಮಧ್ಯಾಹ್ನ ಸಿಸಿಬಿ ಪೊಲೀಸರು ಬೆಂಗಳೂರಿನ ಪದ್ಮನಾಭನಗರದ ಕಚೇರಿಯಲ್ಲಿ ಬಂಧಿಸಿದ್ದಾರೆ."
226,ಅವರು ಕೂಡ ನನ್ನ ಕೊಲೆಗೆ ಸುಪಾರಿ ನೀಡಲಾಗಿದೆ ಎಂಬುದು ಸುಳ್ಳು ಎಂಬುದನ್ನು ಸ್ಪಷ್ಟಪಡಿಸಿದರು.
227,"ನವದೆಹಲಿ, ಜೂನ್ 9: ನನ್ನನ್ನು ಮುಗಿಸಲು ಸರಕಾರ 30 ಲಕ್ಷ ರುಪಾಯಿ ಸುಪಾರಿ ನೀಡಿದೆ ಎಂದು ಅಣ್ಣಾ ಹಜಾರೆ ನೇರ ಆರೋಪ ಮಾಡಿದ್ದಾರೆ."
228,"ಮುಂದೆ 2 ಸಿನಿಮಾ ಮಂದಿರಗಳು, ಮಿಠಾಯಿ ಅಂಗಡಿಯೊಂದರ ಬಳಿ ಬಾಂಬ್ ಸ್ಫೋಟಿಸಲು ಎಜಾಜ್ ಅಹಮದ್ ಇದೇ ಸುಪಾರಿ ಹಣವನ್ನು ಬಳಸಿದ್ದ."
229,"ಕಡಲ ತೀರದ ಭೂಗತಲೋಕದ ಚಟುವಟಿಕೆಗಳು ಮತ್ತು ಸುಪಾರಿ ಕಿಲ್ಲಿಂಗ್ ಅಂಶಗಳೇ ಈ ಚಿತ್ರದ ಕಥಾ ವಸ್ತುವಾಗಿದ್ದು, ಸೆಸ್ಪನ್ಸ್- ಥ್ರಿಲ್ಲರ್ ಶೈಲಿಯಲ್ಲಿ ಚಿತ್ರ ತೆರೆಮೇಲೆ ಬರುತ್ತಿದೆ."
230,ಗೌರಿ ಹತ್ಯೆ ಮಾಡಿದ್ದ ರಿವಾಲ್ವರ್ ಟಿವಿಯೊಳಗಿಟ್ಟು ಆರಾಮಾಗಿದ್ದ ಸುಪಾರಿ ಕಿಲ್ಲರ್!
231,ಹುಡುಗಿಯ ಚಿಕ್ಕಪ್ಪನನ್ನು ಸುಪಾರಿ ಕೊಟ್ಟು ಕೊಲೆ ಮಾಡಿಸಲು ಹುಡುಗನ ಚಿಕ್ಕಮ್ಮ ಕೂಡಾ ಸಾಥ್ ನೀಡಿದ್ದಳು ಎಂದು ತಿಳಿದು ಬಂದಿದ್ದು ಈ ಬಗ್ಗೆ ಕೂಡ ಪೊಲೀಸರು ತನಿಖೆ ಚುರುಕುಗೊಳಿಸಿದ್ದಾರೆ.
232,"ಈಗ ಈ ವಿಡಿಯೊ ಎಲ್ಲೆಡೆ ಹರಿದಾಡುತ್ತಿದ್ದು, ರಾಜ್ಯದಲ್ಲಿ ದೊಂಬಿ ಹುಟ್ಟಿಸಲು ಅಮಿತ್ ಶಾ ಅವರೇ ಪ್ರತಾಪ್‌ ಸಿಂಹ ಅವರಿಗೆ ಸುಪಾರಿ ಕೊಟ್ಟಿದ್ದರು."
233,ತನ್ನ ಪೋಷಕರೇ ಸುಪಾರಿ ಹಂತಕರ ಮೂಲಕ ಈ ಕೃತ್ಯ ಮಾಡಿಸಿದ್ದಾರೆ ಅಂತಾ ನೊಂದ ಪತ್ನಿ ಆರೋಪಿಸಿದ್ದಾಳೆ.
234,ಭಾಸ್ಕರ್​ ಪ್ರಸಾದ್​ ಅಮೀನ್​ ಮಟ್ಟು ವಿರುದ್ಧ ಬಲಪಂಥೀಯ ಲೇಖಕರೊಬ್ಬರ ಹತ್ಯೆಗೆ ಸುಪಾರಿ ನೀಡಿದ್ದರು ಎಂದು ನಿರಾಧಾರ ಆರೋಪವನ್ನು ಸಾಮಾಜಿಕ ಜಾಲತಾಣದಲ್ಲಿ ಮಾಡಿದ್ದರು.
235,ಸುನೀಲ್ ಹೆಗ್ಗರವಳ್ಳಿ ಹತ್ಯೆಗೆ ಸುಪಾರಿ ನೀಡಿದ ಪ್ರಕರಣದಲ್ಲಿ ಪತ್ರಕರ್ತ ರವಿ ಬೆಳೆಗೆರೆಯನ್ನು ಬಂಧಿಸಿದ ಹಿನ್ನೆಲೆಯಲ್ಲಿ ಸೋಮವಾರ ತಮ್ಮ ನಿವಾಸದಲ್ಲಿ ಪತ್ರಿಕಾಗೋಷ್ಠಿ ನಡೆಸಿ ಅಗ್ನಿ ಶ್ರೀಧರ್ ತಮ್ಮಿಬ್ಬರ ಸ್ನೇಹ ಸಂಬಂಧ ಹಳಸಲು ಕಾರಣ ಏನು ಎಂಬುದನ್ನು ವಿವರಿಸಿದರು.
236,"ಸಂಘಟನೆಯೊಂದು ಸುಪಾರಿ ನೀಡಿತ್ತು, ಸಂಘಟನೆ ನೀಡಿದ್ದ ಕೆಲಸವನ್ನು ನಿರ್ವಹಿಸಲು ಅಮೋಲ್ ಕಾಳೆ ಒಂದು ವರ್ಷದಿಂದ ಯೋಜನೆ ರೂಪಿಸಿದ್ದನು."
237,"ಅಂಕಣಕಾರ ರೋಹಿತ್‌ ಚಕ್ರತೀರ್ಥ ಹಾಗೂ ತನ್ನನ್ನು ಕೊಲೆ ಮಾಡಲು, ಸುಪಾರಿ ನೀಡಿರುವುದಾಗಿ ಭಾಸ್ಕರ್‌ ಪ್ರಸಾದ್‌ ಫೇಸ್‌ಬುಕ್‌ನಲ್ಲಿ ಬರೆದಿದ್ದರು."
238,ಸುಪಾರಿ ತಂಡವನ್ನು ಬಂಧಿಸಿದ ತಲಶೇರಿ ಪೋಲೀಸರು
239,ಆದರೆ ಅವರನ್ನೇ ನನ್ನ ಕೊಲೆ ಮಾಡಲು ಸುಪಾರಿ ನೀಡುತ್ತಾರೆ ಎಂದುಕೊಂಡಿರಲಿಲ್ಲ ಎಂದಿದ್ದಾರೆ.
240,ನನ್ನ ಕೊಲೆಗೆ ಸುಪಾರಿ ನೀಡಿಲಾಗಿದೆ ಎಂಬುದು ಸುಳ್ಳು ಎಂಬುದನ್ನು ಸ್ಪಷ್ಟಪಡಿಸಿದ್ದಾರೆ ಎಂದರು.
241,ಗೆ ಸುಪಾರಿ ಕೊಟ್ಟು 7 ಸಾವಿರ ರೂ.
242,ದೀಪಕ್ ಅವರ ಹತ್ಯೆಗೆ ಸುಮಾರು 2 ಕೋಟಿ ರುಪಾಯಿ ಸುಪಾರಿ ನೀಡಿದ್ದ ದೇವಮಾನ ಯೋಗ ಗುರು ಅವಿನಾಶ್ ಶಾಸ್ತ್ರಿಯನ್ನು ಬಂಧಿಸಲಾಗಿದೆ.
243,"ದೇಶದಲ್ಲಿ ಇರುವ ಬಿಜೆಪಿಯೇತರ ಸರಕಾರಗಳನ್ನು ಉರುಳಿಸಲು ಸುಪಾರಿ ನೀಡುತ್ತಿರುವ ಅಮಿತ್ ಶಾ, ಈಗಾಗಲೇ ಪಶ್ಚಿಮ ಬಂಗಾಳದ ಮಮತಾ ಬ್ಯಾನರ್ಜಿ ಮತ್ತು ದಿಲ್ಲಿ ಮುಖ್ಯಮಂತ್ರಿ ಅರವಿಂದ ಕೇಜ್ರಿವಾಲ್ ಅವರನ್ನು ಮುಗಿಸಲು ಸಿಬಿಐ ಎಂಬ ಗುಪ್ತಚರ ಸಂಸ್ಥೆಯನ್ನು ಬಳಸಿಕೊಳ್ಳುತ್ತಿದ್ದಾರೆ."
244,"ರವಿ ಬೆಳಗೆರೆ ಬಂಧನದ ಬಳಿಕ ಯಶೋಮತಿಯವರು ಮೊದಲ ಬಾರಿಗೆ ಸುನೀಲ್ ಹೆಗ್ಗರವಳ್ಳಿ ಬಗ್ಗೆ ಮಾತನಾಡಿದ್ದು, ರವಿ ಅವರು ಸುಪಾರಿ ಕೊಟ್ಟಿದ್ದು ನಿಜವೇ ಆಗಿದ್ದರೂ ಅವರ ಪರಮ ಗುರು ರವಿಯ ಅವರ ಬಗ್ಗೆ ಮಾಧ್ಯಮಗಳಲ್ಲಿ ಹೀಗೆಲ್ಲಾ ಮಾತನಾಡುತ್ತಿರಲಿಲ್ಲ."
245,"ಆದರೆ, ರಾಜಪ್ಪನ ಪತ್ನಿ ಇದು ಅಪಘಾತವಲ್ಲ ಕೊಲೆ ಎಂದು ದೂರು ನೀಡಲು ಮುಂದಾಗಿದ್ದು, ತನಿಖೆ ಕೈಗೊಂಡ ಚಿತ್ರದುರ್ಗ ಗ್ರಾಮಾಂತರ ಠಾಣೆ ಪೊಲೀಸರು, ರಾಜಪ್ಪನ ವಿಮೆ ಹಣ ಪಡೆದುಕೊಳ್ಳಲು ಪತ್ನಿಯೇ ಕೊಲೆಗೆ ಸುಪಾರಿ ನೀಡಿರುವುದನ್ನು ಪತ್ತೆಹಚ್ಚಿದ್ದಾರೆ."
246,ಸಿಐಎ ವರದಿಯಂತೆ ಸಲ್ಮಾನ್ ಅವರು ಅವರನ್ನು ಕೊಳ್ಳುವುದಕ್ಕೆ ಸುಪಾರಿ ನೀಡಿದ್ದರು ಎಂದು ತಿಳಿದುಬಂದಿದೆ.
247,ಹತ್ಯೆಗೆ ಸುಪಾರಿ ನೀಡಿದ ಆರೋಪದಡಿ ಹಿರಿಯ ಪತ್ರಕರ್ತ ರವಿ ಬೆಳಗೆರೆ ವಿರುದ್ಧ ಚಾರ್ಜ್ ಶೀಟ್ ಸಲ್ಲಿಸಿದ್ದಾರೆ.
