Index,Sentence
367,ಈ ವಿಡಿಯೋದಲ್ಲಿ ನಾಯಿವೊಂದು ಫಿಲಿಪೈನ್ಸ್ ನ ಬೀದಿಯಲ್ಲಿ ತನ್ನ ಯಜಮಾನ ಕುಳಿತಿರುವ ವೀಲ್‍ಚೇರ್ ಅನ್ನು ತಳ್ಳಿಕೊಂಡು ಹೋಗುತ್ತಿರುತ್ತದೆ.
368,"ಈ ಕಡೆ ಯಜಮಾನ ಚಿತ್ರ ಹಾಡುಗಳಿಂದ ಅಬ್ಬರಿಸುತ್ತಿದ್ದು, ಫೆಬ್ರವರಿ 10 ರಂದು ಟ್ರೈಲರ್ ಬರಲಿದೆ."
369,ಆ ಮನೆಯ ಯಜಮಾನ ತೀರಿ 22 ವರ್ಷಗಳೇ ಗತಿಸಿವೆ.
370,…ಶುಭ ಕಾರ್ಯಗಳಲ್ಲಿ ನಾಲ್ಕು ಮಾತುಗಳ ಭಾವಾನಾತ್ಮಕ ಪ್ರಾರ್ಥನೆಯನ್ನು ಮನೆಯ ಯಜಮಾನ ಅಥವಾ ಇತರರು ನಡೆಸಿಕೊಡಬೇಕಾದ ಸಂದರ್ಭಗಳು ಉದ್ಭವಿಸುವುದು.
371,ಆ ಗುಂಪಿನ ಯಜಮಾನ ಗೋಸಾಯಿಗೆ ಪಾದ್ರಿಯ ಕಡೆಯವರು ಸ್ವಲ್ಪ ದುಡ್ಡು ಕೊಟ್ಟು ಒಲಿಸಿಕೊಳ್ಳಬೇಕಾಯಿತಂತೆ.
372,"ಇದಲ್ಲದೆ, ರೂಪಾಂತರ ಇದರಲ್ಲಿ ನೌಕರ ವರ್ಕ್ಬುಕ್ನ ಹೊಂದಿರಬಹುದು ಮತ್ತು ಐಚ್ಛಿಕವಾಗಿ ರೆಕಾರ್ಡಿಂಗ್ ಕಾಲ ತನ್ನ ಯಜಮಾನ ಅನುವಾದ."
373,"ಕಂತುಕಟ್ಟುವ ಮನೆಯ ಯಜಮಾನ ಸಾಲಬಾಕಿ ಇರುವಾಗಲೇ ಅನಾರೋಗ್ಯದಿಂದಲೋ, ಅಪಘಾತದಿಂದಲೋ ತೀರಿಕೊಂಡಲ್ಲಿ, ಸಾಲ ತೀರಿಸುವುದು ಯಾರು ಮತ್ತು ಹೇಗೆ?"
374,"ನಮ್ಮ ಸಾಹೇಬರು ಆಫೀಸಿಗೆ ಹೋಗಿದ್ದಾರೆ, ಸಾಹೇಬರು ಬಂದರು, ಇಂತಹ ಸಂದರ್ಭದಲ್ಲಿ ಸಾಹೇಬ ರೂಪ ಒಡೆಯ, ಯಜಮಾನ ಎಂಬರ್ಥದಲ್ಲಿಯೂ ಬಳಕೆಯಾಗುತ್ತದೆ."
375,ಜನವರಿ 1ರಂದು ಧರ್ಮಪುರಿ ಜಿಲ್ಲೆಯ ಎರಿಯಾರ್‌ ಪೊಲೀಸ್‌ ಠಾಣೆ ವ್ಯಾಪ್ತಿಯಲ್ಲಿ ನಡೆದ ಒಂದು ಕುಟುಂಬದ ಕೊಲೆಯಲ್ಲಿ ಮನೆಯ ಯಜಮಾನ ಚಿನ್ನಪನ್ನು ಆತನ ಹೆಂಡತಿ ಪಾಚಿಯಮ್ಮ ಮತ್ತು ಮಕ್ಕಳಾದ ಶಿವಕುಮಾರ್‌ ಮತ್ತು ರಾಜಿ ಸೇರಿದ್ದಾರೆ.
376,ಸಂತನನ್ನು ಕಂಡದ್ದೇ ಮನೆಯ ಯಜಮಾನ ಆದರದಿಂದ ಸ್ವಾಗತಿಸಿದ.
377,"ಉಪಾಧ್ಯಾಯರು ಇಬ್ಬರಿಗೂ ಇನ್ನಿಲ್ಲದ ಪ್ರೀತಿ ಅವರು ಆ ನಾಯಿಯನ್ನು ಎಲ್ಲದಕ್ಕಿಂತ ಹೆಚ್ಚಾಗಿ ಪ್ರೀತಿಸುತ್ತಾರೆ ಮತ್ತೆ ನಾಯಿಯು ಅವರನ್ನು ತುಂಬಾ ಹಚ್ಚಿಕೊಳ್ಳುತ್ತೇ ಇವರು ಕೆಲಸಕ್ಕೆ ಹೋಗಬೇಕಾದರೆ ಟೋಕಿಯೋ ರೈಲು ನಿಲ್ದಾಣದಿಂದ ಹೋಗಬೇಕಿತ್ತು ಹಾಗಾಗಿ ದಿನನಿತ್ಯ ಮನೆಯಿಂದ ಹೊರಡುವಾಗ ಹಚ್ಚಿಕೊ ನಾಯಿ ಕೂಡ ರೈಲು ನಿಲ್ದಾಣದವರೆಗೂ ಅವರ ಜೊತೆಯಲ್ಲಿ ಹೋಗುತ್ತಿತ್ತು ಮತ್ತೆ ಅವರು ಕೆಲಸ ಮುಗಿಸಿ ಕಾಲೇಜಿನಿಂದ ತಿರುಗಿ ಬರೋವರೆಗೂ ಅದು ರೈಲ್ವೆ ನಿಲ್ದಾಣದಲ್ಲಿ ಅವರಿಗಾಗಿ ಕಾಯುತ್ತಿತ್ತು ಅವರು ಇಬ್ಬರು ಒಟ್ಟಿಗೆ ಮನೆಗೆ ಬರುತ್ತಿದ್ದರು ಇದು ಅವರಿಬ್ಬರ ದಿನನಿತ್ಯದ ಕೆಲಸವಾಗಿತ್ತು ಸಹಜವಾಗಿ ಇದು ಕೆಲವು ದಿನಗಳ ಕಾಲ ಹೀಗೆ ನಡೆದಿತ್ತು ಆದರೆ ಮೇ 21 , 1925 ರಂದು ಎಂದಿನಂತೆ ಇಬ್ಬರು ಮನೆಯಿಂದ ರೈಲ್ವೆ ನಿಲ್ದಾಣಕ್ಕೆ ಬಂದರು ತಮ್ಮ ರೈಲನ್ನು ಹತ್ತಿ ಕಾಲೇಜಿಗೆ ಹೋದರು ಇನ್ನು ಈ ನಾಯಿ ತನ್ನ ಯಜಮಾನ ಸಂಜೆ ಬರುತ್ತಾನೆ ಅಂತ ಅಲ್ಲೇ ಕಾಯುತ್ತ ಕುಳಿತಿತ್ತು ಆ ಅಧ್ಯಾಪಕರಿಗೆ ಅನಾರೋಗ್ಯದ ಸಮಸ್ಯೆ ಉಂಟಾಗಿ ಸ್ಥಳದಲ್ಲೇ ಸಾವನ್ನಪ್ಪಿದರು ಇತ್ತ ನಾಯಿ ಕಾಯುತ್ತ ಕುಳಿತಿತ್ತು ಆದರೆ ಎಷ್ಟು ಹೊತ್ತಾದರೂ ಮನೆ ಯಜಮಾನ ವಾಪಸ್ಸು ಬರಲಿಲ್ಲ ಆ ನಾಯಿಯನ್ನು ರೈಲ್ವೆ ನಿಲ್ದಾಣದಲ್ಲಿ ನೋಡಿದ ಅವರ ಮನೆಯ ಮಾಜಿ ಕೆಲಸಗಾರ ಅದನ್ನು ಮನೆಗೆ ವಾಪಸ್ ಕರೆದುಕೊಂಡು ಹೋದ ಆದರೆ ಮಾರನೇದಿನ ಅದು ವಾಪಸ್ ಬಂದು ತನ್ನ ಮಾಲೀಕನಿಗಾಗಿ ಮತ್ತೆ ಅಲ್ಲೇ ಕಾಯುತ್ತ ಕುಳಿತಿರುತ್ತದೆ."
378,ತನ್ನ ಮೈ ದಡವಿ ಹೋದ ಯಜಮಾನ ಇನ್ನಿಲ್ಲ ಎಂಬ ಸತ್ಯ ಅವನಿಗೆ ತಿಳಿಯಿತೋ ಗೊತ್ತಿಲ್ಲ.
379,"ನೇಕಾರರು (ಶ್ರಮಿಕರು) ಅನಕ್ಷರಸ್ಥರಾಗಿ, ಕಡು ಬಡತನದಿಂದ ತಮ್ಮ ನೆಲ ಮೂಲ ಸಂಸ್ಕೃತಿಗೆ ಅಂಟಿಕೊಂಡರೆ, ಯಜಮಾನ ನೇಕಾರರು ವೈದಿಕ ಸಂಸ್ಕೃತಿಯ ಅನುಕರಣೆಯಿಂದ, ಶೋಷಕ ವರ್ಗವಾಗಿ, ಮರದ ಕೊಡಲಿಯ ಕಾವೇ ಮರಕ್ಕೆ ಮೃತ್ಯುವಾದ ದುರಂತ ನೇಕಾರ ಜನಾಂಗದ್ದು."
380,ದೇಶಾಂತರ ಹೋಗಿದ್ದ ಕತ್ತೆಯ ಯಜಮಾನ ಅಗಸನೂ ಯಾವುದೋ ಕಾರಣದಿಂದ ಅಂದೇ ಆ ಊರಿಗೆ ಬರುತ್ತಾನೆ.
381,ಪೊನ್ನು ಕುಮಾರ್ ಯಜಮಾನ ಚಿತ್ರದ ನಿರ್ದೇಶನದ ಹೊಣೆ ಹೊತ್ತಿದ್ದಾರೆ.
382,ಚಿತ್ರದ ಟೈಟಲ್ನಿಂದ ಹಿಡಿದು ತಾರಾಗಣದವರೆಗೆ ಎಲ್ಲದರಲ್ಲೂ ಕುತೂಹಲ ಮೂಡಿಸಿರುವ ಯಜಮಾನ ಚಿತ್ರ ಮೈಸೂರಿನಲ್ಲಿ ಚಿತ್ರೀಕರಣ ಮಾಡುವ ಮೂಲಕ ತಾಕಿ ಪೋರ್ಷನ್ಗೆ ತೆರೆ ಎಳೆದಿದೆ.
383,ಸಿನಿಮಾ ರಿಲೀಸ್ ಆದ್ಮೇಲೆ ಕೂಡ ಯಜಮಾನ ಸಿನಿಮಾ ಸೌತ್ ಇಂಡಸ್ಟ್ರಿ ಮಂದಿಯ ಗಮನ ಸೆಳೆಯಬೇಕು ಎಂಬ ನಿರೀಕ್ಷೆ ಇದೆ.
384,"ಈ ಸಮಿತಿಯ ಏಕೈಕ ಹೋರಾಟಗಾಗ ಯಜಮಾನ ಶಾಂತರುದ್ರಪ್ಪ, ದಶಕಗಳಿಂದ ಘೋರ್ಪಡೆ ಮನೆತನದ ವಿರುದ್ಧ ವ್ಯಕ್ತಿಗತ ನೆಲೆಯಲ್ಲಿ ಹೋರಾಟ ನಡೆಸಿದ್ದರು."
385,ದರ್ಶನ್ ಅಭಿನಯದ ಯಜಮಾನ ಸಿನಿಮಾ ಮಾರ್ಚ್ 1 ರಂದು ವರ್ಲ್ಡ್ ವೈಡ್ ತೆರೆಕಾಣುತ್ತಿದೆ.
386,ಆಗ ತಾನೇ ಮನೆಗೆ ಯಜಮಾನ ಬಂದಿದ್ದನು.
387,ಸುಪ್ರದೀಪ್ ಯಜಮಾನ ಅವರ ಉಪಾಧ್ಯಕ್ಷರ ಅವಧಿ 2-06-2021ಕ್ಕೆ ಕೊನೆಗೊಳ್ಳಲಿದೆ.
388,# ಜೀವ ಪಣಕ್ಕಿಟ್ಟು ನಿಲ್ಲುವ ಮನೆಯ ಯಜಮಾನ
389,ಬೆಂಗಳೂರು: ಚಾಲೆಂಜಿಂಗ್ ಸ್ಟಾರ್ ದರ್ಶನ್ ಅಭಿನಯದ ಯಜಮಾನ ಸಿನಿಮಾ ಸದ್ಯದಲ್ಲೇ ಕಿರುತೆರೆಯಲ್ಲಿ ಪ್ರಸಾರವಾಗಲಿದೆ.
390,"ಮೂರ್ತಿ, ವೀರಶೈವ ಸಮಾಜದ ಯಜಮಾನ ಕೆ."
391,ಚಾಲೆಂಜಿಂಗ್ ಸ್ಟಾರ್ ದರ್ಶನ್ ಅಭಿಯನದ ಯಜಮಾನ ಸಿನಿಮಾ
392,"ಅವುಗಳ ಯಜಮಾನ ಮತ್ತು ಅವನು, ಅವುಗಳ ಗುಲಾಮರಲ್ಲ."
393,ನಟ ದರ್ಶನ ಅವರು ಮುಂಬೈನಲ್ಲಿ ಯಜಮಾನ ಚಿತ್ರೀಕರಣದಲ್ಲಿ ಬ್ಯುಸಿ ಇರುವುದರಿಂದ ದರ್ಶನ್ ಮತದಾನದಿಂದ ದೂರ ಉಳಿದಿದ್ದಾರೆ.
394,ಕವಿರಾಜ್ ಸಾಹಿತ್ಯ ಬರೆದಿರುವ ಒಂದು ಮುಂಜಾನೆ ಹಾಡು ಯಜಮಾನ ಚಿತ್ರದ ರೋಮ್ಯಾಂಟಿಕ್ ಸಾಂಗ್.
395,ಮನೆಯ ಯಜಮಾನ ಅಲ್ಲಿ ದುಡಿದರೆ ಮಡದಿ ಮಕ್ಕಳಿಗೆ ಅನ್ನ-ಆಹಾರ.
396,ಪುನಃ ಸಾಯಂಕಾಲ ಐದು ಗಂಟೆಯ ನಂತರ ಮನೆಯ ಯಜಮಾನ ಸ್ನಾನ ಮಾಡಿ ಮಡಿಯುಟ್ಟು ದೀಪ ಹಚ್ಚಿ ಮಂತ್ರ ಹೇಳುತ್ತ ಗೌರಿ ಕಲಶದ ನೀರಿನಿಂದ ದೇವರಿಗೆ ಅಭಿಶೇಕ ಮಾಡಿ ಪೂಜೆ ಮಾಡುತ್ತಿದ್ದರು.
397,ಕುಮಾರ್ ನಿರ್ದೇಶನದ ಯಜಮಾನ ಚಿತ್ರವನ್ನ ಬಿ.
398,ಈಗಾಗಲೇ ಈ ಯಜಮಾನ ಚಿತ್ರ ಬಿಡುಗಡೆಯಾದ ಹಾಡುಗಳಿಂದಲೇ ಸಾಕಷ್ಟು ಸೌಂಡ್ ಮಾಡುತ್ತಿತ್ತು.
399,ಇದರಿಂದ ಕೋಟ್ಯಾಂತರ ಖರ್ಚು ಮಾಡುವ ನಿರ್ಮಾಪಕರಿಗೆ ಹೊಡೆತ ಬೀಳುತ್ತದೆ ಎಂದು ಯಜಮಾನ ಚಿತ್ರತಂಡ ನೋವು ತೋಡಿಕೊಂಡಿದೆ‌.
400,"ಸ್ವಲ್ಪ ನಂತರ, ಅಲೆಕ್ಸಿ Mikhailovich ಈಗಾಗಲೇ ಯಾರು ಮನೆಯ ಯಜಮಾನ ಮತ್ತು ಮೆಟ್ರೊಪಾಲಿಟನ್ಸ್ ಬಳಸಲಾರಂಭಿಸಿದರು ತರಬೇತುದಾರ, ಕಾಣಿಸಿಕೊಂಡರು."
401,"ಹೌದು, ಈಗಾಗಲೇ ಯಜಮಾನ ಸಿನಿಮಾದಲ್ಲಿ ಕೃಷ್ಣನ ರಾಣಿಯಾಗಿ ಮೆರೆದಿದ್ದ ರಶ್ಮಿಕಾ ತಮ್ಮ ಮುಂದಿನ ಎಲ್ಲಾ ಚಿತ್ರಗಳಿಗೂ ಅದೇ ಫಿಟ್ನೆಸ್ ಕಾಯ್ದುಕೊಳ್ಳೊ ಸಲುವಾಗಿ ಇದೀಗ ಸಿಕ್ಕಾಪಟ್ಟೆ ವರ್ಕೌಟ್ ಶುರುಮಾಡಿದ್ದಾರೆ."
402,"ದಿನದಿಂದ ದಿನಕ್ಕೆ ಯಜಮಾನ ಸಿನಿಮಾ ನೋಡ್ಬೇಕು ಅನ್ನೋ ಕುತೂಹಲ ಹೆಚ್ಚಾಗ್ತಿದ್ದು, ಆ ಕುತೂಹಲವನ್ನ ಮತ್ತೊಂದು ಹಂತಕ್ಕೇರಿಸಲು ಟ್ರೈಲರ್ ರಿಲೀಸ್ ಮಾಡ್ತಿದೆ ಚಿತ್ರತಂಡ."
403,ದೊಡ್ಡ ತಲೆಯ ಹುಲಿ ಮುಂತಾ-ದ ಏಳೆಂಟು ಹುಲಿಗಳು ಬಂದು ಮನೆ ಯಜಮಾನ ಅಥವಾ ಯಜಮಾನತಿಯ ಕಾಲು ಮುಟ್ಟಿ ನಮಸ್ಕರಿಸಿ ನರ್ತಿಸುತ್ತ-ವೆ.
404,ಇಲ್ಲಿ ಯಜಮಾನ ಮನೆಯಲ್ಲಿ ಇಲ್ಲದಾಗ ಮಕ್ಕಳದೇ ಪಾರುಪತ್ಯವಾಗಿ ಮನೆ ತುಂಬ ಬಣ್ಣ ಬಣ್ಣದ ಕಲರವ ತುಂಬಿ ತುಳುಕಾಡುತ್ತಿರುತ್ತದೆ.
405,"ದರ್ಶನ್ ರ 50ನೇ ಚಿತ್ರ ಕುರುಕ್ಷೇತ್ರ ಬಿಡುಗಡೆಗೆ ರೆಡಿಯಾಗಿದ್ದು, ಯಜಮಾನ ಚಿತ್ರದ ಎರಡು ಹಾಡುಗಳ ಶೂಟಿಂಗ್ ಉಳಿದಿದೆ."
406,ಸುದ್ದಿಗಾರರೊಂದಿಗೆ ನಿನ್ನೆ ಇಲ್ಲಿ ಮಾತನಾಡಿದ ಜಿನಮಂದಿರ ಟ್ರಸ್ಟ ಅಧ್ಯಕ್ಷ ಜಯಪಾಲ ಸಾವಂತ ಈ ಮಹಾಮಹೋತ್ಸವದ ಯಜಮಾನ ಸವಾಲ ಕಾರ್ಯಕ್ರಮ ಇದೇ 22ರಂದು ಮಧ್ಯಾಹ್ನ 12 ಗಂಟೆಗೆ ಕಸಮಳಗಿ ಗ್ರಾಮದ ನೂತನ ಜಿನಮಂದಿರದಲ್ಲಿ ನಡೆಯಲಿದೆ ಎಂದು ಹೇಳಿದರು.
407,"ಯಜಮಾನ ಮತ್ತು ಕುರುಕ್ಷೇತ್ರಗಳ ಮೂಲಕ ಸತತ ಹಿಟ್ ಕೊಟ್ಟಿರುವ ದರ್ಶನ್, ಈಗ ಒಡೆಯ ಬಿಡುಗಡೆಗೆ ರೆಡಿಯಾಗಿದ್ದಾರೆ."
408,ತಂಡದ ಯಜಮಾನ ಧೋನಿ ಮೊನ್ನೆ ಚೆಪಾಕ್ ಅಂಗಳಕ್ಕೆ ಬಂದಾಗ ಧೋನಿಗೆ ಅದ್ದೂರಿ ಸ್ವಾಗತ ಸಿಕ್ಕಿತ್ತು.
409,"ಆ ಸಿನಿಮಾದ ಆರಂಭದ ದೃಶ್ಯದಲ್ಲೇ ಒಬ್ಬ ವ್ಯಕ್ತಿ ತಾನು ಎರಡನೇ ಮದುವೆ ಆಗಬೇಕು ಅಂತ ಬಂದಾಗ, ಊರ ಯಜಮಾನ ತೀರ್ಪು ಕೊಡ್ತಾರೆ."
410,ಅದರ ಪರಿಣಾಮ ಯಜಮಾನ ಚಿತ್ರ ಶೂಟಿಂಗ್ ಮುಗಿಸಿ ರಿಲೀಸ್ ಗೆ ರೆಡಿಯಾಗೋಯ್ತು.
411,ಯಜಮಾನ ಚಿತ್ರದಲ್ಲಿ ಕೃತಿ ಬದಲು ಇದೀಗ ಟಾಲಿವುಡ್ ನಟಿ ತಾನ್ಯ ಹೋಪ್ ಅಭಿನಯಿಸುತ್ತಿದ್ದಾರೆ.
412,ಅದಕ್ಕೆ ಇಂಡಸ್ಟ್ರಿಯಲ್ಲಿ ಒಬ್ಬರನ್ನ ರಾಜಕುಮಾರ ಅಂದ್ರೆ ಇನ್ನೊಬ್ಬರನ್ನ ಯಜಮಾನ ಅಂತಾರೆ.
413,"ಕುರುಕ್ಷೇತ್ರ, ಯಜಮಾನ ಚಿತ್ರಗಳ ನಂತರ ಈಗ ಡಿಬಾಸ್ ಒಡೆಯ ಶೂಟಿಂಗ್​​ನಲ್ಲಿ ಬಿಜಿಯಾಗಿದ್ದಾರೆ."
414,ಮನೆಯ ಯಜಮಾನ ತನ್ನ ಕುಟುಂಬಕ್ಕೆ ಪರಿಸರದ ಸ್ವಚ್ಚತೆ ಬಗ್ಗೆ ಅರಿವು ಮೂಡಿಸಿದ ಮೇಲೆ ಉಳಿದ ಸಂಘ-ಸಂಸ್ಥೆಗಳು ಅದನ್ನು ನಿಭಾಯಿಸಿಕೊಂಡು ಹೋಗಲು ಸಾಧ್ಯ ಎಂದು ಏಳನೇ ಹೆಚ್ಚುವರಿ ಜಿಲ್ಲಾ ಮತ್ತು ಸತ್ರ ನ್ಯಾಯಾಧಿಧೀಶ ಮಹಾಂತಪ್ಪ ಎ.
415,ಈ ಹಿಂದೆ ದರ್ಶನ್ ಅವರ ಯಜಮಾನ ಸಿನಿಮಾ ರಿಲೀಸ್ ಆದಾಗಲೂ ಸುಮಲತಾ ಅಂಬರೀಶ್ ಟ್ವೀಟ್ ಮಾಡಿ ಶುಭ ಕೋರಿದ್ದರು.
416,"ತಮ್ಮದೇ ಅಸ್ಮಿತೆ, ಅನನ್ಯತೆಯ ಈ ಆಟ ಸಾಂಸ್ಕೃತಿಕ ಆಚರಣೆಯೇ ಹೊರತು, ಯಜಮಾನ ಸಂಸ್ಕೃತಿಯದಲ್ಲ ಎನ್ನುವುದು ಜಲ್ಲಿಕಟ್ಟು ಪರ ವಾದ."
417,16-ಚಾಲೆಂಜಿಂಗ್ ಸ್ಟಾರ್ ದರ್ಶನ್ ಅಭಿನಯದ ಯಜಮಾನ ಚಿತ್ರದ ಶಿವನಂದಿ ಹಾಡು ಸಂಕ್ರಾಂತಿ ಹಬ್ಬದ ವಿಶೇಷವಾಗಿ ಬಿಡುಗಡೆಯಾಗಿದೆ.
418,ನನ್ನ ಚಿತ್ರದ ಟೈಟಲ್ ಯಜಮಾನ ಎಂದೇ ಇರಬಹುದು.
419,ನವೋದಯವೆಂಬ ಹೆಸರೇ ಯಜಮಾನ ಸಾಹಿತ್ಯ – ಸಂಸ್ಕೃತಿಗಳ ಸ್ವೀಕಾರವನ್ನು ಸೂಚಿಸುತ್ತದೆ.
420,"ಮಂಗಳೂರು (ವಿಶ್ವಕನ್ನಡಿಗ ನ್ಯೂಸ್) : 2014 ರಲ್ಲಿ ನಮ್ಮ ಮನೆಗೆ ಚೌಕೀದಾರನನ್ನಾಗಿ ನೇಮಿಸಿದ್ದು, ಇದೀಗ ಅದೇ ಚೌಕಿದಾರ ನೀವೇನೇ ಈ ಮನೆ ಯಜಮಾನ ಎಂದು ಅನುಮಾನ ವ್ಯಕ್ತಪಡಿಸಿ ಕಾಗದ ಪತ್ರ ಕೇಳುವ ಪರಿಸ್ಥಿತಿ ಇಂದು ದೇಶದ ಪ್ರಜೆಗಳಿಗೆ ಎದುರಾಗಿದೆ ಎಂದು ಹಿರಿಯ ಪತ್ರಕರ್ತ, ಅಂಕಣಕಾರ ಶಿವಸುಂದರ್ ಆಕ್ರೋಶ ವ್ಯಕ್ತಪಡಿಸಿದರು."
421,ಹೌದು ಯಜಮಾನ ದರ್ಶನ್ ತಮ್ಮ ಯಜಮಾನರ ಬಗ್ಗೆ ವ್ಯಾಖ್ಯಾನ ಮಾಡಿದ್ದಾರೆ.
422,ಯೋಚನಾಶಕ್ತಿಯು ಯಜಮಾನ ಹಾಗೂ ಅಧೀನ ನೆಲೆಗಳಿಗೆ ಸಮಾನವಾಗಿಯೇ ಇರಬಹುದು.
423,"ಕುಂದಾಪುರ ಯುವಬಂಟರ ಸಂಘದ ಅಧ್ಯಕ್ಷ ಸುಕೇಶ ಶೆಟ್ಟಿ ಹೊಸಮಠ, ಸಾಲಿಗ್ರಾಮ ಮೇಳದ ಯಜಮಾನ ಪಿ."
424,"ಈಗಷ್ಟೇ ಚಾಲೆಂಜಿಂಗ್ ಸ್ಟಾರ್ ದರ್ಶನ್ ಅಭಿನಯದ ಯಜಮಾನ ಚಿತ್ರದ ಟ್ರೈಲರ್ ರಿಲೀಸ್ ಆಗಿದ್ದು, ಮಿಠಾಯಿ ಸೂರಿ ಪಾತ್ರದಲ್ಲಿ ಧನಂಜಯ್ ಕಮಾಲ್ ಮಾಡ್ತಿದ್ದಾರೆ."
425,"ಯಕ್ಷರಾತ್ರಿ ತೃತೀಯ ಹೆಜ್ಜೆ ಕಾರ್ಯಕ್ರಮ ಅಧ್ಯಕ್ಷತೆಯನ್ನು ಕುಂದಾಪುರ ಫ್ಯಾಶನ್ ಕೋಟ್ ಮಾಲೀಕ ಕಾರ್ತಿಕೇಯ ಮಧ್ಯಸ್ಥ, ಮುಖ್ಯಅತಿಥಿಗಳಾಗಿ ಪೆರ್ಡೂರು ಹಾಗೂ ಹಾಲಾಡಿ ಮೇಳದ ಯಜಮಾನ ಕರುಣಾಕರ ಶೆಟ್ಟಿ, ವೇ."
426,"ಈ ಹಿನ್ನೆಲೆಯಲ್ಲಿ ಮನೆ ಯಜಮಾನ ಕೊಹ್ಲಿಗೆ ದಂಡ ವಿಧಿಸಿದ್ದು, ನೊಟೀಸ್​ ರವಾನಿಸಿದ್ದಾರೆ."
427,"ತಲಬಾಗಿಲು ದಾಟಿದರೆ ಅದಕ್ಕೆ ಹೊಂದಿಕೊಂಡು ಒಳಭಾಗದ ಇಕ್ಕೆಲಗಳಲ್ಲಿ ಒಂದೊಂದು ಕೋಣೆ ಇದ್ದು ಒಂದರಲ್ಲಿ ಮನೆಯ ಯಜಮಾನ ಇರುತ್ತಿದ್ದು ಮತ್ತೊಂದರಲ್ಲಿ ಆಪ್ತರು, ಸ್ನೇಹಿತರು ಬಂದಾಗ ಎದುರುಗೊಂಡು ಮಾತಾಡಿಸಲು ಮೀಸಲಿಡಲಾಗಿರುತ್ತದೆ."
428,ಯಜಮಾನ ಸಿನಿಮಾ ಬಿಡುಗಡೆಗೆ ಕೇವಲ ಒಂದು ದಿನ ಮಾತ್ರ ಉಳಿದಿದೆ.
429,ಯಜಮಾನ ಚಿತ್ರವೂ ಆಕಾಲದಲ್ಲಿ 45 ಕೋಟಿ ರೂಪಾಯಿಯಷ್ಟು ಗಳಿಕೆಯನ್ನು ಹೊಂದಿತ್ತು.
430,"ಆಕಾಶಕ್ಕೆ ತಲೆಕೊಟ್ಟು ಭೂಮಿಗೆ ಬೆವರಿಳಿಸಿ ನಿಯತ್ತಿಂದ ಕಟ್ಟಿ ಸ್ವಂತ ಬ್ರಾಂಡ್ ಮಾಡಿ ಹಳ್ಳಿಗಾಡಲ್ಲಿ ಅಷ್ಟು ವರ್ಷ ಕಷ್ಟ ಪಟ್ಟು , ಬಂದಿದ್ದ ಅಲ್ಪಸ್ವಲ್ಪ ಕಾಸಲ್ಲೆ ತಾನೇ ಯಜಮಾನ ಆಗಿ ನೆಮ್ಮದಿಯಿಂದ ಇದ್ದವ."
431,ಯಜಮಾನ ಪ್ರಸಾರ ದಿನಾಂಕವನ್ನು ಅಮೆಜಾನ್ ಪ್ರೈಮ್‌ ಇನ್ನೂ ಘೋಷಿಸಿಲ್ಲ.
432,ಒಟ್ನಲ್ಲಿ ಯಜಮಾನ ಪಕ್ಕಾ ಔಟ್ ಅಂಡ್ ಔಟ್ ಮಸಾಲ ಎಂಟಟೈನರ್ ಆಗಿರಲಿದ್ದು.
433,ಯಜಮಾನ ಸಿನಿಮಾದ ಎರಡು ಸಾಂಗ್ಸ್ ಯೂಟ್ಯೂಬ್​ನಲ್ಲಿ ಧೂಳೆಬ್ಬಿಸಿದ ಮೇಲೆ ಮತ್ತೊಂದು ಸಾಂಗ್ ಅಪ್​​ಲೋಡ್ ಆಗಿದೆ.
434,"ಮುಟ್ಟಿದನ್ನು ಯಶಸ್ವಿಯಾಗಿ ಗುರಿತಲುಪುವ ರಿಲಯನ್ಸ್ ಇಂಡಸ್ಟ್ರೀಸ್ ಸಂಸ್ಥೆಯ ಯಜಮಾನ ಮುಖೇಶ್ ಅಂಬಾನಿಯವರ ಬಹು ನಿರೀಕ್ಷಿತ ಜಿಯೋ ಗಿಗಾ ಫೈಬರ್ ಬ್ರಾಡ್ ಬ್ಯಾಂಡ್ ಸೇವೆ ನಾಳೆಯಿಂದ (ಸೆ 5), ಭಾರತದ ಹಲವು ನಗರಗಳಿಗೆ ಅಪ್ಪಳಿಸಲಿದೆ."
435,ಅಮೆರಿಕ ಅಧ್ಯಕ್ಷರಾಗಲು ತಯಾರಿ ನಡೆಸುತ್ತಿದ್ದಾರಾ ಫೇಸ್ಬುಕ್ ಯಜಮಾನ ಮಾರ್ಕ್ ಜುಕರ್ಬರ್ಗ್?
436,ಸ್ವೀಡನ್‍ನಲ್ಲಿ ಯಜಮಾನ ಚಿತ್ರೀಕರಣ ವೇಳೆ ದರ್ಶನ್‍ಗೆ ಕಿಡಿಗೇಡಿಗಳ ಕಾಟ
437,ಬಹುಶಃ ಯಜಮಾನ ಚಿತ್ರದ ಆಸುಪಾಸಿನಲ್ಲಿಯೇ ಭೈರವಗೀತಾ ಕೂಡಾ ದರ್ಶನ ಕೊಡಲಿದ್ದಾರೆ!
438,ಕುಟುಂಬದ ಯಜಮಾನ ಸಾವನ್ನಪ್ಪಿದರೆ ಮೇಲ್ನೋಟಕ್ಕೆ ಬಡ ಕುಟುಂಬ ಎಂದು ಕಂಡುಬಂದ ತಕ್ಷಣ ರೂ.
439,ಯಜಮಾನ ಸಿನಿಮಾ ಹವಾ ಬಾಕ್ಸಾಫೀಸ್​ನಲ್ಲಿ ಮುಂದುವರೆದಿದೆ.
440,Home ಕನ್ನಡ ವಾರ್ತೆಗಳು ಮನೋರಂಜನೆ ಹ್ಯಾಪಿ ಮೂಡ್ ನಲ್ಲಿ ಸ್ವಿಮ್ಮಿಂಗ್ ಮಾಡಿದ ಯಜಮಾನ ಚಿತ್ರದ ನಟಿ ತಾನ್ಯಾ!
441,"ಯಜಮಾನ ಮತ್ತು ಸಂತೋಷವನ್ನು ಉದ್ದ ಕೂದಲಿನ ಸಿರಿಯನ್ ಹ್ಯಾಮ್ಸ್ಟರ್, ಅನ್ಗೊರಾ ಕರೆಯಲ್ಪಡುವ."
442,ಯಜಮಾನ ಗೋಸಾಯಿಗೆ ಎರಡು ಸಾವಿರ ರೂಪಾಯಿ ಕೊಡುತ್ತೇವೆ ಎಂದು ನಾವು ಒಪ್ಪಿಕೊಂಡಿದ್ದೇವೆ.
443,ಇತ್ತೀಚೆಗಷ್ಟೇ ಯಜಮಾನ ಸೆಟ್‌ನಲ್ಲಿ ಯಜಮಾನ್ತಿಯನ್ನು ಕಂಡು ಡಿ- ಫ್ಯಾನ್ಸ್ ಒಂದು ವಾರಕ್ಕೆ ಮುಂಚೇನೇ ಹಬ್ಬವನ್ನು ಸೆಲಬ್ರೇಟ್ ಮಾಡಿದ್ರು.
444,ಅರ್ಚಕ ಬುಡಕಟ್ಟಿನ ಯಜಮಾನ ಅಥವಾ ಯಾವುದೇ ಒಬ್ಬ ವ್ಯಕ್ತಿಯ ಮೈಯಲ್ಲಿ ದೇವರು ಪ್ರವೇಶ ಮಾಡುವುದು ಮೈದುಂಬುವುದು.
445,ನಿಖರವಾದ ಆಕಾರ ಮತ್ತು ರೂಪದಿಂದಿರುವ ಜೀವಿಯನ್ನು ಯಜಮಾನ ಅಥವಾ ಒಡೆಯ ಎಂದು ಕರೆಯಲಾಗುತ್ತದೆ.
446,"ಅಧೀನ ಸಂಸ್ಕೃತಿಯ ಇಲ್ಲವೆ ಯಜಮಾನ ಸಂಸ್ಕೃತಿಯಲ್ಲಾಗಲಿ, ಪ್ರಭುತ್ವ ಸಂಸ್ಕೃತಿಯ ನೆಲೆಯಲ್ಲಾಗಲಿ, ಸ್ತ್ರೀಯ ಪಾತ್ರ ಬದಲಾಗಲೇ ಇಲ್ಲ."
447,ಯಜಮಾನ ಚಿತ್ರದಲ್ಲಿ ದರ್ಶನ್‌ಗೆ ನಾಯಕಿಯಾಗಿ ಕಿರಿಕ್ ಬೆಡಗಿ ರಶ್ಮಿಕಾ ಮಂದಣ್ಣ ಹಾಗೂ ತಾನ್ಯ ಹೋಪ್ ನಟಿಸಿದ್ದಾರೆ.
448,ಕೇವಲ 24 ಗಂಟೆಯಲ್ಲಿ 10 ಮಿಲಿಯನ್ ವೀಕ್ಷಣೆ ಕಂಡಿದೆ ಎಂದು ಹೇಳಲಾಗ್ತಿರುವ ಯಜಮಾನ ಟ್ರೇಲರ್ ಸದ್ಯ 11.
449,ಮನೆಯ ಯಜಮಾನ ಬಳೆಕೆಂಪ ಆಧುನಿಕ ಕಾಲದ ಬಳೆಗಾರ.
450,"ಅಲ್ಲದೆ, ತಾಲ್ಲೂಕಿನ ಸಾಲುಕೊಪ್ಪಲು ಗ್ರಾಮದ ಯಜಮಾನ ಅಣ್ಣೇಗೌಡ ಎಂಬುವವರ ₹ 1."
451,ಸದ್ಯ ಅವರ 50ನೇ ಚಿತ್ರ ಕುರುಕ್ಷೇತ್ರನಾ ಅಥವಾ ಯಜಮಾನ ಎಂಬ ಗೊಂದಲ ಅಭಿಮಾನಿಗಳಲ್ಲಿ ಮೂಡಿದೆ.
452,ಮೈಸೂರಿನಲ್ಲಿಯೇ ನಿರ್ಮಿಸಲಾಗಿದ್ದ ವಿಶೇಷವಾದ ಸೆಟ್ಟಿನಲ್ಲಿ ಯಜಮಾನ ಚಿತ್ರದ ಚಿತ್ರೀಕರಣ ಪ್ರಾರಂಭವಾಗಿತ್ತು.
453,ಭರ್ಜರಿ ಪ್ರದರ್ಶನ ಕಾಣುತ್ತಿರುವ ಯಜಮಾನ ಚಿತ್ರ ಪೈರಸಿ ಆಗುವ ಸಾಧ್ಯತೆ ಇದ್ದು ಅದನ್ನು ತಪ್ಪಿಸಲು ಚಿತ್ರತಂಡ ಸಾಮಾಜಿಕ ಜಾಲತಾಣದಲ್ಲಿ ದೂರು ನೀಡಲು ದೂರವಾಣಿ ಸಂಖ್ಯೆ ಹಾಗೂ ಇ-ಮೇಲ್ ಐಡಿ ನೀಡಿದೆ.
454,"ವರ್ಷದ ಆರಂಭದಲ್ಲಿ ಯಜಮಾನ ಹಾಗೂ ವರ್ಷದ ಮಧ್ಯದಲ್ಲಿ ಕುರುಕ್ಷೇತ್ರ, ಈಗ ವರ್ಷದ ಕೊನೆಗೆ ಒಡೆಯನಾಗಿ ಅಬ್ಬರಿಸುವುದಕ್ಕೆ ರೆಡಿಯಾಗಿದ್ದಾರೆ ಚಾಲೆಂಜಿಂಗ್​ ಸ್ಟಾರ್​."
455,ಕಳೆಂಜ ಗ್ರಾಮದ ಬರೆಂಗಾಯ ಗುಡ್ಡೆ ಮನೆಯ ಯಜಮಾನ ಡೊಂಬಯ್ಯ ಗೌಡ ಮತ್ತು ಕಳೆಂಜ ಗ್ರಾ.
456,"ಕಳ್ಳ ಕಾಯುತ್ತಿದ್ದಾನೆ, ಕಾಯುತ್ತಲೇ ಇದ್ದಾನೆ ಮನೆಯ ಯಜಮಾನ ಮಲಗಲೆಂದು."
457,ಎಂಥ ಮಾತ ಹೇಳ್ತಾ ಇದ್ದೀರಿ ಯಜಮಾನ
458,ಯಜಮಾನ ಮೂಲೆ­ಯಲ್ಲಿದ್ದ ಬಟ್ಟೆಯನ್ನು ತೆಗೆದು­ಕೊಂಡು ಅದರ ಮೈ ಒರೆಸಿದ.
459,"ಕೆಜಿಎಫ್, ಯಜಮಾನ ಈಗ ಕೆಮಿಸ್ಟ್ರಿ ಆಫ್ ಕರಿಯಪ್ಪ."
