Index,Sentence
460,ಯಜಮಾನ ಚಿತ್ರದ ತಮ್ಮ ಅನುಭವಗಳನ್ನು ಶಂಕರ್ ಅವರು ತಮ್ಮ ಫೇಸ್ ಬುಕ್ ಖಾತೆಯಲ್ಲಿ ಬರೆದುಕೊಂಡು ಹಂಚಿಕೊಳ್ಳುವ ಸಂದರ್ಭದಲ್ಲಿ ರಶ್ಮಿಕಾ ಮಂದಣ್ಣ ಬಗ್ಗೆ ಬರೆದಿದ್ದಾರೆ.
461,"ಬಿಳಿಬಣ್ಣದ ಒಂಟಿ ಕೊಕ್ಕರೆಯನ್ನಿರಿಸಿದರೆ ಅದು ಕುಟುಂಬ ಸದಸ್ಯರ ನಡುವೆ ಹಿತ ಕಾಪಾಡುವದು,ಜೋಡಿ ಬಿಳಿ ಕೊಕ್ಕರೆಗಳನ್ನಿರಿಸಿದರೆ ಮನೆ ಯಜಮಾನ ಯಜಮಾನಿಯ ನಡುವೆ ಒಗ್ಗಟ್ಟು ಇದ್ದು ಕುಟುಂಬ ಸಲೀಸಾಗಿ ಸಾಗುತ್ತದೆ."
462,ಕತ್ತೆಯ ಯಜಮಾನ ಎಲ್ಲಿ ಹೋದನೋ?
463,ಯಜಮಾನ ಚಿತ್ರದ ಹಾಡುಗಳು ಬಹುದೊಡ್ಡ ದಾಖಲೆ ಬರೆದಿತ್ತು.
464,ಒಮ್ಮೆ ಬೆಕ್ಕಿನ ಯಜಮಾನ ತನ್ನೆಲ್ಲಾ ಕುಟುಂಬಸ್ಥರನ್ನು ಕರೆದುಕೊಂಡು ಯಾವುದೋ ಊರಿಗೆ ತೆರಳುವ ಸೂಚನೆ ಅರಿತ ಬೆಕ್ಕು ಅಂದು ಸಾಯಂಕಾಲ ಕೊಕ್ಕರೆಯನ್ನು ತನ್ನ ಮನೆಗೆ ಉಪಾಹಾರಕ್ಕೆ ಬರಲು ಕೇಳಿಕೊಂಡಿತು.
465,"ಇವರನ್ನೆಲ್ಲ ಬಿಟ್ಟು ನೃತ್ಯ ನಿರ್ದೇಶಕ, ಸಾಹಸ ನಿರ್ದೇಶಕರು ಕೂಡ ಯಜಮಾನ ಜೊತೆ ಇದ್ದಾರೆ."
466,"ಬೆಂಗಳೂರು ವಿವಿಯಿಂದ ಗೌರವ ಡಾಕ್ಟರೇಟ್ ಪಡೆದಿರುವ ವಿಷ್ಣು, ನಾಗರಹಾವು (1972), ಗಂಧದಗುಡಿ (1973), ಭೂತಯ್ಯನ ಮಗ ಅಯ್ಯು (1974), ಹೊಂಬಿಸಿಲು (1977), ಸಾಹಸ ಸಿಂಹ (1982), ಬಂಧನ (1984), ಜೀವನ ಚಕ್ರ (1985), ಮಲಯ ಮಾರುತ (1985), ಸುಪ್ರಭಾತ (1988), ಹೃದಯಗೀತೆ (1989), ಮುತ್ತಿನ ಹಾರ (1990), ಮತ್ತೆ ಹಾಡಿತು ಕೋಗಿಲೆ (1990), ನಿಷ್ಕರ್ಷ (1993), ಯಜಮಾನ (2000), ಆಪ್ತಮಿತ್ರ (2004), ವಿಷ್ಣುಸೇನಾ (2005)ಸೇರಿದಂತೆ ಅನೇಕ ಚಿತ್ರಗಳಲ್ಲಿ ಸ್ಮರಣೀಯ ಅಭಿನಯ ನೀಡಿದ್ದಾರೆ."
467,ಸುಮಾರು 25 ವರ್ಷಗಳ ಅವಧಿಯಲ್ಲಿ ತನ್ನ ಮಾಲಿಕನಿಗೆ ಅತೀ ಹೆಚ್ಚು ಲಾಭ ಮಾಡಿಕೊಟ್ಟಿರುವ ಈ ಗೋ ಮಾತೆಯ ಋಣವನ್ನು ತೀರಿಸುವ ಉದ್ದೇಶದಿಂದ ಈ ಆಕಳುವಿನ ಹುಟ್ಟುಹಬ್ಬವನ್ನು ಭರ್ಜರಿಯಾಗಿ ಆಚರಿಸುವ ಮೂಲಕ ಇದರ ಯಜಮಾನ ತನ್ನ ಗೋಪ್ರೀತಿಯನ್ನು ಪ್ರಚುರಪಡಿಸಿದ್ದಾರೆ.
468,"ದಯಾಳ್ ತಾನು ಬಿಗ್ ಬಾಸ್ ಮನೆಯ ಯಜಮಾನ ಎಂಬಂತೆ ವರ್ತಿಸುತ್ತಿದ್ದಾರೆ, ತಾನು ಹೇಳಿದ್ದೆ ಆಗಬೇಕು ನಾನೇ ರೈಟು ಎನ್ನುವಂತೆ ವರ್ತಿಸುತ್ತಾರೆ."
469,ಕಡೆಗೂ ಅಭಿಮಾನಿಗಳೆಲ್ಲ ಅಗಾಧ ನಿರೀಕ್ಷೆಯಿಂದ ಕಾಯುತ್ತಿದ್ದ ಅಭಿಮಾನಿಗಳಿಗೆ ಯಜಮಾನ ಚಿತ್ರದಲ್ಲಿ
470,"ಮೈಸೂರಿನಲ್ಲಿ ತಮ್ಮ ಯಜಮಾನ ಚಿತ್ರದ ಚಿತ್ರೀಕರಣದ ಸೆಟ್‍ಗೇ ಕರೆಸಿಕೊಂಡಿದ್ದ ದರ್ಶನ್, ಚಿತ್ರೀಕರಣವನ್ನೆಲ್ಲ ತೋರಿಸಿ, ಮಗುವಿನ ಆರೋಗ್ಯಕ್ಕಾಗಿ ಪ್ರಾರ್ಥಿಸಿದ್ದಾರೆ."
471,ಯಜಮಾನ ಕಟ್ಟಿಸಿದ ಕೆರೆಯಲ್ಲಿ ನೀರು ತುಂಬಲು ಸರ್ವರ ಹಿತಕ್ಕಾಗಿ ಅವರ ಸೊಸೆ ಬಲಿಯಾಗುತ್ತಾಳೆ.
472,"ಯಜಮಾನ ಚಿತ್ರಕ್ಕೆ ದೇಶ ವಿದೇಶದಲ್ಲೂ ಸಿಕ್ಕಾಪಟ್ಟೆ ಡಿಮ್ಯಾಂಡ್ ಇದ್ದು, ಕನ್ನಡದಲ್ಲಿ ಮಾತ್ರ ಮೀಡಿಯಾ ಹೌಸ್ ಸಂಸ್ಥೆ ಸಿನಿಮಾವನ್ನ ರಿಲೀಸ್ ಮಾಡ್ತಿದೆ."
473,"ಅಂಬಿ ಅಪ್ಪಾಜಿಯನ್ನು ಕಳೆದುಕೊಂಡಿರುವದನ್ನು ಅರಗಿಸಿಕೊಳ್ಳಲಾಗುತ್ತಿಲ್ಲ ಎಂದಿರುವ ನಟ ದರ್ಶನ್, ಸ್ವೀಡನ್ ನಲ್ಲಿ ನಡೆಯುತ್ತಿರುವ ಯಜಮಾನ ಚಿತ್ರೀಕರಣ ನಿಲ್ಲಿ ವಾಪಸಾಗುತ್ತಿದ್ದಾರೆ."
474,"ಕೌಟುಂಬಿಕ ಕಥೆಯನ್ನೊಳಗೊಂಡ ಯಜಮಾನ ಟ್ರೇಲರ್ ಗೆ ಅಭಿಮಾನಿಗಳು ಫಿದಾ ಆಗಿದ್ದು, ಯೂಟ್ಯೂಬ್ ಟ್ರೆಂಡಿಂಗ್ ನಲ್ಲಿ ನಂಬರ್ 1 ಸ್ಥಾನವನ್ನು ಗಿಟ್ಟಿಸಿಕೊಂಡಿದೆ."
475,ನಿಮ್ಮ ಮನೆಯಲ್ಲಿ ಹಣದ ಬಾಕ್ಸ್ ಅನ್ನು ಈ ದಿಕ್ಕಿಗೆ ಇಟ್ಟರೆ ವೃದ್ಧಿ ಅಭಿವೃದ್ಧಿ ನಿಶ್ಚಿತ ಆಗುತ್ತದೆ ಎಲ್ಲರೂ ಬಯಸುವುದು ನಾವು ಕಷ್ಟ ಪಟ್ಟಿದ್ದೇನೆ ಒಂದಷ್ಟು ಜನರಿಗೆ ಹಣವನ್ನು ಹೆಣ್ಣು ಮಕ್ಕಳು ಅಡುಗೆ ಮನೆಯ ಡಬ್ಬಿಯಲ್ಲಿ ಒಂದಷ್ಟು ದುಡ್ಡು ಎತ್ತಿಡುತ್ತಾರೆ ಮನೆಯ ಯಜಮಾನ ಕೂಡ ಅಷ್ಟೆ ಒಳ್ಳೆಯ ಊಟ ಆಗಲಿ ಒಳ್ಳೆಯ ಚಪ್ಪಲಿ ಆಗಲಿ ಒಳ್ಳೆಯ ವಸ್ತ್ರ ಆಗಲಿ ತನಗೋಸ್ಕರ ತೆಗೆದುಕೊಳ್ಳುವುದಿಲ್ಲ ಒಳ್ಳೆಯ ಊಟ ಕೂಡ ಹೊರಗಡೆ ತಿಂದಿದ್ದಾಗಲಿ ಮಾಡುವುದಿಲ್ಲ ಏನೋ ಹೊಟ್ಟೆ ಕಟ್ಟಿ ಬಟ್ಟೆ ಕಟ್ಟಿ ಆಸೆಗಳ ಬುತ್ತಿಯನ್ನು ಕಟ್ಟಿ ಅಷ್ಟೋ ಇಷ್ಟೋ ದುಡಿದಿದ್ದನ್ನು ಎತ್ತಿಡುತ್ತಾರೆ ಆದರೆ ಅದು ಇನ್ನಷ್ಟು ವೃದ್ಧಿ ಆಗಬೇಕು ಅದು ಅಕಾಲಿಕ ಖರ್ಚು ಆಗಬಾರದು ಅನಗತ್ಯ ಖರ್ಚು ಆಗಬಾರದು ಎನ್ನುವುದು ಪ್ರತಿಯೊಬ್ಬರಿಗೂ ಒಂದು ಉದ್ದೇಶ ಇರುತ್ತದೆ.
476,"ಯಜಮಾನ ಇದು ಫ್ಲಾಶ್ ಸಹಾಯದಿಂದ ಮಾಡಲಾಗುತ್ತದೆ ವೇಳೆ, ಇದು."
477,"ಕುರುಕ್ಷೇತ್ರ, ಯಜಮಾನ ಚಿತ್ರಗಳ ನಂತರ ದರ್ಶನ್ ಅವರ ಲುಕ್ ಸ್ವಲ್ಪ ಬದಲಾಗುತ್ತಿತ್ತು."
478,ಈ ನಡುವೆ ಅಮೇಜಾನ್ ಪ್ರೈಂ ವಿಡಿಯೋದಲ್ಲಿ ಯಜಮಾನ ಸಿನಿಮಾ ಟೆಲಿಕಾಸ್ಟ್ ಆಗಿದೆ.
479,ನಗರದಲ್ಲಿ ಯಜಮಾನ ಸಿನಿಮಾದ ಕೊನೆಯ ಹಾಡಿನ ಶೂಟಿಂಗ್ ನಡೆಯುತ್ತಿದ್ದು ಈ ವೇಳೆ ದರ್ಶನ್ ಯಜಮಾನ ಚಿತ್ರ ತಂಡದೊಂದಿಗೆ ಕೇಕ್.
480,ಎನ್ನುತ್ತ ಅಂಗಡಿಯ ಯಜಮಾನ ಪಾಲಿಷ್‌ನ ಡಬ್ಬಿಯನ್ನು ಆತನ ಎದುರಿಗಿರಿಸಿದ.
481,ಮನೆಯ ಯಜಮಾನ ಆಕಸ್ಮಿಕವಾಗಿ ಮೃತಪಟ್ಟರೆ ಕುಟುಂಬಕ್ಕೆ ₹ 1ಲಕ್ಷದ ಪರಿಹಾರವೂ ಇಲ್ಲಿ ದೊರೆಯಲಿದೆ.
482,"ರಾಮಾಚಾರಿ, ಸಾಹಸಸಿಂಹ, ಯಜಮಾನ ವಿಷ್ಣುವರ್ಧನ್ ಅವರಿಗೆ ನಿಮ್ಮ ಕಂಬನಿ ಮಿಡಿಯಲು ಮತ್ತು ಕುಟುಂಬಕ್ಕೆ ಸಂತಾಪ ಸೂಚಿಸಲು ಅನಿಸಿಕೆಗಳನ್ನು ಇಲ್ಲಿ ದಾಖಲಿಸಿ."
483,"ಜಿಲ್ಲಾ ಪಂಚಾಯತ್ ಉಪಾಧ್ಯಕ್ಷ ಸುಪ್ರದೀಪ್ತ್ ಯಜಮಾನ ನೋಟಿಸ್ ವಿಚಾರವಾಗಿ ಮಾತನಾಡಿದ ಅವರು, 6 ತಿಂಗಳಿಂದ ಮರಳು ಸಂಗ್ರಹಣೆ ಆಗುವವರೆಗೂ ಅಧಿಕಾರಿಗಳು ಏನೂ ಮಾಡುತ್ತಿದ್ದರು."
484,"ಕುರುಕ್ಷೇತ್ರ, ಪೈಲ್ವಾನ್, ಯಜಮಾನ ಅಂತಹ ಸಿನಿಮಾಗಳು ದೊಡ್ಡ ಮೊತ್ತ ಗಳಿಕೆ ಕಾಣುವ ಮೂಲಕ ಬಾಕ್ಸ್ ಆಫೀಸ್ ನಲ್ಲಿ ದಾಖಲೆ ಬರೆದಿದೆ."
485,ಈಗಾಗಲೆ ಚಿತ್ರೀಕರಣ ಮುಗಿಸಿರೊ ಯಜಮಾನ ಸದ್ಯದಲ್ಲೆ ದರ್ಶನ ನೀಡಲಿದೆ.
486,ಯಜಮಾನ ಟೈಟಲ್‍ನ ಚಿತ್ರದಲ್ಲಿ ನಟಿಸುತ್ತಿದ್ದೇನೆ ಎನ್ನುವುದೇ ಖುಷಿಯ ವಿಚಾರ ಎಂದು ಖುಷಿಗೊಂಡಿದ್ದಾರೆ ದರ್ಶನ್.
487,"ಇನ್ನು ವಿದ್ಯಾರ್ಥಿಗಳಿಗಾಗಿ ದರ್ಶನ್ ಯಜಮಾನ ಸಿನಿಮಾದ ಡೈಲಾಗ್ ಹೊಡೆದಿದ್ದು, ಏ ಕ್ಯಾಡ್ಬರೀಸ್ …."
488,ಸ್ವೀಡನ್ ಅಲ್ಲಿ ನಡೆಯುತ್ತಿದ್ದ ಯಜಮಾನ ಶೂಟಿಂಗ್.
489,"ಪತ್ನಿಯರು, 89 ಮಕ್ಕಳು, ಅಸಂಖ್ಯಾತ ಮೊಮ್ಮಕ್ಕಳೊಂದಿಗೆ 72ನೇ ಜನ್ಮದಿನ ಆಚರಿಸಿಕೊಂಡ ಯಜಮಾನ"
490,Read more about: darshan yajamana v harikrishna kannada cinema sandalwood ದರ್ಶನ್ ಯಜಮಾನ ವಿ ಹರಿಕೃಷ್ಣ ಕನ್ನಡ ಸಿನಿಮಾ ಸ್ಯಾಂಡಲ್ ವುಡ್
491,ಯಜಮಾನ ಬೆಲರೂಸಿಯನ್ ಹುಡುಗಿಯರು ಸ್ವತಂತ್ರ ಅನ್ಯಾ ಎಂದು ಪ್ರಯತ್ನಿಸಿ.
492,"ಇಂತಹ ನಿರಾಕರಣೆಯ ನೇರ ಸಾಧನ ಅಧೀನ ಸಂಸ್ಕೃತಿಯ ಗತವೈಭವವನ್ನು ದಾಖಲಿಸಿ, ಆ ಮೂಲಕ ಯಜಮಾನ ಸಂಸ್ಕೃತಿಯನ್ನು ಎದುರಿಸುವುದು."
493,ಯಜಮಾನ ಚಿತ್ರದ ಶಿವನಂದಿ ಸಾಂಗ್‌ ಬಿಡುಗಡೆ ಆಗಿದೆ.
494,"ಕುಟುಂಬದ ಯಜಮಾನ ಸಂಕಪ್ಪ ರೈ ಹಾಗೂ ಕುಟುಂಬಸ್ಥರು, ಬಂದು ಮಿತ್ರರು ಪಾಲ್ಗೊಂಡರು."
495,ನಾವು ಯಜಮಾನ ಎಂದು ಯಾರಿಗೆ ಕರೆಯುತ್ತೇವೆ ಎನ್ನುವುದೇ ಚಿತ್ರದ ಜೀವಾಳ.
496,"ಕುಂಟ್ಯಾನ ಕುಟುಂಬದ ಯಜಮಾನ ಬೆಳಿಯಪ್ಪ ಗೌಡ, ಜೀಣೋದ್ಧಾರ ಸಮಿತಿ ಅಧ್ಯಕ್ಷ ಮೋನಪ್ಪ ಗೌಡ, ಕಾರ್ಯದರ್ಶಿ ವಸಂತ ಗೌಡ ಹಾಗೂ ಸಮಿತಿ ಸರ್ವಸದಸ್ಯರು, ಕುಟುಂಬಸ್ಥರು ಉಪಸ್ಥಿತರಿದ್ದರು."
497,"ಯಜಮಾನ ರತ್ನ, ದುಬಾರಿ ಮತ್ತು ಅಮೂಲ್ಯ."
498,"ಅವಿನಾಶ್, ತಮ್ಮ ಗೆಳೆಯರಾದ ಅಭಿಷೇಕ್ ಗೌಡ, ಅಕ್ಷಯ್ ಗೌಡ, ದುರ್ಗೇಶ್ ಚೇತನ್ ಜೊತೆ ಸೇರಿ ಯಜಮಾನ ಚಿತ್ರದ ವಿತರಣೆ ಹಕ್ಕನ್ನು ಪಡೆಯಲು ಪ್ರೀತಂ ಎಂಬಾತನನ್ನು ಸಂಪರ್ಕಿಸಿದ್ದರು."
499,"ಮೈಸೂರಿನಲ್ಲಿ ದರ್ಶನ ಅಭಿನಯದ ಯಜಮಾನ ಚಿತ್ರದ ಚಿತ್ರೀಕರಣ ನಡೆಯುತ್ತಿದ್ದು, ಹೀಗಾಗಿ ಎಲ್ಲ ಸ್ನೇಹಿತರು ಅಲ್ಲೇ ಸೇರಿ ರೀಯೂನಿಯನ್ ಆಚರಿಸಿದ್ದಾರೆ."
500,ಯಜಮಾನ ಗೆಟಪ್​ನಲ್ಲಿ ದುರ್ಯೋಧನ ಗೆಟಪ್​​ನಲ್ಲಿ ನೆಚ್ಚಿನ ನಟನನ ನೋಡಿದ ಅಭಿಮಾನಿ ಸಮೂಹಕ್ಕೆ ಈಗ ಮಗದೊಂದು ರೂಪವನ್ನು ನೋಡುವ ಸಂಭ್ರಮ.
501,"ಯಜಮಾನ ಸಂಸ್ಕೃತಿಯ ದರ್ಪ, ಪಾಳೇಗಾರಿಕೆ, ಅವುಗಳನ್ನು ಮರೆ ಮಾಚಲು ಮೊರೆ ಹೋಗುವ ಸಾಕ್ಷಾತ್ಕಾರದಂಥ ಶಬ್ದಗಳು; ಈ ಸುಳ್ಳು ಮುಖವಾಡವನ್ನು ಕಳಚಿ ಹಾಕಿ ಪೊಳ್ಳುಗಳನ್ನು ಬಯಲಿಗೆಳೆಯುವ ನಿರಂತರ ಹೋರಾಟ; ಅದರ ವಿಫಲತೆ-ಸಫಲತೆಗಳು; ಎಲ್ಲ ಯುಗಗಳಲ್ಲೂ, ಎಲ್ಲ ಕಾರ್ಯಗಳಲ್ಲೂ ಆಡಳಿತದ ಕ್ಷುದ್ರತೆಗಳ ವಿರುದ್ಧ ನಡೆಯುವ ಬಂಡಾಯ; ಸಣ್ಣದೋ ಅಥವಾ ದೊಡ್ಡದೋ, ನಿಲ್ಲದೇ ಚಲನಶೀಲವಾಗಿ, ಜೀವಂತವಾಗಿ ಭೋರ್ಗರೆಯುವ ಪ್ರವಾಹ ರೂಪಿಯಾಗಿಯೋ, ನೆಲದೊಳಗೇ ಹರಿಯುವ ಗುಪ್ತಗಾಮಿನಿಯಾಗಿಯೋ ಸದಾ ಅಸ್ತಿತ್ವದಲ್ಲಿರುವ ಜನಪರ ಹೋರಾಟದ ಚೊಕ್ಕ ಚಿತ್ರಣ ನಾಟಕದ ಉದ್ದಕ್ಕೂ ಮೂಡಿ ಬಂದಿತ್ತು."
502,ಹಾಡಿನ ಮೂಲಕ ಪಡ್ಡೆ ಹುಡುಗರ ನಿದ್ದೆಗೆಡಿಸಿದ್ದಾರೆ | ಯಜಮಾನ ಯಶಸ್ಸಿನ ನಂತರ ಚಿರಂಜೀವಿ ಸರ್ಜಾ ಜೊತೆ ಮುಂದಿನ ಸಿನಿಮಾ ಮಾಡಲಿದ್ದಾರೆ.
503,ನನ್ನ ಇನ್ನೊಂದು ನಾಟಕ ಜೋಕುಮಾರಸ್ವಾಮಿಯಲ್ಲಿ ಬರುವ ಗೌಡ ವಿಶಾಲವಾದ ಭೂಮಿಯನ್ನು ಸುಂದರಿಯಾದ ಹೆಣ್ಣನ್ನೂ ಪಡೆದಿರುವಂತೆ ಯಜಮಾನ ನಾದವನು ಎಂದೂ ತಾನು ಹೊಂದಿರುವ ಪದಾರ್ಥವಾಗಲು ಸಾಧ್ಯವಿಲ್ಲ.
504,ಅದುವೇ ಮೊದಲು ಯಜಮಾನ ಅನ್ನೋದು.
505,"ಸದ್ಯ ನಟ ದರ್ಶನ್ ಕುರುಕ್ಷೇತ್ರ ಚಿತ್ರದ ಚಿತ್ರೀಕರಣ ಮುಗಿಸಿದ್ದು, ಈಗ ಯಜಮಾನ ಚಿತ್ರದ ಚಿತ್ರೀಕರಣ ನಲ್ಲಿ ತೊಡಗಿದ್ದಾರೆ."
506,ಯಜಮಾನ ಚಿತ್ರವು ಮುಂದಿನ ಶುಕ್ರವಾರ ದೇಶಾದ್ಯಂತ ತೆರೆಗೆ ಅಪ್ಪಳಿಸಲಿದೆ.
507,ಮಾರ್ಚ್ 1ರಂದು ಬಹುನಿರೀಕ್ಷಿತವಾದಂತಹ ಯಜಮಾನ ಸಿನಿಮಾ ಕೂಡ ತೆರೆಗೆ ಬಂದಿತ್ತು.
508,"ಸಾಮಾನ್ಯವಾಗಿ, ನಿಖರವಾಗಿ ಅನೇಕ ಜನರು ನೀವು ಸುಲಭವಾಗಿ ತನ್ನ ಭಯಾನಕ ಪ್ರಯೋಗಗಳನ್ನು ಹಿಡಿದಿಟ್ಟುಕೊಂಡು ಮನೆಯ ಯಜಮಾನ ಅಗತ್ಯವಿದೆ ಎಂದು."
509,"ಈ ನುಡಿಗಟ್ಟಿನ ಪ್ರಧಾನ ಅಂಶ ರಾಜಸತ್ತೆ, ಸಾಂಸ್ಥಿಕ ಧರ್ಮ ಹಾಗೂ ಯಜಮಾನ ವರ್ಗಗಳ ವಿರೋಧವೂ ಆಗಿತ್ತು ಎನ್ನುವುದನ್ನು ನಾವು ಗಮನಿಸಬೇಕು ಎಂದರು."
510,ನಿನ್ನೆ ಡಿ ಬಾಸ್ ಅಭಿನಯದ ಯಜಮಾನ ಚಿತ್ರದ ಟೈಟಲ್ ಸಾಂಗ್ ಬಿಡುಗಡೆಯಾಗಿದೆ.
511,ಮನೆ ಯಜಮಾನ ಕೃಷ್ಣನ್ ಮಾಟಮಂತ್ರಗಳನ್ನು ಮಾಡುತ್ತಿದ್ದರು ಎಂದು ಸ್ಥಳೀಯರು ಮಾಹಿತಿ ನೀಡಿದ್ದಾರೆ.
512,ದನಗಳೆಲ್ಲಾ ದಿನದಿನಕ್ಕೂ ಬತ್ತಿ ಬಡವಾಗುತ್ತಿದ್ದುದನ್ನು ನೋಡಿ ಮನೆಯ ಯಜಮಾನ ಒಂದು ದಿನ ಗೋಪಾಲಕನನ್ನು ಗುಟ್ಟಾಗಿ ಹಿಂಬಾಲಿಸಿದನಂತೆ.
513,ಆದರೆ ಮಹಿಳಾ ಮುಖಂಡರ ಮತ್ತು ಸ್ವಯಂ ಸೇವಕರ ಕೊರತೆಯಿದೆ ಯಾಕೆಂದರೆ ಸೋಲಿಗರಲ್ಲಿ ಪುರುಷ ಯಜಮಾನ ಸಾಮಾನ್ಯವಾಗಿದೆ.
514,ಕುಟುಂಬದ ಯಜಮಾನ ಬಟ್ಯಪ್ಪ ಅವರು ಕೆಲವು ವರ್ಷಗಳ ಹಿಂದೆಯೇ ತೀರಿಕೊಂಡಿದ್ದಾರೆ.
515,ಇನ್ನು ಮನೆಯ ಯಜಮಾನ ಪ್ರತಿ ತಿಂಗಳು 8000 ರೂಪಾಯಿ ದುಡಿಯುತ್ತಿದ್ದು ಇದರಲ್ಲಿ ಪ್ರತಿ ತಿಂಗಳು 3000 ಕೇವಲ ಮನೆಯ ಬಾಡಿಗೆಗೆ ಖರ್ಚು ಆಗುತ್ತಿದ್ದು ಇದರಿಂದ ಮನೆತನವನ್ನು ನಡೆಸುವುದು ಕಷ್ಟ ವಾಗುತ್ತಿದೆ ಎಂದು ತಮ್ಮ ದುಖವನ್ನು ತೋಡಿಕೊಂಡಿದ್ದಾರೆ.
516,13: ಕ್ರಿಕೆಟ್ ಆಡುತ್ತಿದ್ದ ತರುಣನೋರ್ವ ಹೊಡೆದ ಚೆಂಡು ತಮ್ಮ ಮನೆಗೆ ಬಂದು ಬಡಿದಾಗ ಕ್ಷುದ್ರಗೊಂಡ ಮನೆಯ ಯಜಮಾನ ಹಾಗೂ ಆತನ ನಾಲ್ವರು ಮಕ್ಕಳು ಸೇರಿ ಆ ತರುಣನಿಗೆ ಯದ್ವಾತದ್ವಾ ಹೊಡೆದು ಆತನನ್ನು ಕೊಂದೇಬಿಟ್ಟ ಘಟನೆ ಇಲ್ಲಿನ ಭಿವಂಡಿಯಲ್ಲಿ ನಡೆದಿದೆ.
517,"ಸಭಾ ಕಾರ್ಯಕ್ರಮದಲ್ಲಿ ಮಂಗಳೂರು ಕರ್ಣಾಟಕ ಬ್ಯಾಂಕ್ ಲಿ ಆಡಳಿತ ನಿರ್ದೇಶಕ ಹಾಗೂ ಮುಖ್ಯ ಕಾರ್ಯನಿರ್ವಹಣಾಕಾರಿ ಮಹಾಬಲೇಶ್ವರ ಎಮ್ ಎಸ್, ಮಾಜಿ ಸಚಿವ ಬಿ ನಾಗರಾಜ ಶೆಟ್ಟಿ , ಸುರತ್ಕಲ್ ಶಾಖೆ ಒಡಿಯೂರು ಬ್ಯಾಂಕ್ ಸುರೇಶ್ ರೈ, ಪಡ್ರೆ ಶ್ರೀ ಧೂಮಾವತಿ ದೈವಸ್ಥಾನ ಬಾಬು ಬ೦ಡ್ರಿಯಾಲ್, ಕೊಲ್ಯ ಜಾರಂದಾಯ ದೈವಸ್ಥಾನ ಜೀರ್ಣೋದ್ಧಾರ ಸಮಿತಿ ಅಧ್ಯಕ್ಷ ರವಿಪ್ರಸನ್ನ ಸಿ ಕೆ, ಕುಡುಂಬೂರು ಗುತ್ತು ಗುತ್ತಿನಾತ್ ಜಯರಾಮ ಶೆಟ್ಟಿ, ಸುರತ್ಕಲ್ ಇಡ್ಯಾ ಪಣಂಬೂರು ಶ್ರೀ ಕಾಂತೇರಿ ಧೂಮಾವತಿ ದೈವಸ್ಥಾನ ಅಣ್ಣಪ್ಪ ಅರುವಾಳ್, ಈಶ್ವರ್ ಕಜೇರಿಸಾನ ಸುರತ್ಕಲ್, ಮುಕ್ಕ ಭಂಡಾರ ಮನೆ ದೇವೇಂದ್ರ ಪೂಜಾರಿ, ಪಡ್ರೆ ಧೂಮಾವತಿ ದೈವಸ್ಥಾನ ಅಧ್ಯಕ್ಷ ಬಾಬು ಶೆಟ್ಟಿ, ಕುಳಾಯಿಗುತ್ತು ಶಂಕರ್ ರೈ, ಸುರತ್ಕಲ್ ವೀರಭದ್ರ ದುರ್ಗಾಪರಮೇಶ್ವರಿ ದೇವಸ್ಥಾನ ಆನಂದ ಗುರಿಕಾರ, ಪದವು ಮೇಗಿನಮನೆ ಯಜಮಾನ ಮಂಜಣ್ಣ ಶೆಟ್ಟಿ, ಪೆರ್ಮುದೆ ಗುರುರಾಜ ಮಾಡ ಬೊಳ್ಳುಳ್ಳಿಮಾರುಗುತ್ತು, ಅಗರಮೇಲು ಜಾರಂದಾಯ ದೈವಸ್ಥಾನ ಮೋಹನ್ ಪೂಜಾರಿ, ಎಡಪದವು ರಾಮಭಜನಾ ಮಂದಿರ ಸಮಿತಿ ಅಧ್ಯಕ್ಷ ಮುರಳೀಧರ ಶೆಟ್ಟಿ, ಬ್ರಹ್ಮಕಲಶೋತ್ಸವ ಸಮಿತಿ ಅಧ್ಯಕ್ಷ ಮಹಾಬಲ ಪೂಜಾರಿ ಕಡಂಬೋಡಿ ಉಪಸ್ಥಿತರಿದ್ದರು."
518,ಪಿಯಲ್ಲಿ ಇನ್ನೂ ಹೆಚ್ಚಾಗಿ ಅಂಕವನ್ನು ಯಜಮಾನ ಚಿತ್ರವೂ ಪಡೆಯುತ್ತಿತ್ತು ಒಟ್ಟಾರೆ ಈ ವರ್ಷ ದರ್ಶನ್ ಮುಟ್ಟಿದ್ದೆಲ್ಲಾ ಚಿನ್ನವಾಗತ್ತಿದೆ .
519,ಇನ್ನು ಹುಟ್ಟುಹಬ್ಬದ ಸಂಭ್ರದಲ್ಲಿರುವ ದರ್ಶನ ಇನ್ನೆರಡು ದಿನಗಳಲ್ಲಿ ಯಜಮಾನ ಚಿತ್ರದ ಚಿತ್ರೀಕರಣದಲ್ಲಿ ಪಾಲ್ಗೊಳ್ಳಲಿದ್ದಾರೆ.
520,"ಹಾಗೆಯೇ ಕುರುಕ್ಷೇತ್ರ ತಮ್ಮ 50ನೇ ಚಿತ್ರ ಅಲ್ಲ, ಯಜಮಾನ 50ನೇ ಚಿತ್ರ ಎಂದು ಘೋಷಿಸೋ ಇಂಗಿತವನ್ನ ವ್ಯಕ್ತಪಡಿಸಿದ್ದಾರೆ ಎನ್ನಲಾಗ್ತಿದೆ…"
521,ಯಜಮಾನ ಶೂಟಿಂಗ್ ಸೆಟ್ಟಿನಲ್ಲಿ ಕಾಣಿಸಿಕೊಂಡ್ರು ಯಜಮಾನಿ – ಫೋಟೋ ವೈರಲ್
522,ದೇವಾಲಯದ ಉತ್ಸವ: ಪುರಾಣ ಪ್ರಸಿದ್ದ ಮಹಾಬಲೇಶ್ವರ ದೇವಾಲಯದಲ್ಲಿ ನೂತನ ವರ್ಷದ ಪಂಚಾಗವನ್ನು ಯಜಮಾನ ಮನೆತನದ ವೇ.
523,ಶಿವನಂದಿ ಯಜಮಾನ ಸಿನಿಮಾದ ಹಾಡು.
524,ಮೊದಲ ಹಾಡಿನ ಯಶಸ್ವಿನ ಬಳಿಕ ಎರಡನೇ ಹಾಡು ಬಿಡುಗಡೆ ಮಾಡಿದ ಯಜಮಾನ ಚಿತ್ರತಂಡ
525,"ಸದ್ಯ ಚಾಲೆಂಜಿಂಗ್ ಸ್ಟಾರ್ ದರ್ಶನ್ ಅಭಿನಯದ ಯಜಮಾನ ಸಿನಿಮಾ ವರ್ಲ್ಡ ವೈಡ್ ಬಿಡುಗಡೆಯಾಗಿದ್ದು, ಎಲ್ಲೆಡೆಯೂ ಉತ್ತಮ ಪ್ರದರ್ಶನ ಕಾಣ್ತಿದೆ."
526,ಮನೆಯ ಯಜಮಾನ ಸತ್ತರೆ ಮುಂದೇನು ಮಾಡುವುದು ಎಂಬ ಈ ಪ್ರಶ್ನೆ ಬರುತ್ತದೆ.
527,ಯಜಮಾನ ಚಿತ್ರ ತಂಡದಿಂದ ಮೈಸೂರಿನ ಖಾಸಗಿ ಹೋಟೆಲ್ ನಲ್ಲಿ ಆಯೋಜಿಸಿದ್ದ ಸುದ್ದಿಗೋಷ್ಟಿಯಲ್ಲಿ ಮಾತನಾಡಿದ.
528,ಯಜಮಾನ ಆರ್ಟಿಸ್ಟ್ ಪರ್ಫಾರ್ಮೆನ್ಸ್
529,ಕಣಗಾಲದಲ್ಲಿ ಯಾರ ಕಣಕ್ಕೆ ಹೋದರೂ ಐನೋರು ಬಂದವ್ರೆ ಒಂದು ಹೊರೆ ಹುಲ್ಲು ಕೊಡೋ ಮಗ ಅಂತಾ ಯಜಮಾನ ಹೇಳಿದ್ರೆ ನನ್ನ ಕೈಲಿ ಹೊರಲಾರದಷ್ಟು ಹುಲ್ಲನ್ನು ಕಟ್ಟಿ ಹೊರೆಸಿ ಕಳಿಸುತ್ತಿದ್ದರು.
530,ಬೆಳಿಗ್ಗೆ 8 ಗಂಟೆಯಿಂದ ಆರಂಭವಾದ ನಾಮಪತ್ರ ಸಲ್ಲಿಕೆ ಪ್ರಕ್ರಿಯೆಯಲ್ಲಿ ಜೆಡಿಎಸ್‍ನ ಸುಪ್ರದೀಪ್ ಯಜಮಾನ ಅವರು ಮೂರು ನಾಮ ಪುತ್ರ ಸಲ್ಲಿಸಿ ದರು.
531,"ಯಜಮಾನ ಪಡೆಯಬಹುದು ಕೇವಲ ಮೂರು ಪ್ರಾಥಮಿಕ ತಂತ್ರಗಳನ್ನು ಆಧಾರಿಸಿದೆ ಮಣಿಗಳಿಂದ ಕಡಗಗಳು ಯೋಜನೆಗಳು: ರಿಂಗ್, ಕ್ರಾಸ್, ಎಯ್ಟ್."
532,ಯಜಮಾನ ಸಿನಿಮಾದ ಮೋಸ್ಟ್ ಎಕ್ಸ್​ಪೆಕ್ಟೆಡ್​​ ಟೈಟಲ್​ ಸಾಂಗ್ ರಿಲೀಸ್ ಆಗಿದೆ.
533,"ದರ್ಶನ್‌ ನಟನೆಯ ಯಜಮಾನ ಸಿನಿಮಾದಲ್ಲಿ ಖಳನಾಯಕನಾಗಿ ನಟಿಸಿರುವ ಠಾಕೂರ್‌ ಅನೂಪ್‌ ಸಿಂಗ್‌, ತಮ್ಮ ಪಾತ್ರಕ್ಕೆ ತಾವೇ ಕನ್ನಡದಲ್ಲಿ ಡಬ್‌ ಮಾಡಿದ್ದಾರೆ."
534,ಚಾಲೆಂಜಿಂಗ್ ಸ್ಟಾರ್ ಯಜಮಾನ ಚಿತ್ರ ಮುನ್ನುಗುತ್ತ ಇದೆ.
535,ಸರಿ ಎಂದು ಮಲಗಿದ್ದ ಯಜಮಾನ ಎದ್ದು ಕುಳಿತು ಒಂಟೆಗೆ ಮುಂಗಾಲು ಇರಿಸಲು ಸ್ಥಳ ಮಾಡಿ ಕೊಟ್ಟ.
536,ಒಂದು ಮನೆ ಯಜಮಾನ ತನ್ನವರ ಪಾಲನೆಗೆ |
537,ಹಾಗಾಗಿ ಸ್ಯಾಂಡಲ್​​ವುಡ್​​​ನಲ್ಲಿ ಯಜಮಾನ ಅನ್ನುವ ಟೈಟಲ್​ಗೆ ತನ್ನದೇ ಆದ ವ್ಯಾಲ್ಯು ಇದೆ.
538,ಬೆಂಗಳೂರು: ಚಂದನವನದ ಚೆಂದದ ಚೆಲುವೆ ತಾನ್ಯ ಹೋಪ್ ನಟಿಸಿದ್ದ ಯಜಮಾನ ಕಳೆದ ವಾರ ಬಿಡುಗಡೆಯಾಗಿದೆ.
539,"ಅದನ್ನು ಜಗ್ಗುತ್ತಾ ಹೋದರೆ, ಆ ವಾಡೆಯ ಯಜಮಾನ ಯಾವ ಜಾತಿಯವರನ್ನು ವಾಡೆಯ ಎಲ್ಲಿವರೆಗೆ ಬಿಟ್ಟುಕೊಳ್ಳುತ್ತಿದ್ದರು, ಒಳಾಂಗಣದ ಕಟ್ಟೆಯ ಮೇಲೆ ಯಾವ ಜಾತಿಯವರಿಗೆ ಮಣೆ ಹಾಕುತ್ತಿದ್ದರು, ಸ್ವಜಾತಿ ಆತ್ಮೀಯರನ್ನು ದೇವರ ಮನೆ ತನಕ ಬಿಟ್ಟುಕೊಳ್ಳುತ್ತಿದ್ದರೇ?"
