Index,Sentence
451,"ಮಹಾತ್ಮಾಗಾಂಧಿ ಆರಂಭಿಸಿದ ಕರ ನಿರಾಕರಣ ಚಳುವಲಿ, ಖಾದಿ ಚಳುವಲಿಯ ಬಗ್ಗೆ ತೀರಾ ಒಲವುಳ್ಳವರಾಗಿದ್ದ ಗೌರಮ್ಮನವರು ಖಾದಿ ಬಟ್ಟೆಯ ಪ್ರಿಯರಾದರು."
452,"ರಾಜಕಾರಣಿಗಳ ಆಸ್ತಿ ಮೂಲಗಳನ್ನು ಪತ್ತೆಹಚ್ಚಲು ಆದಾಯ ಕರ ಇಲಾಖೆ, ಸಿಬಿಐ ಮತ್ತಿತರ ತನಿಖಾ ಸಂಸ್ಥೆಗಳಿಗೂ ವಿವೇಷ ಆಸಕ್ತಿ ಇಲ್ಲವೆಂದೆನಿಸುತ್ತಿದೆ."
453,– ಉರ್ದು ಭಾಷೆಯಲ್ಲಿ ಕರ ಪತ್ರ ಹಂಚಿದ ಬಚ್ಚೇಗೌಡ
454,"7ರಂದು ಕೌನ್ಸಿಲ್ ಸಭೆ ನಡೆಯ ಲಿರುವ ಹಿನ್ನೆಲೆಯಲ್ಲಿ ಪಾಲಿಕೆ ನವೀಕೃತ ಹಳೇ ಕೌನ್ಸಿಲ್ ಸಭಾಂಗಣದಲ್ಲಿ ಮೇಯರ್ ಪುಷ್ಪಲತಾ ಜಗನ್ನಾಥ್ ಅಧ್ಯಕ್ಷತೆಯಲ್ಲಿ ನಡೆದ ಕಲಾಪ ಸಲಹಾ ಸಮಿತಿ ಸಭೆಯಲ್ಲಿ, ಸದ ಸ್ಯರ ದೂರಿಗೆ ಪ್ರತಿಕ್ರಿಯಿಸಿದ ಅವರು, ಪ್ರತಿ ವಾರ್ಡ್‍ಗೆ ನಿಯೋಜಿಸುವ ಪೌರಕಾರ್ಮಿ ಕರ ಸಂಖ್ಯೆ ಹಾಗೂ ಅವರ ಹಾಜರಾತಿ ಯನ್ನು ಸಲ್ಲಿಸುವಂತೆ ಸೂಚಿಸಿದ್ದರೂ ಸಂಬಂಧ ಪಟ್ಟ ಅಧಿಕಾರಿಗಳು ನಿರ್ಲಕ್ಷ್ಯ ತೋರಿದ್ದಾರೆ."
455,"ಅತಿ ಕಡಿಮೆ ಸಮಯದಲ್ಲಿ ಬಡವರು, ಸಣ್ಣ ಅತಿ ಸಣ್ಣ ರೈತರು ಕರ ಕುಶಲ ಕರ್ಮಿಗಳು ಹಾಗೂ ಇನ್ನುಳಿದ ಅಲಕ್ಷಿತ ವರ್ಗವನ್ನು ಸರಳ ಬ್ಯಾಂಕಿಂಗ್ ಯೋಜನೆಗಳ ಮೂಲಕ ಅತಿ ಕಡಿಮ ಅವಧಿಯಲ್ಲಿ ತಲುಪಲು ಇದರಿಂದ ಸಾಧ್ಯವಾಗುತ್ತಿದೆ."
456,"ರಾತ್ರಿ ಕೃಷಿ ಕೆಲಸ ಮುಗಿಸಿ ಮನೆಗೆ ಹಿಂದಿರುವಾಗ ಪ್ರಾಣಿಗಳನ್ನು ಹೆದರಿಸಲು ಬಳಸಲಾಗುತ್ತಿದ್ದ ಮೂತಗೋಲು, ಕಪ್ಪಲು, ನೇಗಿಲು, ನಡರ್‌ (ಮಣ್ಣಿನ ಒಲೆ), ಕದಿಕೆ, ಕಣಜ (ಭತ್ತ ಸಂಗ್ರಹ ಮಾಡುವುದು), ಪಲಾಯಿ (ಗ¨ªೆ ಉತ್ತ ಬಳಿಕ ಸಮತಟ್ಟು ಮಾಡುವ ಸಾಧನ), ಎತ್ತರದ ಜಾಗದಲ್ಲಿ ಮಣ್ಣನ್ನು ಜಾರಿಸುವುದಕ್ಕಾಗಿ ಉಪಯೋಗಿಸುತ್ತಿದ್ದ ಓಡ ಮರಾಯಿ, ಕರ ಕೈಲ… ಬಿದಲೆ ನೆಸಲೆ, ಅಡ್ಯರ ಪಲ್ಲಯಿ ಗದ್ದವು ಬಾವಡೆ ಇಂಥಹ ಸಾವಿರಾರು ಅಧ್ಯಯನಯೋಗ್ಯ ವಸ್ತುಗಳು ಈ ಕೇಂದ್ರದ ಆಕರ್ಷಣೆ."
457,ಸಂಗೀತದ ವಿದ್ಯಾರ್ಥಿಗಳು ನಾದೋಪಾಸ ಕರ ಸಾಧನೆಯನ್ನು ಸತತವಾಗಿ ಆಲಿಸಬೇಕು.
458,ಅಂದರೆ ಪ್ರತಿಯೊಂದು ಹಂತದಲ್ಲಿಯೂ ಮೌಲ್ಯವರ್ಧನೆಯಾದ ಮೊತ್ತದ ಮೇಲೆ ಮಾತ್ರವೇ ಕರ ಬೀಳುತ್ತದೆ.
459,ಕರ ಜೋರೇಂ ಸುರ ದಿಸಿಪ ಬಿನೀತಾ।
460,"ಶಾತವಾಹನರ ಪ್ರಮುಖ ತೆರಿಗೆಗಳು - ದೆಯ , ಮೆಯ , ಭಾಗ , ಕರ"
461,"ಹದಗೆಟ್ಟ ರಸ್ತೆಗಳಿಂದ ಭಾರೀ ನಷ್ಟವಾಗಿದ್ದು, ಕರ ಸಂಗ್ರಹಕ್ಕೆ ಬೆಂಗಳೂರು ಮಹಾನಗರದ ಸಾರಿಗೆ ಸಂಸ್ಥೆ (ಬಿಎಂಟಿಸಿ) ನೀಡಿದ್ದ ಸಲಹೆಗೆ ಸಮ್ಮತಿ ಸೂಚಿಸಿದೆ."
462,ನಿಮ್ಮ ಕರ ಲೆಕ್ಕ ಹಾಗೂ ರಿಟರ್ನ್ ಫೈಲಿಂಗ್‌ ಈ ಫಾರ್ಮ್ನೊಂದಿಗೆ ತಾಳೆಯಾಗಲೇ ಬೇಕು.
463,ಕರ ಹೇರಲಾಗುತ್ತದೆ ಹಾಗೂ ಅದರ ಮೇಲೆ ಕೆಲ ನಿರ್ದಿಷ್ಠ ವಿನಾಯಿತಿಗಳೂ ಇವೆ.
464,ಕಂ || ಕುಳಿಶರಥಾಂಗಾಂಕಂ ಕರ
465,"ಗುಂಪಿನಲ್ಲಿದ್ದ ಒಬ್ಬ ಹುಡುಗ, ಯುಗಾದಿ ಹಬ್ಬಕ್ಕ ಹರ್ಷಾಗ ಕರ ಕೊಂಡ ನಮ್ಮನೇಗೆ ಬಾ ಅಕ್ಕಾ, ಮಧ್ಯಾಹ್ನ ಊಟ ಮುಗಿಸಿ ಮನೆಗೆ ಹೋಗ್ಬೋದು ಎಂದನು."
466,ಸೀತಾ ಮನ ಬಿಚಾರ ಕರ ನಾನಾ।
467,ಹೋಗೊ ಮುನ್ನ ಕರ ಸೇವೆ!
468,ಕಾರ್ಪೊರೆಟ್ ಸೆಕ್ಟರ್ ಕೊ ಸ್ವಾಗತ ಕರ ರಹ ಹೈ ಉನ್ಹುನೆ.
469,ಕರ ಮಾತ್ರ.
470,"ಅದರ ನಿರ್ಮಾಣಕ್ಕೆ ನಾವು ಇಟ್ಟಿಗೆ, ಕರ ಸೇವೆ ಮಾಡಲು ಸಿದ್ಧ ಅಂತ ಕಾಂಗ್ರೆಸ್ ಮುಖಂಡ ಸಿಎಂ ಇಬ್ರಾಹಿಂ ಹೇಳಿದ್ದಾರೆ."
471,ಇತ್ತೀಚೆಗೆ ಕರ ಇಲಾಖೆ ಪ್ರತಿಯೊಬ್ಬರ 15ಎಚ್‌ (ಹಾಗೂ 15ಜಿ) ಫಾರ್ಮುಗಳ ಜಾಡುಹಿಡಿಯುತ್ತಿದೆ.
472,ಹಲವು ಬಾರಿ ನಾವು ಮೂಲದಲ್ಲಿಯೇ ಕರ ಕಡಿಸಿಕೊಳ್ಳುತ್ತೇವೆ.
473,"ಮೈಸೂರು: ಮೈಸೂರು ಅರಮನೆ ಆವರಣದಲ್ಲಿ ವಿಶ್ವ ಪ್ರವಾಸೋ ದ್ಯಮ ದಿನಾಚರಣೆ ಅಂಗವಾಗಿ ಜಿಲ್ಲಾ ಡಳಿತ, ಪ್ರವಾಸೋದ್ಯಮ ಇಲಾಖೆ, ಮೈಸೂರು ಅರಮನೆ ಮಂಡಳಿ, ಮೈಸೂರು ಟ್ರಾವೆಲ್ಸ್ ಅಸೋಸಿಯೇಷನ್, ಮೈಸೂರು ಹೊಟೇಲ್ ಮಾಲೀಕರ ಸಂಘದ ಸಂಯುಕ್ತಾಶ್ರಯ ದಲ್ಲಿ ಗುರುವಾರ ಸಂಜೆ ನಡೆದ ಸಾಂಸ್ಕøತಿಕ ಕಾರ್ಯಕ್ರಮದಲ್ಲಿ ಕಲಾವಿದರು ಪ್ರಸ್ತುತ ಪಡಿಸಿದ ನೃತ್ಯ, ಗಾಯನಗಳು ಕಲಾ ರಸಿ ಕರ ಮನತಣಿಸಿದವು."
474,"ಡಿಮಾನಿಟೈಸೇಶನ್‌ನಂತಹ ಕಠೊರ ನಿರ್ಣಯದ ಜಾರಿಯಲ್ಲಿ ತಳಮಟ್ಟದಲ್ಲಿನ ನೌಕರಶಾಹಿಯ ಅಸಹಕಾರ-ಅಸಮರ್ಥತೆಯಿಂದಾಗಿ ನಿರೀಕ್ಷಿತ ಉದ್ದೇಶ ಸಾಧನೆಯಾಗದಿದ್ದರೂ ಕರ ಸಂಗ್ರಹಣೆಯಲ್ಲಿ ವೃದ್ಧಿ, ಕಾಳಧನ ನಿಯಂತ್ರಣ, ಅರ್ಥವ್ಯವಸ್ಥೆಯಲ್ಲಿ ಅನೇಕ ಸುಧಾರಣೆಗೆ ಸಹಾಯಕವಾಗಿದೆ."
475,"ಪ್ರತಿ ವಾರಕ್ಕೆ ಒಮ್ಮೆ ಇಂತಹ ಘಟನೆ ಜರುಗುತ್ತಿದ್ದರೂ ಸಂಬಂಧಪಟ್ಟ ಇಲಾಖೆಯ ಅಧಿಕಾರಿಗಳು ಯಾವುದೇ ಕ್ರಮ ಕೈಗೊಳ್ಳದೆ ಇಲ್ಲಿನ ವಾಹನ ಚಾಲ ಕರ ಹಾಗೂ ಸಾರ್ವಜನಿಕರ ಜೀವದ ಜೊತೆ ಚೆಲ್ಲಾಟವಾಡುತ್ತಿದ್ದು, ವಾಹನ ಚಾಲಕರಿಗೆ 30 ಕಿಲೋ ಮೀಟರ್ ವೇಗ ಮಿತಿ ನಿಗದಿ ಗೊಳಿಸಬೇಕು ಹಾಗೂ ಈ ಸ್ಥಳದಲ್ಲಿ ಅಪಘಾತ ವಲಯ ಎಂದು ನಾಮಫಲಕ ಹಾಕಬೇಕು ಎಂದರು."
476,"ಕರ ನಿರಾಕರಣೆ, ಜಲಸಮರ್ಪಣೆ ಚಳವಳಿಯನ್ನೂ ನಡೆಸಲಾಯಿತು."
477,ಪ್ರೀಮಿಯಮ್ಮಿನ ಹತ್ತು ಪಟ್ಟು ವಿಮಾ ಮೊತ್ತ ಇರುವಂಥ ದೀರ್ಘ‌ಕಾಲಿಕ ಪಾಲಿಸಿಗಳಿಗೆ ಮಾತ್ರ 80ಸಿ ಅಡಿಯಲ್ಲಿ ಸಂಪೂರ್ಣ ತೆರಿಗೆ ವಿನಾಯಿತಿ ಹಾಗೂ 10(10ಡಿ) ಕರ ಸೌಲಭ್ಯಗಳು ಇರುತ್ತವೆ.
478,ಕಡಿದು ಹಸ್ತಿಯ ನೂಂಕಲು | ಆನೆಯ ಕರ
479,ಸಮಾನ ವಿದ್ಯುತ್‌ ನೀತಿ ಜಾರಿಗೊಳಿಸುವವರೆಗೂ ರಾಜ್ಯದ ಎಲ್ಲ ಗ್ರಾಮಗಳಲ್ಲಿ ವಿದ್ಯುತ್‌ ಕರ ನಿರಾಕರಣ ಚಳವಳಿ ಹಮ್ಮಿಕೊಳ್ಳಲಾಗುವುದು.
480,"*ಡಂಗುರ, ಕರ ಪತ್ರಗಳ ಮೂಲಕ ಪ್ರಚಾರ"
481,ಭುವನೇಸ್ವರ ಕಾಲಹು ಕರ ಕಾಲಾ।।
482,"ರಾಜ್ಯದ ವಿವಿಧ ಭಾಗಗಳಲ್ಲಿ ಹೊಸದಾಗಿ ಸರ್ಕಾರಿ ಪದವಿ ಕಾಲೇಜು ಗಳನ್ನು ಆರಂಭಿಸಲಾ ಗಿದ್ದು, ಹಳೆ ಕಾಲೇಜು ಗಳೂ ಸೇರಿದಂತೆ ದೊಡ್ಡ ಪ್ರಮಾಣದಲ್ಲಿ ಉಪನ್ಯಾಸ ಕರ ಕೊರತೆ ಇದೆ."
483,ಮೊಬೈಲ್ ರೀಚಾರ್ಜ್ ಮಾಡಿಸುತ್ತೇವೆ ಅದರಂತೆ ನೀರಾವರಿ ಕರ ಸಹ ಪಾವತಿಸಬೇಕೆಂದು ರೈತ ಮುಖಂಡ ಸಾಬಣ್ಣ ಗೊಂದೆನೂರ ಹೇಳುತ್ತಾರೆ.
484,"ಕರ ವಸೂಲಿಗ, ಗುಮಾಸ್ತ ಕಂ ಡಾಟಾ ಎಂಟ್ರಿ ಆಪರೇಟರ್, ಪಂಪ್ ಆಪರೇಟರ್ ಕಂ ಮೆಕ್ಯಾನಿಕ್ ಕಂ ನೀರಿನ ಕರ ವಸೂಲಿಗಾರ, ಜವಾನ, ಸ್ವಚ್ಛತೆಗಾರ ಹುದ್ದೆಗಳಿಗಾಗಿ ಅರ್ಜಿ ಆಹ್ವಾನಿಸಲಾಗಿದ್ದು, ಇದರಲ್ಲಿ ಪ."
485,"ಕೈ ಕನ್ನಡ, ಕರ ಸಂಸ್ಕೃತ ಆಗಿರುವುದೇ ಕಾರಣವೇ?"
486,ಬಾಲಕನನ್ನು ಕರ ಪತ್ರ ಹಂಚದಂತೆ ತಡೆಯಲು ಅವರು ಪ್ರಯತ್ನಿಸಿದರು.
487,"ಪೊರೆಗಳಚಿ ಹೊರಬರುವ ಕಾಳೋರಗನ ನೆ‌ನಪಿಸುವ, ಶಿಶುಶಿವನ ವರಖಡ್ಗವು ಒರೆಗಳಚಿ ಹೊರಬಂದು, ಕರ ಸೇರಿ, ಮುಗಿಲಮುಖಿಯಾಗಿ ಮೇಲೆದ್ದಿತು."
488,ಗಿರಿಧರನ ಹಲಧರನನಾ ಭೀ | ಕರ ಖಗೇಂದ್ರನ ಪಕ್ಷ ಮೂಲದ |
489,"ಗ್ರಹಗಳು ಮತ್ತು ಇತರೆ ಆಕಾಶಕಾಂುುಗಳಿಂದ ಕಾಸ್ಮಿಕ್ ಕಿರಣ ಗಳು ಹೊರಹೊಮ್ಮುತ್ತಿದ್ದು, ಅದರ ಪ್ರಭಾವದಿಂದ ಸಂತೋಷ ಕರ ಕುಟುಂಬ ಜೀವನ ಮತ್ತು ವ್ಯವಹಾರಸಮೃದ್ದಿಂುುಲ್ಲಿ ಮುಖ್ಯ ಪಾತ್ರ ವಹಿಸುತ್ತವೆ."
490,"ಅದಲ್ಲದೆ, ಪಕ್ಕಾ ಪಿಪಿಎಫ್ ಶೈಲಿಯಲ್ಲಿಯೇ ಇದರಲ್ಲಿ ಬರುವ ಬಡ್ಡಿಯ ಮೇಲೂ ಕೂಡಾ ಯಾವುದೇ ರೀತಿಯ ಕರ ಇರುವುದಿಲ್ಲ."
491,"ಹಸಲರಲ್ಲಿ ಬೆಳ್ಳಿ ಹಲಸರು ಅಥವಾ ಬೆಳ್ಳಾಲರು, ಬಗ್ಗಾಲಿನ ಹಸಲರು ಅಥವಾ ಅಂತರ್ಗಾಲು ಹಸಲರು, ನಾಡ ಹಸಲರು, ಮಲೆ ಹಸಲರು, ಕರ ಎಳೆಯುವ ಹಸಲರು ಎಂಬ ಒಳ ಪಂಗಡಗಳಿವೆ."
492,ಬೆಳಗಾವಿ: ಹಳ್ಳಿಗಳಲ್ಲಿ ವಾಸಿಸುತ್ತಿರುವ ಮಾಜಿ ಸೈನಿಕರು ಹಾಗೂ ಅವರ ಕುಟುಂಬದವರ ಮನೆ ಕರ ರದ್ದುಪಡಿಸುವಂತೆ ಆಗ್ರಹಿಸಿ ಮಾಜಿ ಸೈನಿಕರು ಬುಧವಾರ ಸುವರ್ಣ ವಿಧಾನಸೌಧದ ಬಳಿ ಪ್ರತಿಭಟನೆ ನಡೆಸಿದರು.
493,ಜಿಮಿ ಅಮೋಘ ರಘುಪತಿ ಕರ ಬಾನಾ।
494,ಆದರೆ ಹಿಂದೆ ಅಂದೊಂದು ದಿನ ನಮ್ಮ ರೈತರ ಕಷ್ಟ ಕರ ಬದುಕನ್ನು ಬದಿಗಿರಿಸಿ ವರ್ಷ ಪೂರ್ತಿ ದುಡಿದು ದಣಿದ ರಾಸುಗಳಿಗೆ ಸಿಂಗಾರ ಮಾಡಿ ತನ್ನ ಕುಟುಂಬ ಮತ್ತು ಸಹೋದ್ಯೋಗಿಗಳೊಡನೆ ಸಂತಸದಿಂದ ಆಚರಿಸುವ ಹಬ್ಬವಾಗಿದೆ.
495,ಸ್ಕೂಲ್ಬೋರ್ಡಿನಿಂದ ನಿಯಂತ್ರಣಗೊಂಡ ಶಿಕ್ಷಣ ಇಲಾಖೆಯ ಖರ್ಚು ಪುರೈಸಲು ಸ್ಥಳೀಯ ಆಡಳಿತಗಳು ವಿದ್ಯಾ ಕರ ಸಂಗ್ರಹಿಸತೊಡಗಿದವು.
496,ಪೂತುರೆನುತ ಕರ | ಘಾತಿಯ ತಾಳದಿ |
497,2012-13ನೇ ಸಾಲಿನಲ್ಲಿ ನೀರಿನ ಕರ ಶೇ 25ರಷ್ಟು ಮಾತ್ರ ವಸೂಲಾಗಿದೆ.
498,ನೀರಿನ ಕರ ತುಂಬುವಂತೆ ನಗರ ಸಭೆ ಪೌರಾಯುಕ್ತರ ಮನವಿ
499,ಉದ್ದೇಶಪೂರ್ವಕವಾಗಿ ಉಳ್ಳವರು ಕರ ನೀಡದೆ ಉಡಾಫೆ ಮಾಡಿದರೆ ಭೂಕಂದಾಯ ವಸೂಲಾತಿಯ ಮಾರ್ಗವನ್ನು ಅನುಸರಿಸಿ ವಸೂಲಾತಿಗೆ ಕ್ರಮ ಕೈಗೊಳ್ಳುವ ಅಧಿಕಾರವಿದೆ.
500,ಕರ ಪಾವತಿಸುವಂತೆ ಪಂಚಾಯತ್‌ಗೆ ಪತ್ರ ಬರೆಯಲು ಹಿಂದಿನ ಸಭೆಯಲ್ಲಿ ಕೈಗೊಂಡ ನಿರ್ಣಯದಂತೆ ಪತ್ರ ರವಾನೆಯಾಗಿದೆಯಾ?
501,–*–*– ತ್ರಿಜಟಾ ಸನ ಬೋಲೀ ಕರ ಜೋರೀ।
502,ಕರ್ನಾಟಕ ನಗರ ನೀರು ಸರಬರಾಜು ಮತ್ತು ಒಳಚರಂಡಿ ಮಂಡಳಿ ವಿಭಾಗದ ವ್ಯಾಪ್ತಿ ಬರುವ ನಗರದಲ್ಲಿ ನೀರಿನ ಕರ ಬಾಕಿ ವಸೂಲಾತಿಯನ್ನು ಹೊಂದಿರುವವರು ಕಾರ್ಯಪಾಲಕ ಅಭಿಯಂತರ ಕಚೇರಿಯಲ್ಲಿ ನೀಡಬೇಕೆಂದು ಮಂಡಳಿ ಸೂಚಿಸಿದೆ.
503,"ಈಗಾಗಲೆ ಈ ಅಭಿಯಾನಕ್ಕೆ ಹೆಚ್ಚಿನ ಪ್ರಚಾರ ಕೊಡಲು ಗ್ರಾಮಗಳಲ್ಲಿ ಡಂಗುರ ಹಾಕಿಸುವುದು, ಕರ ಪತ್ರ ಹಂಚಿಕೆ, ಶಾಲಾ ವಿದ್ಯಾರ್ಥಿಗಳಿಗೆ ತಿಳುವಳಿಕೆ ಕೊಟ್ಟು ಅವರ ಮುಖಾಂತರ ಪಾಲಕರಿಗೆ ವಯಕ್ತಿಕ ಶೌಚಾಲಯ ಕಟ್ಟಿಸಿಕೊಳ್ಳಲು ಪ್ರೇರೇಪಣೆ ನೀಡುವಂತಯ ಕಾರ್ಯಕ್ರಮಗಳನ್ನು ಹಮ್ಮಿಕೊಳ್ಳಲು ಸಂಬಂದಪಟ್ಟವರಿಗೆ ಸೂಚನೆ ನೀಡಲಾಗಿದೆ."
504,ಮಕ್ಕಳನ್ನು ಓದಿಸುತ್ತಿರುವವರಿಗೆ ಆಗುವ ಖರ್ಚಿನ ಲೆಕ್ಕದಲ್ಲಿ ವರಮಾನ ಕರ ರಿಯಾಯ್ತಿಯೇ ಮುಂತಾದುವನ್ನೂ ಕೊಟ್ಟಿದ್ದಾರೆ.
505,ನೀರು ಸರಬರಾಜು ವ್ಯವಸ್ಥೆಯನ್ನು ಜಲಮಂಡಳಿಯಿಂದ ಪಾಲಿಕೆಗೆ ವಹಿಸಿದಾಗಿನಿಂದ ಕರ ವಸೂಲಿಗೆ ಗುಲ್ಬರ್ಗ ಮಹಾನಗರ ಪಾಲಿಕೆ ಹೋಗೇ ಇಲ್ಲ.
506,"ಮುಖ್ಯಅತಿಥಿಗಳಾಗಿ ಶಿರಗಾಂವಿ ಕರ ಸರಕಾರ ಶ್ರೀಮಂತ ಗೌರವಜೀವ ಮುತಾಲಿಕ ದೇಸಾಯಿ, ಕಾಂಗ್ರೆಸ್ ದುರೀಣ ಅಮೀತ ಕೋರೆ, ಜಿಪಂ ಸದಸ್ಯ ಗಣೇಶ ಹುಕ್ಕೇರಿ, ಕಿರುತೆರೆಯ ನಟಿ ಕಿರಣ ಮೈ, ಜ್ಯೌತಿ ಭಾವಿಕಟ್ಟಿ, ಡಾ."
507,"ಗ್ರಾಮದಲ್ಲಿ ಕರ ಪತ್ರ ಹಂಚಿಕೆ, ಜಾಗೃತಿ"
508,ಕರ ಪಾವತಿಯ ವಿಧಾನಗಳು ಈ ಕೆಳಗಿನಂತೆ:
509,"ಇನ್ನು ಕೆಲವರು ಟೈಲರಿಂಗ್‌, ಕರ ಕುಶಲ ತರಬೇತಿ ಪಡೆದು ಸ್ವಂತ ಉದ್ಯೋಗ ನಿರ್ವಹಿಸುತ್ತಿದ್ದಾರೆ ಎನ್ನುತ್ತಾರೆ ಅವರು."
510,ಕಟ್ಟಿಹ ಕೋಟೆಯ ನೋಡಿ | ಕರ | ತಟ್ಟುತ ಶಿರವೊಲೆದಾಡಿ ||
511,ಬದಲಾಗಿ ಜನರೇ ಪಂಚಾಯಿತಿಗೆ ಬಂದು ಕರ ಪಾವತಿ ಮಾಡಿ ಹೋಗುತ್ತಾರೆ.
512,"ಆದರೆ ತಾಲ್ಲೂಕಿನ ಬರ ಎಂದು ಗುರುತಿಸುವ ಕಣಕಟ್ಟೆ ಹೋಬಳಿಯ ದೊಡ್ಡ ಕೆರೆಗಳಾದ ಕಣಕಟ್ಟೆ, ಕಾಮಸಮುದ್ರ, ಕಿತ್ತನಕೆರೆ, ಮಾಡಾಳು, ಸಾತನಗೆರೆ, ಚಿಕ್ಕೊಂಡಿಹಳ್ಳಿ,ಕಲ್ಗುಂಡಿ, ಬಾಣಾವರ ಹೋಬಳಿಯ ಚಿಕ್ಕಮನಹಳ್ಳಿ, ಕೊಂಡವಾಗಿಲು, ಕುರುವಂಕ, ಬಾಣಾವರ, ಕಸಬಾ ಹೋಬಳಿಯ ಹಾರನಹಳ್ಳಿ, ಯಳವಾರೆ, ನಾಗತಿಹಳ್ಳಿ, ಅಗ್ಗುಂದ, ಮೇಣೇಕೆರೆ, ಸಿಂಗನ ಕೆರೆ, ಜಾವಗಲ್‌ ಹೋಬಳಿಯ ಕಲ್ಲನಹಳ್ಳಿ, ಜಾವಗಲ್‌,ಅರಕೆರೆ, ಕರ ಗುಂದ, ರಂಗಾಪುರ, ಗಂಡಸಿ ಹೋಬಳಿಯ ದೊಡ್ಡಯರಗನಾಳು, ಹೆಗ್ಗಟ್ಟ, ಗಂಡಸಿ, ಕೆರೆಗಳ ಒಡಲು ಬರಿದಾಗಿದ್ದು, ಜಾನುವಾರುಗಳು ನೀರಿಗಾಗಿ ಪರಿತಪಿಸುವಂತಾಗಿದೆ."
513,ಮಾರುಕಟ್ಟೆ ಕರ ಕೂಡ ಲಕ್ಷಾಂತರ ರೂ.
514,"ಸುಬ್ರಮಣಿಯನ್ ಸ್ವಾಮಿ ಕೋರಿಕೆಯಂತೆ ಮೆಟ್ರೊಪಾಲಿಟನ್ ನ್ಯಾಯಾಲಯವು ಕಳೆದ ಜನವರಿ 11 ಮತ್ತು ಮಾರ್ಚ್ 11ರಂದು ಎರಡು ಆದೇಶ ಹೊರಡಿಸಿ ಹಣಕಾಸು, ನಗರಾಭಿವೃದ್ಧಿ, ಕಾರ್ಪೊರೇಟ್ ವ್ಯವಹಾರಗಳ ಇಲಾಖೆ, ಆದಾಯ ಕರ ಇಲಾಖೆ ಮತ್ತು ಕಾಂಗ್ರೆಸ್ ಪಕ್ಷಕ್ಕೆ ದಾಖಲೆಗಳನ್ನು ಒದಗಿಸುವಂತೆ ಸೂಚಿಸಿತ್ತು."
515,"ಶೆಟ್ಟಿ, ಅದಾನಿ ಗ್ರೂಪ್‌ನ ಜಂಟಿ ಅಧ್ಯಕ್ಷ ಕಿಶೋರ್ ಆಳ್ವ, ಕೋಟ ವಿದ್ಯಾ ಸಂಘದ ಅಧ್ಯಕ್ಷ ಪ್ರಭಾ ಕರ ಮಯ್ಯ, ಕಾರ್ಯದರ್ಶಿ ಸುಬ್ರಹ್ಮಣ್ಯ ಉಪಾಧ್ಯ, ಪ್ರಾಂಶುಪಾಲ ಜಗದೀಶ ನಾವುಡ, ಡಿಡಿಪಿಐ ದಿವಾಕರ ಶೆಟ್ಟಿ, ಜಿಲ್ಲಾ ಪಂಚಾಯಿತಿ ಸದಸ್ಯ ರಾಘವೇಂದ್ರ ಕಾಂಚನ್ ಮತ್ತಿತರರು ಉಪಸ್ಥಿತರಿದ್ದರು."
516,"ಇನ್ನು ಕೆಲವೇ ತಿಂಗಳಲ್ಲಿ ನಿರಂತರ ನೀರು ಯೋಜನೆ ಆರಂಭವಾಗಲಿದ್ದು, ಬಳಕೆ ಮಾಡಿದಷ್ಟು ನೀರಿಗೆ ಮಾತ್ರ ಕರ ಪಾವತಿಸಬೇಕಾಗುತ್ತದೆ."
517,"ಮೂಲಭೂತವಾಗಿ, ಚಾಲ್ತಿ ಪಟ್ಟಿಯಲ್ಲಿ ಕರದರಗಳು ಜಾಸ್ತಿ; ಆದರೆ ಸುಮಾರು ನೂರು ರೀತಿಯ ಕರ ವಿನಾಯಿತಿಗಳು ಆ ಪಟ್ಟಿಗೆ ಅನ್ವಯವಾಗುತ್ತವೆ."
518,ಇಲ್ಲಿ ಪ್ರತ್ಯೇಕವಾಗಿ ನಿಲ್ಲುವ ಒಂದು ವಿಷಯವೆಂದರೆ ಕೇಂದ್ರ ಸರಕಾರದ ಕರ ಆದಾಯ ಮತ್ತು ಜಿಡಿಪಿಯ ಅನುಪಾತ ವ್ಯತ್ಯಾಸವಾಗದೆ ಉಳಿದರೆ (ಮುಖ್ಯ ಆದಾಯ ಸಲಹೆಗಾರರು ಈ ಅಂಶವನ್ನು ಮಾಧ್ಯಮಗಳಿಗೆ ಸ್ಪಷ್ಟವಾಗಿ ತಿಳಿಸಿದ್ದಾರೆ) ವಿತ್ತೀಯ ಕೊರತೆ ಮತ್ತು ಜಿಡಿಪಿಯ ಅನುಪಾತವು ಬದಲಾಗದಂತೆ ನೋಡಬೇಕಿದೆ(ಜಾಗತಿಕ ಆರ್ಥಿಕತೆಯಲ್ಲಿ ಭಾರತದ ಕ್ರೆಡಿಟ್ ರೇಟಿಂಗ್‌ನ್ನು ಕಾಪಾಡುವ ಸಲುವಾಗಿ).
519,Home ಮನರಂಜನೆ ಮಾಸಾಂತ್ಯಕ್ಕೆ ಸಂಕಷ್ಟ ಕರ ಗಣಪತಿ ತೆರೆಗೆ
520,ಜನಕಸುತಾ ಕೇ ಆಗೇಂ ಠಾढ़ ಭಯಉ ಕರ ಜೋರಿ।।26।।
521,ವಿಮೆಯ ಪಾವತಿಯಲ್ಲಿ ಎಲ್ಲಿಲ್ಲಿ ಆದಾಯ ಕರ ಲಾಗೂ ಆಗುವುದೋ ಅಲ್ಲಲ್ಲಿ ಶೇ.
522,"ಜರ್ಮನಿನಲ್ಲಿ ಬೇರೆ ಬೇರೆ ಹೆಸರಿನ ಚರ್ಚುಗಳ ಪರವಾಗಿ ಸರ್ಕಾರವೇ ಕರ ವಸೂಲು ಮಾಡಿ, ಆಯಾ ಚರ್ಚುಗಳಿಗೆ ಸಲ್ಲಿಸುತ್ತದೆ."
523,ಅಂದಾಗೆ ನಮ್ ನಂದಿನಿ ನೆನ್ನೆ ಕರ ಹಾಕ್ತು.
524,ಇದು ಇಡೀ ರಾಜ್ಯ ಮಟ್ಟದಲ್ಲಿ ವಿತರಿಸುವ ಕರ ಪತ್ರವೋ ಅಥವಾ ಒಂದು ಕ್ಷೇತ್ರಕ್ಕೆ ಸೀಮಿತವಾಗಿ ವಿತರಿಸುವ ಕರ ಪತ್ರವೋ ಎಂಬುದು ಗೊತ್ತಾಗುತ್ತಿಲ್ಲ.
525,ಯಾವುದೇ ಕಾರಣಕ್ಕೂ ಅಹಿತ ಕರ ಘಟನೆಗೆ ಆಸ್ಪದ ನೀಡುವುದಿಲ್ಲ ಎಂದರು.
526,ಒಂದು ಹೊಸ ಕರ ಇದೆ ನೋಡ್ ಬನ್ರಿ ಅಂದ ರೆಹಮಾನ್.
527,"ರಾಘವೇಂದ್ರ, ಉಡುಪಿ ಡಿಪಿಓ ಸಹಾಯಕ ಆಡಳಿತಾಧಿಕಾರಿ ಜಗದೀಶ್ ಸಾಲಿಮಠ, ಬಡಗಬೆಟ್ಟು ಸೊಸೈಟಿಯ ಪ್ರಧಾನ ವ್ಯವಸ್ಥಾಪಕ ಜಯ ಕರ ಶೆಟ್ಟಿ ಇಂದ್ರಾಳಿ ಉಪಸ್ಥಿತರಿದ್ದರು."
528,ಹಳೇ ಮೈಸೂರು ಭಾಗದಲ್ಲಿ ಪಕ್ಷವನ್ನು ಬಲಪಡಿಸಲು ಕೆಪಿಸಿಸಿ ಅಧ್ಯಕ್ಷ ದಿನೇಶ್‌ ಗುಂಡೂ ರಾವ್‌ ತಕ್ಷಣ ಹಿರಿಯ ನಾಯ ಕರ ಸಭೆ ಕರೆದು ಚರ್ಚಿಸಬೇಕು.
529,"ವಿಕ್ರಮ: ಅಯ್ಯ ಮಂತ್ರಿ ಇಂದ್ರ ಭವನದಂತೆ ಸೌಂದರ‌್ಯಮಾಗಿ ಅಂದ ಚಂದಗಳಿಂದ ಹೊಂದಿ ಇರುವ ಕುಂದಣದ ಮಣಿಮಂಚದ ಮೇಲೆ ಸುಂದರ ಚಂದ್ರಕಾಂತೆ ಸಮೇತನಾಗಿ ಹೊಂದಿ ನಿದ್ರೆಯನ್ನು ಪೋಗುತ್ತಿರುವಲ್ಲಿ ಬಂದಿದ್ದ ಚೋರರು ಬೇಳ್ವೆ ಚೆಲ್ಲಿದರಾದ ಕಾರಣ, ಮಂದಮತಿ ಕವಿದಿರುವ ಸಮಯದಲ್ಲಿ ಯನ್ನ ಕರ ಕಂಕಣಕ್ಕೆ ಓಲೆಯನ್ನು ಬಂಧಿಸಿ ಧನಕನಕ ವಜ್ರ ವೈಢೂರ‌್ಯ ಮುಂತಾದ ಚಂದ್ರಾಯುಧಗಳನ್ನು ಸಹ ಕದ್ದುಕೊಂಡು ಪೋದರಾದ ಕಾರಣ ಮುಂದಿನ ಯೋಚನೆಯನ್ನು ತಿಳಿಸೋ ಪ್ರಧಾನಿ – ವಾರುಧಿ ಸಮಾನಿ ॥"
530,ಕಳುಹೆಂದೆನುತ ಕರ ಮುಗಿದು ಧರ್ಮಜಗೆರಗಿ ಭಕ್ತಿಯಲಿ॥
531,ನೇ ಶತಮಾನದ ಬಾಬ್ರಿ ಮದೀಸಿಯನ್ನು ಕರ ಸೇವಕರು 1992ರಲ್ಲಿ ನೆಲಸಮಗೊಳಿಸಿದರು.
532,ಆಯಾ ಗ್ರಾಮಗಳ ಕರ ವಸೂಲಿ ಹಣದಲ್ಲಿಯೇ ಕಾಮಗಾರಿ ಕೈಗೊಳ್ಳಬೇಕು.
533,ತಾಲೂಕಾ ಶಿಕ್ಷ ಕರ ಸಂಘದ ಅಧ್ಯಕ್ಷ ಎನ್‌.
534,ಉದಯದರ್ಕ ಸಮಗ್ರ ಕರ ಸಂ | ಪದವನಾಂತವೊಲೆಳೆ ಶಶಿಯೇ ಪೆ |
535,"ಪೊನ್ನಪ್ಪ ಮಾತನಾಡಿ, 11 ವರ್ಷದ ಹಿಂದೆ 7 ಮಕ್ಕಳಿಂದ ಆರಂಭ ವಾದ ಕೊಡಗು ಮಾಡೆಲ್ ಸ್ಕೂಲ್, ಶಿಕ್ಷ ಕರ ಪರಿಶ್ರಮದಿಂದ ಇಂದು ಎತ್ತರಕ್ಕೆ ಬೆಳೆ ದಿದೆ."
536,"ವಿಜಯ ಕರ್ನಾಟಕ ಪತ್ರಿಕೆಯನ್ನು ಕೈಯಲ್ಲಿ ಹಿಡಿದು, ಓಡಾಡಿ ನನ್ನ ಕರ ಪತ್ರಗಳನ್ನು ಹಂಚಿದೆ."
537,ಮುದ್ದೇಬಿಹಾಳ 16: ಕಾಪರ್ೋರೇಟರ್ ಕಂಪನಿಗಳ ಪರವಾಗಿ ಕಾರ್ಮಿ ಕರ ಕಾನೂನುಗಳನ್ನು ತಿದ್ದುಪಡೆ ಮಾಡುವ ಮೂಲಕ ಕೇಂದ್ರ ಹಾಗೂ ರಾಜ್ಯ ಸರಕಾರಗಳು ಕಾಮರ್ಿಕರ ಮೇಲೆ ಶೋಷಣೆ ಮಾಡುತ್ತಿದ್ದು ಕೂಡಲೆ ಇದನ್ನು ನಿಲ್ಲಿಸಬೇಕು ಎಂದು ಸಂಘಟನೆಯ ನೌಕರರ ಸಂಘದ ಅಧ್ಯಕ್ಷ ಅಬ್ದುಲ್ರಜಾಕ ತಮದಡ್ಡಿ ಹೇಳಿದರು.
538,ನಗರದ ಬೇರೆ ಕಡೆ ಬೇಕಿದ್ದರೆ ನೀರಿನ ಕರ ವಸೂಲಿ ಮಾಡಿ ಆದರೆ ಮುಳುಗಡೆ ಪ್ರದೇಶದ ವ್ಯಾಪ್ತಿಯ ವಾರ್ಡ್‌ಗಳಲ್ಲಿ ಕರ ವಸೂಲಿ ಬೇಡ ಎಂದು ಒತ್ತಾಯಿಸಿದರು.
