Index,Sentence
460,"ಉದಾಹರಣೆಗೆ, ತಿಳಿ ಹಸಿರು ಪ್ರಾಮ್ ರಾತ್ರಿ ಉಡುಗೆ ರೈಲು ಉತ್ತಮ ಕಾಣುತ್ತವೆ."
461,"ಎಲೆಮರೆ ಕಾಯಿಯಂತಿರುವ ಪ್ರತಿಭೆಗಳಿಗೆ ವೇದಿಕೆ ಅವಶ್ಯಕವಾಗಿದ್ದು, ಇತಿಹಾಸ ಪುಠಗಳಿಂದ ರಾಜಮಹಾರಾಜರ ಕಾಲದಿಂದಲೂ ಕಲೆ, ಸಾಹಿತ್ಯ, ಸಂಗೀತ, ಕನ್ನಡ ನಾಡು ಸಂಪತ ಭರಿತವಾಗಿದ್ದು, ಇವುಗಳ ಬಗ್ಗೆ ಇಂದಿನ ಮಕ್ಕಳಿಗೆ ತಿಳಿ ಪಡಿಸುವ ಮೂಲಕ ಪ್ರೌತ್ಸಾಹ ನೀಡುವುದು ಎಲ್ಲರ ಕರ್ತವ್ಯವಾಗಿದೆ ಎಂದು ತಿಳಿಸಿದರು."
462,"ನೋಡಲು 283ರಂತಿದ್ದರೂ, ತಿಳಿ ಹಸಿರುಗಂದು ಮೇಲ್ಮೈ; ಬಿಳಿ ಹುಬ್ಬು; ಗಂಟಲು-ಎದೆಯ ಮೇಲೆ ಎರಡು ಕ್ಪ ಪಟ್ಟಿಗಳು; ಕಡುಗಂದು ರೆಕ್ಕೆಗಳಲ್ಲಿ ಹಳದಿ ಪಟ್ಟಿಗಳು; ಬಾಲಕ್ಕೆ ಬಿಳಿಯಂಚು; ಮಾಸಲು ಕೆಳಮೈ."
463,"ಇವೆಲ್ಲದರೊಂದಿಗೆ ಬೆಳೆಗಾರರಿಗೆ ಸಹಕಾರಿ ಆಂದೋಲನದ ಮಹತ್ವವನ್ನು ತಿಳಿ ಹೇಳಬೇಕು, ಇದಕ್ಕೆ ಅಗತ್ಯವಿರುವ ಶಿಕ್ಷಣ, ಮಾಹಿತಿ ಮತ್ತು ತರಬೇತು ಅವರಿಗೆ ಒದಗಿಸಿ ಅಡಿಕೆ ಕ್ಷೇತ್ರದ ರಕ್ಷಣೆಗಾಗಿ ಕ್ರಾಂತಿಕಾರಿ ಹೆಜ್ಜೆಯಿಡಬೇಕು."
464,ಅವರವರ ಉತ್ತಮ ಭವಿಷ್ಯ ರೂಪಿಸಿಕೊಳ್ಳಲು ಅವರವರೇ ಶಿಲ್ಪಿಗಳು ಎಂಬ ವಾಸ್ತವವನ್ನು ಎಲ್ಲರೂ ಮನಗಾಣಬೇಕೆಂದು ವಿದ್ಯಾರ್ಥಿಗಳಿಗೆ ತಿಳಿ ಹೇಳಿದರು.
465,ಇದು ನೋವಿನ ನೋಟವನ್ನು ಹೊಂದಿದೆ ತಿಳಿ ಗುಲಾಬಿ ಬಣ್ಣ.
466,ಪ್ರಾಣಿ ಬಣ್ಣಗಳು ಹಳದಿ ಛಾಯೆಯನ್ನು ತಿಳಿ ಬೂದು ಆಗಿದೆ.
467,"ನಿಮ್ಮನ್ನ ನೂರಕ್ಕೆ ನೂರು ಮಂತ್ರಿ ಮಾಡ್ತೇನೆ, ಆದರೆ ಬಜೆಟ್ ಅಂಗೀಕಾರವಾಗಿ ಅಧಿವೇಶನ ಮುಗಿಯಲಿ ಅಂತಾ ತಿಳಿ ಹೇಳಿದ್ದಾರೆ."
468,"ಸಹವಾಸ ಮಾಡೆ, ಅಂತ್ಯದ ತಿಳಿ ಬೆವರು"
469,ನಿಟ್ಸ್ ಅಂಡಾಕೃತಿಯದಾಗಿವೆ ಗಾಢ ಕಂದು ತಿಳಿ ಬೂದು ಛಾಯೆಗಳು.
470,"ಸಲ್ವಾರ್‌ಗೆ ಕಂದು ಬಣ್ಣ, ಟಾಪ್‌ಗೆ ತಿಳಿ ಹಸಿರು ಬಣ್ಣ"
471,ಶಾಸಕ ರಾಜುಗೌಡ ನೇತೃತ್ವದಲ್ಲಿ ಇವತ್ತು ವಿವಿಧ ಗ್ರಾಮಕ್ಕೆ ತೆರಳಿ ಬಯಲು ಶೌಚ್ಯ ಬಗ್ಗೆ ತಿಳಿ ಹೇಳಿದ್ರು.
472,"ಆದರೆ, ರಾಜ್ಯ ಕಾಂಗ್ರೆಸ್‌ನ ಯಾವ ನಾಯಕರೂ ಎಚ್‌ಡಿಕೆ ಅವರೊಂದಿಗೆ ಕುಳಿತು ಇಂತಹ ಸೂಕ್ಷ್ಮ ವಿಚಾರದಲ್ಲಿ ಸಂಯಮ ವಹಿಸಬೇಕೆಂದು ತಿಳಿ ಹೇಳುವ ಸ್ಥಿತಿಯಲ್ಲಿಲ್ಲ."
473,ನಂತರ ತಿಳಿ ಬಿಸಿಲಿಗೆ ಪರಿಚಯಿಸಿದೆವು.
474,ಹಂಡೆ ನಮ್ಮ ಚಿಕ್ಕಂದಿನಲ್ಲಿ ವಹಿಸಿದ ಮಹತ್ವದ ಪಾತ್ರದ ಬಗ್ಗೆ ಅವರಿಗೆ ಎಂತು ತಿಳಿ ಹೇಳುವದು?
475,ಅದರಂತೆ ನಾವಿಂದು ನಿಮಗೆಲ್ಲರಿಗೂ ಮದುವೆ ಮನೆಯಲ್ಲಿ ಮಾಡುವ ತಿಳಿ ಸಾರು ರೆಸಿಪಿಯ ಬಗ್ಗೆ ತಿಳಿಸುಕೊಡುತ್ತಿದ್ದೇವೆ.
476,"ಮದುವೆಯ ಜನಾಂಗ-ಉಡುಪುಗಳು ಹೆಚ್ಚಾಗಿ ಉದ್ದವಾದ ಶೈಲಿಗಳಿಂದ ಪ್ರತಿನಿಧಿಸಲ್ಪಡುತ್ತವೆ, ಮತ್ತು ಕೆಲವೊಮ್ಮೆ ಬಿಳಿ ಅಲ್ಲ, ಆದರೆ ಬಗೆಯ ಉಣ್ಣೆಬಟ್ಟೆ, ತಿಳಿ ಗುಲಾಬಿ ಅಥವಾ ಕೆನೆ ಬಣ್ಣ."
477,ಈ ಸಂದರ್ಭದಲ್ಲಿ ನೀಲಿ ಮತ್ತು ಹಸಿರು ಕಣ್ಣುಗಳ ಮಾಲೀಕರು ಬೆಳಕು ಬೂದು ಅಥವಾ ತಿಳಿ ಕಂದು ಟೋನ್ಗಳಲ್ಲಿ ಬರುತ್ತಾರೆ.
478,ಆದರೆ ಅಧಿಕಾರಿಗಳು ಕೇವಲ ರೇಡಿಯೊ ವಾರ್ತೆ ಕೇಳಿ ಯುದ್ಧ ಘೋಷಿಸಲು ಬರುವುದಿಲ್ಲ ಎಂದು ತಿಳಿ ಹೇಳಿದ್ದರು.
479,ಕಣಗಳು ತಿಳಿ ಛಾಯೆಗಳು ಮೇಲಿನ ಸಾಧಾರಣ ಉದ್ದ ಮಾಲೀಕರಿಗೆ ಆಯ್ಕೆ ಮಾಡಬೇಕು.
480,ಉದ್ದನೆಯ ತಿಳಿ ಹಳದಿ ಹುಬ್ಬು.
481,"ಸೂರ್ಯನ ಕಠಿಣ ಕಿರಣಗಳಿಗೆ ಒಳಗಾಗುವ ಬಹುಸಂಖ್ಯೆಯ ಸಂಸ್ಕೃತಿಗಳಲ್ಲಿ, ತಿಳಿ ಚರ್ಮವು ನೀವು ಒಳಗೆ ವಿಶ್ರಾಂತಿ ಪಡೆದಾಗ ಕ್ಷಮಿಸದ ಸೂರ್ಯನ ಕಿರಣಗಳಲ್ಲಿ ಶ್ರಮವಹಿಸಲು ಬೇರೆಯವರಿಗೆ ಪಾವತಿಸಲು ಸಾಕಷ್ಟು ಶ್ರೀಮಂತ ಎಂದು ಅರ್ಥ."
482,ಸಮೀಕ್ಷೆಗಳು ಏನನ್ನು ಹೇಳಬಲ್ಲವು ಅಥವಾ ಏನನ್ನು ಹೇಳ ಲಾರವು ಎಂಬುದರ ಕುರಿತಂತೆ ಜನಸಾಮಾನ್ಯ ರಿಗೆ ದುರದೃಷ್ಟವಶಾತ್ ಬಹಳ ಕಡಿಮೆ ತಿಳಿ ವಳಿಕೆ ಇದೆ.
483,"ಇದು ತಿಳಿ ಹಳದಿ ಬಣ್ಣದಿಂದ ಗಾಢ ಕಂದು ಹಿಡಿದು, ವಿವಿಧ ಬಣ್ಣಗಳ ಇರಬಹುದು."
484,"ಬಣ್ಣ ವ್ಯಾಪ್ತಿಯು ಬಹಳ ವೈವಿಧ್ಯಮಯವಾಗಿದೆ, ಇದು ಸಾಂಪ್ರದಾಯಿಕ ಕಪ್ಪು, ಕಂದು, ಬೂದು, ಬಗೆಯ ಬಣ್ಣದ ಬಣ್ಣಗಳು, ಮೃದುವಾದ ನೀಲಿಬಣ್ಣದ ಛಾಯೆಗಳು, ಉದಾಹರಣೆಗೆ, ಪುದೀನ, ತಿಳಿ ಗುಲಾಬಿ, ನೀಲಿ, ಪ್ರಕಾಶಮಾನ ಮತ್ತು ಸ್ಯಾಚುರೇಟೆಡ್, ಉದಾಹರಣೆಗೆ ಕೆಂಪು, ಹಳದಿ, ಜಲಚರಗಳು."
485,ತಿಳಿ ಹಸಿರು ಸೂಚಕ ಬೆಳಕಿನ ತಿರುಗುತ್ತದೆ ಒಮ್ಮೆ ಲಿವರ್ ತಿರುಗಿ ಪರಿಮಳಯುಕ್ತ ಪಾನೀಯ ತುಂಬಿದ ಕಪ್ ನಿರೀಕ್ಷಿಸಿ.
486,ಇದಕ್ಕೆ ಕಿವುಚಿದ ಹುಣಸೆಹಣ್ಣಿನ ತಿಳಿ ನೀರನ್ನು ಸೇರಿಸಿ ಚೆನ್ನಾಗಿ ಕುದಿಸಿ.
487,ಪ್ರಮುಖ ರಸ್ತೆಗಳಲ್ಲಿಯೇ ಇಂತಹ ದಶ್ಯ ಕಂಡುಬರುತ್ತಿದ್ದರೂ ತಿಳಿ ಹೇಳುವ ಅಥವಾ ಕ್ರಮ ಜರುಗಿಸುವ ಕಾರ್ಯ ನಡದೇ ಇಲ್ಲ ಎಂಬ ಅಸಮಾಧಾನ ವಾಹನ ಸವಾರರಿಂದ ವ್ಯಕ್ತವಾಗುತ್ತಿದೆ.
488,ತಿಳಿ ನೀಲಿ (ಪ್ಲಾಸಿಡ್ ನೀಲಿ).
489,ತಿಳಿ ಉಜ್ಜುವಿಕೆಯಿಂದ ಕ್ರೀಂ ಒಂದು ತೆಳುವಾದ ಏಕರೂಪದ ಪದರವನ್ನು ಸಮಸ್ಯೆ ಪ್ರದೇಶಗಳಲ್ಲಿ ಅನ್ವಯಿಸಲಾಗುತ್ತದೆ.
490,ಹೋಲಿಕೆಯಲ್ಲಿ 6 ಅಥವಾ ಅದಕ್ಕಿಂತ ಹೆಚ್ಚು ಎಲೆಗಳು ಫಲಕದಲ್ಲಿಯ ತಿಳಿ ವರ್ಣಗಳೊಂದಿಗೆ (ಫಲಕದ ಸಂಖ್ಯೆ 5 ಕ್ಕಿಂತ ಕಡಿಮೆ) ಹೋಲಿಕೆಯಾದರೆ ಪ್ರತಿ ಎಕರೆಗೆ 25 ಕಿಗ್ರಾಂ ಸಾರಜನಕ ನೀಡಿ.
491,"ಉದಾಹರಣೆಗೆ, ತಿಳಿ ಬೂದು ಆಮ್ಲೀಯ ಹೊಂದಿರುವುದಿಲ್ಲ."
492,ಅಡುಗೆ ಅಂಬಲಿ ಬಟಾಣಿ ಪತನಾನಂತರ ತಂಪಾಗುವ ತಿಳಿ ಹಸಿರು ಎಲೆಗಳ ಆಹಾರ ಬೇಕು.
493,"ಬಾಯಿಯಿಂದ ಹರಡಿರುವ ಹಲವಾರು ತಿಳಿ ನೀಲಿ ಗೆರೆಗಳು ಇವೆ, ಮತ್ತು ಗಿಲ್ ರೋಕರ್ಗಳು ಚಿಕ್ಕದಾಗಿರುತ್ತವೆ ಮತ್ತು ಗಟ್ಟಿಯಾಗಿರುತ್ತವೆ."
494,"ಹೀಗಾಗಿ, ಡಾರ್ಕ್ ಕೆಂಪು ಮತ್ತು ಗಾಢ ಹಳದಿ, ಬದಲಿಗೆ ಆಳವಾಗಿ ಕೆಂಪು ಮತ್ತು ಕಪ್ಪು ಹಳದಿ, ನೀವು ಹಸ್ತಾಂತರಿಸುತ್ತಾನೆ ಪದಗಳನ್ನು ಕಡುಗೆಂಪು ಮತ್ತು ಕಂದು ಮಿಶ್ರಿತ ಹಳದಿಬಣ್ಣದ; ತೆಳು ಕಿತ್ತಳೆ - ಪದ orangey, ತಿಳಿ ಹಸಿರು - ಕ್ಲೋರಿನ್, ತಿಳಿ ಹಳದಿ - ಪಾಳು."
495,"ಉದಾಹರಣೆಗೆ, ಇದು ಶಾಂತ ನೀಲಿಬಣ್ಣದ ನೀಲಿ ಮತ್ತು ವಿವಿಧ, ನೀಲಿಬಣ್ಣದ ಗುಲಾಬಿ ಮತ್ತು ತಿಳಿ ಬೂದು, ಪುದೀನ ಮತ್ತು ಬೆಳಕಿನ ಕಂದು ಸಂಯೋಜಿಸಲು ಸಾಧ್ಯ."
496,ತಿಳಿ ನೀಲಿ ಬಣ್ಣದ ಜೆರ್ಸಿಯ ಮೇಲೆ ಹಳದಿ ಬಣ್ಣದ ಪಟ್ಟಿಗಳೂ ಇದ್ದವು.
497,ತಿಳಿ ನೀರಿಗೆ ನೀಲಿ ಬೆರೆಸಿದಾಗ ನೀರು ನೀಲಿಯಾಗುತ್ತದೆ; ಕೆಂಪು ಬೆರೆಸಿದಾಗ ಕೆಂಪಾಗುತ್ತದೆ.
498,ಆ ಹಿನ್ನಲೆಯ ವಿಷಯಗಳನ್ನು ಸಹ ಇಂದು ಜಾನಪದ ಕಲಾವಿದರು ಜನರಿಗೆ ತಿಳಿ ಹೇಳುವುದು ಅವಶ್ಯವಿದೆ ಎಂದು ಹೇಳಿದರು.
499,"ಹೂವಿನ ಆದ್ಯತೆ : ಈ ಜೀವಿಗಳೆರಡೂ ವ್ಯಾಪಕ ಶ್ರೇಣಿಯ ಹೂವುಗಳಿಂದ ಸಪ್ ಮಕರಂದವನ್ನು ಹೊಂದಿವೆ, ಆದರೆ ಅನೇಕ ಹಮ್ಮಿಂಗ್ಬರ್ಡ್ ಪತಂಗಗಳು ತಿಳಿ ಬಣ್ಣಗಳನ್ನು ಆದ್ಯತೆ ನೀಡುತ್ತವೆ."
500,ಅಗರ್-ಅಗರ್ ಎರಡು ವಿಧಗಳಾಗಿರಬಹುದು: ಉನ್ನತ (ಬಿಳಿ ಅಥವಾ ತಿಳಿ ಹಳದಿ) ಮತ್ತು ಮೊದಲ (ಗಾಢ ಹಳದಿ).
501,"ಹೆಚ್ಚಾಗಿ ಇವುಗಳು ತಿಳಿ ಬಣ್ಣಗಳು: ಬಿಳಿ, ಕ್ಷೀರ, ಗುಲಾಬಿ, ನೀಲಕ."
502,"ನೀಲಿ ಅಥವಾ ತಿಳಿ ನೀಲಿ, ಗುಲಾಬಿ ಅಥವಾ ಗಾಢವಾದ ಕೆಂಪು: ಸಾಮಾನ್ಯವಾಗಿ ಸ್ನಾತಕೋತ್ತರ ಕುರ್ಚಿಯ ಮರದ ಭಾಗಗಳು ಇತರ ಬಣ್ಣಗಳನ್ನು ಆಯ್ಕೆ ಮಾಡಲಾಗುತ್ತದೆ."
503,ಚೆನ್ನೈ ಎಕ್ಸ್ ಪ್ರೆಸ್ ಚಿತ್ರದಲ್ಲಿ ಬ್ರ್ಯಾಂಡ್ ಶಾರುಖ್ ಹಾಗೂ ತಿಳಿ ಹಾಸ್ಯ ಪ್ರೇಕ್ಷಕರನ್ನು ರಂಜಿಸುತ್ತದೆ.
504,"ನೋಡಿದಿರಲ್ಲ, ಈ ರೀತಿಯ ಕಾರ್ಯಕ್ರಮಗಳನ್ನು ಆಯೋಜಿಸುವಾಗ ತುಂಬಾ ಎಚ್ಚರಿಕೆ ಅಗತ್ಯ ಎಂದು ತಿಳಿ ಹೇಳಿದ್ದು ಇಂದಿಗೂ ನಮ್ಮ ಬದುಕಿನ ದೊಡ್ಡ ಪಾಠವಾಗಿ ಉಳಿದುಕೊಂಡಿದೆ."
505,"ಪೆನ್ಸಿಲ್, ಬ್ರೌನಿಂಗ್ ಮತ್ತು ಬಿಡುವುದು ಮುಂಚೆ ಕೋನಿಫರ್ ಸೂಜಿಗಳು ತಿಳಿ ಹಸಿರು ಅಥವಾ ನೀಲಿ-ಹಸಿರು ಬಣ್ಣವನ್ನು ತಿರುಗಿಸುತ್ತವೆ."
506,ಪರಿಮಳದಿಂದ ಕೂಡಿದ ತಿಳಿ ಜಲದಲ್ಲಿ ಶಿವಲಿಂಗಕ್ಕೆ ಸ್ನಾನ ಮಾಡಿಸಿ ಬಗೆಬಗೆಯ ರೀತಿಯಿಂದ ಅಲಂಕಾರ ಮಾಡಿ ಪೂಜಿಸುತ್ತಾ ಪೂಜಿಸುತ್ತಾ ರೋಮಾಂಚನಗೊಂಡು ಮೈಮರೆಯುವ ಭಕ್ತೆ ಮಹಾದೇವಿಯ ಚಿತ್ರ ಅಪೂರ್ವವಾದುದು.
507,"ಛೇ ಇದೇನಿದು ಶ್ರಾವಣಮಾಸದಲ್ಲಿ ವಡೆಯ ಚಿಂತೆ, ಎಲ್ಲಿ ಶ್ರೀನಾಥರಿಂದ ಒಡೆಯನ ವಡೆ ಯಲ್ಲಿ ಅದು ಅವರು ತಿಳಿ ಹಾಸ್ಯ ತೆಗೆದು ಹಾಕಿದ್ದಾರಂತೆ."
508,ಬಳಿಕ ರಾಹುಲ್ ಗಾಂಧಿಗೆ ಸೋನಿಯಾ ಗಾಂಧಿ ಹಾಗೂ ಮಾಜಿ ಪ್ರಧಾನಿ ಮನಮೋಹನ್ ಸಿಂಗ್ ಅವರು ತಿಳಿ ಹೇಳಿದ್ದಾರೆ ಎಂದು ತಿಳಿದುಬಂದಿದೆ.
509,ಎಂದು ಹಳ್ಳಿ ಹಳ್ಳಿಗಳಿಗೆ ಹೋಗಿ ತಿಳಿ ಹೇಳಿ ಜಾಗ್ರತಿ ಮೂಡಿಸುವ ಇವರಿಂದಾಗಿ ಇತ್ತೀಚೆಗೆ ಮನೆಯಲ್ಲಿ ಕಟ್ಟಿರುವ ಜೇಡದ ಬಲೆ ತೆಗೆಯಲೂ ನಾನು ನೂರು ಸಲ ಯೋಚಿಸುವಂತಾಗಿ ಬಿಟ್ಟಿದೆ.
510,ಜೊತೆಗೆ ಮನೆಯಲ್ಲಿ ಮಣ್ಣಿನ ಮಡಕೆಯಲ್ಲಿ ಯಾವತ್ತೂ ತಪ್ಪದ ತಿಳಿ ನೀರ ಮಜ್ಜಿಗೆ ಪಾನಕವಿರುತ್ತಿತ್ತು.
511,"ಶೌಚಾಲಯಗಳ ಬಳಕೆಗೆ ಜನರನ್ನು ಪ್ರೇರೇಪಿಸುವುದು, ಗ್ರಾಮೀಣ ಪ್ರದೇಶದಲ್ಲಿ ಸ್ವಚ್ಛತೆಯನ್ನು ಕಾಪಾಡುವುದು, ಘನತ್ಯಾಜ್ಯದ ಸಮರ್ಪಕ ವಿಲೇವಾರಿ, ಜಲಮೂಲಗಳ ಸುತ್ತ ನೈರ್ಮಲ್ಯ ಕಾಪಾಡುವುದು, ನೀರಿನ ಮೂಲಗಳ ಸಂರಕ್ಷಣೆ ಮತ್ತು ನಿರ್ವಹಣೆ ಬಗ್ಗೆ ಜನರಿಗೆ ತಿಳಿ ಹೇಳುವುದು ಆಂದೋಲನದ ಒಟ್ಟಾರೆ ತಿರುಳು."
512,ನನ್ನ ಬಳಿ ಕೆಲವು ಬಾರಿ ವೈಯಕ್ತಿಕ ವಿಷಯ ಪ್ರಸ್ತಾಪಿಸಿದಾಗ ಅವರಿಗೆ ತಿಳಿ ಹೇಳಿದ್ದೆ.
513,ಇದೇ ವಿಚಾರವಾಗಿ ಒಮ್ಮೆ ಆಕೆಯನ್ನ ಕರೆದು ಹೇಗೆ ನಡೆದುಕೊಳ್ಳಬೇಕು ಅಂತ ತಿಳಿ ಹೇಳಿದ್ರಂರೆ.
514,"ಅವುಗಳ ಆಕಾರ ರೇಖೀಯ, ಕಿರಿಯಗಲ ದಾಗಿರುವ ಅವುಗಳ ಬಣ್ಣ ತಿಳಿ ಹಸಿರು."
515,"ಅದೇ ಸಮಯದಲ್ಲಿ, ಒಂದು ನಿಯಮದಂತೆ, ಬೇರ್ಪಡಿಕೆ ವಿರಳವಾಗಿರುವ, ನಸುಗೆಂಪು ಅಥವಾ ಬಣ್ಣದಲ್ಲಿ ತಿಳಿ ಕಂದು, ನೋವು ಜೊತೆಗೂಡಿ ಆಗದೆ ಇವೆ."
516,"ಒಮ್ಮೊಮ್ಮೆ ಕಾದು ಕಾದು ಬೇಸರವಾಗಿ, ಆ ಸಿಡುಕು ಮೂತಿಯ ಅತಿಥಿಯನ್ನು ಕರೆದುಕೊ೦ಡು ಹೋಗುವ ಬದಲು ಯಾರಾದರೂ ಸು೦ದರವಾಗಿರುವ ಗಗನಸಖಿಯನ್ನೇ ಕರೆದುಕೊ೦ಡು ಹೋಗುವ ಎ೦ದು ನಾವೇ ಮಾತನಾಡಿಕೊ೦ಡು ನಮ್ಮ ಮನಸ್ಸಿನಲ್ಲಿರುವ ಆತ೦ಕದ ವಾತಾವರಣ ತಿಳಿ ಗೊಳಿಸಲು ಪ್ರಯತ್ನಿಸುತ್ತಿದ್ದೆವು."
517,"ಆದರೆ, ನಾವು ಎರಡು ಕುಟುಂಬಗಳೀಗೆ ತಿಳಿ ಹೇಳಿದೆವು."
518,"ಕೋಲಾರ: ವಾಹನ ಸವಾರರಲ್ಲಿ ಜಾಗೃತಿ ಮೂಡಿಸಲು ಶುಕ್ರವಾರ ಗಣೇಶನೇ ರಸ್ತೆಗಳಿದಿದ್ದ, ಬೈಕ್‌ ಸವಾರರಿಗೆ ಹೆಲ್ಮೆಟ್‌ ಧರಿಸುವಂತೆ ತಿಳಿ ಹೇಳಿ ಉಚಿತವಾಗಿ ವಿತರಣೆಯೂ ಮಾಡಿದ."
519,ಅನೇಕ ವೈದ್ಯರು ಹೊರಾಂಗಣ ಬಳಕೆಗೆ ತಿಳಿ ನಾಯಿಕೊಡೆ ಬಳಸಲು ಸೂಚಿಸಲಾಗಿದೆ.
520,ಆದ್ದರಿಂದ ಶಿಕ್ಷಕರು ತರಗತಿಗಳಲ್ಲಿ ಪಾಠ ಮಾಡುವಾಗ ಪರಿಸರದ ಸಂರಕ್ಷಣೆ ಕುರಿತು ಮಕ್ಕಳಿಗೆ ಅರಿವು ಮೂಡಿಸುವ ಜತೆಗೆ ಪರಿಸರಕ್ಕೆ ಹಾನಿ ಉಂಟು ಮಾಡುವ ವಸ್ತುಗಳನ್ನು ಬಳಕೆ ಮಾಡದಂತೆ ತಿಳಿ ಹೇಳಬೇಕು ಎಂದರು.
521,ಪುರುಷರು ಎಲ್ಲಿ ಸ್ಪರ್ಶಿಸಿದರೆ ಏನಾಗುತ್ತದೆ ಎಂದೆಲ್ಲ ತಿಳಿ ಹೇಳಿರಬೇಕು.
522,"ಎದೆ ನೋವು ತುಂಬಾ ಹೇರಳವಾಗಿ ಬೆಳೆಯುತ್ತಿದೆ ಹಾಲಿನ ಕಾರಣ, ನೀವು ಒಂದು ಸ್ತನ ಪಂಪ್, ತಿಳಿ ಸುರಿ ಕೊಂಡುಕೊಳ್ಳಬೇಕು ವೇಳೆ ಮತ್ತು ಸಾಮಾನ್ಯವಾಗಿ ಎದೆಹಾಲನ್ನು ಬೇಬಿ ಪುಟ್."
523,ಕಲರ್ಸ್ ಕನ್ನಡದ ಎಂದಿನ ಶೈಲಿಯಲ್ಲಿ ತಿಳಿ ಹಾಸ್ಯಕ್ಕೆ ಇಲ್ಲಿ ಒತ್ತು ನೀಡಲಾಗಿದೆ ಎನ್ನುತ್ತಾರೆ ಕಲರ್ಸ್ ಕನ್ನಡದ ಬಿಸಿನೆಸ್ ಹೆಡ್ ಪರಮೇಶ್ವರ ಗುಂಡ್ಕಲ್.
524,"ಸ್ಟೂಲ್ ಕಳಪೆಯಾಗಿ ರೂಪುಗೊಂಡಿದೆ ಅಥವಾ ದ್ರವವಾಗಿದೆ, ತಿಳಿ ಮ್ಯೂಕಸ್ ಮತ್ತು ಗುಲಾಬಿ ಕಲ್ಮಶಗಳನ್ನು ಹೊಂದಿದೆ (ರಕ್ತದ ವಿಸರ್ಜನೆಯ ಕಾರಣ)."
525,"ಇದು ಒಂದು ಬೆಳಕಿನ ಕಂದು, ತಿಳಿ ಕೆನೆ, ತೆಳು ಕಾವಿಮಣ್ಣು ಬಣ್ಣದ ಇರಬಹುದು."
526,ರಸವು ತಿಳಿ ಕೆಂಪು ಬಣ್ಣವಾಗಿದೆ.
527,"ಜಿಲ್ಲೆಯ ಹೆಂಚಿನ ಕಾಖರ್ಾನೆ ಕಾಮರ್ಿಕರ ಸಂಘಟನೆಯಲ್ಲಿ ಉಪಾಧ್ಯಕ್ಷರಾಗಿ ದೀರ್ಘ ಕಾಲ ಸೇವೆ ಸಲ್ಲಿಸಿದ್ದರು, ಪಕ್ಷದ ಆದೇಶದಂತೆ ಹೆಂಚಿನ ಕಾಖರ್ಾನೆಯಲ್ಲಿ ದುಡಿಯುತ್ತಿದ್ದ ಪಕ್ಷ ಕಾರ್ಯಕರ್ತರು, ಶೋಷಣೆಗೆ ಒಳಗಾಗಿದ್ದ ಅಸಂಘಟಿತ ಕ್ಷೇತ್ರದ ಬೀಡಿ ಕಾಮರ್ಿಕರನ್ನು ಸಂಘಟಿಸಲು ತೆಗೆದುಕೊಂಡಿದ್ದ ತೀಮರ್ಾನ ಪ್ರಕಾರ ಹಳ್ಳಿಯಲ್ಲಿ ಮನೆಮನೆಗೆ ಭೇಟಿ ನೀಡಿ ಅವರಿಗೆ ಸಂಘಟನೆಯ ಅವಶ್ಯಕತೆಯನ್ನು ತಿಳಿ ಹೇಳುವ ಮೂಲಕ ಮಾಲಕರಿಂದ ಮತ್ತು ಮಧ್ಯವತರ್ಿಗಳಿಂದ ಆಗುತ್ತಿರುವ, ಅನ್ಯಾಯ ಶೋಷಣೆಯ ವಿರುದ್ಧ ಚಳವಳಿಗಳನ್ನು ಸಂಘಟಿಸಿದ್ದರು, ಬೀಡಿ ಕಾಮರ್ಿಕರ ಹೋರಾಟಗಳಲ್ಲಿ ಮುಂಚೂಣಿಯಲ್ಲಿದ್ದ ಇವರು ಭವಿಷ್ಯನಿಧಿ ಜ್ಯಾರಿಗಾಗಿ ಒತ್ತಾಯಿಸಿ ದ."
528,ಸತ್ತಿರುವ ತನ್ನದಾಗಿ ಹೊಂದುವ ಛಾಯೆ ತಿಳಿ ಇದು ಬಿಳಿಯ ವರೆಗೆ ಭಾಗದ.
529,"ಡಾರ್ಕ್ ಸ್ಕರ್ಟ್ ಮತ್ತು ಕುಪ್ಪಸ, ಕಪ್ಪು ಮತ್ತು ತಿಳಿ ಬಣ್ಣಗಳೆರಡೂ."
530,"ಇದು ನಕಲಿ ಚರ್ಮದ ಹೊದಿಕೆಯೊಂದಿಗೆ ಬಿಳಿ, ಕಪ್ಪು ಅಥವಾ ತಿಳಿ ಕಂದು ಬಣ್ಣದ ಬಣ್ಣಗಳನ್ನು ಹೊಂದಿದೆ."
531,ಮುಕ್ತಾಯವು ಬಣ್ಣದಲ್ಲಿ ತಿಳಿ ನೀಲಿ ಅಥವಾ ತಿಳಿ ಗುಲಾಬಿಯಾಗಿದೆ.
532,"ಅದೇ, ಅಗಲದ ಹಣ್ಣು, ಒಂದು ತಿಳಿ ಹಳದಿ ಚರ್ಮದ ಹೊದಿಕೆಯ."
533,ಈ ಪ್ರಕರಣ ಬೆಳಕಿಗೆ ಬರುತ್ತಿದ್ದಂತೆ ದೇವಸ್ಥಾನದ ಟ್ರಸ್ಟಿಯವರು ಮಹಿಳೆಯನ್ನು ಕರೆದು ತರಾಟೆಗೆ ತೆಗೆದುಕೊಂಡು ದೇವಸ್ಥಾನದಲ್ಲಿ ಮೂರು ವರ್ಷ ದೇವರ ಸೇವೆ ಮಾಡಿದ ಮಾನವೀಯತೆ ದೃಷ್ಟಿಯಿಂದ ಈಕೆಯ ವಿರುದ್ಧ ಯಾವುದೇ ದೂರು ನೀಡದೆ ತಿಳಿ ಹೇಳಿ ಸುಮ್ಮನಾಗಿದ್ದಾರೆ.
534,ಬಲಬಧ್ರ ಹಾಗೂ ಸುಭದ್ರೆ ಮೂರ್ತಿಯನ್ನು ಸ್ವಲ್ಪ ತಿಳಿ ಬಣ್ಣದ ಕಟ್ಟಿಗೆಬಳಸಲಾಗುತ್ತದೆ.
535,ಬೈಜಿಯು ತಿಳಿ ನೀಲಿ ಅಥವಾ ನೀಲಿ ಬೂದು ಬಣ್ಣವಾಗಿ ಪರಿವರ್ತಿಸುತ್ತವೆ.
536,"ವಾತ ಪ್ರಕೃತಿ ಇರುವ ವ್ಯಕ್ತಿಯ ಕೂದಲು ತಿಳಿ ಕಪ್ಪು, ಕಡಿಮೆ ಬೆಳವಣಿಗೆ ಮತ್ತು ಸುಲಭವಾಗಿ ಸೀಳುತ್ತದೆಯಾದರೆ, ಪಿತ್ತ ಪ್ರಕೃತಿ ವ್ಯಕ್ತಿಯ ಕೂದಲು ಕಂದು ಅಥವಾ ತಿಳಿ […]"
537,ನೋಡ ನೋಡುತ್ತಲೇ ತಿಳಿ ನೀರಿನ ತಳದಲ್ಲಿ ಜಲಚರಗಳ ಮ್ಯೂಸಿಯಂ ತೆರೆದುಕೊಂಡಿತು.
538,ತಿಳಿ ನೀಲಿ
539,"ವಾಸ್ತವವಾಗಿ, ಮತಾಂತರಕ್ಕಿಳಿಸುವ ಮಿಷನರಿಗಳಿಗಾಗಲೀ, ಅಥವಾ ಮುಸಲ್ಮಾನರಿಗಾಗಲೀ, ಮತಾಂತರವಾಗುವವರಿಗೆ ಧರ್ಮದ ಸಾರವನ್ನು ತಿಳಿ ಹೇಳಬೇಕೆಂಬ ಅವಶ್ಯಕತೆಯಿಲ್ಲ!"
540,ಕೂದಲು - ಸುಸಾನ್ಗೆ ತಿಳಿ ಕಂದು ಕೂದಲು ಮತ್ತು ನೀಲಿ ಕಣ್ಣುಗಳಿವೆ.
541,"ಮೃದು ಬಿಳಿ, ಮ್ಯೂಟ್ ಬೂದು, ತಿಳಿ ಗುಲಾಬಿ, ಮತ್ತು ಮರೆಯಾಯಿತು ಹಸಿರು ಎಲ್ಲಾ ಒಂದು ಶಬ್ಬಿ ಚಿಕ್ ® ಒಳಭಾಗದಲ್ಲಿ ಒಂದು ಸ್ಥಾನವಿಲ್ಲ."
542,"ಜೀನ್ಸ್‌ನ ಬಣ್ಣವನ್ನು ಸಂಪೂರ್ಣವಾಗಿ ತಿಳಿ ಮಾಡಿದರೆ, ಅದು ಬಹುತೇಕ ಬಿಳಿಯಂತೆ ಕಾಣುತ್ತದೆ."
543,"ಮದ್ಯ ಎನ್ನಲು ಸಾಕಷ್ಟು ಪುರಾವೆಗಳು ಮಲಗಿದ ವ್ಯಕ್ತಿಯ ನಶೆಯ ಭಾವದ ಮೂಲಕ ಸಂಬಂಧ ಕಲ್ಪಿಸಬಹುದು, ಅದರ ಮೇಲಿನ ತಿಳಿ ನೀರು ನದಿಯೋ, ಕೆರೆಯೋ?"
544,ಮಸುಕಾದ ಬೂದು ಅಥವಾ ಮರಳಿನಲ್ಲಿ ಬೆಳಕಿನ ಉಚ್ಚಾರಣೆಯೊಂದಿಗೆ ಆಕ್ವಾ ಅಥವಾ ತಿಳಿ ನೀಲಿ ಗೋಡೆಗಳು ನಿಮ್ಮ ಅಡಿಗೆ ಬೀಚ್ ಶೈಲಿಯನ್ನು ನೀಡುತ್ತವೆ.
545,ಇಂತಹ ಸಂದರ್ಭಗಳಲ್ಲಿ ಸಾರ್ವಜನಿಕರು ಪರಸ್ಪರ ತಿಳಿ ಹೇಳುವ ಕಾರ್ಯ ಮಾಡಬೇಕು.
546,"ಎಲೆಗಳು ತಿಳಿ ಹಸಿರು, ಮುರಿದ ಜೋಡಿಪರ್ಣಗಳನ್ನು ಹೊಂದಿರುತ್ತವೆ."
547,ಲವಂಗ ಅತ್ಯಗತ್ಯ ತೈಲವು ತಿಳಿ ಹಳದಿ ಬಣ್ಣ ಹೊಂದಿದೆ.
548,"ಎರಡನೇ ಗ್ರಂಥಿಯ ಮಕ್ಕಳ ಈಗಾಗಲೇ ಪೂರ್ಣ ವೇಳೆ, ತಿಳಿ ಸುರಿ ಅಗತ್ಯವಿದೆ."
549,"ಆದಾಗ್ಯೂ, ಜುನಿಪರ್ ತಿಳಿ ಛಾಯೆಯನ್ನು ತರುತ್ತದೆ."
550,"ಸುಂದರ ಪರಿಸರ, ಅಲ್ಲಿ ಒಂದಷ್ಟು ಬಾತು ಕೋಳಿಯಂತಿರುವ, ತಿಳಿ ಮತ್ತು ದಟ್ಟ ಕಂದು ಬಣ್ಣವನ್ನು ಮೈಮೇಲೆ ಹೊತ್ತ ಗೂಸ್ ಪಕ್ಷಿಗಳು, ಕೆಲವು ಒಂಟಿ ಕಾಲಿನಲ್ಲಿ ತಪಸ್ಸು ಮಾಡುತ್ತಿದ್ದುವು, ಮಲಗಿ ನಿದ್ದೆ ಮಾಡುತ್ತಿದ್ದವು, ಸಾಲು ಸಾಲು ಹಕ್ಕಿಗಳು ನೋಡಲು ಚಂದವೆನಿಸುತ್ತಿತ್ತು."
551,ತಿಳಿ ಬಣ್ಣದ ಸಾಂಪ್ರದಾಯಿಕ ಉಡುಪುಗಳಲ್ಲಿಯೂ ಏಳು ಬಣ್ಣಗಳು ಝಲಕ್‌ ಕಾಣಬಹುದು.
