Index,Sentence
211,"ಕಸ, ತ್ಯಾಜ್ಯವನ್ನು ಅಲ್ಲಲ್ಲಿ ರಾಶಿ ಹಾಕುವ ಜನರೇನೂ ಬೆಂಗಳೂರಿನಲ್ಲಿ ಕಡಿಮೆಯಿಲ್ಲ."
212,ರಾಶಿ ಹಾಗೂ ಪ್ರಣಯಕ್ಕೂ ಸಂಬಂಧವಿದೆ.
213,ವೃಷಭ ರಾಶಿ :ಅತಿ ಸೂಕ್ಷ ್ಮಮತಿಗಳಾದ ನಿಮಗೆ ಕೆಲವು ವಿಚಾರಗಳನ್ನು ಜೀರ್ಣಿಸಿಕೊಳ್ಳಲು ಆಗುವುದಿಲ್ಲ.
214,ರಾಶಿ ಹಾಗೂ ವ್ಯವಹಾರದ ನಡುವೆ ನಿಕಟ ಸಂಬಂಧವಿರುತ್ತದೆ.
215,"ಪಂಚಮಾಧಿಪತಿಯು ಸ್ತ್ರೀ ರಾಶಿ ಮತ್ತು ಸ್ತ್ರೀ ನವಾಂಶದಲ್ಲಿದ್ದು, ಸ್ತ್ರೀ ಗ್ರಹಗಳೊಂದಿಗೆ ಇದ್ದರೆ ಅಥವಾ ಪುರುಷ ಗ್ರಹದ ದೃಷ್ಟಿಯಲ್ಲಿದ್ದರೆ, ಇವರಿಗೆ ಹೆಣ್ಣು ಸಂತಾನವಾಗುತ್ತದೆ."
216,ಧನು ರಾಶಿ ವ್ಯಕ್ತಿ - ಧನು ಮಹಿಳೆ
217,ವೃಷಭ ರಾಶಿ ನಕಾರಾತ್ಮಕ Read more…
218,ಗೊಬ್ಬು ಮಣ್ಣಿನ ಜೊತೆ ಸೇರಿಸಿ ರಾಶಿ ಹಾಕಿದರು.
219,"ಉದಾಹರಣೆಗಾಗಿ, ಈ ಕುಟುಂಬ ನಿಯಮಿತ ವರಮಾನವಲ್ಲದೆ, ಇತರ ಸಹಜ ಅಥವಾ ಅಸಹಜ ವಿಧಾನಗಳಿಂದ ಹಣ ಸಂಪಾದಿಸುತ್ತಿರುವ ಸರ್ಕಾರಿ ಅಧಿಕಾರಿ, ಎಮ್ಮೆಲ್ಲೇ, ಎಂಪೀ, ಮಂತ್ರಿ, ದೊಡ್ಡ ಸಂಪಾದನೆಯ ವ್ಯಾಪಾರಿ, ಉದ್ಯಮಿ, ಕಂಟ್ರಾಕ್ಟರ್ ಇತ್ಯಾದಿಯಲ್ಲಿ ಯಾವುದಾದರೂ ಒಂದು ಆಗಿರಬಹುದು ಎಂದುಕೊಂಡರೆ, ನಿಯಮಿತವಾಗಿ ಮತ್ತು ಅನಿಯಮಿತವಾಗಿ ವರ್ಷಕ್ಕೆ ಒಂದು ಕೋಟಿ, ಎರಡು ಕೋಟಿ ಅಥವಾ ಅದಕ್ಕಿಂತಲೂ ಹೆಚ್ಚು ಮತ್ತು ಇನ್ನೂ ಹೆಚ್ಚು ಸಂಪಾದನೆ ಮಾಡಿದರೆ, ಹಣದ ರಾಶಿ ಬೆಳೆಬೆಳೆದು ಹಣವನ್ನು ಖರ್ಚು ಮಾಡಲು ದಾರಿ ಕಾಣಿಸದಿರುವಂಥ ಪರಿಸ್ಥಿತಿಯಲ್ಲಿ ಈ ದ್ರವ್ಯ ಸಂಪಾದಕರು ಏನು ಮಾಡುತ್ತಾರೆ?"
220,ಸೋಮವಾರದ ರಾಶಿ ಭವಿಷ್ಯ.
221,ರಸ್ತೆ ಪಕ್ಕದ ಕಸದ ರಾಶಿ ನಡುವೆ ನಡೆದುಕೊಂಡು ಹೋಗಬೇಕಾದ ಸ್ಥಿತಿ ಇದೆ.
222,"ಧನು ರಾಶಿ ಮನುಷ್ಯನನ್ನು ಗೆಲ್ಲಲು, ತನ್ನ ನೈಸರ್ಗಿಕವಾಗಿ ಸಂತೋಷ ಮತ್ತು ಮನೋಭಾವದ ಮನೋಭಾವವನ್ನು ಹೊಂದಿಸಲು ತಮಾಷೆ ಮತ್ತು ತಮಾಷೆಯಾಗಿರಲು."
223,ಮೇಷ ರಾಶಿ ಪುರುಷ - ತುಲಾ ರಾಶಿ ಸ್ತ್ರೀ
224,ಇತ್ತೀಚಿನ ಓದು ರಾಶಿ ಅವರ ಕೊರವಂಜಿಯ ಪಡುವಣಯಾತ್ರೆ ಜಗ್ಗೋಜಿ ಮತ್ತು ಕೊರವಂಜಿ ಅಪರಂಜಿ ರಾಶಿರಾಶಿ
225,"ಕೋಲಾರ ನಗರದಲ್ಲಿ ದಿನನಿತ್ಯ ಕಸದ ರಾಶಿ ಹೆಚ್ಚುತ್ತಿದ್ದು, ಕಸದ ವಿಲೇವಾರಿ ಘಟಕವನ್ನು ಈಗಾಗಲೇ ಗುರ್ತಿಸಿದ್ದು, ವಿನಾಕಾರಣ ಜಿಲ್ಲಾಡಳಿತ ಹಾಗೂ ಅಧಿಕಾರಿಗಳ ನಿರ್ಲಕ್ಷ್ಯದಿಂದ ವಿಳಂಭವಾಗುತ್ತಿದೆ."
226,ಮುಂಬರುವ ಘಟನೆಗಳ ಮೇಲೆ ಉಹಾತ್ಮಕ ನೀವು ಈ ದಿನ ನೀವು ರಾಶಿ ಏನು ಅರ್ಥ ಸಹಾಯ ಮಾಡುತ್ತದೆ.
227,ಭಾನುವಾರದ ರಾಶಿ ಭವಿಷ್ಯ .
228,ಪ್ರೀತಿಗೆ ಸಂಬಂಧಪಟ್ಟ ವಿಷಯಕ್ಕೆ ಬಂದಾಗ ವೃಷಭ ಮತ್ತು ಕುಂಭ ರಾಶಿ ಎಂದಿಗೂ ಒಟ್ಟಾಗಿ ಇರುವುದಿಲ್ಲ .
229,ಪುತ್ತೂರಿನ ಸಹಾಯಕ ಆಯುಕ್ತರ ಕಚೇರಿಯ ಕೆಳಗಡೆ ಇರುವ ಕಸದ ರಾಶಿ ಈ ಡೆಂಗ್ಯೂ ಡ್ರೈವ್ ಅನ್ನು ಅಣಕಿಸುತ್ತಿದೆ.
230,ಧನು ರಾಶಿ ಆಗಸ್ಟ್ ಇದು ವಿಶ್ವಪ್ರಸಿದ್ಧ ಸಂಕೇತ ವಾಹ್!
231,"ಕೆಲವು ಕಡೆ ರಾಶಿ ಹೊಡೆದಿರುವ ಹುಲ್ಲು ಒದ್ದೆಯಾಗಿ, ಉಪಯೋಗಕ್ಕೆ ಬಾರದಂತಾಗಿದೆ."
232,ಇಂದಿನ ರಾಶಿ ಫಲ : ಮಂಗಳವಾರದ ದಿನ ಭವಿಷ್ಯ ಇಲ್ಲಿದೆ ನೋಡಿ.
233,ಕನ್ಯಾ ರಾಶಿ ಈ ರಾಶಿಯವರಿಗೆ ಸ್ನೇಹಿತರೊಡನೆ ಸಹಾಯ ಉಂಟಾಗುವುದು ಧನ ಪ್ರಾಪ್ತಿ ನೆಮ್ಮದಿ ಸುಖ ಶಾಂತಿ ಕಾರ್ಯದಲ್ಲಿ ಜಯ ಶುಭ ಸಂಖ್ಯೆ 2 9986500833
234,ಆದರೆ ಇವುಗಳ ನಡುವೆ ಸೋಮವಾರಪೇಟೆ ತಾಲೂಕಿನಲ್ಲಿರುವ ಭತ್ತದ ರಾಶಿ ಬೆಟ್ಟ ಕೂಡ ಚಾರಣಪ್ರಿಯರಿಗೆ ಹೇಳಿ ಮಾಡಿಸಿದ ಬೆಟ್ಟ ಎಂದರೆ ತಪ್ಪಾಗಲಾರದು.
235,ಕುಂಭ ರಾಶಿ : – ನಿಮಗೆ ನೂರಾರು ಕಡೆಗಳಿಂದ ಪ್ರಶಂಸೆಗಳು ಬರುವ ಸಾಧ್ಯತೆ ಅಧಿಕ ವಾಗಿರುವುದು.
236,ಗುರುವಾರದ ರಾಶಿಭವಿಷ್ಯ : ಇಂದಿನ ರಾಶಿ ಭವಿಷ್ಯ ಇಲ್ಲಿದೆ ನೋಡಿ.
237,"ತಳಾರನು ವಿಚಾರಮಾಡಿ ಬಂದು, ಪ್ರಭುವೇ ಋಷಿಗಳು ಕನ್ನ ಹಾಕಿ ತಮ್ಮ ಬಸದಿಯಲ್ಲಿ ಚಿನ್ನವನ್ನೆಲ್ಲ ರಾಶಿ ಹಾಕಿದ್ದಾರೆ."
238,"ಆರೋಗ್ಯ, ನೈರ್ಮಲ್ಯ ಇತ್ಯಾದಿಗಳನ್ನು ಸಂಪೂರ್ಣವಾಗಿ ಕಡೆಗಣಿಸಿ ನಗರದ ತರಹೇವಾರಿ ತ್ಯಾಜ್ಯಗಳನ್ನೆಲ್ಲ ತಂದು ಗ್ಯೋಟೋ ಕೊಳಚೆ ಪ್ರದೇಶದಲ್ಲಿ ಬೇಕಾಬಿಟ್ಟಿ ರಾಶಿ ಹಾಕುತ್ತಿದ್ದ ಸ್ಥಳೀಯ ಆಡಳಿತ ಮಂಡಳಿಯ ವ್ಯವಸ್ಥೆಗೆ ಚಾಟಿಯೇಟೊಂದು ಆವಶ್ಯಕವಾಗಿ ಬೇಕಾಗಿತ್ತು."
239,ಭಾನುವಾರದ ರಾಶಿ ಭವಿಷ್ಯ ‌
240,ಕ್ವಿಜ್​ನಲ್ಲಿ ಬಾಹ್ಯಾಕಾಶ ಹಾಗೂ ವಿಜ್ಞಾನಕ್ಕೆ ಸಂಬಂಧಿಸಿದ ಪ್ರಶ್ನೆಗಳನ್ನು ಕೇಳಿದ್ದರು ಎಂದು ರಾಶಿ ಹೇಳಿದರು.
241,"ಸಿಂಹ ರಾಶಿ ಜಾತಕ 2020 ರ ಪ್ರಕಾರ, ಈ ವರ್ಷ ನೀವು ಆರೋಗ್ಯವನ್ನು ಪಡೆಯುತ್ತೀರಿ ಮತ್ತು ನೀವು ಉತ್ತಮ ಆರೋಗ್ಯವನ್ನು ಅನುಭವಿಸುವಿರಿ."
242,ಪೇಟೆಯ ಒಂದು ಬದಿಯಲ್ಲಿ ಕಸದ ರಾಶಿ ತುಂಬಿ ತುಳುಕುತ್ತಿದ್ದು ಸಾರ್ವಜನಿಕರಲ್ಲಿ ಝಿಕಾದ ಆತಂಕ ಶುರುವಾಗಿದೆ.
243,ಮೇಷ ರಾಶಿ ಕಾರ್ಯಗಳಲ್ಲಿ ಸಹಜವಾಗಿ ಅಡೆತಡೆಗಳು ಬಂದರೂ ಸಹ ನಿಮ್ಮ ಪ್ರಯತ್ನವನ್ನು ಪ್ರಾಮಾಣಿಕತೆಯಿಂದ ನಿರ್ವಹಿಸಿ ಇದು ನಿಮಗೆ ಫಲ ನೀಡಲಿದೆ.
244,ನಾಯಿ ಅಲ್ಲಿಯೇ ಬಿದ್ದಿದ್ದ ಎಲುಬಿನ ರಾಶಿ ನೋಡಿತು.
245,"ಕಣಜ ತುಂಬುವಷ್ಟು ಧಾನ್ಯ ಕೊಟ್ಟ ಮಣ್ಣು, ನೀರು, ಗಾಳಿ, ಪಶು-ಪಕ್ಷಿ ಮೊದಲಾದ ಜೀವ ಸಂಕುಲದ ಸಕಲೆಂಟು ಘಟಕಗಳಿಗೂ ಗೌರವದಿಂದ ನಮಿಸುವ ವಿಶಿಷ್ಟ ಆಚರಣೆ ರಾಶಿ ಪೂಜೆ."
246,ಬುಧವಾರದ ರಾಶಿ ಭವಿಷ್ಯ .
247,ರಾಶಿ ರಾಶಿ (ಗುಣಮಟ್ಟವಿಲ್ಲದ) ವಸ್ತು ತಯಾರಿಸಿ ಡಂಪ್ ಮಾಡುವುದೆ?
248,ರಾಶಿಗೆ ಅನುಗುಣವಾಗಿ ಈ ರಾಶಿಗಳ ಜನರು ತಮ್ಮ ಸ್ನೇಹಿತರಿಗೆ ಒಳ್ಳೆಯ ಸ್ನೇಹಿತರಾಗಿರುತ್ತಾರಾ ಅಥವಾ ಬೆನ್ನ ಹಿಂದೆ ಚೂರಿ ಹಾಕ್ತಾರಾ ತಿಳಿಯಿರಿಪ್ರತಿಯೊಂದು ರಾಶಿ ಚಿಹ್ನೆಯು ತನ್ನದೇ ಆದ ಗಮನಾರ್ಹ ಲಕ್ಷಣಗಳನ್ನು ಹೊಂದಿದೆ.
249,ಕುಂಭ ರಾಶಿ
250,ಜಕ್ಕೂರು-ಅಮೃತಹಳ್ಳಿ ಮುಖ್ಯರಸ್ತೆಯ ಸೆಂಚುರಿ ಅಪಾರ್ಟ್‌ಮೆಂಟ್ ಸಮುಚ್ಚಯದ ಮುಂಭಾಗದ ರಸ್ತೆ ಬದಿಯಲ್ಲಿ ಬಹಳ ದಿನಗಳಿಂದ ಕಸದ ರಾಶಿ ಹರಡಿರುವುದರಿಂದ ಪ್ರತಿನಿತ್ಯ ತೊಂದರೆ ಆಗುತ್ತಿದೆ.
251,"ಸೆಪ್ಟೆಂಬರ್ 15 ನೇ ತಾರೀಖು ಶುಕ್ರನು ರಾಶಿ ಬದಲಾವಣೆ ಮಾಡುವುದರಿಂದ ಈ 6 ರಾಶಿಗಳಿಗೆ ಲಾಭವಾಗುವುದು,ಅದೃಷ್ಟದ ಬಾಗಿಲು ತೆರೆಯುವುದು."
252,ತನ್ನ ಮೇಲೆ ಹಿಮ ರಾಶಿ ಬಿದ್ದರೂ ಕೂಡ ಈ ಮರ ತನ್ನ ನೋಟವನ್ನು ಮಂದಗೊಳಿಸುವುದಿಲ್ಲ.
253,ಇಂದಿನ ರಾಶಿ ಭವಿಷ್ಯದ ಮಾಹಿತಿ.
254,ವೃಷಭ ರಾಶಿ : ರಾಹು-ಕೇತುಗಳ ಸ್ಥಾನಪಲ್ಲಟದಿಂದ ವೃಷಭ ರಾಶಿಯವರಿಗೆ ಭಾರೀ ಲಾಭವಿದೆಯಂತೆ.
255,ಶುಕ್ರವಾರದ ಸಂಪೂರ್ಣ ರಾಶಿ ಭವಿಷ್ಯ : ಈ ದಿನದ ರಾಶಿ ಫಲ ಇಲ್ಲಿದೆ ನೋಡಿ.
256,ಮಕರ ರಾಶಿ ಕನ್ಯಾ ಅಥವಾ ಮಿಥುನ ಲಗ್ನದಲ್ಲಿ ಹುಟ್ಟಿದ್ದರೆ ಸಾಲ ಅಥವಾ ಹಣದ ಸಮಸ್ಯೆಯನ್ನು ಬೇಗ ನಿವಾರಣೆ ಮಾಡಿಕೊಳ್ಳುತ್ತಾರೆ.
257,"ಮೇಷ ರಾಶಿ : ನಿಮ್ಮ ರಾಶಿಯ ಅಧಿಪತಿಯಾದ ಕುಜ ಕರ್ಮಸ್ಥಾನದಲ್ಲಿ ಅಂದ್ರೆ ಉದ್ಯೋಗ ಸ್ಥಾನದಲ್ಲಿ ಉಚ್ಛನಾಗಿರುವುದರಿಂದ ಉದ್ಯೋಗದಲ್ಲಿ ಬಡ್ತಿ, ಸಮಾಧಾನ ಸಿಗಲಿದೆ."
258,"ನಸ್ಟರ್ಷಿಯಮ್ ಹೂವು ಅಂತಹ ಸಂದರ್ಭಗಳಲ್ಲಿ ನಿರಾಕರಿಸಬೇಕು ರಲ್ಲಿ: ಕಳಪೆ ಭೂಮಿ ಪ್ರತಿಕೂಲ ಹೂಬಿಡುವ ಮತ್ತು ಅಲಂಕಾರಿಕ ಪರಿಣಾಮ, ಸಾವಯವ ಮಣ್ಣಿನ ಹಸಿರು ರಾಶಿ ಸಕ್ರಿಯ ಬೆಳವಣಿಗೆಯ ಹೆಚ್ಚಾಗುವುದರಿಂದ ಕಾರಣವಾಗುತ್ತದೆ."
259,ಇಂದಿನ ರಾಶಿ ಭವಿಷ್ಯ : ಶನಿವಾರದ ಸಂಪೂರ್ಣ ರಾಶಿ ಫಲ ಇಲ್ಲಿದೆ ನೋಡಿ.
260,"ದೊಡ್ಡ ತರಗೆಲೆಗಳು, ಕುಟುಂಬದಲ್ಲಿ ತೊಂದರೆಗಳು ಮತ್ತು ಭಿನ್ನಾಭಿಪ್ರಾಯಗಳನ್ನು - ರಾಶಿ ಡ್ರೀಮ್ ಎ ಪಿ Vasileva ಮುಂದೆ ಡ್ರೀಮರ್ ಹೆಚ್ಚಿನ ಸಮಗ್ರ ಮತ್ತು ನಿಖರ ಉತ್ತರವನ್ನು ಈ ನೀಡುತ್ತದೆ."
261,ವೃಷಭ ರಾಶಿ ಮನಸ್ಸು ಚಿಂತೆಯ ಗೂಡಾಗಲಿದೆ.
262,ಕಚೇರಿಯಲ್ಲಿ ದಿನ ಕಳೆದು ವಾಪಾಸಾಗುವ ಮಹಿಳೆಗೆ ಬಿರುವಿನಲ್ಲಿಯ ರಾಶಿ ರಾಶಿ ಸೀರೆಗಳು ಅವಳನ್ನು ಪುಳಕಗೊಳಿಸುವುದಿಲ್ಲ.
263,ಮರ್ಕ್ಯುರಿ ಧನು ರಾಶಿ ಚಿಂತಕರು ಭವಿಷ್ಯದಲ್ಲಿ ತಮ್ಮ ಕಣ್ಣುಗಳೊಂದಿಗೆ ಬೆಂಕಿಕಡ್ಡಿಗಳಾಗಿವೆ.
264,ರಾಶಿ ಬಿದ್ದಿವೆ.
265,"ಬೆಂಗಳೂರು: ಹಿಂದೆ ವಿಜಯನಗರದ ರಾಜಬೀದಿಗಳಲ್ಲಿ ಮುತ್ತು, ರತ್ನ, ವಜ್ರ, ವೈಢೂರ್ಯಗಳನ್ನು ರಾಶಿ ಹಾಕಿ ಮಾರುತ್ತಿದ್ದರಂತೆ."
266,ಇಂದಿನ ರಾಶಿ ಭವಿಷ್ಯ .
267,ಧರ್ಮಸ್ಥಳದ ಶಕ್ತಿಶಾಲಿ ಮಂಜುನಾಥ ಸ್ವಾಮಿಗೆ ನಮಿಸುತ್ತಾ ನಿಮ್ಮ ರಾಶಿ ಭವಿಷ್ಯ
268,ಧನು ರಾಶಿ : – ನಿಮ್ಮ ಬಾಯಿ ದೊಡ್ಡದು.
269,ಗೆಡ್ಡೆಗಳನ್ನು ಗಿಡದಿಂದ ಬೇರ್ಪಡಿಸುವ ಸಂದರ್ಭ ಗೆಡ್ಡೆಗಳಲ್ಲಿರುವ ಮೊಳಕೆ ಕಣ್ಣುಗಳನ್ನು ಒಂದೆಡೆ ರಾಶಿ ಹಾಕಿಟ್ಟುಕೊಂಡಿದ್ದೇ ಆದರೆ ಮುಂದಿನ ವರ್ಷಕ್ಕೆ ಅವುಗಳಿಂದ ಸಸಿ ತಯಾರಿಸಲು ಅನುಕೂಲವಾಗುವುದು.
270,ಕಸ ರಾಶಿ ಹಾಕುವ ಕಡೆಗಳಲ್ಲಿ ಸಿ.
271,"ಎತ್ತರದ ಪ್ರದೇಶದಲ್ಲಿ ಸುರಿಯಲ್ಪಡುವ ಕಸದ ರಾಶಿ ತಗ್ಗು ಪ್ರದೇಶವನ್ನು ವ್ಯಾಪಿಸುತ್ತಿದ್ದು, ಸುತ್ತಮುತ್ತಲ ಬಡಾವಣೆಗಳ ನಿವಾಸಿಗಳು ದುರ್ವಾಸನೆ ಮತ್ತು ನೊಣಗಳ ಹಾವಳಿಯಿಂದ ಕಂಗೆಟ್ಟು ಹೋಗಿದ್ದಾರೆ."
272,"ಸಹಜವಾಗಿ ಹಣ್ಣಾಗುವ ಮೊದಲೇ ಮಾರುಕಟ್ಟೆಗೆ ರೈತರು ಸಾಗಿಸುವ ಫಲವನ್ನು, ಕ್ಯಾಲ್ಸಿಯಂ ಕಾರ್ಬೈಡ್‌ ಪೊಟ್ಟಣವನ್ನು ಹಣ್ಣಿನ ರಾಶಿ ಮಧ್ಯೆ ಇಟ್ಟು ಮಾಗಿಸಲಾಗುವುದು."
273,ಸೋಮವಾರದ ಸಂಪೂರ್ಣ ದಿನ ಭವಿಷ್ಯ ಮತ್ತು ರಾಶಿ ಫಲದ ಮಾಹಿತಿ ಇಲ್ಲಿದೆ ನೋಡಿ.
274,ಆದರೆ ರಾಶಿಗಳಲ್ಲಿ ಕೆಲವು ರಾಶಿಯವರಿಗೆ 2019ನೇ ವರ್ಷವು ಅತಿಯಾಗಿ ಸಂತೋಷದ ವರ್ಷವಾಗಲಿದೆ ಎಂದು ಅವರ ರಾಶಿ ಫಲವು ಹೇಳುತ್ತಿದೆ.
275,ಇತ್ತೀಚೆಗೆ ವಿದ್ಯಾಧರ ಚೆನ್ನಾಗಿ ಮಾಡ್ತಾನೆ ಅಂತ ರಾಶಿ ಜನ ಹೇಳ್ತಾರೆ.
276,ಕನ್ಯಾ ರಾಶಿ : ಯಾವುದೇ ಕೆಲಸವನ್ನು ನಿಧಾನವಾಗಿ ಪರಿಶೀಲಿಸಿ ಮಾಡಿ.
277,ಇಲ್ಲಿನ ರಸ್ತೆಯಲ್ಲೇ ಜಲ್ಲಿ ಹಾಗೂ ಮರಳನ್ನು ರಾಶಿ ಹಾಕಿದ ಪರಿಣಾಮ ಕಳೆದ ಕೆಲ ದಿನಗಳಿಂದ ಹಲವು ವಾಹನ ಸವಾರರು ಸ್ಕಿಡ್ ಆಗಿ ರಸ್ತೆಗೆ ಬಿದ್ದು ಗಾಯಗೊಂಡಿದ್ದರು.
278,ಧನು ರಾಶಿ ವ್ಯಕ್ತಿ ನೀವು ನಿಜವಾಗಿಯೂ ಅವರು ಸಲುವಾಗಿ ಆಯಾಸಗೊಂಡಿದ್ದು ಎಂದು ಒಂಟಿತನ ತಿಳಿದುಕೊಳ್ಳಲು ಆರಂಭಿಸಿದ ಮಾತ್ರ ಮದುವೆಯಾಗುತ್ತೇನೆಂದು.
279,ಇದನ್ನೂ ಓದಿ: ಕಟಕ ರಾಶಿ - ವೃಶ್ಚಿಕ ರಾಶಿಯವರ ನಡುವೆ ಹೊಂದಾಣಿಕೆ ಹೇಗಿರುತ್ತದೆ ಗೊತ್ತಾ?
280,ಲಂಕಾ ವಿರುದ್ಧ ಮತ್ತೊಮ್ಮೆ ಟೀಂ ಇಂಡಿಯಾ ರನ್ ರಾಶಿ
281,ಕಸದ ರಾಶಿ ಕೆರೆಯಲ್ಲಿ ಕೊಳೆತು ಮತ್ತಷ್ಟು ದುರ್ವಾಸನೆ ಹೊರಬರುತ್ತಿದೆ.
282,ಇಂದಿನ ರಾಶಿ ಭವಿಷ್ಯ ಹೀಗಿದೆ
283,ಇತ್ತೀಚೆಗೆ ರಾಶಿಗಟ್ಟಲೆ ಕಸದ ರಾಶಿ ಕೂಡಾ ಸೇರಿದೆ.
284,ಮುಖಬೆಲೆ ನೋಟುಗಳು ಸೇರಿದಂತೆ 4 ಕೋಟಿ 52 ಲಕ್ಷ ನಗದು ರಾಶಿ ಪತ್ತೆಯಾಗಿದೆ.
285,ಬುಧವಾರದ ರಾಶಿ ಭವಿಷ್ಯ : ಇಂದಿನ ಸಂಪೂರ್ಣ ರಾಶಿ ಭವಿಷ್ಯ ಇಲ್ಲಿದೆ ನೋಡಿ.
286,"ಈ ಚಿತ್ರವನ್ನು ಸಿದ್ದಾರ್ಥ ನಿರ್ದೇಶಿಸಿದ್ದರೆ,ರಾಮ್ ಗೋಪಾಲ್ ವರ್ಮಾ ಮತ್ತು ಭಾಸ್ಕರ್ ರಾಶಿ ನಿರ್ಮಿಸಿದ್ದಾರೆ."
287,ಸೊಂಪಾಗಿ ದಪ್ಪಗಿದ್ದ ಕೂದಲು ಒಮ್ಮೆಗೆ ರಾಶಿ ರಾಶಿಯಾಗಿ ಉದುರಲು ತೊಡಗಿದಾಗ ಯಾರಿಗಾದರೂ ಚಿಂತೆಯಾಗುವುದು ಸಹಜವೇ ತಾನೇ?
288,ವ್ಯಕ್ತಿಯ ಜನ್ಮದ ಸಮಯದಲ್ಲಿ ಚಂದ್ರನ ಚಿಹ್ನೆಯು ಮೊದಲು ಶನಿಯ ರಾಶಿ ಚಕ್ರದ ಚಿಹ್ನೆಯನ್ನು ಪ್ರವೇಶಿಸಿದಾಗ ಸಾಡೇ ಸಾತ್ ಅವಧಿ ಪ್ರಾರಂಭವಾಗುವುದು.
289,ಶನಿ ದೇವರಿಗೆ ಸ್ಮರಿಸುತ್ತಾ ಈ ದಿನದ ನಿಮ್ಮ ರಾಶಿ ಭವಿಷ್ಯ ಮತ್ತು ಸಮಸ್ಯೆಗಳಿಗೆ ಪರಿಹಾರ
290,ಕಟಕ ರಾಶಿ ಚಂದ್ರನ ಸ್ವಂತ ಮನೆಯಾದ್ದರಿಂದ ಹತ್ತನೇ ಮನೆಗೆ ಚಂದ್ರನ ಬಲವಾದ ದೃಷ್ಟಿಯೇ ಇರುತ್ತದೆ.
291,"ರಾಶಿ ಹಾಡಿವೆ , ರಾಶಿ ಪುಸ್ತಕ ಇವೆ ."
292,"ತುಲಾ ಮತ್ತು ವೃಷಭ ರಾಶಿ,ಕುಂಭ ಮತ್ತು ಕಟಕ ರಾಶಿ,ಮೀನ ಮತ್ತು ಸಿಂಹ ರಾಶಿ,ಮಿಥುನ ಮತ್ತು ಮಕರ ರಾಶಿ,ಕನ್ಯಾ ಮತ್ತು ಮಿಥುನ ರಾಶಿ,ಸಿಂಹ ಮತ್ತು ಕುಂಭ ರಾಶಿ"
293,ಹಿಂದೆ ಮಳೆಗಾಲ ಪ್ರಾರಂಭಕ್ಕೂ ಮೊದಲು ಗದ್ದೆಗೆ ಗೊಬ್ಬರದ ರಾಶಿ ಹಾಕುವುದು.
294,ಸಿಂಹ ರಾಶಿ : ಜುಲೈ ೨೩ ರಿಂದ ಆಗಸ್ಟ್ ೨೩
295,ಶುಕ್ರವಾರದ ರಾಶಿಭವಿಷ್ಯ : ಇಂದಿನ ರಾಶಿ ಭವಿಷ್ಯ ಇಲ್ಲಿದೆ ನೋಡಿ.
296,"ಬೋಗುಣಿ ದಢಾರನೆ ಕೆಳಗೆ ಬಿದ್ದು, ಸೆಗಣಿ ಬಳಿದಿದ್ದ ಕರಿಯ ನೆಲದ ಮೇಲೆ ತಾಮ್ರವರ್ಣದ ಕೇಸಕ್ಕಿಯನ್ನದ ರಾಶಿ ಕೆದರಿಬಿದ್ದಿತು."
297,ಧನು ರಾಶಿ ಮತ್ತು ಮಕರ ಸಂಕ್ರಾಂತಿ ಲವ್ ಹೊಂದಾಣಿಕೆ
298,ಗಂಡ-ಹೆಂಡತಿ ಮಧ್ಯೆ ಸಾಮರಸ್ಯಕ್ಕೆ ಇಬ್ಬರ ನಕ್ಷತ್ರ- ರಾಶಿ ಕೂಡ ಕಾರಣವಾಗುತ್ತದೆ ಎಂಬುದರಲ್ಲಿ ಅನುಮಾನವಿಲ್ಲ.
299,ಗುರುವಾರದ ರಾಶಿ ಭವಿಷ್ಯ : ಈ ದಿನದ ಸಂಪೂರ್ಣ ರಾಶಿ ಭವಿಷ್ಯ ಇಲ್ಲಿದೆ ನೋಡಿ.
300,ಸೋಮವಾರದ ರಾಶಿ ಭವಿಷ್ಯ : ಇಂದಿನ ರಾಶಿ ಭವಿಷ್ಯ ಇಲ್ಲಿದೆ ನೋಡಿ.
301,ಇಂದಿನ ರಾಶಿ ಭವಿಷ್ಯ : ಗುರುವಾರದ ಸಂಪೂರ್ಣ ರಾಶಿ ಭವಿಷ್ಯ ಇಲ್ಲಿದೆ ನೋಡಿ.
302,ಅವರು ಅದಕ್ಕೆ ಹೇಳಿದರು ಮೊದಲನೆಯದಾಗಿ ಈ ಹೊಸ ರಾಶಿ effect ಮುಂದೆ ಹುಟ್ಟುವವರಿಗೆ ನಿಮಗಲ್ಲ.
303,ದಾವಣಗೆರೆಯ ಬಾರ್ ಬಳಿ ಪತ್ತೆಯಾದ್ವು ರಾಶಿ ರಾಶಿ ಆಧಾರ್ ಕಾರ್ಡ್!
304,"ಅಂತಹ ಅದ್ಭುತ ರಜೆ ಬಿಲಿಯರ್ಡ್ಸ್, ಬೌಲಿಂಗ್, ಕ್ಯಾರಿಯೋಕೆ, ಸಿಗಾರ್ ಕೊಠಡಿ ಮತ್ತು ಹತ್ತಿರದ ಒಂದು ಮೀನುಗಾರಿಕೆ ಕೊಳ, ಋತುವಿನ ಅನುಮತಿ ರಾಶಿ ನಂತರ."
305,ಮೊದಲನೆಯದು ಮೀನಾ ರಾಶಿ ಹೌದು ಈ ರಾಶಿಯವರಿಗೆ ಮಧ್ಯ ರಾತ್ರಿಯಿಂದ ಸಕಲ ವೃಧ್ಧಿಗಳು ನಿಮಗೆ ಒಲಿಯಲಿದ್ದು ಮಾಡುವ ಕೆಲಸ ಕಾರ್ಯದಲ್ಲಿ ಒಳ್ಳೆಯ ಲಾಭ ನಿಮ್ಮದಾಗಲಿವೆ ಮತ್ತು ನಾಳೆ ಬೆಳಗ್ಗೆ ಹಸುವಿಗೆ ಏನಾದರೂ ತಿನಿಸುಗಳನ್ನು ಕೊಟ್ಟು ಆಶೀರ್ವಾದ ಪಡೆದುಕೊಳ್ಳಿ ಹೌದು ಲಕ್ಷ್ಮಿ ದೇವಿಯ ಕೃಪೆ ಸದಾ ನಿಮ್ಮ ಮೇಲೆ ಇರುವುದರಿಂದ ಜೀವನದಲ್ಲಿ ಇರುವ ನೋವುಗಳು ದೂರ ಆಗಲಿದ್ದು ನೆಮ್ಮದಿಯ ಜೀವನ ನಿಮ್ಮದಾಗಲಿವೆ.
306,ಕಸದ ರಾಶಿ ಸ್ವಚ್ಛಗೊಳಿಸದೇ ಇರುವುದರಿಂದ ಗಾಳಿಗೆ ರಸ್ತೆಯಲೆಲ್ಲಾ ಚೆಲ್ಲಾಡುತ್ತಿದೆ ಹಾಗೂ ಮನೆಯೊಳಗೆ ಬರುತ್ತಿದೆ ಎನ್ನುತ್ತಿದ್ದಾರೆ.
307,ಸರ್ವಙ್ಞ ಪದಗಳ ಙ್ಞಾನದ ರಾಶಿ
308,"ಆದರೂ ಹಳತನ್ನು ಪ್ರತ್ಯಕ್ಷ ಕಣ್ಣಾರೆ ಕಂಡಿರದ ಹೊಸ ಪೀಳಿಗೆಗೆ ಆ ಪುರಾತನ ವೈಭವದ ತುಣುಕು ಪರಿಚಯವಾಗುವುದು ಅಲ್ಲಿನವರ ಹಾಗೆಯೆ ದೋಣಿಯೊಂದರಲ್ಲಿ ಕುಳಿತು ಆ ವಿಶಾಲ ನದಿಯಲ್ಲಿ ತೇಲುತ್ತಲೆ ಹೋಲಿಕೆಯಲ್ಲಿ ಇಕಾಟ್ಟಾದ ಸುಮಾರು ಐವತ್ತರಿಂದ ನೂರಡಿಯಷ್ಟು ಅಗಲದ ಕಾಲುವೆಗಳಲ್ಲಿ ಚಲಿಸುತ್ತ ಎರಡು ಬದಿಯಲ್ಲಿರುವ ಮನೆಗಳನ್ನು, ಸಂಸಾರಗಳನ್ನು, ಆ ವಾತಾವರಣದಲ್ಲೆ ಬೆಳೆದು ನಳನಳಿಸುವ ಸಸ್ಯ ರಾಶಿ - ಜೀವರಾಶಿಗಳನ್ನು ಗಮನಿಸುತ್ತ ನಡೆದಾಗಲಷ್ಟೆ."
309,ಇಂದಿನ ರಾಶಿ ಭವಿಷ್ಯ : ಗುರುವಾರದ ರಾಶಿ ಭವಿಷ್ಯ ಇಲ್ಲಿದೆ ನೋಡಿ.
310,ರಸ್ತೆ ಬದಿಯಲ್ಲಿರುವ ನನ್ನ ಬುಡದಲ್ಲಿ ಕಸ ರಾಶಿ ಹಾಕುತ್ತಾರೆ.
311,ಕಸದ ರಾಶಿ ತಿಂಗಳುಗಟ್ಟಲೆ ಬಿದ್ದಿರುತ್ತದೆ.
312,"ಬನಹಟ್ಟಿ ಸಹಕಾರಿ ನೂಲಿನ ಗಿರಣಿಯ ಎದುರಿಗೆ ಜಮಖಂಡಿಗೆ ಹೋಗುವ ಪ್ರಯಾಣಿಕರು, ಶಿಕ್ಷಕರು, ವಿದ್ಯಾರ್ಥಿಗಳು ಬಸ್‌ಗಾಗಿ ಕಾಯುತ್ತಿರುವ ಸಂದರ್ಭದಲ್ಲಿ ಜೋರಾಗಿ ಗಾಳಿ ಬೀಸಿದರೆ ಕಸದ ರಾಶಿ ಜನರ ಮೇಲೆಯೇ ಬರುತ್ತದೆ."
313,ಬೇಕಾದ ಸಾಮಾನುಗಳನ್ನೆಲ್ಲ ಹತ್ತಿರ ರಾಶಿ ಹಾಕಿಕೊಂಡು ಅಡಿಗಲ್ಲಿಗೆ ಎದುರಾಗಿ ಕುಳಿತನು.
314,ನೆಲಮಟ್ಟಕ್ಕಿಂತ ಕೆಳಗೆ ಜೈವಿಕ ಕ್ರಿಯೆ ಚೆನ್ನಾಗಿ ನಡೆಯುವುದಿಲ್ಲ ಎಂದು ಅರಿತ ಮೇಲೆ ಸಾಕಷ್ಟು ರೈತರು ನೆಲದ ಮೇಲೆ ರಾಶಿ ಮಾಡಿ ಕಾಂಪೋಸ್ಟ್ ತಯಾರಿಸುತ್ತಿದ್ದಾರೆ.
315,"ಸಿಂಹ ರಾಶಿ : ಇದು ನಿಮ್ಮ ವ್ಯಾಪಾರಕ್ಕೆ ಹೂಬಿಡುವ ಶುಷ್ಕ ಋತು, ಆದ್ದರಿಂದ ನೀವು ಈಗ ನಿಮ್ಮ ವ್ಯಕ್ತಿತ್ವವನ್ನು ಹೊರದಬ್ಬಲು ಪ್ರಯತ್ನಿಸಬಹುದು."
316,"ಧನು ರಾಶಿ ಹುಡುಗರ ಹೆಸರುಗಳು, ಫ್ಯಾಶನ್ ಮಾರ್ಪಟ್ಟಿವೆ ಮತ್ತು ಜೀವನದಲ್ಲಿ ಏನೋ ಸಾಧಿಸಲು ಅವಕಾಶ ಒದಗಿಸುತ್ತದೆ ಒಂದು ನಿರ್ದಿಷ್ಟ ಪೀಳಿಗೆಯ ವಿಸ್ತಾರವಾಗಿ ಬಳಕೆಯಲ್ಲಿದೆ ದ್ರವ್ಯರಾಶಿಗಳ ಬೆಂಬಲ ಮಾತ್ರ."
317,ಭಾವನಾತ್ಮಕ ಗುಣವನ್ನು ಹೊಂದಿರುವ ಐದು ರಾಶಿ ಚಕ್ರದವರು.
