Index,Sentence
0,"ಜೊತೆಗೆ ರಕ್ತೇಶ್ವರಿ, ಪಂಜುರ್ಲಿ, ಗುಳಿಗ, ಕಲ್ಲುರ್ಟಿ, ಬಾವನ ದೈವಗಳು ಇಲ್ಲಿ ನೆಲೆ ನಿಂತಿವೆ."
1,"ಕಳೆದ ವಿಧಾನಸಭೆ ಚುನಾವಣೆಯಲ್ಲಿ, ಬಿಜೆಪಿಗೆ ನೆಲೆ ಇಲ್ಲದಂತೆ ಮಾಡುತ್ತೇನೆ ಎಂದಿದ್ದ ಸಿದ್ಧರಾಮಯ್ಯರಿಗೆ ಈಗ ನೆಲೆ ಇಲ್ಲದಂತಾಗಿದೆ."
2,ನೂತನ ಕಟ್ಟಡ ನಿರ್ಮಿಸಿ ಐದು ವರ್ಷಗಳಾದರೂ ಹಳೆಯ ಕಟ್ಟಡ ಅಲ್ಲೇ ನೆಲೆ ನಿಂತಿದೆ.
3,"ಮಂಡ್ಯ, ಹಾಸನ, ತುಮಕೂರಿನಲ್ಲಿ ಕಾಂಗ್ರೆಸ್ ನೆಲೆ ಕಳೆದುಕೊಳ್ಳುವ ಭಯ ಇದೆ."
4,ದಿನಕಳೆದಂತೆ ಅಜ್ಜಿಯ ಪವಾಡದಿಂದ ಆಕೆ ಬರೀ ಅಜ್ಜಿಯಲ್ಲ ಅಜ್ಜಿಯ ರೂಪದಲ್ಲಿ ಬಂದ ಗ್ರಾಮದೇವತೆ ಭದ್ರಕಾಳಿ ಎಂಬುದು ತಿಳಿದು ಆಕೆ ದೇವಾಲಯ ಕಟ್ಟಿಸುವ ಮೂಲಕ ಶಾಶ್ವತ ನೆಲೆ ನೆಲೆನೀಡಲಾಯಿತೆಂಬ ಮಾತುಗಳು ಜನವಲಯದಲ್ಲಿದೆ.
5,"ಜಮ್ಮು-ಕಾಶ್ಮೀರದ ಕಥಾವಾ ಜಿಲ್ಲೆಯ ಹಿರಂಗ್ನಗರ್ ಪೊಲೀಸ್ ಠಾಣೆ ಬಳಿ ಈ ಘಟನೆ ಸಂಭವಿಸಿದ್ದು, ಸೇನಾ ನೆಲೆ ಇರುವ ಸಾಂಬಾ ಪ್ರದೇಶವನ್ನು ಗುರಿಯಾಗಿಟ್ಟುಕೊಂಡು ಉಗ್ರರು ದಾಳಿ ನಡೆಸಿದ್ದಾರೆಂದು ತಿಳಿದುಬಂದಿದೆ."
6,ಜರ್ಮನಿಯ ಮಿತ್ರ ರಾಷ್ಟ್ರ ಜಪಾನ್ ಹವಾಯ್‌ ಪರ್ಲ್ ಹಾರ್ಬರ್ ನೌಕಾ ನೆಲೆ ಮೇಲೆ ದಾಳಿ ಮಾಡಿ 2000 ಅಮೆರಿಕರನ್ನು ಕೊಂದು ಹಾಕಿ 20 ನೌಕೆಗಳನ್ನು ಮತ್ತು 300 ವಾಯುಪಡೆ ವಿಮಾನಗಳನ್ನು ನಾಶ ಮಾಡಿದಾಗ ಅಮೆರಿಕ ಕೂಡ ಯುದ್ಧದಲ್ಲಿ ಸೇರ್ಪಡೆಯಾಗುವ ನಿರ್ಧಾರ ಕೈಗೊಂಡಿತು.
7,ಇದು ದೇಶಾದ್ಯಂತ ಸಾಮೂಹಿಕ ನೆಲೆ ಹೊಂದಿರುವ ಒಂದು ಬಲಿಷ್ಟ ಅಖಿಲ ಭಾರತ ಕಮ್ಯುನಿಸ್ಟ್ ಪಕ್ಷವನ್ನು ಕಟ್ಟಲು ಒಂದು ಸ್ಪಷ್ಟ ದಿಕ್ಕನ್ನು ತೋರಿಸುತ್ತದೆ.
8,"ಅಷ್ಟು ದಿನಗಳವರೆಗೆ ಮಹಿಳೆಯರು ಹಾಗೂ ಹಿರಿಯ ನಾಗರೀಕರಿಗಾಗಿ ಮಾತ್ರ ಕಾರ್ಯಕ್ರಮಗಳನ್ನು ರೂಪಿಸುತ್ತಿದ್ದ ವಿರೂಪಾಕ್ಷಸ್ವಾಮಿ, ಸಂಸ್ಥೆಯಲ್ಲಿ ಬುದ್ಧಿ ಮಾಂದ್ಯ ಮಕ್ಕಳಿಗೂ ನೆಲೆ ಕಲ್ಪಿಸಲು ಆಲೋಚಿಸಿದರು."
9,ದುಡಿದು ಜೀವನದಲ್ಲಿ ನೆಲೆ ಕಂಡುಕೊಳ್ಳಬೇಕು ಎಂಬುದೇ ನನಗೆ ಮುಖ್ಯ ಆಗಿತ್ತು.
10,"ಸ್ವಾತಂತ್ರ್ಯಾ ನಂತರ ದೇಶದಲ್ಲಿ ಸಮಾನತೆ ನೆಲೆ ಗೊಂಡು, ಪ್ರತಿಯೊಬ್ಬರೂ ವಿದ್ಯಾವಂತರಾಗಿ, ಸ್ವಾವಲಂಬನೆ ಸಾಧಿಸುವುದರೊಂದಿಗೆ ನಮ್ಮ ದೇಶ ಆರ್ಥಿಕವಾಗಿ ಅಭಿವೃದ್ಧಿ ಹೊಂದಬೇಕು ಎಂಬ ಕನಸು ಕಂಡಿದ್ದರು."
11,ಸರ್ಕಾರದ ಪರವಾನಗಿ ಪಡೆದ ತಂಗುದಾಣಗಳಲ್ಲಿ ಅವರಿಗೆ ತಾತ್ಕಾಲಿಕ ನೆಲೆ ಕಲ್ಪಿಸಲಾಗಿದೆ.
12,ಚಿತ್ರರಂಗದಲ್ಲಿ ತನಗೊಂದು ನೆಲೆ ಕಂಡುಕೊಳ್ಳಲಾಗದೆ ಮಗ ಗುರುರಾಜ್ ಮಾನಸಿಕವಾಗಿ ನೊಂದಿದ್ದ.
13,Rotgips - ಇದು ಗೋಡೆಗಳ ಮತ್ತು ಬೇರೆ ನೆಲೆ ಸೀಲಿಂಗ್ ಬಳಸಲಾಗುತ್ತದೆ ಸಾರ್ವತ್ರಿಕ ಪ್ಲಾಸ್ಟರ್.
14,ಬೇರೆಡೆಯಿಂದ ಪಂಚಾಯಿತಿಗೆ ಬಂದ ಅಧಿಕಾರಿಗಳು ಇಲ್ಲಿ ನೆಲೆ ನಿಂತು ಕೆಲಸ ಮಾಡುತ್ತಿಲ್ಲ.
15,ಅಲ್ಲಿ ಅದರ ರಾಜಕೀಯ ನೆಲೆ ಹೇಳಿಕೊಳ್ಳುವ ಮಟ್ಟಿಗೆ ಕಾಣುತ್ತಿದ್ದುದು ಪುಟ್ಟ ಸಿಂಧ್​ನಲ್ಲಿ ಮಾತ್ರ.
16,ಒಳಗೆ ಶಾಶ್ವತ ನೆಲೆ ಸ್ಥಾಪಿಸಲು ಜೆಎಂಬಿ ಯೋಜನೆ ಹೊಂದಿರುವುದು ಇತ್ತೀಚಿನ ತನಿಖೆಗಳಿಂದ ಗೊತ್ತಾಗಿದೆ.
17,ಈಗ ಸರಕಾರ ಬದಲಾಗಿದ್ದರಿಂದ ಜನಪ್ರತಿನಿಧಿಗಳು ಬದಲಾಗಿದ್ದರಿಂದ ಕೊಪ್ಪಳದಲ್ಲಿಯೇ ನೆಲೆ ನಿಂತಿದ್ದ ಅಧಿಕಾರಿಗಳಿಗೆ ಈಗ ಇಲ್ಲಿರಲು ಆಗುತ್ತಿಲ್ಲ.
18,ಜೆಎನ್​ಯುುದಲ್ಲಿ ನೆಲೆ ಕಳಕೊಂಡ ನಿರಾಶ್ರಿತರಲ್ಲವೆ?
19,ಹಳ್ಳಿಗಳಲ್ಲಿ ರೈತರನ್ನು ತಂದು ನೆಲೆ ನಿಲ್ಲಿಸಿದ್ದಕ್ಕಾಗಿ ಅವರಿಗೆ ಗ್ರಾಮಾಡಳಿತದಲ್ಲಿ ಕೆಲವು ವಿಶೇಷ ಹಕ್ಕುಗಳನ್ನು ನೀಡಲಾಯಿತು.
20,ಪ್ರಾಮಾಣಿಕ ಅಧಿಕಾರಿಗಳಿಗೆ ನೆಲೆ ಇಲ್ಲದಂತಹ ಪರಿಸ್ಥಿತಿ ಉದ್ಭವಿಸಿದೆ ಎಂದು ಆಪಾದಿಸಿದರು.
21,"ಎಚ್‌ಎಎಲ್ ಸಂಸ್ಥೆ ನೆಲೆ ನಿಂತಿರುವ ರಾಜ್ಯದಿಂದಲೇ ರಾಜ್ಯಸಭಾ ಸದಸ್ಯೆಯಾಗಿ ಆಯ್ಕೆಯಾಗಿರುವ ರಕ್ಷಣಾ ಸಚಿವರು, ತಮ್ಮ ರಾಜ್ಯದ ಸಂಸ್ಥೆಗೆ ಅತ್ಯಾಧುನಿಕ ಯುದ್ಧವಿಮಾನಗಳನ್ನು ನಿರ್ಮಿಸುವ ಕ್ಷಮತೆ ಇಲ್ಲ ಎಂದು ಹೇಳುತ್ತಾರೆ."
22,ಶ್ರೀಶೈಲ ಮಲ್ಲಿಕಾರ್ಜುನನ ಪರಮ ಭಕ್ತೆಯಾಗಿದ್ದ ಹೇಮರೆಡ್ಡಿ ಮಲ್ಲಮ್ಮ ತನ್ನ ಇಳಿ ವಯಸ್ಸಿನಲ್ಲಿ ಶ್ರೀಶೈಲಕ್ಕೆ ನಡೆದುಕೊಂಡು ಹೋಗಿ ದರ್ಶನ ಮಾಡಿ ಬರುವುದು ಕಷ್ಟವಾಗುತ್ತದೆ ಎಂಬ ಕಾರಣಕ್ಕೆ ಆಕೆಯ ಕನಸಿನಲ್ಲಿ ಕಾಣಿಸಿಕೊಂಡ ಮಲ್ಲಿಕಾರ್ಜುನ ಸ್ವಾಮಿ ತಾನೇ ಇಲ್ಲಿ ನೆಲೆ ನಿಲ್ಲುವುದಾಗಿ ಹೇಳುತ್ತಾನೆ.
23,"ಅದೆಂದರೆ, ಇವರೆಲ್ಲರೂ ತಮ್ಮ ಬದುಕನ್ನು, ಉದ್ಯಮವನ್ನು ನೆಲೆ ಕಾಣಿಸಿದ ಬಳಿಕವೇ ಸಾಮಾಜಿಕ ಕೆಲಸಗಳಲ್ಲಿ ತಮ್ಮನ್ನು ತಾವು ತೊಡಗಿಸಿಕೊಂಡಿದ್ದಾರೆ."
24,"ಸಭೆಯಲ್ಲಿ ಗುರುಗಳ ಮಾನವೀಯ ಆದರ್ಶಗಳಿಗೆ, ಪರಿಶುದ್ಧವಾದ ಆಧ್ಯಾತ್ಮಿಕತೆಗೆ ನೆಲೆ ಒದಗಿಸು ಒಂದು ಸಂಘಟನೆಯ ಅಗತ್ಯವಿದೆ ಎಂದು ತೀರ್ಮಾನಿಸಿದರು."
25,94ಸಿ ಹಾಗೂ 94 ಸಿಸಿಯಡಿಯಲ್ಲಿ ಅರ್ಜಿ ಸಲ್ಲಿಸಿ ಮನೆ ಕಟ್ಟಿಕೊಂಡ ಫಲಾನುಭವಿಗಳು ಇದೀಗ ನೆಲೆ ಕಳೆದು…
26,"ಬಿಜೆಪಿ ಈ ಪ್ರದೇಶದಲ್ಲಿ ನೆಲೆ ಕಂಡುಕೊಳ್ಳಲು ಪ್ರಯತ್ನಿಸುತ್ತಿದ್ದು, ಸಿಪಿಐ–ಎಂ ಜತೆ ದ್ವೇಷ ರಾಜಕೀಯ ಆರಂಭಿಸಿದೆ ಎಂದು ಹೇಳಲಾಗುತ್ತಿದೆ."
27,"ಎಂದು ಚಿಂತಿಸಲು ಮುಸಲ್ಮಾನರಿಗೆ ಇದು ಸಕಾಲ ಎಂದು ಒವೈಸಿ, ಕಾಂಗ್ರೆಸ್ ಈಗ ಮೊದಲಿನಂತಿಲ್ಲ ಅದು ನೆಲೆ ಕಳೆದುಕೊಳ್ಳುತ್ತಿದೆ ಎಂದು ಅವರು ಹೇಳಿದ್ದಾರೆ."
28,ಈಗ ಅದು ಒಡಿಶಾದಲ್ಲಿ ನೆಲೆ ಕಂಡುಕೊಳ್ಳಲು ಯತ್ನಿಸುತ್ತಿದೆ.
29,ಜಮ್ಮು ಮತ್ತು ಕಾಶ್ಮೀರದ ಬದ್‍ಗಾಂವ್‍ನಲ್ಲಿರುವ ಕಾವಲು ನೆಲೆ ಮೇಲೆ ಭಯೋತ್ಪಾದಕರು ನಡೆಸಿದ ದಾಳಿಯಲ್ಲಿ ತೀವ್ರಗಾಯಗೊಂಡಿದ್ದ ಪೊಲೀಸ್ ಸಿಬ್ಬಂದಿ ಆಸ್ಪತ್ರೆಯಲ್ಲಿ ಕೊನೆಯುಸಿರೆಳೆದರು.
30,ಕಾಂಗ್ರೆಸ್ ಪಕ್ಷ ತನ್ನ ನೆಲೆ ಕಂಡುಕೊಳ್ಳಲು ಪ್ರಯತ್ನ ನಡೆಸುತ್ತಲೇ ಇದೆ.
31,"ದಲಿತರು, ಅಲೆಮಾರಿಗಳು, ಶೋಷಿತರು, ಕಾರ್ಮಿಕರು ಇವತ್ತಿಗೂ ನೆಲೆ ಇಲ್ಲದೆ ಪರದಾಡುತ್ತಿದ್ದಾರೆ."
32,ಪುಲ್ವಾಮಾ ದಾಳಿಗೆ ಪ್ರತೀಕಾರವಾಗಿ ಭಾರತೀಯ ವಾಯುಸೇನೆ ಪಾಕಿಸ್ತಾನದ ಬಾಲಾಕೋಟದಲ್ಲಿರುವ ಉಗ್ರರ ನೆಲೆ ಮೇಲೆ ಬಾಂಬ್ ಸಿಡಿಸಿ ಉಗ್ರರನ್ನು ಹತ್ಯೆಗೈದಿದೆ.
33,ಉಡುಪಿ ಸನಿಹದ ಕನ್ನಾರಿನಲ್ಲಿ ನೆಲೆ ನಿಂತಿತು.
34,ಹಾಗಾದರೆ ಇನ್ನು ಮುಂದೆ ಇವರಿಗೆ ನೆಲೆ ಎಲ್ಲಿ?
35,ಕಾಡಿನಂಚಿನಲ್ಲಿ ವಾಸಿಸುತಿರುವ ಬುಡಕಟ್ಟು ಜನರನ್ನು ಸ್ಥಳಾಂತರಿಸಿ ಸೂಕ್ತ ಜಾಗ ಗುರುತಿಸಿ ನೆಲೆ ಕಲ್ಪಿಸಿಕೊಡಲು ಡಿಸಿ ಸೂಚನೆ
36,"ಕವನದ ಮೊದಲಲ್ಲಿ ಮನದ ಬಯಲಲ್ಲಿ ಜಿಂಕೆಯಂತೆ ಬಾಯಾರಿಕೆಯಿಂದ ಬವಣೆಗೊಂಡ ಕರ್ತೃವಿನ ಮನಸ್ಸು ಕವನದ ಕೊನೆಯಲ್ಲಿ ಒಂದು ದರ್ಶನದ, ನೆಲೆ ತಲುಪಿದೆ."
37,ಬಯಾನ ಬೀಚ್‌ನಲ್ಲಿನ ಸುಮಾರು 700 ಗುಡಿಸುಗಳಲ್ಲಿ ವಾಸವಾಗಿದ್ದ ಕನ್ನಡಿಗರು ನೆಲೆ ಕಳೆದುಕೊಂಡಿದ್ದಾರೆ.
38,"ಜಿಲ್ಲೆಯಲ್ಲಿ 25 ಪರಿಹಾರ ಕೇಂದ್ರಗಳನ್ನು ತೆರೆಯಲಾಗಿದ್ದು, 604 ಕುಟುಂಬಗಳ 2,136 ಮಂದಿಗೆ ನೆಲೆ ಕಲ್ಪಿಸಲಾಗಿದೆ."
39,"ಆದರೆ, ಜೇಟ್ಲಿ ಅವರ ನಿಧನದ ಬಳಿಕ ಡಿಡಿಸಿಎನಲ್ಲಿ ಶರ್ಮಾ ಅವರು ನೆಲೆ ಕಳೆದುಕೊಂಡಿದ್ದರು ಎಂದು ಕ್ರಿಕೆಟ್‌ ಮಂಡಳಿಯ ಸದಸ್ಯರು ಹೇಳುತ್ತಾರೆ."
40,ಆದ್ದರಿಂದ ಇಲ್ಲಿ ಮಾಡುವ ನೆಲೆ ಇಲ್ಲ; ಮಾಡಿಸಿಕೊಂಡರೆ ಮಾತ್ರ ಆಗುತ್ತದೆ ಎಂಬ ಭಾವ.
41,"ಐತಿಹಾಸಿಕ ತಾಣವಾಗಿ, ಭಾವೈಕ್ಯತೆಯ ನೆಲೆಯಾಗಿ, ತನ್ನನ್ನು ನಂಬಿದ ಭಕ್ತರ ಇಷ್ಟಾರ್ಥ ನೆರವೇರಿಸುತ್ತಿರುವ ಎಮ್ಮೆಮಾಡು ಭಾವೈಕ್ಯತೆಯ ಸಂಗಮವಾಗಿ ಕೊಡಗಿನ ಬೆಟ್ಟಗುಡ್ಡ, ಕಾಫಿ ತೋಟಗಳ ನಿಸರ್ಗ ರಮಣೀಯ, ಪ್ರಶಾಂತ ಸ್ಥಳದಲ್ಲಿ ನೆಲೆ ನಿಂತಿದೆ."
42,ನಂತ್ರ ಇಲ್ಲಿಯೇ ನೆಲೆ ನಿಂತಿದ್ದಾರೆ.
43,ಆದರೆ ಬುಧವಾರ ಇರಾನ್ ಅಮೆರಿಕಾ ಸೇನಾ ನೆಲೆ ಮೇಲೆ ದಾಳಿ ಬಳಿಕ ಕಚ್ಛಾ ತೈಲ ಬೆಲೆಯು 4.
44,ನಾವು ಹೃತ್ಪೂರ್ವಕವಾಗಿ ಅವರನ್ನೆಲ್ಲ ನೆಲೆ ನೀಡುವತ್ತ ಕೈ ಜೋಡಿಸುತ್ತೇವೆ.
45,"ಯಾವುದೇ ಜಾತಿ, ಧರ್ಮ, ಮತ ಪಂಥಗಳನ್ನು ನೋಡದೆ ಎಲ್ಲರಿಗೂ ಒಂದೇ ಸೂರಿನಡಿಯಲ್ಲಿ ಆಶ್ರಯ, ಆರೈಕೆ, ಅಕ್ಕರೆಯ ನೆಲೆ ಸಿಗಲಿದೆ."
46,ಭಾರತದಲ್ಲಿ ತನ್ನ ನೆಲೆ ಸ್ಥಾಪಿಸಲು ವಾಲ್‌ಮಾರ್ಟ್ ಕಂಪನಿ ಬಹಳ ಕಾಲದಿಂದಲೂ ಪ್ರಯತ್ನಿಸುತ್ತಾಬಂದಿದೆ.
47,ಪರ್ಯಾಯದ ಬೆಲೆ: ಗೊತ್ತಿಲ್ಲದ ನೆಲೆ
48,"ಆದರೆ ಸ್ವಾತಂತ್ರೋತ್ತರ ಭಾರತದಲ್ಲಿ ನೀವು ಯಾರನ್ನು ತ್ಯಾಗ ಬಲಿದಾನದ ಕತೆ ಹೆಣೆದು ಜನಮಾನಸದಲ್ಲಿ ಶಾಶ್ವತವಾಗಿ ನೆಲೆ ನಿಲ್ಲಬೇಕೆಂದು ಇನ್ನಿಲ್ಲದ ಪ್ರಯತ್ನ ನಡೆಸಿದ್ದೀರೋ ಆ ನಾಯಕರು, ಈ ದೇಶಕ್ಕೆ ಕೊಟ್ಟಿದ್ದಕ್ಕಿಂತ ಪಡೆದದ್ದೇ ಹೆಚ್ಚು!"
49,ಉತ್ತರ ಕನ್ನಡದಲ್ಲಿ ಜೆಡಿಎಸ್ ಗೆ ನೆಲೆ ಇಲ್ಲ - ಮಾರ್ಗರೇಟ್ ಆಳ್ವಾ
50,"ತಲೆಯಮೇಲೆ ಹರುಕು ಜೋಪಡಿ ಬಿಟ್ಟರೆ ನೆಲವೇ ಹಾಸಿಗೆ, ನಿಲ್ಲುವುದಕ್ಕೆ ಸರಿಯಾದ ನೆಲೆ ಇಲ್ಲದೇ ಮಹಿಳೆಯರು, ಮಕ್ಕಳ ಕುಟುಂಬ ಚಳಿ, ಬಿಸಿಲು, ಮಳೆ ಎಣಿಸದೇ ಬಯಲಿನಲ್ಲಿಯೇ ನೆಲೆಸಿರುವ ಇವರು ಅಕ್ಷರದಿಂದ ಬಲು ದೂರ."
51,ವಿವಾಹವಾದ ಬಳಿಕ ಬಾಲಿವುಡ್ ಚಿತ್ರರಂಗ ತೊರೆದಿದ್ದ ಮೀನಾಕ್ಷಿ ಶೇಷಾದ್ರಿ ಪತಿಯೊಂದಿಗೆ ಅಮೆರಿಕಾದಲ್ಲಿ ನೆಲೆ ನಿಂತಿದ್ದರು.
52,ಶಿಲೆಯ ಮರೆಯಲ್ಲಿರ್ದ ನೆಲೆ ವಸ್ತುವ
53,ನಂದಾ ದೇವಿ ಪರ್ವತವು ಉತ್ತರಾಖಂಡ ರಾಜ್ಯದ ಕುಮಾವೂನ್ ಹಿಮಾಲಯ ಪ್ರದೇಶದ ರಿಷಿಗಂಗಾ ಕಣಿವೆಯ ಪಶ್ಚಿಮಕ್ಕೆ ಮತ್ತು ಗೋರಿಗಂಗಾ ಕಣಿವೆಯ ಪೂರ್ವಕ್ಕೆ ನೆಲೆ ನಿಂತಿರುವುದನ್ನು ಕಾಣಬಹುದಾಗಿದೆ.
54,"ಅಲ್ಲದೇ ಈ ಬಾರಿ ಮಳೆ ಬಿದ್ದ ತಕ್ಷಣ ಹಣ್ಣಿನ ಗಿಡಗಳನ್ನು ನೆಟ್ಟು, ಪಕ್ಷಿಗಳಿಗೆ ಶಾಶ್ವತ ನೆಲೆ ಕಲ್ಪಿಸುವ ಉದ್ದೇಶ ಹೊಂದಿದ್ದೇನೆ ಎನ್ನುತ್ತಾರೆ ಶಾಂತರಾಜು."
55,"ಇಷ್ಟು ವರ್ಷಗಳಲ್ಲಿ ಸಂಪದ ಎಷ್ಟೋ ಬರಹಗಾರರಿಗೆ ನೆಲೆ ನೀಡಿದೆ, ಅವರ ಆತ್ಮವಿಶ್ವಾಸ ಬೆಳೆಸಿದೆ."
56,ಅಂಬೇಡ್ಕರ್‌ ಅವರು ಭಾರತದ ಶೋಷಿತರ ಹಕ್ಕುಗಳ ಕುರಿತ ಹೋರಾಟಕ್ಕೆ ಕಾನೂನಾತ್ಮಕ ನೆಲೆ ಒದಗಿಸಿದರು.
57,"ಭವಿಷ್ಯದ ಆತಂಕ ಮತ್ತು ನೆಲೆಯ ಅನ್ವೇಷಣೆಯಲ್ಲಿದ್ದ, ಯಾವ ಪರಿಚಯವೂ ಇಲ್ಲದ ನನಗೆ ಅನ್ನ, ನೆಲೆ ಕೊಟ್ಟ ಆರ್‌ಜಿ ನನ್ನ ಪ್ರಾತಃಸ್ಮರಣೀಯ ವ್ಯಕ್ತಿಗಳಲ್ಲಿ ಒಬ್ಬರು ಎನ್ನುವುದಕ್ಕೆ ನನಗೆ ಯಾವ ಸಂಕೋಚವೂ ಇಲ್ಲ."
58,"ಅರಿವು, ಶಕ್ತಿ ಮತ್ತು ಚಟುವಟಿಕೆಗಳನ್ನು ಹೊಂದಿರುವ ಆತ್ಮದ ನೆಲೆ ಇರುವುದು ಮೆದುಳಿನಲ್ಲಲ್ಲ, ಹೃದಯದಲ್ಲಿ."
59,ಚಿತ್ರರಂಗಕ್ಕೆ ಕಾಲಿಡುವವರಿಗೆ ನೆಲೆ ಕಳೆದುಕೊಳ್ಳುವ ಭಯದ ವಾತಾವರಣವೂ ಸ್ವಲ್ಪಮಟ್ಟಿಗೆ ದೂರವಾಗಿದೆ.
60,ಕಥೆ-ಚಿತ್ರಕಥೆಗಳನ್ನು ಅಳೆದು ತೂಗಿ ನೋಡುತ್ತಿರುವ ಹರಿಪ್ರಿಯಾ ಕನ್ನಡ ಚಿತ್ರರಂಗದಲ್ಲಿ ಒಂದಷ್ಟು ಕಾಲ ನೆಲೆ ನಿಲ್ಲುವ ಭರವಸೆ ಹುಟ್ಟಿಸುತ್ತಾರೆ.
61,"ಎಂದು ಹೇಳಿದ್ದಾರೆ, ಬೆಂಗಳೂರು ನಗರದ ಪೋಲಿಸರು ತಮ್ಮ ಕಾರ್ಯಾಚರಣೆಯನ್ನು ಮುಂದುವರೆಸಿ ಮತ್ತೆ ಉಗ್ರರು ಬೇರೆ ಎಲ್ಲಿಯಾದರೂ ನೆಲೆ ಮಾಡಿಕೊಂಡು ಕಾರ್ಯಾಚರಣೆಯನ್ನು ನಡೆಸುತ್ತಿದ್ದಾರೆಯೇ ಎಂಬುದನ್ನು ಪತ್ತೆಮಾಡಬೇಕು ಇದರಿಂದ ರಾಜ್ಯದಲ್ಲಿ ಇರುವ ಉಗ್ರರ ನೆಲೆಗಳನ್ನು ಸಂಪೂರ್ಣ ವಾಗಿ ನಾಶ ಮಾಡಲು ಸಾಧ್ಯವಾಗುತ್ತದೆ."
62,ಆಫ್ಘನ್ ಅಥವಾ ಅಲ್ಲಿ ನೆಲೆ ಹೊಂದಿರುವ ಪಾಕ್ ಉಗ್ರರು ಈ ದಾಳಿ ನಡೆಸಿರುವ ಸಾಧ್ಯತೆಗಳಿವೆ ಎಂದು ಪಾಕ್ ಸೇನಾಧಿಕಾರಿಗಳು ಶಂಕಿಸಿದ್ದಾರೆ.
63,ಇದರಿಂದ ದತ್ತು ಎಂಬುದು ಎಷ್ಟೊಂದು ಒಳ್ಳೆಯ ಕೆಲಸ ಎಂಬುದು ಅವರ ಮನದಲ್ಲಿ ನೆಲೆ ನಿಂತಿತ್ತು.
64,"ಆದರೆ ಕುವೆಂಪು ಪ್ರತಿಮೆ, ಪ್ರತಿಮಾವಿಧಾನಗಳನ್ನು ಕುರಿತು ನಡೆಯಿಸುವ ಚರ್ಚೆಯ ವಿಸ್ತಾರ ವೈವಿಧ್ಯಗಳು ಹಾಗೂ ನೆಲೆ ಬೆಲೆಗಳು- ಅವರಿಗಿರುವ ಮನೋವಿಜ್ಞಾನ, ತತ್ವಶಾಸ್ತ್ರ ಹಾಗೂ ಸಾಹಿತ್ಯದ ಹಿನ್ನೆಲೆಯಲ್ಲಿ ಬೇರೆಯೇ ಆಗಿವೆ."
65,ಜಮ್ಮುವಿನಲ್ಲಿ ನೆಲೆ ನಿಂತಿರುವ ಸುಮಾರು 7000 ರೋಹಿಂಗ್ಯನ್ನರ ಪರವಾಗಿ ಸಲ್ಲಿಸಲಾಗಿರುವ ಅಪೀಲಿನಲ್ಲಿ ಅವರು ತಮ್ಮಲ್ಲಿ ಯಾರೊಬ್ಬರು ಕೂಡ ಉಗ್ರವಾದ ಚಟುವಟಿಕೆಯಲ್ಲಿ ನಿರತರಾಗಿಲ್ಲ ಎಂದು ಹೇಳಿದ್ದಾರೆ.
66,ಹಿಗಿರುವಾಗ ನ್ಯಾಯಾಲಯಕ್ಕೆ ನೀಡಿದ ವಚನವನ್ನು ಮುರಿದು ಕಟ್ಟುವ ರಾಮಮಂದಿರದಲ್ಲಿ ಖಂಡಿತವಾಗಿಯೂ ರಾಮ ನೆಲೆ ನಿಲ್ಲಲು ಸಾಧ್ಯವೆ?
67,ಈ ಪ್ರದೇಶವು ಶ್ರೀ ರಾಮನು ನೆಲೆ ಎಂಬ ದಂತಕಥೆಯನ್ನು ಹೊಂದಿರುವುದರಿಂದಾಗಿ ಪ್ರಸಿದ್ಧವಾದ ಸ್ಥಳವಾಗಿದ್ದು ಪ್ರವಾಸಿಗರ ನೆಚ್ಚಿನ ಸ್ಥಳವಾಗಿದೆ.
68,ಅವರ ಈ ಬೆಳವಣಿಗೆ ಟಾಲಿವುಡ್ ನಲ್ಲಿ ಗಟ್ಟಿ ನೆಲೆ ಹೊಂದಿರುವ ನಟಿ ಸಾಯಿ ಪಲ್ಲವಿಗೆ ಪೈಪೋಟಿ ಎನ್ನುವ ಮಾತು ಟಾಲಿವುಡ್ ಅಂಗಳದಲ್ಲಿ ಕೇಳಿ ಬರುತ್ತಿದೆ.
69,ಈ ಚಿಟ್ಟೆಯ ನೈಸರ್ಗಿಕ ನೆಲೆ ಯಾವ ಭೂಖಂಡ?
70,"ಸಣ್ಣ ಪುಟ್ಟ ತಿಂಡಿ ಅಂಗಡಿಗಳಿಗೂ ಒಂದು ಶಾಶ್ವತ ನೆಲೆ ದಕ್ಕಿಸಿಕೊಡಲು ತಹಶೀಲ್ದಾರ್ ಹಾಗೂ ಪಟ್ಟಣ ಪಂಚಾಯ್ತಿ ಮುಖ್ಯಾಧಿಕಾರಿ ಮತ್ತು ಪಟ್ಟಣ ಪಂಚಾಯ್ತಿ ಅಧ್ಯಕ್ಷರು, ಸದಸ್ಯರು ಸೂಕ್ತ ತೀರ್ಮಾನ ಕೈಗೊಳ್ಳಬೇಕು ಎಂದು ಅವರು ಮನವಿ ಮಾಡಿದರು."
71,ಆದರೆ ಈ ಗುಡ್ನಾಪುರ ಶಾಸನ ಮಾತ್ರ ಇನ್ನೂ ನೆಲೆ ಕಾಣದೆ ಅನಾಥವಾಗಿದೆ.
72,ತಾನು ಬರೆಯುತ್ತಿರುವ ಸಾಹಿತ್ಯ ಪರಂಪರೆಯಲ್ಲಿ ನೆಲೆ ನಿಂತ ಈ ಗಂಡುವಾಕ್ಯಗಳು ಅಂತಸ್ತನ್ನು ಸಮರ್ಥಿಸುವಂಥವು.
73,"ಆದರೆ, ಬಾಂಗ್ಲಾ ದೇಶೀಯರ ಜತೆಗೆ ಪಶ್ಚಿಮ ಬಂಗಾಳ, ಬಿಹಾರ ಮತ್ತಿತರ ರಾಜ್ಯಗಳ ಭಾರಿ ಸಂಖ್ಯೆಯ ಜನರೂ ಅಸ್ಸಾಂನಲ್ಲಿ ನೆಲೆ ಕಂಡುಕೊಂಡಿದ್ದಾರೆ."
74,ಬೃಹತ್ ವಾಯು ನೆಲೆ ಅಗಿರುವುದರಿಂದ ಉಗ್ರ ನಿಗ್ರಹ ಕಾರ್ಯಾಚರಣೆಗೆ ಹೆಚ್ಚು ಸಮಯ ತಗಲಿದೆ ಎಂದರು.
75,"ಮಂಗಳೂರು ಶಾಂತಿಯಿಂದಿದೆ, ಮರಳಿ ಗಲಭೆ ಎಬ್ಬಿಸಿ ಅಲ್ಲಿ ಅಸ್ತಿತ್ವವೇ ಇಲ್ಲದ ತಮ್ಮ ಪಕ್ಷಕ್ಕೆ ನೆಲೆ ಕಲ್ಪಿಸಲು ಕುಮಾರಸ್ವಾಮಿ ಪ್ರಯತ್ನಿಸುತ್ತಿದ್ದಾರೆ ಎಂದು ಸೋದರಿ ಶೋಭಾ ಕರಂದ್ಲಾಜೆ ಹೇಳಿದ್ದಾರೆ."
76,ಪುಟ್ಟ ಮಗು ಜಯಾ ಜೊತೆಗೆ ಆಕೆ ಬೆಂಗಳೂರಿಗೆ ಬಂದು ತಂದೆಯ ಮನೆಯಲ್ಲಿ ನೆಲೆ ಕಂಡುಕೊಳ್ಳುತ್ತಾಳೆ.
77,"ಕೆಲವು ಶಿಲ್ಪಗಳಿಗೆ ಒಳಗೆ ಸೇರಲು ಜಾಗವಿಲ್ಲದೇ, ಹೊರಗಡೆ ನೆಲೆ ನಿಂತಿವೆ."
78,"ಮಾವಿನ ಪಟ್ಟಣದ ವಿಶೇಷ ಆಕರ್ಷಣೆಯಾದ ಹಾರಾಡುವ ಸಸ್ತನಿಗಳು ಇಲ್ಲಿನ ನೆಲೆ ಬಿಟ್ಟು ಬೇರೆಡೆಗೆ ವಲಸೆ ಹೋಗದಂತೆ ತಡೆಯಬೇಕಾದರೆ, ಅವು ನಿರಾತಂಕವಾಗಿ ಜೀವಿಸುವ ವಾತಾವರಣ ಕಲ್ಪಿಸಬೇಕು."
79,ಅದೇ ಸಮಯದಲ್ಲಿ ಮನರಂಜನಾ ನೆಲೆ ಖುಟೊರೊಕ್ ನಲವತ್ತು ಜನರಿಗೆ ಅವಕಾಶ ಕಲ್ಪಿಸಬಹುದು.
80,ಈಗ ಮಕ್ಕಳ ಓದು ನಿಲ್ಲುವುದೆಂಬ ಆತಂಕದಿಂದ ಇಲ್ಲೇ ನೆಲೆ ಊರಿದ್ದಾರೆ.
81,"ಕಛೇರಿ ಯಶಸ್ವಿಯಾದರೆ ಕೇಳುಗನ ಹೃದಯದಾಳದಲ್ಲಿ ಗಾಯಕ, ಆತನ ಸಂಗೀತದ ಸವಿ ಭದ್ರವಾಗಿ ನೆಲೆ ನಿಲ್ಲುತ್ತದೆ."
82,"ದೇಶದ ಇತರೆಡೆಗಳಲ್ಲೂ ಸಹಸ್ರಾರು ಸಂಘ ಸಂಸ್ಥೆಗಳು, ಸರ್ಕಾರಿ ಕಚೇರಿಗಳು, ಸೇನಾ ನೆಲೆ ಆಶ್ರಯದಲ್ಲಿ ಕೂಡಾ ಯೋಗ ಕಾರ್ಯಕ್ರಮ ನಡೆಯಿತು."
83,"ಶ್ರಾವಣ ಮಾಸ, ವಿಜಯದಶಮಿ ಸಂದರ್ಭಗಳಲ್ಲಿ ಸಾವಿರಾರು ಜನರಿಂದ ಪೂಜೆ ಪಡೆಯುವ ಕೆಳದಿ ಅರಸರ ಕಾಲದ ಬಸವೇಶ್ವರ ನೆಲೆ ಕಳೆದುಕೊಳ್ಳುವ ಆತಂಕದಲ್ಲಿದ್ದಾನೆ."
84,ಆಳ್ವಾಸ್ ನುಡಿಸಿರಿ -೨೦೧೭ ರ ಎರಡನೇ ದಿನದ ಮೊದಲ ವಿಚಾರಗೋಷ್ಟಿಯಲ್ಲಿ ಸ್ವವಿಮರ್ಷೆಯ ನೆಲೆ ವಿಷಯದ ಕುರಿತಾಗಿ ರತ್ನಾಕರವರ್ಣಿ ವೇದಿಕೆಯಲ್ಲಿ ಮಾತನಾಡಿದ ಅವರು ವರದಿಯನ್ನು ಪರಿಶೀಲಿಸುವ ವ್ಯವಧಾನ ಯಾವ ಸಂಪಾದಕರರಿಗೂ ಇಲ್ಲ.
85,ಯಡಿಯೂರಪ್ಪನವರ ಬೆಂಬಲಿಗರೆನಿಸಿಕೊಂಡವರಿಗೆ ಮತ್ತೆ ನೆಲೆ ಇಲ್ಲದಂತಾಗುತ್ತದೆ.
86,ಆದ್ದರಿಂದ ಅಲ್ಪಸಂಖ್ಯಾತ ಮತ್ತು ವಿಶಿಷ್ಠವಾದ ಕೊಡವರು ತಮ್ಮ ನೆಲ ಮಾರಿದರೆ ನೆಲೆ ಹಾಗೂ ಸಂಸ್ಕೃತಿಯನ್ನು ಕಳೆದುಕೊಳ್ಳುವ ಅಪಾಯವಿದೆ.
87,ಪಾಕಿಸ್ತಾನ ಎಂದಿನಿಂದಲೋ ಭಯೋತ್ಪಾದಕರಿಗೆ ನೆಲೆ ನೀಡುತ್ತ ಬಂದಿದೆ.
88,ವೇದಾ ಕೃಷ್ಣಮೂರ್ತಿ(7) ಹಾಗೂ ತಾನಿಯಾ ಭಾಟಿಯಾ(11)ಹೆಚ್ಚು ಹೊತ್ತು ಕ್ರೀಸ್‌ನಲ್ಲಿ ನೆಲೆ ನಿಲ್ಲಲು ವಿಫಲರಾದರು.
