Index,Sentence
196,ಬೆಳಗ್ಗೆ ಎದ್ದ ತಕ್ಷಣ ತೆಂಗಿನ ಕಾಯಿ ಅಥವಾ ಬಿಳಿ ಜಲ ಪಕ್ಷಿ ಕಾಣಿಸಿಕೊಂಡರೆ ಯಾವುದೋ ಒಂದು ಮಾರ್ಗದಿಂದ ಹಣ ಬರುತ್ತದೆ ಎಂಬುದರ ಸಂಕೇತವಾಗಿದೆ.
197,ಶೇಂಗಾ ಕಾಯಿ ಕಟ್ಟಿಲ್ಲ.
198,ಮೂಲಂಗಿ ಸೇವಿಸಿದ ದಿನ ಯಾವುದೇ ಕಾರಣಕ್ಕೂ ಆಗಲ ಕಾಯಿ ಪಲ್ಯ ಅಥವಾ ಹಾಗಲಕಾಯಿ ಯನ್ನ ಸೇವಿಸಬೇಡಿ.
199,ಒಂದರಲ್ಲೂ ಚೆನ್ನಾಗಿ ಕಾಯಿ ಕಟ್ಟುತ್ತಿಲ್ಲ.
200,ಸಣ್ಣ ಪ್ರಮಾಣದಲ್ಲಿ ಕಾಯಿ ಹೊಂದಿ­ರುವ ರೈತರು ತಮ್ಮ ಮನೆ ಮುಂದೆಯೇ ಹೊಟ್ಟು ಬಿಡಿಸುವ ಕಾಯಕದಲ್ಲಿ ತೊಡಗಿದ್ದಾರೆ.
201,ಕೆಲವೇ ಮೆಣಸಿನ ಕಾಯಿ
202,"ಸಿಎಂ ಕುಮಾರಸ್ವಾಮಿ ಹಾಗೂ ಅವರ ಪತ್ನಿ ಅನಿತ ಕುಮಾರಸ್ವಾಮಿ ಅವರು ಒಂದೊಂದು ಕಾಯಿ ಒಡೆದಿದ್ದು, ನಿಖಿಲ್ ಕುಮಾರಸ್ವಾಮಿ ಅವರು 6 ಈಡುಗಾಯಿ ಒಡೆದರು ಅದರಲ್ಲಿ 1 ಕಾಯಿ ಒಡೆದಿಲ್ಲ ಎನ್ನಲಾಗಿದೆ."
203,[ಕಡಲೆ ಕಾಯಿ ಪರಿಷೆ ಐತಿಹಾಸಿಕ ಹಿನ್ನಲೆ]
204,ಮದ್ಯ ಸ್ವೀಕರಿಸಿದ ಹರಕೆ ಹೊತ್ತ ಭಕ್ತರು ದೇವರ ಸಮ್ಮುಖದಲ್ಲಿ ಟೆಂಗಿನ ಕಾಯಿ (ಸಿಡಗಾಯಿ) ಒಡೆಯುತ್ತಾರೆ.
205,ಭಾರಿ ಮಳೆಗೆ ಗಿಡದಲ್ಲಿ ಹೀಚು ಕಟ್ಟಿರುವ ಕಾಫಿ ಕಾಯಿ ಮಣ್ಣು ಪಾಲಾಗುತ್ತಿದೆ.
206,ಈತ ತೆಂಗಿನ ಮರ ಹತ್ತಿ ಕಾಯಿ ಕೀಳುವಾಗ ಆಯತಪ್ಪಿ ಬಿದ್ದು ಸಾವನ್ನಪ್ಪಿರುವ ಘಟನೆ ನಡೆದಿದೆ.
207,ಅದರ ಬದಲು ಹಣ್ಣು ಕಾಯಿ ನಿವೇದಿಸಿ.
208,ಬಲಿತಾಗ ಕಾಯಿ ೧೦ ರಿಂದ ೨೦ ಸೆಂ.
209,ನಂತರ ಕಾಯಿ ತುರಿದು ಬೆಲ್ಲ ಸೇರಿಸಿ ಪ್ರಸಾದದ ರೂಪದಲ್ಲಿ ಎಲ್ಲರೂ ಸೇವಿಸುತ್ತಾರೆ.
210,"ಗಟ್ಟಬಾರಾ : ತೇಯ್ದು ನಾಲ್ಕು ಹುಣಸೇ ಬೀಜ ಅಥವಾ ಕವಡೆ, ನೆಲದಲ್ಲಿ ಒಂದು ಇಪ್ಪತ್ತೈದು ಚೌಕಾಕಾರದ ಮನೆಗಳುಳ್ಳ ನಕ್ಷೆ, ಐದು ಕಾಯಿ ಇಡುವ ಕಟ್ಟೆ ಮನೆ ಬಳಸಿ ಇಬ್ಬರು ಅಥವಾ ನಾಲ್ವರು ಆಡುವ ಆಟ."
211,"ಅದೇ ರೀತಿ ಮಲೆನಾಡಲ್ಲಿ ನೇರಲು , ನೆಲ್ಲಿ , ಬಾಗೇಮರ, ಹೊಂಗೆ , ಶಿವಣೆ , ಹೆಬ್ಬೇವು, ಮಹಾಗನಿ, ಅಂಟುವಾಳ, ಗಾರ್ಸಿನಿಯಾ –ಮುರುಗಲು, ಉಪ್ಪಾಗೆ, ಕಾಯಿ ದೂಪ, ಹಲಸು, ಮಾವು ಮುಂತಾದ ಜಾತಿಯ ಗಿಡಗಳು ಹೊಂದಿಕೆ ಆಗುತ್ತವೆ ಎಂಬುದನ್ನು ಸಸ್ಯ ಶಾಸ್ತ್ರಜ್ಞರು, ಪರಿಸರ ಕಾರ್ಯಕರ್ತರು ಎತ್ತಿ ಹೇಳಿದ್ದಾರೆ ."
212,"ಬಹಳ ಹಿಂದಿನ ಕಾಲದಿಂದಲೂ ಕಾಯಿ ಮತ್ತು ಸೊಪ್ಪು ತರಕಾರಿಯಾಗಿ ಬಳಕೆಯಾಗುತ್ತಾ ಬಂದಿದ್ದು, ಆರೋಗ್ಯಕ್ಕೆ ಹಿತಕಾರಿಯಾಗಿದೆ."
213,ಈ ಪಂದ್ಯದಲ್ಲಿ ಕಪ್ಪು ಕಾಯಿ ಗಳೊಂದಿಗೆ ಆಡಿದ ಭಾರತದ ಆಟಗಾರ್ತಿ ಆರಂಭದಿಂದಲೇ ರಕ್ಷಣಾತ್ಮಕ ಆಟಕ್ಕೆ ಒತ್ತು ನೀಡಿದರು.
214,"ಪೊಟ್ಯಾಶ್‌, ಬೊರಾನ್‌ ಕೊರತೆಯಿಂದ ಕಾಯಿ ಉದುರುವ ರೋಗ ಆರಂಭವಾಗುತ್ತದೆ."
215,ಮಹಿಳೆಯರು ಯಾಕೆ ತೆಂಗಿನ ಕಾಯಿ ಒಡೆಯಬಾರದು…?
216,ಮಿದು ಖಾರದ ನೆಲ್ಲಿ ಮೆಣಸಿನ ಕಾಯಿ
217,ಕಾಯಿ ಹಣ್ಣಾಗದೇ ಉದುರಿದರೆ ವಿಫಲವಾದಂತೆ.
218,"ಚಂದನ ಹಚ್ಚಿದ ಮಣೆಯ ಮೇಲೆ ಬಾಳೆಲೆಯಿರಿಸಿ, ಅಕ್ಕಿ ಸುರುವಿ ಅದರ ಮೇಲೆ ಕುಂದಿಲ್ಲದ ದೊಡ್ಡ ಚೀನಿಕುಂಬಳಕಾಯನ್ನಿರಿಸಿ, ಮಲ್ಲಿಗೆ ಮಾಲೆ ತೊಡಿಸಿ, ಇಕ್ಕೆಲಗಳಲ್ಲೂ ಸೌತೆಕಾಯಿ, ತೊಂಡೆಕಾಯಿಗಳನ್ನಿಟ್ಟು,ಹಿತ್ತಿಲ ಮಾವು, ಗೇರುಹಣ್ಣುಗಳನ್ನು ಜೊತೆಗಿರಿಸಿ ದೀಪ ಬೆಳಗಿ, ಅಗರ್‌ಬತ್ತಿ ಹಚ್ಚಿ, ಕಾಯಿ ಒಡೆದು, ಕಾಯಿಹೋಳುಗಳಲ್ಲಿ ಸುಟ್ಟ ಗೇರುಬೀಜಗಳನ್ನೂ, ಓಲೆಬೆಲ್ಲದ ತುಂಡುಗಳನ್ನೂ ಇರಿಸಿ ಸಿಧ್ಧವಾದ ವಿಶುಕಣಿ."
219,"ಮನೆಯ ಗೃಪ್ರವೇಶ ಆಗಿರಬಹುದು ಇಲ್ಲವೇ ಹವನವಾಗಿರಬಹುದು, ಪೂಜೆಯಾಗಿರಬಹುದು ತೆಂಗಿನ ಕಾಯಿ ಬೇಕೇ ಬೇಕು."
220,ಹೆಕ್ಟೇರಿಗೆ ೩೫-೪೦ ಟನ್ ಕಾಯಿ ಸಿಗುತ್ತವೆ.
221,ಒ೦ದೊ೦ದು ಸಾರಿಗೆ ಒ೦ದೊ೦ದು ಕಾಯಿ ತ೦ದು ಸುಲಿಯೋ ಬದಲು ಒ೦ದೇ ಕಾಯನ್ನು ಬಿಡದ೦ತೆ ಸುಲಿದಿದ್ದರೆ ಇಷ್ಟು ದಿನಕ್ಕೆ ಒಂದು ಕಾಯಿಯನ್ನಾದರೂ ಸುಲೀತಿದ್ದೆನೋ ಏನೋ :(
222,ಇದಕ್ಕೆ ಹಸಿಮೆಣಸಿನಕಾಯಿ ಇಲ್ಲವೇ ಒಣಮೆಣಸಿನ ಕಾಯಿ ಸೇರಿಸಿಕೊಳ್ಳಬೇಕು.
223,"ಬೆಟ್ಟದ ನೆಲ್ಲಿ, ಮಧುನಾಶಿನಿ, ತೊಟ್ಲುಕಾಯಿ, ಅಳಿಲು ಕಾಯಿ ಇತ್ಯಾದಿಗಳಿವೆ."
224,ಬೆಂದ ನಂತರ ಒಣಮೆಣಸಿನ ಕಾಯಿ ಪುಡಿ ಸೇರಿಸಿ ನೀರು ಇಂಗುವರೆಗೂ ಬೇಯಿಸಿ.
225,ಈ ಮೂರೂ ಸೌತೆಗಳು ಬಿತ್ತನೆ ಮಾಡಿದ ಐವತ್ತು ದಿನದಿಂದಲೇ ಕಾಯಿ ಕೊಡಲು ಶುರು ಮಾಡುತ್ತವೆ.
226,ತಾವೇ ಗೋಗೆಂದು ಕಳೂವ್ಯಾರೆ || ಕಾಯಿ ದರುಸೇ ||
227,ಉತ್ತರ ಕರ್ನಾಟಕ ಭಾಗದ ಜಿಲ್ಲೆಗಳಲ್ಲಿ ‌ಹುಣಸೆ ಕಾಯಿ ಜಜ್ಜುವ-ಬೇರ್ಪಡಿಸುವ ಕಾಯಕ ಬಹುತೇಕರಿಗೆ ಜೀವನಾಧಾರವಾಗಿದೆ.
228,ತೆಂಗಿನ ಕಾಯಿ ತಿಂದರೆ ಹುಟ್ಟುವ ಮಗು ಬಿಳಿಯಾಗಿರುವುದು ಎನ್ನುವ ನಂಬಿಕೆ ಭಾರತೀಯರಲ್ಲಿದೆ.
229,ವಿಮೆಯನ್ನು ಉತ್ತಮ ಬೆಳವಣಿಗೆ ಹೊಂದಿರುವ ಕನಿಷ್ಠ 30 ಕಾಯಿ ಬಿಡುತ್ತಿರುವ 5 ರಿಂದ ಮೇಲ್ಪಟ್ಟ ಗಿಡಗಳಿಗೆ ಮಾಡಿಸಲು ಅವಕಾಶವಿರುತ್ತದೆ.
230,ಕಾಯಿ ಎಂಬುದು ಕಲ್ಲಿನೆಂಜಲ
231,"ಇದು ಸಹ ಕೊಂಡಿಗಳು ಅಡಿಯಲ್ಲಿ ಒಳಕ್ಕೆ ಅಗತ್ಯ, ಒಂದು ಕಾಯಿ ಅಗತ್ಯವಿದೆ."
232,ರಿಂದ 5 ಹುರುಳಿ ಕಾಯಿ ಅಥವಾ ನೂರು ಗ್ರಾಂ ನಷ್ಟು ಅವರೆಕಾಯಿ
233,"ಅಗರಬತ್ತಿ, ಕರ್ಪೂರ ಬೆಳಗಿಸಿ ತೆಂಗಿನ ಕಾಯಿ ಒಡೆದರು."
234,ನುಗ್ಗೆ ಗಿಡ ಕಾಯಿ ಕೊಡಲಾರಂಭಿಸಿದೆ.
235,"ನಂತರ ಕಾಯಿ ಭೂಮಿ ಮುಚ್ಚಲಾಗುತ್ತದೆ, pritaptyvayut ಮತ್ತು ನೀರಿರುವ."
236,ನೆಟ್ಟು 45 ದಿನದಲ್ಲಿ ಕಾಯಿ ನೀಡಲು ಆರಂಭ.
237,Home ವಾರ್ತೆಗಳು ಆರೋಗ್ಯ ಅನಿಮಿಯಾ ಅಥವಾ ರಕ್ತಹೀನತೆಯ ಸಮಸ್ಯೆಯನ್ನು ನಿವಾರಿಸಲು ಈ ಕಾಯಿ ಸಹಕಾರಿ
238,ತೆಂಗಿನ ಕಾಯಿ ನಿಂಬೆಹಣ್ಣು ಮುಂತಾದವುಗಳ ಪರ್ವತಗಳೇ ನಿರ್ಮಾಣವಾಗುತ್ತಿದ್ದು ನೋಡುಗರ ಕಣ್ಮನ ತಣಿಸುತ್ತಿದೆ.
239,ಸಂಗನಕಲ್ ಗ್ರಾಮದಲ್ಲಿ ಘಟನೆ: ಸಂಗನಕಲ್ ಬೂತ್‍ನಲ್ಲಿ ಕಾಯಿ ಒಡೆದು ಪೂಜೆಯನ್ನು ಮಾಡಿ ಬೂತ್ ಸಂಖ್ಯೆ 125 ಬಳಿ ಘಟನೆ ನಡೆದಿದೆ.
240,ಹುರುಳಿ ಬಳ್ಳಿಯಲ್ಲೂ ಕಾಯಿ ಹೆಚ್ಚು.
241,ಸ್ಪೇಷಲ್ ಡೆಸ್ಕ್: ಅನ್ನ ಅಥವಾ ರೊಟ್ಟಿಗೆ ಮೆಣಸಿನ ಕಾಯಿ ರಾಯತ ತುಂಬಾ ರುಚಿಕರವಾಗಿರುತ್ತೆ.
242,ಸೌತೆ ಕಾಯಿ ರಸ ಹಚ್ಚಿ
243,"ಬೇಕಾಗುವ ಸಾಮಗ್ರಿ: ಇಡ್ಲಿಹಿಟ್ಟು – 1 ಬಟ್ಟಲು, ಹೆಚ್ಚಿಕೊಂಡ ಈರುಳ್ಳಿ – 1 ಕಪ್, ಹಸಿಮೆಣಸಿನ ಕಾಯಿ – 4, ಕರಿಬೇವಿನ ಎಸಳು – 3, ಎಣ್ಣೆ – ಅರ್ಧ ಕಪ್, ಸಾಸಿವೆ – 1 ಚಮಚ, ಜೀರಿಗೆ- 1 ಚಮಚ."
244,ವ್ಯವಸ್ಥೆಯನ್ನು ರಕ್ಷಿಸಲು ಹೆಚ್ಚುವರಿ ಕಾಯಿ ಒದಗಿಸಲಾಗುತ್ತದೆ.
245,ಬೆಂಗಳೂರು: ಬ್ಯಾಡಗಿ ಕೃಷಿ ಉತ್ಪನ್ನ ಮಾರುಕಟ್ಟೆ ಸಮಿತಿ(ಎಪಿಎಂಸಿ)ಯಲ್ಲಿ ಆನ್‌ಲೈನ್‌ ಟೆಂಡರ್‌ ಜಾರಿಯಿಂದಾಗಿ ಒಣಮೆಣಸಿನ ಕಾಯಿ ಆವಕ ಹೆಚ್ಚಾಗಿದ್ದರೂ ರೈತರಿಗೆ ಉತ್ತಮ ಬೆಲೆ ಸಿಕ್ಕಿದೆ.
246,ನಾವು ಮಾವಿನ ಕಾಯಿ ಇಲ್ಲವೇ ಹಣ್ಣುಗಳನ್ನು ಮಾರಾಟ ಮಾಡುವುದಿಲ್ಲ.
247,"ಕಣದಲ್ಲಿ ದಾಸ್ತಾನು ಮಾಡಿದ್ದ ಮೆಕ್ಕೆಜೋಳ ತೆನೆ, ಶೇಂಗಾ ಕಾಯಿ ಬಳ್ಳಿಯ ಬಣವೆಗಳಿಗೆ ಸೋಮವಾರ ನಡು ರಾತ್ರಿ ಬೆಂಕಿ ತಗಲಿ ಉರಿಯುತ್ತಿರುವುದನ್ನು ಕಂಡ ಗ್ರಾಮಸ್ಥರು ನಂದಿಲು ಯತ್ನಸಿದ್ದಾರೆ."
248,"ಕೋಳಿಯ ಮಾಂಸವನ್ನು ಚಿಕ್ಕಚಿಕ್ಕದಾಗಿ ಕತ್ತರಿಸಿ, ಅದಕ್ಕೆ ಮಸಾಲೆ ಸೇರಿಸಿ ಫ್ರೈ ಮಾಡಿ, ತೆಳುವಾದ ದೋಸೆ ಮಾಡಿ ಕೋಳಿ ಮಾಂಸದ ಫ್ರೈಯನ್ನು ದೋಸೆಯೊಳಗೆ ಇಟ್ಟು ನೀಡುವ ಚಿಕನ್‌ ದೋಸೆಯನ್ನು ಕೆಂಪು ಚಟ್ನಿ ಅಥವಾ ಕಾಯಿ ಚಟ್ನಿಯೊಂದಿಗೆ ತಿನ್ನಬೇಕು."
249,"ಒಣಗಿಸಿದ ನೇಂದ್ರ ಬಾಳೆ ಕಾಯಿ ಹುಡಿ,"
250,"ಬೆಳಿಗ್ಗೆ ಸುಪ್ರಭಾತ, 12 ಕಾಯಿ ಮಹಾಗಣಪತಿ ಹವನ, ನರಸಿಂಹ ಹವನ, ಶ್ರೀ ವಿಶ್ವನಾಥ ಸ್ವಾಮಿಗೆ ರುದ್ರಾಭಿಷೇಕ, ನವಕಲಶಾಭಿಷೇಕ, ಮಹಾಪೂಜೆ, ಶ್ರೀನಿವಾಸ ದೇವರಿಗೆ ಪವಮಾನಾಭಿಷೇಕ, ಪಂಚವಿಂಶತಿ ಕಲಶಾಭಿಷೇಕ, ಮಹಾಪೂಜೆ ನೆರವೇರಿತು."
251,ಬೆಂಗಳೂರಲ್ಲಿ ನಾವು ಮನೆ ಕಟ್ಟಿದ ಹೊಸದರಲ್ಲಿ ಒಂದು ಕುಂಬಳದ ಬಳ್ಳಿ ತಾನಾಗಿ ಹುಟ್ಟಿ ಬಹಳ ಕಾಯಿ ಬಿಟ್ಟು ನನ್ನ ಈ ಹಳೆಯ ಕತೆಯನ್ನೆಲ್ಲಾ ಜ್ಞಾಪಕಕ್ಕೆ ತಂದಿತ್ತು.
252,ಎರಡು ವರ್ಷದ ಬಾಲಕಿ ಆಟವಾಡ್ತಾ ಹಸಿಮೆಣಸಿನ ಕಾಯಿ ತಿಂದಿದ್ದಾಳೆ.
253,"ಬುಗುರಿ ಮರದ ಎಲೆ, ಹೂ, ಕಾಯಿ ಮತ್ತು ತೊಗಟೆಯ ಉಪಯೋಗದ ಬಗ್ಗೆ ತಿಳಿಸಿಕೊಟ್ಟರು."
254,ಆಳದಲ್ಲಿ ಕಾಯಿ ಕಟ್ಟುವ ಪ್ರಾರಂಭದ ಹಂತದಲ್ಲಿ ಕ್ಯಾಲ್ಸಿಯಂ ಉತ್ತಮ ರೀತಿಯಲ್ಲಿ ಕಾಯಿ ಕಟ್ಟುವ ಗುಣಮಟ್ಟದ ಬೀಜ ಬರುವಲ್ಲಿ ಸಹಾಯಕವಾಗುವುದು.
255,"ಮಠ ದಲ್ಲಿ ಗದ್ದಿಗೆಗೆ ಕಾಯಿ ಒಡೆಸಿ, ನಗಾರಖಾನೆಯಲ್ಲಿ ಸಕ್ಕರಿ ಓದಿಸಿ ಬರುವು ದೆಂದರೆ ಸಾಮಾನ್ಯ ಜನಕ್ಕೆ ಸಮಾಧಾನ."
256,ಈಗ ಕಾಯಿ ಬಿಡಲು ಆರಂಭಿಸಿದ್ದರೆ ಲಕ್ಷಾಂತರ ರೂಪಾಯಿ ಲಾಭ ನೋಡಬಹುದಿತ್ತು.
257,ನಿಂಬೆ ಮತ್ತು ಮೋಸಂಬಿ ಕಸಿಯಿಂದ ಒಂದೇ ವರ್ಷದಲ್ಲಿ ಕಾಯಿ ಕೊಯ್ಯಬಹುದು.
258,"ಚಿತ್ರಸದೃಶ ಗ್ರಾಮದ ಹೆಮ್ಮೆಯ ಕರಾವಳಿ ಮತ್ತು ಹಲವಾರು ಸೈಪ್ರೆಸ್, ಜಾಜಿ ಮರದ ಕಾಯಿ ಅಲ್ಲೆ ಜೊತೆಗೆ 4 ಕಿ."
259,ನಾನು ಉಪ್ಪಿನ ಕಾಯಿ ಹಾಕ್ತೀರಾ?
260,ಕಾಡುಬಗೆಗಳ ಕಾಯಿ ರುಚಿಯಲ್ಲಿ ಕಹಿಯಾಗಿರುತ್ತವೆ.
261,"ಕಾಯಿ ತೆಗೆಯಲ್ಪಟ್ಟ ನಂತರ, ಹಳೆಯ ಜರಡಿಯನ್ನು ಸಿಂಕ್ ಮೇಲ್ಭಾಗದಿಂದ ಎಳೆಯಿರಿ."
262,ಭಕ್ತರು ರಥೋತ್ಸವದ ಚಕ್ರಕ್ಕೆ ಕಾಯಿ ಒಡೆದು ಭಕ್ತಿ ಸಮರ್ಪಿಸಿದರು.
263,"ತಾವರೆ ಹೂವು, ಸೌತೆ ಹೂವು, ಹೀರೆ ಹೂವು, ಗುಲಾಬಿ ಹೂವು, ರಾತ್ರಿರಾಣಿ, ಮುತ್ತುಗದ ಹೂವು, ಸಾಗುವಾನಿ ಮರದ ಹೂವು, ಅಂಟುವಾಳ ಕಾಯಿ ಮರದ ಹೂವು, ಅತ್ತಿ, ಆಲ, ಬಸರಿ ಹೀಗೆ ಏನೆಲ್ಲಾ ಗಿಡಗಳ, ಮರಗಳ, ಬಳ್ಳಿಗಳ ಹೂಗಳು ಅರಳುವುದು ಯಾವಾಗ?"
264,2-3 ನಿಮಿಷ ಕಳೆದ ಮೇಲೆ ಬಾಳೆ ಕಾಯಿ ಬಿಲ್ಲೆಗಳನ್ನು ಮಗುಚಿ ಹಾಕಿ ಬೇಯಿಸಬೇಕು.
265,"ಚಾವಟಿಯ ಪ್ರಕ್ರಿಯೆಯನ್ನು ಮುಂದುವರೆಸಿಕೊಂಡು ಮೊಟ್ಟೆಯ ಮಿಶ್ರಣಕ್ಕೆ ನಾವು ಹಿಂಡಿದ ಹಿಟ್ಟು ಮತ್ತು ಕೋಕೋ ಪುಡಿ ಸೇರಿಸಿ, ನಂತರ ಕಾಯಿ ತುಣುಕುಗಳನ್ನು ಸುರಿಯಿರಿ, ಮೃದುಗೊಳಿಸಿದ ಕೆನೆ ಬೆಣ್ಣೆಯನ್ನು ಸೇರಿಸಿ ಮತ್ತೊಮ್ಮೆ ತುಪ್ಪಳ ಸೇರಿಸಿ."
266,ಹೊಡೆಯುವವರಿಗೆ ಕಾಯಿ ಸಿಗದಂತೆ ಆಟವಾಡಿಸುತ್ತಾರೆ.
267,ಕಡಲೆ ಕಾಯಿ ತಿಂದ ಮೇಲೆ ನೀರು ಕುಡಿಯಬಾರದು ಏಕೆಂದರೆ ಕಡಲೆ ಕಾಯಿಯಲ್ಲಿ ಹೆಚ್ಚಿನ ಕೊಬ್ಬಿನ ಅಂಶವಿದ್ದು ಇದನ್ನು ತಿಂದ ತಕ್ಷಣ ನೀರು ಕುಡಿದರೆ ಕೊಬ್ಬಿನ ಅಂಶ ಆಹಾರ ದೇಹದಲ್ಲಿ ಕೊಬ್ಬಿನ ಅಂಶ ಹೆಚ್ಚಿಸುತ್ತದೆ ಎಂದು ಹೇಳಲಾಗುತ್ತದೆ .
268,ಅದು ಸತತ ಮೂರು ತಿಂಗಳ ಕಾಲ ಕಾಯಿ ನೀಡಿತು.
269,ಕೊನೆಯ ಹಂತದಲ್ಲಿ ಬೋಲ್ಟ್ ಕೊರೆಯಲಾಗುತ್ತದೆ ರಂಧ್ರದ ಮೂಲಕ ಅಳವಡಿಸಲಾದ ಮತ್ತು ಒಂದು ಕಾಯಿ ಜೊತೆ ನಿವಾರಿಸಲಾಗಿದೆ.
270,"ದಿನನಿತ್ಯ ನಗರದ ಕ್ರೀಮ್ಕಾರ್ನರ್ ದಿಂದ ಆನಂದ ಟಾಕೀಜ ರಸ್ತೆ, ಬಾಫನಾ ಚೌಕದಿಂದ ತೆಂಗಿನ ಕಾಯಿ ಕೂಟ, ಅಪ್ಸರಾ ಕೂಟದಿಂದ ಶಿಂಧಿಕೂಟ, ಬಸ್ನಿಲ್ದಾಣದಿಂದ ಅಪ್ಸರಾ ಕೂಟ, ಸಂಗೋಳ್ಳಿ ರಾಯಣ್ಣ ಸರ್ಕಲ್ದಿಂದ ಹನಮಂತ ದೇವರ ಗುಡಿ, ಹೀಗೆ ಪ್ರಮುಖ ಬೀದಿಗಳನ್ನು ಒಳಗೊಂಡ ಹಲವಾರು ಮಾರ್ಗಗಳು ಜನದಟ್ಟನೆ ಹಾಗೂ ವಾಹನಗಳಿಂದ ತುಂಬಿ ತುಳುಕುತ್ತಿವೆ."
271,"ಪಲ್ಲಕ್ಕಿಯವರು ದೇವರನ್ನು ಗದ್ದುಗೆಯಲ್ಲಿ ಕೂರಿಸಿ ಹಣ್ಣು, ಕಾಯಿ ಇತ್ಯಾದಿಗಳನ್ನು ಅರ್ಪಿಸಿ ಪೂಜಿಸುತ್ತಾರೆ."
272,"ಅನೇಕ ಸಸ್ಯ ಆಮ್ಲಗಳು, ವಿಟಮಿನ್ಗಳು, ಈ ಕಾಯಿ ಸಂಯೋಜನೆಯಲ್ಲಿ ಲೋಹ ಧಾತುಗಳನ್ನು ಇರುವುದರಿಂದ ಪ್ರಯೋಜನಕಾರಿಯಾಗುವ ಅಂಶಗಳಿಗೆ, ಹೇಳಲಾಗದ."
273,"ಇದರಲ್ಲಿ ನೀರಿನಂಶ ಹೆಚ್ಚಾಗಿರುವುದರಿಂದ ದೇಹವನ್ನು ತಂಪಾಗಿಡುತ್ತದೆ, ದಿನಕ್ಕೆ ಒಂದು ಚಿಕ್ಕ ಸವತೆ ಕಾಯಿ ಸೇವಿಸಿದರೆ ಈ ಬೇಸಿಗೆಯಲ್ಲಿ ತುಂಬಾ ಒಳ್ಳೆಯದು."
274,ತೆಂಗಿನ ಕಾಯಿ ಒಡೆದ ಮೇಲೆ ನೀರು ಚೆಲ್ಲುತ್ತೀರಲ್ಲಾ?
275,"ಮಾಲೂರು, ಕೋಲಾರ, ನೆಲಮಂಗಲ, ಹೊಸಕೋಟೆ ಸೇರಿದಂತೆ ಇನ್ನಿತರೆ ಭಾಗಗಳಿಂದ ಬೂದುಕುಂಬಳ ಕಾಯಿ ಬರುತ್ತದೆ."
276,"ಹೀಗೆ ಹೊಸದಾಗಿ ಬೇರೆ ಕಾಂಡ ಬಂದು, ಕಾಯಿ ಕಟ್ಟಿ ಬಲಿಯಲು ಹೆಚ್ಚು ಸಮಯ ಬೇಕಾಗುತ್ತದೆ."
277,"ಒಂದೇ ಸೀಸನ್ನಿನಲ್ಲಿ ಒಂದೇ ಮರದಲ್ಲಿ ಒಂದೇ ಬಾರಿಗೆ ಸಾವಿರಾರು ಮಾವಿನ ಕಾಯಿ ಬಿಟ್ಟಿದ್ದರೆ ಅದೊಂದು ದಾಖಲೆ, ಒಂದೇ ಗೊಂಚಲಲ್ಲಿ ನೂರು ಕಾಯಿ ತೂಗಾಡುತ್ತಿದ್ದರೆ ಅದೂ ಕೂಡ ದಾಖಲೆಯೆ."
278,ಸಿರ್ಸಿಯಿಂದ ಬರುತ್ತ ಕಾಯಿ ಚಿಕ್ಕು ಕೊಯ್ದು ಕಾರ್ಟನ್‌ಗಳಲ್ಲಿ ತುಂಬಿಸಿ ನಮ್ಮೂರಿಗೆ ತಕ್ಕೊಂಡು ಬರುತ್ತಿದ್ದೆವು.
279,ಇನ್ನು ಕೆಲವು ವ್ಯಾಪಾರಿಗಳಿಗೆ ರೈತರೇ ಕಾಯಿ ಸುಲಿಸಿ ಕೊಡಬೇಕು.
280,"ಪಡುವಣ ದಿಕ್ಕಿನ ಗಾಳಿ ಬೀಸಿದಷ್ಟು ಈ ಹತ್ತಿ ಹೆಚ್ಚು ಹೂವು, ಕಾಯಿ ಬಿಡುತ್ತಿತ್ತು."
281,ಪರಾಗಸ್ಪರ್ಶ ಮಾಡಿದ ಕಾಯಿ ಚೆನ್ನಾಗಿ ಬೆಳೆದು ಹಣ್ಣಾದ ತಕ್ಷಣ ಅದನ್ನು ಕಟಾವು ಮಾಡಿ ಬೀಜ ತೆಗೆದು ತೊಳೆಯಬೇಕು.
282,ಇದರಿಂದ ಕಾಯಿ ನಿರೀಕ್ಷಿತ ಗುಣಮಟ್ಟ ಹೊಂದಿರುವುದಿಲ್ಲ.
283,ತೊಂಡೆ ಕಾಯಿ
284,ಕುಂಬಳ ಕಾಯಿ ಬೆಳೆಯುವುದರಿಂದ ಅವರಿಗೆ ಕುಂಬಳಕಾಯಿ ಶಿವರಾಮೇಗೌಡರೆಂಬ ಹೆಸರು ಬಂದಿದೆ.
285,"ಯಾವ ಚಳವಳಿ ಸಾಂಸ್ಕೃತಿಕ ನಡೆಯಾಗಬೇಕಾಗಿತ್ತೋ ಆ ಚಳವಳಿಯ ಬೇರು ಮರೆತು ಮರದ ಕಾಯಿಗಳನ್ನಷ್ಟೇ ಕಣ್ಣಿಗೆ ತುಂಬಿಕೊಂಡವರು, ಹಣ್ಣು ಕಾಯಿ ಮಾರಿಕೊಳ್ಳುವ ದಲ್ಲಾಳಿಗಳಾಗಬಹುದಷ್ಟೇ ಹೊರತು ಈ ನೆಲೆಯ ತುರ್ತಿನ ಬೇಡಿಕೆಯಾಗಿರುವ ಪ್ರಜಾತಾಂತ್ರಿಕ, ಸಾಂಸ್ಕೃತಿಕ ನೊಗ ಹೊರುವ ಬೇಸಾಯಗಾರರಾಗುವುದು ಕಷ್ಟ."
286,"ಇವತ್ತು ಒಂದು ಕಾಯಿ ತಿನ್ನುತ್ತೇನೆ, ನಾಳೆಯಿಂದ ತಿನ್ನುವುದಿಲ್ಲ ಎಂದು ಹೇಳಿಕೊಂಡು ಮತ್ತೆ ಹೊಟ್ಟೆ ತುಂಬ ತಿಂದು ನೋವು ಅನುಭವಿಸುತ್ತದೆ."
287,"ಆದರೆ ಚಿಗುರೊಡೆದಾಗ, ಮೊದಲ ಹೂವು ಬಿಟ್ಟಾಗ, ಕಾಯಿ ಕಾಣಿಸಿಕೊಂಡಾಗ, ಅದನ್ನು ಕಿತ್ತು ಅಡುಗೆ ಮನೆಗೆ ತಂದಾಗ ಆಗುವ ಆನಂದ ಕೋಟಿ ಕೊಟ್ಟರೂ ಸಿಗದು."
288,ಸುಗ್ಗಿ ಕಾಲದಲ್ಲಿ ಇರುವ ಬೆಲೆಗೆ ಕಾಯಿ ಕೊಂಡು ಹಣ್ಣು ಮಾಡಿಸಿ ಕಾಯ್ದಿಟ್ಟು ಮುಂದೆ ಬೆಲೆ ಬಂದಾಗ ಮಾರುವುದು ವಾಡಿಕೆ.
289,ಹೂ ಕಾಯಿ ತಂದೂs
290,"ಗೆಳೆಯರಿಗೆ ಆಗ ತೋಟದ ತೆಂಗಿನಕಾಯಿಗಳನ್ನು ಸರಸರನೆ ಮರವೇರಿ ಅವರನ್ನು ಗಿಡದಿಂದ ದೂರ ಸರಿಸಿ, ಕಾಯಿ ಕೆಳಗೆ ಕೆಡವಿ ಚಕಚಕನೆ ಕಡಿದು ಕೊಡುತ್ತಿದ್ದ."
291,ಸಾಮಾನ್ಯವಾಗಿ ಹುಣಸೆ ಕಾಯಿ (ತಿರುಳು) ಹಣ್ಣಾಗುವ ಮೊದಲು ಬಿಳಿ ಬಣ್ಣದಲ್ಲಿರುತ್ತದೆ.
292,ಕಾಯಿ ದುಂಡು ದುಂಡಾಗಿ ನಿಗದಿತ ವ್ಯಾಸವನ್ನು ಹೊಂದಿರಬೇಕು.
293,ಕೆಂಪು ಮೆಣಸಿನ ಕಾಯಿ
294,ರಾಮಜಮ್ಮ ಎಂಬವರ ತೋಟದಲ್ಲಿ ತೆಂಗಿನ ಕಾಯಿ ಕೊಯ್ಲು ಮಾಡುತ್ತಿದ್ದಾಗ ಆಕಸ್ಮಿಕವಾಗಿ ಏಣಿ ಜಾರಿ ವಿದ್ಯುತ್ ತಂತಿ ಮೇಲೆ ಬಿದ್ದು ಈ ದುರ್ಘಟನೆ ನಡೆದಿದೆ.
295,"ಎಲ್ಲಾ ಅತ್ಯುತ್ತಮ, ಈ ಕಾಯಿ ಚೆರಿ ಸೇರಿಕೊಂಡು (ಚೆರಿ ಅಥವಾ ನೈಜ ಚೆರ್ರಿ - ಇದು ನನಗೆ ಪ್ರತಿ ವಿಶೇಷ ಬಗೆಹರಿಸುವ)."
296,ಗುರಿಕಟ್ಟಿ ಪಿಕ್ಕಿ ಉರುಳಿಸಿದವನು ಪಡೆದ ಕಾಯಿಗಳ ಅರ್ಧ ಕಾಯಿ ತಾನು ಪಡೆಯುತ್ತಾನೆ.
297,ವರ್ಷದ 3 ತಿಂಗಳು ಹೊರತುಪಡಿಸಿದರೆ ಉಳಿದೆಲ್ಲ ಕಾಲವೂ ಕಾಯಿ ಲಭ್ಯ.
298,(ಮಕ್ಕಳಿಗೆ ಜನ ಗದರಿ ಅತ್ತ ದೂಡಿ ಒಬ್ಬೊಬ್ಬರಾಗಿ ಆನೆ ಸೊಂಡಿಲಿಗೆ ಭಕ್ತಿಯಿಂದ ಕಾಯಿ ಕೊಡುತ್ತಲೂ ಆನೆ ಅವುಗಳನ್ನು ಎತ್ತೆತ್ತಿ ಮಾವುತನಿಗೆ ಕೊಡುತ್ತದೆ.
299,ಕಾಯಿ ತುರಿ-1 ಕಪ್‌ಬೆಲ್ಲದ ಪುಡಿ-1 ಕಪ್‌
300,"ಪ್ರಾರಂಭದ ಮೂರು-ನಾಲ್ಕು ತಿಂಗಳವರೆವಿಗೂ ಮಿಶ್ರಬೆಳೆಯಾಗಿ ಚೆಂಡು ಹೂ, ಕಲ್ಲಂಗಡಿ, ಹಸಿಮೆಣಸಿನ ಕಾಯಿ ಹೀಗೆ ಹಲವಾರು ಬೆಳೆಗಳನ್ನು ಬೆಳೆದು ಹಣ ಮಾಡಿದ್ದಾರೆ."
301,"ಕೇಪು ಪಿಲಿಚಾಮುಂಡಿ ದೈವದ ಬಾರಣೆಯ ವೇಳೆ ಗೆರಸೆಯಲ್ಲಿ ಅವಲಕ್ಕಿ, ಅರಳು, ತೆಂಗಿನ ಕಾಯಿ ತುಂಡು, ಸುಲಿದ ಬಾಳೆಹಣ್ಣು, ತುಪ್ಪ, ಜೇನುತುಪ್ಪ ಇತ್ಯಾದಿಗಳನ್ನು ಸೇರಿಸಿ ಬೆರಸಿ ಇರಿಸಲಾಗುತ್ತದೆ."
302,"ಹೊಸ್ತು (ಬೆಲ್ಲ ಹಾಕದ ಕಾಯಿ ಪಾಯಸ), ಸುಗ್ಗಿ ಹಬ್ಬ, ಸಂಕ್ರಾಂತಿ, ಉಗಾದಿ ಎಲ್ಲವನ್ನೂ ಆಚರಿಸುತ್ತಾರಾದರೂ ಎಲ್ಲ ಹಬ್ಬಗಳಲ್ಲಿ ಪುರುಷರದೇ ಪ್ರಧಾನಪಾತ್ರವಾಗಿದ್ದು, ಪೂರಕ ಸಹಾಯ ಹಾಗೂ ಕಜ್ಜಾಯದ ಊಟ ಸಿದ್ಧತೆ ಮಾತ್ರಮಹಿಳೆಯದಾಗಿರುತ್ತದೆ."
303,ಅಲ್ಲದ ಬಿಟ್ಟಿರೋ ಕಾಯಿ ಸೈತ ಕರ್ರಗಾಗಿ ಉದುರಿ ಬೀಳಾಕತ್ತಾವು.
