Index,Sentence
292,ಅವರ ಸಾಹಿತ್ಯ ಕೃಷಿಯೂ ಅಪಾರವಾಗಿದೆ ಮತ್ತು ನಾಡು ನುಡಿ ಹಾಗೂ ಸಂಸ್ಕೃತಿಯನ್ನು ಕಟ್ಟುವಲ್ಲಿ ಅವರ ಸಾಹಿತ್ಯ ಸಹಕರಿಸಿದೆ.
293,"ಮಾತಿನಲ್ಲಿ ಜೀವಂತವಾಗಿ ಶತಮಾನಗಳಿಂದ ಬೆಳೆದಿರುವ ನಮ್ಮ ನುಡಿ ಎಲ್ಲರ ಕಣ್ಣಿಗೂ ಉಜ್ವಲವಾಗಿ ದೊರಕುವಂತೆ, ಈ ನುಡಿಯಮೂಲಕ ಜಗತ್ತಿನ ಅತ್ಯುತ್ತಮ ಗ್ರಂಥಗಳ ಅರಿವು ದೊರಕುವಂತೆ ಮಾಡುವ ಜ್ಞಾನಯಜ್ಞದ ದೀಕ್ಷೆ ತೊಡಬೇಕು."
294,"ಅವರು ಇದಕ್ಕೆ ಹೂಡುವ ಹಂಚಿಕೆ, ಕೊಡುವ ಹಂಚಿಕೆ ಏನಪ್ಪ ಅಂದರೆ ಬೇರೆ ಭಾಷೆಯ ಪದಗಳನ್ನು ನಾವು ಬಳಸುವುದರಿಂದ ನಮ್ಮ ನುಡಿ ಬೆಳೆಯುತ್ತೆ."
295,ಅಲ್ಲಮನ ಈ ಒಂದು ವಚನದ ಮೂಲಕ ಬದುಕಿನ ತತ್ವ ಹಾಗೂ ನುಡಿ ತತ್ವಗಳ ನಡುವಣ ನಂಟಸ್ತಿಕೆಯನ್ನು ನಿರ್ವಚಿಸಬಹುದು.
296,ಅವರು ತಾವು ಓದಿದ ಯೋಗಿಯ ಆತ್ಮ ಕಥೆ ಪುಸ್ತಕದಲ್ಲಿನ ಒಂದು ನುಡಿ ಮರಳಿನ ಮಧ್ಯೆ ಸಕ್ಕರೆ ಕಣಗಳಿರುತ್ತವೆ.
297,ಪಟ್ಟಣದ ರೋಟರಿ ಭವನದಲ್ಲಿ ಮಂಗಳವಾರ ಏರ್ಪಡಿಸಿದ್ದ ಅಮ್ಮ ನುಡಿ ನಮನ ಕಾರ್ಯಕ್ರಮದಲ್ಲಿ ಅಮ್ಮನ ನೆನಪು ಪುಸ್ತಕ ಕುರಿತು ಅವರು ಮಾತನಾಡಿದರು.
298,ಕಾಂತೆಯಳ ನುಡಿ ಕೇಳದೀಪರಿ |
299,"ಪ್ರದೀಪರಿಂದ ಪುಷ್ಪ, ದೀಪ, ನುಡಿ ನಮನ ಕಾರ್ಯಕ್ರಮ ನಡೆಯಿತು."
300,ನೆಲದ ನಡೆ ನುಡಿ ಚರ್ಚೆಗೆ ವೇದಿಕೆ ಆಗಬೇಕು ಎಂಬುದಕ್ಕೆ ಈ ಸಮ್ಮೇಳನದಲ್ಲಿ ನಿಗಧಿಯಾಗಿರುವ ವಿಷಯಗಳು ತೋರಿಸಿ ಕೊಡುತ್ತಿವೆ.
301,Home ಕನ್ನಡ ವಾರ್ತೆಗಳು ಕರ್ನಾಟಕ ಸಂಪುಟದಿಂದ ಅಂಬರೀಷ್ ರನ್ನು ಕೈ ಬಿಟ್ಟದ್ದಕ್ಕೆ ಸುಮಲತಾರ ನೋವಿನ ನುಡಿ ಇಲ್ಲಿದೆ…
302,ಆಗಲಿಂದ ನಾನು ಮಂತ್ರ ಮಾಂಗಲ್ಯನೇ ಆಗ್ತೀನಿ ಇವರೇ ಮಾಡಿಸಬೇಕು ಅಂತ ಯೋಚಿಸಿದ್ದೆ ಅಷ್ಟೇ ಅವತ್ತಿನ ನನ್ನ ಯೋಚನೆ ಬದಲಾಗಲೇ ಇಲ್ಲ ಅದಕ್ಕೆ ಕಾರಣ ಪುಟ್ಟಣ್ಣಯ್ಯರ ಹೋರಾಟ ನಡೆ ನುಡಿ ಸಿದ್ದಂತ ಮತ್ತು ಅವರ ಯೋಚನೆ ಯೋಜನೆಯಲ್ಲಿದ್ದ ಪ್ರಾಮಾಣಿಕತೆ …… ಹೀಗೆ ಹೇಳ್ತಾ ಹೋದ್ರೆ ಒಂದಾ ಎರಡ….
303,"ಅವರು ಹರಿಪಾದ ಸೇರಿದ ಬಳಿಕ ಕೊಲ್ಯ ಶ್ರೀ ಕ್ಷೇತ್ರ ಶೂನ್ಯವಾಗಿದೆಯಾದರೂ, ಅವರು ಅನುಸರಿಸಿದ ನಡೆ, ನುಡಿ ನಮಗೆ ಮಾದರಿಯಾಗಬೇಕು ಎಂದು ತಿಳಿಸಿದರು."
304,"ನುಡಿ ಎಂದರೆ ಅದು ಕೇವಲ ನಾಲಗೆಯನ್ನು ಬಳಸಿಕೊಂಡು ಬಾಯಿಯ ಮೂಲಕ ಹೊರಹಾಕುವ ಶಬ್ದಕ್ಕೆ ಮಾತ್ರ ಸೀಮಿತಗೊಳಿಸದೆ, ಬರಹಗಾರರೆಂಬ ಪಟ್ಟಗಿಟ್ಟಿಸಿಕೊಳ್ಳಲು ಕಾತುರರಾಗಿರುವ ನಾವು, ನಮ್ಮ ಬರಹಗಳಲ್ಲೂ ಮೂಡಿಬರುವ ಅಕ್ಷರಗಳೂ ಕೂಡ ನುಡಿಗಳು ಎಂಬುದನ್ನು ಮನವರಿಕೆ ಮಾಡಿಕೊಂಡಿಲ್ಲ ಎಂದರೆ ತಪ್ಪಾಗಲಾರದೇನೋ."
305,ಒಂದೆಡೆ ಕನ್ನಡ ನಾಡು ನುಡಿ ಸಂಸ್ಕೃತಿ ಉಳಿಸಿ ಎಂಬ ಮೊರೆ.
306,ಮೊದಲನೆಯ ಗೋಷ್ಟಿಯಲ್ಲಿ ಆಶಯ ನುಡಿ ಹಾಗೂ ಸಂಪನ್ಮೂಲ ವ್ಯಕ್ತಿಯಾಗಿ ಕೊಲ್ಲಾಪುರದ ಶಿವಾಜಿ ವಿಶ್ವವಿದ್ಯಾಲಯದ ನಿವೃತ್ತ ಅರ್ಥಶಾಸ್ತ್ರ ಪ್ರಾಧ್ಯಾಪಕ ಪ್ರೊ.
307,ಒತ್ತಿ ನಿನ್ನಯ ಮನದ ಹವಣಱಿಯಲೆಂದು ನುಡಿ
308,ಫುಟ್‌ಬಾಲ್ ಜಗತ್ತಿನಲ್ಲಿ ಇವರು ಭರವಸೆಯ ಆಟಗಾರ ಆಗಲಿದ್ದಾರೆ ಎಂದು ಸಹ ಆಟಗಾರರು ಆಗಲೇ ನುಡಿ ದಿದ್ದರು.
309,"ಕನ್ನಡ ನುಡಿ ನಮ್ಮೆದೆಯ ನುಡಿಯಾಗಿ, ನಮ್ಮರಸುಮುಡಿಯಾಗಿ."
310,"ತಾಯಿ, ಜನ್ಮ ಭೂಮಿ ಹಾಗೂ ತಾಯಿ ನುಡಿ ಸ್ವರ್ಗಕ್ಕೆ ಮಿಗಿಲು ಎಂದರು."
311,"ಮಂಗಳೂರು ಪಶ್ಚಿಮ ವಲಯ ಐಜಿಪಿ ಅರುಣ್ ಚಕ್ರವರ್ತಿ, ನಿವೃತ್ತ ಪೊಲೀಸ್ ಹೆಡ್‌ಕಾನ್ಸ್‌ಸ್ಟೇಬಲ್ ದಯಾನಂದ, ಹಿರಿಯ ಪತ್ರಕರ್ತ ಪುಟ್ಟಸ್ವಾಮಿ, ವಿಜ್ಞಾನಿ ಮುತ್ತುರಾಮನ್, ಅನಿವಾಸಿ ಭಾರತೀಯ ಜಿಜಿಲ್ ರಾಮಕೃಷ್ಣ, ಬೆಂಗಳೂರಿನ ನ್ಯಾಶನಲ್ ಕಾಲೇಜಿನ ಉಪನ್ಯಾಸಕರಾದ ಮೌಲೇಶ್, ಪ್ರಮೋದ್ ಮುತಾಲಿಕ್, ಸುಬ್ಬಾ ರಾವ್, ಹಿರಿಯ ಐಪಿಎಸ್ ಅಧಿಕಾರಿ ದೀಪಿಕಾ ಸೂರಿ, ಎಡಿಜಿಪಿ ರವೀಂದ್ರನಾಥ್, ಬೆಂಗಳೂರಿನ ಕಾಲೇಜು ಸಹಪಾಠಿ ತಾರಕೇಶ್ವರ, ದೆಹಲಿಯ ಕಾಲೇಜು ಸಹಪಾಠಿ ಐವನ್ ಲೋಬೋ, ಹೆಚ್ಚುವರಿ ಪೊಲೀಸ್ ಅಧೀಕ್ಷಕಿ ನಂದಿನಿ ನುಡಿ ನಮನ ಸಲ್ಲಿಸಿದರು."
312,"ಕನ್ನಡದ ನಾಡು, ನುಡಿ ಏಳ್ಗೆಗೆ ಪ್ರತಿಯೊಬ್ಬರು ಕೈಜೋಡಿಸಬೇಕು ಎಂದರು."
313,ನಾಡು ನುಡಿ ಭಾಷೆ ಬಗ್ಗೆ ಪ್ರೀತಿ ಇರುವವರು ಇಂತಹ ಕೆಲಸ ಮಾಡೋದಿಲ್ಲ.
314,ಜಿಲ್ಲೆಯ ಹೂವಿನಹಡಗಲಿ ತಾಲೂಕಿನ ಸುಕ್ಷೇತ್ರ ಮೈಲಾರದಲ್ಲಿ ಇಂದು ಕಾರಣಿಕ ನುಡಿ ಮಹೋತ್ಸವ ನಡೆಯಿತು.
315,ಇನ್ನೇನು ನುಡಿ ರಾಯ ಧರ್ಮಸೆರೆಗಳ ಬಿಟ್ಟೆ | ಎಮ್ಮೊಳಗೆ ಗರ್ವ ನಡೆಸದೆ |
316,ಕೊನೆಯಲ್ಲಿ ನಗರದ ಶಾಲಾ ವಿದ್ಯಾರ್ಥಿಗಳಿಂದ ಕನ್ನಡದ ನುಡಿ ಮತ್ತು ಸಂಸ್ಕೃತಿಯ ವೈಭವವನ್ನು ಸಾರುವ ಆಕರ್ಷಕ ಹಾಡು-ನೃತ್ಯಗಳನ್ನೊಳಗೊಂಡ ಸಾಂಸ್ಕೃತಿಕ ಕಾರ್ಯಕ್ರಮವನ್ನು ಸಚಿವರು ವೀಕ್ಷಿಸಿದರು.
317,ನೊಂದವರ ನುಡಿ
318,"ಮಕ್ಕಳು ಶಿಕ್ಷಕರ ನಡೆ, ನುಡಿ ತಮ್ಮ ಜೀವನದಲ್ಲಿ ಅಳವಡಿಸಿಕೊಳ್ಳುತ್ತಾರೆ."
319,ಆದರೇ ಎಂತಹ ಅವ್ಯವಸ್ಥೆ: ಮಣಿಪುರ ವಿದ್ಯಾರ್ಥಿಯ ನೋವಿನ ನುಡಿ
320,ಕಣ್ಣೀರಿನ ನುಡಿ
321,ಓದುಗರು ತಮ್ಮ ಅಭಿಪ್ರಾಯಗಳನ್ನು ಯೂನಿಕೋಡ್‌ ಅಥವಾ ನುಡಿ ತಂತ್ರಾಂಶದಲ್ಲಿ ಈ ವಿಳಾಸಕ್ಕೆ ಕಳುಹಿಸಬಹುದು
322,"ರೋಹಿಣಿ ಬಯೋಟೆಕನ ಮಲ್ಲಪ್ಪ ಕಟ್ಟಿ ಮಾತನಾಡಿ, ಪ್ರಾಸ್ತಾವಿಕ ನುಡಿ ಹಾಗೂ ನಿರೂಪಣೆಯನ್ನು ಸಂಯುಕ್ತ ಕನರ್ಾಟಕ ವರದಿಗಾರ ಜಯರಾಮ ಶೆಟ್ಟಿ ಮಾಡುತ್ತ, ವರದಿಗಾರ ನಾರಾಣಗೌಡ ಉತ್ತಂಗಿ ಸ್ವಾಗತಿಸಿ ವಂದಿಸಿದರು."
323,ಇಂತೆಂದು ನಂದಿಕೇಶ್ವರ ಪೇಳ್ದ ನುಡಿ ಕೇಳಿ | ಕಾಂತೆ ಪಾರ್ವತಿ ಗಣರ ನೋಡಿ ||
324,ಕೆಜಿಎಫ್: ಗಡಿ ಪ್ರದೇಶಗಳಲ್ಲಿ ಭಾಷಾ ಸೌಹಾರ್ದ ಮೂಡಿಸುವ ಸಲುವಾಗಿ ರಾಜ್ಯದಾದ್ಯಂತ ಪ್ರವಾಸ ಕೈಗೊಳ್ಳಲಿರುವ ಕನ್ನಡ ನುಡಿ ತೇರಿಗೆ ನಗರದಲ್ಲಿ ಮಂಗಳವಾರ ಚಾಲನೆ ನೀಡಲಾಯಿತು.
325,ಕನ್ನಡ ಸಾಹಿತ್ಯ ಪರಿಷತ್‌ ತಾಲುಕಾಧ್ಯಕ್ಷ ನಾಗರಾಜ ದ್ಯಾಮನಕೊಪ್ಪ ಆಶಯ ನುಡಿ ಹೇಳಿದರು.
326,ಅಂದರೆ ನಾವು ಧೈರ್ಯದಿಂದ ಮುಂದೆ ಸಾಗಲು ಸಾಧ್ಯವಾಗುತ್ತದೆ ಎಂಬ ಕೋರಿಕೆಯನ್ನು ನಿಮ್ಮ ಮುಂದೆ ಈ ನುಡಿ ನಮನವನ್ನು ನೂರೊಂದು ಪ್ರಣಾಮಗಳೊಂದಿಗೆ ತಮಗೆ ಸಲ್ಲಿಸುತ್ತಿದ್ದೇವೆ.
327,"ನಾಡು, ನುಡಿ ಕಟ್ಟಲು ಜನರು ಒಂದಾದ ರೀತಿ ನನ್ನಲ್ಲಿ ಬೆರಗು ಹುಟ್ಟಿಸಿದೆ."
328,ನಗರದ ನಡೆ ನುಡಿ ಸಂಘಟನೆಯಿಂದ ನಡೆದ ನಮ್ಮ ನಡೆ ನುಡಿಯಲ್ಲಿ ಬಸವಣ್ಣ ಎಂಬ ಸಂವಾದ ಕಾರ್ಯಕ್ರಮದಲ್ಲಿ ಮಾತನಾಡಿದರು.
329,"5ರಿಂದ ಹುಬ್ಬಳ್ಳಿಯ ಕಿತ್ತೂರು ರಾಣಿ ಚನ್ನಮ್ಮ ಪ್ರತಿಮೆ ಬಳಿಯಿಂದ ಜಾಗೃತಿ ಕಾರ್ಯಕ್ರಮ ಆರಂಭಿಸಲಿದ್ದು, ವಿಶೇಷವಾಗಿ ಬೀದಿ ನಾಟಕಗಳ ಮೂಲಕ, ಶಾಲಾ ಕಾಲೇಜು, ರೈಲ್ವೆ, ಬಸ್ ನಿಲ್ದಾಣಗಳಲ್ಲಿ ಜನಜಾಗೃತಿ ನಡೆಸಲಿದ್ದು, ರಾಜ್ಯಾಧ್ಯಂತ ಈ ಬಗ್ಗೆ ಅಭಿಯಾನ ಕೈಗೊಂಡು ನಾಡು, ನುಡಿ ಜಲ, ಗಡಿ ವಿಚಾರದಲ್ಲಿ ಸ್ಪಷ್ಟ ನಿಲುವಿರುವ ರಾಜಕೀಯ ಪಕ್ಷಕ್ಕೆ ಮಾತ್ರ ಬೆಂಬಲ ನೀಡಲು ಜಾಗೃತಿ ಮೂಡಿಸಲಾಗುವುದು ಎಂದು ಸುದ್ದಿಗೋಷ್ಠಿಯಲ್ಲಿ ಸ್ಪಷ್ಟಪಡಿಸಿದರು."
330,"ಒಟ್ಟಾರೆ, ಈ ಬಾರಿಯ ಕಾರ್ಣೀಕ ನುಡಿ ಒಂದು ಶುಭದ ಸಂಕೇತ ಎನ್ನುವ ಚರ್ಚೆಯ ಮಾತುಗಳು ಕೇಳಿಬಂದವು."
331,ರ್ಪರ ನುಡಿ ದಿಟವೆಂದು ಮೂಢರವಂರಂತೂಳ್ವರ್ || ೧೯ ||
332,"ಅದು ಒಂದು ಪರಮಾನುಭವ, ಮಾತನ್ನು ಮೀರಿದ್ದು, ಅದರ ನುಡಿ ಅನುಭವಿಗಳ ಆಂತರ್ಯಕ್ಕೆ, ಒಳಕಿವಿಗೆ ಮಾತ್ರ ಕೇಳಿಸುವಂಥದ್ದು."
333,"ಆದ್ದರಿಂದ ಹಣೆಪಟ್ಟಿಗಿಂತ ಸಾಹಿತ್ಯ ಮತ್ತು ಕಾವ್ಯವೇ ಮುಖ್ಯವಾಗಿದೆ ಎಂದು ಕೊಣ್ಣೂರ ನುಡಿ ಸಡಗರದ ಸರ್ವಾಧ್ಯಕ್ಷ, ದಲಿತ ಮತ್ತು ಬಂಡಾಯ ಸಾಹಿತಿ ಡಾ."
334,"ರೈತನ ಈ ನೋವಿನ ನುಡಿ ನಮ್ಮ ರಾಜಕೀಯ ವ್ಯವಸ್ಥೆಯನ್ನು, ರಾಜಕಾರಣಿಗಳ ಮುಖವಾಡವನ್ನು ತೋರಿಸುತ್ತದೆ."
335,ನಾಡೋಜ ಹಂಪ ನಾಗರಾಜಯ್ಯ ಅಭಿನಂದನಾ ನುಡಿ ಆಡಲಿದ್ದಾರೆ ಎಂದು ಶಿವರಾಂ ತಿಳಿಸಿದರು.
336,ಇವರು ದಾಕ್ಷಿಣಾಪಥಕ್ಕೆ ಅರಸರಾಗಿದ್ದುದರಿಂದ ಆಂಧ್ರ ಎಂಬ ಹೆಸರು ಬಂದಿತೇ ಹೊರತು ಇವರ ನುಡಿ ತೆಲಗು ಎಂಬುದರಿಂದಲ್ಲ.
337,ಅಣ್ಣನಿಗೊಂದು ನುಡಿ ನಮನ
338,ಅಗಲಿದ ಚಂದ್ರಶೇಖರ ಪೂಜಾರಿಯವರಿಗೆ ನುಡಿ ನಮನ ಸಲ್ಲಿಸಿದ ಉಪ್ಪಿನಂಗಡಿ ಮೂರ್ತೆದಾರರ ಸೇವಾ ಸಹಕಾರಿ ಬ್ಯಾಂಕ್‌ನ ಮುಖ್ಯ ಕಾರ್ಯ ನಿರ್ವಹಣಾಧಿಕಾರಿ ಸದಾನಂದ ದಾಸರಮೂಲೆಯವರು ಮಾತನಾಡಿ ನನ್ನ ಬಾಲ್ಯದ ದಿನಗಳಿಂದಲೇ ಚಿರಪರಿಚಿತರಾಗಿದ್ದ ಚಂದ್ರಶೇಖರರವರ ನಿಧನದ ಸಂದರ್ಭದಲ್ಲಿ ಅವರ ಮನೆಗೆ ಭೇಟಿ ನೀಡಿದಾಗ ಅವರ ಎಲ್ಲಾ ಸಂಸಾರವೇ ಕಣ್ಣೀರಲ್ಲಿ ಮುಳುಗಿದ್ದನ್ನು ಕಂಡೆ ಇಂತಹ ಆತ್ಮೀಯ ವ್ಯಕ್ತಿತ್ವ ಕೆಲವರಲ್ಲಿ ಮಾತ್ರ ಇರುತ್ತದೆ.
339,Home ಕನ್ನಡ ವಾರ್ತೆಗಳು ರಾಷ್ಟ್ರೀಯ ಮಣಿಪುರ ಸಿಎಂ ಆಗುವೆ; ಎಎಫ್‌ಎಸ್‌ಪಿಎ ರದ್ದತಿಗೆ ನಿರ್ದೇಶಿಸುವೆ: ಇರೋಮ್‌ ಉಕ್ಕಿನ ನುಡಿ
340,ತಿರುಗತಿ ಬಾರದು ಕಾಣಣ್ಣ || ನುಡಿ ||
341,ಈ ಸಂಬಂಧಗಳಲ್ಲಿ ಯಾವುದು ಆ ನುಡಿ ಪ್ರಭೇದಗಳ ನಡುವೆ ಇದೆಯೆಂದು ತಿಳಿಯುವುದು?
342,"ಅಂದು ಬೆಳಿಗ್ಗೆ 10ಕ್ಕೆ ವಿಜಾಪುರದಿಂದ ಹೊರಡುವ ಈ ನುಡಿ ತೇರು ಮಧ್ಯಾಹ್ನ 1ಕ್ಕೆ ಇಂಡಿ ತಾಲ್ಲೂಕಿನ ಚಡಚಣ, 3ಕ್ಕೆ ಝಳಕಿ, ಸಂಜೆ 4ಕ್ಕೆ ಇಂಡಿ."
343,ಕೋಟಿ ವಿದ್ಯೆಗಿಂತ ಮೇಟಿವಿದ್ಯೆ ಮೇಲೆಂಬ ನುಡಿ ಅದೆಷ್ಟು ದಿಟವೆಂದು ಎಳೆಯ ಕೂಸಿಗೂ ಗೊತ್ತು.
344,"4) ವಿದ್ಯಾರ್ಥಿಗಳಿಗಾಗಿ, ಸ್ವಾಮಿ ವಿವೇಕಾನಂದರ ಸ್ಮರಣೀಯ ಮಾರ್ಗದರ್ಶನದ ನುಡಿ ಏನೆಂದರೆ,ನಾನು ಹೆಚ್ಚೆಚ್ಚು ಓದುತ್ತೇನೆ."
345,"ಸಹಬಾಳ್ವೆಯಿಂದ ಕೌಟುಂಬಿಕ, ಸಾಮಾಜಿಕ ನೆಮ್ಮದಿ – ಡಿವಿಜಿ ನೆನಪು-77ರಲ್ಲಿ ಸ್ವಾಮಿ ಜಪಾನಂದಜಿ ನುಡಿ"
346,"ಅಲ್ಲಿ ವಿಧಿಬದ್ಧವಾಗಿ ದೇವಿಯ ಮೂರ್ತಿಯನ್ನು ಹಾಲುಹಳ್ಳದಲ್ಲಿ ಪವಿತ್ರಸ್ನಾನ ಮಾಡಿಸಿ, ಅಲ್ಲಿ ಸಾಂಪ್ರದಾಯಿಕವಾಗಿ ಹಾಲು ಉಕ್ಕಿಸುವ ಕಾರ್ಯಕ್ರಮ ಹಾಗೂ ನುಡಿ ಹೇಳುವ ಕುರಿತಂತೆ ಹಲವಾರು ಪೂಜಾ ವಿಧಿವಿಧಾನಗಳು ನೆರವೇರಿದವು."
347,ಇದು ಕೆಣಕು ನುಡಿ ತಿರುಗಿದರೆ - ಇದು ಕೋಪ ಮತ್ತು ಗುಣ ಇಲ್ಲಿದೆ.
348,ಡಬ್ಬಿಂಗ್‌ ತಂತ್ರಜ್ಞಾನವನ್ನು ವಿರೋಧಿಸುತ್ತಾ ಕನ್ನಡ ಜಗತ್ತು ಪ್ರತ್ಯೇಕ ದ್ವೀಪವಾಗಿ ಕನ್ನಡಕ್ಕೆ ಕಂಟಕಪ್ರಾಯವಾಗದಿರಲಿ ಎಂಬ ಅವರ ನುಡಿ ಸತ್ಯವನ್ನು ಹೇಳಿದೆ.
349,ನಿಮ್ಮ ಸಂವೇದನಾಹೀನ ಅಮಾನವೀಯ ನಡೆ ನುಡಿ ಸಂಕಷ್ಟದಲ್ಲಿರುವ ಸಂತ್ರಸ್ತರ ಆತಂಕವನ್ನು ಹೆಚ್ಚಿಸಿದೆ.
350,ಚೆಂದದ ನುಡಿ ಕನ್ನಡ-ಗಂಧದಗುಡಿ ಕರ್ನಾಟಕ
351,"ಮತ್ತೊಂದು ಕಡೆ, ಸಮನ್ವಯ ಸಮಿತಿ ಅಧ್ಯಕ್ಷರಾದ ಸಿದ್ದರಾಮಯ್ಯ ಅವರ ನಡೆ- ನುಡಿ ಆತಂಕ ಹೆಚ್ಚಿಸುತ್ತಲೇ ಇದೆ."
352,ಊರಿನಲ್ಲಿ ಯಾವುದಾದರೂ ಅಸಂಭವವಾದದ್ದು ಆದರೆ ಸಿದ್ಧಲಿಂಗಪ್ಪನ ಮದುವೆ ಆದಂಗೆ ಬಿಡು ಎನ್ನುವ ನುಡಿ ಪ್ರಚಲಿತದಲ್ಲಿದೆ.
353,ಪಾರ್ವತಿ ರಮಣನು ನೀನಣ್ಣ || ನುಡಿ ||
354,ತಕ್ಕರೊರೆದ ಚೊಕ್ಕಳಿಕೆಯ ನುಡಿ ಕಿವಿಯಂ ಮಿಗೆ ಪುಗೆ ಮನದ |
355,"ಬಸವರಾಜ್ ಕೊಣ್ಣೂರ, ಕಾಲೇಜ್ ಆರಂಭಿಸಿ ತಮ್ಮ ಹುಟ್ಟಿದ ಹಬ್ಬದ ದಿನವನ್ನೇ ಕಳೆದ ಮೂರು ವರ್ಷಗಳಿಂದ ಕೊಣ್ಣೂರು ನುಡಿ ಸಡಗರ ಮಾಡಿಕೊಂಡು ಬರುತ್ತಿದ್ದಾರೆ."
356,ಕನ್ನಡ ನೆಲ ಜಲ ನುಡಿ ವಿಚಾರ ಬಂದಾಗ ಧ್ವನಿ ಎತ್ತುತ್ತಿದ್ದ ಮಹಾನ್ ವ್ಯಕ್ತಿ ಡಾ.
357,ಬುಡಕಟ್ಟು ಉಪ ಭಾಷೆ ಜೇನು ನುಡಿ ಮತ್ತದರ ಅಭಿವೃದ್ಧಿಗೆ ಪ್ರೋತ್ಸಾಹ ನೀಡಲಾಗುತ್ತಿದೆ.
358,ಭಾಷೆಗಿಂತ ನುಡಿ ಎಂಬ ಪದ ಕನ್ನಡವನ್ನು ಧ್ವನಿಸುತ್ತದೆ.
359,"ಕನ್ನಡರಾಜ್ಯೋತ್ಸವ ಅಂಗವಾಗಿ ಕನ್ನಡ ನಾಡು, ನುಡಿ ಬಿಂಬಿಸುವ ಆಕರ್ಷಕ ಸ್ತಬ್ಧಚಿತ್ರಗಳ ಮೆರವಣಿಗೆ, ವಿವಿಧ ಕಲಾತಂಡಗಳೊಂದಿಗೆ ನಗರದ ನೀಲಕಂಠೇಶ್ವರದೇವಸ್ಥಾನದ ಮುಂಭಾಗ ಕನ್ನಡಾಂಬೆ ಭುವನೇಶ್ವರ ಭಾವಚಿತ್ರಕ್ಕೆ ಪೂಜೆ ಹಾಗೂ ಪುಷ್ಪನಮನ ಸಲ್ಲಿಸಿ ನಂತರ ರಾಷ್ಟ್ರಧ್ವಜಾರೋಹಣ ನೆರವೇರಿಸುವ ಮೂಲಕ ಆರಂಭಿಸಲಾಯಿತು."
360,ಜಿಲ್ಲಾ ಕಾರ್ಯನಿರತ ಪತ್ರಕರ್ತರ ಸಂಘ ಮತ್ತು ಮಂಗಳೂರು ಪ್ರೆಸ್‌ಕ್ಲಬ್ ವತಿಯಿಂದ ನಡೆದ ನುಡಿ ನಮನ ಕಾರ್ಯಕ್ರಮದಲ್ಲಿ ಕಯ್ಯಾರರ ಭಾವಚಿತ್ರಕ್ಕೆ ಪುಷ್ಪ ನಮನ ಸಲ್ಲಿಸಿ ಅವರು ಮಂಗಳವಾರ ಮಾತನಾಡಿದರು.
361,ಮಹದೇವಪ್ರಸಾದ್ ಪುಣ್ಯ ಸ್ಮರಣೆ ನುಡಿ ನಮನ
362,ಈ ಇಬ್ಬರು ಸ್ವಯಂ ಘೋಷಿತ ದೇವಮಾನವರ ನಡೆ ನುಡಿ ಹಾಗೂ ಅವರ ಎದುರಿಸುತ್ತಿರುವ ಆರೋಪಗಳಲ್ಲೂ ಹೆಚ್ಚಿನ ಸಾಮ್ಯತೆ ಇದೆ.
363,ದಿದನಾದಂ ಸರಿವೋದನೆಂಬ ನುಡಿ ತಾನಿಲ್ಲೆಂದೊಡೆಲ್ಲಿತ್ತೊ ಗೆ
364,ಅಂದರೆ ಇನ್ನುಮುಂದೆ ನುಡಿ ತಂತ್ರಾಂಶವನ್ನು ಸಮುದಾಯದ ತಂತ್ರಜ್ಞರು ಸುಧಾರಿಸಬಹುದಾಗಿದೆ.
365,"ಭುಟಿಯಾ ಇದ್ದೆಡೆ ಮಿಂಚಿನ ಸಂಚಾರವಾದಂತೆ, ಎಂಬ ಅಭಿಮಾನಿಗಳ ನುಡಿ ಸುಳ್ಳಲ್ಲ."
366,"ಎರಡೂ ಧೀಮಂತ ನಾಯಕರುಗಳಿಗೆ ನುಡಿ ನಮನ,ಪುಷ್ಪ ನಮನ ಸಲ್ಲಿಸಲಾಯಿತು."
367,ಮುಂದಿನ ಪೀಳಿಗೆಗೆ ಅಲ್ಲಿನ ನಡೆ ನುಡಿ ಆಚಾರ ವಿಚಾರದ ಕುರಿತು ತಿಳಿದುಕೊಳ್ಳಲು ಇದು ಒಂದು ದಾರಿಯೂ ಆಗಲಿದೆ.
368,ನುಡಿ ಉಪಯೋಗಿಸುವ ಬಗ್ಗೆ ಆತ್ಮೀಯ ಕೆ.
369,ಸುತಿಯಂತೆ ನಾನು ಸಾರಾಂಶ ರುಚಿ ನುಡಿ ನಿನ್ನು
370,ಪುಷ್ಪಾಬಾಯಿ ಕೋರೆ ಪ್ರಾಸ್ತವಿಕ ನುಡಿ ಆಡಿದರು.
371,ಎಚ್ಚರಿಕೆಯ ನುಡಿ
372,ಕರ್ನಾಟಕ ಸಾಂಸ್ಕ್ಕತಿಕ ಪಂರಪರೆಯನ್ನೊಮ್ಮೆ ಸಿಂಹಾವಲೋಕನ ಮಾಡಿದಾಗ ಕನ್ನಡ ನಾಡು ನುಡಿ ಸಂಸ್ಕ್ಕತಿಯ ರ್ಕೀತಿ ಪತಾಕೇಯನ್ನು ಮುಗಿಲೆತರಕೇ ಹಾರಿಸಿ ಜನ್ಮ ಭೋಮಿಯ ರುಣ ತೀರಿಸಿದ ಅಪ್ರತಿಮ ಸಾದಕರ ಸಮೋಹದಲ್ಲಿ ಮೊದಲ ಪಂಕ್ತಿಯಲ್ಲಿ ಸಿಗುವ ವ್ರುತ್ತಿರಂಗಬೋಮಿ ನಟರೆದರೆ ಯಲಿವಾಳ ಸಿದ್ಯಯ್ಯನ್ನವರು ಕಲಾಕೇಸರಿ.
373,ಈ ಕೆಲಸದಲ್ಲಿ ಜಪಾನಿಯರು ಒಂದು ನುಡಿ ಸಮುದಾಯವಾಗಿ ತೊಡಗಿಕೊಂಡರು.
374,ಭವ : ಮೊದಲ ನುಡಿ (ಮೊದಲ ಮುದ್ರಣಕ್ಕೆ ಬರೆದ ಮುನ್ನುಡಿ)
375,ವಿಶ್ವಾಸ ವೈದ್ಯ ಮಾತನಾಡಿ ಇಂದಿನ ಕಾಂಗ್ರೆಸ್‌ ಪಕ್ಷಕ್ಕೆ ಸಿಕ್ಕಿರುವ ಬೆಂಬಲ ನೋಡಿದರೆ 11 ಸ್ಥಾನಗಳಲ್ಲಿ 8 ಸ್ಥಾನಗಳನ್ನಾದರೂ U್ವದ್ದೆ ಗೆಲ್ಲುತ್ತೆವೆ ಎನ್ನುವ ವಿಶ್ವಾಸದ ನುಡಿ ನುಡಿದಾಗ ಎಲ್ಲೆಡೆಯೂ ಕಾಂಗ್ರೇಸ್‌ ಪಕ್ಷಕ್ಕೆ ಜಯವಾಗಲಿ ಎನ್ನುವ ಹರ್ಷೋದ್ಘಾರವು ಕೇಳಿ ಬಂದಿತು.
376,"ಅಷ್ಟೇ ಯಲ್ಲದೆ, ಒಳನುಡಿಗಳಿಂದ ಹಿಡಿದು ಗ್ರಾಂಥಿಕ ಶೈಲಿಯವರೆಗಿನ ನುಡಿ ಚಳಕಗಳು ಇಲ್ಲಿಂದಲೇ ವಿಕಾಸಗೊಳ್ಳಬೇಕಿತ್ತು [ಖುಬ್ಚಂದಾನಿ:1983]."
377,೧೦ನೆಯ ನುಡಿ
378,ಕವಿಯ ಬರವಣೆಗೆಯು ಸಮಾಜದ ವಾಸ್ತವಿಕ ಚಿತ್ರಣ ನೀಡುವುದರ ಮೂಲಕ ಸಮಾಜವನ್ನು ಸುಧಾರಿಸುವಂತಿರಬೇಕೆಂದು ಹೇಳುತ್ತಾ ಕನ್ನಡ ನಾಡು ನುಡಿ ಸಂಸ್ಕೃತಿಯನ್ನು ಕಟ್ಟುವಂತಹ ಭಾವಿ ಶಿಕ್ಷಕರಾಗಿರೆಂದು ವಿದ್ಯಾರ್ಥಿಗಳಿಗೆ ಕರೆ ನೀಡಿದರು.
379,ನುಡಿ ಎಂಬುದು ಒಂದು ನಾಡಿನ ಜೀವದ್ರವ್ಯ.
380,ಹಿರಿಯರ ನುಡಿ ಗಳನ್ನು ಪಾಲಿಸಬೇಕಿದೆ.
381,ರಾ ಬೇಂದ್ರೆಯವರ 121ನೇ ಜನ್ಮ ದಿನಾಚರಣೆ ಅಂಗವಾಗಿ ಮಂಗಳವಾರ ಹಮ್ಮಿಕೊಂಡಿದ್ದ ಬೇಂದ್ರೆ ನುಡಿ ನಮನ ಕಾರ್ಯಕ್ರಮದಲ್ಲಿ ಅವರು ಮಾತನಾಡಿದರು.
382,ವೀರಸೋಮೇಶ್ವರರ ನುಡಿ
383,ಭೂಕಾಂತನಾದಪಂಗಡ ವಿಪ್ರರೆಂದ ನುಡಿ ತಪ್ಪದೆನ್ನಾತ್ಮಜರ್ಗೆ ||
384,ಒಳನುಡಿಗಳು ಕೇವಲ ನುಡಿ ಬಹುಳತೆಯನ್ನು ಮಾತ್ರ ಸೂಚಿಸಲಾರವು.
385,ನಾಡು – ನುಡಿ – ಸಂಸ್ಕೃತಿಯ ಅಭಿಮಾನವನ್ನು ತಮ್ಮ ನಾಟಕಗಳ ಮೂಲಕ ತುಂಬಿಕೊಟ್ಟ ನಲವಡಿಯವರ ಬದುಕನ್ನು ಚಿತ್ರಿಸುವಲ್ಲಿ ಡಾ.
386,", ನೇರ ನುಡಿ"
387,"ಮುಂತಾದ ಭಾಷೆಗಳ ಬೆನ್ನು ಹತ್ತಿದ ಪುರುಷನು ಮನೆಗೆ ಬಂದರೆ, ಯಾರಿದ್ದೀರಿ ಮನೆಯಲ್ಲಿ ಎನ್ನದ ಹೊರತು ಮೋಕ್ಷವಿಲ್ಲದಾದ ಮೇಲೆ ನುಡಿ ತಾಯಿಗೆ ಅಳಿಲು ಸೇವೆ ಆಯಿತಾದರೂ ಯಾರಿಂದ?"
388,ಶೋಭಾ ಮಹೇಶ ಪ್ರಾಸ್ತಾವಿಕ ನುಡಿ ಸಲ್ಲಿಸಿದರು.
389,"ಮಕ್ಕಳಿಗೆ ದಾಸತ ಕೀರ್ತನೆಗಳು , ಶರಣರ ವಚನಗಳು, ನುಡಿ ಮುತ್ತುಗಳನ್ನು ಬಾಲ್ಯದಲ್ಲಿಯೇ ಮಕ್ಕಳಿಗೆ ಭೋದನೆ ಮಾಡುತ್ತಿರುವುದು ಶಿಕ್ಷರರ ಜವಬ್ದಾರಿಯಾಗಿದೆ."
390,ನುಡಿ ಮುತ್ತುಗಳು !
391,ಅಕ್ಕಿಆಲೂರ: ಇಲ್ಲಿ ಇದೇ 10ರಿಂದ ಆರಂಭಗೊಳ್ಳಲಿರುವ 26ನೇ ವರ್ಷದ ಕನ್ನಡ ನುಡಿ ಸಂಭ್ರಮಕ್ಕೆ ಅಂತಿಮ ಹಂತದ ಸಿದ್ಧತೆಗಳು ಭರದಿಂದ ಸಾಗಿವೆ.
392,"ನಾಡು, ನುಡಿ ವಿಷಯದಲ್ಲಿ ಆಗಿರುವ ಕೆಲಸಗಳಿಗಿಂತ ಆಗಬೇಕಾಗಿರುವ ಕೆಲಸಗಳು ಬಹಳಷ್ಟಿದೆ."
