Index,Sentence
0,ಕೊನೆಯಲ್ಲಿ ವನಮಾಲೀ ಗದೀ ಶಾರ್ಙ್ಗೀ ಶಂಖೀ ಚಕ್ರೀ ಚ ನಂದಕೀ | ಶ್ರೀಮಾನ್ ನಾರಾಯಣೋ ವಿಷ್ಣುರ್ವಾಸುದೇವೋಽಭಿರಕ್ಷತು || ಎಂಬ ನುಡಿ ಪಠಿಸುವಾಗ ಮನೆಯ ವಾತವರಣವೇ ಬದಲಾಗಿತ್ತು.
1,ಕೆಲವು ಪತ್ರಿಕೆಗಳು ಸುದ್ದಿಯ ಜತೆಗೆ ನುಡಿ ನಮನವನ್ನೂ ಪ್ರಕಟಿಸಿವೆ.
2,ಮಾತೆ ನಿಮ್ಮಂು ನುಡಿ ತಪ್ಪಲರಿವುದುಂಟೆ |
3,ಕೃಷ್ಣಮ್‌ ವಂದೆ ಜಗದ್ಗುರು ನುಡಿ ಅದೆಷ್ಟು ಅನ್ವರ್ಥ.
4,"ಬಿಜೆಪಿ ಪ್ರಮುಖರು, ಗಣ್ಯರು, ವಿವಿಧ ಸಂಘಟನೆಗಳ ಪದಾ„ಕಾರಿಗಳು ಸೇರಿದಂತೆ ಸಾರ್ವಜನಿಕರು ನೂರಾರು ಸಂಖ್ಯೆಯಲ್ಲಿ ಸೇರಿ, ನುಡಿ ನಮನ ಸಲ್ಲಿಸಿದರು."
5,ಚನ್ನವೀರ ಶಿವಾಚಾರ್ಯರು ಅಭಿನಂದನಾ ನುಡಿ ನುಡಿದರು.
6,"ಇದರೊಂದಿಗೆ ಕನ್ನಡ ಸಾಹಿತ್ಯ, ಕಲೆ, ನಾಟಕ ಹಾಗೂ ನುಡಿ ವಿಚಾರವಾಗಿ ಹಲವಾರು ಯೋಜನೆ ನೀಡಿದ್ದರು ಎಂದು ಸ್ಮರಿಸಿದರು."
7,ಏನು ಬಂದೈ ತಮ್ಮ ನುಡಿ ನಿ | ನ್ನಾನನದ ಸಿರಿ ಕುಂದಿದೇತಕೆ |
8,ಭಾಪುಭಯಂಕರ | ಪಾಪವಿದೂರ ದ | ಯಾಪರ ಲಾಲಿಸು | ನಾ ಪೇಳುವ ನುಡಿ || ೬೩ ||
9,ಮತ್ತು 5ರಂದು ನುಡಿ ಜಾತ್ರೆ
10,ಇಂದಿನ ಲೇಖನದಲ್ಲಿ ಕಲಾವಿದರೊಂದಿಗೆ ನಮ್ಮ ತಂಡವು ಮಾಡಿರುವ ಸಂದರ್ಶನವನ್ನು ನಿಮ್ಮೆದುರು ಪ್ರಸ್ತುಪಡಿಸುತ್ತಿದ್ದು ಕಲಾವಿದರ ನೇರ ನುಡಿ ಮತ್ತು ಅವರ ಚಾಕಚಕತ್ಯತೆಯನ್ನು ಕಲಾ ರಸಿಕರು ಆಸ್ವಾದಿಸಬಹುದಾಗಿದೆ.
11,ಆ ಮುಂಚೆ ವಿಶ್ವಾಮಿತ್ರನು ನುಡಿದುದನ್ನು ಮಾತ್ರ ವಸಿಷ್ಠನ ನುಡಿ ಸ್ಥಿರೀಕರಿಸುತ್ತದೆ.
12,"ಆದರೆ, ಇಂತಹ ಪುರಾವೆಗಳು ಕನ್ನಡ ಬರಹ ಎಶ್ಟು ಹಳೆಯದು ಎಂಬುದನ್ನು ತಿಳಿಸಬಲ್ಲುವಲ್ಲದೆ ಕನ್ನಡ ನುಡಿ ಎಶ್ಟು ಹಳೆಯದು ಎಂಬುದನ್ನು ತಿಳಿಸಲಾರವು."
13,"ಬಳ್ಳಾರಿ, ಫೆಬ್ರವರಿ 04: ಬಳ್ಳಾರಿ ಜಿಲ್ಲೆಯ ಐತಿಹಾಸಿಕ ಸುಕ್ಷೇತ್ರ ಮೈಲಾರಲಿಂಗೇಶ್ವರನ ಕಾರ್ಣಿಕೋತ್ಸವ ನುಡಿ ಹೊರಬಿದ್ದಿದೆ."
14,ನಾಳೆ ಬೆಳಗ್ಗೆ ೧೧ ಕ್ಕೆ ಧಾರವಾಡದ ಸರ್ಕಾರಿ ಕಲಾ ಶಾಲೆಯಲ್ಲಿ ಆರ್ಯರಿಗೆ ನುಡಿ ನಮನವನ್ನು ಹಮ್ಮಿಕೊಳ್ಳಲಾಗಿದೆ
15,ಇತ್ತೀಚೆಗೆ ನಡೆದ ಬಾಗಲಕೋಟೆಯ ಕೊಣ್ಣೂರು ನುಡಿ ಸಡಗರದಲ್ಲಿ ಜಾದೂ ಮಾಡಿದ್ದಾರೆ.
16,"6: ನಾವೆಲ್ಲರೂ ಸೇರಿ ಕನ್ನಡ ಸಾಹಿತ್ಯ ಪರಿಷತ್ತು ಅಧ್ಯಕ್ಷರನ್ನು ಚುನಾಯಿಸಿರುವುದು ನಾಡು, ನುಡಿ ರಕ್ಷಣೆಗಾಗಿ."
17,"ಇದು ನೆರವಾಗಿದ್ದಾರೆ, ನೀವು ನೇರ ನುಡಿ ಇರುವ ವ್ಯಕ್ತಿ ಎಂದು ಹೇಳಬಹುದು."
18,ಕನ್ನಡ ಹಬ್ಬದಲ್ಲಿ ನುಡಿ ನಮನ
19,18ರಂದು ನುಡಿ ಕನ್ನಡ
20,"ಬೆಳೆಗಾವಿಯ ವಕೀಲರು, ಸಾಹಿತಿ, ಕನ್ನಡದ ನುಡಿ ಸೇವಕರಾದ ರವೀಂದ್ರ ತೋಟಿಗೇರ, ಕಳೆದ 25 ವರ್ಷಗಳಿಂದ ನಾಡು-ನುಡಿ ಸೇವಕರಾಗಿ, ಗಡಿ ಹೋರಾಟಗಾರರಾಗಿ, ಪತ್ರಕರ್ತರಾಗಿ ಸೇವೆ ಸಲ್ಲಿಸುತ್ತಿದ್ದಾರೆ."
21,ಮೇಲು ಕೋಟೆಯಿಂದ ದಾಸರ ನುಡಿ ಹೊತ್ತೊಯ್ಯಲಿರುವ ಪುರಂದರ ಜ್ಯೋತಿ | ThatsKannada.
22,ಪಾಟೀಲ ನುಡಿ
23,"ವಾಟಾಳ್ ನಾಗರಾಜ್ ಅವರು ಏಕಪಕ್ಷೀಯ ನಿರ್ಧಾರ ಮಾಡಿದ್ದಾರೆ ಎಂಬ ಆರೋಪಕ್ಕೆ ಉತ್ತರಿಸಿದ ಗಿರೀಶ್ ಅವರು, ಕನ್ನಡ ನಾಡು- ನುಡಿ ವಿಷಯದ ಹೋರಾಟಕ್ಕೆ ಪ್ರತಿಯೊಬ್ಬ ಹೋರಾಟಗಾರರು ಕೈ ಜೋಡಿಸಬೇಕು."
24,"ಹಣ್ಣಿಕೇರಿ ಅಧ್ಯಕ್ಷತೆ ವಹಿಸಿ ಮಾತನಾಡಿ, ಜೈನ ಸಮಾಜ ಸಂಸ್ಕ್ರತಿ, ಸಂಸ್ಕಾರಕ್ಕೆ ಹೆಸರುವಾಸಿಯಾಗಿದ್ದು ಪಾಲಕರು ಮಕ್ಕಳಿಗೆ ಉತ್ತಮ ನಡೆ ನುಡಿ ಕಲಿಸಿ ಸಾಧಕರನ್ನಾಗಿ ರೂಪಿಸಿದಾಗ ಮಾತ್ರ ಜೀವನ ಸಾರ್ಥಕವಾಗಲಿದ್ದು ಯುವಕರು ದುಶ್ಚಟಗಳನ್ನು ತೊರೆದು ಅಧ್ಯಾತ್ಮದತ್ತ ಒಲವು ತೋರಬೇಕೆಂದರಲ್ಲದೇ ಹಿರಿಯರ ಮಾರ್ಗದರ್ಶನ ಪಡೆಯಬೇಕು."
25,"ಕನ್ನಡ ನೆಲ, ಜಲ, ಭಾಷೆಯ ನುಡಿ ವಿಚಾರ ಬಂದಾಗ ಧ್ವನಿ ಎತ್ತುತ್ತಿದ್ದ ಮಹಾನ್ ವ್ಯಕ್ತಿ ಡಾ."
26,"ದೇವಾಸುರರಿಂದ ಸಮುದ್ರಮಥನವಾದ ಪೌರಾಣಿಕ ಘಟನೆಯನ್ನು ನೆನಪಿಗೆ ತರುವ ಆ ನುಡಿ ಪಾಂಡವ ಕೌರವರ ಸತ್ ಮತ್ತು ಅಸತ್ ಪಕ್ಷಗಳನ್ನು ನಮ್ಮ ಕಣ್ಮುಂದೆ ಚಿತ್ರಿಸಿ, ಅಸತ್ ಪಕ್ಷ ಮುಂದೆ ನಷ್ಟಗೊಳ್ಳುವುದನ್ನು ಈಗಲೇ ಧ್ವನಿಸುತ್ತದೆ."
27,ಸಮ್ಮೇಳನಾಧ್ಯಕ್ಷರ ನುಡಿ - ಡಾ.
28,"ಕೋಲಾರದ ಅಣ್ಣಿಹಳ್ಳಿ ಗ್ರಾಮದಲ್ಲಿಂದು ಮಾಧ್ಯಮದ ಜೊತೆ ಮಾತನಾಡಿದ ಅವರು, ಸಿದ್ದರಾಮಯ್ಯ ಹಾಗೆಲ್ಲ ಇನ್ನೊಬ್ಬರಿಗೆ ಮೋಸ ಮಾಡೋವವರಲ್ಲ, ನೇರ ನುಡಿ ಮನುಷ್ಯ, ದೊಡ್ಡ ಮನುಷ್ಯ, ಏಕ್ ಬಾಜಿ ಮನುಷ್ಯ ಹಾಗೆಲ್ಲಾ ಮೋಸ ಮಾಡೋವರಲ್ಲ ಎಂದು ಅವರು ತಿಳಿಸಿದರು."
29,ಅಂಬರೀಶ್ ನೀಡಿದ ಉಡುಗೊರೆ ಬಗ್ಗೆ ಯಶ್ ಭಾವುಕ ನುಡಿ
30,ಮುರಹರನ ನುಡಿ ಕೇಳಿ ನಾರದ |
31,"ಬಾಳುವುದೇತಕೆ ನುಡಿ ಎಲೆ ಜೀವ, ಸಿರಿಗನ್ನಡದಲಿ ಕವಿತೆಯ ಹಾಡೆ, ಸಿರಿಗನ್ನಡದೇಳಿಗೆಯನು ನೋಡೆ, ಕನ್ನಡ ತಾಯಿಯ ಸೇವೆಯ ಮಾಡೆ ಎನ್ನುವ ಕು."
32,ಗಿರಿರಾಜ್ ನುಡಿ : ಒಂದು ಕೃತಿ ಒಬ್ಬೊಬ್ಬರ ಓದು ಮತ್ತು ಮಾಗುವಿಕೆಯ ಅನುಸಾರವಾಗಿ ಅವರವರಿಗೆ ಬೇರೆ ಬೇರೆ ಅರ್ಥಗಳನ್ನ ಕೋಡುತ್ತದೆ.
33,ಕೇವಲ ಕರ್ತ್ಯವ್ಯವೆಂದು ಬಗೆದು ನಿನ್ನ ಕೆಲಸವನ್ನು ಮಾಡು ಎಂದು ಭಗವದ್ಗೀತೆಯ ನುಡಿ ನಮಗೆ ನಿರ್ದೇಶಿಸುತ್ತದೆ.
34,ಅವರ ನೇರ ನುಡಿ ಮತ್ತು ಸ್ವಭಾವ.
35,"ಕನ್ನಡ ನುಡಿ ದೀಪಕರು, ಇವರೇ ನಮ್ಮ ಕನ್ನಡ ಕಟ್ಟಾಳುಗಳು"
36,ವಚನಕಾರರ ನಡೆ ನುಡಿ ಸಿದ್ಧಾಂತ ಕೂಡ ನಮ್ಮ ಹಳ್ಳಿಗಾಡಿನ ಸುಸಂಸ್ಕೃತ ಜನರ ಜೀವನಕ್ರಮಕ್ಕೆ ಅನುಗಣವಾಗಿಯೇ ಇದೆ.
37,ಚಂದ್ರಯಾನ–1ರಲ್ಲಿ ಸಾಕಷ್ಟು ಪಾಠ ಕಲಿತು ಅದನ್ನು ಮಂಗಳಯಾನದಲ್ಲಿ ಬಳಸಿದ್ದರಿಂದ ಮಂಗಳ ನೌಕೆಯು ಇನ್ನೂ ಕಾರ್ಯ ನಿರ್ವಹಿಸುತ್ತಿದೆ ಎಂಬ ಅನುಭವದ ನುಡಿ ಅವರದು.
38,"ರವಿವಾರ ನಗರದ ನಯನ ಸಭಾಂಗಣದಲ್ಲಿ ಅಖಿಲ ಕರ್ನಾಟಕ ಕುವೆಂಪು ಸಾಂಸ್ಕೃತಿಕ ವೇದಿಕೆ ವತಿಯಿಂದ ಹಮ್ಮಿಕೊಂಡಿದ್ದ ಕನ್ನಡ ನುಡಿ ಹಬ್ಬ ಹಾಗೂ ಕದಂಬ ರತ್ನ ಪ್ರಶಸ್ತಿ ಪ್ರದಾನ ಸಮಾರಂಭದಲ್ಲಿ ಪಾಲ್ಗೊಂಡು ಮಾತನಾಡಿದ ಅವರು, ಶಿಕ್ಷಣದಿಂದ ಹಿಡಿದು ಜನರ ಆಡಳಿತ ಭಾಷೆವರೆಗೂ ಕೇಂದ್ರದಲ್ಲಿ ಅಧಿಕಾರ ನಡೆಸುತ್ತಿರುವ ಸರಕಾರ ಮಧ್ಯಪ್ರವೆೀಶ ಮಾಡುತ್ತಿದೆ ಎಂದು ದೂರಿದರು."
39,ಕನ್ನಡ ನಾಡು ನುಡಿ ಕುರಿತ ಗೋಷ್ಠಿಯಲ್ಲಿ ಮಾತಾಡಿದ ಕರ್ನಾಟಕ ಕೇಂದ್ರೀಯ ವಿಶ್ವವಿದ್ಯಾನಿಲಯದ ಪ್ರಾಧ್ಯಾಪಕ ಡಾ.
40,"ಪುರಸ್ಕೃತರ ಭಾವಚಿತ್ರಗಳು, ವಿಭಿನ್ನ ಪಾತ್ರಗಳಲ್ಲಿ ನಟಿಸಿದ ಡಾ| ವಿಷ್ಣು ಅವರ ಚಿತ್ರಗಳು ರಾರಾಜಿಸುತ್ತಿದ್ದರೆ, ಮುಂದೆ ತಾಯಿ ಭುವನೇಶ್ವರಿ ಮತ್ತು ಕನ್ನಡ ನುಡಿ ಮುತ್ತುಗಳು ಆಕರ್ಷಿಸುತ್ತಿವೆ."
41,ಗಂಟೆಗೆ ಸರಿಯಾಗಿ ತಂಬೂರಿ ನುಡಿ ಅಪ್ಪನ ಕಿವಿಗೆ ಬೀಳಲೇಬೇಕಿತ್ತು.
42,ನಮ್ಮ ನಡೆ ನುಡಿ ಜೀವನದ ಶ್ರೇಯಸ್ಸಿಗೆ ಸ್ಫೂತರ್ಿಯಾಗಬೇಕು.
43,ನಾವಾಡುವ ನುಡಿಯೇ ಕನ್ನಡ ನುಡಿ - (ಗಂಧದ ಗುಡಿ)
44,ಕೇಶವಮೂರ್ತಿ ಅವರ ನುಡಿ ನಮನ ಕರ್ಯಕ್ರಮದಲ್ಲಿ ಅವರ ಒಡ ನಾಡಿಗಳ ಸಿಕೆ ಅವರ ಜನಪರ ಕಾರ್ಯಗಳನ್ನು ಶ್ಲಾಘಿಸಿ ಕೊಂಡಾಡಿದರು.
45,"ಸಾಹಿತಿಗಳ, ಸಾಹಿತ್ಯ ಕೃತಿಗಳ, ಕನ್ನಡ ನುಡಿ ಸಂಪತ್ತಿನ, ವ್ಯಾಕರಣದ ಮಾಹಿತಿ ಸಂಚಂುು ರೂಪಿಸುವ ನಿಟ್ಟಿನಲ್ಲಿ ಬರಹಗಾರರು ಕೆಲಸ ಮಾಡಬೇಕು."
46,ದೊಡ್ಡಮಲ್ಲಯ್ಯ ಆಶಯ ನುಡಿ ಹಾಡಲಿದ್ದಾರೆ.
47,ಭಾಗವಹಿಸಬೇಕು ಉತ್ಸವ ನಮ್ಮ ನಾಡು ನುಡಿ ಹಾಗೂ ಸಂಸ್ಕ್ತ್ರತಿಯ
48,ಸಾಹಿತಿ ಶಂಕರ ಕುಕನೂರ ಕವನ ನುಡಿ ನಮನ ಸಲ್ಲಿಸಿದರು.
49,"ಮಾತೃವಾತ್ಸಲ್ಯದ ನಿನ್ನ ನುಡಿ ಸವಿಜೇನು,"
50,"ಕ್ರೀಡಾಂಗಣದಲ್ಲಿ ರೆಬಲ್ ಸ್ಟಾರ್ ಅಂಬರೀಶ್ ನುಡಿ ನಮನ ಕಾರ್ಯಕ್ರಮದಲ್ಲಿ ಮಾತನಾಡಿದ ಅವರು, ಅಂಬಿ ಮೃತಪಟ್ಟ ದಿನ 30 ಮಂದಿ ಕನಗನಮರಡಿ ಯಲ್ಲಿ ಸತ್ತಿದ್ದು, ಜೊತೆಗೆ ಇಬ್ಬರು ಅಭಿಮಾನಿಗಳು ಆತ್ಮಹತ್ಯೆ ಮಾಡಿಕೊಂಡಿದ್ದು ಬೇಸರದ ಸಂಗತಿ, ಮುಂದೆ ಯಾರೂ ಸಹ ಹೀಗೆ ಆತ್ಮಹತ್ಯೆ ಮಾಡಿಕೊಳ್ಳಬೇಡಿ, ಆತ್ಮಹತ್ಯೆ ಮೂಲಕ ಅಭಿಮಾನ ತೋರುವ ಅವಶ್ಯಕತೆ ಇಲ್ಲ ಎಂದರು."
51,ಆದ್ದರಿಂದಲೇ ಅವರು ನಾಡು – ನುಡಿ ಚಿಂತನೆಯ ಕಡೆಗೆ ತಮ್ಮನ್ನು ಹೊರಳಿಸಿಕೊಂಡದ್ದು.
52,ಯಾವ ಹೀರೋನನ್ನು ಕಳಪೆಯಾಗಿ ನೋಡಬೇಡಿ - ಸತೀಶ್ ನೋವಿನ ನುಡಿ
53,ಈ) ಬರಹ ಎಷ್ಟೇ ಗುಣಮಟ್ಟದ್ದಾಗಿದ್ದರೂ ಕಾಗುಣಿತದ ಬಗ್ಗೆ ತೀರ ತಾತ್ಸಾರವಿರುವ ಬರಹಗಾರರ ನುಡಿ ಕಾಣಿಕೆಗಳನ್ನು ಪ್ರಕಟಣೆಗೆ ಪರಿಶೀಲಿಸಲಾಗುವುದಿಲ್ಲ.
54,"ಅಂತಹ ಪುತ್ರಿಯನ್ನು ಪಡೆದ ಕನ್ನಡನಾಡು, ನುಡಿ ಧನ್ಯ."
55,"ಆದರೆ ಈ ನುಡಿ ಚಿಗುರುವಂತಾಗಲು ಆ ಸ್ಥಳಕ್ಕೆ ತಕ್ಕಂತೆ ಅಲ್ಲಿನ ಗಾಳಿನೀರು ಮಣ್ಣಿಗೆ ಅನುಗುಣ ಕಸಿಮಾಡಬೇಕಾಗಿದೆ, ಆಗ ಸಮಾನತೆ ಜೀವಾಡುತ್ತದೆ."
56,"ಕವಿರಾಜಮಾರ್ಗ ಕಂಡಂತೆ ಕನ್ನಡನಾಡು, ನುಡಿ ಮತ್ತು ಕನ್ನಡಿಗರು"
57,"ಮನೆಯಲ್ಲಿ ಮಕ್ಕಳ ಮೊದಲ ಮಾತು, ತೊದಲು ನುಡಿ ರಿಕಾರ್ಡ್ ಮಾಡಿಡುತ್ತಾರೆ."
58,"ಗೀತಾ ಮಹದೇವಪ್ರಸಾದ್ ಮತ್ತು ಕುಟುಂಬ ವರ್ಗದವರು, ನುಡಿ ನಮನವನ್ನು ಸಾಹಿತಿ ಪ್ರೊ."
59,ಈ ಗಾನದಲ್ಲಿರುವ ತನುಮನಪಟುತೆ ಎಂಬ ನುಡಿ ಬಹುಮುಖ್ಯವಾಗಿದೆ.
60,8ರಿಂದ ಸೂರ್ಯ ನಗರಿಯಲ್ಲಿ ನುಡಿ ಜಾತ್ರೆ
61,ಇಂಗ್ಲಿಶು ನುಡಿ ಸಂಪಾದಿಸಿದ ಘನತೆಯ ಆಧಾರದ ಮೇಲೆ ಆ ನುಡಿಯ ಬಳಕೆಯ ವಲಯಗಳು ಮೈದಾಳುತ್ತವೆ.
62,ಹಿಂದಿನಿಂದಲೂ ಕನ್ನಡ ಸಾಹಿತ್ಯ ಸಮ್ಮೇಳನಗಳು ಸಮಸ್ತ ಕನ್ನಡಿಗರ ಹೆಮ್ಮೆಯ ನುಡಿ ಜಾತ್ರೆಗಳಾಗಿವೆ.
63,ತರುಣಿ ಚಂದ್ರಮರು ಸಂಚರಿಸದೆನಿಂದರು | ಹರಪೇಳ್ದ ನುಡಿ ಹುಸಿಬಾರದು ನೀನರಿಯೆ ||೨೬೪||
64,ನುಡಿ ಜೊತೆಗೆ ಸಂಸ್ಕೃತಿಗಳು ಇರ್ತಾವೆ.
65,ನಮ್ಮ ನಡೆ ನುಡಿ ಶುದ್ಧವಾಗಿ ಸಮಾಜವು ಶುದ್ಧವಾಗಿರುತ್ತದೆ.
66,"ಹೌದು, ಕನ್ನಡ ಎಂಬುದೊಂದು ಮಾತ್ರವೇ, ಒಂದು ನಾಡು, ಒಂದು ನುಡಿ ಮತ್ತು ಒಂದು ರಾಗ ಈ ಎಲ್ಲಕ್ಕೂ ಸರಿಹೋಗಬಲ್ಲ ಹೆಸರು ."
67,ಅದು ಮಕ್ಕಳ ಕಲಿಕಾ ಪ್ರಕ್ರಿಯೆ ಮತ್ತು ನಾಡಿನ ನುಡಿ ಸಂಸ್ಕೃತಿ ಎರಡರ ಮೇಲೆ ಕೆಟ್ಟ ಪರಿಣಾಮವನ್ನು ಉಂಟುಮಾಡುವುದರಿಂದ ಹಾಗೆ ಅವರು ಹೇಳುವುದು ಸರಿಯಾಗಿಯೇ ಇದೆ.
68,ಬಱನೆ ನುಡಿ ಬರನಾದೊಡೀಕ್ಷಿಪು
69,ಕವಿಗಳ ಕಾಣಿಕಿ ಎನ್ನುವ ಆ ಕವನದ ಒಂದು ನುಡಿ ಹೀಗಿದೆ:
70,ಬೆದರಿಕೆಗೆ ಬಗ್ಗುವುದಿಲ್ಲ: ಜಮೀದಾ ಸ್ಪಷ್ಟ ನುಡಿ
71,"ನಿರಂತರ ತೊಡಗಿಕೊಳ್ಳುವಿಕೆ, ಮೇಲ್ವಿಚಾರಣೆಯ ಮಹತ್ವವನ್ನು ಈ ನುಡಿ ಬಿಂಬಿಸುತ್ತಿದೆ."
72,ಹುಡುಕು ಯಂತ್ರ(ಸರ್ಚ್ ಇಂಜಿನ್)ಸೇರಿದಂತೆ ಹೊಸ ಸೌಲಭ್ಯಗಳನ್ನು ನುಡಿ ಹೊಂದಲಿದೆ ಎಂದು ಪರಿಷತ್ತಿನ ಕಾರ್ಯದರ್ಶಿ ಜಿ.
73,"ಈ ಶಿಷ್ಯನ ನುಡಿ ನಮನ,"
74,"ಶನಿವಾರ ನಗರದಲ್ಲಿ ಸುದ್ದಿಗೋಷ್ಠಿಯನ್ನುದ್ದೇಶಿಸಿ ಮಾತನಾಡಿದ ಅವರು, ರಾಜ್ಯದ ವಿವಿಧ ಭಾಗಗಳಿಂದ ನುಡಿ ತೇರು ಎಳೆಯಲು ಆಗಮಿಸುವ ಕನ್ನಡಾಭಿಮಾನಿಗಳಿಗೆ ವಸತಿ ಮತ್ತು ಕಾರ್ಯಕ್ರಮಕ್ಕೆ ತೆರಳಲು ಸಮಸ್ಯೆ ಆಗದಂತೆ ನೋಡಿಕೊಳ್ಳಲು ಸೂಕ್ತ ಕ್ರಮ ವಹಿಸಲಾಗಿದೆ ಎಂದರು."
75,ಇದೋ ನಿಮಗೆ ನಮ್ಮ ನುಡಿ ನಮನ.
76,"ಕಣ್ವಕುಪ್ಪಿ ಗವಿಮಠದ ನಾಲ್ವಡಿ ಶಾಂತಲಿಂಗ ಶಿವಾಚಾರ್ಯರು, ಸಿದ್ಧರಬೆಟ್ಟದ ವೀರಭದ್ರ ಶಿವಾಚಾರ್ಯರು ಮತ್ತು ನೆಗಳೂರಿನ ಗುರುಶಾಂತೇಶ್ವರ ಶಿವಾಚಾರ್ಯರು ನಾಂದಿ ನುಡಿ ಸೇವೆ ಸಲ್ಲಿಸಿದರು."
77,"ಪ್ರಕಾಶ್ ರವರ ಪ್ರೇರಣಿ ಮತ್ತು ಪ್ರೋತ್ಸಾಹ ಕಾರಣವಾಗಿದ್ದು, ಅವರೊಬ್ಬ ಸಾಂಸ್ಕೃತಿಕ ರಾಯಭಾರಿಯಾಗಿದ್ದರು ಎಂದು ಹೇಳುತ್ತಾ, ಅವರ ಆಸೆಯಂತೆ ಸಾಂಸ್ಕೃತಿಕ ವೈಭವದ ಪರಂಪರೆಯನ್ನ ಉಳಿಸಿ ಬೆಳೆಸೋಣ ಎಂದು ಉದ್ಘಾಟನೆ ನುಡಿ ನುಡಿದರು."
78,"ಇಲ್ಲಿ ಸಾವಿರಾರು ವರ್ಷದಿಂದ ಬಾಳಿ ಬದುಕ್ತಾ ಇರೋರು ನಾವು, ಅಂದ್ರೆ ಕನ್ನಡಿಗರು, ಇಲ್ಲಿ ನಾವಾಡೋ ನುಡಿ ಕನ್ನಡ."
79,ಮೇಲಿನ ಮೂರೂ ಹಂತಗಳು ದಾಟಿ ಅಧೋಗತಿಯಲ್ಲಿ ಸಾಗುತ್ತಿರುವ ಭಾಷೆ ತನ್ನ ಎದುರಾಳಿ ಭಾಷೆಗೆ ಸೋಲೊಪ್ಪಿಕೊಂಡಾಗಿನ ಪರಿಸ್ಥಿತಿ ನುಡಿ ಪಲ್ಲಟ.
80,ದಯವಿಟ್ಟು ಅವಳನ್ನು ಸುರಕ್ಷಿತವಾಗಿಡಿ- ಪತ್ನಿ ಪ್ರಿಯಾಂಕಾ ಕುರಿತು ವಾದ್ರಾ ಭಾವನಾತ್ಮಕ ನುಡಿ
81,ಈಗ ಈ ನುಡಿ ಹೊಸತು ಹೊಸತು ಎನ್ನುವಂತಹ ಅರ್ಥವನ್ನು ವಿಡಿಯೊವೊಂದು ಹೃದಯಸ್ಪರ್ಶಿಯಾಗಿಸಿದೆ.
82,ಅತಿಥಿಗಳಾಗಿ ಆಗಮಿಸಿ ಮಾತನಾಡಿದ ಕನ್ನಡ ಸಾಹಿತ್ಯ ಪರಿಷತ್ ಜಿಲಾಧ್ಯಕ್ಷೆ ಶ್ರಿÃಮತಿ ಮಂಗಳಾ ಮೆಟಗುಡ್ಡ ಸಮಾಜದ ಸೇವೆಯ ಜೊತೆಗೆ ನಾಡು ನುಡಿ ಉಳಿಸುವ ಕಾರ್ಯವನ್ನು ಸಹ ಜೈಂಟ್ಸ ಸಂಸ್ಥೆ ಮಾಡಬೇಕು.
83,ಒಳರ್ದೊಡೆ ಪರಿಹಾಸದ ನುಡಿ
84,ಆ ನಾಡುಗಳಷ್ಟೇ ಶ್ರೇಷ್ಠ ಚರಿತ್ರೆಯನ್ನು ಪಡೆದಿರುವ ಕರ್ನಾಟಕದ ಜನರು ತಮ್ಮ ಚರಿತ್ರೆಯ ಬಗ್ಗೆ ಜಾಗೃತರಾಗದೇ ಉಳಿದಿರುವುದರ ಬಗ್ಗೆ ಆಲೂರು ವೆಂಕಟರಾಯರಂತಹ ನಾಡು – ನುಡಿ ಅಭಿಮಾನಿಗಳು ತೀವ್ರವಾಗಿಯೇ ನೊಂದರು.
85,"ಕನ್ನಡ ಭಾಷೆ, ನುಡಿ ಅಭಿವೃದ್ಧಿಗೆ ಸರಕಾರ ಬದ್ಧವಾಗಿದೆ."
86,ಮಂಡ್ಯ: ಅಂಬರೀಷ್​ ಅವರ ಪುಣ್ಯ ಸ್ಮರಣೆ ಹಾಗೂ ಶ್ರದ್ಧಾಂಜಲಿ ಅರ್ಪಿಸಲು ಶನಿವಾರ ಕರ್ನಾಟಕ ಅಂಬರೀಶ್​ ಅಭಿಮಾನಿಗಳ ಸಂಘ ಸಕ್ಕರೆ ನಗರಿಯಲ್ಲಿ ಅಂಬಿ ನುಡಿ ನಮನ ಕಾರ್ಯಕ್ರಮವನ್ನು ಏರ್ಪಡಿಸಿತ್ತು.
87,ನಮ್ಮ ನುಡಿ ಹಾಗೂ ಬರಹವನ್ನು ಗಟ್ಟಿಗೊಳಿಸುವ ಆಂಗ್ಲ ಭಾಷೆಯನ್ನು ಕೋಟ್ ಮಾಡುತ್ತೇವೆ.
88,ಅವರ ನಡೆ- ನುಡಿ ಎಲ್ಲವೂ ಹಿತ-ಮಿತವಾಗಿರುತ್ತದೆ ಅನ್ನೋದು ಅಭಿಮಾನಿಗಳ ನಂಬಿಕೆ.
89,ಡುಸಿರು ಭಾರೈಸೆ ನಡೆಯೊಡನೆ ನುಡಿ ಬಾಡಲಿ
90,ಸಖನೊಲುಮೆಯ ನುಡಿ
91,ಎಂಬ ನುಡಿ ಕೇಳಿದರು.
92,ನುಡಿ ಪ್ರಸಾರದ ಹಂಬಲ ಅವರನ್ನು ಕನ್ನಡ ಸಾಹಿತ್ಯ ಪರಿಷತ್ತು ಬೆಂಗಳೂರು – ಇದರ ದಕ್ಷಿಣ ಕನ್ನಡ ಮತ್ತು ಕೊಡಗು ಪ್ರಾದೇಶಿಕ ಸಮಿತಿಯ ಕಾರ್ಯದರ್ಶಿಗಳಾಗಿ ಕಾರ್ಯನಿರ್ವಹಿಸುವಂತೆ ಪ್ರೇರೇಪಿಸಿತು.
93,"ಮರುಳಯ್ಯ ಅವರು ಭಾಷೆ, ದ್ರಾವಿಡ ಭಾಷೆಗಳು, ಕರ್ನಾಟಕ: ನಾಡು ಮತ್ತು ನುಡಿ ಎಂಬ ಮೂರು ಅಧ್ಯಾಯಗಳಲ್ಲಿ ಕನ್ನಡ ಭಾಷಾ ಚರಿತ್ರೆಯ ಸ್ಥೂಲನೋಟವನ್ನು ಬಿಂಬಿಸಿದ್ದಾರೆ."
94,ಅವನ ಮಾತಿನಲ್ಲೇ ಹೇಳುವುದಾದರೆ ಈ ನುಡಿ ಸಾಕ್ಷಿ.
95,"ನನ್ನ ಮಗನ ಗಲ್ಲಿಗೇರಿಸಿ, ಬೆಂಕಿ ಹಚ್ಚಿ ಸಾಯಿಸಿ; ಪಶುವೈದ್ಯೆ ಮೇಲೆ ಅತ್ಯಾಚಾರವೆಸಗಿ ಕೊಂದವನ ತಾಯಿಯ ಆಕ್ರೋಶದ ನುಡಿ ಹೋಟೆಲ್​ಗಳಲ್ಲಿ ಮಾಡುವ ಅಡುಗೆಯಲ್ಲಿ ಈರುಳ್ಳಿ ಬಳಕೆಯನ್ನು ಆದಷ್ಟು ಕಡಿಮೆಗೊಳಿಸಿದ್ದೇವೆ."
96,ಮುಂಡ್ಕೂರು ಗ್ರಾಮ: ನುಡಿ ಚಿತ್ರ
97,ರಾಜೇಶ ಪ್ರಾಸ್ತಾವಿಕ ನುಡಿ ನುಡಿದರು.
98,ತನ್ನ ದೇಶ ಕಾಲ ಸಂದರ್ಭಗಳ ನುಡಿ ರೂಪಕವಾಗಿದೆ ಈ ಕತೆಗಳು.
99,"ಈ ಸಂಬಂಧ ಸುಂದರ ರಾಜ್ ಕೂಡ ಮಾತನಾಡಿದ್ದು, ನಾಡು, ನುಡಿ ಮತ್ತು ನೆಲ-ಜಲ ಎಂಬ ವಿಚಾರ ಬಂದಾಗ ಆ ಸಮಸ್ಯೆ ರಾಜ್ಯದ ಎಲ್ಲಾ ಜನರಿಗೆ ಸಂಬಂಧಿಸಿದ ಸಮಸ್ಯೆ ಎಂದು ಪರಿಗಣಿಸಿ ಕಾರ್ಯನಿರ್ವಹಿಸುತ್ತಿದ್ದೇವೆ."
100,ಏನಿದೆತ್ತಣ ಕೌತುಕದ ನುಡಿ ಕುಳಿಂದಂಗೆ |
101,"೮೫ನೇ ಅಖಿಲ ಭಾರತ ಕನ್ನಡ ಸಾಹಿತ್ಯ ಸಮ್ಮೇಳನದ ಸಮನಾಂತರ ವೇದಿಕೆಯಲ್ಲಿ ಇಂದು ನಡೆದ ಕನ್ನಡ ನಾಡು ನುಡಿ ಮತ್ತು ಯುವ ಕರ್ನಟಕ ಗೋಷ್ಠಿಯಲ್ಲಿ ಕರ್ನಾಟಕ ಯುವ ಸಮುದಾಯ ಸವಾಲು ಮತ್ತು ಸಾಧ್ಯತೆಗಳು ವಿಷಯ ಮಂಡನೆ ಮಾಡಿ ಮಾತನಾಡಿದ ಅವರು, ಯುವ ಸಮುದಾಯ ತಮಗೆ ಅರಿವಿಲ್ಲದಂತೆ ಜಾತಿವಾದ, ಕೋಮವಾದ, ಧರ್ಮಾಂದಲ್ಲಿ ಮುಳುಗಿದ್ದಾರೆ."
102,ಜುಲೈ 14ರಂದು ಕಪ್‌ ನನ್ ಕೈಲಿರ್ಬೇಕ್: ಹಾರ್ದಿಕ್ ಪಾಂಡ್ಯ ಹುಮ್ಮಸ್ಸಿನ ನುಡಿ
103,"ಸ್ನೇಹಿತನಾಗಿ, ಅಣ್ಣನಾಗಿ, ತಂದೆಯಾಗಿದ್ದರು ಅಂಬಿ… ಇದು ಸಿಎಂ ಕುಮಾರಸ್ವಾಮಿ ಅವರು ದಿವಂಗತ ಅಂಬರೀಶ್ ಅವರಿಗೆ ಸಲ್ಲಿಸಿದ ನುಡಿ ನಮನ."
104,"ನಾಡಿನ ಎಲ್ಲೆಲ್ಲೂ ಕನ್ನಡ ಅಭಿಮಾನಿಗಳು ಕನ್ನಡ ನಾಡು, ನುಡಿಯ ಹೆಮ್ಮೆಯನ್ನು ಸಾರುವ ಹಾಗೂ ಕನ್ನಡ ನಾಡು , ನುಡಿ ಬೆಳೆದು ಬಂದ ಇತಿಹಾಸವನ್ನೊಮ್ಮೆ ನೆನಪಿಸಿಕೊಳ್ಳುವ ಹಾಗೂ ಇಂದಿನ ಪೀಳಿಗೆಗೆ ಅದರ ಭವ್ಯ ಇತಿಹಾಸವನ್ನು ತಿಳಿಸುವ ಕಾರ್ಯ ನಾಡಿನ ಉದ್ದಗಲಕ್ಕೂ ನಡೆಯುತ್ತದೆ."
105,"ಮುಖ್ಯವಾಗಿ, ಅಭಿವ್ಯಕ್ತಿಯ ಗಳಿಗೆ ಒದಗಿಬಂದಾಗ ಮಾತು ಹೇಗೆ ನುಡಿ ಪಡೆಯುತ್ತದೆ, ಆ ನುಡಿ ತನ್ನೊಳಗೆ ರೂಪಕವನ್ನು ಹೇಗೆ ಹುದುಗಿಸಿಕೊಂಡಿರುತ್ತದೆ ಎಂಬುದನ್ನು ತೋರುತ್ತಿದೆ."
106,ಅವರುಗಳ ಆತ್ಮಕ್ಕೆ ಶಾಂತಿ ಕೋರುವ ಮೂಲಕ ನುಡಿ ನಮನಗಳನ್ನು ಅರ್ಪಿಸಿದರು.
