Index,Sentence
186,ಟ್ಟನೆ ತೊಡಗುವ ಹದನಂ ನುಡಿ ಕೆಡೆನುಡಿದಡೆ ಕೆಡಹುವೆನೆಂದನು ಪಾತಕನು ೩೦
187,"- ಎಂದು ನಂಬಿ ಬಾಳಿದ, ಕೊನೆಯ ತನಕ ಕಾವ್ಯವನ್ನು ಉಸಿರಾಡಿದ, ನಮ್ಮ ಒಲವಿನ ಕವಿಗೆ ನುಡಿ ನಮನ."
188,"ಕೊಪ್ಪಳದ ಗವಿಮಠದ ಶ್ರೀ ಸಿದ್ಧಲಿಂಗ ದೇವರು ಸಮಾರೋಪ ನುಡಿ ಆಡಲಿದ್ದು, ಮುಖ್ಯ ಅತಿಥಿಗಳಾಗಿ ಡಾ."
189,ಕೋಟ್ಯಾನ್ ಮೊದಲಾದವರು ಮಾತನಾಡಿ ನುಡಿ ನಮನ ಸಲ್ಲಿಸಿದರು.
190,"ರಾಜ್ ರವರ ಬಗ್ಗೆ ವಿಷಯ ಸಂಗ್ರಹಣೆ ಮಾಡುತ್ತಾ ಹೋದಂತೆಲ್ಲ ರಾಜ್ ರವರ ಬಗ್ಗೆ ಕೃತಿ ರಚಿಸಬೇಕೆಂಬ ಹಂಬಲದಿಂದ ರಾಜ್‌ಕುಮಾರ್ ರವರ ಜೀವನ ಚರಿತ್ರೆ, ಸಾಮಾಜಿಕವಾಗಿ ರಾಜ್ ಪ್ರಭಾವಗಳು, ರಾಜ್‌ಕುಮಾರ್ ರವರ ಅಪರೂಪದ ಭಾಷಣಗಳು, ರಾಜ್ ನುಡಿಮುತ್ತುಗಳು, ರಾಜ್ ರವರ ಶ್ರೇಷ್ಠ ಪ್ರಬಂಧಗಳು, ರಾಜ್‌ಕುಮಾರ್ ಚಲನಚಿತ್ರದ ವೈಶಿಷ್ಟ್ಯಗಳು, ರಾಜ್ ರವರು ಹಾಡಿದ ಅಮರ ಗೀತೆಗಳು, ರಾಜ್ ಚಿತ್ರ ನಿರ್ದೇಶಿಸಿದ ನಿರ್ದೇಶಕರು, ಸಾಹಿತಿಗಳ ಸಂದರ್ಶನಗಳು, ಕನ್ನಡ ನಾಡು – ನುಡಿ – ಭಾಷೆ, ಸಂಸ್ಕೃತಿಯಬೆಳವಣಿಗೆಯ ಬಗ್ಗೆ ರಾಜ್‌ಕುಮಾರ್ ರವರ ಪಾತ್ರ – ಹೀಗೆ ರಾಜ್ ಜೀವನದ ವಿವಿಧ ಆಯಾಮಗಳ ಬಗ್ಗೆ ವರನಟ, ಡಾ."
191,ಅಜಿತಸೇನಾಚಾರ್ಯರು ಮತ್ತು ರನ್ನರ ನಡುವಿನ ಈ ನುಡಿ ಸಂವಾದ ಯಾರು ತಾನೇ ಅರಿಯರು?
192,"ತಾಳಿಕೋಟೆ: ಕನ್ನಡ ನಾಡು ನುಡಿ ಮೇಲೆ ನಡೆಯುತ್ತಿದ್ದ ದಬ್ಟಾಳೆಕೆಗಳಿಗೆ ತಕ್ಕ ಉತ್ತರ ನೀಡುವುದರೊಂದಿಗೆ ಕನ್ನಡವನ್ನು ರಕ್ಷಣೆ ಮಾಡಲು ಕರ್ನಾಟಕ ರಕ್ಷಣಾ ವೇದಿಕೆ ಮುಂಚೂಣಿಯಲ್ಲಿ ಕಾಣಿಸಿಕೊಳ್ಳುತ್ತ ಬಂದಿದ್ದು ಹೆಮ್ಮೆ ಪಡುವಂತಹದ್ದಾಗಿದೆ ಎಂದು ಕರ್ನಾಟಕ ಸರ್ಕಾರದ ದೆಹಲಿ ವಿಶೇಷ ಪ್ರತಿನಿಧಿ , ಶಾಸಕ ಸಿ."
193,ರಂದು ಸಾರ್ಥಕ ನುಡಿ ನಮನ
194,ನಿಮ್ಮ ಸಮಸ್ಯೆ ಗಳಿಗೆ ಸ್ಪಂದಿಸುವುದಾಗಿ ಭರವಸೆ ನುಡಿ ದರು.
195,ಮೂಡಬಿದಿರೆ ಆಳ್ವಾಸ್‌ ಶಿಕ್ಷಣ ಪ್ರತಿಷ್ಠಾನದ ಆಶ್ರಯದಲ್ಲಿ ನಡೆಯಲಿರುವ 14ನೇ ವರ್ಷದ ಆಳ್ವಾಸ್‌ ನುಡಿಸಿರಿ ನಾಡು ನುಡಿ ಸಂಸ್ಕೃತಿಯ ಹಬ್ಬಕ್ಕೆ ವಿದ್ಯಾಗಿರಿ ಸಜ್ಜಾಗಿದೆ.
196,ಅರಸ ಕೇಳ್ ನಿನ್ನಯ ನುಡಿ ಸತ್ಯಸಂಸಾರ | ತರುವು ಸಂತಾನ ಪುಷ್ಪವನು |
197,Home ಕನ್ನಡ ವಾರ್ತೆಗಳು ಕರ್ನಾಟಕ ತಮಿಳುನಾಡಿಗೆ ನೀರು ಬಿಡಲು ಸಾಧ್ಯವಿಲ್ಲ: ಮುಖ್ಯಮಂತ್ರಿ ಸಿದ್ದರಾಮಯ್ಯ ಖಡಕ್ ನುಡಿ
198,ನಾಡು ನುಡಿ ನಮ್ಮ ಸಂಸ್ಕ್ಕತಿ ಸಂಬಂಧಗಳಿಗಾಗಿ ನಮ್ಮ ಹೆಜೆಗಳನ್ನು ಅವಲೋಕಿಸದಿದ್ದರೆ ದುರಂತಗಳನ್ನೆ ನೋಡಬೇಕಾದೀತು ಎಂದರು.
199,"ಪ್ರತಿಯೊಬ್ಬ ವ್ಯಕ್ತಿ ಕನ್ನಡ ನಾಡು, ನುಡಿ ಸಂರಕ್ಷಿಸಲು ಪ್ರಯತ್ನಿಸಬೇಕು."
200,ಅರ್ಧಶತಕ ಹೊಡೆದ ಪೈಲ್ವಾನ್: ಕಿಚ್ಚ ಸುದೀಪ್ ಭಾವುಕ ನುಡಿ
201,"ಆದರೆ ಯಾವುದೇ ನುಡಿ ಬಳಕೆಯ ನೆಲೆಗಳು ಈಗ ವಾಸ್ತವಿಕ [ಎಕ್ಸ್ಟ್‌ರಾನ್ಸಿಕ್] ಸಂಗತಿಗಳಾದ, ವಾಸಸ್ಥಳ, ಶಿಕ್ಷಣ ಮಾಧ್ಯಮ, ನುಡಿಯೊಂದಕ್ಕೆ ವ್ಯಕ್ತಿಯೊಬ್ಬನು ತೆರೆದುಕೊಂಡ ಪ್ರಮಾಣ, ನುಡಿ ಬಳಕೆಯ ಪ್ರಮಾಣ ಹಾಗೂ ನುಡಿಗೆ ಇರುವ 62 ತೆಂಕಣ ನುಡಿಗಳು ಮತ್ತು ಇಂಗ್ಲಿಶ ಘನತೆ ಇತ್ಯಾದಿ ಸಂಗತಿಗಳನ್ನು ನೆಮ್ಮಿಕೊಂಡಿರುತ್ತವೆ."
202,ಅವರ ಜನಪ್ರಿಯ ಸುಂದರ ಕವನ ನನ್ನ ಹಣತೆ ನುಡಿ ಚಿತ್ರದ ಇನ್ನೊಂದು ಅದ್ಭುತ ರಚನೆ.
203,ದೇವರ ಕೋಣೆಯಲ್ಲಿ ನಾನು ಉಸಿರುಗಟ್ಟಿದ್ದೆ ಎಂಬ ಆಸೀಫಾಳ ನುಡಿ ಇದರ ಆತ್ಯಂತಿಕ ರೂಪವಾಗಿ ಕಾಡುತ್ತದೆ.
204,ಚುನಾವಣೆ ಸೋಲಿನ ಭೀತಿಯಲ್ಲಿ ಕಾಂಗ್ರೆಸ್ ನಾಯಕನಿಂದ ಉದುರಿದ ಹತಾಶೆಯ ನುಡಿ ಇದು ಎಂದು ಬಿಜೆಪಿ ಎದಿರೇಟು ನೀಡಿದೆ.
205,"ಖೋದಣ್ಣವರ ಸ್ವಾಗತ ಮತ್ತು ಪ್ರಾಸ್ತವಿಕ ನುಡಿ ನುಡಿದರೆ, ಬೆಳ್ಳುಬ್ಬಿ ಮಹಾವಿದ್ಯಾಲಯದ ಪ್ರಾಚಾರ್ಯ ಡಾ."
206,ಆಚಾರ್ಯ ನುಡಿ ಗೌರವ ಸಲ್ಲಿಸಿದರು.
207,"ಅವರು ನರಕಕ್ಕೆ ಹೋಗಲಿ ಎಂದು ಅಣುಕು ನುಡಿ ನುಡಿದಿದ್ದು, ಈ ಅಣುಕು ತಿಥಿಯಲ್ಲಿ ಊಟದ ವ್ಯವಸ್ಥೆ ಸಹ ಮಾಡಲಾಗಿತ್ತು."
208,ಪರಶುಧರನ ನುಡಿ ಕೇಳುತ ನೇತ್ರದಿ | ಸುರಿಸುತ ಜಲಗಳನು ||
209,ಬೆಂಗಳೂರು: ಕನ್ನಡದ ನುಡಿ ಹಬ್ಬ ರಾಜ್ಯೋತ್ಸವ ಮತ್ತೆ ಬರುತ್ತಿದೆ.
210,ಕರಿಯಪ್ಪ ಮಾಸ್ತರ ಖೇದದ ನುಡಿ
211,"ಹಾಗೆ, ನುಡಿ ಮತ್ತು ಬದುಕು ಒಂದಾಗದೇ ಇರುವ ಯಾವ ನಾಡಿನ ಕಲ್ಚರನ್ನೂ ಅರಿತು ಕಟ್ಟಿರುವ ಗುರುತುಗಳು ಇಲ್ಲ."
212,ಸಿಂಪಿ ಲಿಂಗಣ್ಣ – ಸಮಗ್ರ ಜನಪದ ಸಂಪುಟ: ಸಂಪಾದಕರ ನುಡಿ
213,ದೈವದ ಈ ನುಡಿ ಬಗ್ಗೆ ಶ್ರೀಗಳು ಯಾವುದೇ ಗಮನ ಹರಿಸಿರಲಿಲ್ಲ
214,ತಾವು ಸಾಗಿದ್ದಲ್ಲೆಲ್ಲಾ ತಮ್ಮ ನುಡಿ ಮತ್ತು ಬರಹದ ಮೂಲಕ ಎಲ್ಲರಲ್ಲೂ ತಮ್ಮ ಸಾಮರ್ಥ್ಯವನ್ನು ಹೊರಹಾಕಿಸುವ ಪ್ರೇರಣೆ ನೀಡಬಲ್ಲವರಾಗಿದ್ದರು.
215,"ಮೋದಿ ಅವರ ಭಾಷಣ, ಅವರ ನಡೆ ನುಡಿ ಕಂಡು ಸಾಮಾಜಿಕ ಜಾಲ ತಾಣಗಳು ಕೂಡಾ ಕಣ್ತುಂಬಿಕೊಂಡಿದ್ದವು."
216,"ಮಕ್ಕಳಲ್ಲಿ ದೇಶ ಪ್ರೇಮ ತುಂಬಿದಲ್ಲಿ, ಅವರ ನಡೆ ನುಡಿ ಸಾಮಾಜಿಕವಾಗಿ ಉತ್ತಮಗೊಳ್ಳುತ್ತದೆ."
217,ನಾಯಕ 22 ಕನ್ನಡ ನುಡಿ ಮತ್ತು ಸಾಹಿತ್ಯವನ್ನು ಕುರಿತು ನಾಯಕರು ತೋರಿಸುತ್ತಿದ್ದ ಉತ್ಸಾಹ ಅಪಾರವಾಗಿತ್ತು.
218,"ಶ್ರೇಷ್ಟ ಮಟ್ಟದ ನಡೆ, ನುಡಿ ರೂಢಿಸಿಕೊಂಡಿದ್ದರು ಎಂದರು."
219,"ಬರಹ ಸೃಷ್ಟಿ ಮಾಡಿದ ವಾಸು, ನುಡಿ ರೂಪಿಸಿದ ಕೆ."
220,ಪ್ರಮಾಣಕ್ಕೆ ಸೀಮಿತಗೊಳ್ಳದ ಕನ್ನಡ: ನುಡಿ ಪ್ರಮಾಣೀಕರಣ ಎಂಬುದೊಂದು ಮಿಥ್ ದಿಟ.
221,ಅಲ್ಲದೆ ಆ ಮೂಲಕ ಕನ್ನಡಮ್ಮನ ನಾಡು – ನುಡಿ ಪ್ರತೀಕಗಳನ್ನು ಅರಿಯಲು ಸಾಧ್ಯ.
222,ದೇವರು ಅವರ ಆತ್ಮಕ್ಕೆ ಶಾಂತಿ ಕೊಡಲೆಂದು ಈ ನುಡಿ ನಮನ.
223,ಪಾಟೀಲ ಅಂತಿಮ ನುಡಿ ನಮನ ಸಲ್ಲಿಸಿದರು.
224,"ನನ್ನ ಕಣ್ಮುಂದೆ ನುಡಿ ನಡೆಯ ಕಲಿತಿದ್ದವಳು,"
225,"ವಿಶ್ವ ರಂಗಭೂಮಿ ದಿನಾಚರಣೆ ಕಾರ್ಯಕ್ರಮದ ಅಂಗವಾಗಿ ತುಮಕೂರಿನ ನುಡಿ ಕನ್ನಡ ಕಲಾ ಸಂಘ ಮತ್ತು ಸಮುಖ, ರಂಗ ಸಂಪನ್ಮೂಲ ಕೇಂದ್ರವು ಶ್ರೀ ವಾಲ್ಮೀಕಿ ಕನ್ವೆನ್ಷನ್ ಹಾಲ್‍ನಲ್ಲಿ ಏರ್ಪಡಿಸಿದ್ದ ಕಾರ್ಯಕ್ರಮದಲ್ಲಿ ಭಾಗವಹಿಸಿ ಮಾತನಾಡುತ್ತಿದ್ದರು."
226,ಶಬ್ದಾರ್ಥ ನುಡಿ ಸರಿ ಇರಬೇಕು ಅಂತ ನನಗ ಗುರುಗಳು ಬೋಧಾ ಕೊಟ್ಟ್ರು.
227,"ಮನಿಗೆ ತಂದು ಹೊಟ್ಟಿ ತುಂಬಾ ತಿನ್ನಲಿ ಅಂತಾ ಹಾಕಿ ಬಂಗಾರದಂಥ ಆಕಳು ಸಾಯಿಸಿದೆ, ಅತಿಯಾದ್ರೆ ಅಮೃತಾನೂ ವಿಷ~ ಎಂಬ ಹೊನ್ನಾಳಿ ಫಕ್ಕೀರಪ್ಪನವರ ವಿಷಾದದ ನುಡಿ ಈ ಸಮಸ್ಯೆಯ ಗಂಭೀರತೆಯನ್ನು ತಿಳಿಸುತ್ತದೆ."
228,ಭಾರತ ಕಂಡ ಅಗ್ರಮಾನ್ಯ ರಾಜಕೀಯ ಮುತ್ಸದ್ದಿಗೆ ದೇಶದ ಮಾಧ್ಯಮ ವಲಯ ನುಡಿ ಗೌರವ ಸಲ್ಲಿಸಿದೆ.
229,ಗಟ್ಟಿಯವರಂದಂತೆ ನುಡಿ ಅರ್ಧಗಂಟೆಯಲ್ಲೇ ಕರಗತವಾಯ್ತು.
230,"ಹೈದರಾಬಾದ್ ಪ್ರಾಂತ್ಯ, ಕೋಲಾರ, ಮೈಸೂರು, ಧಾರವಾಡ ಹಾಗೂ ದಾವಣಗೆರೆಯ ಕನ್ನಡ ನುಡಿ ಸೊಗಡನ್ನು ಕಟ್ಟಿಕೊಡುವ ಮೂವತ್ತು ಬರಹಗಳು ಇಲ್ಲಿವೆ."
231,ವರಜನನಿಯೆಂದ ನುಡಿ ತರಳನಾ ಕರ್ಣದಲಿ |
232,ಪರ್ವತರಾಜು ನುಡಿ ನಮನ ಸಲ್ಲಿಸುವರು.
233,"ತನು ಕನ್ನಡ, ಮನ ಕನ್ನಡ, ನುಡಿ ಕನ್ನಡವೆಮ್ಮವು ಎಂದು ಮನೋಹರವಾಗಿ ತಮ್ಮ ಕನ್ನಡ ಭಕ್ತಿಯನ್ನು ವ್ಯಕ್ತಪಡಿಸಿರುವರು."
234,ಹೇಳಿದರು ನುಡಿ ನುಡಿ ಸುಯೋಧನ ಎಂದನಾ ಭೂಪ ೧೭
235,[ ದೇಶಾವಲೋಕನ ಕುರಿತು ಗುರುರಾಜ್ ದೇಶಪಾಂಡೆ ನುಡಿ ]
236,ಟ್ವಿಟ್ ನುಡಿ
237,ಮಗಳಿಗೆ ತಾಯಿಯ ಪರಿಚಯ ಸಿಗುತ್ತದೆ ಎಂಬ ನುಡಿ ಕೊಡುತ್ತಾರೆ.
238,"ಆದ್ದರಿಂದಲೇ, ಆಡು ನುಡಿ ಸಾಹಿತ್ಯಕ್ಕೆ ಚರಿತ್ರೆ ಇದ್ದರೂ, ಅದು ಹೇಳಿ ಗುರುತಿಸಲಾಗದ ಚರಿತ್ರೆ."
239,ಕರ್ನಾಟಕದ ರಾಜಕಾರಣಿಗಳಿಂದ ಸದಾ ನಿರ್ಲಕ್ಷಕ್ಕೆ ಒಳಗಾದ ಕಲಬುರ್ಗಿಯಲ್ಲಿ ಕನ್ನಡ ನುಡಿ ಜಾತ್ರೆ ೩೨ ವರ್ಷಗಳ ನಂತರ ನಡೆದಿರುವುದೇ ಒಂದು ಸಂತಸದ ಸಂಗತಿ.
240,"ಕನ್ನಡ ನಾಡು ನುಡಿ ಸಂಸ್ಕೃತಿ, ಭಾಷೆಗೆ ತನ್ನದೆ ಆದ ಸ್ಥಾನಮಾನವಿದೆ."
241,ಈ ಸಂದರ್ಭದಲ್ಲಿ ವಿಶೇಷವಾಗಿ ಕಾಶ್ಮೀರದ ಪುಲ್ವಾಮದಲ್ಲಿ ಉಗ್ರಗಾಮಿಗಳ ಕುತಂತ್ರಕ್ಕೆ ಬಲಿಯಾದ ಭಾರತೀಯ ಸೇನೆಯ ಸೈನಿಕರಿಗೆ ವಿಶ್ವನಾಥ್‌ ಪೂಜಾರಿ ಅವರ ನುಡಿ ನಮನದೊಂದಿಗೆ ಎಲ್ಲರು ಸೇರಿ ಶ್ರ¨ªಾಂಜಲಿ ಸಲ್ಲಿಸಿದರು.
242,"ನಾನು ನಿನ್ನ ನಡೆ ನುಡಿ ,ನಗುವಿಗೆ ಸೋತಿರಬಹುದು."
243,"ನಾನೇ ಸರ್ವಶಕ್ತನು, ಮಾಯೆಗೆ ಮಣಿಯದವನು ಎಂಬ ಈ ನಿನ್ನ ನುಡಿ ಅದೆಲ್ಲಿ ಅಡಗಿತ್ತು?"
244,"ನಾಡಿನ ಎಲ್ಲೆಲ್ಲೂ ಕನ್ನಡ ಅಭಿಮಾನಿಗಳು ಕನ್ನಡ ನಾಡು, ನುಡಿಯ ಹೆಮ್ಮೆಯನ್ನು ಸಾರುವ ಹಾಗೂ ಕನ್ನಡ ನಾಡು , ನುಡಿ ಬೆಳೆದು ಬಂದ ಇತಿಹಾಸವನ್ನೊಮ್ಮೆ ನೆನಪಿಸಿಕೊಳ್ಳುವ ಹಾಗೂ."
245,"ಜ್ಞಾನವೇ ಶಕ್ತಿ ಎಂಬ ನುಡಿ ಮುತ್ತಿದ್ದು, ಕಾನೂನು ಜ್ಞಾನವಿದ್ದಲ್ಲಿ ಅದು ಇನ್ನಷ್ಟು ಹೆಚ್ಚು ಶಕ್ತಿ ತಂದುಕೊಡಲಿದೆ."
246,ಕನ್ನಡದ ನುಡಿ ಹಬ್ಬಕ್ಕೆ ಖಂಡಿತವಾಗಿಯೂ ಉತ್ತಮ ಫೇಡಾ ಪೂರೈಕೆ ಮಾಡಬೇಕು.
247,"12: ನಾಡು ನುಡಿ ಇಂದಿನ ಅವಶ್ಯಕವಾಗಿದ್ದು, ಯುವಜನತೆ ನಮ್ಮ ನಾಡು ಮತ್ತು ಭಾಷೆಗೆ ಆದ್ಯತೆ ನೀಡಬೇಕು ಎಂದು ಉಡುಪಿ ಜಿಲ್ಲಾ ಪಂಚಾಯತ್ ಉಪಾಧ್ಯಕ್ಷೆ ಶೀಲಾ ಕೆ."
248,ಮನ್ನಿಸುತ ಮಗನ ನುಡಿ ಮೋಹದಿಂ ಕೇಳಿದಳು
249,ಶೆಟ್ಟಿಯವರಿಗೆ ನುಡಿ ನಮನ
250,"ಪರಮಪೂಜ್ಯ ಶ್ರೀ ಶಿವಾನಂದ ಶಿವಾಚಾರ್ಯರು, ಪರಮಪೂಜ್ಯ ಶ್ರೀ ಯತೀಶ್ವರ ಶಿವಾಚಾರ್ಯ ಸ್ವಾಮೀಜಿಗಳ ದಿವ್ಯ ಸಾನಿಧ್ಯದಲ್ಲಿ ನುಡಿ ನಮನ ಕಾರ್ಯಕ್ರಮವು ನೆರವೇರಲಿದೆ ಎಂದು ವೀರಶೈವ ಲಿಂಗಾಯತ ಯುವ ವೇದಿಕೆಯ ರಾಜ್ಯ ಪ್ರಧಾನ ಕಾರ್ಯದರ್ಶಿ ಕವನ ಬಸವಕುಮಾರ್ ಅವರು ಹೇಳಿದ್ದಾರೆ."
251,ನುಡಿ ಮಿಡಿಯಿತು.
252,"ಪಟ್ಟಣದ ಡಿವಿಜಿ ರಂಗಮಂದಿರದಲ್ಲಿ ನುಡಿ ತೇರು ಕಾರ್ಯಕ್ರಮದಲ್ಲಿ ಮಾತನಾಡಿ, ಶಾಲೆ ಗಳಲ್ಲಿ ಕನ್ನಡ ಮಾತನಾಡಿದರೆ ಕೀಳರಿಮೆ ಎಂಬ ಮನೋಭಾವನೆಯನ್ನು ಕೆಲವು ಖಾಸಗಿ ಶಾಲೆ ಗಳು ಬಿತ್ತರಿಸುತ್ತಿವೆ ಎಂದು ಆರೋಪಿಸಿದರು."
253,"ನಾಡು, ನುಡಿ ಕುರಿತ ಜನಪದ ಸಂಗೀತ ಕಾರ್ಯಕ್ರಮ"
254,"ರೇಷ್ಮೆ ನಗರಿಯಲ್ಲಿ ನುಡಿ ಜಾತ್ರೆ: ಕನ್ನಡದ ಕಟ್ಟಾಳುಗಳ ಸಮಾಗಮ, ವೇದಿಕೆ ಮುಂಭಾಗ ರೈತರ ರಂಪಾಟ"
255,"ಅವರ ನಡೆ, ನುಡಿ ಪ್ರೇರೇಪಣೆಯ ಮೂಲವಾಗಬಲ್ಲದು."
256,"ಶಿಕ್ಷಣ, ಆರೋಗ್ಯ, ಬ್ಯಾಂಕಿಂಗ್‌, ಕೃಷಿ, ಕೈಗಾರಿಕೆಗಳ ನಡುವೆ ಭಾಷೆ, ಸಾಹಿತ್ಯ, ಸಂಸ್ಕೃತಿ, ನಾಡು ನುಡಿ ಎಲ್ಲದಕ್ಕೂ ಸ್ಪಂದಿಸುವ ದೊಡ್ಡ ಗುಣ ತುಳುನಾಡಿನಲ್ಲಿದೆ ಎಂದು ಹೇಳಿದರು."
257,ಶ್ರೀ ವಿಜಯ ರಚಿಸಿರುವ ಕವಿರಾಜ ಮಾರ್ಗದ ಈ ನುಡಿ ಕೊಪ್ಪಳದ ಇತಿಹಾಸದ ಘನತೆಯನ್ನು ಹೇಳುತ್ತದೆ.
258,"ಉಳಿದ ಏಳು ತೆಂಕುದ್ರಾವಿಡ ನುಡಿಗಳಲ್ಲಿ, ತುಳು ನುಡಿ ಮೊದಲಿಗೆ ಬೇರ‍್ಪಟ್ಟಿರಬೇಕು; ಯಾಕೆಂದರೆ, ಉಳಿದ ಎಲ್ಲಾ ತೆಂಕುದ್ರಾವಿಡ ನುಡಿಗಳಲ್ಲೂ ನಡೆದಿರುವ ಹಲವು ಮಾರ‍್ಪಾಡುಗಳು ತುಳುವಿನಲ್ಲಿ ನಡೆದಿಲ್ಲ."
259,ಹುತಾತ್ಮರಾದ ವೀರ ಸೈನಿಕರಿಗೆ ನುಡಿ ನಮನವನ್ನು ಸಲ್ಲಿಸುವ ಕಾರ್ಯವಾಗಲಿದೆ.
260,"ರಹೀಂ, ದಲಿತ ಮುಖಂಡ ಭಾನುಚಂದ್ರ ಕೃಷ್ಣಾಪುರ, ಇಂಟಕ್ ಜಿಲ್ಲಾ ಉಪಾಧ್ಯಕ್ಷ ಚಿತ್ರರಂಜನ್ ಶೆಟ್ಟಿ ಬೊಂಡಾಲ, ಸಾಧನಾ ಸಾಂಸ್ಕೃತಿಕ ಪ್ರತಿಷ್ಠಾನ ಮುಖ್ಯಸ್ಥ ವಿಶ್ವನಾಥ ಬಂಟ್ವಾಳ, ಉಪಾನ್ಯಾಸಕ ಜಯಾನಂದ ಪೆರಾಜೆ ನುಡಿ ನಮನ ಸಲ್ಲಿಸಿದರು."
261,ಡಬ್ಬಿಂಗ್‌ಗೆ ಅನು­ಮತಿ ನೀಡದೆ ನಾಡು ನುಡಿ ರಕ್ಷಣೆಗೆ ನಿಲ್ಲ­ಬೇಕು.
262,ಈ ಚರ್ಚೆ ನಡೆಯುತ್ತಿರುವ ಸಂರ್ಭದಲ್ಲಿ ಸ್ಮರಣೀಯ ಎನಿಸುವ ನುಡಿ ಎಂದರೆ ತಾಯ್ನುಡಿಯಲ್ಲಿ ಕಲಿಸದಿದ್ದರೆ ಬಹುತೇಕ ಭಾರತೀಯರು ಕಲಿಕೆಯಿಂದ ದೂರವಾಗುತ್ತಾರೆ ಎಂದು ಹೇಳಿದ್ದ ನೋಬೆಲ್‌ ಪ್ರಶಸ್ತಿ ಪುರಸ್ಕೃತ ರಾಷ್ಟ್ರಕವಿ ರವೀಂದ್ರನಾಥ್‌ ಟ್ಯಾಗೋರ್‌ ಅವರ ಮುತ್ತಿನಂತ ಮಾತು.
263,ಮೊಗಸಾಲೆ ಅವರು ಸಂಪಾದಕರ ನುಡಿ ಮಾತನಾಡುವರು.
264,ರಾಜ್ ಅವರೊಂದಿಗೆ ಮೋಹಕವಾಗಿ ಹೆಜ್ಜೆ ಹಾಕಿದ ಧಾರವಾಡದ ಜಗ್ಗಲಿಗೆ ತಂಡ ನಂಜನಗೂಡಿನ ನುಡಿ ಜಾತ್ರೆಗೆ ಬಂದಿದೆ.
265,ಬಸವಾದ್ವೈತ ಅರಿವು ಮತ್ತು ಆಚಾರವನ್ನು ನಡೆ ನುಡಿ ಸಿದ್ಧಾಂತವಾಗಿಸುವಲ್ಲಿ ತಮ್ಮ ಬದುಕನ್ನೇ ಪಣಕ್ಕಿಟ್ಟರು.
266,"ಕನ್ನಡ ನಾಡು, ನುಡಿ ರಕ್ಷಣೆಗೆ ನಮ್ಮ ಸರಕಾರ ಬದ್ಧವಾಗಿದೆ ಎಂದು ಮುಖ್ಯಮಂತ್ರಿ ಬಿ."
267,ತ್ತಿಗಳೊಳಗೆ ನುಡಿ ಮುಳುಗಿತೇನಿದು ಚಿತ್ರವಾಯ್ತೆಂದ ೫೦
268,ನುಡಿ ನಿಂತ ನೀರಾಗಬಾರದೆಂದರೆ ಬೇರೆ ನುಡಿಯ ಪದಗಳನ್ನು ಬಳಸಬೇಕು.
269,"ಇಂಗ್ಲಿಶು ನುಡಿಯ ಯಜಮಾನಿಕೆಯನ್ನು ಹೊರತುಪಡಿಸಿ ನೋಡಿದರೆ, ಜ್ಞಾನಶಿಸ್ತುಗಳಲ್ಲಿ ತಮಿಳು ಯಜಮಾನಿಕೆಯು ನುಡಿ ಬೆಳವಣಿಗೆಗೆ ಮತ್ತು ಅಂತಹ ಬೆಳವಣಿಗೆಗೆ ಮೂಲವಾಗಿರುವ ತಮಿಳು ಧೋರಣೆಗಳನ್ನು ಹುಟ್ಟು ಹಾಕುವುದು ಅಗತ್ಯವಾಗಿರುತ್ತದೆ."
270,ನುಡಿ ನುಡಿಗೂ ಬಾಯಿ ತಡಬಡವೇನೇ॥
271,ಅದಕ್ಕೆ ಕಾರಣ ಪುಟ್ಟಣ್ಣಯ್ಯರ ಹೋರಾಟ ನಡೆ ನುಡಿ ಸಿದ್ಧಾಂತ ಮತ್ತು ಅವರ ಯೋಚನೆ ಯೋಜನೆಯಲ್ಲಿದ್ದ ಪ್ರಾಮಾಣಿಕತೆ… ಹೀಗೆ ಹೇಳ್ತಾ ಹೋದ್ರೆ ಒಂದಾ ಎರಡಾ.
272,ನಿಮ್ಮಗ ಹೇಳುವ ನುಡಿ ಕೇಳು
273,"ನಡೆ ನುಡಿ ಸಿದ್ಧಾಂತದ ಶರಣರು ಜಾತಿ ನಿರರ್ಥಕ, ನೀತಿ ಲೋಕರಕ್ಷಕ ಎಂಬ ತತ್ತ್ವದಲ್ಲಿ ನಂಬಿಕೆ ಇಟ್ಟವರಾಗಿದ್ದರು."
274,"ನುಡಿ ತೇರು ಕಟ್ಟುತಿಹ ಸಂಪದಿಗ, ಮಿತ್ರ"
275,ನುಡಿ ಹಬ್ಬದ ಹಿಂದೆ ಏನೆಲ್ಲಾ ಕಷ್ಟ-ಸುಖಗಳಿವೆ ಗೊತ್ತೆ?
276,ನುಡಿ ಹಾಗು ಲಿಪಿಯನ್ನು ಒ೦ದಕ್ಕೊ೦ದು ಅತಿಯಾಗಿ ಅವಲ೦ಬಿಸದೆ ಭಾಷೆಯ ಬೆಳವಣಿಗೆ ಸಾಗಬೇಕು ಎನ್ನುವುದು ಅವರ ಅಭಿಮತವಾಗಿತ್ತು.
277,ಈ ಅದರ ದೊಡ್ಡ ಗಾತ್ರದ ಲೋಹದ ಶೀನ್ ಮತ್ತು ಭಯಾನಕ ಅಪಶಕುನ ನುಡಿ ಕಡು ಬಣ್ಣದ ಮಾಡುವುದು.
278,ಸಮೀಪದ ಯಲ್ಲಟ್ಟಿಯಲ್ಲಿ ಶುಕ್ರವಾರ ನಡೆದ ಕೊಣ್ಣೂರು ನುಡಿ ಸಡಗರ ಕಾರ್ಯಕ್ರಮ ಉದ್ಘಾಟಿಸಿ ಅವರು ಮಾತನಾಡಿದರು.
279,"ಇಂಗ್ಲಿಷ್ ನುಡಿ ಬರಹ (ಸಬ್ ಟೈಟಲ್ಸ್) ದೊಂದಿಗೆ ಪ್ರದರ್ಶಿಸಿ, ನಮಗೂ ಅರ್ಥಮಾಡಿಕೊಳ್ಳಲು ಸುಲಭವಾಗುತ್ತದೆ ಎನ್ನುವುದು ಜಪಾನೀ ಪ್ರೇಕ್ಷಕರ ಬಹು ದಿನಗಳ ಕೋರಿಕೆ."
280,ಕನ್ನಡ ನಾಡ ನುಡಿ ಇಡೀ ರಾಷ್ಟ್ರದ ಗಮನವನ್ನು ಸೆಳೆದಿದೆ.
281,ಕಸಾಪ ಜಿಲ್ಲಾಧ್ಯಕ್ಷ ಮಲ್ಲಿಕಾರ್ಜುನ ಯಂಡಿಗೇರಿ ಆಶಯ ನುಡಿ ವ್ಯಕ್ತಪಡಿಸಿದರು.
282,ನಡುವೆ ಇಲ್ಲಿನ ಆತ್ಮಕಥನಗಳಲ್ಲಿ ಕನ್ನಡವು ಚಿಂತನೆ ಹಾಗೂ ಬಳಕೆಯ ನುಡಿ ಎನ್ನುವುದೂ ಇಂಗ್ಲಿ ಷ ಕೇವಲ ಗ್ರಹಿಕೆಯ ನುಡಿ ಎನ್ನುವದೂ ಅವರ ವೈಚಾರಿಕ ಸಿದ್ಧಾಂತವಾಗಿಯೇ ರೂಪುಗೊಂಡಿದೆ.
283,"ನಮ್ಮ ಸಾಹಿತಿಗಳು, ಕನ್ನಡ ಸಾಹಿತ್ಯ ಪರಿಷತ್ತು, ಕನ್ನಡ ಮತ್ತು ಸಂಸ್ಕೃತಿ ಸಚಿವರು ಮತ್ತು ಸಾಮಾನ್ಯ ಕನ್ನಡಿಗರು ಬಡಗರ ಬಗ್ಗೆ ಆಸಕ್ತಿ ವಹಿಸಿ ಬಡಗ ನುಡಿ ಮತ್ತು ಬಡಗರನ್ನು ನಮ್ಮವರೆಂದು ಅಪ್ಪಿಕೊಂಡು ಅವರನ್ನು ಹೊರನಾಡ ಕನ್ನಡಿಗರೆಂದು ಸ್ಥಾನಮಾನ ನೀಡಿ ಗೌರವಿಸಬೇಕೆಂದು ಕೇಳಿಕೊಳ್ಳುತ್ತೇನೆ."
284,ಕಂತುಪಿತನ ನುಡಿ ಕೇಳುತ ಧೈರ್ಯದಿ | ಕುಂತಿಯ ಸುತ ತಾನು ||
285,"ಉಸಿರಾಡುವ ಈ ದೇಹದೇಹ ಮೆಟ್ಟುವ ಈ ನೆಲನೆಲದ ಮೆಲೆ ಬೆಳೆಯುವ ಫಲಫಲದಿಂದ ಬರುವ ಈ ಬಲಬಲದಿಂದ ಹೇಳಿದ ಪದಪದಗಳಿಂದ ನುಡಿ ಹೊರಬರುವಕನ್ನಡ ಕನ್ನಡ ಕನ್ನಡ ಮಲನಾಡಿನ ತಂಪು ನಿಡುವಬಯಲಸಿಮೆಯ ಬಿಸಿ ಇರುವತುಂಗ ಭದ್ರ ಕಾವೇರಿ ನೆಲಿಸಿದನಾಡು ನಮ್ಮದು,…"
286,"ಭುಜೇಂದ್ರ ಮಹಿಷವಾಡಗಿ, ನುಡಿ ಮಾರ್ಗವನು ಮನೋಹರ ದೇಶಪಾಂಡೆ, ಪುಸ್ತಕ ಮಳಿಗೆಯನ್ನು ಕೆ."
287,"ತಾಲೂಕು ಬಿಜೆಪಿಯಿಂದ ನಗರದ ಪಿಪಿ ವೃತ್ತದಲ್ಲಿ ಮಾನವ ಸರಪಳಿ ನಿರ್ಮಿಸಿ ರಸ್ತೆ ತಡೆ ನಡೆಸಿದ ಸಂದರ್ಭದಲ್ಲಿ ಕಾರ್ಯ ಕರ್ತರನ್ನು ಉದ್ದೇಶಿಸಿ ಮಾತನಾಡಿದ ಅವರು, ರಾಜ್ಯದ ರೈತರು ಸಾಲದ ಸುಳಿಯಲ್ಲಿ ಸಿಲುಕಿ ಆತ್ಮಹತ್ಯೆ ಹಾದಿ ಹಿಡಿದಿದ್ದು ಕೂಡಲೇ ಕುಮಾರಸ್ವಾಮಿಯವರು ತಾವು ನುಡಿ ದಂತೆ ನಡೆದುಕೊಂಡು ಸಾಲಮನ್ನಾ ಮಾಡ ಬೇಕಿದೆ."
288,ನಿನ್ನ ನುಡಿ ನಿನಗೆ ಹಗೆಯಾಯ್ತೆ ಕಂಡುದನಲ್ಲ
289,ಭಟ್ಕಳ: ನಮ್ಮ ನಾಡು ನುಡಿ ಪರಂಪರೆಯ ಇತಿಹಾಸ ಅರಿವು ನಮಗಿರಬೇಕು.
290,"ಈ ನೆಲೆಯಲ್ಲಿ ಚರ್ಚಿತವಾದ ಸಂಸ್ಕೃತಿ ಯ ಜಾಗದಲ್ಲಿ ಕನ್ನಡ ನಾಡು, ಭಾಷೆ ಯ ನೆಲೆಯಲ್ಲಿ ಕನ್ನಡ ನುಡಿ ಮತ್ತು ಅವುಗಳ ಶಿಶುವಾದ ಮನುಷ್ಯ ನ ಜಾಗದಲ್ಲಿ ಕನ್ನಡಿಗ ನನ್ನು ಇಟ್ಟು ನೋಡಬೇಕಾಗಿದೆ."
291,ಕನ್ನಡ ನುಡಿ ವೈಜ್ಞಾನಿಕವಾಗಿ ಕಲಿಯಲು ಇಲ್ಲಿದೆ ಅವಕಾಶ
