Index,Sentence
393,"ಚೈತ್ರಾ ಬ್ಯಾಳಿ, ಕೀರ್ತಿ ನವಲಗುಂದ ನುಡಿ ನಮನ ಗೀತೆ ಹಾಡಿದರು."
394,ಇಂತಹ ಸಂದರ್ಭದಲ್ಲಿ ಪಾಲಕರು ಶಿಕ್ಷಕರು ಹಾಗು ಸಮಾಜ ಹದಿವಯಸ್ಸಿನಲ್ಲಿ ಆಗುವ ಬದಲಾವಣೆ ನಡೆ ನುಡಿ ತಿದ್ದಿಕೊಳ್ಳುವ ಕುರಿತು ಮಕ್ಕಳಿಗೆ ತಿಳಿಸಬೇಕೆಂದರು
395,ಆದರೆ ಕೇವಲ ನುಡಿ ಮಾತ್ರವೇ ಇರುವ ಸಂಸ್ಕೃತಿಯಲ್ಲಿ ಪಠ್ಯಗಳು ಇರುವುದಿಲ್ಲ.
396,ಒಬ್ಬ ಸಾಮಾನ್ಯ ಕನ್ನಡಿಗ ತನ್ನ ನಾಡು ನುಡಿ ಬಗ್ಗೆ ಕಾಳಜಿ ಹೊಂದಿದ್ದರೆ ಸಾಕು!
397,ಹಲವಾರು ಒಳನುಡಿಗಳನ್ನಾಡುವ ಜನರ ನಡುವೆ ಒಂದೇ ಬಗೆಯ ಬರಹದ ನುಡಿ ಬಳಕೆಗೆ ಬಂದಿರುವುದಕ್ಕೂ ಈ ರೀತಿ ಬರಹಗಳನ್ನು ಅಚ್ಚುಹಾಕಲು ತೊಡಗಿದುದೇ ಕಾರಣವಾಗಿದೆ.
398,ಜಿಲ್ಲಾ ಘಟಕದ ಅಧ್ಯಕ್ಷ ಸಿದ್ದರಾಮ ಕಲ್ಮಠ ವಹಿಸಿಕೊಂಡು ಅಧ್ಯಕ್ಷೀಯ ನುಡಿ ನುಡಿದರು.
399,"ಮನ್ರೋ ನಂತರ ಮೇಲೇಳುತ್ತಾ, ಆರ್ಕೆಸ್ಟ್ರಾ ಜನ್ಮದಿನದ ಶುಭಾಶಯಗಳು ಹಾಡನ್ನು ನುಡಿ"
400,"ನುಡಿ ಬಳಸಿ ನಾಡು ಕಟ್ಟುವುದೇ ಆದಲ್ಲಿ ಕನ್ನಡಿಗರು ತಮಗೆ ಯಾವ ತಿಳಿವುಗಳು ಮೇಲ್ಮೆಯವು, ಆತುರದಲ್ಲಿ ಬೇಕಿರುವುವು ಎಂದು ಕಂಡುಕೊಳ್ಳಬೇಕಾಗುತ್ತದೆ ದಿಟ."
401,"ಗಡಾದ ಗದಗ ಇವರು ಬಿಡುಗಡೆಗೊಳಿಸಿ ಮಾತನಾಡಿ, ಸಾನ್ವಿ ಮಕ್ಕಳ ಕವನ ಸಂಕಲನದಲ್ಲಿ ಒಟ್ಟು 68 ಕವಿತೆಗಳಿವೆ ಇದರಲ್ಲಿ ತಿರುಳ್ಗನ್ನಡ ನಾಡನ್ನು, ಗವಿಮಠವನ್ನು, ಕೊಪ್ಪಳವನ್ನು ತಮ್ಮ ಕುಟುಂಬದವರನ್ನು ಕನ್ನಡ ನಾಡು ನುಡಿ ಸಂಸ್ಕೃತಿ ಬಿಂಬಿಸುವ ಕವಿತೆಗಳು, ಇಸ್ರೋ, ಅಬ್ದುಲ್ ಕಲಾಂ, ಹಾರುವ ತಟ್ಟೆ, ವಿಜ್ಞಾನ, ತಂತ್ರಜ್ಞಾನ, ಅಂತರೀಕ್ಷದ ಕೌತುಕವನ್ನು, ಕರುನಾಡನ್ನು ಭರತ ಭೂಮಿಯನ್ನು ವಣರ್ಿಸಿದ್ದಾರೆ."
402,ನಡೆದ ಸದ್ಗತಿಗೀಗ ಜ್ಞಾನಿ ಸೈರಿಸು ಎಂಬ | ನುಡಿ ಕೇಳಿ ಕ್ಷಮೆಯ ತಾಳ್ದು || 427 ||
403,"ಬಹು ರೂಪಿ ವಸ್ತುಪ್ರದರ್ಶನದಲ್ಲಿ ನೇಗಿಲ ನುಡಿ ಹೆಸರಿನಲ್ಲಿ ಮಳಿಗೆ ತೆರೆದಿದ್ದು, ಪ್ರದರ್ಶನ ವೀಕ್ಷಿಸಲು ಬರುವ ಆಸಕ್ತರಿಗೆ ಬಿಳಿಗಿರಿ ರಂಗನಬೆಟ್ಟದ ಸೋಲಿಗರ ಹೆಸರಿನಲ್ಲಿ ರಾಜಗಿರ(ಯಡ್ಡಾ) ಬಿತ್ತನೆ ಬೀಜವನ್ನು ಉಚಿತ ವಾಗಿ ನೀಡುವ ಮೂಲಕ ರಾಜಗಿರವನ್ನು ಬೆಳೆಯುವುದಕ್ಕೂ ಪ್ರೇರಣೆ ನೀಡುತ್ತಿದೆ."
404,ನುಡಿ ಕೊಳ್ಳದೆಂದೆನಿಸಿ ಯೋಗಮಜ್ಜನವ ನಡಸುತ್ತಿರ್ದನಪ್ರತಿಮನು ೮
405,ಭಾರತದಲ್ಲಿ ನಡೆದ ಕೆಲವು ನುಡಿ ಸಾಹಸಗಳ ನಿದರ್ಶನಗಳನ್ನು ಮುಂದಿನ ವಾರಗಳಲ್ಲಿ ನೋಡೋಣ.
406,11): ನಾಡು-ನೆಲ-ಜಲ-ಸಂಸ್ಕೃತಿಗೆ ಧಕ್ಕೆ ಬಂದಾಗ ಧ್ವನಿ ಎತ್ತಲೆಂದು ಇರುವ ಕರ್ನಾಟಕ ರಕ್ಷಣಾ ವೇದಿಕೆಯ ಇತ್ತೀಚಿನ ನಡೆ ನುಡಿ ಬೇರೆಯೇ ಪ್ರಶ್ನೆಗಳನ್ನ ಹುಟ್ಟುಹಾಕುತ್ತಿದೆ.
407,ಸಮ್ಮೇಳಾಧ್ಯಕ್ಷರ ನುಡಿ ಸಮಾಜಕ್ಕೆ ಒಳ್ಳೆಯ ಸಂದೇಶ ಕೊಡಬೇಕು ಅಂತವರನ್ನು ಅಧ್ಯಕ್ಷರನ್ನಾಗಿ ಮಾಡಿ ಎಂದು ಹೇಳಿದ್ದೇವೆ ಎಂದರು
408,ರಂದು ಆಚರಿಸಿಯೇ ತೀರುತ್ತೇವೆ- ಜಯಮಾಲಾ ಖಡಕ್​​​ ನುಡಿ
409,1890ರಲ್ಲಿ ಕನ್ನಡ ನುಡಿ ರಕ್ಷಣೆಗಾಗಿ ಧಾರವಾಡದಲ್ಲಿ ರಾ.
410,ನಾನೇ ಮುಂದಿನ ಪ್ರಧಾನಿ ಎಂಬ ರಾಹುಲ್ ನುಡಿ
411,ವಿಡಿಯೋ ಕೃಪೆ: ಕನ್ನಡ ನುಡಿ
412,ಬಾಳುಗೆಡುವುದನರಿಯದೇ ಹೋದನೆಂಬ ನುಡಿ |
413,ಹೇಳ ಬ್ಯಾಡೋ ನುಡಿ || ಜೀ ||
414,ಇಂತವರ ನಡೆ ನುಡಿ ಬಗ್ಗೆ ನಾವು ಮಾತನಾಡುವುದರಿಂದ ಅವರ ಆದರ್ಶ ಪಾಲಿಸಲು ಇತರರಿಗೆ ಉತ್ತೇಜನ ನೀಡಿದಂತಾಗುವುದು ಎಂದರು.
415,"ಶಿವಕುಮಾರ ಸ್ವಾಮೀಜಿ ಅವರ ಸ್ಮರಣಾರ್ಥ ನುಡಿ ನಮನ ಹಾಗೂ ಕವಿಗೋಷ್ಟಿ ಕಾರ್ಯಕ್ರಮದಲ್ಲಿ ಮುಖ್ಯ ಅತಿಥಿಗಳಾಗಿ ಮಾತನಾಡಿದ ಅವರು, ಸ್ವಾಮಿ ಹಾಗೂ ಸನ್ಯಾಸತ್ವಕ್ಕೆ ಸ್ವಾಮೀಜಿಗಳು ಹೆಸರುವಾಸಿಯಾಗಿದ್ದರು."
416,ಆದರೆ ಭಾಗವಹಿಸಿದರೆ ಅವರಿಗೆ ಮಾನಸಿಕ ಮತ್ತು ಬೌದ್ಧಿಕವಾಗಿ ಚೈತನ್ಯ ಬರುತ್ತದೆ ಎನ್ನುವ ನುಡಿ ನಿರ್ದೇಶಕ ಬಿ.
417,ಭವದ ಬೇರು ಮೊದಲು ಕಡಿಯಣ್ಣ || ನುಡಿ ||
418,"ಈ ಬಾರಿ ಯುವ ಸಂಭ್ರಮದಲ್ಲಿ ನಿರೂಪಣೆ ಮಾಡುವವರ ಭಾಷೆ ಯುವಕರನ್ನು ಬೇರೆಡೆ ಪ್ರೇರೇಪಿಸುವ ಹಾಗಿರದೆ ನಮ್ಮ ನಾಡು ನುಡಿ ಮಹಾರಾಜರ ಇತಿಹಾಸ ಸಾರುವ ಮಾಹಿತಿಗಳು ಕೊಡದೆ ದಸರಾದಲ್ಲಿ ಯುವ ಜನತೆಯನ್ನು ದಾರಿತಪ್ಪಿಸುವ ಹಾಗಿರಬಾರದು ಎಂದು ಸಮಗ್ರ ಕರ್ನಾಟಕ ರಕ್ಷಣಾ ವೇದಿಕೆಯ ಅರವಿಂದ್ ಶರ್ಮ ಉಸ್ತುವಾರಿ ಸಚಿವರ ಗಮನಕ್ಕೆ ತಂದಿದ್ದು, ಅದಕ್ಕೆ ಕ್ರಮ ತೆಗೆದು ಕೊಳ್ಳುವುದಾಗಿ ಹೇಳಿದರು."
419,"ಕನ್ನಡ ಭಾಷೆ, ನಾಡು, ನುಡಿ ಬಗ್ಗೆ ಅಪಾರ ಅಭಿಮಾನ ಹೊಂದಿರುವ ಚೇತನ್, ಸದ್ಯ ತಮ್ಮ ಪ್ರಿಯತಮೆಗೆ ಕನ್ನಡ ಪಾಠ ಕಲಿಸುತ್ತಿದ್ದಾರೆ."
420,ಕನ್ನಡ ನುಡಿ ದೇವಿಯ ಉತ್ಕರ್ಷಕ್ಕೆ ಸೂಚಕವಾಗಿತ್ತು.
421,ಮೂಡಲಗಿ 21: ರಾಜ್ಯದ ನಾಡು ನುಡಿ ರಕ್ಷಣೆಯ ಹೊಣೆ ಹೊರಬೇಕಿದ್ದ ಸಕರ್ಾರವೇ ನಾಡಿನ ಭಾಷೆಯ ಮೇಲೆ ಅನ್ಯಭಾಷೆಯನ್ನು ಹೇರುತ್ತಿರುವುದು ಕನ್ನಡ ಭಾಷೆಗೆ ಸಕರ್ಾರ ಮಾಡಿದ ದೊಡ್ಡ ಅನ್ಯಾಯ ಎಂದು ಕನರ್ಾಟಕ ನವನಿಮರ್ಾಣ ಸೇನೆ ತಾಲೂಕಾಧ್ಯಕ್ಷ ಸಚಿನ ಲೆಂಕೆನ್ನವರ ಹೇಳಿದರು.
422,ಸಿನಿಮಾ ಮಾತ್ರವಲ್ಲ ಕನ್ನಡ ನಾಡು ನುಡಿ ಇರುವವರೆಗೂ ರಾಜಕುಮಾರ್‌ ಅವರ ಹೆಸರು ಚಿರಸ್ತಾಯಿ ಆಗಿರುತ್ತದೆ ಎಂದು ಹೇಳಿದ ಕೆ.
423,ಕಾಡು ಮಲ್ಲೇಶ್ವರ ದೇವಾಲಯದಿಂದ ಮೈದಾನದವರೆಗೆ ನಾಡು ನುಡಿ ಪರಂಪರೆಯನ್ನು ಬಿಂಬಿಸುವ ಜನಪದ ತಂಡಗಳ ಬೃಹತ್ ಮೆರವಣಿಗೆ ನಡೆಯಿತು.
424,ಜಿಲ್ಲೆಯಾದ್ಯಂತ ಪರ ವಿರೋಧದ ನಡುವೆಯೇ ನಾಡು ನುಡಿ ಒಂದೇ ಎಂಬ ಧ್ಯೇಯದೊಂದಿಗೆ ಉಸಿರಾಡುವ ಈ ನೆಲದಲ್ಲಿ ಮಾತೃಭಾಷೆಗೆ ಅವಮಾನ ವೆಸಗಿರುವುದು ಸರಿ ಅಲ್ಲ ಎಂಬ ಅಭಿಪ್ರಾಯ ಸಾರ್ವಜನಿಕರಿಂದ ಕೇಳಿ ಬಂದಿದೆ.
425,ಹಿಗೆ ನಡೆ – ನುಡಿ ಒಂದಾಗಿರುವುದು ಕವಿಯ ವ್ಯಕ್ತಿತ್ವದ ಅನಿವಾರ್ಯ ಗುಣ.
426,"ಸಾನ್ನಿಧ್ಯ ವಹಿಸಿದ್ದ ರಾಮಕೃಷ್ಣ ಆಶ್ರಮದ ವಿಜಯಾನಂದ ಸರಸ್ವತಿ ಸ್ವಾಮೀಜಿ ಮಾತನಾಡಿ, ಶ್ರೀಗಳು ಕನ್ನಡ ನಾಡು ನುಡಿ ಭಾಷೆ ಹಾಗೂ ಕಾಯಕ ದಾಸೋಹಕ್ಕೆ ನೀಡಿದ ಕೊಡುಗೆ ಅಪಾರವಾಗಿದೆ."
427,Home ಕನ್ನಡ ವಾರ್ತೆಗಳು ಕರಾವಳಿ ಕೋಟ ಜೋಡಿ ಕೊಲೆಗೆ ನ್ಯಾಯ ಕೇಳಿ ದೇವರ ಮೊರೆ ಹೋದವರಿಗೆ ಸಿಕ್ಕಿತು ಭರವಸೆಯ ನುಡಿ (Video)
428,ಬಹುಸಮಯದ ಬಳಿಕ ಒಂದೊಳ್ಳೆ ಪಾತ್ರ ಸಿಕ್ಕಿದೆ ಎಂಬ ಸಂತಸದ ನುಡಿ ಹಿರಿಯ ನಟ ಶ್ರೀನಾಥ್‌ ಅವರದು.
429,ನನ್ನ ನಡೆ ನುಡಿ ಚಹರೆ ಕ್ಲೀಷೆಯಾದ
430,ಬಳ್ಳಾರಿ29: ಕನ್ನಡ ನಾಡು ನುಡಿ ಮತ್ತು ದೇಶದ ಅಭಿಮಾನ ಇದ್ದಾಗ ಮಾತ್ರ ಜೀವನದಲ್ಲಿ ಏನಾದರೂ ಸಾಧಿಸಬಹುದು.
431,ಸುಂದರಾಂಗ ನಿಮ್ಮ ನುಡಿ ಕಂದವಾಗಿ ತೋರುವದೋ
432,ಓದುಗರು ತಮ್ಮ ಅಭಿಪ್ರಾಯಗಳನ್ನು ಯೂನಿಕೋಡ್‌ ಅಥವಾ ನುಡಿ ತಂತ್ರಾಂಶದಲ್ಲಿ ಈ ವಿಳಾಸಕ್ಕೆ ಕಳುಹಿಸಬಹುದು.
433,ಕುಲಕರ್ಣಿ 7ನೇ ಸಾಹಿತ್ಯ ಸಮ್ಮೇಳನಕ್ಕೆ ಚಾಲನೆ ನೀಡಿ ಕನ್ನಡ ನಾಡು ನುಡಿ ಸಂರಕ್ಷಣೆಗಳಿಗೆ ಸಮ್ಮೇಳನಗಳು ಜರುಗುತ್ತದೆ.
434,"ಕನ್ನಡ ನಾಡು, ನುಡಿ ಹಾಗೂ ಸಂಸ್ಕೃತಿಯನ್ನು ಸದಾ ಉತ್ತುಂಘದಲ್ಲೇ ನೋಡಬಯಸೋ ಸ್ವಾಭಿಮಾನಿ ಕನ್ನಡಿಗ ಯಶ್."
435,ದತ್ತಜಯಂತಿಯಂದು ಶ್ರೀದತ್ತ ನುಡಿ
436,"ಹಾಗದರೆ ಈ ಕಾಲದೂಡನೆ ಸ್ಪರ್ಧಿಸಿ ಗೆಲ್ಲೋದು ಹೇಗೆ ಅಂತಹ ವಿಚಾರ ಮಾಡಿದಾಗ, ಕನ್ನಡ ಚಿತ್ರನಟ ಶಂಕರ್ ನಾಗ್ ರ ನುಡಿ ನೆನಪಾಗುತ್ತೆ"
437,ರೀಮೇಕ್ ಚಿತ್ರಗಳ ಹಕ್ಕುಗಳನ್ನು ಖರೀದಿಸುವುದರಲ್ಲಿ ನಾವು ಸದಾ ಮೊದಲು ಎಂಬ ವ್ಯಂಗ್ಯದ ನುಡಿ ಅವರದು.
438,ಸುರಪುರ: ಕನ್ನಡದ ನುಡಿ ಗಡಿ ಮತ್ತು ಭಾಷೆಯ ಉಳಿವಿಗಾಗಿ ನಿರಂತರವಾಗಿ ದುಡಿಯುತ್ತಿರುವ ಕರ್ನಾಟಕ ರಕ್ಷಣಾ ವೇದಿಕೆಯು ಇದೇ ತಿಂಗಳು ೧೫ನೇ ತಾರೀಖಿನಂದು ನಗರದ ವೇಣುಗೋಪಾಲ ಸ್ವಾಮಿ ದೇವಸ್ಥಾನದ ಆವರಣದಲ್ಲಿ ಕನ್ನಡ ಜಾಗೃತಿ ಸಮಾವೇಶವನ್ನು ಹಮ್ಮಿಕೊಂಡಿದ್ದು ಎಲ್ಲಾ ಕನ್ನಡಾಭಿಮಾನಿಗಳು ಹೆಚ್ಚಿನ ಸಂಖ್ಯೆಯಲ್ಲಿ ಭಾಗವಹಿಸುವಂತೆ ವೇದಿಕೆಯ ರಾಜ್ಯ ಪ್ರಧಾನ ಸಂಚಾಲಕ ಬಸವರಾಜ ಪಡಕೋಟೆ ಮಾತನಾಡಿದರು.
439,"ಯಾಕೆಂದರೆ, ಕನ್ನಡ ನುಡಿ ಎಂಬುದು ಮುಕ್ಯವಾಗಿ ಕನ್ನಡಿಗರ ಮಾತಲ್ಲದೆ ಬರಹವಲ್ಲ."
440,"ಅದರೆ,ಅವಳದೊಂದೇ ನುಡಿ ಟ್ಯೂಶನ್ ಗೆ ನಡಿ."
441,ಮಂ || ನುಡಿ ನೀರಾನನಮಬ್ಜಯಕ್ಷಯುಗಳಂ ಮಿನ್ಗಳ್ ಕರಂ ಭಾವಕಂ
442,"ಕ್ರಿಮಿನಲ್‌ ನ್ಯಾಯವಾದಿ ಮಹೇಶ್‌ ಕರ್ಕೇರ ಅವರು ನುಡಿ ನಮನ ಸಲ್ಲಿಸುತ್ತ, ಜಾರ್ಜ್‌ ಓರ್ವ ಛಲವಾದಿ."
443,"ಮೇಲ್ನೋಟಕ್ಕೆ ಈ ಬಗೆಯ ಯಾವುದೇ ಸೀಳುಗಳು ನುಡಿಯಲ್ಲಿಲ್ಲ ಎಂದು ನಂಬಿಸಲಾಗಿದ್ದರೂ, ನುಡಿ ಹಾಗೂ ನುಡಿಗೆ ಸಂಬಂಧಪಟ್ಟ ಕ್ರಿಯೆಗಳು, ಇಂತಹ ಸೀಳುಗಳು ನುಡಿಯಲ್ಲಿ ಹೇಗೆ ಅಂತರ್ಗತವಾಗಿವೆ ಎಂಬುದನ್ನು ತೋರ್ಪಡಿಸುತ್ತವೆ."
444,"ಕನ್ನಡಮ್ಮನ ತೇರು ಎಳೆಯಲು ಎಲ್ಲರೂ ಸಕ್ರಿಯವಾಗಿದ್ದಾರೆ: ನುಡಿ ಜಾತ್ರೆ ಅಂಗವಾಗಿ ಕನ್ನಡಮ್ಮನ ತೇರು ಎಳೆಯಲು ಜಿಲ್ಲೆಯ ಎಲ್ಲ ಕನ್ನಡಪರ ಸಂಘಟನೆಗಳು, ಸಾಹಿತಿಗಳು, ಅಧಿಕಾರಿಗಳು ಸಮ್ಮೇಳನ ಯಶಸ್ಸಿಗೆ ದುಡಿಯುತ್ತಿದ್ದು, ಅಕ್ಷರ ಜಾತ್ರೆ ಐತಿಹಾಸಿಕ ಯಶಸ್ವಿಯಾಗಲಿದೆ."
445,"ಹುಸಿ ಭಕ್ತರು, ನುಡಿ ವಂಚಕರು ಇದ್ದಾರೆ."
446,ಸುಮಾರು 2 ಸಾವಿರ ವರ್ಷಗಳಿಂದಲೂ ಹೆಚ್ಚಿನ ಇತಿಹಾಸವುಳ್ಳ ಈ ಕನ್ನಡನಾಡು ನುಡಿ ಇಂದು ನೂರಾರು ಸಮಸ್ಯೆಗಳ ಸುಳಿಯೊಳಗೆ ಸಿಲುಕಿಕೊಂಡಿರುವುದು ಸವಾಲುಗಳನ್ನು ಎದರಿಸುತ್ತಿರುವುದು ನೋವಿನ ವಿಚಾರ ಎಂದರು.
447,"ಪುಸ್ತಕ ಬಿಡುಗಡೆ ನುಡಿ ನಮನ, ಮಹಿಷ ಪ್ರಶಸ್ತಿ ಪ್ರಧಾನ ನಡೆಸಲಾಗುವುದು."
448,ಅಲ್ಲಿ ವಾಸಿಸುವವರ ನಡೆ ಬ್ರಿಟಿಷ್; ನುಡಿ ಇಂಗ್ಲಿಷ್!
449,"ನೀವು ಮಗುವನ್ನು ನುಡಿ ವಸಂತ ಯಾಂತ್ರಿಕ, ಮತ್ತು ಉತ್ಪನ್ನ ವಿನ್ಯಾಸ ಒಂದು ಅಂತರ್ನಿರ್ಮಿತ ಹಾಸಿಗೆಯ ಆರಿಸಿಕೊಂಡಾಗ."
450,ಕನ್ನಡ ಸಾಹಿತ್ಯ ಪರಿಷತ್‌ ಜಿಲ್ಲಾ ಘಟಕದ ವತಿಯಿಂದ ಮಂಗಳವಾರ ಹಮ್ಮಿಕೊಂಡಿದ್ದ ಗಿರೀಶ ಕಾರ್ನಾಡ ನುಡಿ – ನಮನ ಕಾರ್ಯಕ್ರಮದಲ್ಲಿ ಭಾಗವಹಿಸಿ ಅವರು ಮಾತನಾಡಿದರು.
451,"ಅಥವಾ ಔಟ್‌ಲುಕ್ ಮಾದರಿಯ ವಿ-ಅಂಚೆಯ ತಂತ್ರಾಂಶದಲ್ಲಿ ನೇರವಾಗಿ ಬರಹ, ನುಡಿ ಮಾದರಿಯ ಬೆರಳಚ್ಚು ತಂತ್ರಾಶವನ್ನು ಬಳಸಿ ಕನ್ನಡದಲ್ಲಿ ಬೆರಳಚ್ಚು ಮಾಡಿ ಕಳುಹಿಸುವುದು."
452,ನಡೆ ನುಡಿ ಕ್ರಿಯಾಶೀಲನೆ ನಮ್ಮ ಪಾಡು
453,ಎನ್ನುವ ಎಡೆಯಾಳದ ನೋವಿನ ನುಡಿ ನಾಟಕದ ವಸ್ತುಧ್ವನಿಯಾಗಿ ಅನುಕರಿಸುತ್ತದೆ.
454,"ಕನ್ನಡ ಭಾಷೆಯಲ್ಲಿ ಬರಹ ಮತ್ತು ನುಡಿ ಎನ್ನುವ ತಂತ್ರಾಂಶಗಳು ಉಚಿತವಾಗಿ ಲಭ್ಯವಿದ್ದು, ಇವುಗಳನ್ನು ಬಳಸಲು ಇಂಗ್ಲಿಶ್ ಭಾಷೆಯಲ್ಲಿರುವ ಆಪರೇಟಿಂಗ್ ಸಿಸ್ಟಂಗಳನ್ನು ಉಪಯೋಗಿಸಬೇಕಾಗಿದೆ."
455,ಸಮಾರಂಭದಲ್ಲಿ ಪ್ರಾಸ್ತವಿಕ ನುಡಿ ತಿಳಿಸಿದ ಶ್ರೀ ಗುರುಮಲ್ಲೇಶ್ವರ ಸೇವಾ ಸಮಿತಿ ಅಧ್ಯಕ್ಷರು ಹಾಗೂ ಫ್ರೋ|| ಸದಾಶಿವಮೂರ್ತಿ ಯವರು ಅನುರಾಗ್ ಮಕ್ಕಳ ಮನೆಯ ಸಂಸ್ಥಾಪಕ ದೇವನೂರು ಗ್ರಾಮದ ಡಿ.
456,ರಾಮಾಯಣದ ಕವಿಗೆ ನುಡಿ ನಮನ
457,20-21ರಂದು ಕೊಣ್ಣೂರು ನುಡಿ ಸಮ್ಮೇಳನ
458,ಇದಷ್ಟೇ ಅಲ್ಲ ನುಡಿ ನಮನ ಕಾರ್ಯಕ್ರಮದ ಜೊತೆ ಅಂಬಿ ಹೆಸರಿನಲ್ಲಿ ಆರ್ಥಿಕ ಸಹಾಯವನ್ನು ಕೂಡ ಮಾಡುವ ಮಾದರಿ ಕಾರ್ಯಕ್ರಮ ಇದಾಗಲಿದೆ.
459,ಉಡುಪಿ ರಥಬೀದಿ ಗೆಳೆಯರು ವತಿಯಿಂದ ಉಡುಪಿಯ ಎಂಜಿಎಂ ಕಾಲೇಜಿನ ಗೋವಿಂದ ಪೈ ಸಂಶೋಧನ ಕೇಂದ್ರದ ಧ್ವನ್ಯಾಲೋಕದಲ್ಲಿ ಮಂಗಳ ವಾರ ನಡೆದ ಗಿರೀಶ್ ಕಾರ್ನಾಡ್‌ರಿಗೆ ನುಡಿ ನಮನ ಕಾರ್ಯಕ್ರವುದಲ್ಲಿ ಅವರು ಮಾತನಾಡುತಿದ್ದರು.
460,ಈ ನೇರ ನುಡಿ ಕ್ರಮೇಣ ಉರುಳುವ ಹಿಮಗಡ್ಡೆಯಂತೆ ತೋರಗೊಳ್ಳುತ್ತ ಹೋಗುತ್ತಿತ್ತೆಂದು ಕೆಲವು ಮಿತ್ರರಿಂದ ತಿಳಿದಾಗ ನನ್ನಲ್ಲಿ ಮೊಳೆತದ್ದು ತಿರಸ್ಕಾರ.
461,"ಅರ್ಥ : ಯತ್ರ = ಎಲ್ಲಿ, ಉಪಕೃತ್ಯ = ಉಪಕರಿಸುವುದಱ (ಮಾಡಿ) ಉಕ್ತಿಃ = ನುಡಿ (ಮಾಹವು) ತತ್ = ಅದು, ಕಿಂಕೃತಂ = ಏನುಪಕಾರಮೆ || ಉಪಕಾರಂಗೆಯ್ದುನುಡಿಯವೇಡೆಂಬುದುತಾತ್ಪರ್ಯಂ || ಇಂತಿಪ್ಪವರ್ಗೆನಂಟುನಡೆಯದೆಂಬುದುತ್ತರವಾಕ್ಯಂ :"
462,ನೇರ ನುಡಿ
463,ಸುಡು ತಾಯಿ ನಿಮ್ಮಾತ ನುಡಿ ಕಿವಿಗೆ ಬೀಳಲು | ಹೊಡೆಯಬೇಕಾತನ ಮೇಲೆ |
464,ಕೊತ್ತಲ ಬಸವೇಶ್ವರ ದೇವಾಲಯದ ಸ್ವಾಮಿಗಳಾದ ಶ್ರೀ ಸದಾಶಿವ ಸ್ವಾಮಿಗಳು ನುಡಿ ನಮನ ಸಲ್ಲಿಸಿ ಕರದಳ್ಳಿಯವರ ಬಗ್ಗೆ ಭಾವಪೂರ್ಣ ಮಾತುಗಳಾಡಿದರು.
465,ಲಿಂಗಾಯತ ಧರ್ಮ ನಡೆ ನುಡಿ ಸಿದ್ಧಾಂತಕ್ಕೆ ಮನ್ನಣೆ ನೀಡಿದೆ.
466,ತಮಟೆ ನುಡಿ ಎನ್ನುವುದು ಊರಿನ ಎಚ್ಚರಿಕೆಯ ದನಿ.
467,ಶಶಿವಂಶ ಕಳೆಗುಂದಿದರುನಾನಾಡಿದ ನುಡಿ |
468,ನಿನಗದೀಗಳೆಯಹುದು ಚಿಂತೆಯ | ಮನಸಿನಿಂ ತೆಗೆ ನನ್ನ ನುಡಿ ರಾ |
469,ಮಹಾ ಶಿವರಾತ್ರಿ ನಿಮಿತ್ತ ಸೋಮವಾರ ರಾತ್ರಿ ಶ್ರೀಬಸವೇಶ್ವರ ದೇವಸ್ಥಾನದಲ್ಲಿ ವಿಶೇಷ ಪೂಜೆಯೊಂದಿಗೆ ಶ್ರೀ ವೃಷಭೇಂದ್ರ ಅಪ್ಪನವರ ಸಾನ್ನಿಧ್ಯದಲ್ಲಿ ಶ್ರದ್ಧಾ ಭಕ್ತಿಯಿಂದ ಶಿವರಾತ್ರಿ ನುಡಿ ವಚನ ಪಠಿಸಲಾಯಿತು.
470,ರಂಗಕರ್ಮಿ ಸಿಜಿಕೆಯವರು ತೀರಿಕೊಂಡಾಗ ಅವರ ಬದುಕು ಹಾಗೂ ಸಾಧನೆಗಳನ್ನು ಆಧರಿಸಿ ರಂಗಜಂಗಮನಿಗೆ ನುಡಿ ನಮನ ಎನ್ನುವ ಸಿಜಿಕೆ ಕುರಿತ ಲೇಖನಗಳ ಸಂಕಲನಗಳ ಪುಸ್ತಕವನ್ನು ಬರೆದಿದ್ದೆ.
471,ಬಾಲಕಿಯ ನುಡಿ ಕೇಳುತಾಕ್ಷಣದಿ | ದುಃಖಾಂಬುಧಿಯೊಳ್ಮುನಿ |
472,"ಅಂಬಿ ಅಂತ್ಯಕ್ರಿಯೆ ವೇಳೆ ಜೊತೆಯಲ್ಲಿದ್ದ ದಳಪತಿಗಳು, ಅಂಬಿ ನುಡಿ ನಮನಕ್ಕೆ ಗೈರು."
473,ಕಾಂತಾವರದ ಅಲ್ಲಮಪ್ರಭು ಪೀಠದ ಅನುಭವದ ನಡೆ ಅನುಭಾವದ ನುಡಿ ತಿಂಗಳ ಉಪನ್ಯಾಸ ಕಾರ್ಯಕ್ರಮದಲ್ಲಿ ಅವರು ಅಲ್ಲಮನ ಅಂತರಂಗಎಂಬ ವಿಷಯದ ಬಗ್ಗೆ ಮಾತನಾಡಿದರು.
474,"ಗುರುವಾರ ಹಾನಗಲ್ ತಾಲೂಕು ಅಕ್ಕಿಆಲೂರಿನಲ್ಲಿ ಜರುಗಿದ ಕನ್ನಡ ನುಡಿ ಸಂಭ್ರಮ ಕಾರ್ಯಕ್ರಮ ಉದ್ಘಾಟಿಸಿ ಮಾತನಾಡಿದ ಅವರು, ಮಾತೃಭೂಮಿಗಾಗಿಯೇ ಜೀವನ ಮತ್ತು ಮರಣ ಎಂದು ನಾವು ಭಾವಿಸಿಕೊಳ್ಳಬೇಕು ಎಂದು ಹೇಳಿದರು."
475,ಕವಯಿತ್ರಿ ಅಕ್ಷತಾ ಕೃಷ್ಣಮೂರ್ತಿ ಆಶಯ ನುಡಿ ಆಡಿದರು.
476,ಈ ಸಮ್ಮೇಳನದಲ್ಲಿನ ನುಡಿ ಇತಿಹಾಸ ಪುಟದಲ್ಲಿಸೇರಬೇಕು ಎಂದು ಆಸೆ ವ್ಯಕ್ತಪಡಿಸಿದರು.
477,ಚಿಕ್ಕಮಗಳೂರು; ಮಲೆನಾಡ ಕನ್ನಡ ನುಡಿ ಜಾತ್ರೆಗೆ ಕ್ಷಣಗಣನೆ ಆರಂಭವಾಗಿದೆ.
478,ನನ್ನಯ ನಡೆ ನುಡಿ ಮೂಡಿತು ಸಿಹಿ ನುಡಿ
479,ಅಲ್ಲದೇ ಮನುಷ್ಯಕುಲ ಮಾತ್ರವೇ ಶ್ರೇಷ್ಠವಾಗಿದ್ದು ನಮ್ಮ ನಡೆ ನುಡಿ ಶುದ್ಧವಾಗಿರಬೇಕು ಹಾಗೂ ಯಾವುದೇ ಜಾತಿಯು ಮೇಲು ಕೀಳು ಅಲ್ಲ ಎಂದು ಹೇಳಿದರು.
480,"ಸಂಸ್ಥೆಯ ನಿರ್ದೇಶಕರಾದ ಉದ್ಯಾವರ ನಾಗೇಶ ಕುಮಾರ್, ಅಬ್ದುಲ್ ಜಲೀಲ್ ಸಾಹೇಬ್, ಚಂದ್ರಾವತಿ ಭಂಡಾರಿ, ಶರತ್ ಕುಮಾರ್, ಗ್ರಾಪಂ ಅಧ್ಯಕ್ಷೆ ಸುಗಂಧಿ ಶೇಖರ್, ತಾಪಂ ಸದಸ್ಯೆ ಗಿರೀಶ್‌ಕುಮಾರ್, ಸದಸ್ಯರಾದ ಶೇಖರ ಕೋಟ್ಯಾನ್, ಲೋರೆನ್ಸ್ ಡೇಸಾ ಅಗಲಿದ ಅಝೀಝ್ ಸಾಹೇಬರಿಗೆ ನುಡಿ ನಮನ ಸಲ್ಲಿಸಿದರು."
481,ಆ ನುಡಿ ಕೇಳಿ ಅನುಭವಿಸಿದ ಪುಳಕ ನೆನಪಿದೆ.
482,"ಮೌನವಿರದೆ ನುಡಿ, ನುಡಿ ಅಥವ ಇನ್ನು ಯಾವುದೇ ಸದ್ದು ಇಲ್ಲದೆ ಮೌನ ಇರಲು ಸಾಧ್ಯವಿಲ್ಲ."
483,"ಈಗವರು ಗಾಯಕರಾಗಿಯೂ ಗುರುತಿಸಿಕೊಂಡಿದ್ದು, ಕನ್ನಡ ರಾಜ್ಯೋತ್ಸವದ ಪ್ರಯುಕ್ತ ಕುವೆಂಪು ರಚಿತ ಜಯ ಭಾರತ ಜನನಿಯ ತನುಜಾತೆ … ನಾಡಗೀತೆಗೆ ನುಡಿ ನಮನ ಸಲ್ಲಿಸಿದ್ದಾರೆ."
484,ಮಧ್ಯಾಹ್ನ 12ಕ್ಕೆ ಕನ್ನಡ ನಾಡು ನುಡಿ ಗೋಷ್ಠಿ ಅಧ್ಯಕ್ಷತೆಯನ್ನು ಡಾ.
485,"ವರದಿಗಳನ್ನು ಬರೆಯಲು ಉಚಿತವಾಗಿ ಸಿಗುವ ಬರಹ, ನುಡಿ ಸಾಫ್ಟ್ ವೇರ್ ಬಳಸಿ ವರ್ಡ್ ಮುಖಾಂತರ ಲಗತ್ತಿಸಿ ರವಾನಿಸಿ."
486,"ಅಧಿಕಾರಕ್ಕಾಗಿ ಧರ್ಮಗಳನ್ನು ಒಡೆದವ್ರು ಮೋದಿ, ನಾನಲ್ಲ: ಹೆಚ್‍ಡಿಕೆ ಕಿಡಿ ನುಡಿ"
487,ಯುವಕರು ದೇಶದ ಭವಿಷ್ಯ ಎಂಬ ನುಡಿ ಕ್ಲೀಷೆಯಂತಾಗಿದೆ.
488,"ಅಂದರೆ ದ್ವಿಸ್ತರತೆಯ ಪ್ರದೇಶಗಳೆಂದರೆ, ಎಲ್ಲೆಲ್ಲಿ ಆಯಾ ಪ್ರದೇಶದ ನುಡಿ ಅನೌಪಚಾರಿಕ ಬಳಕೆಗೆ ಹಾಗೂ ಬಾಯ್ದೆರೆಯ ವಿನ್ಯಾಸಗಳಿಗೆ ಮಾತ್ರ ಸೀಮಿತವಾಗುತ್ತವೆಯೋ ಅಲ್ಲಿ ಅವು ಅಂದರೆ, ಪ್ರಭುತ್ವದ ನುಡಿಗಳು ಮಾತ್ರ, ಎಲ್ಲ ಬಗೆಯ ಔಪಚಾರಿಕ ಬಳಕೆಗೆ ತಕ್ಕುದಾದ ನುಡಿಗಳಾಗಿರುತ್ತವೆ ಎಂಬ ಹುಸಿ ನಂಬಿಕೆ ಅಸ್ತಿತ್ವದಲ್ಲಿದೆ."
