Index,Sentence
474,"ಮಾಡುವ ವಿಧಾನ: ಪ್ರೆಶರ್ ಕುಕ್ಕರಿನಲ್ಲಿ ಮೊದಲಿಗೆ ತುಪ್ಪ ಹಾಕಿ, ಅದರಲ್ಲಿ ದಾಲ್ಚಿನ್ನಿ, ಸೋಂಪು ಹಾಕಿರಿ."
475,"ಇದರ ನಡುವೆ, ಪಾಕ್‌ನಲ್ಲಿ ಶುಕ್ರವಾರ ಮೈಸೂರು ಹುಲಿ ಟಿಪ್ಪು ಸುಲ್ತಾನ್‌ರ 218 ನೇ ಪುಣ್ಯದಿನ ಆಚರಿಸಲಾಗಿರುವುದು ಕೂಡ ವಿವಾದಕ್ಕೆ ಇನ್ನಷ್ಟು ತುಪ್ಪ ಸುರಿದಿದೆ."
476,ಈ ಸಿಹಿ ತಿಂಡಿಗೆ ತುಪ್ಪ ಮತ್ತು ಬೆಣ್ಣೆಯಂತಹ ಯಾವುದೇ ದುಬಾರಿ ಪದಾರ್ಥಗಳ ಬಳಕೆ ಇಲ್ಲದೆ ಸರಳವಾಗಿ ತಯಾರಿಸಬಹುದು.
477,ಟೀಸ್ಪೂನ್ ತುಪ್ಪ
478,ಕರಿಮೆಣಸು ಹಾಗೂ ತುಪ್ಪ ಇಲ್ಲಿಗೆ ಸಲ್ಲಿಸುವ ವಿಶೇಷ ಕಾಣಿಕೆಗಳು.
479,• ಜೇನು ತುಪ್ಪ ಮತ್ತು ನಿಂಬೆ ರಸ ಮಿಶ್ರಣವನ್ನು ಮೊಡವೆ ಇರುವ ಜಾಗಕ್ಕೆ ಹಚ್ಚಬೇಕು.
480,ಸಾರಿಗೆ ಒಂದು ತೊಟ್ಟು ತುಪ್ಪ ಹೆಚ್ಚಿಗೆ ಬಿದ್ದರೆ ಮನೆ ಒಡೆದು ಹೋಗುವಂತೆ ಅರುಚುತ್ತಿದ್ದರು ಅಂತ ಕಾಣುತ್ತೆ.
481,ಬೆಂಗಳೂರು: ಸಚಿವ ಸಂಪುಟ ವಿಸ್ತರಣೆಯಲ್ಲಿ ( bsy assures ) ಉಪಚುನಾವಣೆ ಸೋತ ಕಾರಣ ಸ್ಥಾನ ವಂಚಿತರಾಗಿರುವ ಎಂಟಿಬಿ ನಾಗರಾಜ್ ಮತ್ತು ಎಚ್ ವಿಶ್ವನಾಥ್ ಅವರು ಬಂಡಾಯ ಏಳದಂತೆ ಅವರ ಮೂಗಿಗೆ ಸಿಎಂ ಯಡಿಯೂರಪ್ಪ ತುಪ್ಪ ಸವರಿದ್ದಾರಾ?
482,"ಶಿವಲಿಂಗ, ಟ್ರೇ, ಐದು ಹಣ್ಣುಗಳು, ಪುಷ್ಪಮಾಲಾ (ಹೂವುಗಳ ಮಾಲೆ), ವೀಳ್ಯದೆಲೆ, ಬಿಲ್ವಪತ್ರ, ದತ್ತೂರ, ಹೂವುಗಳು, ಹತ್ತಿ, ಮಣ್ಣಿನ ಹಣತೆ, ಕುಂಬಳಕಾಯಿ, ಶಿವಲಿಂಗ, ತಟ್ಟೆ, ಜೇನುತುಪ್ಪ, ಗಂಗಾಜಲ,ಸಕ್ಕರೆ, ಹಸುವಿನ ಹಾಲು, ಮೊಸರು, ಹಸುವಿನ ತುಪ್ಪ ದೀಪದ ಬೆಳಕು, ಮೊಲಿ (ಪವಿತ್ರ ಕೆಂಪು ದಾರ), ಮತ್ತು ಶೃಂಗಾರರ್ ಪೆಟ್ಟಿಗೆ, ಅಕ್ಕಿ ಕೆಲವು ಧಾನ್ಯಗಳು ಭಗವಾನ್ ಶಿವನನ್ನು ಆರಾಧಿಸುವಾಗ ಪಾರ್ವತಿ ದೇವತೆಗೆ ಅರ್ಪಿಸಬಹುದು."
483,"ನಂದಿನಿ ತುಪ್ಪ ಬಳಸಿ ದೋಸೆ ಮಾಡುವುದರಿಂದ ರುಚಿ, ಪರಿಮಳ ಮತ್ತು ಗರಿಗರಿಯಾಗಿರುತ್ತದೆ."
484,ಇದಕ್ಕೆ ತುಸು ತುಪ್ಪ ಸವರಿಕೊಂಡು ಆಸ್ವಾದಿಸಬೇಕು.
485,ಜೇನುಹುಳವನ್ನು ಸ್ಫೂರ್ತಿಯಾಗಿ ಹೊಂದಿರುವ ಇವರು ಜೇನು ತುಪ್ಪ ಉದ್ಯಮದಲ್ಲಿ ಆರು ಕೋಟಿ ರೂಪಾಯಿಗಳ ನಿವ್ವಳ ಮೌಲ್ಯ ಮತ್ತು ಒಂದು ವರ್ಷಕ್ಕೆ 10 ಕೋಟಿ ರೂ.
486,ಚಂಚಲವೇ : ನಾಸಿಕದಲ್ಲಿ ದೇಶಿ ತುಪ್ಪ ಹಾಕಿ.
487,"ಬೇಕಾಗುವ ಸಾಮಗ್ರಿ : ರಾಗಿಹುಡಿ - ಒಂದು ಕಪ್‌, ಗೋಧಿಹುಡಿ - ಒಂದು ಕಪ್‌, ಬೆಲ್ಲದಪುಡಿ - ಎರಡು ಕಪ್‌, ತುಪ್ಪ - ನಾಲ್ಕು ಚಮಚ, ನೆಲಕಡ್ಲೆ ಬೀಜ - ಎಂಟು ಚಮಚ, ಕೊಬ್ಬರಿ ತರಿ - ಅರ್ಧ ಕಪ್‌, ಗೋಡಂಬಿ- ದ್ರಾಕ್ಷಿ - ನಾಲ್ಕು ಚಮಚ, ಏಲಕ್ಕಿ - ಸುವಾಸನೆಗಾಗಿ."
488,"ಬಿಳಿಮುರುಗಲ ತುಪ್ಪ ಚರ್ಮದ ಕಾಯಿಲೆ, ಅತಿಸಾರ ಬೇಧಿ ಕಡಿಮೆ ಮಾಡುವಲ್ಲಿ ಹೆಚ್ಚಿನ ಪರಿಣಾಮ ಬೀರುತ್ತದೆ ಎನ್ನುವುದು ಬೆಂಗಳಿ ವೆಂಕಟೇಶ್ ಮತ್ತು ಕುಟುಂಬದವರ ಅಭಿಪ್ರಾಯವಾಗಿದೆ."
489,ತೂಕ ಕಡಿಮೆ ಮಾಡಲು ತುಪ್ಪ ಸಹಾಯಕ:
490,"ಉದುರಾಗಿ ತಯಾರಿಸಿದ ಅನ್ನ 1 ಕಪ್ಪು, ಬೆಲ್ಲದ ಪುಡಿ 1 ಕಪ್ಪು, ತೆಂಗಿನತುರಿ ಅರ್ಧ ಕಪ್ಪು, ತೆಂಗಿನ ಹಾಲು 1 ಕಪ್ಪು, ತುಪ್ಪ 2 ಚಮಚ, ಏಲಕ್ಕಿ ಪುಡಿ ಸ್ವಲ್ಪ."
491,"ಹಬ್ಬದ ಸಾಲು ಬಂತೆಂದರೆ ಅದರ ಬಿಸಿ ಮೊದಲು ತಟ್ಟುವುದು ತರಕಾರಿ, ಹಣ್ಣು, ಹೂವು, ಹಾಲು, ಮೊಸರು, ತುಪ್ಪ ಮತ್ತಿತರ ಅಡುಗೆ ಹಾಗೂ ಪೂಜಾ ಸಾಮಗ್ರಿಗಳಿಗೆ."
492,ಇದು ಕಾಂಗ್ರೆಸ್ಸಿನೊಳಗೇ ಇದ್ದ ಅರಸು ವಿರೋಗಳ ಅಸಹನೆಗೆ ತುಪ್ಪ ಸುರಿಯಿತು.
493,ಹಾಗಾಗಿ ನೀವು ಸ್ನಾನ ಮಾಡುವಾಗ ನಿಮ್ಮ ನೀರಿಗೆ ಜೇನು ತುಪ್ಪ ಹಾಕಿಕೊಂಡು ಸ್ನಾನ ಮಾಡುವುದು ಒಳಿತು.
494,ಒಂದು ಚಮಚ ತುಪ್ಪ 100 ಕ್ಯಾಲೊರಿಗಳನ್ನು ಮತ್ತು 14 ಗ್ರಾಂ ಕೊಬ್ಬನ್ನು ಒದಗಿಸುತ್ತದೆ.
495,"ಅದನ್ನು ನೋಡಿ ದ್ರೌಪದಿ ಮತ್ತಿತರೂ ನಕ್ಕಿದ್ದು, ಬೆಂಕಿಗೆ ತುಪ್ಪ ಸುರಿದಂತಾಗಿತ್ತು."
496,"ಆ ಮಿಶ್ರಣ ಕುದಿಯುವಾಗ ಡ್ರೈ ಫ್ರೂಟ್ಸ್‌ ಪುಡಿ, ತುಪ್ಪ ಸೇರಿಸಿ ಮಗುಚಿ."
497,"ಮೊದಲು ಅವರು ಕಡಲೆ ಹಿಟ್ಟು, ತುಪ್ಪ ಮತ್ತು ಸಕ್ಕರೆ ಮೂವರನ್ನು ಮಿಶ್ರಣ ಮಾಡಿಕೊಂಡರು."
498,ಆಯುರ್ವೇದದ ಪ್ರಕಾರ ತುಪ್ಪ ಮತ್ತು ಜೇನು ಒಂದೇ ಪ್ರಮಾಣದಲ್ಲಿ ಇರಬಾರದು.
499,"ರಾಜ್ಯದ ಉಡುಪಿ ಶ್ರೀಕೃಷ್ಣ ದೇವಾಲಯ, ಕೊಲ್ಲೂರು ಮೂಕಾಂಬಿಕೆ ದೇವಾಲಯ, ಸುಬ್ರಹ್ಮಣ್ಯ ದೇವಸ್ಥಾನಗಳಿಗೆ ಮತ್ತು ವಿವಿಧ ರಾಜ್ಯಗಳ ದೇವಾಲಯಗಳಲ್ಲಿ ನಂದಿನಿ ತುಪ್ಪ ಬಳಸಲಾಗುತ್ತಿದೆ."
500,ಜೇನು ತುಪ್ಪ ಸೇರಿಸಿ
501,ತುಪ್ಪ ಲೆಕ್ಕ ಸ್ವತಂತ್ರವಾಗಿ ಮಾಡಬಹುದು - 1 ಕೆಜಿ ಬೆಣ್ಣೆ ಇರಿಸಲಾಗುತ್ತದೆ ಅರ್ಧ teaspoon ಉಪ್ಪು.
502,ತ್ರಿಫಲಾ ಕಷಾಯಕ್ಕೆ ತುಪ್ಪ ಸೇರಿಸಿ ತೆಗೆದುಕೊಳ್ಳಿ ಅನ್ನುವ ಸಲಹೆಗಳನ್ನು ನೀಡುವುದು ಸುಲಭ.
503,"ಅರಣ್ಯದೊಳಗಿನ ಮರ-ಗಿಡ, ಪೊಟರೆಗಳಲ್ಲಿ ಕಟ್ಟಿಕೊಳ್ಳುವ ತುಡವಿ ಜೇನನ್ನು ರವಿ ಮಾರ್ಗದರ್ಶನದಲ್ಲಿ ಜಮೀನೊಳಗಿರುವ ಕಟ್ಟಗೆಯ ಪೊಟರೆಯೊಳಗೆ ಕಟ್ಟುವಂತೆ ಮಾಡಿ, ಅವುಗಳು ನೀಡಿದ ತುಪ್ಪ ಸವಿಯುವಂತಾಗಿದ್ದು ವಿಶೇಷ."
504,ಇಲ್ಲಿನ ಗಂಗಾಧರೇಶ್ವರನ ಲಿಂಗಕ್ಕೆ ತುಪ್ಪ ಸವರಿದರೆ ಅದು ಬೆಣ್ಣೆಯಾಗುತ್ತದೆಂಬ ಪ್ರತೀತಿ ಇದೆ.
505,"ನಿಲ್ಲದ ಕೆಮ್ಮಿದ್ದರೆ, ಶುಂಠಿ ರಸಕ್ಕೆ ಸ್ವಲ್ಪ ಜೇನು ತುಪ್ಪ ಸೇರಿಸಿಕೊಂಡು ಸೇವಿಸಿದರೆ ಕೆಮ್ಮು ನಿಯಂತ್ರಣಕ್ಕೆ ಬರುತ್ತದೆ."
506,"ಹಾಲು, ಮಜ್ಜಿಗೆ, ಬೆಣ್ಣೆ, ತುಪ್ಪ ಮಾರಾಟ ಜೋರಾಗಿದೆ ಎಂದು ಅವರು ಹೇಳುತ್ತಾರೆ."
507,"ಇನ್ನು ಹಿರಿಯ ಕಲಾವಿದ ಜಯರಾಮ್ ಮಾತನಾಡಿ ರಾಜ್ಯದ ಮನೆ ಮಾತಾಗಿರುವ ಸೆಂಚುರಿ ಗೌಡ ಹಾಗೂ ಗಡ್ಡಪ್ಪನಂತಹ ಹಿರಿಯ ನೈಜ, ಮುಗ್ಧ ಕಲಾವಿದರೊಂದಿಗೆ ಅಭಿನಯಿಸದಿದ್ದರೆ ಏನೋ ಕಳೆದುಕೊಂಡತ ಭಾವ ಮೂಡುತ್ತಿತ್ತು, ಅದನ್ನು ಹಾಲು ತುಪ್ಪ ಚಿತ್ರ ನೀಗಿಸಿದ್ದು, ಸೆಂಚುರಿ ಗೌಡರ ಮಗನ ಪಾತ್ರ ನಿರ್ವಹಿಸುವ ಮೂಲಕ ತೃಪ್ತಿ ತಂದಿದೆ ಎಂದಿದ್ದಾರೆ."
508,"ಮೊದಲು ಅವರು ಕಡಲೆ ಹಿಟ್ಟು, ತುಪ್ಪ ಮತ್ತು ಸಕ್ಕರೆ ಮೂರನ್ನು ಮಿಶ್ರಣ ಮಾಡಿಕೊಂಡರು."
509,"ಹೆಚ್ಚು ಉರಿಯಲ್ಲಿ ಪ್ರೆಶರ್ ಕುಕ್ಕರಿನ ವಿಶಲ್ 3-4, ನಂತರ ಸಣ್ಣ ಉರಿಯಲ್ಲಿ 3-4 ವಿಶಲ್ ಆದ ನಂತರ ಅದನ್ನು ತೆಗೆದು ಅದಕ್ಕೆ ಒಂದು ಚಮಚ ತುಪ್ಪ ಹಾಕಿ"
510,"ಈ ಮಳಿಗೆಯಲ್ಲಿ ಹೊರನಾಡು ಕಾಫಿ ಪುಡಿ, ಹೊರನಾಡು ಟೀಪುಡಿ, ಮಲೆನಾಡು ಜೇನುತುಪ್ಪ, ಮಲೆನಾಡು ಹಸುವಿನ ತುಪ್ಪ ಮುಂತಾದ ಅನೇಕ ಮಲೆನಾಡಿನ ವಿಶೇಷ ವಸ್ತುಗಳು ದೊರೆಯುತ್ತವೆ."
511,ಅದರಲ್ಲೂ ವಿಧಾನಸಭಾ ಚುನಾವಣೆಯಲ್ಲಿ ಪರಾಭವಗೊಂಡಿದ್ದ ಲಕ್ಷ್ಮಣ ಸವದಿಯವರಿಗೆ ಸಚಿವ ಸ್ಥಾನ ನೀಡಿರುವುದು ಉರಿಯುವ ಬೆಂಕಿಗೆ ತುಪ್ಪ ಸುರಿದಂತಾಗಿದೆ.
512,ತಯಾರಿಸುವ ವಿಧಾನ : ಬಾಣಲೆ ಒಲೆಯ ಮೇಲಿಟ್ಟು 1 ಚಮಚ ತುಪ್ಪ ಹಾಕಿ.
513,"ನೈಜ ಬಾದಾಮ್, ಗೋಡಂಬಿ, ಪಿಸ್ತಾ, ಹಾಲಿನ ಘನಾಂಶ, ನಂದಿನಿ ಶುದ್ಧ ತುಪ್ಪ ಹಾಗೂ ಸಕ್ಕರೆಯಿಂದ ತಯಾರಿಸ್ಪಟ್ಟ ಉತ್ಕೃಷ್ಟ ಸಿಹಿ ತಿನಿಸು."
514,ವಿರೋಧ ಪಕ್ಷದವರು ಮಾಧ್ಯಮದವರು ಸೇರಿ ಬೆಂಕಿಗೆ ತುಪ್ಪ ಹಾಕುವಂತಹ ಕೆಲಸ ಮಾಡಿದ್ದಾರೆ.
515,ತುಪ್ಪ ಅತ್ಯಂತ ಸುಲಭವಾಗಿ ಜೀರ್ಣವಾಗುವ ಆಹಾರವಾದ ಕಾರಣ ಚಿಕ್ಕ ಮಕ್ಕಳಿಗೂ ತುಪ್ಪವನ್ನು ಯಾವುದೇ ಅಳುಕಿಲ್ಲದೇ ತಿನ್ನಿಸಬಹುದು.
516,"ಒಂದು ವೇಳೆ ಮನೆಯಲ್ಲಿ ಹೆಣ್ಣಮಕ್ಕಳು ಇಲ್ಲವಾದರೆ ವಿವಾಹಿತ ಬ್ರಾಹ್ಮಣ ಮಗಳಿಗೆ ಕಳಸ, ಹೂ, ಸುಗಂಧ, ಸಕ್ಕರೆ, ತುಪ್ಪ ದಾನ ಮಾಡಬೇಕು."
517,"ಬಾಣಲೆಯಲ್ಲಿ ತುಪ್ಪ ಕಾಯಿಸಿ ಅದರಲ್ಲಿ ಸಕ್ಕರೆ ಕರಗಿಸಿ, ಒಲೆಯಿಂದ ಕೆಳಗಿರಿಸಿ."
518,ಸಾಮಾನ್ಯವಾಗಿ ಎಲ್ಲರಿಗೂ ತುಪ್ಪ ಅಚ್ಚುಮೆಚ್ಚು.
519,"ಮಿಶ್ರಣ ಗಟ್ಟಿಯಾಗುತ್ತಾ ಬಂದಾಗ ಕೆಳಗಿಳಿಸಿ, ತುಪ್ಪ ಹಚ್ಚಿದ ಪಾತ್ರೆಗೆ ಹಾಕಿ."
520,ಹಲಸಿನ ಎಲೆಯಲ್ಲಿ ನೀಡುವ ದನದ ತುಪ್ಪ ವಾತ ಮುಂತಾದ ರೋಗ ಶಮನ ಕಾರಿ ಎಂದು ಗುರುತಿಸಲಾಗಿದೆ.
521,ಒಂದು ದಿನ ತುಪ್ಪ ಮಾರುವ ವ್ಯಾಪಾರಸ್ಥನೊಬ್ಬ ಶಾಮನ ಬಳಿ ಬಂದು ಸಹಾಯ ಮಾಡುವಂತೆ ಕೇಳಿಕೊಂಡ.
522,ಒಂದ್ಹಾಡ ತುಪ್ಪ ಹೊಯ್ಸಿನಿ ತಾನು
523,ಖ್ಯಾತ ಬಾಲಿವುಡ್ ನಟಿ ಕರೀನಾ ಕಪೂರ್ ಸಹಾ ತುಪ್ಪ ಬೆರೆಸಿದ ಆಹಾರಗಳನ್ನೇ ಹೆಚ್ಚಾಗಿ ಇಷ್ಟಪಡುತ್ತಾರೆ.
524,ಆದ್ರೆ ವಿರಾಟ್ ಕೊಹ್ಲಿ ಹಾಗೂ ಆಸ್ಟ್ರೇಲಿಯಾ ಕ್ರಿಕೆಟ್ ತಂಡದ ನಡುವಣ ಸಂಘರ್ಷ ತಣ್ಣಗಾಗುತ್ತಿದೆ ಎಂದುಕೊಳ್ಳುವಷ್ಟರಲ್ಲಿ ಕಾಂಗರೂಗಳು ವಿವಾದದ ಬೆಂಕಿಗೆ ತುಪ್ಪ ಸುರಿಯೋ ಕೆಲಸ ಮಾಡ್ತಿದ್ದಾರೆ.
525,"ಯಾಕೆಂದರೆ ಸರಕಾರ ಸನ್ನಿಧಾನಕ್ಕೆ ಪ್ರವೇಶಿಸುವ ಮಹಿಳೆಯರಿಗೆ ಸರಕಾರವೇ ಭದ್ರತೆ ನೀಡುತ್ತದೆ ಎನ್ನುವ ಮೂಲಕ ಉರಿಯುತ್ತಿರುವ ಬೆಂಕಿಗೆ ತುಪ್ಪ ಸುರಿಸಿದೆ, ಆದ್ದರಿಂದ ಇದು ಹಿಂದೂಗಳ ಕಣ್ಣು ಕೆಂಪಾಗುವಂತೆ ಮಾಡಿದೆ."
526,ಒಂದು ವೇಳೆ ತಲೆಯಲ್ಲಿ ತಲೆಹೊಟ್ಟು ಇದ್ದರೆ ತುಪ್ಪ ಮತ್ತು ಲಿಂಬೆರಸಗಳನ್ನು ಬೆರೆಸಿ ನಯವಾದ ಮಸಾಜ್ ನೊಂದಿಗೆ ಹಚ್ಚಿಕೊಳ್ಳಬೇಕು.
527,"ಮತ್ತು ಉತ್ತಮ - ಎಣ್ಣೆ, ತುಪ್ಪ ಬಳಸಲಾಗುತ್ತದೆ ಮಾತ್ರ ರುಚಿ ಹೆಚ್ಚಾಗುತ್ತದೆ ಇದು."
528,ಕಾಸಲಿಲ್ಲದ ತುಪ್ಪ
529,"ತಮ್ಮ ಹೊಲಗಳಿಗೆ ಕೂಲಿಯಾಳುಗಳಾಗಿ ಬಂದು ದುಡಿದುಹೋದ ಕೂಲಿಕಾರರನ್ನು ಕರೆದು ಎಲ್ಲರೂ ಒಟ್ಟಿಗೆ ಕುಳಿತು ಹುಗ್ಗಿ ಪಾಯಸ, ಪಾನಕ ಪನಿವಾರ, ಕೋಸಂಬರಿ, ಹಾಲು ಮೊಸರು ಮಜ್ಜಿಗೆ ಬೆಣ್ಣೆ ತುಪ್ಪ ಕರ್ಜಿಕಾಯಿ ಹೋಳಿಗೆ ವಡೆ ಇತ್ಯಾದಿ ಪದಾರ್ಥಗಳನ್ನು ಹಂಚಿಕೊಂಡು ತಿಂದರೆ ಹಬ್ಬದೂಟ ಎಷ್ಟೊಂದು ರುಚಿಯಲ್ಲವೇ?"
530,"ಬಿಲದಲ್ಲಿ ದ್ವಾರವನ್ನು ಹುಡುಕುತ್ತ ಕೊನೆಗೂ ಬಂಧಿಸಿದ ದ್ವಾರವನ್ನು ನೂಕಿ ಬಿಡಿಸಿ ಹೊರಬಂದ ವಾಲಿ ಸಿಟ್ಟಿನಿಂದ ಕುದಿದು ಒಂದೆ ನೆಗೆತದಲ್ಲಿ ಸುಗ್ರೀವನ ಬಳಿ ಸೇರಿ ರುಮೆ, ತಾರೆಯರೊಂದಿಗಿರುವುದನ್ನು ಕಂಡು, ಬೆಂಕಿಗೆ ತುಪ್ಪ ಸುರಿದಂತೆ, ಉರಿದು ಸುಗ್ರೀವನನ್ನು ಹೊಡೆದು ಓಡಿಸುತ್ತಾನೆ."
531,ಕೊಬ್ಬಿನಾಂಶವನ್ನು ಗಮನದಲ್ಲಿಟ್ಟುಕೊಂಡು ಇತ್ತೀಚಿಗೆ ತುಪ್ಪ ಹಾಕದೆ ಗೋಧಿ ಚಪಾತಿ ಸೇವನೆ ಮಾಡುವವರ ಸಂಖ್ಯೆ ಹೆಚ್ಚಿದೆ.
532,ತುಪ್ಪ – 1ಸ್ಪೂನ್
533,"ಅಂದು ನಾವು ಹೆಕ್ಕಿ ತಿನ್ನುತ್ತಿದ್ದ ಮಾವಿನ ಮರದೊಂದಿಗೆ, ಆ ಮನೆಯಲ್ಲಿ ಮನೆ ಮಕ್ಕಳೊಂದಿಗೆ ತುಪ್ಪ ಹಾಕಿದ ಗಂಜಿ ಊಟ ಮಾಡಿದ, ಕಾಫಿ, ಚಹಾ ಕುಡಿದ, ಆಟವಾಡಿದ ಕ್ಷಣಗಳೆಲ್ಲವೂ ನೆನಪಾಗುತ್ತವೆ."
534,- ತ್ವಚೆಯ ಕಾಂತಿ ವೃದ್ಧಿಸಲು ತುಪ್ಪ ಬಹಳ ಸಹಕಾರಿ.
535,ಮುಸ್ಲಿಂ ಸಮುದಾಯಕ್ಕೆ ಕಾಂಗ್ರೆಸ್ ಮೂಗಿಗೆ ತುಪ್ಪ ಒರೆಸಿ ಓಟ್ ಬ್ಯಾಂಕ ರಾಜಕಾರಣ ಮಾಡಿ ಅನ್ಯಾಯಮಾಡುತ್ತಿತ್ತು.
536,ತುಪ್ಪ ದೇಹ ತೂಕ ಕಡಿಮೆ ಮಾಡಲು ಸಹಕಾರಿ
537,"ಸಣ್ಣ ವಯುಕ್ತಿಕ ಗಲಾಟೆಯನ್ನು ದೊಡ್ಡದು ಮಾಡಿ ಒಂದೋ ಎರಡೋ ತಿಂಗಳು ಜನರಲ್ಲಿ ಭಯ ಹುಟ್ಟಿಸಿ ನಂತರ ತಮ್ಮ ರಾಜಕೀಯ ಪ್ರಭಾವಗಳನ್ನು ಉಪಯೋಗಿಸಿ ಒಂದು ಕೋಮಿನಿಂದ ಒಂದಿಬ್ಬರನ್ನು ಅರೆಸ್ಟ್ ಮಾಡಿಸಿ, ಮತ್ತೊಂದು ಕೋಮನ್ನು ಕೆರಳಿಸಿ ತಮ್ಮ ಮತಬ್ಯಾಂಕನ್ನು ಗಟ್ಟಿಮಾಡಿಕೊಳ್ಳುವ ರಾಜಕಾರಣಿಗಳು ಗಲಭೆಗೆ ತುಪ್ಪ ಸುರಿಯುತಿದ್ದಾರೆ."
538,"ಗಸಗಸೆ, ತುಪ್ಪ ಹಾಕಿ 15 ನಿಮಿಷಗಳ ವರೆಗೆ ಬೇಯಿಸಿ."
539,ಜೇನು ಗೂಡು:ಜೇನು ಗೂಡಿನಲ್ಲಿರುವ ಜೇನು ತುಪ್ಪ ತಿನ್ನಲು ಮಾತ್ರ ಬಹಳ ರುಚಿ ಹಾಗೆ ಆರೋಗ್ಯಕ್ಕೂ ಕೂಡ ಇದು ಬಹಳ ಒಳ್ಳೆಯದು.
540,"ಈ ಸಂದರ್ಭವನ್ನೇ ಬಳಸಿಕೊಂಡು ಅನರ್ಹ ಶಾಸಕ ರಮೇಶ್ ಅಮೇರಿಕ ಪ್ರವಾಸದಲ್ಲಿದ್ದಾರೆ ಎಂದು ಹೇಳಿ, ಸಹೋದರ ಸತೀಶ್ ಉರಿಯುವ ಬೆಂಕಿಗೆ ತುಪ್ಪ ಸುರಿದಿದ್ದಾರೆ."
541,ತವಾಕ್ಕೆ ತುಪ್ಪ ಸವರಿ ಚಿಕ್ಕ ಚಿಕ್ಕದಾಗಿ ದಪ್ಪಗೆ ದೋಸೆ ಮಾಡಿ.
542,ಬಂಡಾಯ ಏಳುವವರ ಮೂಗಿಗೆ ತುಪ್ಪ ಸವರುವುದಕ್ಕಾಗಿಯೇ ಇನ್ನೂ 7 ಸಚಿವ ಸ್ಥಾನಗಳನ್ನು ಖಾಲಿ ಉಳಿಸಿಕೊಳ್ಳಲಾಗಿದೆ.
543,"ಹಿರಿಯರಿಗೆ ತಾವು ತುಪ್ಪ ತಿಂದು ದಪ್ಪಗಾಗುವ ಚಿಂತೆಗಿಂತ ತಮ್ಮ ಮಕ್ಕಳು ತುಪ್ಪ ತಿನ್ನಬೇಕೇ, ತಿನ್ನಬಾರದೇ ಎಂಬ ದ್ವಂದ್ವ ಹೊಂದಿರುವುದನ್ನು ಎಲ್ಲಾ ಮನೆಗಳಲ್ಲಿ ಕಾಣಬಹುದು."
544,ಅಲ್ಲಿಗೆ ಸೀದು ಹೋಗಿದ್ದ ನೀರ್ ದೋಸೆಗೆ ಘಮಘಮ ತುಪ್ಪ ಸವಲಾಗುತ್ತಿದೆ.
545,ಹಲವು ವರ್ಷಗಳಿಂದಲೂ ಹಿಂದೂ - ಮುಸ್ಲಿಮರ ನಡುವಿನ ಸಂಘ ರ್ಷದ ಬೆಂಕಿಗೆ ತುಪ್ಪ ಸುರಿಯುತ್ತಾ ಬಂದಿರುವ ಅಯೋಧ್ಯೆ ರಾಮ ಮಂದಿರ ವಿವಾದ ವನ್ನು ಪರಸ್ಪರ ಸಂಧಾನ ಮಾತು ಕತೆಯ ಮೂಲಕ ಬಗೆ ಹರಿಸಲು ಹೊರಟಿ ರುವ ರವಿ ಶಂಕರ್‌ ಗುರೂಜಿ ಗುರುವಾರ ಅಯೋಧ್ಯೆಯಲ್ಲಿ ಆಡಿರುವ ಮಾತಿದು.
546,ವಿನೆಗರ್ ಮತ್ತು ಜೇನು ತುಪ್ಪ
547,ಈ ಹಿಟ್ಟಿಗೆ ಇನ್ನೊಂದು ಚಿಕ್ಕ ಬಾಣಲೆಯಲ್ಲಿ ತುಪ್ಪ ಹಾಕಿ ಕಾದನಂತರ ಅದಕ್ಕೆ ಸಾಸಿವೆ ಹಾಕಿ ಸಿಡಿಸಿ ಸೇರಿಸಿ ತಿರುಗಿಸಬೇಕು.
548,ಆ ಪ್ರಸಾದದಿಂದ ತುಪ್ಪ ತಟ್ಟೆ ತುಂಬಾ ಹರಿಯುತ್ತಿರುತ್ತದೆ.
549,ಮಾಡುವ ವಿಧಾನ: ಎಳ್ಳು ಮತ್ತು ಮೆಣಸನ್ನು ಒಟ್ಟಿಗೆ ಸೇರಿಸಿ ಅರ್ಧ ಚಮಚ ತುಪ್ಪ ಹಾಕಿ ಹುರಿಯಿರಿ.
550,ಇದು ರೈತರ ಮೂಗಿಗೆ ತುಪ್ಪ ಸವರುವಂತಹ ಕೆಲಸ ಆಗಿದೆ.
551,"ಕಾಯಿತುರಿ 2 ಕಪ್, ಕಂಡೆನ್ಸಡ್ ಮಿಲ್ಕ್ 2 ಕಪ್, ಸಕ್ಕರೆ 1 ಕಪ್, ಏಲಕ್ಕಿ ಪುಡಿ ಸ್ವಲ್ಪ, ಬಾದಾಮಿ ಸ್ವಲ್ಪ, ತುಪ್ಪ ಸ್ವಲ್ಪ"
552,"ಜನರ ಮೂಗಿಗೆ ತುಪ್ಪ ಸವರಿ ಅಧಿಕಾರಕ್ಕೆ ಬಂದ ಮೋದಿ, ಭಾರತೀಯರ ಖಾತೆಗೆ 15 ಲಕ್ಷ ಹಾಕಲಿಲ್ಲ."
553,ಬೆಂಗಳೂರಿನಲ್ಲಿ ಉರಿಯುವ ಪೌರತ್ವದ ಬೆಂಕಿಗೆ ನಿಷೇಧಾಜ್ಞೆಯ ತುಪ್ಪ
554,Home ವಾರ್ತೆಗಳು ಆರೋಗ್ಯ ಬ್ರಾಹ್ಮೀ ರಸವನ್ನು ಜೇನು ತುಪ್ಪ ಜೊತೆ ದಿನಕ್ಕೆ ಮೂರು ಬಾರಿ ಸೇವಿಸಿದರೆ ಊರಿ ಮೂತ್ರ ನಿವಾರಣೆ
555,"ಜೇನುತುಪ್ಪದಲ್ಲಿ ಸಕ್ಕರೆಪಾಕ, ಕಾಫಿ ಪುಡಿಯಲ್ಲಿ ಹುಣಸೆ ಬೀಜದ ಪುಡಿ, ಟೀ ಪುಡಿಯಲ್ಲಿ ಹಿಂದೆಂದೋ ಬಳಸಿ ಬಿಟ್ಟ ಟೀ ಪುಡಿಯ ಮರುಬಳಕೆ, ತುಪ್ಪ ಬೆಣ್ಣೆಯಲ್ಲಿ ಡಾಲ್ಡದ ಮಿಶ್ರಣ ಹೀಗೆ, ಆಹಾರದ ಪ್ರತಿ ಗುಂಪಲ್ಲೂ ಕಲಬೆರಕೆಯ ಗುರುತೊಂದನ್ನು ಗಮನಿಸಬಹುದು."
556,ಜೇನು ತುಪ್ಪ ಉತ್ಪಾದನೆ ಮಾತ್ರ ಜೇನು ಕೃಷಿಯ ಉದ್ದೇಶವಲ್ಲ.
557,"ವಾಸು ಹೇಳಿಕೆ ನೀಡಿದ್ದು, ಅದು ಉರಿಯುತ್ತಿರುವ ಬೆಂಕಿಗೆ ತುಪ್ಪ ಸುರಿದಂತೆ ಮಾಡಿದೆ."
558,ತಪ್ಪು ಮಾಡುತ್ತಲೇ ತುಪ್ಪ ತಿನ್ನುತ್ತ ಹಾಯಾಗಿರುವ ಬಹಳ ಜನಗಳಿರುವಾಗ ಅವರಿಗೂ ಸಮಾಜದಲ್ಲಿ ಸಾಕಷ್ಟು ಮಾನ-ಮರ್ಯಾದೆ-ಗೌರವಾದರಗಳೂ ಸಿಗುತ್ತಿರುವಾಗ ತನ್ನದೇನು ಮಾಹಾ ಅಪರಾಧ?
559,ಮಧುಮೇಹ ನಿಯಂತ್ರಣ ಆಗಬೇಕಾದರೆ ಎರಡು ಚಮಚ ಮೂಸಂಬಿ ರಸಕ್ಕೆ ನಾಲ್ಕು ಚಮಚ ನೆಲ್ಲಿಕಾಯಿ ರಸ ಮತ್ತು ಒಂದು ಚಮಚ ಜೇನು ತುಪ್ಪ ಬೆರೆಸಿ ಖಾಲಿ ಹೊಟ್ಟೆಯಲ್ಲಿ ಸೇವಿಸಬೇಕು.
560,ಈಗ ಅದೇ ಚೌಧರಿಯನ್ನು ಹೊಸ ಕಾರ್‍ಯಾಧ್ಯಕ್ಷ ಜೆಪಿ ನಡ್ಡಾ ಬಿಜೆಪಿಗೆ ಕೆಂಪು ಹಾಸು ಹಾಸಿ ಬರ ಮಾಡಿಕೊಂಡಿರುವುದು ಬಿಜೆಪಿ ಮತ್ತು ಮೋದಿ ಟೀಕಾಕಾರರ ಬಾಯಿಗೆ ತುಪ್ಪ ಸುರಿದಂತಾಗಿದೆ.
561,"ಹೋಳಿಗೆ, ಅನ್ನ, ಸಾರು, ತುಪ್ಪ ಇತ್ಯಾದಿಗಳನ್ನು ಅರ್ಪಿಸಿ ತೆಂಗಿನಕಾಯಿ ಒಡೆದು ಹಿರೇ ಹಟ್ಟೆವ್ವನ ಮುಂದೆ ಇಡುತ್ತಾರೆ."
562,ಸಣ್ಣ ಪ್ರಮಾಣದಲ್ಲಿ ತುಪ್ಪ ದಿನಾ ತಿನ್ನುವುದು ಒಳ್ಳೆಯದು.
563,ಮಕ್ಕಳಿಗೆಷ್ಟು ತುಪ್ಪ ಅಗತ್ಯ?
564,"* ಒಂದು ಪಾತ್ರೆಯಲ್ಲಿ ಮೈದಾಹಿಟ್ಟು, ಚಿರೋಟಿ ರವೆ, ಅರಿಶಿನ, ಒಂದು ಚಿಟಿಕೆ ಉಪ್ಪು ಮತ್ತು ತುಪ್ಪ ಹಾಕಿ ಅಗತ್ಯಕ್ಕೆ ತಕ್ಕಷ್ಟು ನೀರು ಹಾಕಿ ಚಪಾತಿ ಹಿಟ್ಟಿಗಿಂತ ತುಂಬಾ ಮೃದುವಾಗಿ ಕಲಸಿಕೊಳ್ಳಿ."
565,ಹೀಗಾಗಿ ಜೇನು ತುಪ್ಪ ಸ್ವಲ್ಪ ಪ್ರಮಾಣದಲ್ಲಿ ಕರಡಿಗಳ ಪಾಲಾಗುತ್ತವೆ!
566,ಆದರೆ ಈ ಬಗ್ಗೆ ಅಧಿಕಾರಿಗಳು ಜವಾಬ್ದಾರಿಯಿಂದ ನಡೆದುಕೊಳ್ಳದೇ ಮೂಗಿಗೆ ತುಪ್ಪ ಸವರುತ್ತಿದ್ದಾರೆ.
567,ಸರ್ಕಾರ ಹಾಗೂ ಉನ್ನತ ಮಟ್ಟದ ಅಧಿಕಾರಿಗಳ ಇಂಥ ನಿರ್ಧಾರದಿಂದ ಪ್ರಾದೇಶಿಕ ಅಸಮಾನತೆಗೆ ಸದ್ದಿಲ್ಲದೇ ಕಿಚ್ಚಿಗೆ ತುಪ್ಪ ಸುರಿಯುವ ಕೆಲಸ ನಡೆಯುತ್ತಿತ್ತು.
568,ಅದರಲ್ಲೂ ವಿಶೇಷವಾಗಿ ಸಣ್ಣ ಹಿಡುವಳಿದಾರರಿಗೆ ಸಾಲಮನ್ನಾ ಮಾಡುತ್ತೇವೆ ಎಂದು ಮೂಗಿಗೆ ತುಪ್ಪ ಸವರಿದ ಕೆಲಸವನ್ನು ಎಲ್ಲರೂ ಮಾಡಿಕೊಂಡು ಬಂದಿದ್ದರು.
569,ಮಲಗುವ ಮುನ್ನ ಬೆಣ್ಣೆ ಅಥವಾ ತುಪ್ಪ ಇಲ್ಲವೇ ಕೆನೆ ಸವರಿಕೊಂಡರೂ ತುಟಿ ಮೃದುವಾಗುತ್ತವೆ.
