Index,Sentence
174,"ಬಿಳಿ ಅನ್ನಕ್ಕೆ ಸ್ವಲ್ಪ ಜೇನು ತುಪ್ಪ ಮತ್ತು ಸಕ್ಕರೆ, ಅಡುಗೆಗೆ ಬಳಸುವ ಕೊಬ್ಬರಿ ಎಣ್ಣೆ ಸೇರಿಸಿ, ಆ ಅನ್ನವನ್ನು ದೇವತೆಗಳಿಗೆ ನೈವೇದ್ಯವಾಗಿ ಸಮರ್ಪಿಸಿದರೆ ಅದನ್ನು ದಾನ ಮಾಡಿದರೆ ಸಕಲ ರೋಗಗಳು ವಾಸಿಯಾಗುತ್ತವೆ ಎಂದು ಆಧ್ಯಾತ್ಮಿಕ ಶಾಸ್ತ್ರಗಳಲ್ಲಿ ಉಲ್ಲೇಖವಿದೆ."
175,"ಸೂರವ್ವ ಬೋರವ್ವ ದ್ವಯರು, (ತಾಯಿಮಗಳು ಇರಬಹುದು, ನಮಗೆ ತಿಳಿಯದು) ಬಹಳಕಾಲ ಅಂದರೆ ಅವರು ಜೀವಿಸಿರುವ ತನಕ ನಮ್ಮ ಮನೆಗೆ ಹಾಲು ಮೊಸರು, ತುಪ್ಪ ತಂದುಕೊಡುತ್ತಿದ್ದರು."
176,ಒಂದೆಡೆ ನಂದಿನಿ ತುಪ್ಪ ಬಳಸಿ ಮಾಡಿದ್ದ ಹಾಗೂ ಅವರೆಕಾಳಿನ ತಿನಿಸಿನ ಘಮಲು ಆಕರ್ಷಿಸುತ್ತಿತ್ತು.
177,ಜೇನು ತುಪ್ಪ – ಉತ್ತಮ ಧ್ವನಿ
178,"ಒಂದು ಬಾಣಲೆಯಲ್ಲಿ ಸ್ವಲ್ಪ ತುಪ್ಪ ಬಿಸಿ ಮಾಡಿ ಅದಕ್ಕೆ ಕರಿಬೇವಿನಸೊಪ್ಪು, ಜೀರಿಗೆ, ಕಾಳುಮೆಣಸು, ಅರಿಶಿನ, ಗೋಡಂಬಿ ಮತ್ತು ಕತ್ತರಿಸಿದ ಹಸಿಮೆಣಸಿನಕಾಯಿ ಹಾಕಿ ಬಾಡಿಸಿ."
179,ಈ ಕೋಮು ಗಲಭೆಗಳಿಂದ ಇಡೀ ರಾಜ್ಯವೇ ಹೊತ್ತಿ ಉರಿಯುತ್ತಿದ್ದಾಗ ರಾಜಕೀಯ ಪಕ್ಷಗಳು ಉರಿಯುವ ಬೆಂಕಿಗೆ ತುಪ್ಪ ಸುರಿಯುವ ಕೆಲಸ ಮಾಡುತ್ತಿವೆ.
180,ಈಗಿನ ಮಹಾರಾಷ್ಟ್ತ್ರ ನಾಯಕರು ಕೂಡ ಉರಿಯುತ್ತಿರುವುದಕ್ಕೆ ತುಪ್ಪ ಸುರಿದಂತೆ ವರ್ತಿಸುತ್ತಿದ್ದಾರೆ.
181,"ಎಲ್ಲೆಲ್ಲಿ ಮಾದರಿ ಕೌ ಶೆಲ್ಟರ್‌ಗಳಿರುತ್ತವೋ ಅಲ್ಲೆಲ್ಲ ನಾವು ಒಂದು ಆಂಪಿಥಿಯೇಟರ್ ನಿರ್ಮಿಸಿ ಹಸುಗಳ ಬಗ್ಗೆ ಕೆಲವು ವೀಡಿಯೊ ಕ್ಲಿಪ್‌ಗಳ ಪ್ರದರ್ಶನ, ಕೆಲವು ಶೋಗಳು ಹಾಗೂ ತುಪ್ಪ ಮತ್ತು ಹಾಲು ಮಾರುವ ಒಂದು ಸ್ಟಾಲ್‌ನ ವ್ಯವಸ್ಥೆ ಮಾಡುತ್ತೇವೆ."
182,"ಅದಕ್ಕೆ ತುಪ್ಪ ಮತ್ತು ಅರ್ಧ ಕಪ್ ಹಾಲು ಹಾಕಿ ಚೆನ್ನಾಗಿ ಕೈ ಆಡಿಸಿ,ಒಂದೆರಡು ನಿಮಿಷ ಚೆನ್ನಾಗಿ ತಿರುವಿ, ಒಲೆಯಿಂದ ಕೆಳಗಿಳಿಸಿ."
183,"ಬೇಕಾಗುವ ಸಾಮಗ್ರಿ: ಗಟ್ಟಿ ಅವಲಕ್ಕಿ ಒಂದು ಕಪ್, ಹೆಸರುಬೇಳೆ ಮುಕ್ಕಾಲು ಕಪ್, ತುಪ್ಪ ಅರ್ಧಕಪ್, ಕರಿಮೆಣಸು ಮತ್ತು ಜೀರಿಗೆ ಒಂದು ಚಮಚ, ಗೋಡಂಬಿ, ಉಪ್ಪು, ಶುಂಠಿ, ಇಂಗು, ಕರಿಬೇವು, ಹಸಿಮೆಣಸಿನಕಾಯಿ ಎರಡು, ಚಿಟಿಕೆ ಅರಿಶಿನ ಪುಡಿ, ಒಂದು ಕಪ್ ಕಾಯಿತುರಿ"
184,ಹೆದ್ದಾರಿ ಪ್ರಾಧಿಕಾರ ಅಭಿವೃದ್ಧಿಪಡಿಸುತ್ತದೆ ಎಂದು ಮೂಗಿಗೆ ತುಪ್ಪ ಸವರುವ ಕೆಲಸ ಮಾಡಲಾಗುತ್ತಿದೆ.
185,ಒಂದು ಬಾಣಲೆಯಲ್ಲಿ ಎರಡು ಚಮಚ ತುಪ್ಪ ಹಾಕಿ ಒಲೆಯ ಮೇಲೆ ಇಡಿ.
186,"ಊಟವಾದ ಮೇಲೆ ಒಂದು ಲೋಟ ಶುಂಠಿ ಕಷಾಯ ಕುಡಿಯಿರಿ ,ಸ್ವಲ್ಪ ನೀರಿಗೆ ಸ್ವಲ್ಪ ಶುಂಠಿ ಹಾಕಿ ಅದನ್ನು ಚೆನ್ನಾಗಿ ಕುದಿಸಿ ನಂತರ ತಣ್ಣಗಾದ ಮೇಲೆ ಅದಕ್ಕೆ ಸ್ವಲ್ಪ ಜೇನು ತುಪ್ಪ ಹಾಕಿ ಕುಡಿಯಬೇಕು ,ಅದುಫುಡ್ ಪಾಯಿಸನ್ ನಿಂದ ಆಗುವ ಹೊಟ್ಟೆ ನೋವು ,ಭೇದಿ ಮತ್ತು ಎದೆ ನೋವನ್ನು ವಾಸಿಮಾಡುತ್ತದೆ."
187,ಗುರು ಪ್ರಸಾದ್ ಮನಸ್ಸಿನಲ್ಲಿ ಸಣ್ಣಗೆ ಉರಿಯುತ್ತಿದ್ದ ಬೆಂಕಿಗೆ ತುಪ್ಪ ಸುರಿದಂತಾಯಿತು.
188,ಅನ್ನವು ಶಾಕವು ತುಪ್ಪ ದಧಿ ಹರವಿಗಳನಂ ||
189,"ಅದು ಕರಗಲು ಸಮಯ ತೆಗೆದುಕೊಂಡರೆ, ಅದರ ಬಣ್ಣ ಹಳದಿಯಾಗಿಯೇ ಇದ್ದರೆ ಆ ತುಪ್ಪ ಕಲಬೆರಕೆಯಾಗಿದೆ ಎಂದು ಹೇಳಬಹುದು."
190,ಕಡಲೆ ಹಿಟ್ಟಿಗೆ ಸ್ವಲ್ಪ ತುಪ್ಪ ಸ್ವಲ್ಪ ಅರಿಶಿನ ಮತ್ತು ನೀರು ಸೇರಿಸಿ ಪೇಸ್ಟ್ ಮಾಡಿಕೊಂಡು ಅದನ್ನು ಮುಖಕ್ಕೆ ಹಚ್ಚುವುದರಿಂದ ತ್ವಚೆ ಆರೋಗ್ಯವಾಗಿಯೂ ಇರುತ್ತದೆ ಮತ್ತು ಉತ್ತಮ ಕಾಂತಿಯನ್ನು ಪಡೆಯುತ್ತದೆ.
191,ದೇಶದಾದ್ಯಂತ ವ್ಯಾಪಕ ಟೀಕೆಗೆ ಗುರಿಯಾಗಿರುವ ಡೀಸೆಲ್ ಬೆಲೆ ಏರಿಕೆಯ ಮರುದಿನವೇ ಸರ್ಕಾರವು ತೆಗೆದುಕೊಂಡ ಈ ಕ್ರಮಗಳು ಬಿಜೆಪಿ ಹಾಗೂ ಎಡಪಕ್ಷಗಳ ಅಸಮಾಧಾನದ ಬೆಂಕಿಗೆ ಮತ್ತಷ್ಟು ತುಪ್ಪ ಸುರಿದಿವೆ.
192,ರೈತರ ಸಾಲಮನ್ನಾ ವಿಚಾರ ರೈತರ ಮೂಗಿಗೆ ತುಪ್ಪ ಹಚ್ಚುವ ಕೆಲಸ : ಕುರುಬೂರು ಶಾಂತಕುಮಾರ್ ಆಕ್ರೋಶ
193,"ಅಕ್ಕಿ, ದೊಡ್ಡ ಈರುಳ್ಳಿ, ಚೀವ್ಸ್ ಮತ್ತು ಉಗಿ ತುಪ್ಪ (100 ಗ್ರಾಂ."
194,"ಸಕ್ಕರೆ ಕರಗಿದಾಗ, ಅದಕ್ಕೆ ತುಪ್ಪ ಹಾಕಿ, ನಂತರ ಹಿಚುಕಿದ ಅನ್ನವನ್ನು ಸೇರಿಸಿ."
195,ಇದೀಗ ಪ್ರತ್ಯೇಕ ಲಿಂಗಾಯತ ಧರ್ಮದ ಹೋರಾಟಗಾರ ಅಯ್ಯಣ್ಣಗೌಡ ಎಂಬಾತ ವೀರಶೈವರ ಪರವಾಗಿರುವ ರಂಭಾಪುರಿ ಶ್ರೀಗಳ ಬಗ್ಗೆ ಕೆಟ್ಟದಾಗಿ ಪೋಸ್ಟ್ ಮಾಡಿ ಉರಿಯೋ ಬೆಂಕಿಗೆ ತುಪ್ಪ ಸುರಿದಿದ್ದ‌.
196,ಪ್ರಸಾದದಲ್ಲಿ ತುಪ್ಪ ಮತ್ತು ಮಿಶ್ರಿಯನ್ನು ಬಳಸಬೇಕು.
197,ಹಾಗಾಗಿ ತುಪ್ಪ ಅನಿವಾರ್ಯವಲ್ಲ ಎಂಬುದು ಅವರ ವಾದ.
198,ತುಪ್ಪ - 4-5 ಚಮಚ
199,"- ಯಾರ ಮನೆಯಲ್ಲಿ ನೀರನ್ನು ಹಿಡಿದಿಟ್ಟುಕೊಳ್ಳುವ ಅನಿವಾರ್ಯತೆ ಇದೆಯೋ ಅಂತಹವರು ನೀರಿನ ಪಾತ್ರೆಗಳ (ಹಾಲು, ಮೊಸರು, ತುಪ್ಪ ಮತ್ತು ಎಣ್ಣೆಯಲ್ಲಿ ಕರಿದ ಪದಾರ್ಥಗಳು ಇತರೆ) ಮೇಲೆ ದರ್ಭೆ ಹಾಕಿರಬೇಕು."
200,ಕಾಂಗ್ರೆಸ್‌ ಪಕ್ಷ ಕೆಸರಿನಲ್ಲಿ ಮೀನು ಹಿಡಿಯುವ ಅಥವಾ ಬೆಂಕಿಗೆ ತುಪ್ಪ ಸುರಿಯುವ ಮತ್ತು ಜನರಲ್ಲಿ ಅಶಾಂತಿ ಸೃಷ್ಟಿಸುವ ತನ್ನ ಹಳೆಯ ಚಾಳಿಯನ್ನು ಮುಂದುವರಿಸಿದೆ.
201,"ಅನ್ನಭಾಗ್ಯದಿಂದ ಕದ್ದ ಅನ್ನ 1 ಕೆಜಿ, ಕಸಾಯಿಖಾನೆಯಿಂದ ತಂದ ದನದಮಾಂಸ 1 ಕೆಜಿ, ಹಿಂದುಗಳ ರಕ್ತ 2 ಲೀಟರ್, ಕಾವೇರಿ ಮತ್ತು ಮಹದಾಯಿ ನೀರು 4 ಲೀಟರ್, ಸ್ಟೀಲ್‍ಬ್ರಿಡ್ಜ್‍ಗೆ ಕಡಿದ ಮರದ ಕಟ್ಟಿಗೆ , ಕೊಲ್ಲೂರು ದೇವಸ್ಥಾನದಿಂದ ದೋಚಿದ ತುಪ್ಪ 1 ಕೆಜಿ, ಇಂದಿರಾ ಕ್ಯಾಂಟಿನ್‍ನಿಂದ ಈರುಳ್ಳಿ 2, ಸಿದ್ದು ಬೀಫ್ ರೆಡಿ ಅಂತಾ ವ್ಯಂಗ್ಯ ಮಾಡಿದ ವಿಡಿಯೋ ಬಿಜೆಪಿ ಕೂಡ ರಿಲೀಸ್ ಮಾಡಿದ್ದು, ಇದೀಗ ವೈರಲ್ ಆಗಿದೆ."
202,"ಕ) ಮತ್ತು ತಮಿಳುನಾಡಿನ ಮಧುರೈಯಿಂದ ವಿವಿಬ್ಸ್‌ ಎನ್ನುವ ಕಂಪನಿಯವರು ಜೇನು ಮತ್ತು ಜೇನು ಆಧಾರಿತ ಉತ್ಪನ್ನಗಳು, ಸಂಸ್ಕರಿಸಿದ ಮತ್ತು ಮೌಲ್ಯವರ್ಧಿತ ಉತ್ಪನ್ನಗಳಾದ ಆಮ್ಲಹನಿ ಜೇನುಜಾಮ್‌, ಜೇನು ಲೇಹ್ಯ ಅಲ್ಲದೇ ನಾನಾ ಬೆಳೆಗಳಿಂದ ಪಡೆದ, ನಾನಾ ಔಷಧ ಗುಣಗಳಿಂದ ಕೂಡಿದ ಬಗೆ ಬಗೆಯ ಜೇನು ತುಪ್ಪ ಮಾರಾಟ ಮಾಡಿದರು."
203,ತುಪ್ಪ ಆರೋಗ್ಯಕ್ಕೆಷ್ಟು ಒಳ್ಳೆಯದು ಎಂದು ಈಗ ಅರಿವಾಯಿತಲ್ಲವೇ?
204,ದೋಸೆ ತವಾವನ್ನು ಬಿಸಿ ಮಾಡಿ ದೋಸೆ ಎರೆದು ಮೇಲಿನಿಂದ ತುಪ್ಪ ಅಥವಾ ಬೆಣ್ಣೆ ಹಚ್ಚಿ ಬೇಯಿಸಿ.
205,"ಇದು ಕತ್ತರಿಸಿದ ಈರುಳ್ಳಿ ಮತ್ತು ಬೆಳ್ಳುಳ್ಳಿ ಹುರಿಯಲು, ನೀವು ಸೂರ್ಯಕಾಂತಿ ಎಣ್ಣೆ ಅಥವಾ ತುಪ್ಪ ಮತ್ತು ಆಲಿವ್ ತೈಲ ಉತ್ಪಾದಿಸಲು ಸಾಧ್ಯವಿಲ್ಲ ಉತ್ತಮ."
206,ಅರಮನೆಗೆ ಸೇರಬೇಕಾದ ತುಪ್ಪ ತಮ್ಮ ಆಚಾತುರ್ಯದಿಂದ ಹೀಗೆ ಬೆಂಕಿಯ ಪಾಲಾಯಿತಲ್ಲಾ!
207,1) ಒಂದು ದಪ್ಪತಳದ ಪಾತ್ರೆಯಲ್ಲಿ ತುಪ್ಪ ಹಾಕಿ ಚಿಕ್ಕ ಉರಿಯಲ್ಲಿ ಪೂರ್ಣವಾಗಿ ಕರಗುವವರೆಗೆ ಕಾಯಿರಿ.
208,ಈ ಮೂಲಕ ವಿಧಾನಸಭೆ ಚುನಾವಣೆ ವೇಳೆ ಸರ್ಕಾರಿ ನೌಕರರಿಗೆ ಸಿದ್ದರಾಮಯ್ಯ ಮೂಗಿಗೆ ತುಪ್ಪ ಸವರಲು ಮುಂದಾಗಿದ್ದಾರೆ.
209,"ಮುದ್ಗಾನ್ನ ಎಂದರೆ ಹುಗ್ಗಿ ಅಕ್ಕಿಯ ಎರಡರಷ್ಟು ಪ್ರಮಾಣ ಹೆಸರುಬೇಳೆ, ಒಣಶುಂಠಿ, ಮೆಣಸು, ಜೀರಿಗೆ, ಪತ್ರೆ, ದಾಲ್ಚಿನ್ನಿ, ಜಾಜಿಕಾಯಿ, ಕೊಬ್ಬರಿ, ಲವಂಗ, ಉಪ್ಪು, ತುಪ್ಪ ಎಲ್ಲವನ್ನು ಕೂಡಿಸಿ ಬೇಯಿಸಿದ ಪದಾರ್ಥವೇ ಮುದ್ಗಾನ್ನ."
210,"ಹಾಗೆಯೇ ಪರಡಿ, ಶ್ಯಾಂವಿಗೆ, ತುಪ್ಪ ಮುಂತಾದ ಪದಾರ್ಥಗಳ ಅಡಿಗೆ ಮಾಡಿ ಹಲವು ದಿವಸ ಅವಳಿಗೆ ಊಟ ಮಾಡಿಸುತ್ತಾರೆ."
211,ತಳ ಹಿಡಿಯದಂತೆ ತುಪ್ಪ ಹಾಕಿ ಮಿಕ್ಸ್‌ ಮಾಡಿ.
212,"ತುಪ್ಪ ತೈಲ ಮಾಡಲು, ನೀವು ಬೆಣ್ಣೆ ಬೇಕು."
213,ತುಕ್ಕುಹಿಡಿಯದಿರಲೆಂದು ಕತ್ತಿಗೆ ತುಪ್ಪ ಸವರಿರುತ್ತಾರೆ.
214,ಮಹದೇವಪ್ಪ ಸೇರಿದಂತೆ ಮತ್ತಿತರ ಪ್ರಮುಖರು ತಮ್ಮ ತಮ್ಮ ಅಭ್ಯರ್ಥಿಗಳ ಪರ ಮತದಾರನ ಮೂಗಿಗೆ ತುಪ್ಪ ಸವರುವ ಕೆಲಸ ಮಾಡಿದರು.
215,"ಮೊದಲು ಬಾಣಲೆಯನ್ನು ಒಲೆಯ ಮೇಲಿಟ್ಟು ಅದಕ್ಕೆ ತುಪ್ಪ ಹಾಕಿ, ತುಪ್ಪ ಕಾದ ಮೇಲೆ ಗೋಡಂಬಿ, ಒಣದ್ರಾಕ್ಷಿಯನ್ನು ಹಾಕಿ ಕೈಯಾಡಿಸಿ (ಜಾಸ್ತಿಹೊತ್ತು ಬಿಟ್ಟರೆ ದ್ರಾಕ್ಷಿ ಕಪ್ಪಾಗಾಗುತ್ತದೆ)."
216,"ತುಪ್ಪ ಕಾಯಿಸಿ ಅದರಲ್ಲಿ ಗೋಡಂಬಿ ತುಂಡುಗಳನ್ನು ಕೆಂಪಗೆ ಹುರಿದು,ಸಿದ್ಧವಾಗಿರುವ ಹುಗ್ಗಿಗೆ ಗೆ ಸೇರಿಸಿ."
217,ಹೇಗಾದರೂ ಮಾಡಿ ಮುಂದಿನ ಲೋಕಸಭಾ ಚುನಾವಣೆವರೆಗೆ ಆಕಾಂಕ್ಷಿಗಳ ಮೂಗಿಗೆ ತುಪ್ಪ ಸವರುತ್ತ ಕಾಳ ಕಳೆಯಬೇಕು ಎಂಬ ನಿರ್ಧಾರದಲ್ಲಿದ್ದ ಹೈಕಮಾಂಡ್ ಈಗ ಒಪ್ಪಿಗೆ ನೀಡಿ ತಪ್ಪು ಮಾಡಿತೇ ಎಂದು ಸ್ವತಃ ಕಾಂಗ್ರೆಸಿಗರೇ ಕೇಳುವಂತಾಗಿದೆ.
218,ಉರಿಯುವ ಬೆಂಕಿಗೆ ತುಪ್ಪ ಸುರಿದರು ಎಂಬಂತೆ ಮೊದಲೆ ಅಸಮಾಧಾನಗೊಂಡಿದ್ದ ರಮೇಶ್ ಜಾರಕಿಹೊಳಿಯನ್ನು ನಿನ್ನೆಯಷ್ಟೇ ಸಂಪುಟದಿಂದ ಕೈ ಬಿಡಲಾಗಿತ್ತು.
219,"ತುಪ್ಪ ಕಾಯಲಿರಿಸಿ, ಬೆಲ್ಲ ಸೇರಿಸಿ, ಕರಗಿಸಿ."
220,"ಆದರ್ಶ ಅನುಪಾತ ಕೆಳಗಿನ ಆಗಿದೆ ನೇರ ಹಂದಿ ಎರಡು ಭಾಗಗಳಲ್ಲಿ, ಗೋಮಾಂಸ ಮತ್ತು ತುಪ್ಪ ಒಂದು ಭಾಗವನ್ನು."
221,ಒಂದು ದಪ್ಪ ತಳದ ಬಾಣಲೆಗೆ ಅರ್ಧದಷ್ಟು ತುಪ್ಪ ಹಾಕಿ ರವೆಯನ್ನು ಚೆನ್ನಾಗಿ ಘಮ್ಮೆನ್ನುವಂತೆ ಹುರಿದು ತೆಗೆದಿಟ್ಟುಕೊಳ್ಳಿ.
222,"(ಹಿಟ್ಟನ್ನು ಮೊದಲು ತ್ರಿಕೋನ ಮಾಡಿ ಲಟ್ಟಿಸಿದರೆ ಮೆತ್ತಗಿರುತ್ತದೆ) ಕಾವಲಿ ಬಿಸಿ ಮಾಡಿ, ತುಪ್ಪ ಹಾಕಿ ಬೇಯಿಸಿದರೆ ಓಟ್ಸ್‌ ಮಸಾಲೆ ಚಪಾತಿ ರೆಡಿ."
223,ಸಿಎಂ ರಾಜ್ಯದ ರೈತರ ತುಟಿಗೆ ತುಪ್ಪ ಸವರುವ ಕೆಲಸ ಮಾಡುತಿದ್ದಾರೆ ಎಂದರು.
224,ತುಪ್ಪ ಅಥವಾ ಬೆಣೆ್ಣೆ ಆರೋಗ್ಯಕ್ಕೆ ಹಿತಕರವಾದ ಕೊಬ್ಬೆಲ್ಲ.
225,"ಬಿಸಿ ಇರುವಾಗಲೇ, ಕ್ಯೆಗೆ ತುಪ್ಪ ಸವರಿಕೊಂಡು, ಇಲ್ಲವೇ ಸ್ವಲ್ಪ ಹಾಲು ಬೆರೆಸಿ,"
226,"ಕ್ಯಾಪ್ಸಿಕಂ- 2, ಬಟಾಣಿ 1 ಹಿಡಿ, ರುಚಿಗೆ ತಕ್ಕಷ್ಟು ಉಪ್ಪು, ಬೆಳ್ಳುಳ್ಳಿ 6 ಎಸಳು, ಈರುಳ್ಳಿ- 2, ಟೊಮೆಟೊ- 2, ಬಾಸ್ಮತಿ ಅಕ್ಕಿ- 500ಗ್ರಾಂ, ಎಣ್ಣೆ ಅಥವಾ ತುಪ್ಪ ಅಥವಾ ಡಾಲ್ಡಾ (ಕರಿಯಲು), ಚಕ್ಕೆ – 1 ರಿಂದ 2 ಚೂರು, ಬೆಳ್ಳುಳ್ಳಿ ಶುಂಠಿ ಪೇಸ್ಟ್‌ ಸ್ವಲ್ಪ, ಜೀರಿಗೆ – 1 ಟೀ ಚಮಚ, ಹಸಿಮೆಣಸು – 2 ರಿಂದ 3, ಕೊತ್ತಂಬರಿ ಕಟ್ಟು, ಪಲಾವ್‌ ಪೌಡರ್‌ 4 ಟೀ ಚಮಚ, ಕ್ಯಾರೆಟ್ – 2."
227,ನಂತರ ಸಕ್ಕರೆ ಪುಡಿ ಹಾಕಿ ಚೆನ್ನಾಗಿ ಕಲಸಿ ಸ್ವಲ್ಪ ತುಪ್ಪ ಸೇರಿಸಿ ಉಂಡೆ ಕಟ್ಟಿ.
228,ಈ ದುಃಖಕ್ಕೆ ತುಪ್ಪ ಸುರಿದು ಬೆಂಕಿ ಹಚ್ಚುತ್ತಿದ್ದವರೆಂದರೆ ನೆರೆಹೊರೆಯ ಹೆಣ್ಣುಮಕ್ಕಳು.
229,ತಣ್ಣಗಾಗಿದ್ದ ಹೊಗೇನಕಲ್ ವಿವಾದದ ಬೆಂಕಿಗೆ ಎಂಕೆ ತುಪ್ಪ
230,ಅದ್ರೆ ಇಲ್ಲಿ ಕಾಡುತ್ತಿರೋ ಪ್ರಶ್ನೆ ಅಂದ್ರೆ ಸ್ಯಾಂಡಲ್ ವುಡ್ ನ ಸ್ಟಾರ್ ವಾರ್ ಅನ್ನೋ ಫೈಯರ್ ಗೆ ಅಗಾಗ ತುಪ್ಪ ಸುರಿತಿರೋದು ಯಾರ್ ?ಎಸ್ ಇಲ್ಲಿ ಗಮನಿಸ ಬೇಕಾದ ಅಂಶ ಅಂದ್ರೆ ಸ್ಯಾಂಡಲ್ ವುಡ್ ನಲ್ಲಿ ಸದ್ದು ಮಾಡ್ತಿರೋ ಸ್ಟಾರ್ ವಾರ್ ನಿಜಕ್ಕೂ ಸ್ಟಾರ್ ವಾರ್ ಅಲ್ಲ ಅದು ಫ್ಯಾನ್ಸ್ ಗಳ ವಾರ್ ಅಂದ್ರೆ ತಪ್ಪಾಗಲ್ಲ.
231,"ನರಪುಷ್ಠಿಗೆ, ದೇಹದ ಸವೆತ ಕಡಿಮೆ ಮಾಡಲು, ದಿನಾ ಅಲ್ಪ ಪ್ರಮಾಣದಲ್ಲಿ ತುಪ್ಪ ತಿನ್ನಿ."
232,"ರಾಜಕೀಯವನ್ನು ಅಧ್ಯಯನ ಮಾಡಲಿಕ್ಕಾಗಿಯೇ ಹೋಗಿದ್ದು ಎಂದು ಸಮರ್ಥಿಸಿಕೊಂಡ ರವಿ, ಸರಕಾರದ ಉರಿಯುವ ಬೆಂಕಿಗೆ ತುಪ್ಪ ಸುರಿಯಲಿಕ್ಕಾಗಿಯೇ ನಾವಿರುವುದು, ನಾವಿರುವುದೂ ರಾಜಕಾರಣ ಮಾಡಲಿಕ್ಕಾಗಿಯೇ ಎಂದರು."
233,"ಬೇಕಾಗುವ ಸಾಮಗ್ರಿಗಳು: ತೆಂಗಿನ ಕಾಯಿಹಾಲು – 2ಕಪ್, ಹಾಲು – 2ಕಪ್, ಸಕ್ಕರೆ – 2ಕಪ್, ಏಲಕ್ಕಿ ಪುಡಿ – ಸ್ವಲ್ಪ, ತುಪ್ಪ –ಚೂರು"
234,"ದಾಸರು ನಿನ್ನಜ್ಜನ ಬೆನ್ನ ಹಿಂದೆ ಬಂದಿದ್ದರಂತೆ, ರೊಟ್ಟಿಗೆ ತುಪ್ಪ ಸವರಿಕೊಂಡು!"
235,ಭಾರತದಲ್ಲಿ ಉತ್ಪತ್ತಿಯಾದ ತುಪ್ಪ ಬಹುತೇಕವಾಗಿ ಅಮೇರಿಕಾದಲ್ಲಿ ನಿಷೇಧ ಪಡೆದಿದೆ.
236,ಈ ಬಜೆಟ್ ಮೂಲಕ ಕೇವಲ ರಾಜ್ಯದ ಜನರಿಗೆ ಮೂಗಿಗೆ ತುಪ್ಪ ಸುರಿಯುವ ಕಾರ್ಯ ಮಾಡಲಾಗಿದೆ ಎಂದು ಬಿಜೆಪಿ ಶಾಸಕ ಆರ್.
237,ತುಪ್ಪ ಬೇಕಾ ತುಪ್ಪ ರಾಜಕೀಯಕ್ಕೆ?
238,"ಬೆಂಗಳೂರು: ಮಾಜಿ ಸಚಿವ, ನಟ ರೆಬೆಲ್ ಸ್ಟಾರ್ ಅಂಬರೀಶ್ ಅವರ ಅಗಲಿ ಇಂದಿಗೆ 11 ದಿನವಾಗಿದ್ದು ಕುಟುಂಬಸ್ಥರು ಸೂತಕ ಕಳೆದುಕೊಳ್ಳುವ ಶಾಸ್ತ್ರ ಆಚರಿಸಿದ್ದು ಬೆಳಿಗ್ಗೆ ಕಂಠೀರವ ಸ್ಟುಡಿಯೋದಲ್ಲಿರುವ ಅಂಬರೀಶ್ ಸಮಾಧಿಗೆ ತೆರಳಿ ಹಾಲು, ತುಪ್ಪ ಅರ್ಪಿಸಿ ವಿಶೇಷ ಪೂಜೆಯನ್ನು ಸಲ್ಲಿಸಲಾಯಿತು."
239,ಉರಿಯೋ ಬೆಂಕಿಗೆ ತುಪ್ಪ ಸುರಿದ ಕುಮಾರಸ್ವಾಮಿ ಹೇಳಿಕೆ
240,) ಮತ್ತಷ್ಟು ಕುಸಿಂುುುತ್ತಿರುವುದು ಬೆಂಕಿಗೆ ತುಪ್ಪ ಸುರಿದಂತಾಗಿದೆ.
241,ಅವನ ರೋಷಾವೇಶಕ್ಕೆ ತುಪ್ಪ ಸುರಿದದ್ದು 1947ರ ವಿಭಜನೆ.
242,ಅನ್ನದ ಮೇಲೆ ತೊವ್ವೆ – ಅದರ ಮೇಲೆ ತುಪ್ಪ ಬಿದ್ದು ತಾತ ಚಿತ್ರಾವತಿ ಇಟ್ಟು ಊಟ ಶುರುಮಾಡುವ ತನಕ ಯಾರೂ ಎಲೆಗೆ ಕೈಹಾಕುವಂತಿರಲಿಲ್ಲ.
243,ಜೇನು ತುಪ್ಪ ಇದು ಜೀವಿಗಳ ವಿರೋಧಿ ಮತ್ತು ಉರಿಯೂತದ ಗುಣಲಕ್ಷಣಗಳನ್ನು ಹೊಂದಿರುತ್ತದೆ ಇದು ಯಾವುದೇ ರೀತಿಯ ಸೋಂಕುಗಳು ಸಂಭವಿಸದಂತೆ ತಡೆಯುತ್ತದೆ ಉಸಿರಾಟಕ್ಕೆ ತೊಂದರೆ ಆದಾಗ ಮೆಣಸು ಪುಡಿಯನ್ನು ಸ್ವಲ್ಪ ಜೇನುತುಪ್ಪದೊಂದಿಗೆ ಸೇವಿಸಬೇಕು.
244,ಹಾಲಿನ ಪುಡಿ ಮತ್ತು ಜೇನು ತುಪ್ಪ - ಇವೆರಡೇ ಪದಾರ್ಥಗಳು ಸಾಕು ನಿಮ್ಮ ತ್ವಚೆಗೆ ಸೌಂದರ್ಯವನ್ನು ನೀಡಲು!
245,ಆದರೆ ತುಪ್ಪ ತಿನ್ನುವುದರಿಂದ ದೇಹದ ತೂಕ ಹೆಚ್ಚಾಗುತ್ತದೆ ಎಂಬುದು ಸುಳ್ಳು ಎನ್ನುತ್ತದೆ ಆಯುರ್ವೇದ.
246,"ಅಳತೆಗಳು ಮತ್ತು ತೂಕಗಳು : ಭೂಮಿಯ ಅಳತೆ, ಕಾಳಿನ ಅಳತೆ ಹಾಗೂ ಎಣ್ಣೆ ತುಪ್ಪ ಇತ್ಯಾದಿ ದ್ರವಗಳ ಅಳತೆ ಹಾಗೂ ಲೋಹಗಳ ತೂಕ ಶಾಸನಗಳಲ್ಲಿ ಕಾಣಬರುತ್ತವೆ."
247,"ಜತೆಗೆ ಇದೀಗ ಕರ್ತಾಪುರಕ್ಕೆ ಆಗಮಿಸುವ ಸಿಕ್ಖ್ ಸಮುದಾಯದವರ ಮನಸ್ಸು ಕೆರಳುವಂತೆ, ಭಾರತ ಒಡೆಯಲು ಪ್ರತ್ಯೇಕ ಖಲಿಸ್ಥಾನ ಚಳವಳಿಗೆ ತುಪ್ಪ ಸುರಿಯಲು ಬಿಂದ್ರನ್‌ವಾಲೆ ವೀಡಿಯೋ ತೋರಿಸಲಾಗುತ್ತದೆ."
248,"ನಂತರ ಒಂದು ಬಾಣಲೆಯಲ್ಲಿ ಸ್ವಲ್ಪ ತುಪ್ಪ ಅಥವಾ ಎಣ್ಣೆ ಹಾಕಿ, ಎಣ್ಣೆ ಅಥವಾ ತುಪ್ಪ ಬಿಸಿಯಾದಾಗ ಸಾಸಿವೆ ಮತ್ತು ಜೀರಿಗೆ ಹಾಕಬೇಕು."
249,"ತುಪ್ಪ ತಿಂದರೆ ಆರೋಗ್ಯ ಕೆಡುತ್ತದೆ, ಕೊಬ್ಬರಿ ಎಣ್ಣೆ ಬಳಸಬಾರದು ಎಂಬಂತಹ ವಾದಗಳನ್ನು ವಿವೇಕ್‌ ಅವರು ತಮ್ಮ ವಾಹಿನಿ ಮೂಲಕವೇ ಸೋಲಿಸುತ್ತಿದ್ದಾರೆ ಕೂಡ."
250,ಗಣಪತಿ ಆತ್ಮಹತ್ಯೆ ಪ್ರಕರಣಕ್ಕೆ ತುಪ್ಪ ಸುರಿದ ಎಕೆ ಸುಬ್ಬಯ್ಯ
251,ಇತ್ತ ತಮ್ಮ ವೈಫಲ್ಯವನ್ನು ಪ್ರಶ್ನಿಸದಂತೆ ಟಿಕೆಟಿನ ಆಸೆ ಹುಟ್ಟಿಸಿ ಭೀಮಣ್ಣ ನಾಯ್ಕರ ಮೂಗಿಗೆ ತುಪ್ಪ ಸವರುತ್ತಿದ್ದಾರೆ ಎಂದರು.
252,ಇಲ್ಲಿದೆ ನೋಡಿ ಶುದ್ಧ ತುಪ್ಪ ಪರೀಕ್ಷಿಸುವ ವಿಧಾನ
253,"ನಂತರ ಟ್ರಂಪ್ ಪತ್ನಿ ಮೆಲೇನಿಯಾಗೆ ಕಾಶ್ಮೀರಿ ಮತ್ತು ಹಿಮಾಚಲ ಪ್ರದೇಶದ ಶಾಲು, ಹಿಮಾಚಲ ಪ್ರದೇಶದ ಸಾಂಪ್ರದಾಯಿಕ ಬೆಳ್ಳಿ ಕಡಗ, ಕಾಂಗ್ರಾ ವ್ಯಾಲಿಯ ಚಹಾ ಮತ್ತು ಜೇನು ತುಪ್ಪ ಉಡುಗೊರೆಯಾಗಿ ನೀಡಿದರು."
254,ನೀವು ಜಾಸ್ತಿ ತುಪ್ಪ ಬಳಸುವವರಾದರೆ ನಿಮ್ಮ ಜೇಬು ಕಚ್ಚಬಹುದು.
255,"ಈಗ ಬಾಣಲೆಯಲ್ಲಿ ಒಂದು ದೊಡ್ಡ ಚಮಚ ತುಪ್ಪ ಬಿಸಿಮಾಡಿ, ಮೆಂತ್ಯ, ಸಣ್ಣದಾಗಿ ಹೆಚ್ಚಿದ ಈರುಳ್ಳಿ, ಶುಂಠಿ ಬೆಳ್ಳುಳ್ಳಿ ಪೇಸ್ಟ್, ಸಣ್ಣಗೆ ಹೆಚ್ಚಿದ ಟೊಮ್ಯಾಟೊ, ಉಪ್ಪು, ಚಿಕನ್, ಖಾರದ ಪುಡಿ, ಧನಿಯಾ ಪುಡಿ, ಅರಿಶಿನ, ಗರಮ್ ಮಸಾಲ ಸೇರಿಸಿ ಚೆನ್ನಾಗಿ ಬಾಡಿಸಿ."
256,ಸಜ್ಜೆ ರೊಟ್ಟಿತಯಾರಿಸಬಹುದಲ್ಲದೇ ಸಜ್ಜೆ ಹಿಟ್ಟನ್ನು ಹುರಿದು ಪಾಕ ತಯಾರಿಸಿ ತುಪ್ಪ ಬೆರೆಸಿ ಉಂಡೆ ತಯಾರಿಸಬಹುದು.
257,ಒಂದು ಚಮಚ ತುಪ್ಪ
258,ಎರಡು ಪ್ಯಾಕ್‌ನ ತುಪ್ಪವನ್ನು ಪರೀಕ್ಷೆ ನಡೆಸಿದ ತಜ್ಞರು ಕಲಬೆರಕೆ ತುಪ್ಪ ಎಂದು ದೃಢಪಡಿಸಿದರು.
259,ಈ ಬೆನ್ನಲ್ಲೆ ಕಳೆದ ನಾಲ್ಕು ದಿನಗಳ ಹಿಂದೆ ಹಲ್ಲೆಗೊಳಗಾಗಿದ್ದ ಆರ್‍ಎಸ್‍ಎಸ್ ಕಾರ್ಯಕರ್ತ ಶರತ್ ಮಡಿವಾಳ ನಿನ್ನೆ ರಾತ್ರಿ ಚಿಕಿತ್ಸೆ ಫಲಿಸದೆ ಸಾವನ್ನಪ್ಪಿರುವುದು ಉರಿಯುವ ಬೆಂಕಿಗೆ ಮತ್ತಷ್ಟು ತುಪ್ಪ ಸುರಿದಂತಾಗಿದೆ.
260,ಕೆಲವು ನಾಯಕರ ಹೇಳಿಕೆಗಳು ಉರಿಯುವ ಬೆಂಕಿಗೆ ತುಪ್ಪ ಸುರಿಯುವಂತೆ ಮಾಡಿದೆ.
261,ನಾಲಿಗೆ ಕಚ್ಚಿಕೊಂಡಿರುವ ಜಾಗಕ್ಕೆ ಸ್ವಲ್ಪ ಜೇನು ತುಪ್ಪ ಸವರಿ ಅಥವಾ ಒಂದು ಟೀ ಚಮಚ ಜೇನು ತುಪ್ಪ ಬಾಯಿಯಲ್ಲಿ ಹಾಕಿಕೊಂಡು ಗಾಯ ಆಗಿರುವ ಜಾಗದಲ್ಲಿ 10 ರಿಂದ 20 ಸೆಕೆಂಡ್ ಗಳಷ್ಟು ಕಾಲ ಇಟ್ಟುಕೊಳ್ಳಿ .
