Index,Sentence
0,ಮಂಜು ಹೇಳಿದ್ರಂತೆ.
1,ಚಿಕ್ಕಣ್ಣನನ್ನು ಹೀರೋ ಮಾಡಲು ಮಂಜು ಮಾಂಡವ್ಯ ಪ್ಲಾನ್ ಮಾಡಿದ್ದಾರೆ.
2,"ಈಗಾಗಲೇ ಟ್ರೇಲರ್ ಮೇಕಿಂಗ್​ನ ತಾಂತ್ರಿಕ ಅಂಶ, ಪಾತ್ರಗಳ ಪರಿಚಯ, ಕತೆಯ ಬಗೆಗಿನ ಕುತೂಹಲದ ಕುರಿತು ಚಿತ್ರತಂಡಕ್ಕೆ ಸಾಕಷ್ಟು ಪ್ರಶಂಸೆ ಸಿಕ್ಕಿದ್ದು ಯೋಗ್ ರಾಜ್ ಭಟ್ ಹಿರಿಯ ನಟ ದತ್ತಣ್ಣ, ಪೂರ್ಣ ಚಂದ್ರ ತೇಜಸ್ವಿ, ನಿರ್ದೇಶಕ ಪವನ್ ಒಡೆಯರ್,ಡೈರೈಕ್ಟರ್ ಸತ್ಯಪ್ರಕಾಶ್ ಹಾಗೂ ರೈಟರ್ ಮಂಜು ಮಾಸ್ತಿ ಮತ್ತಿತರರು ಈ ಚಿತ್ರಕ್ಕೆ ಶುಭ ಹಾರೈಸಿದ್ದಾರೆ."
3,2014ರ ಲೋಕಸಭಾ ಚುನಾವಣೆಯಲ್ಲಿ ಜೆಡಿಎಸ್​ ಭದ್ರಕೋಟೆಯಾಗಿದ್ದ ಹಾಸನದಲ್ಲಿ ದೇವೇಗೌಡರ ವಿರುದ್ಧ ಸ್ಪರ್ಧಿಸಿದ್ದ ಎ ಮಂಜು ಕೇವಲ 1 ಲಕ್ಷಗಳ ಮತಗಳ ಅಂತರದಲ್ಲಿ ಸೋತಿದ್ದರು.
4,ಮಂಜು ಹೆಸ್ರಲ್ಲಿ ಯುವತಿಯರಿಗೆ ಬಲೆ ಬೀಸುತ್ತಿದ್ದ ನಕಲಿ ನಿರ್ಮಾಪಕ
5,ಲೋಕಸಭೆ ಚುನಾವಣೆಯಲ್ಲಿ ಹಾಸನ ಕ್ಷೇತ್ರದ ಜೆಡಿಎಸ್ ಅಭ್ಯರ್ಥಿಯಾಗಿದ್ದ ಪ್ರಜ್ವಲ್ ರೇವಣ್ಣ ಸುಳ್ಳು ಪ್ರಮಾಣ ಪತ್ರ ನೀಡಿ ಆಯ್ಕೆಯಾಗಿದ್ದಾರೆ ಎಂದು ಅವರ ವಿರುದ್ಧ ಮಂಜು ಹೈಕೋರ್ಟ್ ನಲ್ಲಿ ಚುನಾವಣಾ ತಕರಾರು ಅರ್ಜಿ ಸಲ್ಲಿಸಿದ್ದಾರೆ.
6,"ರಂಜನೆಯ ಪರಿಧಿ ಮೀರಿದ, ಸಂದೇಶ ನೀಡುವಂತಹ 5ರಿಂದ 6 ನಿಮಿಷಗಳ ಈ ಮೂರೂ ಕಿರುಚಿತ್ರಗಳ ನಿರ್ದೇಶಕ ಮಂಜು ಎಂ."
7,"ಈ ಚಿತ್ರಕ್ಕೆ ರವಿಶಂಕರ್ ನಾಗ್ ಸಂಭಾಷಣೆ, ಕವಿರಾಜ್ ಸಾಹಿತ್ಯ, ಸಾಯಿಕಿರಣ್ ಸಂಗೀತ, ವೀನಸ್‌ಮೂರ್ತಿ ಛಾಯಾಗ್ರಹಣ, ಬಾಬುಖಾನ್ ಕಲೆ, ಶಂಕರ್ ನೃತ್ಯ, ಥ್ರಿಲ್ಲರ್ ಮಂಜು ಸಾಹಸ ಈಶ್ವರ್ ಸಂಕಲನವಿದೆ."
8,"ಈ ಮಧ್ಯೆ ಮಂಜು ಎಂಬಾತನ ಶವ ಪತ್ತೆಯಾಗಿದ್ದು, ಕುಟುಂಬ ಸದಸ್ಯರ ಆಕ್ರಂದನ ಮುಗಿಲು ಮುಟ್ಟಿದೆ."
9,"ತಮಿಳು ಅವತರಣಿಕೆಯನ್ನು ನಿರ್ಮಿಸಲು ಸ್ವತಃ ಮಂಜು ಅವರಿಗೆ ಆಸಕ್ತಿಯಿದ್ದರೂ, ತಮಿಳಿನ ನಿರ್ಮಾಪಕರು ಪಟ್ಟು ಹಿಡಿದಿದ್ದರಿಂದ ತಮ್ಮ ಪಟ್ಟು ಸಡಿಲಿಸಬೇಕಾಯಿತು ಎನ್ನುತ್ತಾರೆ."
10,"5ನೇ ಬೆಟಾಲಿಯನ್​ನಲ್ಲಿ​ ಕೆಲಸ ನಿರ್ವಹಿಸುತ್ತಿದ್ದ ದೇವರಾಜ್, ಪತ್ನಿ ಗಾಯತ್ರಿ, ಮಕ್ಕಳಾದ ಆದರ್ಶ, ಮಂಜು ರನ್ನು ಅಗಲಿದ್ದಾರೆ."
11,ಎಂದು ಮುನಿರತ್ನಂ ಮತ್ತು ಕೆ ಮಂಜು ನಡುವಣ ಅವರವರ ಚಿತ್ರ ಬಿಡುಗಡೆ ವಿಚಾರದಲ್ಲಿ ಭಾರೀ ಸದ್ದುಗದ್ದಲ.
12,"ಇದು ಈಗಾಗಲೇ ಮುಖ್ಯ ಬೆಳಕಿಗೆ ಮುಂದಿನ ನೆಲೆಗೊಂಡಿವೆ ಇದು ಸುತ್ತಿನಲ್ಲಿ ಮಂಜು ದೀಪಗಳು, ಎಂದು ಗಮನಿಸಬೇಕು."
13,ಮಂಜು ಗುಡುಗಿದರು.
14,"ಹೌದು, ನೀವು ಮಂಜು ತಿನ್ನುತ್ತಿದ್ದರೆ ನೀವು ಸಮಾನ ಪ್ರಮಾಣದ ನೀರನ್ನು ಸೇವಿಸಿದರೆ ಸ್ವಲ್ಪ ಹೆಚ್ಚು ಕ್ಯಾಲೋರಿಗಳನ್ನು ಸುಡುವಿರಿ."
15,ಸಜ್ಜನ ರಾಜಕಾರಣ ಎ ಟಿ ರಾಮಸ್ವಾಮಿ ಮಂಜು ಅಬ್ಬರವನ್ನು ಅಡಗಿಸುವಲ್ಲಿ ಯಶಸ್ವಿಯಾಗಿದ್ದಾರೆ.
16,ಹಾಸನದಲ್ಲಿ ಜೆಡಿಎಸ್ ವಿರುದ್ಧ ಸಮರ ಸಾರಿದ್ದ ಎ ಮಂಜು ಅರಕಲಗೂಡು ಕ್ಷೇತ್ರದಲ್ಲಿ ಸೋತದ್ದು ಕೂಡ ನಡವಳಿಕೆಯ ಕಾರಣಕ್ಕೆ.
17,"ಮಂಜು ವಿಜ್ಞಾನ್‍ನ ಸಹೋದ್ಯೋಗಿ, ಈತನ ಊರು ಸೊರಗೂರಿನ ಚಿತ್ರಗುಪ್ಪ."
18,ಮೆರೈನ್ ಇಂಡಸ್ಟ್ರಿ ಸ್ಟ್ಯಾಂಡರ್ಡ್ನಿಂದ ಅಗತ್ಯಕ್ಕಿಂತ ಹೆಚ್ಚು ಕಠಿಣವಾದ ಉಪ್ಪು ಮಂಜು ಪರೀಕ್ಷೆ 66 ಶೇಕಡಾಕ್ಕಿಂತಲೂ ಹೆಚ್ಚಿದೆ
19,"ಮಂಜು ಪ್ರಸಾದ್, ಪೊಲೀಸ್ ಸಿಬ್ಬಂದಿ ನಗೀನಾ ಮುಲ್ಲಾ ಮತ್ತು ಪದ್ಮ ಅವರ ಸೋದರ ಸಂಬಂಧಿ ಮಹದೇವ ಅವರನ್ನೊಳ ಗೊಂಡ ತಂಡವು ಕಳೆದ ಸೋಮವಾರ ಶಿಮ್ಲಾಗೆ ಕಳುಹಿಸಿಕೊಡಲಾಗಿತ್ತು."
20,"ನಿಮಿಷಕ್ಕೊಮ್ಮೆ ಮುಚ್ಚುವ ಬಿಚ್ಚುವ ಮಂಜು ಮೋಡಗಳ ಹಿಂದೆ, ಯಕ್ಷ ಕಿನ್ನರ ಮಿಥುನಗಳು ಪ್ರೇಮಾಲಾಪದಲ್ಲಿ ತೊಡಗಿವೆ."
21,"ಈ ಚಿತ್ರಕ್ಕೆ ಅರ್ಜುನ್ ಜನ್ಯ ಅವರ ಸಂಗೀತವಿದ್ದು, ಥ್ರಿಲ್ಲರ್ ಮಂಜು ಅವರ ಸಾಹಸವಿದೆ."
22,ಅವರು ಮಂಜು ಅವರ ಗೆಳೆಯ.
23,"ಬುಟಾಳಿ, ಸಿದ್ದಾರ್ಥ ಶಿಂಗೆ, ವಿನಯಕ ದೇಸಾಯಿ, ಸಂಜು ಕಾಂಬಳೆ, ಮಂಜು ಹೋಳಿಕಟ್ಟಿ ಇದ್ದರು."
24,"ದಿನಾಂಕ 17-4-2018 ರಂದು ಸಂಜೆ 17-30 ಗಂಟೆಗೆ ಮಾದಾಪಟ್ಟಣ ಗ್ರಾಮದಲ್ಲಿ ಸರಕಾರದ ವತಿಯಿಂದ ಚರಂಡಿ ದುರಸ್ಥಿ ಕೆಲಸ ನಡೆಯುತ್ತಿದ್ದು ಗುತ್ತಿಗೆದಾರು ಮಾದಾಪಟ್ಟಣದ ನಿವಾಸಿಗಳಾದ ಶ್ರೀಮತಿ ಗೀತಾರವರಿಗೆ ಮನೆಯ ಮುಂದಿನ ಶೀಟುಗಳನ್ನು ತೆರವುಗೊಳಿಸಲು ತಿಳಿಸಿದ್ದು, ಅದಕ್ಕೆ ನಾಳೆ ಸದರಿ ಶೀಟ್ ಗಳನ್ನು ತೆರವುಗೊಳಿಸಿಕೊಡಲಾಗುವುದೆಂದು ತಿಳಿಸಿದ್ದು, ಈ ವಿಚಾರದಲ್ಲಿ ಎರಡು ಕಡೆಯವರಿಗೆ ಜಗಳವಾಗಿ ಪರಸ್ಪರ ಹಲ್ಲೆ ಮಾಡಿದ್ದು ಈ ಸಂಬಂಧ ಶ್ರೀಮತಿ ಗೀತಾರವರು ರಾಜು, ಮಂಜು ಭಾಗ್ಯರವರು ಹಲ್ಲೆ ನಡೆಸಿದ ಬಗ್ಗೆ ಹಾಗು ಶ್ರೀಮತಿ ಶೃತಿರವರು ಮಾದೇಶ, ಮಧು, ಪ್ರಮೋದ್, ಪ್ರವೀಣ, ಗೀತಾ, ಮಾಲಾ ಭವ್ಯರವರು ಹಲ್ಲೆ ನಡೆಸಿರುತ್ತಾರೆಂದು ನೀಡಿದ ದೂರಿನ ಮೇರೆಗೆ ಎರಡು ಪ್ರತ್ಯೇಕ ಪ್ರಕರಣಗಳನ್ನು ದಾಖಲಿಸಿದ ಕುಶಾಲನಗರ ಪಟ್ಟಣ ಪೊಲೀಸರು ತನಿಖೆ ಕೈಗೊಂಡಿದ್ದಾರೆ."
25,"ಕರವೇ ಕಾರ್ಯಕರ್ತರಾದ ಕಿರಣ ವಾಸನದ, ಲೋಕೇಶ ನಾವಿ, ರಮೇಶ ದಂಡಿನ, ಮಂಜು ಗಸ್ತಿ, ಸಂತೋಷ ಗಸ್ತಿ, ಶ್ರೀನಿವಾಸ ಪೈಲಿ, ಕಿರಣ ನ್ಯಾಮಗೌಡ ಮತ್ತಿತರರು ಕಾರ್ಯಾಚರಣೆಯಲ್ಲಿದ್ದರು."
26,ಮಂಜು ಮಹಿಯನು ಮುಸುಕುವಂತೆ ಧ
27,ಮಂಜು ಅವರ ಈ ಗಿಮಿಕ್‌ ಈಗಾಗಲೇ ಸಮಾಜದಲ್ಲಿ ಅಪಮಾನಕ್ಕೊಳಗಾಗಿರುವ ಪೌರ ಕಾರ್ಮಿಕರನ್ನು ವ ಮೂಲಕ ಅವರನ್ನು ಮತ್ತಷ್ಟು ಅವಮಾನ ಮಾಡಿದಂತಾಗಿದೆ.
28,ಮಂಜು ಪತ್ರಕರ್ತರ ನಡುವೆ ಕಥೆಗಾರ ಮಂಜಣ್ಣ~ ಎಂದೇ ಪ್ರಸಿದ್ಧರು.
29,ಹಾಗಾಗಿ ನೀರು ತುಂಬಿಸಿಕೊಳ್ಳಲು ಎಚ್ಚರಿಕೆಯಿಂದ ಕಾಲಿಡಬೇಕಾದ ಸ್ಥಿತಿ ಇದೆ ಎಂಬುದು ಗ್ರಾಮದ ಮಂಜು ರವರ ಆರೋಪ.
30,ಸಿಕ್ಕ ಸುವರ್ಣಾವಕಾಶ ಮತ್ತು ಜವಾಬ್ದಾರಿಯನ್ನು ಸಮರ್ಥವಾಗಿ ನಿಭಾಯಿಸಲು ಮಂಜು ಮಾಂಡವ್ಯ ರೆಡಿ ಇದ್ದರು.
31,ಉತ್ತರ ಭಾರತದ ಪ್ರದೇಶಗಳಲ್ಲಿ ಸದ್ಯ ಪೂರ್ವದ ಶೀತಗಾಳಿ ಬೀಸುತ್ತಿದ್ದು ದೆಹಲಿ ಸೇರಿ ಹಲವಡೆ ದಟ್ಟ ಮಂಜು ಕವಿದುಕೊಳ್ಳಲು ಮತ್ತೊಂದು ಕಾರಣ ಎನ್ನಲಾಗಿದೆ.
32,"ಮಂಜು ಮತ್ತು ತಂಡದವರಿಂದ ವೀರಭದ್ರನ ಕುಣಿತ, 6ಕ್ಕೆ ಮಿಶ್ರ ನವೀನ್ ಮತ್ತು ತಂಡದಿಂದ ನೃತ್ಯರೂಪಕ, ಖ್ಯಾತಗಾಯಕ ವಿಜಯಪ್ರಕಾಶ್ ಮತ್ತು ತಂಡದಿಂದ ಸುಗಮ ಸಂಗೀತ ನಡೆಯಲಿದೆ."
33,ಶಾಲಾಭಿವೃದ್ಧಿ ಸಮಿತಿಯ ಅಧ್ಯಕ್ಷ ಮಂಜು ಕೆ ದೇವಾಡಿಗ ಅಧ್ಯಕ್ಷತೆ ವಹಿಸಿದ್ದರು.
34,"ಉಪಾಧ್ಯ, ಚಂದ್ರಕಾಂತ ಶಾಂತು ನ್ಯಾಮ ಗೌಡ್ರು, ಹುಕುಂ ಚಂದ ಬಾಗೇವಾಡಿ, ಮಂಜು ದುಂಡಣ್ಣ ನವರ, ಶಾಂತಕ್ಕ ಅಂಗಡಿ, ಮಾಲತೇಶ ಈಲಿಗೇರ, ಎಂ."
35,"ನಾವು ಟೆರೇಸ್ಗೆ ಬಂದಾಗ, ಮರದ ಇನ್ನೂ ಹಸಿರು ಮತ್ತು ಇನ್ನೂ ಮಂಜು ಇತ್ತು, ಆದರೆ ಕಣ್ಣುಗಳು, ಬೆಳಕು ಇಲ್ಲ, ಮತ್ತು ಬಾರ್ಗಳು ಗುಂಡಿಕ್ಕಿ ಚಿತ್ರೀಕರಿಸಲ್ಪಟ್ಟಿದ್ದವು."
36,"ಈ ಘಟನೆಗೆ ಕಾರಣ, ದಾರಿ ಕಾಣದಷ್ಟು ಮಂಜು ಮತ್ತು ಮಳೆಯ ಸುರಿತ ಎನ್ನಲಾಗಿದೆ."
37,"ಅಂತರವಿರುವ ನಾರಾಯಣಪುರಕ್ಕೆ ಕಳೆದ 4 ವರ್ಷಗಳ ಹಿಂದೆ ರಸ್ತೆಯಿತ್ತು ಎಂದು ವಾಲ್ಮೀಕಿ ಸಂಘದ ಅಧ್ಯಕ್ಷ ಮಂಜು ಹೇಳುತ್ತಿದ್ದು, ಆದರೆ ಕಳೆದ 6 ವರ್ಷಗಳಲ್ಲಿ ರಂಗನಾಯಕನ ಕುಟುಂಬ ಈ ರಸ್ತೆಗೆ ಅಕ್ರಮವಾಗಿ ಬೇಲಿ ಹಾಕಿಕೊಂಡಿರುವುದರಿಂದ ಸಂಪರ್ಕ ಬಂದ್ ಆಗಿದೆ."
38,ಮಂಜು ಹೇಳಿದರು.
39,ಮಂಜು ಅವರು ವಿಷ್ಣುವರ್ಧನ್ ಅವರ ನಿಕಟ ಸಂಪರ್ಕ ಹೊಂದಿದ್ದವರು.
40,ಹೀರೋ ಆದ್ರು ಮಂಜು ಮಾಂಡವ್ಯ
41,ಮಂಜು ಬಿಜೆಪಿಯಿಂದ ಸ್ಪರ್ಧೆ ಮಾಡುವ ಮೂಲಕ ಕಾಂಗ್ರೆಸ್​ಗೆ ಬಿಗ್​ ಶಾಕ್​ ನೀಡಲು ನಿರ್ಧರಿಸಿದ್ದಾರೆ ಎಂಬ ಮಾತುಗಳು ಕೇಳಿಬರುತ್ತಿವೆ.
42,"ಆದರೆ ವೈಫಲ್ಯ ಸಾಧನ ಮಾತ್ರ ಮಾಡಬಹುದು ಹಿಮ, ಮಂಜು ಅಥವಾ ಮಣ್ಣಿನ ಹೊಂದಿರುವ ಪದರದ ಮೇಲೆ ಸಂವೇದಕಗಳು."
43,ಆದರೆ ಅಪ್ರಾಮಾಣಿಕತೆ ಮಂಜು ಶೀಘ್ರದಲ್ಲೇ ರಚನಾತ್ಮಕ ಬದಲಾವಣೆ ಮಾಡುವ ಹೊರಡಲಿದೆ.
44,ಮಂಜು ಪ್ರಜಾವಾಣಿಗೆ ತಿಳಿಸಿದ್ದಾರೆ.
45,"ಕೃಷ್ಣ, ಖಜಾಂಚಿ ಲಕ್ಷ್ಮೇಗೌಡ, ಮಂಜು ಸೇರಿ ದಂತೆ ಇನ್ನಿತರು ಉಪಸ್ಥಿತರಿದ್ದರು."
46,ಪ್ರಚಾರಕ್ಕೆ ಬರುವಂತೆ ಕರೆ ಮಾಡಿದಾಗ ಇಬ್ಬರಿಂದಲೂ ಬೈಗುಳ ಕೇಳಬೇಕಾಯಿತು ಎಂದು ಮಂಜು ನಿರ್ಮಾಪಕರ ಸಂಘಕ್ಕೆ ದೂರು ನೀಡಿದ್ದರು.
47,ಟೌನ್ ಬ್ಯಾಂಕ್ ಉದ್ಯೋಗಿ ಆರೋಪಿ ಮಂಜು ಮತ್ತು ಬಾಲಕಿಯ ತಂದೆ ಸ್ನೇಹಿತ ರಾಗಿದ್ದ ಹಿನ್ನಲೆಯಲ್ಲಿ ಆತ ಬಾಲಕಿಯ ಮನೆಗೆ ಬಂದು ಹೋಗುತ್ತಿದ್ದ ಎನ್ನಲಾಗಿದೆ.
48,"ಅದೇನೆಂದರೆ ಸ್ಯಾಂಡಲ್ ವುಡ್ ನ ಕಿಚ್ಚ ಸುದೀಪ್ ಹಾಗೂ ಮಂಜು ಇಬ್ಬರೂ ಒಂದು ಸಿನಿಮಾ ನಿರ್ಮಾಣ ಮಾಡುತ್ತಿದ್ದು, ಅದರಲ್ಲಿ ಸಲ್ಮಾನ್ ಖಾನ್ ನಟಿಸುತ್ತಿದ್ದು, ನಿರ್ದೇಶಕ ಪ್ರೇಮ್ ಅವರು ನಿರ್ದೇಶನ ಮಾಡಲಿದ್ದಾರೆ ಎಂದು ಹೇಳಲಾಗಿತ್ತು."
49,ಮಂಜು ಲೆಕ್ಕಾಚಾರಗಳು ಏನಿದ್ದವು?
50,ಕರ್ನಾಟಕ ವಿತರಣೆ: ಜಾಕ್​ ಮಂಜು
51,"ಸಾಂಟಾ ಮತ್ತು ಹಿಮಸಾರಂಗ ಮತ್ತು ಮಂಜು ಇತ್ತು ಮೊದಲು,"
52,ಒಂದಕ್ಕಿAತ ಒಂದು ಡಿಫರೆಂಟ್ ಎನ್ನುವುದೇ ಮಂಜು ಸ್ವರಾಜ್ ಸ್ಪೆಷಾಲಿಟಿ.
53,ದೆಹಲಿಯ ಆಗಸದಲ್ಲಿ ದಟ್ಟನೆಯ ಹೊಗೆ ಮತ್ತು ಮಂಜು ತುಂಬಿದ್ದ ಕಾರಣ ನಸುಕಿನವರೆಗೂ ಬೇರೆ ವಿಮಾನಗಳು ಟೇಕಾಫ್ ಆಗಿರಲಿಲ್ಲ.
54,ಮಂಜು ಹಣ ಹಾಗೂ ಅಧಿಕಾರದ ಆಸೆಗಾಗಿ ಯಡಿಯೂರಪ್ಪ ಬಳಿಗೆ ತೆರಳಿದ್ದಾರೆ.
55,ಜಾಕ್ ಮಂಜು ನಿರ್ಮಾಣದ ಚಿತ್ರಕ್ಕೆ ಗುರುದತ್ ಗಾಣಿಗ ಎಂಬ ಹೊಸ ಪ್ರತಿಭೆಯ ನಿರ್ದೇಶನವಿದೆ.
56,"ವೇದಿಕೆಯಲ್ಲಿ ಉಪಾಧ್ಯಕ್ಷೆ ಶೋಭ ಶಿವರಾಜ್, ನಿರ್ದೇಶಕರುಗಳಾದ ಗಾಯಿತ್ರಿ ನಾಗರಾಜ್, ಜಲಜಾ ಶೇಖರ್, ಉಷಾ ತೇಜಸ್ವಿ, ಲೀಲಾ ನಿರ್ವಾಣಿ, ಶೋಭ ಯಶವಂತ್, ಜ್ಯೋತಿ ಶುಭಾಕರ್, ಲತಾ ಮಂಜು ಇದ್ದರು."
57,ಮಂಜು ಅವರು ಮಾಡುತ್ತಲೇ ಇದ್ದಾರೆ.
58,ಮಂಜು ಕೆ.
59,"ಆದರೆ ಹೆಚ್ಚಿನ ಆರ್ದ್ರತೆ, ಮಳೆ ಮತ್ತು ಮಂಜು ನಂತರ ಹುಟ್ಟಿಕೊಂಡವು ಸಾಮಾನ್ಯವಾಗಿ ಕೊನೆಯಲ್ಲಿ ರೋಗ ಮತ್ತು ಇತರ ಅನೇಕ ಕಾಯಿಲೆಗಳನ್ನು ಸಂಭವಿಸುತ್ತವೆ."
60,"ಗಾಳಿಯಿಂದ, ಪರಿಸ್ಥಿತಿ ಸಾಕಷ್ಟು ಸರಳವಾಗಿದೆ: ಕೆಲವು ನೀರಿನ ಪ್ರತಿನಿಧಿಗಳು ಶಾಂತಿಯುತವಾಗಿ ಕೋರ್ಸಿನ, ಹೊರತು, ಮಂಜು ಮತ್ತು ಮೋಡಗಳ ಘೋರ ಸಾಧ್ಯವಿಲ್ಲ, ಅವುಗಳನ್ನು ಏಕಕಾಲದಲ್ಲಿ ಮಾಡಬಹುದು."
61,ನಿರ್ದೇಶಕ ಗುರುದತ್ತ್ ಗಾಣಿಗ ಡೈರೆಕ್ಟ್ ಮಾಡುತ್ತಿರುವ ಮೊದಲ ಚಿತ್ರ ಇದಾಗಿದ್ದು ಕಿಚ್ಚ ಕ್ರಿಯೇಷನ್ಸ್ ಅಡಿಯಲ್ಲಿ ಜಾಕ್ ಮಂಜು ಸಿನಿಮಾ ನಿರ್ಮಾಣ ಮಾಡುತ್ತಿದ್ದಾರೆ.
62,ರಷ್ಯಾದ ಪಡೆಗಳು ಮಂಜು ಸುತ್ತುವರೆಯಿತು.
63,"ಮಂಜು ನಿರ್ಮಾಣ ಮಾಡಿದ್ದು, ದಯಾಳ್ ಪದ್ಮನಾಭನ್ ಆಕ್ಷನ್ ಕಟ್ ಹೇಳಿದ್ದಾರೆ."
64,"ಎಸ್ ವರ್ಮಾ, ಕಿರುತೆರೆ ನಿರ್ದೇಶಕ ಕಲಾಗಂಗೋತ್ರಿ ಮಂಜು ಮತ್ತು ಅಂತರ ರಾಷ್ಟ್ರೀಯ ಖ್ಯಾತಿಯ ಕೃಪಾಕರ್ ಹಾಗೂ ಸೇನಾನಿ ಪಾಲ್ಗೊಂಡಿದ್ದರು."
65,"ಪ್ಲಾಸ್ಟಿಕ್ ಬಳಕೆ ನಿಲ್ಲಿಸಬೇಕು, ಪರಿಸರ ಉಳಿಸಬೇಕು ಎಂಬ ಸಂದೇಶವನ್ನು ಇಟ್ಟುಕೊಂಡು ಗುಣವಂತ ಮಂಜು ಅವರು ಕಟ್ಟಿದ ಕಥೆಗೆ ಭಾರತಿ ಎಂ."
66,ಮಂಜು ದೈವಜ್ಞ ಕಥೆ ಚಿತ್ರಕಥೆ ಬರೆದು ನಿರ್ದೇಶಿಸುತ್ತಿರುವ ನಾರದ ವಿಜಯ ಚಿತ್ರಕ್ಕೆ ಆದಂ ಸಂಗೀತ ನೀಡಿದ್ದಾರೆ.
67,ನವದೆಹಲಿ: ರಾಜಧಾನಿಯಲ್ಲಿ ಮಂಗಳವಾರವೂ ದಟ್ಟ ಮಂಜು ಕವಿದ ಕಾರಣ ಇಂದಿರಾಗಾಂಧಿ ಅಂತರರಾಷ್ಟ್ರೀಯ ವಿಮಾನ ನಿಲ್ದಾಣದಿಂದ ಹೊರಡಬೇಕಿದ್ದ ಆರು ವಿಮಾನಗಳ ಸಂಚಾರ ರದ್ದಾಯಿತು.
68,ರಾತ್ರಿ ಕುಡಿದ ಅಮಲಿನಲ್ಲಿ ಮಂಜು ಚಿನ್ನತಾಯಮ್ಮನನ್ನು ವರದಕ್ಷಿಣೆ ತರುವಂತೆ ಪೀಡಿಸಿ ರೀಪಿಸ್ ಪಟ್ಟಿಯಿಂದ ಹಲ್ಲೆಗೈದಿದ್ದಾನೆ.
69,ಮಂಜು ಎರಡು ಲಕ್ಷ ಎಂಬತ್ತು ಸಾವಿರ ಲೀಡ್‍ನಲ್ಲಿ ಸೋತ ಬಳಿಕ ಮತ್ತೆ ಸಿದ್ದರಾಮಯ್ಯನ ಹತ್ತಿರ ಹೋಗುತ್ತಾರೆ ಎಂದು ಆಡಿಯೋದಲ್ಲಿ ಹೇಳಲಾಗಿದೆ.
70,ವಿಧಿಬದ್ದ ಕಸ್ಟಡಿಯಲ್ಲಿದ್ದ ಆಪಾಧಿತ ಮಂಜು ಭದ್ರಿಕೆಯಲ್ಲಿದ್ದ ಕರ್ತವ್ಯದ ಸಿಬ್ಬಂದಿ ಹೆಚ್‌ಸಿ ರಾಮ ದೇವಾಡಿಗರ ತಳ್ಳಿ ಠಾಣೆಯಿಂದ ಓಡಿ ಹೋಗಿದ್ದಾನೆ.
71,"ನಾರಾಯಣ್, ಮುಖ್ಯಪಾಧ್ಯಾಯಿನಿಗಳಾದ ಉಮಾ, ವೀಣಾ ಕಾವೇರಿಯಮ್ಮ, ಪ್ರಮುಖರಾದ ಮಂಜು ಚಿಣ್ಣಪ್ಪ, ಕೆ."
72,ಗುಣವಂತ ಮಂಜು ಸೇರಿದಂತೆ ಮತ್ತಿತರರು ಉಪಸ್ಥಿತರಿದ್ದರು.
73,ಎಂದು ಪ್ರಶ್ನಿಸಿ ಮಾಲ್ಗುಡಿ ಡೇಸ್ ಕನ್ನಡದಲ್ಲಿ ಬರುವಂತೆ ಮಾಡುವುದು ಶಂಕರಣ್ಣನ ಕತೆ ಕೇಳಿ ಕಣ್ಣು ಮಂಜು ಮಾಡಿಕೊಳ್ಳುವ ನಮ್ಮೆಲ್ಲರ ಮೇಲಿದೆ.
74,ಸದ್ಯಕ್ಕೆ ನಿರ್ದೇಶಕ ಮಂಜು ಮಾಂಡವ್ಯ ಮತ್ತು ಇಡೀ ಚಿತ್ರತಂಡ ಭರ್ಜರಿಯಾಗಿ ಚಿತ್ರದ ಪ್ರಚಾರ ಕಾರ್ಯದಲ್ಲಿ ತೊಡಗಿದೆ.
75,"ಶಿಶಿರ, ಶ್ರೀಕಂಠ, ಶ್ರಾವಣಿ ಸುಬ್ರಹ್ಮಣ್ಯ ಎಂಬ ವಿಶಿಷ್ಟ ಜಾನರ್‍ಗಳ ಚಿತ್ರಗಳಿಗೆ ಆ್ಯಕ್ಷನ್ ಕಟ್ ಹೇಳಿರುವ ಮಂಜು ಸ್ವರಾಜ್ ಅವರೇ ಈ ಚಿತ್ರವನ್ನು ನಿರ್ದೇಶಿಸಿದ್ದು, ಈ ಚಿತ್ರಕ್ಕೆ ತೆಲುಗು ಚಿತ್ರವೊಂದು ಸ್ಫೂರ್ತಿಯಾಗಿದೆಯಂತೆ."
76,"ಮಂಜು ಅವರ ಬಳಿ 15 ಲಕ್ಷ ನಗದು ಇದೆ, ಪತ್ನಿ ಅವರ ಬಳಿ 10 ಲಕ್ಷ ನಗದು ಇದೆ."
77,"ಸುನಂದಾ ಆಗ್ರಹಕ್ಕೆ, ಇದೀಗ ಜಾರಿಗೊಂಡಿರುವ ನೂತನ ಕಾನೂನಿನ ಬಗ್ಗೆ ಪಾಲಿಕೆಯಿಂದ ಮುಡಾಗೆ ನೇಮಕಗೊಂಡಿರುವ ಜೆಡಿಎಸ್‌ ಸದಸ್ಯ ಎಸ್‌ಬಿಎಂ ಮಂಜು ಸ್ಪಷ್ಟನೆ ನೀಡಲು ಮುಂದಾಗುತ್ತಿದ್ದಂತೆ; ಕಾಂಗ್ರೆಸ್ ಸದಸ್ಯ ಆರೀಫ್ ಹುಸೇನ್ ಆಕ್ಷೇಪ ವ್ಯಕ್ತಪಡಿಸಿದರು."
78,"ಆಳ್ವಾಸ್ ನುಡಿಸಿರಿಯ ತಾಲ್ಲೂಕು ಘಟಕದ ಕಾರ್ಯದರ್ಶಿ ಸುಬ್ರಮಣ್ಯ ಶೆಟ್ಟಿ ಸ್ವಾಗತಿಸಿದರು, ಮೇಧಿನಿ ಶೆಟ್ಟಿ ಪ್ರಾರ್ಥಿಸಿದರು, ಕೋಶಾಧಿಕಾರಿ ವಿಶ್ವನಾಥ ಕರಬ ನಿರೂಪಿಸಿದರು, ಮಂಜು ಕಾಳಾವರ ವಂದನೆ ಸಲ್ಲಿಸಿದರು."
79,"ಜಂಬೂ ಸವಾರಿ ದಿಣ್ಣೆ ಬಳಿ ಇರುವ ದೀಪಶ್ರೀ ಮಲ್ಟಿ ಸ್ಪೆಷಾಲಿಟಿ ಆಸ್ಪತ್ರೆ ಆರಂಭೋತ್ಸವ ಕಾರ್ಯಕ್ರಮದಲ್ಲಿ ಸ್ಯಾಂಡಲ್ ವುಡ್ ನ ಲವ್ಲಿ ಸ್ಟಾರ್ ಪ್ರೇಮ್, ನಟಿ ಸಂಜನಾ ಗಲ್ರಾನಿ, ನಿರ್ದೇಶಕ ರಘು ರಾಮ್, ಮಂಜು ಮಾಂಡವ್ಯ, ಐಶ್ವರ್ಯ ಭಟ್, ಗುರುನಂದನ್ ಸೇರಿದಂತೆ ಗಾಂಧಿನಗರದ ಖ್ಯಾತನಾಮರು ಪಾಲ್ಗೊಂಡಿದ್ದರು."
80,ಮಂಜು ಅವರಿಗೆ ಮತ ಹಾಕಬೇಕು ಎಂದರು.
81,"ಮಂಜು ಅವರ ಟೀಕೆಗೆ ಪ್ರತಿಕ್ರಿಯಿಸಲು ನಿರಾಕರಿಸಿದ ಅವರು, ಅವರ ಆರೋಪ, ಟೀಕೆಗಳಿಗೆಲ್ಲಾ ಪ್ರತಿಕ್ರಿಯಿಸಿ ಪೊಳ್ಳಾಗುವುದಿಲ್ಲ."
82,ಇನ್ನು ಮಂಜು ಕುಮಾರಿ 59 ಕೆಜಿ ವಿಭಾಗದಲ್ಲಿ ಮಂಗೋಲಿಯದ ಬ್ಯಾಟ್‌ಸೆಟ್ಸೆಗ್ ವಿರುದ್ಧವೇ 6-15ರಿಂದ ಸೋಲು ಅನುಭವಿಸಿದರು.
83,ಮತ್ತು ಒಂದು ಗಂಟೆ ಅಥವಾ ಮಂಜು ಮುಸುಕಿದ ಶಿಖರಗಳು ಹಿನ್ನಲೆಯಲ್ಲಿ ಕಮರಿಗಳು ಕಾಯುವ ಹೊರಾಂಗಣ ಉತ್ಸಾಹಿಗಳಿಗೆ ಪ್ರಯಾಣವಾಗುತ್ತದೆ.
84,"ಸ್ಥಳಕ್ಕೆ ಡಿವೈಎಸ್ಪಿ ಗಂಗಾಧರ ಸ್ವಾಮಿ, ಪಟ್ಟಣ ಠಾಣಾ ಇನ್ಸಪೆಕ್ಟರ್ ಮಹದೇವಯ್ಯ, ಸಿಬ್ಬಂದಿಗಳಾದ ಮೂರ್ತಿ, ವೀರಭದ್ರಪ್ಪ, ಮಂಜು ಪ್ರಭುಸ್ವಾಮಿ, ಶ್ವಾನದಳ ತಂಡ, ಬೆರಳಚ್ಚು ತಜ್ಞರು ಭೇಟಿ ನೀಡಿ ಪರಿಶೀಲನೆ ನಡೆಸಿದರು."
85,"ಮಂಜು ನಾಥ, ನಾಲ್ವತವಾಡಮಠ ಮತ್ತು ಆಟೊ ಸಂಘಗಳ ಪದಾಧಿಕಾರಿಗಳು, ಸಾರ್ವ ಜನಿಕರು ಸಭೆಯಲ್ಲಿ ಉಪಸ್ಥಿತರಿದ್ದರು."
86,"ಮಂಜು ಮುಸುಕಿದ ದೂರದ ಹಿಮಾಲಯ ಪರ್ವತ ಶ್ರೇಣಿಗಳ ರಮಣೀಯ ದೃಶ್ಯ ಸೌಂದರ್ಯ, ಹಸಿರು ಹೊದ್ದ ನಿಸರ್ಗದ ನಡುವಿನ ಪ್ರಕೃತಿ ಸೌಂದರ್ಯ ಮೇಳೈಸಿರುವ ಸುಂದರ ತಾಣವಿದು."
87,ಮಂಜು ಮಾಂಡವ್ಯ ಡೈಲಾಗ್ ಬರೆಯುವ ಮುನ್ನ ಕೊಂಚ ತಲೆಗೆ ಕೆಲಸ್ಕೊಡಬೇಕಿತ್ತು.
88,"ಮಂಜು ಬಿಜೆಪಿ ಸೇರುವ ಇಂಗಿತ ವ್ಯಕ್ತಪಡಿಸಿದ್ದು, ನಾನು ಹಾಗೂ ಕಡೂರು ಶಾಸಕ ಬೆಳ್ಳಿ ಪ್ರಕಾಶ್ ಸ್ವಾಗತಿಸಿದ್ದೇವೆ ಎಂದರು."
89,ಮಂಜು ಅವರು ಬಿಜೆಪಿ ಸೇರಿದ ಬಳಿಕ ಯೋಗಾ ರಮೇಶ್ ಅವರು ಪಕ್ಷದ ನಾಯಕರ ವಿರುದ್ಧ ಅಸಮಾಧಾನಗೊಂಡಿದ್ದರು.
90,ಮಂಜು ಮಾತುಕತೆ ವೇಳೆಯಲ್ಲಿ 15 ಕೋಟಿ ರೂ.
91,ಕನ್ನಡದಲ್ಲಿ ಬೇಡಿಕೆ ಇರುವ ಕೆಲವೇ ಬಾಲನಟರ ಪೈಕಿ ಮಂಜು ಕೂಡ ಒಬ್ಬ.
92,ಮಂಜು ಚುನಾವಣಾ ನೀತಿ ಸಂಹಿತೆ ಉಲ್ಲಂಘಿಸದಿದ್ದರೂ ದುರುದ್ದೇಶದಿಂದ ಅವರ ವಿರುದ್ಧ ಎಫ್ಐಆರ್‌ ದಾಖಲಿಸಲಾಗಿದೆ ಎಂದು ಕಾಂಗ್ರೆಸ್‌ ಜಿಲ್ಲಾಧ್ಯಕ್ಷ ಜಾವಗಲ್‌ ಮಂಜುನಾಥ್‌ ಆರೋಪಿಸಿದರು.
