Index,Sentence
180,ಸಮಾರಂಭದಲ್ಲಿ ಮಾತನಾಡಿದ ನಿರ್ದೇಶಕಿ ಮಂಜು ಹೆಬ್ಬೂರು ಈ ಹಿಂದೆ ಲೋ ಬಜೆಟ್ ಎಂಬ ಸಿನಿಮಾವನ್ನು ಆರಂಭಿಸಿದ್ದೆ.
181,ಆರ್ ಮಂಜು ಹಾಜರಿದ್ದರು .
182,ಟೆಕ್ಸಾಸ್ ಎ ಮತ್ತು M ವಿಶ್ವವಿದ್ಯಾಲಯದ ಕ್ಯಾಂಪಸ್ ಮೇಲೆ ಮಂಜು ರಲ್ಲಿ ವ್ಯಾನಿಟೀಸ್ ಸ್ಮಾರಕದ ಜಾಲತಾಣಗಳನ್ನು.
183,ಬಿಹಾರ ಮುಖ್ಯಮಂತ್ರಿ ನಿತೀಶ್ ಕುಮಾರ್ ಅವರ ಜೊತೆ ಸಮಾಲೋಚನೆ ನಡೆಸಿದ ನಂತರ ಮಂಜು ವರ್ಮಾ ಅವರು ಸಚಿವ ಸ್ಥಾನಕ್ಕೆ ರಾಜೀನಾಮೆ ನೀಡಿರುವುದು ಹೊಸ ರಾಜಕಾರಣದ ಬೆಳವಣಿಗೆ ಕಾರಣವಾಗಿದೆ.
184,"ಚಂಡೀಗಢದಿಂದ ಬರುತ್ತಿದ್ದ ಎರಡು ಕಾರುಗಳು ಡಿಕ್ಕಿ ಹೊಡೆದಿದ್ದು, ಮಂಜು ಆವರಿಸಿದ ಕಾರಣ ರಸ್ತೆ ಅಸ್ಪಷ್ಟವಾಗಿ ಕಾಣುತ್ತಿತ್ತು."
185,"ಇದನ್ನೂ ಓದಿ: ಯಡಿಯೂರಪ್ಪ ಹೇಳಿದಂತೆ ಅಪ್ಪ-ಮಕ್ಕಳು, ಡಿಕೆಶಿಯವರನ್ನು ಮುಂಬೈ ಬೀದಿಯಲ್ಲಿ ನಿಲ್ಲಿಸಿದರು; ಎ ಮಂಜು ವ್ಯಂಗ್ಯ ಸಿಎಂ ಕುಮಾರಸ್ವಾಮಿ ವಿರುದ್ಧ ಇನ್ನಷ್ಟು ಹರಿಹಾಯ್ದ ಚಲುವರಾಯಸ್ವಾಮಿ, ಮುಖ್ಯಮಂತ್ರಿಗಳು ಮಂಡ್ಯ ಜನರ ವಿರುದ್ಧ ಧ್ವೇಷದ ರಾಜಕಾರಣ ಮಾಡುತ್ತಿದ್ಧಾರೆ ಎಂದು ಆರೋಪಿಸಿದ್ದಾರೆ."
186,ಇಬ್ಬರು ಹುಡುಗಿಯರು ಮತ್ತು ಒಬ್ಬ ಹುಡುಗನ ನಡುವಿನ ಪ್ರೇಮಕಥೆಯನ್ನು ತಮ್ಮ ಸಿನಿಮಾದಲ್ಲಿ ಹೇಳಲು ಹೊರಟಿದ್ದಾರಂತೆ ನಿರ್ದೇಶಕ ಮಂಜು ಅಮ್ಮನಪುರ.
187,"ನಾಗರಾಜ್, ಗಣೇಶ್ ಹುಲ್ಲುಮನೆ, ಮಂಜು ನಾಯ್ಕ, ಉತ್ತರ ಪ್ರಮೋದ್, ವಿನಯ್‌ಕುಮಾರ್, ತೌಫೀಕ್ , ವಿನಾಯಕ, ಇಬ್ರಾಹಿಂ ಖಲೀಲ್ ಇತರರಿದ್ದರು."
188,"ಜಿಲ್ಲಾ ಪ್ರಧಾನ ಕಾರ್ಯದರ್ಶಿಗಳಾದ ಮಹೇಶ ಮೋಹಿತೆ, ರಾಜ್ಯ ಕಾರ್ಯಕಾರಿಣೀ ಸದಸ್ಯ ಯುವ ಮೋರ್ಚಾ ಯುವರಾಜ ಜಾಧವ, ಮಂಡಳ ಪ್ರಧಾನ ಕಾರ್ಯದರ್ಶಿಗಳಾದ ಪ್ರವೀಣ ಪಾಟೀಲ, ರವಿ ಕೊಟಬಾಗಿ, ಹೇಮಂತ ಪಾಟೀಲ, ಯಲ್ಲೇಶ ಕೋಲಕಾರ, ಯುವ ಮೋರ್ಚಾ ಅಧ್ಯಕ್ಷರಾದ ಚೇತನ ಪಾಟೀಲ, ಕಪೀಲ ತ್ಯಾಗಿ, ವೀರಭದ್ರಯ್ಯಾ ಪೂಜೇರ, ಡಾ:ಯಲ್ಲಪ್ಪಾ ಪಾಟೀಲ, ಮಂಜು ಧರೆಣ್ಣವರ, ಮಲ್ಲಪ್ಪಾ ಕಾಂಬಳೆ, ವಸಂತ ಪಾಟೀಲ, ಪವನ ದೇಸಾಯಿ, ಸಂಜಯ ಪಾಟೀಲ ಕುದ್ರೆಮನಿ, ಸಾಗರ ಶೇರೆಕರ, ಭುಜಂಗ ಸಾಲಗುಡೆ, ಪ್ರಭಾಕರ ವಾಘಮಾರೆ, ಪುಂಡಲಿಕ ಮುರಾರಿ, ಅಭಯ ಅವಲಕ್ಕಿ ಸಮಸ್ತ ಮಂಡಲ ಕಾರ್ಯಕರ್ತರು ಪಾಲ್ಗೊಂಡಿದ್ದರು."
189,"ಸಾಧಕರಾದ ಅಂತರರಾಷ್ಟ್ರೀಯ ಕ್ರೀಡಾಪಟು ಜಯಂತಿ ಎಮ್ ದೇವಾಡಿಗ,ಅಂತರರಾಷ್ಟ್ರೀಯ ಕರಾಟೆಯಲ್ಲಿ ಕಂಚಿನ ಪದಕ ಪಡೆದ ವಿಶ್ವನಾಥ ದೇವಾಡಿಗ, ಕೊಲ್ಲೂರು ಶ್ರೀ ಮೂಕಾಂಬಿಕಾ ದೇವಸ್ಥಾನದ ಟ್ರೆಸ್ಟಿಯಾದ ಅಂಬಿಕಾರಾಜು ದೇವಾಡಿಗ ಕುಂದಾಪುರ ಕ್ರಷಿ ಉತ್ಪನ್ನ ಮಾರುಕಟ್ಟೆ ಸದಸ್ಯರಾದ ಮಂಜು ದೇವಾಡಿಗ ಬಿಜೂರು,ರಾಷ್ಟ್ರಮಟ್ಟದ ಯೋಗಪಟು ನಿವೇದಿತಾ ನಾಯ್ಕನಕಟ್ಟೆ 2016-17 ನೇ ಸಾಲಿನ ಎಸ್ ಎಸ್ ಎಲ್ ಸಿ ಹಾಗೂ ಪಿಯುಸಿಯಲ್ಲಿ ಅತೀ ಹೆಚ್ಚು ಅಂಕ ಗಳಿಸಿದ ರಕ್ಷಿತಾ ದೇವಾಡಿಗ,ಜಯಲಕ್ಷ್ಮಿ ದೇವಾಡಿಗ,ಸವಿನಯ ದೇವಾಡಿಗ ದೀಪಾ ದೇವಾಡಿಗ,ಮೊದಲಾದವರನ್ನು ಸನ್ಮಾನಿಸಲಾಯಿತು."
190,ಈ ಕಾರ್ಯಕ್ರಮದಲ್ಲಿ ಕೂದುವಳ್ಳಿ ಮಂಜು ಮತ್ತು ಸಂಗಡಿಗರು ಕ್ರಾಂತಿಗೀತೆಗಳನ್ನು ಹಾಡಿ ರಂಜಿಸಿದರು.
191,"ಭಾರೀ ನೀರಿನ ಮಂಜು ತೇಲುತ್ತದೆ ಅಥವಾ ಮುಳುಗಬಹುದೆಂದು ವಿಜ್ಞಾನಿಗಳು ಊಹಿಸಲು ಸಾಧ್ಯವಾಗುತ್ತಿರುವಾಗ, ಅದು ಏನಾಗಬಹುದು ಎಂಬುದನ್ನು ನೋಡಲು ಪ್ರಾಯೋಗಿಕ ಅಗತ್ಯವಿತ್ತು."
192,"ಸಮುದ್ರ ಮಟ್ಟಕ್ಕಿಂತ 1300 ಮೀಟರ್ ಎತ್ತರದಲ್ಲಿರುವ ಈ ಪಟ್ಟಣದಲ್ಲಿ ಈಗ ಇರುವ ಸ್ವಲ್ಪ ಗಿಡಗಳನ್ನೂ ಮಂಜು ಆವರಿಸಿಕೊಂಡಿದ್ದು, ಬದುಕು ಮತ್ತಷ್ಟು ದುರ್ಬರವಾಗಿದೆ."
193,ಮಾಸ್ಟರ್ ಪೀಸ್‌ ನಿರ್ದೇಶಕ ಮಂಜು ಮಾಂಡವ್ಯ ಮೊದಲ ಬಾರಿಗೆ ಹೀರೋ ಆಗಿ ನಟಿಸಿರೋ ಶ್ರೀಭರತ ಬಾಹುಬಲಿ ಚಿತ್ರಕ್ಕೆ ಪ್ರೇಕ್ಷಕರಿಂದ ಉತ್ತಮ ಪ್ರತಿಕ್ರಿಯೆ ವ್ಯಕ್ತವಾಗಿದೆ.
194,ಮಂಜು ಜೊತೆ ಮಾತನಾಡುತ್ತಾ ನಟಿ ಮಾಲಾಶ್ರೀ ಗರಂ ಆದರು.
195,"ಮಂಜು ಮೂದಲಿಸಿ ಮಾತನಾಡಿ, ಮುಜುಗರಕ್ಕೀಡು ಮಾಡಿದ್ದರು."
196,"ಮಂಜು ನಾಥ್, ಮಾಜಿ ಸದಸ್ಯೆ ಎ."
197,ರಾಜಕೀಯ ಎಂಟ್ರಿಗೆ ಈಡುಗಾಯಿ ಒಡೆದ ಕೆ ಮಂಜು
198,ಅದು ಬಿಸಿಲಿಗೆ ಮಂಜು ಕರಗಿದಂತೆ ಗಾಢವಾದ ವಾತ್ಸಲ್ಯ ಪ್ರೇಮದಿಂದ ಕೂಡಲೆ ಕರಗಿ ನೀರಾಗಿ ಬಿಡುತ್ತದೆ.
199,ಬುಧವಾರ ಬೆಳಗ್ಗೆ 9ಗಂಟೆಯ ಸುಮಾರಿಗೆ ರಸ್ತೆಯಲ್ಲಿ ದಟ್ಟ ಮಂಜು ಆವರಿಸಿತ್ತು.
200,"ಮಹೇಶ, ಮಹದೇವಮ್ಮ, ಜಯಲಕ್ಷ್ಮೀ, ಹೊರಳಹಳ್ಳಿ ನಿಂಗಯ್ಯ, ಕೆಬ್ಬೇಹುಂಡಿ ಮಹೇಶ, ಮಣಿಕಂಠಸ್ವಾು, ರಂಗಸ್ವಾಮಿ, ಹಸುವಟ್ಟಿ ಜವರಯ್ಯ, ಏಳುಮಲೆ ಮಂಜು ಇತರರು ಹಾಜರಿದ್ದರು."
201,ಟೀಸರ್ ನಲ್ಲಿ ಉಗ್ರಂ ಮಂಜು ಹಾಗೂ ಶಿವರಾಜ್ ಕೆ.
202,ಶ್ರೀಯುತ ಮಂಜು ಅವರು ರಾಜ್ಯ ಮಟ್ಟದ ಕಬಡ್ಡಿ ಆಟಗಾರರಾಗಿದ್ದರು.
203,"ಮಲಯಾಳಂ ಕಲಾವಿದರ ಸಂಘದಿಂದ ದಿಲೀಪ್ ಅವರನ್ನು ಉಚ್ಚಾಟಿಸಲಾಗಿದ್ದರೆ, ಅವರ ಮಾಜಿ ಹೆಂಡತಿ ಮಂಜು ವಾರಿಯರ್ ಅವರು, ತಮ್ಮಿಬ್ಬರಿಗೆ ಹುಟ್ಟಿದ ಮಗಳನ್ನು ತಮ್ಮ ಸುಪರ್ದಿಗೆ ಕೊಡಬೇಕೆಂದು ಕೋರ್ಟಿನ ಮೊರೆ ಹೋಗಿದ್ದಾರೆ."
204,ಅದಾದ ಬಳಿಕ ಈಗ ಮಂಜು ಮಾಂಡವ್ಯ ಸದ್ದಿಲ್ಲದೆ ಹೊಸಚಿತ್ರಕ್ಕೆ ಚಾಲನೆ ನೀಡುವ ಸಿದ್ಧತೆಯಲ್ಲಿದ್ದಾರೆ.
205,ತಮಿಳಿನ ಖ್ಯಾತ ಹಾಸ್ಯನಟ ಯೋಗಿ ಬಾಬು ಇವತ್ತು ಮಂಜು ಭಾರ್ಗವಿ ಜೊತೆ ಸಪ್ತಪದಿ ತುಳಿದಿದ್ದಾರೆ.
206,ದೇಶದ ಜನರ ಗಮನ ಸೆಳೆದಿರುವ ಮುಜಾಫರಪುರ್ ಶೆಲ್ಟರ್ ಹೋಮ್ ಸೆಕ್ಸ್ ಹಗರಣ ಸಂಬಂಧ ತಲೆ ಮರೆಸಿಕೊಂಡು ಓಡಾಡುತ್ತಿರುವ ಬಿಹಾರ ಮಾಜಿ ಸಚಿವೆ ಮಂಜು ವರ್ಮಾ ಅವರನ್ನು ಬಂಧಿಸದ ಪೊಲೀಸ್ ಇಲಾಖೆಗೆ ಸುಪ್ರೀಂ ಕೋರ್ಟ್ ಚಳಿ ಬಿಡುವಂತೆ ತರಾಟೆಗೆ ತೆಗೆದುಕೊಂಡಿದೆ.
207,"ಆ ನಂತರ ಅಮೆರಿಕದಲ್ಲಿ ಹೋಲಿ ಸಂಭ್ರಮ, ಹಾಂಕಾಂಗ್ ನಲ್ಲಿ ಆಕಾಶದೆತ್ತರದ ಕಟ್ಟಡಗಳಿಗೆ ಮಂಜು ಮುಸುಕಿದ ಫೋಟೋಗಳು ನಿಮ್ಮೆದುರು ಇವೆ."
208,"ಸೋಲಿಗೆ ಹೆದರಿ ಓಡಿಹೋಗುವ ಜಾಯಮಾನ ನನ್ನದಲ್ಲ, ಇಂದಿನ ಸೋಲನ್ನೇ ಮುಂದಿನ ಚುನಾವಣೆಯಲ್ಲಿ ಗೆಲುವನ್ನಾಗಿಸಿಕೊಳ್ಳಲು ಮತದಾರರ ವಿಶ್ವಾಸಗಳಿಸಲು ಪ್ರಾಮಾಣಿಕ ಪ್ರಯತ್ನ ಮಾಡುತ್ತೇನೆ ಎಂದು ಬಿಜೆಪಿ ಪರಾಜಿತ ಅಭ್ಯರ್ಥಿ ಬೂಕಹಳ್ಳಿ ಮಂಜು ಹೇಳಿದರು."
209,"ಪ್ರತಿಭಟನೆಯಲ್ಲಿ ಬೆಳ್ತೂರು ವೆಂಕಟೇಶ್, ಮಹೇಶ್‍ಕುಮಾರ್, ಚಿಕ್ಕಣ್ಣೇಗೌಡ, ಅಶೋಕ್, ಜಗದೀಶ್, ಸಿದ್ದಯ್ಯ, ಸುಬ್ಬೇಗೌಡ, ದರ್ಶನ್, ಕಿರಣ್, ಮಂಜು ಮುಂತಾದ ವರು ಭಾಗವಹಿಸಿದ್ದರು."
210,"ನೀವು ಕನಸಿನಲ್ಲಿ ಮಂಜು ಹೊರಬರಲು ನಿರ್ವಹಿಸುತ್ತಿದ್ದ ವೇಳೆ, ನಂತರ ನೀವು ವ್ಯಾಂಪೈರ್ ತೊಡೆದುಹಾಕಲು ಒಂದು ರೀತಿಯಲ್ಲಿ ಹೇಗೆ."
211,ಇಲ್ಲಿನ ನೈಸರ್ಗಿತವಾಗಿ ಎದುರಾಗುವ ದಟ್ಟವಾದ ಮಂಜು ಹಾಗೂ ಅನಿರೀಕ್ಷಿತ ಪ್ರವಾಹಗಳು ಹೆಚ್ಚು ಅಪಾಯವನ್ನು ಸೃಷ್ಟಿಮಾಡುತ್ತದೆ.
212,ಅತಿ ಹೆಚ್ಚು ಹಿತಕರವಾದ ವಾತಾವರಣವನ್ನು ಹೊಂದಿದ ಬೆಳಗಾವಿಯಲ್ಲಿ ಬೆಳಗಿನ ಜಾವ ಮಂಜು ಬೀಳುತ್ತಿರುತ್ತದೆ.
213,"ಇದಲ್ಲದೆ, ಸನ್ನಿ ಜಿಟಿಐ-ಆರ್ ಇಂತಹ ಸರೌಂಡ್ ಹಿಂಬದಿಯ ನೋಂದಣಿ ಪ್ಲೇಟ್ ಮತ್ತು ಹಿಂಭಾಗದ ಪಲ್ಸರ್ ಹೆಚ್ಚು ಶಾರೀರಿಕ ವ್ಯತ್ಯಾಸಗಳನ್ನು ಆಗಿತ್ತು ಮಂಜು ದೀಪಗಳು."
214,"ಕ್ರಾವಿಸ್ ಜಲಪಾತದ ತೊರೆಗಳಿಂದ ಹನಿಗಳು ಅಕ್ಷರಶಃ ಗಾಳಿಯಲ್ಲಿ ಸ್ಥಗಿತಗೊಳ್ಳುವುದರಿಂದ, ಮಧ್ಯಾಹ್ನ ಈ ಸ್ಥಳದಲ್ಲಿ ಮಂಜು ಇರುತ್ತದೆ."
215,ಈ ಅವಧಿಯಲ್ಲಿ ಇಲ್ಲಿ ಮಂಜು ಕೂಡ ಆವರಿಸುತ್ತದೆ.
216,ಅಲ್ಲಿನ ಪೊಲೀಸ್ ಠಾಣೆಗೆ ಬಂದು ಮಗು ನಾಪತ್ತೆಯಾಗಿದೆ ಎಂದು ಮಂಜು ಎಂಬಾಕೆ ದೂರು ನೀಡಿದ್ದಾಳೆ.
217,ಮಂಜು ಮುಸುಕಿದ ಮುಂಜಾವಿನಲಿ ಪಟ ಪಟನೇ ಪುಟಿಯುತ್ತಿದ್ದ ಮಂಜಹನಿ.
218,ಒಕ್ಕಲಿಗ ಹಾಗೂ ಒಕ್ಕಲಿಗ ಉಪಜಾತಿ ಮತಗಳನ್ನು ನೆಚ್ಚಿಕೊಂಡಿರುವ ಜೆಡಿಎಸ್ ಗೆ ಆಘಾತ ನೀಡಲು ಸಿದ್ದರಾಮಯ್ಯ ಅವರ ಸಂಪುಟದ ಸಚಿವ ಅರಕಲಗೂಡು ಮಂಜು ಅವರು ಭಾರಿ ಪ್ರಯತ್ನ ನಡೆಸಿದ್ದರು.
219,ಬೆಳಗ್ಗೆ ಮಂಜು ಕವಿದಿದ್ದರಿಂದ ಲಾರಿ ಮರಕ್ಕೆ ಡಿಕ್ಕಿ ಹೊಡೆದಿದೆ ಎಂದು ತಿಳಿದು ಬಂದಿದೆ.
220,ಇಂತಿಪ್ಪ ಮಂಜು ಅವರೇ ಮೀಟ್ ದಿ ಪ್ರೆಸ್ ಅತಿಥಿಯಾಗಿದ್ದು ಯಾಕೆ?
221,ತ್ರಿಶೂರ್‌: ಲೋಕಸಭೆ ಚುನಾವಣೆ ಸಮೀಪಿಸುತ್ತಿರುವಂತೆ ಮಲಯಾಳಂ ಖ್ಯಾತ ನಟಿ ಮಂಜು ವಾರಿಯರ್‌ ಅವರು ಕಾಂಗ್ರೆಸ್‌ ಸೇರ್ಪಡೆಯಾಗುವ ಸಾಧ್ಯತೆಯಿದೆ.
222,"ಹಿನ್ನೆಲೆಯಲ್ಲಿ, ಜಾಕ್ಸನ್ ಪ್ರತಿಮೆ ಮತ್ತು ಸೇಂಟ್ ಲೂಯಿಸ್ ಕ್ಯಾಥೆಡ್ರಲ್ ಆರಂಭಿಕ ಬೆಳಿಗ್ಗೆ ಮಂಜು ಮೂಲಕ ಕೇವಲ ಗೋಚರಿಸುತ್ತವೆ."
223,ಮಂಜು ಗೆಲುವು ಸಾಧಿಸಲಿದ್ದಾರೆ.
224,"ಐವರು ಸ್ಪರ್ಧಾಳುಗಳು ಭಾಗವಹಿಸಿದ್ದ ಈ ಸ್ಪರ್ಧೆಗೆ ಶಿರಸಿಯ ನಿಸರ್ಗ ಆಸ್ಪತ್ರೆಯ ಖ್ಯಾತ ವೈದ್ಯರಾದ ಶ್ರೀ ವೆಂಕಟ್ರಮಣ ಹೆಗಡೆ, ಹಾಗೂ ಶಿರಸಿಯ ತೋಟಗಾರಿಕಾ ಸಂಶೋಧನಾ & ವಿಸ್ತರಣಾ ಕೇಂದ್ರದ ಪ್ರಾಧ್ಯಾಪಕರಾದ ಮಂಜು ಎಮ್."
225,"ಆ ಪೊಲೀಸರಿಂದಾಗಿ ಪ್ರವಾಸ ರದ್ದು ಮಾಡಿಲ್ಲ, ವೈಯಕ್ತಿಕ ಕಾರಣಗಳಿಂದ ರದ್ದು ಮಾಡಿರುವುದಾಗಿ ಮಂಜು ವಕ್ತಾರರು ತಿಳಿಸಿರುವುದಾಗಿಯೂ ವರದಿಯಾಗಿದೆ."
226,ಜೈವಿಕ ಜೀವನ ಜನಗಳಿಗೆ ಸ್ಪರ್ಧಿಗಳಲ್ಲಿ ದೀರ್ಘಕಾಲದವರೆಗೆ ಪಟ್ಟಿ ಶುಕ್ರ ಗ್ರಹದ ವಿಂಗ್ಸ್ನ ಮುಚ್ಚಿಡಲಾಗಿತ್ತು ಯಾವುದೇ ಕಡಿಮೆ ಮಂಜು ಹೆಚ್ಚು ಸೌರ ವ್ಯವಸ್ಥೆಯ.
227,ಈಶ್ವರಪ್ಪ ಕೇಳಿದ ಪ್ರಶ್ನೆಗೆ ವಸತಿ ಸಚಿವರ ಪರವಾಗಿ ಮಂಜು ಉತ್ತರಿಸಿದರು.
228,ಮಂಜು ಮಾಂಡವ್ಯ ಕೂಡ ನಿರ್ದೇಶಕ
229,ವಿಧಾನಸಭಾ ಚುನಾವಣೆಗೂ ಮೊದಲಿನಿಂದಲೂ ದೊಡ್ಡಗೌಡರು ಮತ್ತು ಮಂಜು ನಡುವೆ ಶೀತಲ ಸಮರ ಇದೆ ಎನ್ನುವ ಮಾತು ಈಗಲೂ ಹಾಸನ ಜನರ ಬಾಯಲ್ಲಿದೆ.
230,8- ನಗರದಲ್ಲಿ ಬೆಳ್ಳಂಬೆಳಗ್ಗೆ ಮಂಜು ಮುಸುಕಿದ ವಾತಾವರಣ ನಿರ್ಮಾಣವಾಗಿ ಪರಿಸರ ಪ್ರೇಮಿಗಳಿಗೆ ಸಂಭ್ರಮ ತಂದರೆ ವಾಹನ ಸವಾರರಿಗೆ ತೀವ್ರ ತೊಂದರೆಯಾಯಿತು.
231,"ಮೊದಲಿಗೆ, ವಿನ್ಯಾಸದ ಕುರಿತು ಮಾತನಾಡೋಣ - ಇದು ನಿಮ್ಮ ತಲೆಗೆ ಮತ್ತು ಮುಖದ ಮೇಲೆ ಸರಿಯಾದ ಗಾಳಿ ನೀಡುವಂತೆ ಮೃದುವಾದ, ಜಾಲರಿಯಂತಹ, ಗಾಳಿಯಾಡಬಲ್ಲ ಬಟ್ಟೆಯಿಂದ ನಿರ್ಮಿಸಲಾಗಿದೆ ಮತ್ತು ನೀವು ಇದನ್ನು ಮೂರು ವಿಭಿನ್ನ ಬಣ್ಣಗಳಲ್ಲಿ (ಇದ್ದಿಲು, ಮಂಜು ಅಥವಾ ಹವಳದ) ಖರೀದಿಸಬಹುದು."
232,"ದೇವರ ಮುಟ್ಟಲು ಅವಕಾಶ ಕೊಡುವುದಿಲ್ಲ ಎಂದು ಗ್ರಾಮದ ಪಾಪಣ್ಣ, ಧರ್ಮ, ಹಾಗೂ ಮಂಜು ಎಂಬವರು ದಬ್ಬಾಳಿಕೆಯಲ್ಲಿ ನಮ್ಮ ಮೇಲೆ ಏಕಾಏಕಿ ದೌರ್ಜನ್ಯ ಎಸಗಿದ್ದಾರೆ."
233,"ಚಿತ್ರದ ಸಂಭಾಷಣೆ ಮಾಸ್ತಿ ಮಂಜು ಬರೆಯುತ್ತಿದ್ದು, ಚರಣ್ ರಾಜ್ ಸಂಗೀತ ಸಂಯೋಜಿಸುತ್ತಿದ್ದಾರೆ."
234,"ಗಿರೀಶ್, ಮಂಜು ಎಸ್ ಉಪಸ್ಥಿತರಿದ್ದರು."
235,"ಹೊನವಾಡ, ಚನ್ನಮಲ್ಲಮ್ಮ ಹಲಕಾವಟಗಿ, ಮಂಜು ಕೊಡಗಾನೂರ, ಸಂಗಣ್ಣ ಕಡಪಟ್ಟಿ, ತಿಮ್ಮಣ್ಣ ದಾದ್ಮಿ, ಮಹಾಂತೇಶ ರೇವಡಿ, ಮಹಾಂತೇಶ ಚಿತ್ತವಾಡಗಿ, ಮಲ್ಲು ಚೂರಿ, ಸಾಂತಪ್ಪ ಹೊಸಮನಿ, ಮಹೇಶ ಬೆಳ್ಳಿಹಾಳ ಇತರರಿದ್ದರು."
236,ಮಂಜು ಅವರಿಗೆ 1 ಕೋಟಿವರೆಗೆ ಡಬ್ಬಿಂಗ್ ಹಕ್ಕುಗಳ ಮೊತ್ತ ಕೇಳಿ ಬಂದಿತ್ತು.
237,ಮಂಜು ವಾಗ್ದಾಳಿ
238,ಇಲ್ಲೆಲ್ಲಾ ಈಗ ಮಂಜು ಕವಿದಿದೆ.
239,ಅನ್ನಿಯನ್ ವಿಕ್ರಮ್ ಕನ್ನಡಕ್ಕೆ ಕರೆತಂದ ಕೊಬ್ರಿ ಮಂಜು
240,"ಸುದ್ದಿಗೋಷ್ಠಿಯಲ್ಲಿ ಸಂಯೋಜಕ ಶ್ರೀಕಾಂತ್, ಮಂಜು ಉಪಸ್ಥಿತರಿದ್ದರು."
241,"ಬಿಳಿಯ ಮಂಜು ಹೊಂದಿಕೊಂಡಿರುವ ಬೆಟ್ಟಗಳು, ಚುಮು ಚುಮು ಚಳಿಯ ಅನುಭೂತಿ ಪಡೆಯಬೇಕೆಂಬ ನಿಮ್ಮ ಆಸೆ ಪೂರೈಸಲು ಈಗ ಭಾರತೀಯ ರೈಲ್ವೆ ಇಲಾಖೆ ಮುಂದಾಗಿದೆ."
242,ಪ್ರವಾಸಿಗರಾಗಿ ಮಂಜು ಬೀಳುವ ಪ್ರದೇಶಕ್ಕೆ ಭೇಟಿ ನೀಡಲು ಡಿಸೆಂಬರ್ ಅತ್ಯುತ್ತಮ ಸಮಯವಾಗಿದೆ.
243,ಇದ್ದಕ್ಕಿದ್ದಂತೆ ಮಂಜು ಸುರಿಯುತ್ತಿರುವುದನ್ನು ನೋಡಿ ಎಲ್ಲರಿಗೂ ಗಾಬರಿ.
244,ಅವರು ಅಭಿನಯಿಸುತ್ತಿರುವ ಕನ್ನಡದ ಎರಡನೇ ಚಿತ್ರ ಮಳೆ ಬರಲಿ ಮಂಜು ಇರಲಿ.
245,ಜಾಲಿ ಬಾಸ್ಟಿನ್ ಹಾಗೂ ಥ್ರಿಲ್ಲರ್ ಮಂಜು ಸಂಯೋಜಿಸಿರುವ ಸಾಹಸ ದೃಶ್ಯಗಳನ್ನು ನಿರ್ವಹಿಸಲೆಂದೇ ಪ್ರೇಮ್ ಏಳು ತಿಂಗಳು ವಿಶೇಷ ರೀತಿಯಲ್ಲಿ ಸಿದ್ಧತೆ ನಡೆಸಿದರಂತೆ.
246,"ಉತ್ತರ ಕನ್ನಡ ಜಿಲ್ಲೆ ಸಿದ್ದಾಪುರ ತಾಲೂಕಿನ ಹಸ್ವಂತೆ ಗ್ರಾಮದ ಯುವರಾಜ (25), ಮಂಜು (28) ಮೃತಪಟ್ಟವರು."
247,ಮಂಜು ನಿರ್ಮಾಣದ ಈ ಚಿತ್ರದಲ್ಲಿ ಕೃತಿ ಕರಬಂಧ ನಾಯಕಿ.
248,"ಹೊರಗೇ ನಿಂತ ಮಲುಹಣ ಮೈ ಕೊರೆವ ಚಳಿಗೆ ನಡು ನಡುಗಿ ಕುಸಿದು ಬಿದ್ದ; ಮೇಲೆ ಧಾರಾಕಾರವಾಗಿ ಮಂಜು ಬಿದ್ದು ಮೂರ್ಛೆ ಹೋದ, ಮಂಜಿನಲ್ಲಿ ಮುಚ್ಚಿಯೂ ಹೋದ."
249,ಮೈಲಾರ ಪಟ್ಟಣ ಶಾಲೆ ಶಿಕ್ಷಕ ಮಂಜು ನಾಥ್ ಆಶಯ ನುಡಿಗಳನ್ನಾಡಿದರು.
250,"ಶಮ್ನಾಡ್ ಸಹೋದರ ದೂರು ನೀಡಿದ ಬಳಿಕ ಶಮ್ನಾಡ್​ಗಾಗಿ ತುಂಬಾ ಹುಡುಕಾಡಿದ್ವಿ, ಆದ್ರೆ ಎಲ್ಲೆಲ್ಲೂ ಮಂಜು ಕವಿದಿದ್ದರಿಂದ ಹುಡುಕಾಟಕ್ಕೆ ತೊಂದರೆ ಆಯ್ತು ಅಂದಿದ್ದಾರೆ."
251,ಈ ಚಿತ್ರಕ್ಕೆ ಜಾಕ್ ಮಂಜು ನಿರ್ಮಾಪಕ.
252,"ಅಂತಿಮವಾಗಿ ಮಂಜು ಅವರು ಜೆಡಿಎಸ್ ಸೇರ್ಪಡೆಯಾಗಲಿದ್ದು, ಶೀಘ್ರ ದಿನಾಂಕ ನಿರ್ಧಾರವಾಗುವ ಸಂಭವವಿದೆ ಎಂದು ಮೂಲಗಳು ತಿಳಿಸಿವೆ."
253,"ಮಂಜು ರಲ್ಲಿ, ಮಸ್ಸಾಸೊಯಿತ್ ರಾಜ್ಯ ಪಾರ್ಕ್ ಲಿಟಲ್ Bearhole ಪಾಂಡ್ ಬಣ್ಣಗಳನ್ನು ಪತನ."
254,ಸಿದ್ದೇಶ್ ಸಕಾಲದಲ್ಲಿ ಗಾಯಗೊಂಡ ಕಾರ್ಮಿಕ ಮಂಜು ಅವರನ್ನು ಆಸ್ಪತ್ರೆಗೆ ಸಾಗಿಸಲು ನೆರವಾಗಿ ಮಾನವೀಯತೆ ಮೆರೆದಿದ್ದಾರೆ.
255,"ಮಂಜು ಸುರಿಸುವ ಮೋಡಗಳನ್ನು ತಡೆದು ನಿಲ್ಲಿಸಿಕೊಂಡು ತಂಪೆರೆಯುವ ಹಸಿರು ಬೆಟ್ಟಗಳ ನಡುವೆ ಹರಡಿಕೊಂಡಿರುವ ಊಟಿಯ ಸುಂದರ ಪರಿಸರದಲ್ಲಿ, ಅಲ್ಲಿಗೆ ಸಮೀಪದ ಗೂಡಲೂರು ಮತ್ತು ಕೇರಳದ ಸುಲ್ತಾನ್ ಬತ್ತೇರಿಯ ಎಸ್ಟೇಟ್‌ಗಳಲ್ಲಿ, ಹಾಗೂ ಮೈಸೂರಿನ ವಿವಿಧ ಸ್ಥಳಗಳಲ್ಲಿ ಈ ಚಿತ್ರದ ಚಿತ್ರೀಕರಣ ಮಾಡಲಾಗಿದೆ."
256,ನಿರಂತರ ಮಂಜು ಸುರಿಯುತ್ತಿ ರುವ ಕಾರಣ ಈಗಾಗಲೇ ಇಲಾಖೆ 53 ರೈಲುಗಳನ್ನು ರದ್ದುಪಡಿಸಿದೆ.
257,"ಥ್ರಿಲ್ಲರ್ ಮಂಜು ಜೊತೆ ಉಳಿದ ಐವರು ನಿರ್ದೇಶಕರಾದ ಸಾಧು ಕೋಕಿಲಾ, ಜೆ."
258,ಈ ಮಂಜು ಮುಸುಕಿದ ವಾತಾವರಣದಿಂದ ವಾಹನ ಚಾಲಕರು ಮುಂಜಾವಿನಲ್ಲಿಯೂ ದೀಪ ಬೆಳಗಿಸಿ ಸಂಚರಿಸಬೇಕಾದ ಪರಿಸ್ಥಿತಿ ಬಂದೊದಗಿದೆ.
259,"ಮಂಜು ಅವರೆ, ನಮ್ಮ ತಂದೆಯವರಿಗೂ ನಿಮ್ಮ ಹಾಗೇ ಅನ್ನಿಸಿತ್ತು."
260,ಮಂಜು ಎರಡು ಬಾರಿ ಭೇಟಿಯಾಗಿ ಮಾತುಕತೆ ನಡೆಸಿದ್ದರು.
261,ಮಂಜು ಮಂಜಾದ ಕನಸು – ಹಡಗುಗಳನ್ನೇರಿ ದೂರ ದೂರ ದೇಶಗಳನ್ನೆಲ್ಲ ಸುತ್ತಾಡಿ ಬರುತ್ತಿದ್ದೆ.
262,ನಿರ್ದೇಶಕ ಮಂಜು ಸ್ವರಾಜ್ ಈಗ ಹೊಸ ಸಿನಿಮಾವನ್ನು ನಿರ್ದೇಶನ ಮಾಡುತ್ತಿದ್ದಾರೆ.
263,ಮಂಜು ಮಧ್ಯವರ್ತಿಯಾಗಿ ಕೆಲಸ ಮಾಡಿದ್ದರು ಎಂಬ ಆರೋಪವಿದೆ.
264,"ಪಂಪ್ ಆಕ್ಷನ್ ಸಾಧನಗಳು ಕಡಿಮೆ ಒತ್ತಡದಲ್ಲಿ ಕಾರ್ಯ ಭಿನ್ನವಾಗಿ, ಶೀತ ಮಂಜು ಉತ್ಪಾದಕಗಳು ಗಮನಾರ್ಹವಾಗಿ ಸಮಯ ಸಂಸ್ಕರಣಾ ಮತ್ತು ಹಲವಾರು ನಿಮಿಷಗಳ ಒಂದು ದೊಡ್ಡ ಪ್ರದೇಶದಲ್ಲಿ ಆವರಣದಿಂದ ಸೋಂಕು ನಿವಾರಿಸಲು ಅಗತ್ಯವಿದೆ ಕಡಿಮೆ ಮಾಡಬಹುದು."
265,"ನಂತರ ದಂಡಾಧಿಕಾರಿಗಳಾದ ರಾಜು ರವರು ಮಾತನಾಡಿ ಸರ್ಕಾರಿ ಕೆಲಸ ದೇವರ ಕೆಲಸ ಎಂದು ನಾನು ಭಾವಿಸುತ್ತೇನೆ ಸಾರ್ವಜನಿಕರು ಯಾರೇ ಬರಲಿ ನಮ್ಮ ಕಚೇರಿಗಳ ಹತ್ತಿರ ನಾವು ಅವರ ಸೇವೆ ಮಾಡುತ್ತಿದ್ದೇವೆ ಎಂದರು, ಈ ಸಂದರ್ಭದಲ್ಲಿ, ಜಮಿಯತ್ ಉಲ್ಮಾ ಹಿಂದ್ ರ ರಾಜ್ಯಾಧ್ಯಕ್ಷ ರಾದ ಇಫ್ತೆಖಾರ್ ಅಹ್ಮದ್, ಮಾಜಿ ತಾ ಪಂ ಸದಸ್ಯರಾದ ಕೆ ಕೆ ಮಂಜು , ಕೋಲಾರ ಜಿಲ್ಲಾ ವಕ್ಫ್ ಅಧ್ಯಾಕ್ಷರಾದ ಹಿದಾಯತ್ , ಸಲಾಮ್ ಮುಷೀರ್ , ಮಹಮ್ಮದ್ ಅಲಿ ಮತ್ತು ಫಲಾಹೇ ಉಮ್ಮತ್ ಕಮೇಟಿಯಾ, ಕಾರ್ಯದರ್ಶಿ ಅಯಾಜ್ ಪಾಷ , ಪುರಸಭಾ ಉಪಾಧ್ಯಕ್ಷರಾದ ಟ ಮಹಮ್ಮದ್ ಮುಖ್ತಾರ್ ಅಹಮ್ಮದ್, ಪುರಸಭೆಯ ಸದಸ್ಯರಾದ ಇಮ್ರಾನ್, ಮುಜೀರ್ ಬರೀದ್, ಅಜ್ಗರ್ ಪಾಷ , ನಜೀರ್ ಅಹ್ಮದ್ ಖಾನ್ , M."
266,ಮಂಜು ಕಾರಣ ಎಂದು ನೇರವಾಗಿ ಆರೋಪಿಸಿದ್ದಾರೆ.
