Index,Sentence
469,"ಕೆ ಮಂಜು ನಿರ್ಮಾಣದ ಗಾಡ್ ಫಾದರ್, ರಜನಿಕಾಂತ, ಶಂಕರೇಗೌಡ ನಿರ್ಮಾಣದ ವರದನಾಯಕ, ದ್ವಾರಕೀಶ್ ನಿರ್ಮಾಣದ ಚಾರುಲತಾ ಬಿಡುಗಡೆಯಾಗಬೇಕಿವೆ."
470,ಇನ್ನೂ ಕುದಿಯುವ ನೀರಿನಿಂದ ತ್ವರಿತ ಮಂಜು ಮಾಡಲು ಇದು ತುಂಬಾ ಸುಲಭ.
471,ಮಂಜು ಹಾಗೂ ಕಾಂಗ್ರೆಸ್‌ -ಜೆಡಿಎಸ್‌ ಮೈತ್ರಿ ಅಭ್ಯರ್ಥಿಯಾಗಿ ಪ್ರಜ್ವಲ್‌ ರೇವಣ್ಣ ಅವರು ಸ್ಪರ್ಧಿಸಿದ್ದಾರೆ.
472,"ಮಂಜು ಅವರು, ಇಂಡಿಯನ್ ವರ್ಚುವಲ್ ಅಕಾಡೆಮಿಯ ಪ್ರಶಸ್ತಿಗೆ ಭಾಜನರಾಗಿದ್ದಾರೆ."
473,– ಗಂಜಾಂ ಮಂಜು
474,"ಮಂಜು ವಿಷ್ಣುವರ್ಧನ ಅವರ ಚೊಚ್ಚಲ ನಿರ್ದೇಶನದ ಈ ಚಿತ್ರದಲ್ಲಿ, ವಿಜಯ್ ವೆಂಕಟ್ ನಾಯಕರಾಗಿ ಪದಾರ್ಪಣೆ ಮಾಡಿದ್ದಾರೆ."
475,ಮಂಜು ಅವರನ್ನ ಸಂಪರ್ಕ ಮಾಡಿ ಸತ್ಯ ಬಿಚ್ಚಿಟ್ಟಿದ್ದಾರೆ.
476,ಮಾಜಿ ಸಮಾಜ ಕಲ್ಯಾಣ ಸಚಿವ- ಸದ್ಯಕ್ಕೆ ಶಸ್ತ್ರಾಸ್ತ್ರ ಕಾಯ್ದೆಯಡಿ ಬೇಕಾಗಿರುವ ಮಂಜು ವರ್ಮಾ ಬಂಧನಕ್ಕಾಗಿ ಈ ಕ್ಯಾಮೆರಾ ಅಳವಡಿಸಿದ್ದೀರಾ ಎಂದು ಪ್ರಶ್ನೆ ಮಾಡಿದ್ದಾರೆ.
477,"ಪಂದ್ಯಾವಳಿಯಲ್ಲಿಕಲ್ಕುಣಿಕೆಯ ಜೈ ಮಾರುತಿ ನಾಯಕರ ಗರಡಿಯ ರವಿ, ನವೀನ್‌, ಅಭಿ ಮತ್ತು ಮಾದು, ಕನಕದಾಸರ ಗರಡಿಯ ರಾಜೇಶ್‌, ಹಳೇರಾಮೇನಹಳ್ಳಿಯ ಹರೀಶ್‌, ಆರತಿ ಉಕ್ಕಡದ ಶ್ರೀಕಂಠ, ಮೈಸೂರಿನ ಪ್ರಶಾಂತನಾಯಕ, ಗಂಜಾಂನ ತೇಜಸ್‌ ಮತ್ತು ಮಂಜು (ಕೆಂಚ), ದಸ್ತರ ಕುಪ್ಪೆಯ ವಿಜೇಂದ್ರ ಪಾಲ್ಗೊಂಡಿದ್ದರು."
478,ಅಮೋಘ ತನ್ನ ತಂಗಿಯೊಂದಿಗೆ ಗೊರಳ್ಳಿಯಿಂದ ರಾತ್ರಿ ಬೆಟ್ಟದಪುರದ ಕಡೆಗೆ ದ್ವಿಚಕ್ರ ವಾಹನದಲ್ಲಿ ತೆರಳುತ್ತಿದ್ದಾಗ ಪಿರಿಯಾಪಟ್ಟಣದ ರಸ್ತೆಯಲ್ಲಿನ ಮಂಜು ಎ ಬ್ರಿಡ್ಜ್ ಬಳಿ ನಿಂತಿದ್ದ ಲಾರಿಗೆ ಡಿಕ್ಕಿ ಹೊಡೆದು ಸಂಭವಿಸಿದ ಅಪಘಾತದಲ್ಲಿ ತೀವ್ರವಾಗಿ ಗಾಯಗೊಂಡಿದ್ದರು.
479,ಮಂಜು ಸೋಲಿಸಲು ಪ್ರೀತಂ ಗೌಡ ಸ್ಕೆಚ್ ಹಾಕಿದ್ದಾರೆ ಎಂದು ಹೇಳಲಾದ ವೈರಲ್ ಆಡಿಯೋ ಬಗ್ಗೆ ಸ್ವತಃ ಶಾಸಕರೇ ಇದೀಗ ಪ್ರತಿಕ್ರಿಯಿಸಿದ್ದಾರೆ.
480,ಮಂಜು ಕಳ್ಳ ಎತ್ತು ಎಂದು ಕಾಂಗ್ರೆಸ್ ಮುಖಂಡ ಸಿದ್ದರಾಮಯ್ಯ ಕುಟುಕಿದರು.
481,"ಇದೀಗ ಎ ಮಂಜು ಕೂಡ ಬಿಜೆಪಿಗೆ ಸೇರಲು ಮುಂದಾಗಿದ್ದಾರೆ, ಮಾಜಿ ಮುಖ್ಯಮಂತ್ರಿ ಸಿದ್ದರಾಮಯ್ಯ ಅವರ ಮನವೊಲಿಸಲು ಯತ್ನಿಸಿದ್ದಾಗ ನಾನು ಬಿಜೆಪಿ ಸೇರಿಯೇ ಸೇರುತ್ತೇನೆ , ಸೋಮವಾರ ಬಿಜೆಪಿಗೆ ಸೇರ್ಪಡೆಯಾಗುವೆ ಯಾರ ಮಾತನ್ನೂ ನಾನು ಕೇಳುವುದಿಲ್ಲ ಎಂದಿದ್ದಾರೆ."
482,ಮಹಾಮಸ್ತಕಾಭಿಷೇಕದ ಕಾಮಗಾರಿ ನಿಗಧಿತ ಅವಧಿಯೊಳಗೆ ಮುಗಿಯಲಿದೆ: ಮಂಜು
483,"ಮಂಜು ಅವರು, ದೇವೇಗೌಡರಿಂದ ಮಾತ್ರ ಹಾಸನದಲ್ಲಿ ಗೆಲ್ಲೋಕೆ ಸಾಧ್ಯ, ಪ್ರಜ್ವಲ್‍ಗೆ ಸಾಧ್ಯವಿಲ್ಲ ಎಂದು ಹೇಳಿದ್ದರು."
484,ಮಂಜು ಅವರ ಕಾರಿನಲ್ಲಿ ಹೊರಟೆವು.
485,ಅಂತಹ ಒಂದು ಮಂಜು ತುಂಬಿದ ಮುಂಜಾನೆ ನಾನು ಈಜುಕೊಳದಲ್ಲಿ ಅಭ್ಯಾಸ ಮಾಡುತ್ತಿದ್ದೆ.
486,ಅವರ ಸಾಲಿಗೆ ಈಗ ಸಾಹಸ ನಿರ್ದೇಶಕ ಥ್ರಿಲ್ಲರ್ ಮಂಜು ಸಹ ಸೇರಿದ್ದಾರೆ.
487,ಪ್ರೇಮ ವಿವಾಹವಾಗಿದ್ದ ಖ್ಯಾತ ನಟಿ ಮಂಜು ವಾರಿಯರ್ ಮತ್ತು ನಟ ದಿಲೀಪ್ 17 ವರ್ಷಗಳ ನಂತರ ಪರಸ್ಪರ ಒಪ್ಪಿಗೆಯಿಂದ ದಾಂಪತ್ಯ ಜೀವನವನ್ನು ಡೈವೋರ್ಸ್ ಮೂಲಕ ಅಂತ್ಯಗೊಳಿಸಿದ್ದರು.
488,ಈಗಿರುವ ಹೆಸರು ಬಂದಿದ್ದು ಲಿಬೆಳ್ಳಿಗ್ಚೆಆವಿಳಿ ಎಂದರೆ ಇಲ್ಲಿನ ವಾತಾವರಣದಲ್ಲಿ ಬೆಳಗಿನ ಜಾವ ಮಂಜು ಬೀಳುತ್ತಿತ್ತು ಅದರಿಂದಾಗಿ ಶಿಬೆಳಗಾವಿಷಿ ಎಂದು ಹೆಸರು ಬಂದಿದೆ.
489,ಮಂಜು ರಕ್ಷಿತ್
490,ಮಂಜು ಅವರ ಮನೆಯ ಬಳಿ ಜನ ಜಾತ್ರೆಯೇ ನೆರೆದಿದೆ.
491,ನಿಖಿಲ್ ಮಂಜು ಅವರನ್ನಂತೂ ರಾಘಣ್ಣ ದೇವರಿಗೆ ಹೋಲಿಸುತ್ತಾರೆ.
492,"ಸಾಂಸ್ಕೃತಿಕ ಮತ್ತು ಕಾಂಟಿನೆಂಟಲ್ ಗಡಿಗಳನ್ನು ಮೀರಿ ಸರಳ ಪರಿಕಲ್ಪನೆಗಳನ್ನು ಮೀರಿ, ಕೆಂಪು ಆಕ್ಟೋಗಾನ್ಗಳಂತೆಯೇ ನಿಲ್ಲಿಸಿ, ಪ್ರತಿ ಡ್ರೈವರ್ ಹೆಚ್ಚಿನ ಕಿರಣಗಳಂತಹ ವಸ್ತುಗಳನ್ನು ಮತ್ತು ಇಂಜಿನ್ ದೀಪಗಳನ್ನು ಪರೀಕ್ಷಿಸಲು ಶೈಲೀಕೃತ ಚಿತ್ರಸಂಕೇತಗಳನ್ನು ಗುರುತಿಸಬೇಕಾಗಿದೆ, ಮತ್ತು ನಿಮಗೆ ತಿಳಿದಿಲ್ಲವಾದ್ದರಿಂದ ಮಂಜು ಅಥವಾ ಮಂಜು ಕಾರಣದಿಂದಾಗಿ ಗಾಳಿಯ ಗಾಳಿ, ನೀವು ಸ್ಕ್ವಿಗ್ಲಿ ಲೈನ್ಗಳ ಸರಣಿ ಮತ್ತು ಕಿತ್ತಳೆ ಅಥವಾ ಆಯಾತವನ್ನು ಎದ್ದು ಕಾಣುವ ಸ್ವಲ್ಪ ಬಟನ್ಗೆ ತಲುಪುತ್ತೀರಿ."
493,ಮಂಜು ಪ್ರದೇಶಗಳ ಗಡಿ ಗುರುತಿಸುವ ಈ ವರ್ಗದಲ್ಲಿನ ವಿಶೇಷವಾಗಿ ಪ್ರಾಯೋಗಿಕ ಸಾಧನಗಳನ್ನು.
494,ಮಂಜು ಕಪೂರ್ ಅವರ ಎ ಮ್ಯಾರೀಡ್ ವುಮನ್ ಕಾದಂಬರಿಗೂ ಬಾಬ್ರಿ ಮಸೀದಿ ಧ್ವಂಸ ಘಟನೆಗೂ ಇದೆಯಾ ನಂಟು?
495,ಪ್ರಜಾಕೀಯ ಹಾಗೂ ಮಂಜು ಪವರ್ ಸ್ಟಾರ್ ಎನ್ನುವ ಎರಡು ಫೇಸ್‌ಬುಕ್‌ ಖಾತೆಗಳ ವಿರುದ್ಧ ದೂರು ನೀಡಲಾಗಿದೆ.
496,ಮಂಜು ಪಕ್ಷ ಬಿಡುವುದಿಲ್ಲ.
497,"ಮಂಜು ಮುಂಚೋಣಿಯಲ್ಲಿದ್ದು, ಬಾಲಕೃಷ್ಣ ಅವರಿಗೆ ರಾಜಕೀಯ ಹಾದಿ ಸುಗಮವಾಗಿರುತ್ತೆ ಎನ್ನಲಾಗದು."
498,"ಉತ್ತರ ಪ್ರದೇಶದ ರಾಜಧಾನಿ ಲಖನೌನಲ್ಲಿ ದಟ್ಟ ಮಂಜು ಕವಿದಿದ್ದು, 84 ರೈಲುಗಳ ಸಂಚಾರಕ್ಕೆ ಅಡಚಣೆಯಾಗಿದೆ."
499,"ಮಂಜು ಗೆದ್ದು ಶಾಸಕರಾದರೆ, ಕಾಂಗ್ರೆಸ್‌ನ ಎ."
500,ಸುರೇಶ್ ಸೋದರರಿಗೆ ಮಾತ್ರ ಎಂದು ಬಿಜೆಪಿ ಪರಾಜಿತ ಅಭ್ಯರ್ಥಿ ಎ ಮಂಜು ಕಿಡಿಕಾರಿದರು.
501,ಮಂಜು ಬಿಜೆಪಿಯಿಂದ ಸ್ಪರ್ಧೆ ಮಾಡುತ್ತಾರೆ ಅಂತಾದ ಮೇಲೆ ಸ್ಪರ್ಧೆ ಜಿದ್ದಾಜಿದ್ದಿನ ಹೋರಾಟ ಕಾಣುವುದು ನಿಶ್ಚಿತ ಎಂದಾಗಿದೆ.
502,ಮಂಜು ಸಿನಿಮಾವನ್ನು ನಿರ್ಮಿಸುತ್ತಿದ್ದಾರೆ.
503,"ಪ್ರತಿಭಟನೆಯಲ್ಲಿ ಕಾಮಣ್ಣ ಮಿರ್ಜಿ, ಅಂಬಣ್ಣಾ ಕೆಂಗನಾಳ, ಇಮಾಮಸಾಬ ಬಾಗವಾನ, ಬಸಣ್ಣಾ ಜಾಡರ, ಹುಸೇನ್ ಅತ್ತಾರ, ಸಿದ್ದ್ಧರಾಮ ಬಡಿಗೇರ, ಧರೆಪ್ಪ ಮದರಿ, ಮಳಸಿದ್ದಪ್ಪ ನಾವಿ, ಮಂಜು ಮದರಿ, ಶರಣು ಇಂಡಿ ಸೇರಿದಂತೆ ನೂರಾರು ಮಹಿಳೆಯರು ಭಾಗವಹಿಸಿದ್ದರು."
504,ಮಂಜು ಇತರರು ಉಪಸ್ಥಿತರಿದ್ದರು.
505,ರಾಜಮಹಾರಾಜರ ಕಾಲದಿಂದ ಬೀಸುತ್ತಿರುವ ಅದೇ ಗಾಳಿ ಅದೇ ಮಂಜು ಮತ್ತು ಅಂದಿಗಿಂತಲೂ ಭಾರವಾಗಿ ಈಗಲೂ ಆಕಾಶದಲ್ಲಿ ಹಾಗೇ ಉಳಕೊಂಡಿರುವ ಒಂದು ವಿಷಣ್ಣ ಕುಳಿರು.
506,"– ಮಂಜು ಪೂಜಾರಿ, ಉಳ್ಳಾಲ ಗ್ರಾಮಾಭಿವೃದ್ಧಿ ಸಮಿತಿ ಅಧ್ಯಕ್ಷ."
507,ಮಂಜು ಭೈರಮಂಗಲ ಗ್ರಾಮ ಪಂಬಾಯತ್ ಅಧ್ಯಕ್ಷ ರವಿ.
508,ದೆಹಲಿಯಲ್ಲಿ ಮಂಜು ಕವಿದ ವಾತಾವರಣದಿಂದಾಗಿ ವಿಮಾನ ಸಂಚಾರ ಹಾಗೂ ರೈಲು ಸಂಚಾರದಲ್ಲಿ ತೀವ್ರ ಅಸ್ತವ್ಯಸ್ತವಾಗಿದೆ.
509,ಮಂಜು ಹೇಳಿದ್ದಾರೆ.
510,"ಎಲ್ಲಾ ಆರೋಗ್ಯ ಕಾಳಜಿಗಳ ಕಾರಣದಿಂದ, OSHA, ಆಕ್ಯುಪೇಷನಲ್ ಸೇಫ್ಟಿ ಅಂಡ್ ಹೆಲ್ತ್ (NIOSH), ಮತ್ತು ನ್ಯಾಷನಲ್ ಇನ್ಸ್ಟಿಟ್ಯೂಟ್ ಫಾರ್ ಆಕ್ಯುಪೇಶನಲ್ ಸೇಫ್ಟಿ ಅಂಡ್ ಹೆಲ್ತ್ (NIOSH) ಸೇರಿದಂತೆ ಹಲವು ಸಂಸ್ಥೆಗಳು, ಖನಿಜ ತೈಲ ಮಂಜು ಕಾರ್ಮಿಕರ ಪ್ರಮಾಣವನ್ನು ಬಹಿರಂಗಪಡಿಸಬೇಕು."
511,"ಬ್ರಿಲಿಯನ್ಸ್ M2 ಗೆ ಮುಂದಿನ ಮತ್ತು ಹಿಂದಿನ ಡಿಸ್ಕ್ ಬ್ರೇಕ್, ಅಳವಡಿಸಿರಲಾಗುತ್ತದೆ ಪವರ್ ಸ್ಟೀರಿಂಗ್, ಅಡ್ಡ ಮತ್ತು ಮುಂಭಾಗದ ಗಾಳಿಚೀಲಗಳು, ಮತ್ತು ಮುಂದಿನ ಮತ್ತು ಹಿಂದಿನ ಮಂಜು ದೀಪಗಳು."
512,ಹಳ್ಳಿಗಾಡಿನ ಜನರಿಗೆ ಬ್ಯಾಂಕ್ ಖಾತೆ ತೆರೆಯಲು ಉದ್ಯಮ ಪ್ರತಿನಿಧಿಗಳು ನೆರವಾಗುತ್ತಿದ್ದಾರೆ ಅಂತಾ ಎಸ್ ಬಿ ಐ ಮ್ಯಾನೇಜಿಂಗ್ ಡೈರೆಕ್ಟರ್ ಮಂಜು ಅಗರ್ವಾಲ್ ತಿಳಿಸಿದ್ದಾರೆ.
513,ಒರಟು ವಿಜ್ಞಾನಿಗಳು ಪ್ರಕಾರ ಆರ್ಕ್ಟಿಕ್ 2050 ಮಂಜು ಮುಕ್ತ ಬೇಸಿಗೆಯಲ್ಲಿ ಆಗಲಿದೆ.
514,"ಕಲಾವಿದರುಮಯೂರ್, ಮೂರ್ತಿ, ನೇಹಾ ಪಾಟೀಲ್, ಅಚ್ಚುತರಾವ್, ದಿಶಾ ಪೂವಯ್ಯ, ಗುರುರಾಜ ಹೊಸಕೋಟೆ, ಶಿವ ಮಂಜು, ಮಂಜು ನಾಗವಾರ, ದೊರೆ ಮುಂತಾದವರಿದ್ದಾರೆ."
515,ಮಂಜು ಅವರ ಪುತ್ರ ಶ್ರೇಯಸ್ ಸ್ಯಾಂಡಲ್‍ವುಡ್‍ಗೆ ಎಂಟ್ರಿ ಕೊಟ್ಟಿರುವ ಪಡ್ಡೆಹುಲಿಯು ರಾಜಾದ್ಯಾದ್ಯಂತ ಈ ವಾರ 200ಕ್ಕೂ ಹೆಚ್ಚು ಚಿತ್ರಮಂದಿರಗಳಲ್ಲಿ ತನ್ನ ಘರ್ಜನೆಯನ್ನು ಶುರು ಮಾಡಲಿದೆ.
516,ಕೆಎಂಎಫ್​ಗೆ ರೇವಣ್ಣನ ಕಪಿಮುಷ್ಟಿಯಿಂದ ಮುಕ್ತಿದಶಕಗಳ ಕಾಲ ಕೆಎಂಎಫ್​ ಅಧ್ಯಕ್ಷ ಹುದ್ದೆಯನ್ನು ಅನುಭವಿಸಿದ್ದ ರೇವಣ್ಣ ಅವರ ಕಪಿಮುಷ್ಟಿಯಿಂದ ಈ ಬಾರಿ ಕೆಎಂಎಫ್​ ಮುಕ್ತಿ ಪಡೆಯಲಿದೆ ಎಂದು ಬಿಜೆಪಿ ನಾಯಕ ಎ ಮಂಜು ತಿಳಿಸಿದ್ದಾರೆ.
517,ಮಂಜು ಅವರಿಂದ ಹಾಸ್ಯ ರೋಗ~ ಕಾರ್ಯಕ್ರಮ.
518,ಸಂಕಲನದ ಹೆಸರೇ ಸಾಂಕೇತಿಕವಾಗಿದೆ; ಮಂಜು ಕವಿದ ಸಂಜೆ ಮತ್ತು ಇತರ ಕತೆಗಳು.
519,ಮಂಜು ಅವರು ಕೇವಲ 50 ಸಾವಿರ ಮತಗಳ ಅಂತರದಿಂದ ಸೋತಿದ್ದಾರೆ.
520,McGuirk - Geoghagen - ರಾಯ್ - ಮಂಜು ರಲ್ಲಿ ಹಿಕೊರಿ ಸ್ಟ್ರೀಟ್ ಬಳಿ 70 ಆಡುಬನ್ ಬೌವ್ಲ್ವಾರ್ಡ್ನಲ್ಲಿ Conwill IV ಹೌಸ್ (1912).
521,ಬೇಸಿಗೆ ಮತ್ತು ಮಂಜು ಸಾಂದರ್ಭಿಕವಾಗಿ ನೀವು ಅವುಗಳನ್ನು ಧಾರಾಳವಾಗಿ ನೀರಿಡಬೇಕು.
522,"ಸಂಗಪ್ಪ ಯಲಬುಣಚಿ, ಕಳಕಪ್ಪ ಹಡಪದ, ಬಾಬು ಗೋಡೆಕಾರ್‌, ಗಣೇಶ ಗುಗಲೋತ್ತರ, ಶ್ರೀಕಾಂತ ಕಮ್ಮಾರ, ಅಂದಪ್ಪ ರಾಠೋಡ್‌, ಮಂಜು ಚವ್ಹಾಣ, ಕಾಶಿ ಗುಗಲೋತ್ತರ, ಗುರುರಾಜ ಸಂಗನಾಳ, ಕಿರಣ ರಾಠೋಡ್‌, ಕೃಷ್ಣಾ ರಾಠೋಡ್‌, ಮಲ್ಲಿಕಾರ್ಜುನ ಅಂಗಡಿ, ಮಹ್ಮದಗೌಸ್‌ ಮುಲ್ಲಾ, ಬೀಬಿಜಾನ್‌ ಮುಜಾವರ್‌, ನಂದಾ ಮನೇರಾಳ್‌, ಆಶಾ ಹುಲಿ ಉಪಸ್ಥಿತರಿದ್ದರು."
523,ಮಂಜು ಅವರ ಮಾಜಿ ಪತಿ ದಿಲೀಪ್ ಅವರ ಮೇಲೂ ಆರೋಪ ಹೊರೆಸಲಾಯಿತು.
524,ಮಂಜು ಕಾಂಗ್ರೆಸ್ ತೊರೆದು ಬಿಜೆಪಿ ಸೇರುವ ಸಾಧ್ಯತೆ ದಟ್ಟವಾಗಿದೆ.
525,ಮತ್ತು ಅದಕ್ಕೆ ಪೂರಕವಾದ ಮಂಜು ನಾರಾಯಣ್ ಅವರ ವಿಶಿಷ್ಟವಾದ ಬೆಳಕು ಪ್ರೇಕ್ಷಕರ ಮನಸ್ಸು ಅತ್ತಿತ್ತ ಸುಳಿಯದಂತೆ ಜಾಗೃತೆ ವಹಿಸಿ ನಾಟಕವನ್ನು ಶ್ರೀಮಂತಗೊಳಿಸಿದೆ.
526,ಮಂಜು ಎಸ್.
527,"ಮಂಜು ಪರ ಪ್ರಚಾರ ನಡೆಸಿದ ಅವರು, ಜೆಡಿಎಸ್‌ ವಿರುದ್ಧ ಹರಿಹಾಯ್ದರು."
528,ಮಂಜು ಅವರನ್ನು ಭೇಟಿ ಮಾಡಿ ಕಥೆ ಹೇಳಿದ ಎರಡು ದಿನದಲ್ಲೇ ಚಿತ್ರಕ್ಕೆ ಚಾಲನೆ ಸಿಕ್ಕಿತು ನಗು ಎಂಬ ವೆಪನ್‌ ಲೈಫ್ನಲ್ಲಿದ್ದರೆ ಏನು ಬೇಕಾದರೂ ಸಾಧಿಸಬಹುದು.
529,ಮಂಜು ಬೆಂಬಲಿಗ ಮಾಗಡಿ ಯೋಜನಾ ಪ್ರಾಧಿಕಾರ ಅಧ್ಯಕ್ಷ ಕೃಷ್ಣಮೂರ್ತಿ ಮೇಲೆ ಅವರ ಖಾಸಾ ಸಹೋದರ- ಮಾಜಿ ಶಾಸಕ ಎಚ್.
530,"ಮಾಥುರ್, ಸಿದ್ಧಾರ್ಥ ಬೇಹೂರ, ದೂರಸಂಪರ್ಕ ಆಯೋಗದ ಹಣಕಾಸು ವಿಭಾಗದ ಮಾಜಿ ಸದಸ್ಯ ಮಂಜು ಮಾಧವನ್, ಭಾರತೀಯ ದೂರಸಂಪರ್ಕ ನಿಯಂತ್ರಣ ಪ್ರಾಧಿಕಾರದ ಮಾಜಿ ಅಧ್ಯಕ್ಷ ಪ್ರದೀಪ್ ಬೈಜಾಲ್ ಅವರನ್ನೂ ಸಮಿತಿ ಪ್ರಶ್ನಿಸಿದೆ."
531,ಶಿಮ್ಲಾದ ರಸ್ತೆಗಳು ಮಂಜು ಆವೃತವಾಗಿದ್ದು ನಡೆದುಕೊಂಡು ಹೋಗುತ್ತಿರುವ ಯುವಕರು.
532,ಮಂಜು ಸ್ಪರ್ಧಿಸಿದ್ದಾರೆ.
533,"ಕ್ಷೇತ್ರದಲ್ಲಿ ಕೈಗೊಂಡಿರುವ ಅಭಿವೃದ್ಧಿ ಕಾರ್ಯ, ಕಾಂಗ್ರೆಸ್ ಸರ್ಕಾರದ ಜನಪರ ಕಾರ್ಯಕ್ರಮಗಳನ್ನು ಮಂಜು ನೆಚ್ಚಿಕೊಂಡಿದ್ದಾರೆ."
534,ಮಂಜು ವಿರುದ್ಧ ಶ್ರೀರಂಗಪಟ್ಟಣ ಹಾಗೂ ಪಾಂಡವಪುರದಲ್ಲಿ ಹಲವು ಪ್ರಕರಣಗಳು ದಾಖಲಾಗಿವೆ ಎಂದು ತನಿಖೆ ವೇಳೆ ಬೆಳಕಿಗೆ ಬಂದಿದೆ.
535,"ನಗರದೆಲ್ಲೆಡೆ ಮಳೆಯೊಂದಿಗೆ ದಟ್ಟ ಮಂಜು ಕವಿದ ವಾತಾವರಣವಿದ್ದು, ತೀವ್ರ ಚಳಿಯು ನಗರದ ನಿವಾಸಿಗಳನ್ನು ನಡುಗಿ ಸಿದೆ."
536,ಉದಾಹಾರಣೆಗೆ ವಿತರಕ ಜಾಕ್ ಮಂಜು ಪ್ರೀತಿಯಿಂದ ನಿರ್ಮಾಣ ಮಾಡಿದ್ದ ಅಂಬಿನಿಂಗ್ ವಯಸ್ಸಾಯ್ತೋ ಸಿನ್ಮಾಕ್ಕೆ ಕಿಚ್ಚ ಸಂಭಾವನೆ ಪಡೆದಿಲ್ಲ.
537,ವಿಷ್ಣುವರ್ಧನ್ ಆಪ್ತೇಷ್ಟರಲ್ಲಿ ಒಬ್ಬರಾದ ಮಂಜು ತಮ್ಮ ಗುರುಗಳ ಮಹತ್ವಾಕಾಂಕ್ಷೆಯನ್ನೂ ಮುಂದಿಟ್ಟರು.
538,ಮಂಜು ಮಿತ್ರ ಕಥೆ-ಚಿತ್ರಕಥೆ-ಸಂಭಾಷಣೆ ಬರೆದು ನಿರ್ದೇಶಿಸಿರುವ ಈ ಚಿತ್ರಕ್ಕೆ ವಿ.
539,10ಎ ಕ್ರಮಾಂಕದ ಕುಸ್ತಿಯಲ್ಲಿ ಮಂಜು ಕಕೇRರಿ ವಿರುದ್ಧ ರಮೇಶ ಸನ್ಯಾಳ ಗೆಲುವು ಸಾಧಿ ಸಿದರು.
540,ನನ್ನ ಹಿಂದಿನ ಚಿತ್ರದಲ್ಲಿ ಲೈಟ್‍ಬಾಯ್ ಆಗಿದ್ದ ಮುಂಜಾನೆ ಮಂಜು ಈ ಚಿತ್ರದ ಛಾಯಾಗ್ರಾಹಕರಾಗಿದ್ದಾರೆ.
541,ಮಂಜು ಮತ ಯಾಚನೆ
542,"ಇದಲ್ಲದೆ 50 ಆಸನಗಳ ಮೂವಿ ಥಿಯೇಟರ್, ಬೇಸಿಗೆ ಬಂದರೆ ಮಂಜು ಸುರಿಯುವಂತೆ ಕೂಲ್ ಆಗುವ ತಂತ್ರಜ್ಞಾನ ಹೊಂದಿರುವಂತಹ ಮನೆಯನ್ನು ಮುಖೇಶ್ ಅಂಬಾನಿ ಹೊಂದಿದ್ದಾರೆ."
543,"ಮಂಜು ಮಾಂಡವ್ಯ, ಚಿಕ್ಕಣ್ಣ ಮುಖ್ಯ ಭೂಮಿಕೆಯ ಈ ಚಿತ್ರದ ಟಪ್ಪಾಂಗೋಚಿ ಸಾಂಗ್ ರಿಲೀಸ್ ಆಗಿದೆ."
544,- ದಟ್ಟ ಮಂಜು ನಗರಕ್ಕೆ ಇಳಿದಿದೆ.
545,[ ಸಮಾಜ ಬದಲಾಗಲು ಕೊಬ್ರಿ ಮಂಜು ಸಿನಿಮಾ ಮಾಡಲ್ವಂತೆ.
546,"ಮಂಜು ಮಾತನಾಡಿ, ರೈತರು ವೈಜ್ಞಾನಿಕವಾಗಿ ಬೇಸಾಯ ಮಾಡಿ ಹೆಚ್ಚಿನ ಇಳುವರಿಯನ್ನು ಪಡೆಯಬೇಕು."
547,ಮಂಜು ಇಂದಿಲ್ಲಿ ತಿಳಿಸಿದ್ದಾರೆ.
548,"ಇನ್ನು, ಈ ಚಿತ್ರಕ್ಕೆ ಮಾಸ್ತಿ ಮಂಜು ಡೈಲಾಗ್ಸ್​ ಬರೆದಿದ್ದು, ದೀಪಾವಳಿಗೆ ಸಲಗದ ದಾಳಿ ರಗಡ್​ ಆಗಿರೋದು ಪಕ್ಕಾ."
549,ಮಂಜು ಆಕ್ರೋಶ ವ್ಯಕ್ತಪಡಿಸಿದ್ದಾರೆ.
550,ಮಂಜು ಭೇಟಿಯಾಗಿದ್ದರಿಂದ ಇಂತಹ ಸುದ್ದಿಗಳು ಹರಿದಾಡುತ್ತಿವೆ.
551,"ಮಂಜು ಕಿಂದ್ರಾಳೆ, ಸಿದ್ದಪ್ಪಾ ಹಂಚಿನಮನಿ, ಸಾಜಿದ್ ಸೈಯ್ಯದ ಸೇರಿದಂತೆ ಕಾರ್ಯಕರ್ತರು ಸಭೆಯಲ್ಲಿ ಹಾಜರಿದ್ದರು."
552,ಡೆತ್ ಸ್ಮಶಾನ longed ಮತ್ತು ಬೆಳಿಗ್ಗೆ ಮಂಜು ಕರಗುತ್ತದೆ ಹಾಗೆ ಕಣ್ಮರೆಯಾಯಿತು ಆದ್ದರಿಂದ ಹಾಡಿದರು.
553,ಮಂಜು ಹಾಗೂ ಪ್ರಧಾನ ಕಾರ್ಯದರ್ಶಿ ಬಿ.
554,"ಐ ಶಿವಪ್ರಕಾಶ್ ನೇತೃತ್ವದಲ್ಲಿ ನಡೆದ ದಾಳಿಯಲ್ಲಿ ಪೋಲಿಸ್ ಸಿಬ್ಬಂದಿಗಳಾದ ಮುಖ್ಯ ಪೇದೆ ರಮೇಶ್, ಪೇದೆಗಳಾದ ದಿನೇಶ್, ರಾಜರತ್ನಂ, ಬೀರೆಗೌಡ, ಮನೋಹರ್ ಹಾಗೂ ಚಾಲಕ ಮಂಜು ಭಾಗವಹಿಸಿದ್ದರು."
555,ಮಂಜು ಅವರು ಹಸ್ತಾಂತರಿಸಿದರು.
556,ಮಳೆ ನೀರಿನ ತರಹ ಮಂಜು ಆವರಿಸಿಕೊಂಡಿರುವದರಿಂದ ವಾಹನ ಸವಾರರು ಲೈಟ್ ಹಚ್ಚಿಕೊಂಡೆ ವಾಹನ ಚಲಾಯಿಸುತ್ತಿರುವುದು ಕಂಡು ಬಂದಿದೆ.
557,ಆದರೆ ಮಂಜು ಕುಮಾರಿ ಭಾರತಕ್ಕೆ ಪದಕವನ್ನು ತಂದುಕೊಡುವಲ್ಲಿ ಯಶಸ್ವಿಯಾಗಿದ್ದಾರೆ.
558,"ಮಂಜು ಆನಂದದಿಂದ, ಆರಾಮವಾಗಿ ಕೂತು ತಿನ್ನೋಣ ಎಂದು ಅಶ್ವತ್ಥ ಕಟ್ಟೆಯ ಬಳಿ ಬಂದಾಗ ಶಾಂತಿ ಇನ್ನೂ ಅಲ್ಲೇ ಇದ್ದಳು."
559,ಇನ್ನುಳಿದಂತೆ ವಿತರಕ ವಲಯದಲ್ಲಿ ಕೆ ಮಂಜು 274 ಮತಗಳಿಂದ ಜಯ ಸಾಧಿಸಿದ್ದಾರೆ.
560,ಮಂಜು ಈಗೊಂದು ನಿರ್ಣಯಕ್ಕೆ ಬಂದಿದ್ದಾರೆ.
561,"ನಟ ದಿಲೀಪ್, ಕಾವ್ಯಾ ಮಾಧವನ್ ಜೊತೆಗೆ ಅಕ್ರಮ ಸಂಬಂಧ ಹೊಂದಿದ್ದಾರೆ ಅನ್ನೋ ವಿಚಾರವನ್ನು ನಟಿ ಅವರ ಪತ್ನಿ ಮಂಜು ವಾರಿಯರ್ ಬಳಿ ಹೇಳಿದ್ದಳಂತೆ."
