Index,Sentence
364,"ಹಾಗೆ ಗೋಪಿನಾಥ್ ಮತ್ತವರ ಕುಟುಂಬ, ಮಂಜು ಕುಟುಂಬ, ಹರೀಶ್, ತೇಜಸ್ವಿ, ನಾಗರಾಜ್, ಕವಿ ನಾಗರಾಜರು, ಶ್ಯಾಮಲಾ ಜನಾರ್ಧನನ್, ಅ೦ಜನ್ ಕುಮಾರ್,ರೂಪ ರಾವ್ ಎಲ್ಲರ ಪರಿಚಯವಾದ ಮೇಲೆ ಕಾರ್ಯಕ್ರಮ ಶುರುವಾಯ್ತು."
365,ಮಂಜು ಸಿದ್ಧರಾಗಿದ್ದಾರೆ.
366,"ಅಧ್ಯಕ್ಷ ದಿನಕರ ಬಾಬು, ಸಂಘದ ಪ್ರಮುಖರಾದ ಚಂದ್ರ ಪೂಜಾರಿ, ಗುಣಕರ ಶೆಟ್ಟಿ, ಮಂಜು ಬಿಲ್ಲವ ಉಪಸ್ಥಿತರಿದ್ದರು."
367,ಈ ಕುರಿತು ಡಿಸಿ ರೋಹಿಣಿ ಸಿಂಧೂರಿ ಅವರ ವಿರುದ್ಧವೇ ಸಚಿವ ಮಂಜು ಚುನಾವಣಾ ಆಯೋಗಕ್ಕೆ ದೂರು ನೀಡಿದ್ದರು.
368,ಇದನ್ನು ನೆನಪು ಮಾಡಿಕೊಳ್ಳಬೇಕು ಎಂದು ಸಚಿವ ಮಂಜು ಹೇಳಿದರು.
369,ರಾಮ್​ಗೋಪಾಲ್​ ವರ್ಮಾ ಹಾಗೂ ಅಗಸ್ತ್ಯ ಮಂಜು ನಿರ್ದೇಶನದಲ್ಲ ಕಂಪೆನಿ ಪ್ರೊಡಕ್ಷನ್ಸ್​ ಹಾಗೂ ಜಿ.
370,"ಗುಡಿ, ನಲ್ಲಿಕತ್ತರಿ, ಕೆರೆದಿಂಬ, ಜೋಡಿಗೆರೆ, ಹೊನ್ನಮೇಟಿ, ಅತ್ತಿಖಾನೆಗಳಲ್ಲಿ ಮುಂಜಾನೆಯಿಂದ ರಾತ್ರಿಯಡೀ ಮಂಜು ಕವಿದಿರುತ್ತದೆ."
371,"ಸ್ಥಾಪಿತವಾದ 25000 ಚದರ ಮೀಟರ್ ಮತ್ತು 18000 ಚದರ ಮೀಟರ್ ಕಾರ್ಯಾಗಾರದಲ್ಲಿ ಪ್ರದೇಶದಲ್ಲಿ ಒಂದು ವ್ಯಾಪ್ತಿಯನ್ನೊಳಗೊಂಡಿದ್ದ 1992 ರಲ್ಲಿ ಇದು ನಿಂಗ್ಬೋ ಪೋರ್ಟ್ ನಿಂದ Ningbo Lishe ಅಂತರರಾಷ್ಟ್ರೀಯ ವಿಮಾನ ಕೇವಲ 30 ನಿಮಿಷದ ಡ್ರೈವ್ ಮತ್ತು ಕೇವಲ 25 ನಿಮಿಷದ ಡ್ರೈವ್ ಅನುಕೂಲಕರ ಸಂಚಾರ ಮತ್ತು ಉನ್ನತ ಸ್ಥಳ ಹೊಂದಿದೆ --- ಅಲ್ಲದ silting, ಆಳ ನೀರಿನ ಮತ್ತು ವರ್ಷಪೂರ್ತಿ ಮಂಜು ಮುಕ್ತ ಲಾಭ ಜೊತೆ ಪ್ರಖ್ಯಾತ ಅಂತರರಾಷ್ಟ್ರೀಯ ಸಮುದ್ರ ಬಂದರು."
372,ಹಾಸನ ಜಿಲ್ಲಾಧ್ಯಕ್ಷ ಹುದ್ದೆಗೆ ಸಚಿವ ಎ ಮಂಜು ಪುತ್ರ ಮಂಥರ್ ಗೌಡ ಅವಿರೋಧವಾಗಿ ಆಯ್ಕೆಯಾಗಿದ್ದಾರೆ.
373,ಥ್ರಿಲ್ಲರ್ ಮಂಜು ಅವರು 29 ವರ್ಷಗಳ ಸಿನಿಮಾ ಜರ್ನಿಯಲ್ಲಿ 500 ಚಿತ್ರಗಳಿಗೆ ಸಾಹಸ ನಿರ್ದೇಶನ ಮಾಡಿದ್ದಾರೆ.
374,"ವೆಂಕಟೇಶ, ಮಂಜು ಪಡದಾರ, ಸುಧಿಧೀರ ಹುಕ್ಕೇರಿ, ಲಗಮಣ್ಣ ಕಣಗಲಿ ಗೋಪಾಲ ತಳವಾರ ಇದ್ದರು."
375,"ನವದೆಹಲಿಯ ವಿಜಯ್ ಚೌಕ್ ನಲ್ಲಿ ಕಂಡು ಬಂದ ಚಳಿಗಾಲದ ದೃಶ್ಯ ಮಂಜು ಮತ್ತು ಸೂರ್ಯನ ಬೆಳಕಿನ ನಡುವಿನ ಹೊಂದಾಣಿಕೆ, ಸಾಂರಸ್ಯದ ಕತೆ ಹೇಳುತ್ತಿತ್ತು."
376,"ಮೂಡಿಗೆರೆ ಕಡೆಯಿಂದ ಮಂಗಳೂರು ಕಡೆಗೆ ಸಾಗುತ್ತಿದ್ದ ಕೆಎ19, ಝಡ್1421 ಸ್ಕಾರ್ಪಿಯೊ ಬುಧವಾರ ರಾತ್ರಿ ಚಾರ್ಮಾಡಿ ಘಾಟ್ ಮಧ್ಯ ಭಾಗದಲ್ಲಿರುವ ಅಣ್ಣಪ್ಪ ಸ್ವಾಮಿ ದೇವಸ್ಥಾನದಿಂದ 1 ಕಿಮೀ ಅಂತರದಲ್ಲಿ ಮಂಜು ಮುಸುಕಿನ ನಡುವೆ ರಸ್ತೆ ಕಾಣದೇ300 ಅಡಿ ಪ್ರಪಾತಕ್ಕೆ ಉರುಳಿ ಬಿದ್ದಿದೆ."
377,"ಛಾಯಗ್ರಹಣ ಚಂದ್ರುಬೆಳವಂಗಲ ಮತ್ತು ನಾಗಶೆಟ್ಟಿ, ಸಾಹಸ ಗೋಪಿ, ಸಂಕಲನ ನಲ್ಮೆಯ ತಿರು , ನೃತ್ಯ ವಿಜಯನಗರ ಮಂಜು ಮಾಡಿದ್ದಾರೆ."
378,ಮಂಜು ಮುಸುಕಿದ ಹಾದಿಯಲ್ಲೇ ಸಾಗಿತು ನಮ್ಮ ಯಾನ.
379,"ಪೇಟಾ ಚಿತ್ರದ ಕರ್ನಾಟಕ ವಿತರಣೆ ಹಕ್ಕು ಹಾಗೂ ಡಬ್ಬಿಂಗ್ ಹಕ್ಕು ಖರೀದಿಸಿದ್ದ ವಿತರಕ ಜಾಕ್ ಮಂಜು ಅವರು, ಪೇಟಾ ಚಿತ್ರಕ್ಕೆ ರಜನಿಕಾಂತ್ ಅವರಿಂದ ಡಬ್ ಮಾಡಿಸುವ ಪ್ರಯತ್ನ ಆಗ್ತಿದೆ, ಅವರು ಒಪ್ಪಿದರೇ ಕನ್ನಡದಲ್ಲಿ ಅವರೇ ಧ್ವನಿಯಲ್ಲಿ ಸಿನಿಮಾ ರಿಲೀಸ್ ಮಾಡ್ತೀನಿ, ಇಲ್ಲವಾದರೇ ಯೋಚನೆ ಮಾಡ್ತೀನಿ ಎಂದು ಸುದ್ದಿಗೋಷ್ಠಿಯಲ್ಲಿ ಹೇಳಿದ್ರು."
380,ಮತ್ತೆ ಮುಂದುವರಿದ ಮಳೆ ಘಾಟ್ ರಸ್ತೆಯಲ್ಲಿ ಮಂಜು ಮುಸುಕಿದ ವಾತವರಣ
381,"ನೀವು ಶುಷ್ಕ ಮಂಜು ಮಂಜು ಮಾಡುವಾಗ, ಇಂಗಾಲದ ಡೈಆಕ್ಸೈಡ್ನ ಸಾಂದ್ರತೆಯು ನೆಲದ ಹತ್ತಿರ ಹೆಚ್ಚಾಗುತ್ತದೆ."
382,"ವಿಡಿಯೋದಲ್ಲಿ ಮಂಜು ಅವರ ದುರಾಡಳಿತ, ಭ್ರಷ್ಟಾಚಾರ ದರ್ಪದ ನಡವಳಿಕೆ, ದಲಿತ ವಿರೋಧಿ ನೀತಿ, ಕುಡಿಯುವ ನೀರಿನ‌ ಸಮಸ್ಯೆ ಬಗ್ಗೆ ಸಾರ್ವಜನಿಕ ಆಕ್ರೋಶ ವ್ಯಕ್ತ ಪಡಿಸಿದ್ದಾರೆ…"
383,ಜಾಕ್ ಮಂಜು ನಿರ್ಮಾಣ ಹಾಗೂ ಗುರುದತ್ ಗಾಣಿಗ ನಿರ್ದೇಶನ ಚಿತ್ರಕ್ಕಿತ್ತು.
384,ಅಮ್ಮನ ಫ್ರೆಂಡ್ ಒಬ್ಬರಿಗೆ ನಿಖಿಲ್ ಮಂಜು ಅವರ ಪರಿಚಯವಿತ್ತು.
385,"ತ್ಯಾಗರಾಜ್, ವಕೀಲ ಕೃಷ್ಣಪ್ಪ, ಜಿಲ್ಲಾ ಉಪಾಧ್ಯಕ್ಷ ಜಲೇಂದ್ರಕುಮಾರ್, ವಿವಿಧ ತಾಲೂಕು ಅಧ್ಯಕ್ಷರಾದ ನಾಗೇಂದ್ರ, ಮುರಳೀಧರ, ಗೌರೀಶ್ ಗದ್ದಿಗೆ, ಮಂಜು ನಾಥ್, ನರಸಿಂಹ, ಸಿ."
386,ಸುದೀಪ್ ರಂತೆಯೇ ರಾಕಿಂಗ್ ಸ್ಟಾರ್ ಯಶ್ ಮತ್ತು ನಿರ್ಮಾಪಕ ಕೆ ಮಂಜು ಕೂಡ ಇದೇ ಪ್ರಯತ್ನದಲ್ಲಿದ್ದಾರೆ.
387,"ಮಂಜು ಹೊಂದಿದ್ದು, ಸಚಿವರಾದ ವಿನಯ್‌ ಕುಲಕರ್ಣಿ, ಎಚ್‌."
388,ನಿರಂತರ ಮಂಜು ಬೀಳುವಿಕೆಯ ಪರಿಣಾಮ ಇಳುವರಿ ಕುಂಠಿತ ಸಾಧ್ಯತೆ
389,ಯುವತಿ ಹೊಲಕ್ಕೆ ಹೋಗಿದ್ದಾಗ ಮಂಜು ಅಲಿಯಾಸ್ ಹುಲಿಯ ಎಂಬುವನು ಹಿಂಬಾಲಿಸಿಕೊಂಡು ಹೋಗಿ ಅತ್ಯಾಚಾರ ಎಸಗಿದ್ದಾನೆ ಎಂದು ತಿಳಿದು ಬಂದಿದೆ.
390,2002: ಚೀನಾದ ಬೋಯಿಂಗ್ ವಿಮಾನ ಸಿಎ129 ವ್ಯಾಪಕ ಮಳೆ ಹಾಗೂ ಮಂಜು ಆವರಿಸಿದ ಕಾರಣ ದ.
391,ಮಂಜು ನಿರ್ಲಕ್ಷ್ಯ: ಕೃಷ್ಣಮೂರ್ತಿ
392,ಆದರೆ ಮಂಜು ಮಾತ್ರ ತಮಗೆ ಕಾಂಗ್ರೆಸ್ ಟಿಕೆಟ್ ಗ್ಯಾರಂಟಿ ಎಂದಿರುವುದು ಹಲವು ಅನುಮಾನಗಳಿಗೆ ಕಾರಣವಾಗಿದೆ.
393,Kannada Film ಕನ್ನಡ ಸಿನಿಮಾ Punith Rajkumar ಪುನೀತ್ ರಾಜಕುಮಾರ್‌ Raghavendra Rajkumar ರಾಘವೇಂದ್ರ ರಾಜಕುಮಾರ್ Ammana Mane Nikhil Manju ಅಮ್ಮನ ಮನೆ ನಿಖಿಲ್ ಮಂಜು
394,"ಇವುಗಳ ಜತೆಗೆ ಪಿ ವಾಸು, ಎಪಿ ಅರ್ಜುನ್, ಮಂಜು ಸ್ವರಾಜ್, ನಾಗತಿಹಳ್ಳಿ ಚಂದ್ರಶೇಖರ್, ಟಿಎಸ್ ನಾಗಾಭರಣ, ಯೋಗರಾಜ್ ಭಟ್ ನಿರ್ದೇಶನದಲ್ಲಿ ತಲಾ ಒಂದೊಂದು ಸಿನಿಮಾ ಘೋಷಣೆ ಆಗಿವೆ."
395,"ಇದು ಬಿಟ್ಟರೇ ಕೆ, ಮಂಜು ಅವರ ಬ್ಯಾನರ್ ನಲ್ಲೊಂದು ಚಿತ್ರ ಮಾಡಲಿದ್ದಾರೆ ಉಪ್ಪಿ."
396,ಮಂಜು ಮತ್ತು ಸಾವಿತ್ರಿ ಕೊಲೆ ಮಾಡಿದ.
397,ದೇವೇಗೌಡರ ನೆಪವೂಡ್ಡಿ ಬಿಜೆಪಿ ಪಕ್ಷ ಸೇರಿ ರುವ ಮಂಜು ಕುಟುಂಬ ರಾಜಕಾರಣ ಎಂದು ಹೇಳುವುದು ಸರಿಯಲ್ಲ.
398,ಮಂಜು ವಿಶ್ವಾಸ ವ್ಯಕ್ತಪಡಿಸಿದ್ದಾರೆ.
399,ಇದರ ಹಿನ್ನೆಲೆಯಲ್ಲಿ ದಪ್ಪ ಮಂಜು ಕಾಣಿಸುತ್ತದೆ.
400,ಮಂಜು ಲೇವಡಿ ಮಾಡಿದ್ದಾರೆ.
401,"ಮಂಜು ವಿರುದ್ಧ 10–0 ಅಂತರದ ಜಯ ಸಾಧಿಸಿ ಸಾಕ್ಷಿ ಮಲಿಕ್ ಆಯ್ಕೆ ಯಾದರೆ, ಸತ್ಯವ್ರತ ಅವರು ಮೌಸಮ್‌ ವಿರುದ್ಧ ವಾಕ್‌ ಓವರ್‌ ಪಡೆದಿದ್ದರು."
402,"ರಾಮಸ್ವಾಮಿ ನಾಯಕ, ಮಂಜು ನಾಯಕ, ಲಕ್ಷ್ಮಮ್ಮ, ಭಾಗ್ಯಮ್ಮ ಪ್ರತಿಭಟನೆಯಲ್ಲಿ ಪಾಲ್ಗೊಂಡಿದ್ದರು."
403,ಮಂಜು ವ್ಯಂಗ್ಯವಾಡಿದರು.
404,"ಮಂಜು ಹಾಗೂ ಮುನಿರತ್ನ, ಹುಟ್ಟಾ ಶತ್ರುಗಳಂತೆ ಮಾಧ್ಯಮಗಳ ಮೂಲಕ ಕಚ್ಚಾಡಿದರು."
405,ಬಿಗ್ ಓಪನಿಂಗ್ ಕಂಡಿರುವ ಮಂಜು ಮಾಂಡವ್ಯ ನಿರ್ದೇಶನದ ಮಾಸ್ಟರ್ ಪೀಸ್ ಮೊದಲ ದಿನವೇ ರೆಕಾರ್ಡ್ ಬ್ರೇಕಿಂಗ್ ಕಲೆಕ್ಷನ್ ಮಾಡಿದೆ.
406,ವರದಿ: ಮಂಜು ಪತ್ತಾರ ಬಿಟಿವಿ ಹುಬ್ಬಳ್ಳಿ.
407,ಅದು ನಾನು ಮಾಡಿರುವ ದೊಡ್ಡ ತಪ್ಪು ಎಂದು ಮಂಜು ಹೇಳಿದರು.
408,"ದಿವಾಕರ್ ಛಾಯಾಗ್ರಹಣ, ರಾಜೇಶ್ ಬ್ರಹ್ಮಾವರ್ ಅವರ ನೃತ್ಯ ನಿರ್ದೇಶನ ಹಾಗೂ ಥ್ರಿಲ್ಲರ್ ಮಂಜು ಅವರ ಸಾಹಸ ಚಿತ್ರಕ್ಕಿದೆ."
409,ಇದ್ರ ನಡುವೆ ಮಂಜು ಸ್ವರಾಜ್ ಕೂಡ ಬೇರೆ ಸಿನಿಮಾದಲ್ಲಿ ಬ್ಯುಸಿಯಾಗಿದ್ದಾರೆ.
410,ಚಿತ್ರಕ್ಕೆ ಮಾಸ್ತಿ ಮಂಜು ಸಂಭಾಷಣೆ ಬರೆದಿದ್ದು ಚರಣ್​ರಾಜ್ ಸಂಗೀತವಿದೆ.
411,ಮಂಜು ಮತ್ತು ಮತ್ತಿತರರನ್ನು ಥಳಿಸಿದ್ದಾರೆಂದು ನಿರ್ಮಾಪಕರ ಸಂಘ ಆರೋಪಿಸಿದೆ.
412,ಸಂಭಾವನೆ ನೀಡಿಲ್ಲ ಎಂಬ ತಮ್ಮ ಮೇಲಿನ ಆರೋಪವನ್ನು ತಿರಸ್ಕರಿಸಿ ಸ್ಪಷ್ಟೀಕರಣ ನೀಡಿದ ಮಂಜು ಮಸ್ಕಲ್ ಮಟ್ಟಿ ಚಿತ್ರೀಕರಣದ ವೇಳೆ ಅನುಭವಿಸಿದ ತೊಂದರೆಗಳನ್ನು ಬಿಚ್ಚಿಟ್ಟರು.
413,ಮಂಜು ವಿಶ್ವಾಸ ವ್ಯಕ್ತಪಡಿಸಿದರು.
414,"ಈ ಸಂದರ್ಭಗಳಲ್ಲಿ, T3 ನ ಜೊತೆಗೆ ಖಿನ್ನತೆ, ಮೆದುಳಿನ ಮಂಜು , ಆಯಾಸ ಮತ್ತು ಇತರ ಲಕ್ಷಣಗಳನ್ನು ನಿವಾರಿಸಲು ನೆರವಾಯಿತು."
415,"14): ಬೆಂಗಳೂರು ವಿಮಾನ ನಿಲ್ದಾಣದಲ್ಲಿ ದಟ್ಟ ಮಂಜು ಕವಿದಿದ್ದು, ವಿಮಾನಗಳ ಹಾರಾಟದಲ್ಲಿ ವ್ಯತ್ಯಯ ಉಂಟಾಗಿತ್ತು."
416,"ಮಂಜು ಎಂ ಜೆ, ಜಲತಜ್ಞ ಮತ್ತು ಅಂಕಣಕಾರ ಶಿವಾನಂದ ಹೆಗಡೆ ಕಳವೆ, ಪರಿಸರ ತಜ್ಞ ಬಾಲಚಂದ್ರ ಸಾಯಿಮನೆ, ಪಕ್ಷಿತಜ್ಞ ಮಹೇಶ ಎಸ್ ಯಾಮೋಜಿ ಇವರುಗಳು ಬೇರೆ ಬೇರೆ ವಿಷಯಗಳ ಕುರಿತಾಗಿ ಪ್ರಶ್ನಾವಳಿ ತಯಾರಿಸಲು ಕಾಲಕಾಲಕ್ಕೆ ಮಾಹಿತಿ ಹಾಗೂ ನಿರ್ದೇಶನ ನೀಡಲಿದ್ದಾರೆ."
417,ಬೈಂದೂರು : ಇಲ್ಲಿನ ತೂದಳ್ಳಿಯ ಮಂಜು ಪೂಜಾರಿ ( 48 ) ಖಾಯಿಲೆಯಿಂದ ಮನನೊಂದು ಬಾವಿಗೆ ಹಾರಿ ಆತ್ಮಹತ್ಯೆ ಮಾಡಿಕೊಂಡ ವ್ಯಕ್ತಿ.
418,"ಕಾಡಲಿದೆ ಅಸ್ತಮಾ, ಒಣ ಚರ್ಮ: ಚಳಿಗಾಲದಲ್ಲಿ ಧೂಳು ಮಂಜಿನೊಂದಿಗೆ ಸೇರುವುದರಿಂದ, ಮಂಜು ಮಿಶ್ರಿತ ಗಾಳಿ ಸೇವನೆ ಅಸ್ತಮಾ ತರುವಂತಹ ಅಪಾಯವಿರುತ್ತದೆ."
419,ಥ್ರಿಲ್ಲರ್ ಮಂಜು ಅವರು 1990ರಲ್ಲಿ ನಟ ಶಂಕರ್ ನಾಗ್ ಅಭಿನಯದ ನರಸಿಂಹ ಸಿನಿಮಾಗೆ ಸಾಹಸ ನಿರ್ದೇಶನ ಮಾಡುವ ಮೂಲಕ ತಮ್ಮ ಸಿನಿ ಪ್ರಯಣವನ್ನು ಶುರು ಮಾಡಿದ್ದರು.
420,ಬಿ ಮಂಜು ಜಿಲ್ಲಾ ಪಂಚಾಯತ್ ಸಾಮಾಜಿಕ ನ್ಯಾಯ ಸ್ಥಾಯಿ ಸಮಿತಿ ಅಧ್ಯಕ್ಷ ಬೀರಿಹುಂಡಿ ಬಸವಣ್ಣ ಅವರುಗಳು ಭಾಗವಹಿಸಲಿದ್ದಾರೆ.
421,"ನೀವು ರೇಂಜರ್ಸ್ ಗಂಟೆಗಳ ಭಾವಿಸಿದರೆ ಮತ್ತು, ಮಂಜು ಇಪ್ಪತ್ತು ನಿಮಿಷಗಳ ಇದ್ದರು."
422,ಜನವರಿಯಲ್ಲಿ ಭಾರೀ ಮಂಜು ಬೀಳುವ ಕಾರಣ ವಿಮಾನ ಹಾಗೂ ರೈಲು ಸಂಚಾರಕ್ಕೆ ಅಡ್ಡಿಯಾಗುತ್ತದೆ.
423,ಚಾರ್ಮಾಡಿ ಘಾಟಿಯಲ್ಲಿ ಮಂಜು ಮುಸುಕಿದ ವಾತಾವರಣ ನಿರ್ಮಾಣವಾಗಿದೆ.
424,"ಅಧ್ಯಕ್ಷೆ ರೇಖಾ, ಹಿಂದಿನ ಅಭಿವೃದ್ಧಿ ಅಧಿಕಾರಿಯಾಗಿದ್ದ ಶಿವಕುಮಾರ, ಫ್ಯಾಷನ್ ಹಟ್ಸ್ ಅಂಗಡಿ ಮಾಲೀಕ ಮಂಜು ಮತ್ತು ಎಂ."
425,"ಮಂಜುನಾಥ ಅಲಿಯಾಸ್​ ಕೊತ್ತನೂರು ಮಂಜು ತಪ್ಪಿತಸ್ಥ ಎಂದು ನ್ಯಾಯಾಲಯ ಆದೇಶಿಸಿದ್ದು, ಮಂಜುನಾಥ ಸಂಕಷ್ಟಕ್ಕಿಡಾಗಿದ್ದಾರೆ."
426,"ಮಂಜು ಕ್ಷೇತ್ರದ ಪ್ರಭಾವಿ ಕಾಂಗ್ರೆಸ್​ ನಾಯಕರಾಗಿದ್ದು, ಸಿದ್ದರಾಮಯ್ಯ ಆಪ್ತ ಕೂಡ."
427,ಸಂಸದ ಪ್ರಜ್ವಲ್ ರೇವಣ್ಣ ವಿರುದ್ಧ ಎ ಮಂಜು ಸ್ಫೋಟಕ ಆರೋಪ
428,ಪಂಜಾಬ್ ನ ಅಬೋರ್ ನ ಪಂಜಪೀರ್ ನಿವಾಸಿ ಮಂಜು ಮತ್ತು ಆಕೆಯ ಪ್ರಿಯತಮ ವಿಜಯ್ ಕುಮಾರ್ ದೀಕ್ಷಾ ಎಂಬ 17 ವ.
429,"ಮಂಜು ಎದುರು 1,42,123 ಮತಗಳ ಅಂತರದಿಂದ ಗೆಲುವು ಸಾಧಿಸಿದ್ದಾರೆ."
430,ಮಂಜು ವಾರಿಯರ್ ಮುಖ್ಯಭೂಮಿಕೆಯಲ್ಲಿದ್ದ ಕೇರ್ ಆಫ್ ಸಾಯಿರಾಭಾನು ಮತ್ತು ಕುಂಬಳಂಗಿ ನೈಟ್ಸ್ ಸಿನಿಮಾಗಳಲ್ಲೂ ಅವರದು ಗಮನಾರ್ಹ ಪಾತ್ರ.
431,"ಹೆಲ್ಮೆಟ್ ವಿರೋಧಿ ಸ್ಕ್ರಾಚ್ ಮತ್ತು ವಿರೋಧಿ ಮಂಜು ಗುರಾಣಿ ನಿಮ್ಮ ಸಮಯವನ್ನು ಎಲ್ಲಾ ಸಮಯದಲ್ಲೂ ಸ್ಪಷ್ಟವಾಗಿಸಲು ಉದ್ದೇಶಿಸಿದೆ, ಆದರೆ ನೀವು ನೋಡದಿದ್ದರೆ, ಅದು ಶೀಘ್ರ ಬಿಡುಗಡೆ ಹೊಂದಿದೆ."
432,ಮಂಜು ಮಾಂಡವ್ಯ ಮತ್ತು ಚಿಕ್ಕಣ್ಣ ಕಾಂಬಿನೇಷನ್​ನಲ್ಲಿ ಶ್ರೀ ಭರತ ಬಾಹುಬಲಿ ಸಿನಿಮಾ ಬಿಡುಗಡೆಗೆ ಸಿದ್ಧವಾಗಿದೆ.
433,"ಮಂಜು ವರ್ಮ, ಮದನ್ ಸಹ್ನಿ, ಶೈಲೇಶ್ ಕುಮಾರ್ ಹಾಗೂ ಕಪಿಲ್ ದೇವ್ ಕಾಮತ್ ಅವರು ಸಚಿವ ಸ್ಥಾನ ಪಡೆದುಕೊಳ್ಳುತ್ತಿದ್ದಾರೆ."
434,ಹಿಮಾಚಲ ಪ್ರದೇಶದ ಪ್ರಯಳದಲ್ಲಿ ದಕ್ಷಿಣ ಭಾರತದ ನಟಿ ಮಲಯಾಳಂನ ಲೇಡಿ ಸೂಪರ್ ಸ್ಟಾರ್ ಮಂಜು ವಾರಿಯರ್ ಮತ್ತು ಚಿತ್ರತಂಡ ಸಿಲುಕಿಕೊಂಡಿದ್ದಾರೆ.
435,ಒಂದು ವೇಳೆ ಸಚಿವರ ಪತಿ ಈ ಪ್ರಕರಣದಲ್ಲಿ ಭಾಗಿಯಾಗಿದ್ದೇ ಆದ್ರೆ ಮಂಜು ವರ್ಮಾ ಅವರನ್ನ ಸಂಪುಟದಿಂದ ವಜಾ ಮಾಡೋದಾಗಿ ನಿತೀಶ್ ಕುಮಾರ್ ಹೇಳಿದ್ದಾರೆ.
436,ಮಂಜು ಅವರ ಪರವಾಗಿ [more]
437,ಮಂಜು ಅವರ ಆಡಳಿತ ನಡೆಯುತ್ತಿದೆ.
438,ಮಂಜು ಕಾರಣವಾಗಿದ್ದಾರೆ.
439,"ಮೀನುಗಾರಿಕಾ ಅಭಿವೃದ್ಧಿ ನಿಗಮದ ಮಾಜಿ ಅಧ್ಯಕ್ಷ ಹೆರಿಯಣ್ಣ ಚಾತ್ರಬೆಟ್ಟು, ಪುರಸಭೆ ಉಪಾಧ್ಯಕ್ಷ ರಾಜೇಶ್ ಕಾವೇರಿ, ಜಿಪಂ ಸದಸ್ಯರಾದ ಶ್ರೀಲತಾ ಸುರೇಶ್ ಶೆಟ್ಟಿ, ಲಕ್ಷ್ಮೀ ಮಂಜು ಬಿಲ್ಲವ, ಜಿಲ್ಲಾ ಪ್ರವಾಸೋದ್ಯಮ ಇಲಾಖೆಯ ಸಹಾಯಕ ನಿರ್ದೇಶಕಿ ಅನಿತಾ, ಕೋಟೇಶ್ವರ ಗ್ರಾಪಂ ಅಧ್ಯಕ್ಷೆ ಜಾನಕಿ ಬಿಲ್ಲವ ಮಾತನಾಡಿದರು."
440,"ಇದೀಗ ಹೆಬ್ಬುಲಿ ಉಮಾಪತಿ ನಿರ್ಮಾಣದಲ್ಲಿ, ರಾಜಾಹುಲಿ ನಿರ್ದೇಶಕ ಮಂಜು ಮಾಂಡವ್ಯನವರ ನಿರ್ದೇಶನದಲ್ಲಿ ಚಿಕ್ಕಣ್ಣ ಪೂರ್ಣ ಪ್ರಮಾಣದ ನಾಯಕನಾಗಿ ನಟಿಸುತ್ತಿದ್ದಾರೆ."
441,ಚಳಿಗಾಲ ಹಾಗೂ ಮಳೆಗಾಲದಲ್ಲಂತೂ ದಟ್ಟ ಮಂಜು ಆವರಿಸಿಕೊಂಡಿರುವುದರಿಂದ ಬೇರೊಂದು ಲೋಕಕ್ಕೆ ಬಂದಂತಹ ಅನುಭವವಾಗುತ್ತದೆ.
442,ದಟ್ಟವಾದ ಮಂಜು ಹೇಳಬೇಕೆಂದರೆ - ಸಂದಿಗ್ಧತೆಯನ್ನು ಗೆ.
443,ಮಂಜು ಮಾರ್ತಾಂಡನ ಮುಸುಕುವುದುಂಟೆ ||
444,"ನಿನ್ನೆ, ಮಳೆ ಮಂಜು ; ಇಂದಿನ, ಫ್ರಾಸ್ಟ್ ಮಂಜು , ಆದರೆ ಪ್ರತಿಯೊಬ್ಬರೂ ಹೇಗೆ ಆಕರ್ಷಕವಾಗಿರುತ್ತಿದ್ದಾರೆ."
445,"ಅರವಿಂದ ಬೋಳಾರ್, ಭೋಜರಾಜ ವಾಮಂಜೂರು, ಮಂಜು ರೈ ,ಸಾಯಿ ಕೃಷ್ಣ, ವಿಸ್ಮಯ್ ವಿನಾಯಕ್ ಅದ್ಬುತವಾಗಿ ನಟಿಸಿದ್ದಾರೆ."
446,ಬೆಳ್ಳಂ ಬೆಳಿಗ್ಗೆ ಗಿರಿ ಶಿಖರಗಳು ಮಂಜು ಹೊದ್ದು ನಿಂತಿವೆ.
447,ಈ ಸಮಯದಲ್ಲಿ ಬಿಜಿಎಸ್ ವಿದ್ಯಾ ಸಂಸ್ಥೆಯ ಕಾರ್ಯಕ್ರಮಕ್ಕೆ ಪ್ರಿಯಾರನ್ನು ಕೆ ಮಂಜು ಕರೆದುಕೊಂಡು ಹೋಗಿದ್ದರು.
448,ಇಲ್ಲಿ ಮುಂಜಾನೆಯಲ್ಲಿ ಕಾಣಸಿಗುವ ಮಂಜು ಮತ್ತು ಕತ್ತಲಾಗುತ್ತಿದ್ದಂತೆ ಅನುಭವವಾಗುವ ಚಳಿ ಇವೆರಡರ ಮಧ್ಯೆ ಕಣ್ಮನ ಸೆಳೆಯುವ ಪ್ರಕೃತಿಯ ಸೊಬಗು ಇವೆಲ್ಲವೂ ನಿಮ್ಮ ಹನಿಮೂನ್ ಪ್ರವಾಸವನ್ನು ಉತ್ತವಾಗಿಸುತ್ತದೆ.
449,ಮಂಜು ಚಿತ್ರದ ನಿರ್ಮಾಪಕರು.
450,ಈಗಾಗಲೇ ಭೂಮಿಯ ಮೇಲಿನ ಮಂಜು ಕರಗುತ್ತಿದೆ.
451,ಗೋವಾದಲ್ಲಿ ಮಂಜು ಮುಸುಕಿರುವ ಚಿತ್ರ
452,"ಬಿ ಮಂಜು ನಾಥ್, ಮಾಜಿ ಸದಸ್ಯ ಎಂ ಮಹೇಶ್, ಲ್ಯಾಂಪ್ಸ್ ನಿರ್ದೇಶಕ ಕೆ."
453,"ಮಂಜು ಆರ್ಯ, ನ್ಯೂಸ್ 18 ಕನ್ನಡ"
454,ಈ ಎರಡರ ಪರಿಣಾಮದಿಂದ ದೆಹಲಿಯಲ್ಲಿ ದಟ್ಟ ಮಂಜು ಮತ್ತು ತೀವ್ರ ಕೊರತೆಯುವ ಚಳಿಗೆ ಕಾರಣ ಎಂದು ಹವಾಮಾನ ಇಲಾಖೆ ಹೇಳಿದೆ.
455,"ಗಾಳಿಯಲ್ಲಿ, ನೀರಿನ ಹಲವಾರು ಕಿಲೋಮೀಟರ್ ಜಲಪಾತದ ಶತಕೋಟಿ ಹಾರಾಡುವ ಹನಿಗಳು ಮಂಜು ಮಾರ್ಪಡಿಸಿದ್ದು."
456,ಮಂಜು ಬಿಜೆಪಿಗೆ ಹೋಗುವುದಿಲ್ಲ.
457,"ಸಂಕ್ಷಿಪ್ತವಾಗಿ ಹೇಳುವುದಾದರೆ, ಮಂಜು ಮಸಾಜ್ ಮೊಣಕಾಲು ಶಕ್ತಿ, ಚಲನೆಯ ವ್ಯಾಪ್ತಿ ಮತ್ತು ಕಾರ್ಯಕ್ಕಾಗಿ ಪ್ರಯೋಜನಕಾರಿಯಾಗಿದೆ."
458,"ಮಂಜು ಮಾತನಾಡಿ, ಜೆಡಿಎಸ್ ಅಭ್ಯರ್ಥಿ ವಯಸ್ಸು 27, ಆತನ ಚುನಾವಣಾ ಆದಾಯ ಘೋಷಣೆಯಲ್ಲಿ 20 ಹಸುಗಳನ್ನು ಸಾಕಿರುವುದಾಗಿ ತಿಳಿಸಿದ್ದಾರೆ."
459,ಈಗ ಮಂಜು ಅಮುಕಿರುವ ಬೆಳಕು.
460,"ಸಂಘಟನೆ ತಾಲೂಕು ಅಧ್ಯಕ್ಷ, ವಕೀಲರಾದ ಸಂಜಯ ಐಹೊಳ್ಳಿö, ಮಂಜು ಭಜಂತ್ರಿö, ದರ್ಶನ ಮೊಕಾಶಿ, ಹುಲ್ಲಪ್ಪ ಭಜಂತ್ರಿö, ಮಹಾಂತೇಶ ಹೂಗಾರ, ಹನಮಂತ ಮಡಿಕಾರ, ಶ್ರಿÃಧರ ಭಜಂತ್ರಿö, ಸುನೀಲ ಪವಾರ ಇತರರು ಇದ್ದರು."
461,"ಉದ್ಘರ್ಷ ಕನ್ನಡ ಭಾಷೆಯ ಅವತರಣಿಕೆಯನ್ನು ಜಾಕ್ ಮಂಜು ಅವರ ವಿತರಣೆ ಮಾಡಿದ್ರೆ ತಮಿಳು ಭಾಷೆಯ ಉಚ್ಛಕಟಂ ಚಿತ್ರವನ್ನು ಜಾಯ್ ಸನ್ ಆಂಡ್ ಎಜೆಎಸ್​ ಬ್ರದರ್ಸ್ , ತೆಲುಗು ಭಾಷೆಯ ಉದ್ಘರ್ಷಂ ಅನ್ನು ಮಯೂರಿ ಫಿಲ್ಮಂಸ್ ಹಾಗೂ ಮಲಯಾಳಂ ಭಾಷೆಯ ಚಿತ್ರವನ್ನು ಪಲ್ಲವಿ ರಿಲೀಸ್ ನ ಸಾಜೀತ್ ಕುಮಾರ್ ಕೇರಳ ರಾಜ್ಯದಲ್ಲಿ ಬಿಡುಗಡೆ ಮಾಡಲಿದ್ದಾರೆ."
462,ಮನೆ ವಿತರಣೆ ವಿಳಂಬದ ಬಗ್ಗೆ ಸತ್ಯ ಹೇಳಿದರೆ ನಿಮ್ಮ ಬಿಜೆಪಿ ಸರ್ಕಾರದ ಮರ‌್ಯಾದೆ ಹೋಗಲಿದೆ ಎಂದ ಮಂಜು ಸರ್ಕಾರದ ಖಜಾನೆಯಲ್ಲಿ ಹಣವಿಲ್ಲದೆ ದುಡ್ಡು ಬಿಡುಗಡೆಯಾಗಿಲ್ಲ.
463,ಇದರಿಂದ ಕೋಪಗೊಂಡ ತಾಯಿ ಮಂಜು ಮಗುವಿಗೆ ಹೊಡೆದು ನೂಕಿದ್ದಾಳೆ.
464,ಅಲ್ಲಿಗೆ ಮಂಜು ಅವರ ಒಟ್ಟು ಆಸ್ತಿ ಮೌಲ್ಯ 13.
465,ಮಂಜು ಪ್ರಜಾವಾಣಿಗೆ ತಿಳಿಸಿದರು.
466,ಮಂಜು ಜೊತೆ ಮೋಡ - ಬಲವಾದ ಚಂಡಮಾರುತದ ಗಾಳಿಯು ಜೊತೆಗೆ ಇದರಲ್ಲಿ ಸಾಮಾನ್ಯ ವಿದ್ಯಮಾನ.
467,ಬೆಂಗಳೂರು : ಭಾರತೀಯ ವಿಜ್ಞಾನಿಗಳು ಎಚ್‌ಐವಿ ಹೋಗಲಾಡಿಸಲು ತಯಾರಿಸಿರುವ ಲಸಿಕೆಯನ್ನು ಅಮೆರಿಕಾದ ಪ್ರಯೋಗಾಲಯವೊಂದರ ಸಹಯೋಗದೊಂದಿಗೆ ಮಂಗಗಳ ಮೇಲೆ ಪರೀಕ್ಷಿಸಲಾಗುವುದು ಎಂದು ಕೇಂದ್ರ ಜೈವಿಕ ತಂತ್ರಜ್ಞಾನ ಇಲಾಖೆಯ ಕಾರ್ಯದರ್ಶಿ ಮಂಜು ಶರ್ಮ ಹೇಳಿದ್ದಾರೆ.
468,ಇದೀಗ ಸಂಭಾಷಣೆಗಾರರಾಗಿದ್ದ ಮಂಜು ಮಾಂಡವ್ಯ ಭಡ್ತಿ ಪಡೆದುಕೊಂಡು ಮಾಡಿದ ಮಾಸ್ಟರ್ ಪೀಸ್ ಸಿನಿಮಾ ಇದನ್ನು ಬ್ರೇಕ್ ಮಾಡುತ್ತಾ ಅಂತ ಕಾದು ನೋಡಬೇಕು.
