Index,Sentence
509,ವೈದ್ಯ ಪದವಿ ಪಡೆಯುವ ಹಂಬಲ ಹೊಂದಿದ್ದ ಅರ್ಪಣ್​ ತಮ್ಮ 17ನೇ ವರ್ಷದ ಹುಟ್ಟು ಹಬ್ಬದ ನಂತರ ಷೆಫೀಲ್ಡ್ ವಿಶ್ವವಿದ್ಯಾಲಯಕ್ಕೆ ಸೇರ್ಪಡೆಯಾದರು.
510,ಕುಂಭ: ನಿಮ್ಮ ಹುಟ್ಟು ಗುಣ ಸತ್ತರು ಬದಲಾಗಲ್ಲ ಎಂಬಂತೆ ಕೆಲವು ಸಂಧರ್ಭದಲ್ಲಿ ನಿಮ್ಮನು ನೀವು ಅನಿವಾರ್ಯ ಆಗಿರುತ್ತದೆ.
511,panpipes ಹುಟ್ಟು ಕ್ರಿ.
512,ರಮ್ಯಾ ತಮ್ಮ ಹುಟ್ಟು ಹಬ್ಬದ ಅಂಗವಾಗಿ ಇಂದು ಮಂಡ್ಯ ತಾಲೂಕಿನ ಸಾತನೂರು ಗ್ರಾಮದ ಶಾಲಾ ಕಾರ್ಯಕ್ರಮದಲ್ಲಿ ಪಾಲ್ಗೊಂಡು ವಾಪಸ್ಸಾಗುವ ವೇಳೆ ರಮ್ಯಳನ್ನು ತಡೆದು ಗ್ರಾಮಸ್ಥರು ಕಾವೇರಿ ಚಳುವಳಿಯಲ್ಲಿ ಪಾಲ್ಗೊಳ್ಳದೆ ಇರುವುದಕ್ಕೆ ಸಂಬಂಧಿಸಿದಂತೆ ತರಾಟೆಗೆ ತೆಗೆದುಕೊಂಡರು.
513,ಮೊಬೈಲ್ ಮೇನಿಯಾ ಈ ಮಟ್ಟಿಗೆ ಇರುತ್ತದಾ ಎಂಬ ಪ್ರಶ್ನೆ ಹುಟ್ಟು ಹಾಕುವಂತಹ ಘಟನೆಯೊಂದು ಚೀನಾದಲ್ಲಿ ನಡೆದಿದೆ.
514,ಘನಾಕೃತಿ ಹುಟ್ಟು 1906-1907 ವರ್ಷದ ಸೇರಿದೆ.
515,"ಭಗವದ್ಗೀತೆ ಹೇಳುವ ವ್ಯಕ್ತಮಧ್ಯ ಅಥವಾ ಹುಟ್ಟು ಹಾಗೂ ಸಾವಿನ ಮಧ್ಯದ ಅವಧಿಯಲ್ಲಿ ಮನುಷ್ಯನನ್ನು ಕಾಡುವ ಮೂಲಭೂತ ಸಮಸ್ಯೆಗಳನ್ನು ಅರ್ಥೈಸುವ ಹಾಗೂ ಪರಿಹರಿಸುವ ನಿಟ್ಟಿನಲ್ಲಿ ತತ್ವಶಾಸ್ತ್ರಜ್ಞ ಗಂಭೀರವಾಗಿ, ತಾರ್ಕಿಕವಾಗಿ ಯೋಚಿಸುತ್ತಾನೆ."
516,"ಆದಾದ ಮೇಲೆ ಜಗನ್ನಾಥನ ಇಂಗ್ಲೆಂಡ್ ವಿದ್ಯಾಭ್ಯಾಸ: ಫಾರ್‌ಸ್ಟರ್ ಪರಿಚಯ; ನ್ಯೂಲೆಫ್ಟಿನವರ ಜೊತೆ ಸಹವಾಸ; ಉದ್ದ ಕೂದಲು ಸಾದಾ ಡ್ರೆಸ್ಸು ನೀಳ ಮೂಗು ಎತ್ತರ ನಿಲುವು; ಶಾಲಿಗ್ರಾಮ ಸ್ಪರ್ಶ, ಅತ್ಯಾಚಾರ ಪ್ರಯತ್ನ; ಶತಮಾನಗಳ ವಾಸ್ತವ ಬದಲಿಸುವ ಮೊದಲ ಹೆಜ್ಜೆಯ ಆಸ್ತತ್ವವಾದೀ ಥಿಯರಿ; ಮನೆಗೆ ಬಹಿಷ್ಕಾರ; ಭಾರತೀಪುರದ ಆರ್ಥಿಕ ವ್ಯವಸ್ಥೆ ಮುರಿದು ಬಿದ್ದೀತೆಂಬ ವರ್ತಕ ಪ್ರಭುಗಳ ಆತಂಕ; ಮಂಜುನಾಥನ ಭಂಟ ಭೂತರಾಯನ ಸರ್ವವ್ಯಾಜ್ಯ – ಸರ್ವರೋಗ ಪರಿಹಾರ ಶಕ್ತಿ, ಹುಟ್ಟು ಬಂಜೆಯರಿಗೆ ಮಕ್ಕಳು ಕೊಡುವ ಶಕ್ತಿ; ಜಗನ್ನಾಥ ಮುಂದಿನ ಚುನಾವಣೆಗೆ ನಿಲ್ಲುವರೆ?"
517,(ನಮ್ಮಲ್ಲಿಯೂ ಷೇರು ಮಾರುಕಟ್ಟೆ ಮತ್ತು ಕಡಿಮೆಯಾಗುತ್ತಿರುವ ಬಡ್ಡಿ ದರಗಳಿಂದಾಗಿ ಬ್ಯಾಂಕುಗಳು ಹೊಸ ಚೈತನ್ಯ ಹುಟ್ಟು ಹಾಕುತ್ತಿವೆ.
518,ಅಭಿಮಾನಿಗಳ ಒಂದು ದೊಡ್ಡ ಸಂಖ್ಯೆಯ ರಷ್ಯಾದ ಭಾಷೆಯ ಕೈಪಿಡಿಗಳು ಸಮುದಾಯಕ್ಕೆ ತಮ್ಮ ವೈದ್ಯಕೀಯ ಆಧರಿಸಿ ವಿವರವಾದ ರೂಪ ಹುಟ್ಟು ಮೂಡಿಬಂದವು.
519,ಅಜಾತ ೮ – ೬೭ : ಹುಟ್ಟು ಇಲ್ಲದವನು
520,ಜೆ ಎನ್ ಯು ಸಂಸ್ಥೆ ಭಯೋತ್ಪಾದಕರನ್ನು ಹುಟ್ಟು ಹಾಕುತ್ತಿದೆ.
521,ನಟಿಯ ಸಾವು ಹುಟ್ಟು ಹಾಕಿದೆ ಹಲವು ಅನುಮಾನ
522,ಯಡಿಯೂರಪ್ಪ ಅವರ ಹುಟ್ಟು ಹಬ್ಬ ಇದೇ ಫೆ.
523,ಬಗ್ಗೆ ಪಾತ್ರ ತನ್ನ ಹುಟ್ಟು ಮತ್ತು ಪುಸ್ತಕದ ಅಭಿವೃದ್ಧಿ ಸಂಕ್ಷಿಪ್ತ ವಿವರಗಳನ್ನು ಒಳಗೊಂಡಿದೆ:
524,ಆಧುನಿಕತೆಯನ್ನು ವಿವರಿಸಲು ಮತ್ತು ವಿರೋಧಿಸಲು ದೇಸಿ ಎಂಬ ಪರಿಕಲ್ಪನೆಯನ್ನು ಹುಟ್ಟು ಹಾಕಲಾಯಿತು.
525,ಚೆನ್ನೈ ಕ್ರಿಕೆಟ್ ಲೀಗ್ ಎಂಬ ಸಂಸ್ಥೆಂುುನ್ನು ಇಂಡಿಂುುನ್ ಸಿಮೆಂಟ್ ಹುಟ್ಟು ಹಾಕಿ ಕ್ರಿಕೆಟಿಗರಿಗೆ ಪೋತ್ಸಾಹ ನೀಡುತ್ತದೆ.
526,ಹುಟ್ಟು ಸಾವಿನ ಗುಟ್ಟದು ಗುಟ್ಟೇ ಖಂಡಿತ
527,ನಗರದ ಓದುವ ಕೋಣೆ ಹುಟ್ಟು
528,ಹುಟ್ಟು ಹಬ್ಬ ಆಚರಿಸಿಕೊಳ್ಳುತ್ತಿರುವ ಇಂಗ್ಲಿಷ್‌ ಮೇಷ್ಟ್ರಿಗೆ ಅವರ ಶಿಷ್ಯ ಸಮೂಹದವರು ಮತ್ತು ಸ್ನೇಹಿತವರ್ಗದವರೆಲ್ಲ ಸೇರಿ ಸೋಮವಾರ ಸನ್ಮಾನ ಸಮಾರಂಭ ಇಟ್ಟುಕೊಂಡಿದ್ದರು.
529,"ಕುಕ್ಕೆ ಸುಬ್ರಹ್ಮಣ್ಯ ದೇವಸ್ಥಾನದಲ್ಲಿ ಆಚರಿಸುತ್ತಿರುವ ಮಡೆ ಮಡೆ ಸ್ನಾನ ಪದ್ಧತಿ ನಿಷೇಧಿಸುವಂತೆ ಒತ್ತಾಯಿಸಿ ನಿಡಮಾಮಿಡಿ ಸ್ವಾಮೀಜಿ ನಡೆಸುತ್ತಿರುವ ಸತ್ಯಾಗ್ರಹಕ್ಕೆ ಬೆಂಬಲ ವ್ಯಕ್ತಪಡಿಸಿದ ಕಾರ್ಯಕರ್ತರು, ಈ ಪದ್ಧತಿಯು ಜಾತಿಗಳ ನಡುವೆ ತಾರತಮ್ಯವನ್ನು ಹುಟ್ಟು ಹಾಕುತ್ತದೆ."
530,ಕಾಂಗ್ರೆಸ್ ಬಂಡಾಯ ಅಭ್ಯರ್ಥಿಯಾಗಿಯೇ ನಾಮಿನೇಷನ್ ಮಾಡುತ್ತೇನೆ ಎಂದು ಹೇಳುವ ಮೂಲಕ ಮುದ್ದಹನುಮೇಗೌಡರು ಮತ್ತೆ ಗೊಂದಲ ಹುಟ್ಟು ಹಾಕಿದ್ದಾರೆ.
531,"ನಿಮಗೆ ಹುಟ್ಟು ಹಬ್ಬದ ಶುಭಾಶಯಗಳು, ಎಂದು ಬರೆದುಕೊಂಡಿದ್ದರು."
532,"ಅದಕ್ಕೆ ಪ್ರಶ್ನೆ ಮಾಡಿ ಗೊತ್ತು, ಪ್ರಶ್ನೆ ಹುಟ್ಟು ಹಾಕಿ ಗೊತ್ತು, ಪ್ರಶ್ನೆಗಳ ಸಮೇತವೇ ಸಂಚರಿಸುವಂತೆ ಮಾಡುವುದು ಗೊತ್ತು."
533,"ಜೀವಮಂಡಲದ ಸ್ವಾಭಾವಿಕ ಬೆಳವಣಿಗೆಯ ಹಾದಿಯಲ್ಲಿ ಮಾನವ ನಾಗರಿಕತೆಯ ಹುಟ್ಟು ಬೇಸ್ ತಯಾರು, ಜನರು ಬೆಳೆಗಳ, ಖನಿಜಗಳು ಬಳಸಲು ಸೆಳೆದಿವೆ."
534,"ನಮ್ಮ ಕನ್ನಡ ಚಿತ್ರರಂಗದ ಶ್ರೇಷ್ಠ ನಟ, ನಿರ್ದೇಶಕ, ಹಾಗೂ ರಾಷ್ಟ್ರಪ್ರೇಮಿ ಮತ್ತು ನಮ್ಮೆಲ್ಲರಿಗೂ ಸ್ಫೂರ್ತಿಯಾಗಿರುವ ನಮ್ಮ The legend ಶಂಕರ್ ನಾಗ್ ಸರ್ ಅವರಿಗೆ ಹುಟ್ಟು ಹಬ್ಬದ ಶುಭಾಶಯಗಳು."
535,"ಆದರೆ ಮೆಸೆಂಜರ್ ಆಫ್ ಗಾಡ್ ಸಿನಿಮಾದಲ್ಲಿ ಬಾಬಾಗೆ ಹೀರೋಯಿನ್ ಆಗಿ ಹನಿಪ್ರೀತ್ ಕಾಣಿಸಿಕೊಂಡಿದ್ದು, ಸಾಕಷ್ಟು ಅನುಮಾನಗಳನ್ನು ಹುಟ್ಟು ಹಾಕಿದೆ."
536,ಹುಟ್ಟು ಹಾಗೂ ಸಾವಿನ ನಡುವೆ ಇದ್ದಷ್ಟು ದಿನಗಳು ಧಾರ್ಮಿಕ ಕಾರ್ಯಗಳಲ್ಲಿ ತೊಡಗಿ ಬದುಕನ್ನು ಸಾರ್ಥಕಪಡಿಸಿಕೊಳ್ಳಬೇಕು.
537,"ಯಾಕೆಂದರೆ ಅಲ್ಲಿದ್ದವರಿಗೆಲ್ಲಾ ವಯಸ್ಸೆಷ್ಟೇ ಇದ್ದರೂ ತಮ್ಮ ಮಾಂತ್ರಿಕ ದಂಡದಿಂದ ಅವರದ್ದು ಯುವ ಮನಸ್ಸಾಗಿ ಮಾಡಿಬಿಡುವ, ಅವರಲ್ಲಿ ತುಂಟತನ ಹುಟ್ಟು ಹಾಕಿಬಿಡುವ ತಾಖತ್ತು ಅವರಲ್ಲಿ ಇತ್ತು- ಅವರು ವಾಜಪೇಯಿ, ಗೋಪಾಲ ವಾಜಪೇಯಿ."
538,ಸದಾನಂದ ಗೌಡ ಅವರು ತಮಗೆ ರಾಜಕೀಯ ಹುಟ್ಟು ನೀಡಿದ ದಕ್ಷಿಣ ಕನ್ನಡ ಜಿಲ್ಲೆಯ ಪುತ್ತೂರಿನ ಸಂಬಂಧ ಕಡಿದುಕೊಂಡರೇ?
539,ರಾಜ್‌ ಕುಮಾರ್‌ ಅವರ 88ನೇ ಹುಟ್ಟು ಹಬ್ಬದ ದಿನ ರಾಜ್‌ ಅವರ ಡೂಡಲ್‌ ಪ್ರದರ್ಶಿಸುವ ಮೂಲಕ ಗೌರವ ಸಲ್ಲಿಸಿದ್ದಾರೆ.
540,ರೇಡಿಯೊ ಹುಟ್ಟು
541,ಹಲವು ಪ್ರಶ್ನೆಗಳನ್ನು ಹುಟ್ಟು ಹಾಕಿದೆ ಪೈಲ್ವಾನ್ ಸೆಟ್‍ನ ಫೋಟೋ
542,"ಈಗಾಗಲೇ ಚಿತ್ರ ನೂರು ನಿರೀಕ್ಷೆಗಳನ್ನು ಹುಟ್ಟು ಹಾಕಿದ್ದು, ಮೊದಲ ಬಾರಿಗೆ ಶಿವಣ್ಣನವರು ದೃಷ್ಟಿ ವಿಕಲಚೇತನ ಪಾತ್ರವನ್ನು."
543,ಹೆಣ್ಣು ಮಕ್ಕಳ ಮೇಲಿನ ದೌರ್ಜನ್ಯವನ್ನು ತಡೆಗಟ್ಟಲು ಒಂದು ಸಂಸ್ಥೆಯನ್ನು ಹುಟ್ಟು ಹಾಕಿದರು.
544,"ಅವರು ಗೋಥಿಕ್ ಇಟ್ಟಿಗೆಯ ಮೇಲೆ ಹುಟ್ಟು ಆಧಾರವಾಗಿ, ಇದು, ವಾಸ್ತವವಾಗಿ, ಕೋಟೆ ಮತ್ತು ಮರಣದಂಡನೆ ಕಾರ್ಯನಿರ್ವಹಿಸಿದರು."
545,ಇದೇ ಕಾರಣದಿಂದ ಸಂವಿಧಾನದ ಆಶಯದಂತೆ ಪ್ರಜಾಪ್ರಭುತ್ವ ವ್ಯವಸ್ಥೆಯಲ್ಲಿ ನೈಜ ರಾಜಕೀಯ ಶಕ್ತಿಯನ್ನು ಮತ್ತು ಮೌಲ್ಯಾಧಾರಿತ ರಾಜಕಾರಣವನ್ನು ಪರಿಚಯಿಸುವುದಕ್ಕಾಗಿ ವೆಲ್‌ಫೇರ್ ಪಾರ್ಟಿ ಆಫ್ ಇಂಡಿಯಾವನ್ನು ಹುಟ್ಟು ಹಾಕಲಾಗಿದೆ ಎಂದು ಪ್ರೊ.
546,ಇಪ್ಪತ್ಮೂರನೇ ಹುಟ್ಟು ಹಬ್ಬ (sep7-1986) ಆಚರಿಸಬೇಕೆಂದಿದ್ದವಳು ಆ ದಿನಕ್ಕೆ ಎರಡು ದಿನದ ಹಿಂದೆ ಭಯೋತ್ಪಾದಕರ ಗುಂಡಿಗೆ ಬಲಿಯಾಗ್ತಾಳೆ.
547,ಮೂವರ ವ್ಯಕ್ತಿಗತ ಮಹತ್ವಾಕಾಂಕ್ಷೆಗಳು ನಾಗಾ ಪೀಪಲ್ಸ್ ಫ್ರಂಟ್ಅನ್ನು ಒಡೆದು ರಾಜಕೀಯ ಅಸ್ಥಿರತೆಯನ್ನು ಹುಟ್ಟು ಹಾಕಿವೆ.
548,ಮನೆಗೆ ಬಂದ ಮೇಲೆ ಹುಟ್ಟು ಹಬ್ಬಕ್ಕೆಂದು ಬೇರೆಉಡುಗೊರೆ ಕೊಡುತ್ತೇನೆ.
549,"25: ತೀನರಸೀಪುರ ಪಟ್ಟಣದ ಹಲವು ಸಂಘ ಸಂಸ್ಥೆಗಳ ಸಹಕಾರದೊಂದಿಗೆ ನಗೆಹಬ್ಬ, ಕನ್ನಡ ರಾಜ್ಯೋತ್ಸವ ಹಾಗೂ ವಾಟಾಳು ಶ್ರೀ ಸಿದ್ದಲಿಂಗಶಿವಚಾರ್ಯಸ್ವಾಮಿಜೀಗಳ 69 ನೇ ಹುಟ್ಟು ಹಬ್ಬವನ್ನು ಆಚರಿಸಲಾಯಿತು."
550,"ಯಾವುದೇ ಇರಲಿ ಕನ್ಯಾ ರಾಶಿಯನ್ನು ಎಲ್ಲ ರಾಶಿಯ ತಾಯಿ ಎಂದು ಕರೆಯುವರು, ಅವರ ಪೋಷಣೆಯ ಹುಟ್ಟು ಗುಣ ಮಿತಿ ಮೀರಿದ ರೀತಿ ಆಗಿರುವುದರಿಂದ, ಕೆಲವೊಮ್ಮೆ ಇವರನ್ನು ಪ್ರೀತಿಯಲ್ಲಿ ಕುರುಡರನ್ನಾಗಿಸಿ ಬಿಡುತ್ತದೆ ."
551,"ಜೀವನದಲ್ಲಿ ಸು:ಖ-ದು:ಖ, ಹುಟ್ಟು ಸಾವು ಎಲ್ಲವು ಬೇಕು."
552,"ತ್ರಿವಳಿಗಳ ಹುಟ್ಟು ಅಸಾಮಾನ್ಯ ಘಟನೆಯಾಗಿದೆ, ಇದು ಬಹಳ ವಿರಳವಾಗಿ ನಡೆಯುತ್ತದೆ."
553,ರಾಯಲ್ ಆಯ್ಕೆಯನ್ನು ಹುಟ್ಟು
554,"ಕ್ರೌರ್ಯದ ಕಾವನ್ನು ತಣಿಸುವುದು ಮತ್ತು ಜನರಲ್ಲಿ ಗೊಂದಲವನ್ನು ಹುಟ್ಟು ಹಾಕಿ, ಅಪರಾಧಿಗಳು ತಪ್ಪಿಸಿಕೊಳ್ಳುವಂತೆ ನೋಡಿಕೊಳ್ಳುವುದೇ ಈ ಬಗೆಯ ವರ್ತನೆಗಳ ಮೂಲ ಉದ್ದೇಶವಾಗಿದೆ ಎಂದೇ ಇದನ್ನು ಅರ್ಥೈಸಬೇಕಾಗುತ್ತದೆ."
555,ನಾಕುತಂತಿ ಧಾರಾವಾಹಿಯಿಂದಾಗಿ ಧಾರವಾಡದಲ್ಲಿ ಮಹಿಳೆಯರು ಒಂದು ಸಂಘಟನೆಯನ್ನೇ ಹುಟ್ಟು ಹಾಕಿದ್ದಾರೆ.
556,"ಕಳೆದ ವರ್ಷ ವಿರಾಟ್ ಕೊಹ್ಲಿ ಹರಿದ್ವಾರದಲ್ಲಿರೋ ಅನಂತ್ ಧಾಮ ಆತ್ಮಬೋದ ಆಶ್ರಮದಲ್ಲಿ, ಪರಮ ಶಿವನಿಗೆ ಪೂಜೆ ಸಲ್ಲಿಸೋ ಮೂಲಕ ತಮ್ಮ ಹುಟ್ಟು ಹಬ್ಬವನ್ನ ಆಚರಿಸಿಕೊಂಡಿದ್ರು."
557,ಈ ಮಾರಕ ದಾಳಿಗಳನ್ನು ಯಾರು ಹುಟ್ಟು ಹಾಕಿದರು ಎಂಬ ಪ್ರಶ್ನೆಗೆ ಯಾರಲ್ಲೂ ಉತ್ತರವಿಲ್ಲ.
558,ರಾಜ್ಯದಲ್ಲಿ ಮಾನವ ಬಂಧುತ್ವ ವೇದಿಕೆಯನ್ನು ಹುಟ್ಟು ಹಾಕಿ ಮೌಡ್ಯ ಆಚರಣೆಯ ವಿರುದ್ಧ ರಾಜ್ಯಾದ್ಯಾಂತ ಹೋರಾಟ ನಡೆಸಿ ಮೌಢ್ಯ ವಿರೋಧಿಯಾಗಿರುವ ಸತೀಶ ಜಾರಕಿಹೊಳಿ ಅವರು ಮೂರು ವರ್ಷಗಳ ಕಾಲ ಸಚಿವರಾಗಿ ಕೆಲಸ ಮಾಡಿದಾಗ ಸರಕಾರಿ ಕಾರ್ಯಕ್ರಮಗಳನ್ನು ಉದ್ಘಾಟಿಸುವಾಗ ತಾವು ದ್ವೀಪ ಬೆಳಗಿಸಿ ಉದ್ಘಾಟಿಸದೆ ಇನನೊಬ್ಬರ ಕೈಯಿಂದ ಉದ್ಘಾಟನೆ ಮಡಿಸುತ್ತಿದ್ದ ಸತೀಶ ಜಾರಕಿಹೊಳಿ ಅವರು ಎಐಸಿಸಿ ಕಾರ್ಯದರ್ಶಿಯಾಗಿ ತಾವು ಮೌಡ್ಯ ವಿರೋಧಿಯಲ್ಲ ಎಂದು ಸಮಾಜಕ್ಕೆ ಸಂದೇಶ ರವಾನಿಸಿದ್ದಾರೆ.
559,ಈ ಮಂಟಪವನ್ನು ಹೇಗೆ ನಿರ್ಮಿಸಲಾಗಿದೆ ಎಂದರೆ ಅಕ್ಟೋಬರ್ 2 ಗಾಂಧೀಜಿಯವರ ಹುಟ್ಟು ದಿನದಂದು ಪ್ರಥಮ ಸೂರ್ಯ ಕಿರಣವು ಅವರ ಅಸ್ಥಿ ಇರಿಸಿದ ಜಾಗದಲ್ಲೆ ಬೀಳುತ್ತದೆ.
560,ಮುನಿರಾಜು ಅವರಿಗೆ ಹುಟ್ಟು ಹಬ್ಬದ ಶುಭಕೋರಿದರು.
561,"ಅದು ಏನೇ ಇರಲಿ, ಅಲ್ಲೇ ಇದ್ದ ಅವರ ತಂದೆಗೆ ಮಾಹಿತಿ ನೀಡದೆ ಮೃತದೇಹವನ್ನು ಆಸ್ಪತ್ರೆಗೆ ಸಾಗಿಸಿರುವುದು ಅನುಮಾನಗಳನ್ನು ಹುಟ್ಟು ಹಾಕಿದೆ."
562,ಹುಟ್ಟು : ಅಥಣಿ ಪರಿಸರದ ವಾಲ್ಮೀಕಿ ಸಮುದಾಯದಲ್ಲಿ ಯಾವುದೇ ಕುಟುಂಬದಲ್ಲಿ ಒಬ್ಬ ಸ್ತ್ರೀಯು ಮಗುವನ್ನು ಹೆರುವ ಸಂದರ್ಭದಲ್ಲಿ ಬಂಧು ಬಳಗದವರೆಲ್ಲರು ಮತ್ತು ಸೂಲಗಿತ್ತಿಯರು ಸೇರಿಕೊಂಡು ಆಕೆಗೆ ಮಕ್ಕಳನ್ನು ಹೆತ್ತ ಅನುಭವ ಇರುವ ಸ್ತ್ರೀಯರು ಮೊದಲಿಗೆ ಆಕೆಗೆ ತಿಳುವಳಿಕೆ ಹೇಳುವುದರ ಜೊತೆಗೆ ಧೈರ್ಯವನ್ನು ಕೊಡುತ್ತಿರುತ್ತಾರೆ.
563,ನಿನ್ನೆ ಮೂವರು ಕೂಡ ಸೋಹಾ ಅಲಿ ಖಾನ್ ಹುಟ್ಟು ಹಬ್ಬದ ಸಂಭ್ರಮದಲ್ಲಿ ಒಟ್ಟಿಗೆ ಭಾಗಿಯಾದರು.
564,ಪ್ರತಿ ಸಾರಿ ಮಾರುಕಟ್ಟೆಗೆ ಬರುವಾಗಲು ಒಂದಿಷ್ಟು ಕೌತುಕಗಳನ್ನ ಹುಟ್ಟು ಹಾಕುವುದು ಆಪಲ್ ಗೆ ಸಾಮಾನ್ಯ ವಿಷಯ.
565,"ಇತ್ತೀಚೆಗೆ ಕೆಲವು ಅಭಿಮಾನಿಗಳು ನನ್ನ ಹುಟ್ಟು ಹಬ್ಬದ ಪ್ರಯುಕ್ತ ನನ್ನ ಮನೆಯ ಹತ್ತಿರ ಆಹಾರ ಪದಾರ್ಥಗಳನ್ನು ತಂದು ನೀಡುತ್ತೇವೆ, ಅದನ್ನು ಸಿದ್ದಗಂಗಾ ಮಠ ಹಾಗೂ ಕೆಲವು ಅನಾಥಾಶ್ರಮಕ್ಕೆ ತಲುಪಿಸಿ ಎಂದು ಕೇಳಿಕೊಂಡು ಫೇಸ್ ಬುಕ್ ನಲ್ಲಿ ವಿಡಿಯೋ ಮಾಡಿ ಬಿಟ್ಟಿರುವುದು ತುಂಬಾ ಸಂತೋಷದ ವಿಷಯ, ನನ್ನ ಹುಟ್ಟು ಹಬ್ಬಕ್ಕೆ ನೀವುಗಳು ಕೊಡುತ್ತಿರುವ ಉಡುಗೊರೆ ಎಂದು ತಿಳಿದು ಅದನ್ನು ಪ್ರತಿ ಜಿಲ್ಲೆಯ ಒಂದು ಅನಾಥಾಶ್ರಮಕ್ಕೆ, ಒಂದು ವೃದ್ಧಾಶ್ರಮಕ್ಕೆ ಹಾಗೂ ಸಿದ್ದಗಂಗಾ ಮಠಕ್ಕೆ ತಲುಪಿಸುವ ಜವಾಬ್ದಾರಿಯನ್ನು ತುಂಬಾ ಸಂತೋಷದಿಂದ ನಾನೇ ತೆಗೆದು ಕೊಳ್ಳುತ್ತೇನೆ."
566,ಬಜಾಜ್ ಚೇತಕ್ ಎಲೆಕ್ಟ್ರಿಕ್ ಸ್ಕೂಟರ್ ಭಾರತೀಯರಲ್ಲಿ ಬಹುನಿರೀಕ್ಷೆಯನ್ನು ಹುಟ್ಟು ಹಾಕಿದೆ.
567,"ಚಿಟ್ಟೆಗಳ ಬಗ್ಗೆ ಆಸಕ್ತಿಕರ ವಿಷಯಗಳು, ನೀವು ಅಸಾಮಾನ್ಯ ಕೀಟ ಹುಟ್ಟು ಹಂತಗಳಲ್ಲಿ ಬಗ್ಗೆ ಹೇಳುವ, ಹೇಳಬಲ್ಲೆ."
568,ಸ್ವತಂತ್ರ ಪದ್ಯ ಹುಟ್ಟು
569,ಬಸ್ ನಿಲ್ದಾಣದಿಂದ ಹುಟ್ಟು ಕಾಮೇಶ್ವರ ದೇವಸ್ಥಾನದ ಎರಡೂ ಬದಿಯಲ್ಲಿ ವಿದ್ಯುತ್ ದೀಪಗಳನ್ನು ಅಳವಡಿಸಲಾಗಿತ್ತು.
570,ಸಣ್ಣಾಟಗಳು: ಹುಟ್ಟು – ಬೆಳವಣಿಗೆ (೨)
571,ನಗರದ ಹುಟ್ಟು ಆರಂಭದಲ್ಲಿ ಬಗ್ಗೆ
572,ಹಾಗೆಯೇ ನನ್ನ ಕಡೆಯಿಂದ ನಿಮ್ಮ ಅಮ್ಮನಿಗೆ ಹುಟ್ಟು ಹಬ್ಬದ ಶುಭಾಶಯಗಳು ಎಂದು ಕಮೆಂಟ್ ಮಾಡಿದರೆ ಇನ್ನೂ ಕೆಲವರು ಅನುಷ್ಕಾ ಕನ್ನಡದಲ್ಲಿ ಸಿನಿಮಾ ಮಾಡದಿದ್ದರೆ ಏನಂತೆ?
573,ಹುಟ್ಟು ಹೋರಾಟಗಾರನಾಗಿ ದಲಿತ ಸಮಾಜದ ಏಳ್ಗೆಗಾಗಿ ಶ್ರಮಿಸಿದ ವ್ಯಕ್ತಿಯಾಗಿದ್ದರು ಎಂದರು.
574,ಕಾಡಿನಿಂದ ನಾಡಿಗೆ ಆಹಾರ ಅರಸಿ ಬಂದ ಚಿರತೆ ಕಂಚುಕಲ್ ಗ್ರಾಮಸ್ಥರಲ್ಲಿ ಭಯವನ್ನು ಹುಟ್ಟು ಹಾಕಿತ್ತು.
575,ಎಲ್ಲವೂ - ಫೇರೋಗಳು ನಿಂದ ಸರಳ ರೈತರ ಹುಟ್ಟು ಸಾವಿನ ನಂತರ ತನ್ನ ಮುಂದಿನ ಜೀವನದ ಆರೈಕೆಯನ್ನು ಆರಂಭಿಸಿದರು.
576,ಈ ವಾಸ್ತವವಾಗಿ ಪುರುಷ ಜನನಾಂಗದ ರಚನೆ ಉರಿಯೂತದ ಪ್ರಕ್ರಿಯೆಗಳು ಹುಟ್ಟು ದಾರಿಯ ಎಂಬುದನ್ನು ಕಾರಣ.
577,ಉಪೇಂದ್ರ ಕಳೆದ ವಿಧಾನಸಭೆ ಚುನಾವಣೆಗೆ ಮುನ್ನ ಪ್ರಜಾಕೀಯ ಎನ್ನುವ ಹೆಸರಿನಲ್ಲಿ ಕರ್ನಾಟಕ ಪ್ರಜಾ ಜನತಾ ಪಕ್ಷ (ಕೆಪಿಜೆಪಿ) ಎನ್ನುವ ಪಕ್ಷ ಹುಟ್ಟು ಹಾಕಿದ್ದ ಉಪೇಂದ್ರ ವಿಧಾನಸಭೆ ಚುನಾವಣೆ ಘೋಷಣೆಯಾಗುವ ವೇಳೆಗೆ ಪಕ್ಷದ ಅಧ್ಯಕ್ಷರ ನಡುವೆ ಉಂಟಾದ ಭಿನ್ನಾಭಿಪ್ರಾಯಗಳಿಂದ ಪಕ್ಷದಿಂದ ಹೊರ ಬಂದಿದ್ದರು.
578,ಚಿಕ್ಕಮಗಳೂರು ಪೊಲೀಸ್ ಇಲಾಖೆ ನೀಡಿದ ನೋಟಿಸ್ ಸಾಕಷ್ಟು ವಿವಾದ ಹುಟ್ಟು ಹಾಕಿದೆ.
579,ನಟ ರಾಕಿಂಗ್​​ಸ್ಟಾರ್​ಗೂ ಮುನ್ನ ನಟಿ ರಾಧಿಕಾ ಪಂಡಿತ್​ ಕೂಡ ತಮ್ಮ ಮಗಳ ಹುಟ್ಟು ಹಬ್ಬಕ್ಕೆ ವಿಶೇಷವಾಗಿ ಶುಭಾಶಯ ಕೋರಿದ್ದರು.
580,ಕೇಂದ್ರ ಹಣಕಾಸು ಸಚಿವ ಅರುಣ್ ಜೇಟ್ಲಿ ಅವರಿಗೆ ಇಂದು 62ನೇ ಹುಟ್ಟು ಹಬ್ಬದ ಸಂಭ್ರಮ.
581,12: ಈಗಾಗಲೇ ಒಂಥರಾ ಸೆನ್ಸೇಷನಲ್ ಹುಟ್ಟು ಹಾಕಿರುವ ತುಳು ಮೂವಿ ಉಮಿಲ್ ಹಿಂದಿಗೇ ಡಬ್ ಆಗುತ್ತಿದೆ.
582,ಇರಬೇಕಲ್ಲ ಹುಟ್ಟು ಸಾವಿನ ಅನಂತ.
583,"ಈ ಶತಮಾನದ ಆರಂಭದ ದಶಕದಲ್ಲಿ ಶಾಲೆ ಮತ್ತು ವಾಚನಾಯಲಗಳನ್ನು ಹುಟ್ಟು ಹಾಕಿದ ಕ್ರಾಂತಿಕಾರಕ ಚಳುವಳಿಗಳು ಕೇರಳದ ಜನತೆಯನ್ನು ಎಚ್ಚರಿಸಿ, ಅವರನ್ನು ಸಾಕ್ಷರರನ್ನಾಗಿಸಿತು."
584,ಆದರೆ ಇದೇ ಮೊದಲ‌ ಬಾರಿಗೆ ಅವರು ಅಭಿಮಾನಿಗಳೊಂದಿಗೆ ತಮ್ಮ ಹುಟ್ಟು ಹಬ್ಬವನ್ನು ಆಚರಿಸಿಕೊಳ್ಳದೆ ದೂರದ ಲಂಡನ್ ನಲ್ಲಿ ತಮ್ಮ ಭುಜದ ಶಸ್ತ್ರ.
585,"ಇದು ಗಮನಿಸಬೇಕು ಹೊಸ ಸಸ್ಯಗಳು, ಪ್ರಾಣಿಗಳು, ಸೂಕ್ಷ್ಮಾಣುಜೀವಿಗಳು ಬೂಷ್ಟು ಹಾಗೂ ಪರಿಸ್ಥಿತಿಗಳಿಗೆ ರಚನೆಗೆ ಹುಟ್ಟು - ಸಾಕಷ್ಟು ದೀರ್ಘ ಪ್ರಕ್ರಿಯೆ, ಮತ್ತು ಹತ್ತಾರು, ನೂರಾರು, ಅಥವಾ ಸಾವಿರಾರು ವರ್ಷಗಳಿಂದ ಮುಂದುವರಿಸಬಹುದು."
586,"ಕರ್ನಾಟಕವು ಇತ್ತೀಚೆಗೆ ಹಿಂದೆಂದೂ ಕಂಡು ಕೇಳರಿಯದ ನೈಸರ್ಗಿಕ ವಿಕೋಪಕ್ಕೆ ತುತ್ತಾಗಿದ್ದು, ಕೇಂದ್ರ ಸರ್ಕಾರದಿಂದ ನಿರೀಕ್ಷೆಯ ನೆರವು ದೊರಕಲಿಲ್ಲ ಮತ್ತು ಬಂದಿರುವ ನೆರವೂ ಭೀಮನಹೊಟ್ಟೆಗೆ ಕಾಸಿನ ಮಜ್ಜಿಗೆಯಂತಾಗಿದೆ ಎನ್ನುವ ಆರೋಪದ ಹಿನ್ನೆಲೆಯಲ್ಲಿ, ನಮ್ಮಲ್ಲೂ ಪ್ರಾದೇಶಿಕ ಪಕ್ಷದ ಅಧಿಕಾರ ಇದ್ದಿದ್ದರೆ, ಎನ್ನುವ ಚಿಂತನೆಯನ್ನು ಹುಟ್ಟು ಹಾಕಿದೆ."
587,ಆದರೆ ಬಿಡುಗಡೆಗೂ ಮುನ್ನವೇ ಹೊಸ ಸ್ಮಾರ್ಟ್‌ಫೋನ್‌ನ ಫೀಚರ್ಸ್‌ ಲೀಕ್‌ ಆಗಿದ್ದು ಮಾರುಕಟ್ಟೆಯಲ್ಲಿ ಬಾರಿ ನಿರೀಕ್ಷೆಯನ್ನ ಹುಟ್ಟು ಹಾಕಿದೆ.
588,೧೯೫೬ರಲ್ಲಿ ಗುರೂಜಿಯವರ ೫೦ನೇಯ ಹುಟ್ಟು ಹಬ್ಬ.
589,"ಮಾರುಕಟ್ಟೆಗೆ ಕಳೆದ ಕೆಲವು ದಿನಗಳಿಂದ ಯಾವುದೇ ಹೊಸ ಸ್ಮಾರ್ಟ್‌ಫೋನ್‌ಗಳನ್ನು ಬಿಡುಗಡೆ ಮಾಡದ ಚೀನಾ ಮೂಲದ ಸ್ಮಾರ್ಟ್‌ಫೋನ್ ತಯಾರಿಕ ಕಂಪನಿ ಲಿನೊವೊ, ಈ ಬಾರಿ ಹೊಸದೊಂದು ಸ್ಮಾರ್ಟ್‌ಫೋನಿನೊಂದಿಗೆ ಕಾಣಿಸಿಕೊಂಡಿದ್ದು, ಈ ಸ್ಮಾರ್ಟ್‌ಫೋನ್ ಮಾರುಕಟ್ಟೆಯಲ್ಲಿ ಹೊಸ ಅಲೆಯನ್ನು ಹುಟ್ಟು ಹಾಕಲಿದೆ ಎನ್ನುವ ಮಾತು ಕೇಳಿ ಬಂದಿದೆ."
590,ಅವುಗಳ ಹುಟ್ಟು ಮತ್ತು ಚರಿತ್ರೆಯ ಬಗ್ಗೆ ಹಿಂದೆ (ಸೆಪ್ಟೆಂಬರ್‌ 2000ದಲ್ಲಿ ಟೆಕ್ಸಸ್‌ ಸಂಸ್ಥಾನದ ಹ್ಯೂಸ್ಟನ್‌ ನಗರಿಯಲ್ಲಿ ನಡೆದ ವಿಶ್ವಸಮ್ಮೇಳನದ ಸ್ಮರಣ ಸಂಚಿಕೆಯಲ್ಲಿ) ಬರೆದಿರುವೆನಾದ್ದರಿಂದ ಪುನಃ ಬರೆಯುವ ಗೋಜಿಗೆ ಹೋಗುವುದಿಲ್ಲ.
