Index,Sentence
331,"ಅವರಿಗೆ ತಾಯಿ ಚಾಮುಂಡೇಶ್ವರಿ ಆಯಸ್ಸು,ಆರೋಗ್ಯ ಯಶಸ್ಸು ಕರುಣಿಸಲಿ ಎಂದು ಪ್ರಾರ್ಥಿಸಿ ಸಾರ್ವಜನಿಕರಿಗೆ ಸಿಹಿ ಹಂಚುವ ಮುಖಾಂತರ ಮೈಸೂರು ನಗರ ಬಿಜೆಪಿ ಕಛೇರಿಯಲ್ಲಿ ಹುಟ್ಟು ಹಬ್ಬವನ್ನು ಆಚರಿಸಲಾಯಿತು."
332,"ಇವತ್ತು ನನ್ನ ಹುಟ್ಟು ಹಬ್ಬ ಸಂಜೆ 6ಕ್ಕೆ, ನೀವು ಬರಲೇಬೇಕು ಕಣ್ರೀ, ಅಂಗೇ…"
333,"ಟೆಲಿಕಾಂ ಮಾರುಕಟ್ಟೆಯಲ್ಲಿ ಹೊಸ ಅಲೆಯನ್ನು ಹುಟ್ಟು ಹಾಕಿದ ಮಾದರಿಯಲ್ಲಿ ಜಿಯೋ, ಡೇಟಾ ಕಾರ್ಡ್ ಮಾರುಕಟ್ಟೆಯಲ್ಲಿಯೂ ಹುಟ್ಟುಹಾಕಿತ್ತು."
334,ಮಹಾವಿದ್ಯಾಲಯದಲ್ಲಿ ಹೊಸತನ ಎಂಬ ಸಂಸ್ಥೆಯನ್ನು ಹುಟ್ಟು ಹಾಕಬೇಕು.
335,ನಂತರ ಬಂದ ಸಂಪುಟಗಳು ಅದರಲ್ಲಿಯೂ ಐದರಿಂದ ಹನ್ನೆರಡು ಸಂಪುಟಗಳು ಪೌರ್ವಾತ್ಯ ದೇಶಗಳ ಸಮುದಾಯ ಪ್ರಜ್ಞೆಗಳ ಜೊತೆಗೆ ಪಾಶ್ಚಾತ್ಯ ವಸಾಹತುಗಳು ಹುಟ್ಟು ಹಾಕಿದ ಅಧಿಕಾರ ಜ್ಞಾನಗಳಿಗೆ ಸಂಬಂಧಿಸಿದ ವಿಮರ್ಶೆಗಳನ್ನು ಸಬಾಲ್ಟರ್ನ್ ಅಧ್ಯಯನದ ಗುರುತೆಂದು ಪರಿಗಣಿಸಿದ ವಿಚಾರವು ಸರ್ಕಾರ್ ಅವರ ತೀವ್ರವಾದ ಅಸಮಾಧಾನಕ್ಕೆ ಕಾರಣವಾಯಿತು.
336,"ಕಾಂಗ್ರೆಸ್ ಮತ್ತು ಬಿಜೆಪಿಗಳು ಹಲವು ವರ್ಷಗಳಿಂದ ಹುಟ್ಟು ಹಾಕಿದ ಹಲವು ಗೋಜಲು, ಗೊಂದಲಗಳನ್ನೆಲ್ಲಾ ತಿಳಿಗೊಳಿಸಬೇಕಾಗುತ್ತದೆ."
337,ಈ ಸಂಬಂಧ ಹುಟ್ಟು ಹಾಕಿರುವ ವಿವಾದಗಳಿಗೆ ನಿಮ್ಮ ಅಭಿಪ್ರಾಯಗಳನ್ನು ಮಂಡಿಸಿ…
338,ಈಗ ಜಗತ್ತಿನ ನಂಬರ್ ಒನ್ ಶೂ ಬ್ರಾಂಡ್ ಆಗಿರುವ ನೈಕಿಯ ಹುಟ್ಟು ಬೆಳವಣಿಗೆಯ ಪ್ರತೀ ಹೆಜ್ಜೆಯೂ ದಾಖಲಾಗಿರುವ ಈ ಪುಸ್ತಕವನ್ನು ಹೆಚ್ಚಿನ ಮಾಹಿತಿಗೆ ಓದಬಹುದು.
339,"ಸಾಮಾನ್ಯವಾಗಿ ಶ್ರೇಷ್ಠ ಕವಿ, ಸಾಹಿತಿ ಅಥವಾ ವಿಮರ್ಶಕರ ಹುಟ್ಟು ಹಬ್ಬದ ಸಮಾರಂಭಗಳಲ್ಲಿ ಭಾಷಣಗಳಿಗೆ, ವ್ಯಕ್ತಿ ಪ್ರಶಂಸೆಗೆ ಹೆಚ್ಚು ಮಹತ್ವ ನೀಡಲಾಗುತ್ತದೆ."
340,ಅವನ ಮಾತುಗಳು ನನ್ನ ಮನದಲ್ಲಿ ಕೆಲವೊಂದು ಪ್ರಶ್ನೆಗಳನ್ನು ಹುಟ್ಟು ಹಾಕಿದವು.
341,"ಬೆಂಗಳೂರು: ಸಾವಿರಾರು ಅಭಿಮಾನಿಗಳು, ಕಾಂಗ್ರೆಸ್ ಕಾರ್ಯಕರ್ತರ ಜೈಕಾರ, ಹಷೋದ್ಘಾರಗಳ ನಡುವೆ ರೆಬಲ್ ಸ್ಟಾರ್ ಅಂಬರೀಷ್ ತಮ್ಮ 60ನೇ ಹುಟ್ಟು ಹಬ್ಬವನ್ನು ಭಾನುವಾರ ಸಂಭ್ರಮದಿಂದ ಆಚರಿಸಿಕೊಂಡರು."
342,"ಹಾಗೆಯೇ ರೈತರು, ಮಹಿಳೆಯರು, ಶೋಷಿತರಿಗೆ ಹೆಚ್ಚಿನ ಬೆಂಬಲ ನೀಡುವ ಯೋಜನೆಗಳನ್ನು ಜಾರಿಗೊಳಿಸಲು ಸಿದ್ದರಾಮಯ್ಯ ಈಗಾಗಲೇ ತೀರ್ಮಾನಿಸಿದ್ದು, ಶುಕ್ರವಾರ ಮಂಡನೆ ಯಾಗುವ ಬಜೆಟ್ ನಿರೀಕ್ಷೆ ಹುಟ್ಟು ಹಾಕಿದೆ."
343,ಬೇರೆ ಬೇರೆ ರಾಜ್ಯಗಳ ರಾಜಕೀಯ ಪಕ್ಶಗಳು ಸೇರಿಕೊಂಡು ಹುಟ್ಟು ಹಾಕಲು ಯೋಚಿಸಿದ ರಾಜಕೀಯ ವೇದಿಕೆ ಇದು.
344,ಆ ವರ್ಷ ಭಾರತದ ಪ್ರಖ್ಯಾತ ಕೈಗಾರಿಕೋದ್ಯಮಿ ಸರ್ ದೊರಾಬ್ಜಿ ಟಾಟಾ ಭಾರತ ಒಲಿಂಪಿಕ್ ಸಂಸ್ಥೆಯನ್ನು ಹುಟ್ಟು ಹಾಕಲು ಶ್ರಮಿಸಿದರು.
345,"ಬುಲ್ ಬುಲ್, ಮತ್ತು ಪೊರ್ಕಿ ಚಿತ್ರಗಳ ನಂತರ ನಿರ್ದೇಶಕ ಎಂ ಡಿ ಶ್ರೀಧರ್ ಮತ್ತೆ ದರ್ಶನ್ ಚಿತ್ರಕ್ಕೆ ನಿರ್ದೇಶನ ಮಾಡುತ್ತಿದ್ದು, ಒಂದು ಮಟ್ಟದ ನಿರೀಕ್ಷೆಯನ್ನು ಹುಟ್ಟು ಹಾಕುತ್ತಿದೆ."
346,ಸದ್ಯ ಇವರ ಈ ನಡೆ ಹಲವಾರು ಅನುಮಾನಗಳನ್ನು ಹುಟ್ಟು ಹಾಕಿದೆ.
347,ಹುಟ್ಟು ಕಲಾವಿದರಲ್ಲದಿದ್ದರೂ ಸಹ ಯಾವುದೇ ಹಿನ್ನಲೆಯಿಲ್ಲದೆ ರಂಗಭೂಮಿಯಲ್ಲಿ ಕೇವಲ ಆಸಕ್ತಿಯೊಂದರಿಂದ ಹಾಗೂ ಕಠಿಣ ಪರಿಶ್ರಮದಿಂದ ಗುರುತಿಸಿಕೊಳ್ಳುವ ಇಂತಹ ಕಲಾವಿದರಿಗೆ ಸಂಘ ಸಂಸ್ಥೆಗಳಿಂದ ಸೂಕ್ತ ಮನ್ನಣೆ ದೊರೆತಾಗ ಇವರ ಕೊಡುಗೆಗೊಂದಿಷ್ಟು ಸಾರ್ಥಕತೆ ದೊರೆಯುತ್ತದೆ.
348,ನಾರಾಯಣ ರಾವ್) ಲೇಖನ ಆ ಸ್ಥಳ ನೋಡಲೇಬೇಕೆಂಬ ಕುತೂಹಲ ಹುಟ್ಟು ಹಾಕಿತು.
349,ಸದಾ ಹೊಸ ಹುಟ್ಟು ಪಡೆದು ಓಡಾಡುವ ಜಂಗಮಕ್ಕೆ ಎಂದೂ ಅಳಿವಿಲ್ಲ ಎಂಬುದು ಸತ್ಯ.
350,ಹುಟ್ಟು ಮತ್ತು ಆಲೂಗಡ್ಡೆ ಸಲಾಡ್ ಜನಪ್ರಿಯತೆ
351,ಸ್ಯಾಂಡಲ್‌ವುಡ್‌ನಲ್ಲಿ ಸಖತ್ ಕ್ಯೂರಿಯಾಸಿಟಿ ಹುಟ್ಟು ಹಾಕಿರುವ ಸಿನಿಮಾ ಮಫ್ತಿ ಅಭಿನಯ ಚಕ್ರವರ್ತಿ ಶಿವರಾಜ್ ಕುಮಾರ್ ಹಾಗೂ ರೋರಿಂಗ್ ಸ್ಟಾರ್ ಶ್ರೀ ಮುರುಳಿ ಅಭಿನಯದ ಈ ಚಿತ್ರ ಕನ್ನಡ ಚಿತ್ರ ಪ್ರೇಮಿಗಳನ್ನು ತುದಿಗಾಲಲ್ಲಿ ನಿಲ್ಲಿಸಿತ್ತು.
352,ಇಲ್ಲಿ ವಿಶ್ಲೇಷಣೆ ವೈಜ್ಞಾನಿಕ ಪರಿಧಿಯನ್ನೂ ಮೀರಿ ಅಸಮಾನತೆಯ ವಿಷದ ಬೀಜಗಳನ್ನು ನಮ್ಮಲ್ಲಿ ಹುಟ್ಟು ಹಾಕುತ್ತವೆ.
353,"ವಿದ್ಯಾರ್ಥಿಗಳು ಶಿಕ್ಷಕರು, ಎಸ್ ಡಿಎಂಸಿ ಸದಸ್ಯರು ಶಾಲೆಯನ್ನು ಹಸಿರು ತೋರಣಗಳಿಂದ ಸಿಂಗರಿಸಿ, ಶಾಲೆಯನ್ನು ಶುಚಿಗೊಳಿಸಿ ಗಿಡಮರಗಳಿಗೆ ದೀಪಲಂಕಾರ, ಹೂವಿನ ಅಲಂಕಾರ ಮಾಡಿ ಹುಟ್ಟು ಹಬ್ಬ ಆಚರಿಸಿದ್ದು ವಿಶೇಷವಾಗಿತ್ತಲ್ಲದೆ, ಕಾರ್ಯಕ್ರಮದಲ್ಲಿ ಸಾಲುಮರದ ತಿಮ್ಮಕ್ಕ ಅವರನ್ನು ನೆನಪಿಸಿ ಕೊಳ್ಳಲು ಮರೆಯಲಿಲ್ಲ."
354,"ಅಲ್ಲದೇ, ಹುಟ್ಟು ಹಬ್ಬದ ಸಂಭ್ರಮದ ವೇಳೆ ಸಾಲು ಸಾಲು ರೌಡಿಶೀಟರ್ ಗಳು ಸೆಲ್ಫಿ ಕ್ಲಿಕಿಸಿಕೊಂಡಿದ್ದಾರೆ."
355,"ಸದ್ಯಕ್ಕೆ ಎಲ್ಲರ ದೃಷ್ಟಿ ಮೇ 23 ರ ಮೇಲೆ ಇದ್ದು, ಈ ಬಾರಿಯ ಚುನಾವಣ ಫಲಿತಾಂಶ ಕರ್ನಾಟಕದಲ್ಲಿ ಭಾರೀ ನಿರೀಕ್ಷೆಗಳನ್ನು ಹುಟ್ಟು ಹಾಕಿದೆ."
356,ಖೈಬರ್ ಪಖ್ತೂನ್‌ಖ್ವಾ ಪ್ರಾಂತ್ಯದಲ್ಲಿರುವ ಸಂಸ್ಕೃತಿ ಮತ್ತು ಪಾರಂಪರಿಕ ಮಂಡಳಿಯು ಪೇಶಾವರದಲ್ಲಿ ದಿಲೀಪ್ ಹುಟ್ಟು ಹಬ್ಬ ಆಚರಿಸಲು ನಿರ್ಧರಿಸಿದೆ.
357,ಗಣಪತಿ ದೇವಸ್ಥಾನದ ಅಭಿವೃದ್ಧಿ ಸಮಿತಿ ಕಾರ್ಯದರ್ಶಿ ಮೋಹನ ನಾಯ್ಕ ಹಾಗೂ ಮುಖಂಡ ಬರ್ನಾಡ್ ಬೈಲಾ ಅವರು ಮಾತನಾಡಿ ಹುಟ್ಟು ಹೋರಾಟಗಾರರಾದ ಮೋಹನ ಹಲವಾಯಿಯವರ ಸಾಮಾಜಿಕ ಬದ್ದತೆ ಮತ್ತು ಅನ್ಯಾಯದ ವಿರುದ್ದ ಧ್ವನಿಯೆತ್ತಿ ನಿಲ್ಲುವ ಅವರ ಸೇವಾಗುಣ ಮತ್ತು ಕೈಂಕರ್ಯ ಶ್ಲಾಘನೀಯವಾಗಿದೆ.
358,"ಇದರ ಹೊರತು ಭಾರತದ ಸಾರ್ವಭೌಮತೆಗೆ ಧಕ್ಕೆ ತರುವುದಾಗಲಿ, ಭಾರತ ಸರಕಾರದ ವಿರುದ್ಧ ಯಾವುದೇ ದ್ವೇಷದ ಭಾವನೆ ಹುಟ್ಟು ಹಾಕುವ ಉದ್ದೇಶ ಹೊಂದಿರಲಿಲ್ಲ, ಎಂದು ಅವರು ಪತ್ರಿಕಾ ಹೇಳಿಕೆಯಲ್ಲಿ ಸ್ಪಷ್ಟಪಡಿಸಿದ್ದಾರೆ."
359,ರಮಾಜೈನ್ ಮತ್ತು ಸಾಹು ಶಾಂತಿ ಪ್ರಸಾದ್ ಜೈನ್ ದಂಪತಿಗಳು ಹುಟ್ಟು ಹಾಕಿದ ಈ ಸಂಸ್ಥೆ ೧೯೬೫ರಿಂದ ಭಾರತೀಯ ಭಾಷೆಗಳಲ್ಲಿ ಅನುಪಮ ಸಾಹಿತ್ಯ ಸೇವೆ ಸಲ್ಲಿಸಿದವರನ್ನು ಗುರುತಿಸಿ ಗೌರವಿಸುತ್ತಾ ಬಂದಿದೆ.
360,"ಮೊನ್ನೆಯಷ್ಟೇ ತಮ್ಮ ಹುಟ್ಟು ಹಬ್ಬವನ್ನು ವಿಭಿನ್ನವಾಗಿ ಆಚರಿಸಿಕೊಂಡು, ಮಾದ್ಯಮಗಳಲ್ಲಿ ಸುದ್ದಿಯಾಗಿದ್ದ ಹರ್ಷಿಕಾ ಪೂಣಚ್ಚ ಅವರು ಇದೀಗ ಅವರ ಮೇಲೆ ನಡೆದಿದೆ ಎನ್ನಲಾಗಿರುವ ಕಿರುಕುಳದ ವಿಷಯವಾಗಿ ಮಾದ್ಯಮದಲ್ಲಿ ಸುದ್ದಿಯಾಗಿದೆ."
361,ಪಾಳೇಗಾರಿಕೆ ಪದ್ಧತಿಯನ್ನು ಒಳಗೊಳಗೇ ಪೋಷಿಸಿಕೊಂಡು ಬಂದಿರುವ ಸಮುದಾಯಗಳಲ್ಲಿ ಪರ್ಯಾಯ ಪೊಲೀಸಿಂಗ್~ ಬಹಳ ಸುಲಭವಾಗಿ ಹುಟ್ಟು ಪಡೆಯುತ್ತದೆ.
362,ಬೆಂಗಳೂರು: ಕನ್ನಡದ ರ್ಯಾಪ್‌ ಸಿಂಗರ್ ಚಂದನ್ ಶೆಟ್ಟಿ ಇಂದು ತಮ್ಮ ಹುಟ್ಟು ಹಬ್ಬವನ್ನು ಅಭಿಮಾನಿಗಳ ಜೊತೆ ಆಚರಿಸಿಕೊಂಡರು.
363,ಏಷ್ಯಾ ಅಥ್ಲೆಟಿಕ್ಸ್ ಸಂಸ್ಥೆ ಹುಟ್ಟು ಪಡೆದ 40ನೇ ವರ್ಷಾಚರಣೆ ಸಂಭ್ರಮ ಇಲ್ಲಿ ನಡೆದಿದೆ.
364,ಇಂದು (ಜುಲೈ 2) ಗೋಲ್ಡನ್‌ ಸ್ಟಾರ್‌ ಗಣೇಶ್‌ ಅವರ ಹುಟ್ಟು ಹಬ್ಬ.
365,ಗುಲಾಮಗಿರಿ: ಹುಟ್ಟು ಮತ್ತು ಸ್ವರೂಪ
366,"ಈ ಅಂಶಗಳು, ಮತ್ತು ಇದು ಎರಡು ಗುಂಪುಗಳಾಗಿ ವಿಂಗಡಿಸಲಾಗಿದೆ ಶಾಲೆಗಳು ಹಾಗೂ ಸಿದ್ಧಾಂತಗಳ ಒಂದು ಸಂಖ್ಯೆ, ಹುಟ್ಟು ಆಧಾರವಾಯಿತು."
367,ಮಕ್ಕಳಂತೆ ಅಥವಾ ಅದಕ್ಕೂ ಹೆಚ್ಚು ಅಕ್ಕರೆಯ ಪೋಷಣೆಯಿಂದ ಶಾಲಾ ಆವರಣದಲ್ಲಿ ಆಳೆತ್ತರ ಬೆಳೆದು ನಿಂತ ಹೊಂಗೆ ಹಾಗೂ ಚೆರ‌್ರಿ ಗಿಡಗಳ ಹುಟ್ಟು ಹಬ್ಬ!
368,ಈ ನೀಡಿದರೆ ಮಾತ್ರ ವ್ಯಾಕ್ಸಿನೇಷನ್ ಮತ್ತು ಕಡ್ಡಾಯ ವ್ಯಾಕ್ಸಿನೇಷನ್ ಹುಟ್ಟು ಕಾರಣ ನಿಲ್ಲಿಸಬೇಕು ಬಹಳ ಅಪಾಯಕಾರಿ ರೋಗ ಎಂದು ಮರೆಯಬೇಡಿ.
369,ಹಾಗಾಗಿ ಇದು ಒಂದು ವಿವಾದವನ್ನು ಹುಟ್ಟು ಹಾಕುತ್ತದೆ.
370,"ಸಾಮಾನ್ಯವಾಗಿ, ವಯಸ್ಕರು ಮತ್ತು ಯುವಕರು ಹಾರ್ಮೋನ್ ಟೆಸ್ಟೋಸ್ಟೆರಾನ್ ಪ್ರಚೋದಿಸಬಹುದು ಎಂದು ಸಾಕಷ್ಟು ದೊಡ್ಡ ಬೋಳು ತೇಪೆ ಅನೇಕ ಕೇಂದ್ರಗಳಲ್ಲಿ ಹುಟ್ಟು ನಷ್ಟಗೊಳ್ಳುತ್ತಾರೆ."
371,ಸಂವಿಧಾನ ಬದಲಾಯಿಸಬೇಕೆಂಬ ಪೇಜಾವರಶ್ರೀಗಳ ಹೇಳಿಕೆ ದೇದಾದ್ಯಂತ ಪರ-ವಿರೋಧ ಚಳುವಳಿ ಹುಟ್ಟು ಹಾಕುವ ಸಾಧ್ಯತೆ ಇದೆ.
372,ಈ ಎಲ್ಲ ಸಂಘಗಳ ಹುಟ್ಟು ಬೆಳವಣಿಗೆ ಸಾಧನೆಯ ಹೆಜ್ಜೆಗುರುತುಗಳನ್ನು ದಾಖಲಿಸುವುದು ಈ ಬರಹದ ಉದ್ದೇಶವಲ್ಲ.
373,"ನನ್ನ ಹುಟ್ಟು ಹಬ್ಬಕ್ಕೆ ಸರಿಯಾಗಿ ಈ ಬಾರಿ ದೀಪಾವಳಿ ಹಬ್ಬ ಬಂದಿದೆ, ಇದು ನನ್ನ ಸಂತೋಷವನ್ನು ಇಮ್ಮಡಿಗೊಳಿಸಿದೆ ಎಂದೂ ರಾಧಿಕಾ ಹೇಳಿದರು."
374,ಇದನ್ನು ಓದಿ: ಕಾಂಗ್ರೆಸ್​ ಅಧ್ಯಕ್ಷ ರಾಹುಲ್​ ಗಾಂಧಿ ಹುಟ್ಟು ಹಬ್ಬಕ್ಕೆ ಶುಭಾಶಯ ಕೋರಿದ ಪ್ರಧಾನಿ ಮೋದಿ
375,ಹುಟ್ಟು ಅಪಾಯಕಾರಿ ವಿಭವದ ದೇಹದ ಮೇಲೆ.
376,ಲಿಂಗರಾಜ ಗಾಂಧಿ ಮಾತನಾಡಿ ನಮ್ಮೆಲ್ಲರ ಹುಟ್ಟು ಆಯ್ಕೆಯಲ್ಲ.
377,ದೇಶದಲ್ಲಿ ಆಗುತ್ತಿರುವ ಮಹಿಳೆಯರ ಮೇಲಿನ ಸರಣಿ ದೌರ್ಜನ್ಯಗಳ ಹಿನ್ನೆಲೆ ಅದ್ಧೂರಿಯಾಗಿ ಹುಟ್ಟು ಹಬ್ಬವನ್ನು ಆಚರಿಸಿಕೊಳ್ಳಲು ಸೋನಿಯಗಾಂಧಿ ನಿರಾಕರಿಸಿದ್ದಾರೆ.
378,ಹುಟ್ಟು ಹೆಸರು ಯುಧಿಷ್ಠಿರನಾಗಿದ್ದರೂ ಧರ್ಮವು ಸಂಪೂರ್ಣವಾಗಿ ಆತನಲ್ಲಿ ನೆಲಸಿದ್ದುದರಿಂದ ಧರ್ಮರಾಜನೆಂದೇ ಆತ ಪ್ರಖ್ಯಾತನಾದ.
379,ಹುಟ್ಟುಗಾರರ ಹುಟ್ಟು ತುಂಡಾಗುತ್ತದೆ.
380,ಹುಟ್ಟು ಕುರುಡನಾದ ನರಗೆ
381,ಯಾವಾಗ ಕೆಜಿಎಫ್ ಚಿತ್ರ ಸೆಟ್ಟಿರಿತೋ ಅಂದಿನಿಂದ ಇಂದಿನವರೆಗೂ ಅದೇ ನಿರೀಕ್ಷೆಯನ್ನು ಹುಟ್ಟು ಹಾಕಿರುವ ಚಿತ್ರ.
382,ಹುಟ್ಟು ಹಬ್ಬದಂದು ಮೂರು ಕೋತಿಗಳ ಕಥೆ ಹೇಳಿದ ಕಿಚ್ಚ ಸುದೀಪ್
383,"ಮಾತ್ರವಲ್ಲ, ತೀವ್ರಗೊಳ್ಳುತ್ತಿ­ರುವ ಸಿರಿಯಾ ಬಿಕ್ಕಟ್ಟನ್ನು ಪರಿಹರಿಸುವ ನಿಟ್ಟಿನಲ್ಲಿ ಅಮೆರಿಕ ಕೈಗೊಂಡಿರುವ ರಾಜ­ತಾಂತ್ರಿಕ ಯತ್ನಗಳ ಕಾರ್ಯ­-ಸಾಧ್ಯತೆ ಬಗ್ಗೆ ಸಂದೇಹಗಳನ್ನೂ ಹುಟ್ಟು ಹಾಕಿದೆ."
384,ಬಾಲಿವುಡ್ ನಲ್ಲಿ ಬ್ಲಾಕ್ ಬ್ಲಾಸ್ಟರ್ ಚಿತ್ರ ಎನಿಸಿದ ಕರಣ್ ಅರ್ಜುನ್ 1995ರಲ್ಲಿ ಇಬ್ಬರಿಗೂ ಚಿತ್ರರಂಗದಲ್ಲಿ ಮರು ಹುಟ್ಟು ನೀಡಿತ್ತು.
385,"ಅಷ್ಟೇ ಏಕೆ, ಅನ್ನದಾನ, ರಕ್ತದಾನ ಇನ್ನಿತರ ಸಾಮಾಜಿಕ ಸೇವೆಗಳಲ್ಲಿ ತೊಡಗಿಸಿಕೊಂಡು ಹುಟ್ಟು ಹಬ್ಬ ಆಚರಿಸುವುದೂ ಹೊಸತೇನಲ್ಲ."
386,"ಚುನಾವಣೆ ಹತ್ತಿರವಾದಾಗ ಕೋಮುಗಲಭೆಗಳನ್ನು ಹುಟ್ಟು ಹಾಕುವುದು ಹಿಂದಿನಿಂದಲೂ ಬಿಜೆಪಿ ಅನುಸರಿಸಿಕೊಂಡು ಬಂದಿದ್ದಾರೆ, ಬಿಜೆಪಿಗೆ ಇದೀಗ ಚುನಾವಣೆಯಲ್ಲಿ ಗೆಲ್ಲುವುದಿಲ್ಲ ಎಂಬ ಭಯ ಆರಂಭವಾಗಿದೆ."
387,ಮೋದಿ ಹುಟ್ಟು ಹಬ್ಬ ಆಚರಣೆಗಾಗಿಯೇ ಅವಧಿಗೂ ಮುನ್ನ ಜಲಾಶಯ ಭರ್ತಿ
388,ಇದಕ್ಕೆ ಸಾಕ್ಷಿ ಎಂಬಂತೆ ಮೊನ್ನೆ ಬುಧವಾರ ದರ್ಶನ್‌ ಗೆಳೆಯನ ಅಮ್ಮ ಗಿರಿಜಾ ಲೋಕೇಶ ಅವರ ಹುಟ್ಟು ಹಬ್ಬವನ್ನು ಆಚರಿಸಿದ್ದಾರೆ.
389,1: ಬಾಲಿವುಡ್ ಸ್ಟಾರ್ ಅಮಿತಾಬ್ ಬಚ್ಚನ್ ಮುಂಬೈನಲ್ಲಿ ಇಂದು ತಮ್ಮ 74ನೇ ಹುಟ್ಟು ಹಬ್ಬವನ್ನು ಆಚರಿಸಿಕೊಂಡಿದ್ದಾರೆ.
390,"ವ್ಯಕ್ತಿನಿಷ್ಠ, ಇದು ಕ್ರಮಗಳು ಮತ್ತು ಘಟನೆಗಳ ಮೌಲ್ಯಮಾಪನಗಳನ್ನು ವಿವಿಧ ಹುಟ್ಟು ಉಂಟಾಗುತ್ತವೆ."
391,"ಪುನೀತ್ ರಾಜ್‍ಕುಮಾರ್, ಅಂಧಮಕ್ಕಳ ಜೊತೆ ಕೇಕ್ ಕತ್ತರಿಸಿ ಹುಟ್ಟು ಹಬ್ಬ ಆಚರಿಸಿಕೊಂಡರು."
392,"ಮಂಗಳವಾರ ನಿಮ್ಮ ಹುಟ್ಟು ಹಬ್ಬ ಬಂದಿದ್ದರೆ, ಲಕ್ಷ್ಮಿ ದೇವಿಗೆ ಉಡಿಸಿದ ಕೆಂಪು ಸೀರೆಯನ್ನು ಬ್ರಾಹ್ಮಣರ ಪತ್ನಿಗೆ ನೀಡಿ."
393,ಬಹುಶಃ ಭೂಮಿಯ ಹುಟ್ಟಿಗೆ ಮೊದಲು ಸೂರ್ಯನ ಹುಟ್ಟು ಆಯಿತೇನೊಎಂದಳು.
394,"ಮುಹೂರ್ತದ ನಂತರ ಮಾತನಾಡಿದ ಕೃಷ್ಣ, ನಾನು ಸಿದ್ದಾಪುರದಲ್ಲೇ ಹುಟ್ಟು ಬೆಳೆದಿದ್ದರಿಂದ 2 ದಶಕಗಳ ಹಿಂದೆ ಅಲ್ಲೇ ನಡೆದಂತ ಕಥೆಯನ್ನು ತೆರೆಯ ಮೇಲೆ ತರುತ್ತಿದ್ದೇನೆ."
395,ಇದು ಸೂಕ್ಷ್ಮ ಬಿರುಕುಗಳು ಮತ್ತು ಗೀಚುಗಳನ್ನು ವಿವಿಧ ಹುಟ್ಟು ರಕ್ಷಿಸುತ್ತದೆ.
396,"ಆದಾಗ್ಯೂ, ಈ ನೀತಿಯನ್ನು ನಡೆಸುವ ಹಣದುಬ್ಬರದ ಒತ್ತಡ ಹುಟ್ಟು ಮತ್ತು ಖಜಾನೆ ಬರಿದು ತುಂಬಿದ್ದು."
397,ರಾಜಕೀಯ ಪಕ್ಷಗಳ ದ್ವಂದ್ವ ನಿಲವುಗಳು ಹುಟ್ಟು ಹಾಕುವ ಇಂತಹ ಪ್ರಶ್ನೆಗಳಿಗೆ ಉತ್ತರ ಹುಡುಕುವುದು ಹೇಗೆ?
398,ಕೆಲ ದಿನಗಳಿಂದ ಸಾಮಾಜಿಕ ಜಾಲತಾಣಗಳಲ್ಲಿ ಹರಿದಾಡಿದ ನಕಲಿ ಸಚಿವ ಸಂಪುಟದ ಪಟ್ಟಿಗಳು ಜಿಲ್ಲೆಯ ರಾಜಕೀಯ ವಲಯದಲ್ಲಿ ಬಿಸಿ ಚರ್ಚೆ ಹುಟ್ಟು ಹಾಕಿದ್ದವು.
399,ಈ ಚಿತ್ರ ರಾಗಿಣಿ ಕರಿಯರ್ನಲ್ಲಿ ಬದಲವಾಣೆ ತರಲಿದೆಯೇ ಎನ್ನುವ ಕುತೂಹಲವನ್ನೂ ಹುಟ್ಟು ಹಾಕಿದೆ.
400,"ಅವರಿಗೋ ಸುಮಾರು ಮೂರು ದಶಕಗಳ ಹಿಂದೆ (೧೯೫೩ ರಿಂದ ೧೯೬೨), ತಾನು ಮಡಿಕೇರಿ ಸರಕಾರೀ ಕಾಲೇಜಿನ ಗಣಿತೋಪನ್ಯಾಸಕನಾಗಿದ್ದುಕೊಂಡು, ಸೊನ್ನೆ ಬಂಡವಾಳದಿಂದ ಹುಟ್ಟು ಹಾಕಿ, ಬಹು ಲಕ್ಷದ ಮಾಲು ಮತ್ತು ನಿರಖು ಠೇವಣಿಗಳ ಮಟ್ಟಕ್ಕೆ ಬೆಳೆಸಿದ ಕಾಲೇಜಿನ ಸಹಕಾರೀ ಸರ್ವ ಸರಕಿನ ಮಳಿಗೆಯನ್ನು ಕಟ್ಟಿದ ಉತ್ಸಾಹದ್ದೇ ಆವಾಹನೆಯಾದಂತಿತ್ತು."
401,ಇಂತಹ ಬೆಳವಣಿಗೆಗಳು ವಿವಾದಗಳನ್ನು ಹುಟ್ಟು ಹಾಕುತ್ತದೆ.
402,"ಅನಂತ ಕುಮಾರ್​ ಹೆಗಡೆ ಮೋದಿ ಸರ್ಕಾರದಲ್ಲಿ ಕೌಶಲ್ಯಾಭಿವೃದ್ಧಿ ಸಚಿವರಾದ ಬಳಿಕ ಒಂದಿಲ್ಲೊಂದು ವಿವಾದ ಹುಟ್ಟು ಹಾಕುತ್ತಲೆ ಇದ್ದು, ತಮ್ಮ ಹೇಳಿಕೆ ಮೂಲಕ ಕೇಂದ್ರ ಸರ್ಕಾರವನ್ನು ಕೂಡ ಇಕ್ಕಟ್ಟಿಗೆ ಸಿಲುಕಿಸಿದ್ದರು."
403,ವಿಕಾಸದ ಪ್ರಕ್ರಿಯೆಯು ಆಂತರಿಕ ಫಲೀಕರಣ ಹುಟ್ಟು chordate ಪ್ರಾಣಿಗಳ ಬಿಡುಗಡೆ ಭೂಮಿಯಲ್ಲಿ ಸಂಬಂಧಿಸಿದೆ.
404,ಇತಹ ಕಾಲದಲ್ಲಿ ವಚನಗಳು ತುಂಬಾ ಪ್ರಭಾವ ಬೀರಿದ್ದವು ಎಂದ ಅವರು ಮಡಿವಾಳ ಮಾಚಿದೇವರ ಹುಟ್ಟು ಮತ್ತು ಅವರ ಜೀವನದ ಚರಿತ್ರೆಯನ್ನು ಅವರ ವಚನಗಳ ಮೂಲಕ ತಿಳಿಸಿಕೊಟ್ಟರು.
405,"ಆದರೆ ಸೌಜನ್ಯ ಅತ್ಯಾಚಾರ, ಕೊಲೆ ಪ್ರಕರಣದಲ್ಲಿ ಹುಟ್ಟಿಕೊಂಡ ಹೋರಾಟ ಇಲ್ಲಿನ ಕೋಮುಶಕ್ತಿಗಳ ಆಶ್ರಯದಾತರಾಗಿರುವ ಆಗೋಚರ ಸರಕಾರಗಳ ವಿರುದ್ಧದ ಜನ ಚಳುವಳಿಯಾಗಿ ಪರಿವರ್ತನೆಗೊಂಡಿದ್ದು, ಜನ ಚಳುವಳಿಗಳು ಜನಸಾಮಾನ್ಯರ ಮಧ್ಯೆ ಸಕ್ರಿಯಗೊಂಡಿದ್ದು, ನುಡಿಸಿರಿ, ಜನನುಡಿ ಕಾರ್ಯಕ್ರಮಗಳು ಹುಟ್ಟು ಹಾಕಿದ ವೈಚಾರಿಕ ಸಂಘರ್ಷಗಳ ಮಧ್ಯೆ ಏಕಾಏಕಿ ಮತೀಯ ಶಕ್ತಿಗಳಿಗೆ ಪ್ರಬಲವಾಗಿ ಎದ್ದು ನಿಲ್ಲಲು ಸಾಧ್ಯವಾದುದರ ಹಿಂದೆ ಆಳವಾದ ಪಿತೂರಿಯ ವಾಸನೆ ಬಡಿಯುತ್ತದೆ."
406,"ಭಾರತವು ಐಐಟಿ, ಐಐಎಂ, ಇಸ್ರೊಗಳಂತಹ ಜಾಗತಿಕ ಮಟ್ಟದ ಸಂಸ್ಥೆಗಳನ್ನು ಕಟ್ಟಿದರೆ ಪಾಕಿಸ್ತಾನವು ಉಗ್ರಗಾಮಿ ಸಂಘಟನೆಗಳನ್ನು ಹುಟ್ಟು ಹಾಕಿದೆ ಎಂದು ಸುಷ್ಮಾ ಅವರು ಹೇಳಿದ್ದರು."
407,ನಗರದ ಡಾನ್‌ಬಾಸ್ಕೋ ಸಭಾಂಗಣದಲ್ಲಿ ಇಂದು ಕಡಲ ತಡಿಯ ಭಾರ್ಗವ ಶಿವರಾಮ ಕಾರಂತರ ಹುಟ್ಟು ಹಬ್ಬದ ಪ್ರಯುಕ್ತ ದ.
408,ಈ ಬಿಸಿ ಹುಟ್ಟು ಮಹಾನ್ ಪೂರಕ ಬೇಯಿಸಿದ ಆಲೂಗಡ್ಡೆ.
409,ಪ್ರಧಾನಿ ನರೇಂದ್ರ ಮೋದಿ ಅವರ ಶ್ರೀಲಂಕಾ ಭೇಟಿ ಭಾರಿ ನಿರೀಕ್ಷೆ ಹುಟ್ಟು ಹಾಕಿದೆ.
410,ಮೋದಿ ಹುಟ್ಟು ಹಬ್ಬ ಕಾರ್ಯಕ್ರಮದಲ್ಲಿ ಸಂಸದ ಮುನಿಸ್ವಾಮಿ ಮನವಿ
411,"ಶಿವಣ್ಣನ ಹುಟ್ಟು ಹಬ್ಬ 12 ನೆ ತಾರೀಕು ಇರುವದರಿಂದ, ಆ ದಿನದಂದೆ ಚಿತ್ರ ಅಧಿಕೃತವಾಗಿ ಅನೌನ್ಸ್ ಮಾಡಲಿದ್ದಾರಂತೆ."
412,"ಎಲ್ಲಾ ಮೊದಲ, ಇದು (ಉದಾಹರಣೆಗೆ ಸೈನುಟಿಸ್, ಕಿವಿಯ, ನ್ಯುಮೋನಿಯಾ,) ಸಂಭವನೀಯ ಹುಟ್ಟು ಮತ್ತು ತೀವ್ರ ಸಾಂಕ್ರಾಮಿಕ ರೋಗದ ಅಭಿವೃದ್ಧಿ ತಡೆಯಲು ಅಟಾಕ್ಸಿಯಾ ಹಚ್ಚುವ ಸಾಮರ್ಥ್ಯವನ್ನು ಅಗತ್ಯವಿದೆ."
413,ರುಕ್ಮಿಣಿಮಾಲಾ ಪತ್ರ: ಸ್ಪಾರ್ತಕಸ್ ಸಿನಿಮಾದಲ್ಲಿ ಚೆನ್ನಾಗಿ ಹುಟ್ಟು ಹಾಕುವ ಗುಲಾಮ ಬದುಕಬಲ್ಲ.
414,ರಂದು ದರ್ಶನ್ ಹುಟ್ಟು ಹಬಕ್ಕೆ ಸಕಲ ಸಿದ್ಧತೆ ಮಾಡಿಕೊಳ್ಳುತ್ತಿದ್ದಾರೆ.
415,"ಆದರೆ, ಇತ್ತೀಚಿನ ವರ್ಷಗಳಲ್ಲಿ ಹುಟ್ಟು ಕಾರಣ, ಹೆಚ್ಚು ಜನಪ್ರಿಯ ಮತ್ತು ದುಬಾರಿ ಕೌಂಟರ್ಪಾರ್ಟ್ಸ್ ಗ್ರಾಹಕರು ಮತ್ತು ತಜ್ಞರು ಈ ಪರಿಣಾಮಕಾರಿಯಾದ ಸಾಧನವಾಗಿದೆ ಮರೆತಿದ್ದೀರಿ."
