Index,Sentence
0,ಸಮಯ ಎಲೆ ಪತನದ ಆರಂಭದಲ್ಲಿ ಮತ್ತು ಮೊದಲ ಹಿಮ ನಡುವೆ ಆಯ್ಕೆ.
1,ಎಲೆ ಮುನೀಶ್ವರ ಕೇಳು ಹರಿಯದು | ಕುಲದೊಳುದಿಸಿದು ಬಾಲಕತ್ವವ |
2,"*ಕರಿಬೇವಿನ ಎಲೆ : ಒಂದು ಚಮಚ ಕರಿಬೇವಿನ ಎಲೆಯನ್ನು ಪೇಸ್ಟ್‌ ಮಾಡಿ, ಅದಕ್ಕೆ ಮೊಸರು ಮಿಕ್ಸ್‌‌ ಮಾಡಿ ರೆಗ್ಯುಲರ್‌ ಆಗಿ ಕೂದಲಿಗೆ ಮತ್ತು ಸ್ಕಾಲ್ಪ್‌ಗೆ ಹಚ್ಚಿ."
3,"Home ವಾರ್ತೆಗಳು ಆರೋಗ್ಯ ಹೊಟ್ಟೆನೋವು,ವಾಂತಿ, ತಲೆಸುತ್ತು ಇನ್ನು ಅನೇಕ ರೋಗಗಳಿಗೆ ಈ ಎಲೆ ರಾಮಬಾಣ."
4,[ಹೋಗಯ್ಯ] ಎಲೆ ಮಂತ್ರಿ ಹೇಳಿಕೊಳ್ಳಲಿ ಬೇಡ | ಕೀಳುವ ಧೈರ್ಯುಂಟು ಕಲ್ಲ |
5,ಇದರ ಎಲೆ ಮತ್ತು ಹೂವುಗಳ ಸೂಪ್ ಮಾಡಿಕೊಂಡು ಕುಡಿಯುವ ಮೂಲಕ ಈ ಸೋಂಕುಗಳನ್ನು ಕಡಿಮೆ ಮಾಡಬಹುದು.
6,"ಎಲೆ ರಚನೆಯು ಟ್ರಿಲ್ಲಿಯಮ್ನಂತೆ ಹೋಲುತ್ತದೆ, ಇದು ಜ್ಯಾಕ್-ಇನ್-ದಿ-ಪುಲ್ಪಿಟ್ನ ಸ್ಥಳೀಯ ಆವಾಸಸ್ಥಾನವನ್ನು, ಜೊತೆಗೆ ಅಡ್ಡಹೆಸರು ವೇಕ್ ರಾಬಿನ್ ಅನ್ನು ಹಂಚಿಕೊಳ್ಳುತ್ತದೆ."
7,"ಪರಿಸರದಲ್ಲಿ ಸಿಗೋ ಹೂವು ಹಣ್ಣು, ಎಲೆ ಕಾಯಿ, ರೆಂಬೆ ಕೊಂಬೆಗಳನ್ನೇ ಉಪಯೋಗಿಸಿಕೊಂಡು ಕಲಾತ್ಮಕ ವಸ್ತುಗಳನ್ನು, ವಿನ್ಯಾಸಗಳನ್ನು ಮಾಡಿಕೊಂಡು ತರಬೇಕು."
8,ಅಂತಿಮವಾಗಿ ಮೆಣಸು ಮತ್ತು ಬೇ ಎಲೆ ಸೇರಿಸಿ.
9,ಕತ್ತೆ ಪರಿಮಳವ ಹೊತ್ತರೆ ಎಲೆ ಹೆಣ್ಣೆ ಅದರ
10,ನನ್ನ ಗಾಳಕ್ಕೆ ಯಾವಾಗಲೋ ಶೇಖರನ ಎಲೆ ಅಡಿಕೆ ಮಿಶ್ರಿತ ಕಫಕ್ಕೆ ಕಣ್ಣು ಮಿಟುಕಿಸುವುದರೊಳಗೆ ಬಿದ್ದ ಔಲು ಮೀನಿನ ಕಥೆಯೂ ವರ್ಷಾನುಗಟ್ಟಲೆ ಗುನುಗಲು ಬಹು ದೊಡ್ಡ ವಸ್ತು.
11,ಆ ನಾಡಿನ ಒಳಭಾಗದಲ್ಲಿ ಸುಂದರವೂ ವಿವಿಧವೂ ಆದ ಎಲೆ ಹಣ್ಣು ಹೂವುಗಳಿಂದ ಕೂಡಿದ ಕಾಡು ಮದ್ದಾನೆಗಳನ್ನು ಬೆಳೆಸುತ್ತದೆ.
12,ರ ಹರಳನ್ನು ಎಲೆ ಸುರುಳಿಯಲ್ಲಿ ಹಾಕಬೇಕು.
13,"ನೈವೇದ್ಯ, ಅರಿಶಿಣ ಕುಂಕುಮ ನೀಡುವುದು, ಬಾಳೆ ಎಲೆ ಊಟ ಎಲ್ಲ ಪದ್ಧತಿಯನ್ನೂ ನೆರವೇರಿಸಿದ್ದೇವೆ."
14,ಹುರಿಯುವ ಸೂಕ್ತವಾದ ಆಳವಾದ ಪಾತ್ರೆಯಲ್ಲಿ ಒಂದು ತಯಾರಿಕೆಯ ಅಥವಾ ಹರಡಿತು ಮತ್ತು ಇದು ಮಾಡಬೇಕು ಚೂರುಗಳಾಗಿ ಮುರಿಯಲ್ಪಡಬೇಕು ಬೇ ಎಲೆ ಸೇರಿಸಿ.
15,"ತಯಾರಿಸಲಾಗುತ್ತದೆ ಅಕ್ಕಿ, ಉಪ್ಪು, ಮೆಣಸು, ಬೆಳ್ಳುಳ್ಳಿ ಮತ್ತು ಬೇ ಎಲೆ ಜೋಡಿಸಲಾದ ತರಕಾರಿಗಳು ಮೇಲೆ, ನೀರು ತುಂಬಿಸಿ."
16,ಕೆಲವು ತಳಿಯನ್ನು ಸಾಮಾನ್ಯವಾಗಿ ಅವುಗಳ ಎಲೆ ಬಣ್ಣಕ್ಕೆ ಬೆಳೆಯಲಾಗುತ್ತದೆ.
17,ಇದು ಬೆಳೆ ಎಲೆ ಪತನ ಮತ್ತು ಮೊದಲ ಬೆಳಕಿನ ಮಂಜಿನಿಂದ ಉತ್ಪಾದಿಸಲು ಅನಿವಾರ್ಯವಲ್ಲ.
18,ಎಲೆ ಉದುರಿದ ಮರವೊಂದು ವಸಂತ ಋತುವಿಗಾಗಿ ಕಾಯುತ್ತದೆಯೇ ಹೊರತು ಅಸಹಜವಾದ ಯಾವುದೋ ಒಂದರ ಮೂಲಕ ಚಿಗುರಲು ಪ್ರಯತ್ನಿಸುವುದಿಲ್ಲ.
19,ಬಾಳೆ ಎಲೆ ಉರಿಯೂತದ ಪರಿಣಾಮವನ್ನು ಹೊಂದಿದೆ;
20,ರಂಗಯ್ಯ ಎಲೆ ಅಡಕೆ ಹಾಕುವ ಸಂಭ್ರಮದಲ್ಲಿ ಬಾಹ್ಯ ಜಗತ್ತನ್ನೇ ಮರೆತುಬಿಟ್ಟಿದ್ದ.
21,ಮೃದುವಾಗಿ ಎಲೆ ಎಳೆಯಿರಿ ಮತ್ತು ಅದು ಸುಲಭವಾಗಿ ಬೇರ್ನಿಂದ ಪ್ರತ್ಯೇಕಗೊಳ್ಳುತ್ತದೆ.
22,ಎಲೆ ವಿಲಾಸಿನೀ !
23,ಜೀಗುಜ್ಜೆ ಎಲೆ ಹಾಗೂ ಕಾಯಿಯಲ್ಲಿ ಹಲಸಿಗಿಂತ ಭಿನ್ನವಾಗಿದೆ.
24,ಆಹಾರ ತ್ಯಾಜ್ಯವನ್ನು ಬಾಳೆ ಎಲೆ ಇಲ್ಲದಿದ್ದರೆ ಆಹಾರ ತ್ಯಾಜ್ಯವನ್ನು ಪ್ರತ್ಯೇಕವಾಗಿ ಸಾಗಿಸುವ ವ್ಯವಸ್ಥೆ ಮಾಡಬೇಕು.
25,ಎಲೆ ಹಸಿರು ಬಣ್ಣದ ಸೀರೆಯುಟ್ಟು ಫೋಟೋಗಳಿಗೆ ಪೋಸ್ ನೀಡುತ್ತಿರುವ ವೀಡಿಯೋ ಇದೀಗ ವೈರಲ್ ಆಗಿದೆ.
26,"ಹಾಸನ ಆ 18: ಹಾಸನ ತಾಲ್ಲೂಕಿನಲ್ಲಿ ಮುಂಗಾರು ಹಂಗಾಮಿನ ಮುಖ್ಯ ಬೆಳೆಯಾದ ಮುಸುಕಿನಜೋಳದ ಬೆಳೆಯು ಸುಮಾರು 21000 ಹೆಕ್ಟೇರ್ ಮಳೆಯಾಶ್ರಿತ ಪ್ರದೇಶದಲ್ಲಿ ಆವರಿಸಿದ್ದು ಈ ಬಾರಿ ಸುಳಿ ಎಲೆ ತಿನ್ನುವ ಹುಳು (ಸ್ಪೊಡಾಪ್ಟರ, ಪ್ಯೂಜಿಫೆರ್ಡಾ) ವಿನ ಬಾಧೆ ತೀವ್ರವಾಗಿದ್ದು, ಶೇಕಡ 12-50 ರ ವರೆಗೂ ತೀವ್ರತೆ…"
27,ಗರಿಗರಿಯಾದ ಸಂಯುಕ್ತವಿರುವ ಎಲೆ ಹೊಂದಿರುವ ಮರಗಳು ಕಾಂಡ ಅಥವಾ ರಾಚಿಸ್ನ ಉದ್ದಕ್ಕೂ ಹಲವಾರು ಸ್ಥಳಗಳಿಂದ ಎಲೆಗಳ ಬೆಳೆಯುತ್ತವೆ - 21 ಎಲೆಗಳಷ್ಟು ಮತ್ತು ಮೂರು ರಷ್ಟು ಕಡಿಮೆ ಇರುತ್ತದೆ.
28,ನೋಟವನ್ನು ಪ್ರಚಾರ ಅಧಿಕ ಉಪ್ಪನ್ನು ದೇಹದ ಒಂದು ಬೇ ಎಲೆ ಸಹಾಯ ಹಿಂತೆಗೆದುಕೊಳ್ಳುವ edemas ಮುಖದ.
29,ಬ್ಯಾಟರ್ ಪ್ರತಿ ಎಲೆಕೋಸು ಎಲೆ ಅದ್ದು ಮತ್ತು ಬೆಣ್ಣೆಯನ್ನು ಬಿಸಿ ಹುರಿಯಲು ಪ್ಯಾನ್ ಮೇಲೆ ಗೋಲ್ಡನ್ ಬ್ರೌನ್ ರವರೆಗೆ ಎರಡೂ ಫ್ರೈ.
30,ದುಡ್ಡು ಕೊಟ್ಟು ನಾಲ್ಕೆಲೆ ಮಾವಿನ ಎಲೆ ತಂದು ತೋರಣ ಕಟ್ಟಬೇಕು.
31,ಎಲೆ ಕಡ್ಡಿ ಕಸ ತುಂಬಿಹೋಗಿತ್ತು.
32,ಗಿಡದ ತುಂಬಾ ತುದಿಯಲ್ಲಿ ಎಲೆ ಕಾಣಿಸದಷ್ಟು ಗೊಂಚಲು ಗೊಂಚಲು ಮೊಗ್ಗುಗಳು.
33,(ಈ ಮಾತಿನಿಂದ ನೋವಾಗಿ ನಾಯೀಮಗ ಊಟ ಮಾಡದೇ ಹಾಗೇ ಎಲೆ ಎತ್ತಿಕೊಂಡು ಹೊರಗೆ ಹೋಗುವನು.
34,ಉಂಡ ಎಲೆ ಕೊಚ್ಚಬೇಕು ಎಂಬ ನಾಣ್ಣುಡಿಯೇ ಈ ಪ್ರದೇಶದಲ್ಲಿ ಪ್ರಚಲಿತದಲ್ಲಿದೆ.
35,"ರುಚಿಗೆ ತಕ್ಕಷ್ಟು ಉಪ್ಪು ಸೇರಿಸಿ, ಲೌರೆಲ್ ಎಲೆ ಮತ್ತು ಎಲ್ಲಾ ಐದು ನಿಮಿಷಗಳವರೆಗೆ ಒಟ್ಟಿಗೆ ಬೇಯಿಸಿ."
36,ಚಂ || ಎಲೆ ಬಗೆಯಿಲ್ಲದೆನ್ನೊಡನೆ ತಂದೆನನಿಂದಿತ ಮಾನುಷೋತ್ತರಾ
37,"ಕಿಸ್ನ ಊರು ತುಂಬಾ ಬಾಳೆ ಎಲೆ, ತರಗಿನ ಎಲೆ ತೋರಣ ಕಟ್ಟಿದ್ದ,."
38,ಮರದ ಟೊಂಗೆ ಹಾಗೂ ಎಲೆ ಕೊಳತೆ ವಾಸನೆಗೆ ಮೀನುಗಳು ಅಲ್ಲಿ ಬರುವುದರಿಂದ ಮೀನಿನ ಬೇಟೆ ಸುಲಭವಾಗುತ್ತದೆ.
39,"ಶಿಗ್ಗಾವಿ22 : ಪಟ್ಟಣದ ತಾಲೂಕ ಪಂಚಾಯತ ಆವರಣದಲ್ಲಿರುವ ಆಂಜನೇಯ ದೇವಸ್ಥಾನದಲ್ಲಿ ಕುಂಕುಮ ಪೂಜೆ ಹಾಗೂ ಎಲೆ ಪೂಜೆಯನ್ನು ಪ್ರಕಾಶ ಕುಲಕಣರ್ಿಯವರು ನೇರವೇರಿಸುವ ಮೂಲಕ ತುಮಕೂರಿನ ನೆಡೆದಾಡುವ ದೇವರು, ಶತಮಾನದ ಸಂತ, ಕಲಿಯುಗದ ದೇವರು, ತ್ರಿವಿಧ ದಾಸೋಹಿ ಡಾ."
40,"ಎಲೆ ಬಿಚ್ಚಾಲಿ ಗ್ರಾಮ ಪಂಚಾಯ್ತಿಯಲ್ಲಿ 2016-2017ನೇ ಸಾಲಿನ 14ನೇ ಹಣಕಾಸು ಯೋಜನೆಯಡಿ ಅನುದಾನವನ್ನು ಅಧ್ಯಕ್ಷೆಯ ಪತಿ, ಮಾವ ವೈಯಕ್ತಿಕ ಹೆಸರಿನಲ್ಲಿ ಚೆಕ್ ಪಡೆದುಕೊಂಡಿದ್ದಾರೆ ಎನ್ನುವ ಆರೋಪ ಕೇಳಿ ಬಂದಿತ್ತು."
41,ಉದ್ಯಾನಗಳಲ್ಲಿನ ಎಲೆ ಮತ್ತಿತರ ತ್ಯಾಜ್ಯವನ್ನು ಗೊಬ್ಬರ ಮಾಡಲು ಗುಂಡಿಗಳ ನಿರ್ಮಾಣ ಮಾಡಬೇಕು.
42,ಅನೇಕ ಜನರು ಜೇನುತುಪ್ಪ ಕೆಮ್ಮು ಒಂದು ಎಲೆಕೋಸು ಎಲೆ ಚಿಕಿತ್ಸೆಗೆ ಬಳಸಲಾಗುತ್ತದೆ.
43,ಕಾಳುಮೆಣಸಿನ ಎಲೆ ಕೊಳೆರೋಗವನ್ನು ಹತೋಟಿಗೆ ತರಲು ಶೇ1 ರಷ್ಟು ಬೋರ್ಡೋ ದ್ರಾವಣವನ್ನು ಕಾಳುಮೆಣಸಿನ ಬಳ್ಳಿಗಳಿಗೆ ಸಿಂಪಡಿಸಬೇಕು.
44,ಎಲೆ ನೃಪ ಕಡೆಗಾಲದ ರುದ್ರನ ಭುಜ | ಬಲವ ನೆಗ್ಗುವ ಸತ್ತ್ವಯುತಗೆ |
45,ನುಗ್ಗೆೆ ಎಲೆ ಮತ್ತು ನುಗ್ಗೆೆ ಕಾಯಿಯನ್ನು ಪಡೆಯಬಹುದು.
46,ಹಸಿರು ಎಲೆ ಹಾಗೂ ತರಕಾರಿಗಳಿಂದ ಮಾಡಿದ ಸೂಪ್ ಅನ್ನು ಮಕ್ಕಳಿಗೆ ನೀಡಿ ಇದು ಮಕ್ಕಳ ಮಲಬದ್ಧತೆಯ ಸಮಸ್ಯೆಯನ್ನು ದೂರ ಮಾಡಿ ಹಸಿವು ಹೆಚ್ಚಿಸುತ್ತದೆ.
47,"ನಾವು ಬಾಗಿಲಿನ ಎಲೆ ಅಥವಾ ಕಿಟಕಿಯ ಬೋರ್ಡ್ನೊಂದಿಗೆ ವ್ಯವಹರಿಸುವಾಗ ಈ ಪರಿಸ್ಥಿತಿಯು ಪ್ರಾಯೋಗಿಕವಾಗಿ ಅಸಾಧ್ಯವಾಗಿದೆ, ತೇವಾಂಶ, ಉಷ್ಣತೆಯ ಬದಲಾವಣೆಗಳು ಅನಿವಾರ್ಯವಾಗಿ ಉತ್ಪನ್ನದ ವಿರೂಪಕ್ಕೆ ಕಾರಣವಾಗುತ್ತವೆ."
48,"ಈ ಹಲವರ ಜೊತೆಗೆ, ಎಲೆ ಮರೆಯ ಕಾಯಿಯಾಗಿ ಭುಜಕ್ಕೆ ಭುಜ ಸೇರಿಸಿ ಸೀತಾರಾಮ್ ನಿಂತಿದ್ದಾರೆ."
49,"ಇಂದು, ಆಫ್ರಿಕನ್ violets ಒಂದೇ ಮತ್ತು ಎರಡು ಹೂವುಗಳಲ್ಲಿ ಲಭ್ಯವಿದೆ, ಎಲ್ಲಾ ವಿವಿಧ ಬಣ್ಣಗಳಲ್ಲಿ, ಮತ್ತು ವ್ಯಾಪಕವಾಗಿ ವಿವಿಧ ಎಲೆ ಆಕಾರಗಳನ್ನು."
50,ಸಿದ್ಧಪಡಿಸಿದ ಹಣ್ಣುಗೆ ಎಲೆ ಸೇರಿಸಿ.
51,"ಮೃದುವಾದ ಬೆಣ್ಣೆ ಹಳದಿ, ಮೃದುವಾದ ಎಲೆ ಗ್ರೀನ್ಸ್, ಮತ್ತು ಆಕಾಶದ ಬ್ಲೂಸ್ಗಳು ವರ್ಷಗಳಿಂದಲೂ ವಿಸ್ತರಿಸಬಹುದು."
52,"ಅದೇ ಮೈಸೂರಿನ ಮುಖ್ಯ ನಗರದಲ್ಲಿ, ನಂಜನಗೂಡು, ಗುಂಡ್ಲುಪೇಟೆ ಇನ್ನೂ ಮುಂತಾದ ಸ್ಥಳಗಳಲ್ಲಿ ಬೇಡರ ಮಹಿಳೆಯರು ವೀಳ್ಯೆದೆಲೆ ವ್ಯಾಪಾರ, ಗಂಧದ ಕಡ್ಡಿ ವ್ಯಾಪಾರ, ಇಸ್ತ್ರೀ ಎಲೆ ವ್ಯಾಪಾರ, ಬೀಡಿ ವ್ಯಾಪಾರ ಮಾಡುತ್ತಾರೆ."
53,"ಈ ಕೆತ್ತನೆಯ ಕೌಶಲ ಕಂಡುಬರುವ ನಮೂನೆಗಳು : ನವಿಲು, ನಾನಾ ಪ್ರಕಾರದ ಹೂಗಳು, ವಿಮಾನ, ಮೀನು, ಪಕ್ಷಿ, ಎಲೆ, ಅತ್ತರದಾನಿ, ವಿವಿಧಾಕಾರದ ತಟ್ಟೆಗಳು, ಪನ್ನೀರದಾನಿ, ಹೂಜಿ, ದುಂಡು, ಅಂಡಾಕಾರದ ಬಾದಾಮಿ ಆಕಾರದ ಮಾವಿನಕಾಯಿ ನಮೂನೆಯ ಹಲವು ಬಗೆಯ ಕುಂಕುಮ ಅಂಗಚೂರ್ಣ ಡಬ್ಬಿಗಳು; ನಾನಾ ಪ್ರಕಾರದ ಹೂದಾನಿಗಳು, ತಾರೀಕು ಪಟ್ಟಿ ಪೀಠ, ದೀಪದ ಪೀಠ, ಪರಿಚಯ ಚೀಟಿ (ವಿಸಿಟಿಂಗ್ ಕಾರ್ಡ್), ಕಡ್ಡಿ ಪೊಟ್ಟಣ, ಸಿಗರೇಟು, ಮತ್ತು ಇಸ್ಪೀಟುಗಳ ಕೇಸುಗಳು, ಬೂದಿ ಕರಂಡಗಳು, ಶೇರವಾನಿ, ಶರ್ಟು ಕೋಟುಗಳ ಗುಂಡಿಗಳು, ವಿವಿಧ ಚಿತ್ರವಿಚಿತ್ರ ಬ್ರೋಚುಗಳು, ಎಲೆ ಅಡಿಕೆ ಡಬ್ಬಗಳು (ಪಾನದಾನಿ) ಬಳೆಗಳು, ಲೋಲಕ್ಕುಗಳು, ಜುಮುಕಿ, ಪೆಂಡೆಂಟು ಪದಕಗಳು, ಹೇರ್‍ಪಿನ್ ಮೊದಲಾದ ನಾನಾ ಪ್ರಕಾರದ ಮುಡಿ ಭೂಷಣದ ಮಸ್ತುಗಳು ಇತ್ಯಾದಿ."
54,ಎಲೆ ಸಾಮಾನ್ಯವಾಗಿ ಕಾಂಡದ ಮೇಲೆ ಜೋಡಿಯಾಗಿರುತ್ತದೆ.
55,ನಗುತ್ತಲೇ ಅವನಿಗೆ ನೀರು ಕೊಟ್ಟು ಅವನಿಗೆ ಎಲೆ ಹಾಕಿ ಊಟ ಬಡಿಸಿದಳು.
56,ಇದು ಎಲೆ ಉದುರುವ ಮರ.
57,"ಹೊನ್ನಹಟ್ಟಿ ಆಲೇಗೌಡ ಚಿನ್ನಮ್ಮನ ಅಣ್ಣಂದಿರಾದ ಎರಿಜಿನ್ನ, ಮರಿಜಿನ್ನ, ಕೀವಟ್ಟೆ, ಮರಿಪಿಡ್ಡ, ಕಡೆಹುಟ್ಟಿನ ಕಟ್ಟಾಣಿ, ಬೇವಿನ ಎಲೆ ಚಿನ್ನ, ದೊಡ್ಡ ಚಿನ್ನೇಗೌಡ, ಚಿಕ್ಕ ಚಿನ್ನೇಗೌಡ ಅವರೊಡನೆ ಮಾತುಕತೆ ನಡೆಸಿ ಕೆಂಗುರಿ ಮಲ್ಲಪ್ಪನ ಮದುವೆಯನ್ನು ಸ್ವತಃ ನಿಂತು ಮಾಡಿಸಿದ, ಮದುವೆ ಮಾಡಿಕೊಂಡ ಕೆಂಗುರಿ ಮಲ್ಲಪ್ಪ ತನ್ನ ತಂದೆ ದೇವರ ದಯಮಾರನಂತೆಯೇ ಹೆಂಡತಿಯನ್ನು ಮರೆತು, ದನಗಳನ್ನು ಕಾಯುತ್ತಾ ಕಾಡಿನಲ್ಲಿಯೇ ಹನ್ನೆರಡು ವರ್ಷಗಳನ್ನು ಕಳೆದ."
58,ನಾಯೀಮಗ ಎಲೆ ಎಸೆದು ಒಳ ಬರುವನು.
59,ಎಲೆ ಅವಲಕ್ಕಿ ಇತ್ತು.
60,ಕರಿಬೇವಿನ ಎಲೆ ಸೇವನೆಯಿಂದ ಒಂದೇ ತಿಂಗಳಲ್ಲಿ ತೂಕ ಕಳೆದುಕೊಳ್ಳಬಹುದಂತೆ!
61,ನೀಲಾಂಬಿಕೆ ನೀನು ಪೇಳು ಎಲೆ ಹೆಣ್ಣೆ | ಶಿವನು
62,"ಮೂಲತಃ ರೈತರಾಗಿರುವ ಇವರು ಗ್ರಾಮೀಣ ಪ್ರತಿಭೆಯಾಗಿ ಎಲೆ ಮರೆಯ ಕಾಯಿಯಂತೆ ತಮ್ಮ ಕಾರ್ಯವನ್ನು ಕೇವಲ ಸಂಗೊಳ್ಳಿ ಗ್ರಾಮದಲ್ಲಿ ಮಾತ್ರ ಇವರು ಶಕ್ತಿ ಪ್ರದರ್ಶನ ನಡೆಸುತ್ತಾ ಬಂದಿದ್ದಾರೆ, ಸರ್ಕಾರದ ಅನೇಕ ಕಾರ್ಯಕ್ರಮಗಳು ಜಿಲ್ಲೆಯಾದ್ಯಂತ ನಡಿಯುತ್ತಿದ್ದರು ಸಹ ಇವರನ್ನು ಅಧಿಕಾರಿಗಳು ಗುರುತಿಸದೇ ನಿರ್ಲಕ್ಷ ಮನೋಭಾವನೆ ತೊರುತ್ತಿದ್ದಾರೆ ಎಂದು ತಮ್ಮ ಅಳಲನ್ನು ತೊಡಿಕೊಂಡರು."
63,"ಜೋರಾಗಿ ಬೀಸಿದ ಗಾಳಿ ಮಳೆಗೆ ಗೊನೆ ಹೊತ್ತು ನಿಂತಿದ್ದ ಸುಮಾರು 60 ಎಕರೆ ಬಾಳೆ ತೋಟ, ಮೈತುಂಬಿಕೊಂಡಿದ್ದ 40 ಎಕರೆಗೂ ಹೆಚ್ಚಿನ ಎಲೆ ತೋಟಗಳು ಹಾನಿಗೀಡಾಗಿವೆ."
64,ಅವುಗಳ ಎಲೆ ನೋಡಿದಾಗ ಹಸಿರನಲ್ಲಿ ಎಷ್ಟೊಂದು ಬಣ್ಣಗಳು ಎಂಬ ಉದ್ಗಾರ!
65,ಮಡೆಸ್ನಾನ ಮಾಡುವವರು ಬೇರೆಯವರನ್ನೇನೂ ಬಲವಂತವಾಗಿ ಎಲೆ ಮೇಲೆ ತಳ್ಳುತ್ತಿಲ್ಲ.
66,"ಆ ನಂತರ, ಪಾಸ್ಟಾ ಒಂದು ಬೇ ಎಲೆ ಹಾಕಲಾಗುತ್ತದೆ, ಮತ್ತು ಬೆಂಕಿ ಅಧಿಕಗೊಂಡರೆ."
67,"ಈ ಎಲೆ ಬಹಳ ದುರ್ಬಲವಾಗಿ ಕಾಣುತ್ತದೆಯಾದರೂ, ಎಲ್ಲವನ್ನೂ ವಿಶ್ವಾಸದಿಂದ ಮತ್ತು ಅಪಾಯವಿಲ್ಲದೆಯೇ ತುಂಡು ಮಾಡಲು ಸಾಧ್ಯವಿದೆ."
68,ಕರಿಬೇವಿನ ಎಲೆ -5 ರಿಂದ 6
69,ಇದರ ಕೆಳಭಾಗವು ಕಾಂಡದ ಎಲೆ ಹೆಚ್ಚುತ್ತಿರುವ ನೀರಿನಡಿ ಆಗಿದೆ.
70,"ಹನಿ ನೀರಿನ ಸೌಲಭ್ಯ ಪಡೆದು, ಮೃದು ಎಲೆ ಹೊಂದಿ ಹೆಚ್ಚು ಇಳುವರಿ ನೀಡುವ ವಿ-1 ತಳಿ ಸಾಗುವಳಿ ಮಾಡಿದ್ದಾರೆ."
71,ಸಾರಜನಕ-ಸಮೃದ್ಧ ಅಡುಗೆ ಸ್ಕ್ರ್ಯಾಪ್ ಮತ್ತು ಹುಲ್ಲಿನ ತುಣುಕುಗಳ ಪದರದೊಂದಿಗೆ ಕಾರ್ಬನ್-ಶ್ರೀಮಂತ ಸತ್ತ ಎಲೆ ಪದರವನ್ನು ಪದರಕ್ಕೆ ಮುಂದುವರಿಸಿ.
72,"ಇದು ಪ್ರಾಣಿಗಳು ಮತ್ತು ನಿರ್ಜೀವ ವಸ್ತುಗಳ ಜಗತ್ತಿಗೆ ಉಲ್ಲೇಖಿಸುವಾಗ, ಇವಾನ್ Antonovich, ಇವರ ಹಾಸ್ಯ, ಅಸಭ್ಯ ಅಡ್ಡಹೆಸರು (ಹೂಜಿ ಎಲೆ ಮೂತಿಯನ್ನು) ವಿಕೃತ ಚಿತ್ರವನ್ನು ಆರಂಭದಲ್ಲಿ ಗಮನಿಸಬೇಕು."
73,"ನಂತರ, ಮಲ್ಟಿವರ್ಕ್, ಕಟ್ ಆಲೂಗಡ್ಡೆ, ವೆಮಿಸೆಲ್ಲಿ, ಉಪ್ಪು, ತೆಳುವಾದ ಪಟ್ಟಿಗಳಾಗಿ ಕತ್ತರಿಸಿ, ಬೇ ಎಲೆ ಸೇರಿಸಿ ಮತ್ತು ರುಚಿಗೆ ಮಸಾಲೆ ಹಾಕಿದ ಬೌಲ್ನಲ್ಲಿ ಅಣಬೆಗಳನ್ನು ಹಾಕಿ."
74,ಮಡದಿ ಕೇಳು ಮಡಲಿಗಿಲ್ಲ ಎಲೆ ತಂಗಿ | ಶಿವಗೆ
75,"ನಮ್ಮ ಪೂರ್ವಜ್ಜರು, ಹಿರಿಯರು ದಿನದ 12 ತಾಸು ಎಲೆ ಅಡಿಕೆಯನ್ನು ಬಾಯಲ್ಲಿ ಚಪ್ಪರಿಸುತ್ತಾ ಹೊಲ ಗದ್ದೆಗಳಲ್ಲಿ, ಹಲವಾರು ಕಚೇರಿಗಳಲ್ಲಿ ಕಾಲ ಕಳೆಯುತ್ತಾ ನೂರು ವರ್ಷಗಳ ವರೆಗೆ ಬಾಳಿ ಬದುಕಿದ್ದಾರೆ."
76,"ಅವರದೇ ಚಾಪೆ, ತಂಬಿಗೆ, ಲೋಟ ಎಲ್ಲ ಪ್ರತ್ಯೇಕ ಬಾಳೆ ಎಲೆ ಅಥವಾ ಅಡಿಕೆ ಮರದ ಹಾಳೆಗಳಲ್ಲಿ ಊಟ ತಿಂಡಿ."
77,"ಎಲೆ ಲಿಂಗರಾಜು, ಶಿವಗಂಗೆ ಬೆಟ್ಟದಲ್ಲಿ ಉಗಮವಾಗುವ ಕುಮುದ್ವತಿ ನದಿ ಭಾಗದಲ್ಲಿ ಕೆಲಸ ನಡೆಯುತ್ತಿದೆ."
78,ಆಂಜನೇಯ ದೇವಸ್ಥಾನಕ್ಕೆ ಹೋಗಿ ಐದು ಪ್ರದಕ್ಷಿಣೆ ಮಾಡಬೇಕು ಮತ್ತು ನೀವು ನಿಮ್ಮ ಕೈಯಿಂದ ಎಲೆ ಅಡಿಕೆ ಎಳ್ಳೆಣ್ಣೆ ಮತ್ತು ಗಂಗ ಸಿಂಧೂರವನ್ನು ಸಮರ್ಪಣೆ ಮಾಡಬೇಕು ನೀವು ಇದನ್ನು ಮಾಡುವುದರಿಂದ ನಿಮಗೆ ಧನ ಆದಾಯ ಹೆಚ್ಚಳ ಆಗುತ್ತದೆ ನಿಮ್ಮ ಜೀವಿತ ಅವಧಿಯಲ್ಲಿ ಒಂದು ಸಲ ಆದರೂ ಶ್ರೀ ರಾಮ ನವಮಿ ದಿನದಂದು ನೀವು ಸೀತಾರಾಮ ಕಲ್ಯಾಣ ಮಾಡಿಸಬೇಕು ನೀವು ನಿಮ್ಮ ಸ್ವಂತ ಖರ್ಚಿನಿಂದ ಮಾಡಿದರೆ ನಿಮಗೆ ಅಖಂಡ ಐಶ್ವರ್ಯ ಪ್ರಾಪ್ತಿ ಆಗುತ್ತದೆ ಎಂದು ಜ್ಯೋತಿಷ್ಯ ಶಾಸ್ತ್ರ ಹೇಳುತ್ತದೆ.
79,* ಕೆಲವು ಸಸ್ಯಗಳ ಎಲೆ ಅತ್ಯಂತ ಹೆಚ್ಚು ಕಹಿಯಾಗಿರುತ್ತವೆ.
80,ನಂತರದ ದಿನಗಳಲ್ಲಿ ಪಾಟ್‌ ಒಂದರಲ್ಲಿ ಹಸಿತ್ಯಾಜ್ಯಗಳನ್ನೆಲ್ಲಾ ಹಾಕಿ ಅದರ ಮೇಲೆ ಸ್ವಲ್ಪ ಒಣಗಿದ ಎಲೆ ಹಾಕಿ ತೆಂಗಿನಕಾಯಿ ನಾರು ಹಾಕಿ ಮೇಲಿನಿಂದ ಮಣ್ಣು ಮುಚ್ಚಿದೆ.
81,"ಬೆಳ್ತಿಗೆ ಅಕ್ಕಿಯ ಹಿಟ್ಟಿಗೆ ನೀರನ್ನು ಚಿಮುಕಿಸಿ ಕಲೆಸಿ ಪೂವರಸು ಮರದ ಎಲೆಯಲ್ಲಿ ಹಿಟ್ಟನ್ನು ಹರಡಿ ಅದರೊಳಗೆ ಹೆಸರುಬೇಳೆ, ಬೆಲ್ಲ, ತೆಂಗಿನಕಾಯಿ ಬೆರೆಸಿದ ಹೂರಣವನ್ನು ಇಟ್ಟು ಎಲೆಯನ್ನು ಮುಚ್ಚಿ ಹೂರಣ ಹೊರಗೆ ಬಾರದಂತೆ ಹಿಟ್ಟನ್ನು ಅಂಟಿಸಿ ನೀರಾವಿಯಲ್ಲಿ ಬೇಯಿಸುವುದು ಎಲೆ ಮೋದಕವಾಗಿದೆ."
82,ಬೀಜ ಅಥವಾ ಎಲೆ ಕತ್ತರಿಸಿದ ಮೂಲಕ ಪ್ರಸರಣವನ್ನು ಸಾಧಿಸಲಾಗುತ್ತದೆ.
83,"BLACK + DECKER ನಿಂದ ಈ ಎಲೆ ಕಳ್ಳ ಒಂದು 7-AMP ಮೋಟಾರು ಹೊಂದಿದೆ, ಮತ್ತು ಅದರ ಪರಿಮಾಣಕ್ಕೆ ಸಂಬಂಧಿಸಿದಂತೆ ಅದರ ಶಕ್ತಿಗೆ ಅವರು ಪ್ರಭಾವಿತರಾಗಿದ್ದಾರೆ ಎಂದು ಅನೇಕ ವಿಮರ್ಶಕರು ಹೇಳುತ್ತಾರೆ."
84,ಅಡುಗೆಗೆ ಬೇಕಾದ ತಾವರೆ ಎಲೆ ಬೆಳೆದುಕೊಳ್ಳುತ್ತೇವೆ.
85,ಅಳಿಯನ ಎಲೆ ಖಾಲಿಯಾಗಿದ್ದನ್ನು ನೋಡಿ ಅತ್ತೆ ಅಳಿಯನಿಗೆ ಎರಡು ಹೂರಣದ ಹೋಳಿಗೆಗಳನ್ನು ಜೋಡಿಸಿ ತಂದು ಹಾಕಿದರು.
86,"ಇದು ಸೂಪ್, ಬೇಯಿಸಿದ ಗೋಮಾಂಸ ಮತ್ತು ಎಲೆ ತರಕಾರಿಗಳನ್ನು ತಿನ್ನಲು ಅನುಮತಿಸಲಾಗಿದೆ (ಎಲ್ಲಾ ರೀತಿಯ ಸಲಾಡ್, ಸೋರ್ರೆಲ್, ಇತ್ಯಾದಿ);"
87,"ನಂತರ ಪರಿಣಾಮವಾಗಿ ಸಮೂಹ ಉಪ್ಪು ಮತ್ತು ಮಸಾಲೆ ಕರಿಮೆಣಸು, ಲವಂಗ, ಮತ್ತು ಬೇ ಎಲೆ ಮಾಡಬೇಕು."
88,ಎಲೆ ವೈದ್ಯಕೀಯ ರೂಪ.
89,"ಹಲವು ವರ್ಷಗಳ ಕಾಲ ಬದುಕಿದ್ದ ಮರದ ಮೊಳಕೆ ಮತ್ತು ಆರಾಮದಾಯಕ ಸಾಂಸ್ಕೃತಿಕ ಪರಿಸ್ಥಿತಿಗಳಲ್ಲಿ ಬೆಳೆಯುತ್ತಿದ್ದು, ಎಲೆ ಮೇಲ್ಮೈ ಮತ್ತು ಮೂಲ ಬೆಳವಣಿಗೆಯ ಜಾಗರೂಕತೆಯಿಂದ, ನೈಸರ್ಗಿಕ ಸಮತೋಲನವನ್ನು ಬೆಳೆಸುತ್ತದೆ."
90,ಸ್ಟ್ರಾಬೆರಿ ಮತ್ತು ಕಿವಿ ಫ್ರೂಟ್: ಸ್ಟ್ರಾಬೆರಿ ಮತ್ತು ಕಿವಿಫ್ರೂಟ್‌ ಜತೆ ಎರಡು ಪುದೀನಾ ಎಲೆ ಹಾಕಿ ಜ್ಯೂಸ್‌ ಮಾಡಿ ಕುಡಿದರೆ ಸುಸ್ತು ಬೇಗನೆ ಕಡಿಮೆಯಾಗುವುದು.
91,"ಈ ಎಲೆಗಳು ಸಸ್ಯದಿಂದ ಬಹಳಷ್ಟು ರಸವನ್ನು ಮತ್ತು ಶಕ್ತಿಯನ್ನು ತೆಗೆದುಕೊಳ್ಳುತ್ತವೆ, ಆದ್ದರಿಂದ ಕೇವಲ ಒಂದು ಸಂಕೀರ್ಣವಾದ ಎಲೆ ಅಗತ್ಯವಿರುತ್ತದೆ, ಮತ್ತು ಎರಡು ಎಲೆಗಳನ್ನು ಐದು ಎಲೆಗಳಿಂದ ತೆಗೆಯಲಾಗುತ್ತದೆ ಮತ್ತು ಉಳಿದ ಮೂರು ಭಾಗಗಳನ್ನು ಮೂರನೆಯದಾಗಿ ಕತ್ತರಿಸಲಾಗುತ್ತದೆ."
92,ಮಲ್ಲಮ್ಮ ಎಂದಿನಂತೆ ತನ್ನ ಎಲೆ ತೋಟದಲ್ಲಿ ಮಧ್ಯಾಹ್ನ ಕೆಲಸ.
93,ದೊಡ್ಡಪತ್ರೆ ಎಲೆ ತಂಪಿನ ಗುಣ ಹೊಂದಿದೆ.
94,ಇತರ ಸಂದರ್ಭಗಳಲ್ಲಿ ಅದು ಬಾಗಿಲು ಎಲೆಯ ಒಂದು ಎಲೆ ಆದ್ಯತೆ ನೀಡಲು ಸಾಧ್ಯ.
