Index,Sentence
206,"ಕೀಟವು ನಿಮ್ಮ ಮೇಲೆ ಫೀಡ್ ಮಾಡಿದಾಗ ನೀವು ಪಡೆಯುವ ಬಂಪ್ಗಿಂತ ಭಿನ್ನವಾಗಿ ಅಲ್ಲ, ಎಲೆ ಗಾಲ್ ಹೋಗುವುದನ್ನು ನಿರೀಕ್ಷಿಸುವುದಿಲ್ಲ."
207,"ಮಾಮೂಲಿ ಕಡ್ಜುಳಕ್ಕಿಂತ ಇದು ಬೇರೆ ಎಂದು ಗುರುತಿಸಲು ಹುಲಿ ಕಡ್ಜುಳ ಎಂದು ಹೆಸರಿಟ್ಟಿದ್ದರು ನಮ್ಮ ಹಳ್ಳಿ ಇದಕ್ಕಿಂತ ತುಸು ಚಿಕ್ಕದಾದ, ಎಲೆ ಕಡ್ಜುಳ ಎಂಬ ಹಸಿರು ಬಣ್ಣದ ಇನ್ನೊಂದು ಕೀಟವೂ ಇದೆ."
208,ಇಲ್ಲಿನ ಅಂಬಾಡಿ ಎಲೆ ಸವಿಯಲು ರುಚಿ ಮತ್ತು ಮೃದುವಾಗಿ ಇರುವುದು ಇದಕ್ಕೆ ಕಾರಣ ಎಂದು ರೈತ ನಿಂಗಪ್ಪ ಚಲವಾದಿ ಹೇಳಿದರು.
209,"ಹೆಚ್ಚು ಸೂರ್ಯನ ಬೆಳಕು ಎಲೆ ತುದಿ ಸುಟ್ಟ ಅಥವಾ ಬಣ್ಣಗಳನ್ನು ಉಂಟುಮಾಡಬಹುದು, ಆದರೆ ತಮ್ಮ ಬುಟ್ಟಿಗಳಲ್ಲಿ ಕಳಪೆ ಒಳಚರಂಡಿ ಬೇರುಗಳನ್ನು ಹಾನಿಗೊಳಿಸುತ್ತದೆ."
210,"ಎಣ್ಣೆ ಕಾಯಲು ಇಟ್ಟು ಕಲೆಸಿದ ಹಿಟ್ಟಿನಿಂದ ಚಿಕ್ಕ ಚಿಕ್ಕ ಉಂಡೆ ಮಾಡಿ, ಬಾಳೆ ಎಲೆ ಅಥವಾ ಪ್ಲಾಸ್ಟಿಕ್ ಪೇಪರ್ ಗೆ ಎಣ್ಣೆ ಸವರಿ ಉಂಡೆಗಳನ್ನು ಇಟ್ಟು ತಟ್ಟಿ ಕಾದ ಎಣ್ಣೆ ಗೆ ಹಾಕಿ ಕೆಂಪಗೆ ಕರಿದು ತೆಗೆಯಿರಿ."
211,"ಉಪ್ಪು, ಮೆಣಸು, ಬೇ ಎಲೆ ಸೇರಿಸಿ."
212,ಒಂದು ಕುಟುಂಬಕ್ಕೆ ಮೂರು ಹಾಲು ಕರೆಯುವ ಹಸುಗಳು ಮತ್ತು ಐವತ್ತು ಎಲೆ ಬಳ್ಳಿಗಳಿದ್ದರೆ ನೆಮ್ಮದಿಯ ಜೀವನ ನಡೆಸಬಹುದು ಎನ್ನುವುದಕ್ಕೆ ಫಿಲೋಮಿನಾ ಅವರು ಉದಾಹರಣೆ.
213,ಎಲೆ ಗೋಪಿ ನಿನ್ನ ಮಗನ ದೆಸೆಯಿಂದಮ್ಮ | ಕಲತಿಯ ಮೊಸರು ಬದುಕುದು |
214,"ಹುಣಸೂರು: ರಾಗಿ ಬೆಳೆಗೆ ಎಲೆ ತಿನ್ನುವ ಹುಳು ಕಾಣಿಸಿಕೊಂಡಿದ್ದು, ಇದರಿಂದ ರೈತರು ಕಂಗಾಲಾಗಿದ್ದಾರೆ."
215,ಈಗ ಬಾಳೆ ಎಲೆ ಅಥವಾ ಪ್ಲಾಸ್ಟಿಕ್ ಕವರ್ ನಲ್ಲಿ ಅಂಗೈ ಅಗಲಕ್ಕೆ ತಟ್ಟಿ ಎಣ್ಣೆಯಲ್ಲಿ ಹಾಕಿ ಕರಿಯಿರಿ.
216,ಇದು ಅಂತಿಮವಾಗಿ ಎಲೆಗಳು ಮತ್ತು ಅಕಾಲಿಕ ಎಲೆ ಡ್ರಾಪ್ ಹಳದಿ ಕಾರಣವಾಗಬಹುದು.
217,ಯಾವಾಗ ಮೊಗ್ಗು ಹೂದಾನಿ ಜೀವನದ ಬಲ್ಬ್ಗಳಿಗೆ 2 ಕಡಿಮೆ ಎಲೆ ಬಿಡಲು ಅಗತ್ಯ ತಿನ್ನುವುದು ಮತ್ತು ಸಾಮಾನ್ಯವಾಗಿ ಅಭಿವೃದ್ಧಿ ಸಾಕಷ್ಟು ಆಗಿತ್ತು.
218,"ಸದಾ ಸಿಡುಕುತನದ ಒರಟು ಮೋರೆ,ಯಾವಾಗಲೂ ಒಟ ಒಟಗುಡುವ, ಎಲೆ ಅಡಿಕೆ ಜಗಿದು ಜಗಿದು ಕೆಂಪಾದ ಬಾಯಿ."
219,ಚಿಂತಕರು ಹಾಗೂ ವಿಷಯ ತಜ್ಞರ ಕೂಟಗಳು ಚುರುಕಾಗಿ ತಮ್ಮ ಕೆಲಸವನ್ನು ಎಲೆ ಮರೆ ಕಾಯಿಯಂತೆ ನಿರಂತರವಾಗಿ ನಡೆಸುತ್ತಿರಬೇಕು.
220,"ಹೇಳೈ, ಎಲೆ ಹೂವೇ?"
221,"ಈ ಗಿಡಗಳಿಗೆ ಶಿಲೀಂದ್ರ, ಎಲೆ ತಿನ್ನುವ ಹುಳುಗಳ ಕಾಟ ಹೆಚ್ಚು."
222,ಇದು ವಿಶಾಲವಾದ ಎಲೆ ಋಷಿಯಾಗಿದ್ದು ಅದರ ಬಲವಾದ ಆರೊಮ್ಯಾಟಿಕ್ ಗುಣಲಕ್ಷಣಗಳಿಗೆ (ವಿಭಿನ್ನ ವಿಧದ ಋಷಿಗಳ ಪ್ರಬಲ) ಹೆಚ್ಚು ಪ್ರಶಂಸನೀಯವಾಗಿದೆ.
223,": ಎಲೆ ನಾರಿ, ಈ ನಿನ್ನ ಬಿಂಕದ ಪತಿಯಾರು ?"
224,"ಸ್ಟೇಜಿನ ಒಂದು ಮೂಲೆಯಲ್ಲಿ ಎಲೆ ಅಡಿಕೆ ಹಾಕಿಕೊಳ್ಳುತ್ತ ಕುಳಿತಿದ್ದ ಆಕೆ ಹರದೇಶಿ ಹಾಡುಗಾರನತ್ತ, ತಂಡದತ್ತ ಲಟಿಕೆ ಮುರಿಯುತ್ತಾ ಸಾಪಳಿಸುತ್ತಿದ್ದಳು."
225,"ಇದು ಕುದಿಯುವ, ಬೆಳ್ಳುಳ್ಳಿ, ಸೇರಿಸಲು ಬೇ ಎಲೆ ಮತ್ತು ಕೆಲವು ಮೆಣಸು."
226,ಎಲೆ ಅಥವಾ ಅದರ ಬಿಸಿ ರಸವನ್ನು ಯಾವುದೇ ಎಣ್ಣೆಯ ಜೊತೆ (ಕೊಬ್ಬರಿ ಎಣ್ಣೆ) ಮಿಶ್ರ ಮಾಡಿ ಹಚ್ಚುವುದರಿಂದ ಬೆನ್ನಿನ ಕೆಳಭಾಗದ ನೋವನ್ನು ಕಡಿಮೆ ಮಾಡುತ್ತದೆ.
227,ನಡುಗಲು ಉತ್ತಮ ಸಮಯ ಮರಗಳು ಎಲೆ ಮೊದಲು.
228,"ಮಕ್ಕಳಿಗೆ ಮರ ಅಲ್ಲಾ ಮರದ ಎಲೆ ಮುಟ್ಟೋಕು ಬಿಡಲ್ಲ ಎಂಬ ಫಾರೆಸ್ಟ್ ಆಫೀಸರ್ ಡೈಲಾಗ್ ಇರಲಿ, ಚೀಂಕ್ರನ ಡೈಲಾಗ್ ಇರಲಿ ಕೊನೆಯಲ್ಲಿ ನಾಯಕ-ನಾಯಕಿ ಸಂಭಾಷಣೆಯಾಗಲಿ ಇನ್ನಷ್ಟು ಬೆಳೆಸಬಹುದಿತ್ತು."
229,ಕಳತನ ಮಾಡಬೇಡ ಎಲೆ ಮನವೇ |
230,ಸಾಲವು ನಿದ್ದೆ ನೆಲದ ತಡೆಗಟ್ಟುತ್ತದೆ ಮೊದಲ ಎಲೆ ನಲ್ಲಿ ಮೊಳಕೆ ಬರಿ.
231,ಬಡಿಸಿದ ಎಲೆ ಮುಂದೆ ಕೂತು ಅಡಿಗೆಯವರಾರು ?
232,ಅತಿಥಿಯೊಬ್ಬ ಊಟ ಮಾಡಿ ಎಲೆ ಅಡಿಕೆ ಹಾಕಿಕೊಳ್ಳುತ್ತ ಅವಳ ಕಡೆಗೆ ನೋಟ ಬೀರುತ್ತಿರುತ್ತಾನೆ.
233,"ಉತ್ಪನ್ನಗಳ ಮುಂದಿನ ಅಗತ್ಯವಿರುವ ಹೊಂದಿದೆ ತಯಾರಿಕೆಗೆ: 1 ಡಕ್ ಹಕ್ಕಿ 2 ಪ್ರಮುಖ ಸೇಬು ದೊಡ್ಡ ಈರುಳ್ಳಿ, ಉಪ್ಪು, 175 ಗ್ರಾಂ ಹುಳಿ ಕ್ರೀಮ್, ಕರಿಮೆಣಸು, ನೀರು, ಬೇ ಎಲೆ ಮತ್ತು ತರಕಾರಿ ತೈಲ 60-80 ಗ್ರಾಂ."
234,"ಈಗ ಒಂದು ಪ್ಯಾನ್ ತೊಳೆದು ಒಣದ್ರಾಕ್ಷಿ, ಮೆಣಸು, ಕೊಲ್ಲಿ ಎಲೆ ಹಾಕಬಹುದು ನೀರು ಸೇರಿಸಿ."
235,ಅನ್ನಾಕಿ ಎಲೆ ಪುನ್ಯ ಪಡದಾರ ವಿಠ್ಠಲದಾಸ
236,"ಸಹಜವಾಗಿ, ಈ ಕಾರಣಗಳು ಸಹ ಇರಬಹುದು, ಆದರೆ ತೇವಾಂಶ ರಾಸ್ಪ್ಬೆರಿ ಸಸ್ಯರೋಗ, ಎಲೆ ಸುಟ್ಟ ಕೊರತೆಯಿರುವ, ಆದರೆ ಬಿದ್ದು ಹಳದಿ ತಿರುಗಿ ಮಾಡುವುದಿಲ್ಲ."
237,"ಈಗಲೂ ಮಹಿಳೆಯರು ಬಟ್ಟೆ, ಪೇಪರ್, ಒಣಗಿದ ಎಲೆ ಬಳಸ್ತಾರೆನ್ನುವ ವಿಷಯ ತಿಳಿದಿತ್ತು."
238,"ಗ್ಲ್ಯಾಡಿಯೋಲಸ್‌ ಹೂವಿನಗಿಡಗಳಿಗೆ ಎಲೆ ತಿನ್ನುವ ಹುಳು ಮತ್ತು ಕೆಂಪುನುಶಿ, ಕಂದುಕೊಳೆ ರೋಗ ಸೊರಗು ರೋಗಗಳು ಬರುವ ಸಾಧ್ಯತೆಗಳು ಇರುವುದರಿಂಧ ಬೇಗನೇ ಹತೋಟಿ ಕ್ರಮಗಳನ್ನು ಕೈಕೊಳ್ಳಬೇಕು."
239,ಹಳದಿ ಎಲೆ ರೋಗದಿಂದ ಅಡಕೆ ಬೆಳೆ ನಾಶಗೊಂಡು ಬೆಳೆಗಾರರು ಗುಳೆ ಹೋಗುತ್ತಿದ್ದಾರೆ.
240,"ಮೊದಲಿಗೆ ಬಾಣಲೆಗೆ 2 ಚಮಚ ತುಪ್ಪವನ್ನು ಹಾಕಿ, ಕಾದ ನಂತರ ಏಲಕ್ಕಿ, ಲವಂಗ, ಚಕ್ಕೆ, ಕಾಳುಮೆಣಸು, ಪಲಾವ್ ಎಲೆ ಹಾಕಿ ಕೆಂಪಗೆ ಹುರಿದುಕೊಳ್ಳಬೇಕು."
241,ಹೊಟ್ಟೆಹೊರೆದು ಬಾಳೊಕಿಂತ ಎಲೆ ಹೆಣ್ಣೆ | ಒಂದು
242,"ಭೂಮಿ, ಈ ರೀಡ್ಗೆ ಅತ್ಯಂತ ಆರಾಮದಾಯಕ - ಎಲೆ ಭೂಮಿ, ಪೀಟ್, ಮರಳು ಮಿಶ್ರಣವನ್ನು ನೀವು ಮಣ್ಣಿನ ಸಿಲ್ಟ್ ಅಥವಾ ಸಪ್ರೊಪೆಲ್ ಅನ್ನು ಸೇರಿಸಬಹುದು."
243,ಎಲೆ ಹುತಾಶನ ಭೂತಭಾವನ
244,"ನಿಮ್ಮ ಬಲಗೈಯಲ್ಲಿ, ಒಂದು ಲಾರೆಲ್ ಎಲೆ ಮತ್ತು ಎಡಭಾಗದಲ್ಲಿ - ಮಸೂದೆಗಳನ್ನು ಇರಿಸಿ."
245,(ಒಡಾಳೆ ಪಟ್ಟೆ = ಅಡಿಕೆ ಮರದ ಹೊಂಬಾಳೆಗೆ ಮುಸುಕಾಗಿರುವ ತಿಗುಡು) ಒಡಾಳೆ ಪಟ್ಟೆಗೆ ಕೆಲವು ಕಡೆ ಸುಲಿಪಟ್ಟೆ ಎಲೆ ಎಂದೂ ಹೇಳುತ್ತಾರೆ.
246,"ಕ್ಕೂ ಹೆಚ್ಚಿನ ಗಿಡ, ಪೊದೆಗಳು, ಪಾಚಿ, ನಾಯಿಕೊಡೆ, ಎಲೆ ಬಳ್ಳಿ, ಪರಪುಟ್ಟ ಸಸ್ಯ ಹಾಗು ಅವುಗಳ ಚಿಗುರು, ಫಂಗೈ, ಅಲ್ಗೈ, ಬ್ಯಾಕ್ಟೀರಿಯಾ, ೨,೨೦೦ಕ್ಕೂ ಮಿಕ್ಕಿದ ಪ್ರಜಾತಿಯ Grass Hoppers ಶಿವನ ಕುದುರೆಗಳು, ೨೦,೦೦೦ ಕ್ಕೂ ಮಿಕ್ಕಿದ ವಿವಿಧ ಜಾತಿಯ ಮಿಡತೆಗಳು, ೧,೨೦,೦೦೦ ಸಂಖ್ಯೆಯ ಕೀಟಗಳು, ರೆಕ್ಕೆಯ ಪತಂಗಗಳು, ಕ್ರಿಮಿಗಳು ಹಾಗು ೧,೭೦,೦೦೦ ದಷ್ಟು ಪಾತರಗಿತ್ತಿ ಪ್ರಜಾತಿ ಇವುಗಳ ಇಷ್ಟದ ಆಹಾರ."
247,ಸಿಲೋನ್ ದೊಡ್ಡ ಎಲೆ ಕ್ರಾನ್ ಸಂಗ್ರಹಗಳನ್ನು ಕಪ್ಪು ಚಹಾ.
248,"ಈ ಬಾಣಗಳನ್ನು ಬೆಳ್ಳುಳ್ಳಿ, ವಿನೆಗರ್, ಉಪ್ಪು ಮತ್ತು ಬೇ ಎಲೆ ಅಗತ್ಯವಿದೆ."
249,ಹೊಟ್ಟಿಕೂಳ ತಿಂದ ನಾಯಿ ಎಲೆ ಹೆಣ್ಣೆ | ದೊಡ್ಡ
250,ಎಲೆ ಕೃಷ್ಣ ಸಾಯದೆಬಂದೆರಗಲ್ಲದೊ | ಡಲಸದೆ ಕಾಯ್ದುಕೊಳ್ಳೆಂದು |
251,"ನಂತರ ಮಾವಿನ ತೊಳಲು, ಹೂವು, ಎಲೆ ಹಾಗೂ ಟೆಂಗಿನ ಕಾಯಿಗಳಿಂದ ಸಿಂಗರಿಸಿದ ಪೂರ್ಣಕುಂಭಗಳನ್ನು ಹೊತ್ತುಕೊಂಡ ಮುತ್ತೈದೆಯರ ಮೆರವಣಿಗೆಯೊಂದಿಗೆ ಗ್ರಾಮದ ಪ್ರಮುಖ ಬೀದಿಗಳಲ್ಲಿ ನಡೆದ ಪಲ್ಲಕ್ಕಿ ಮೆರವಣಿಗೆಯಲ್ಲಿ ಪಾಲ್ಗೊಂಡರು."
252,ವಾದಿಮುನಿಗಳಿಂದ ಶಿವನ ಎಲೆ ದೇವ | ಜರಿಯೆ
253,ಎಲೆ ಧರಾಧಿಪ ಕೇಳು ಮಣಿಧರ |
254,ನೀವು ಈ ಸಂಕಷ್ಟದಿಂದ ಮುಕ್ತಿ ಪಡೆಯಲು ಏನೆಲ್ಲಾ ಕಾರ್ಯಗಳು ಮಾಡಬೇಕು ಅಂದ್ರೆ ಅರಳಿ ಮರದ ಎಲೆ ತೆಗೆದುಕೊಂಡು ಬಂದು ಅದನ್ನ ಮನೆಯ ದೇವರ ಮನೆಯಲ್ಲಿ ಇಟ್ಟು ಅದನ್ನು ಪೂಜಿಸಬೇಕು ಜೊತೆಗೆ ಗೋ ಮಾತೆಗೆ ಕಡಲೆ ಮತ್ತು ಬೆಲ್ಲ ಮತ್ತು ಅಕ್ಕಿ ಈ ಮೂರು ಸೇರಿಸಿ ನಿಮ್ಮ ಮನಸಿಗೆ ಬಂದಷ್ಟು ಆಹಾರ ನೀಡಿ ಆ ಗೋ ಮಾತೆ ಸಂತೃಪ್ತಿ ಹೊಂದಿದ್ದರೆ ಖಂಡಿತ ನಿಮ್ಮ ಸಮಸ್ಯೆಗಳಿಗೆ ತಕ್ಕ ಮಟ್ಟಿಗೆ ಪರಿಹಾರ ದೊರೆಯಲಿದೆ.
255,"ಯಾವುದೇ ಘನೀಕರಿಸುವ ಅಥವಾ ಮಂಜಿನಿಂದ ಕೂಲ್ ರಾತ್ರಿ ಉಷ್ಣಾಂಶಗಳು ಮತ್ತು ತಂಪಾದ, ಪ್ರಕಾಶಮಾನವಾದ, ಸುತ್ತುವರಿಯದ ಬಿಸಿಲಿನ ದಿನಗಳು ಎಲೆ ಬಣ್ಣ ಬದಲಾವಣೆಯನ್ನು ಹೆಚ್ಚಿಸುತ್ತವೆ."
256,"ಎಲೆ ಮನವೆ, ಆವಲ್ಲಿ ನೀನೆಂಬ ಶಂಕೆ ಹಿಂಗಿ ತಾನೆ ತೋಱುತ್ತಿಹುದು ಅದೀಗ ನಿನ್ನ ನಿಜ,"
257,ಕಗ್ಗ ಗಿಡದ ಎಲೆ ಅಥವಾ ಕಾಂಡ ಆಗಾಗ ಉಪ್ಪು ನೀರಿನಲ್ಲಿ ಮುಳುಗಿ ಏಳುವುದರಿಂದ ದನಕರುಗಳು ಈ ಹುಲ್ಲನ್ನು ಅಷ್ಟಾಗಿ ಇಷ್ಟಪಡುವುದಿಲ್ಲ.
258,ನಿಜವಾದ ಎಲೆ ವರ್ಣದ್ರವ್ಯಗಳು ಮರಗಳ ಪ್ರಭೇದಗಳೊಂದಿಗೆ ಬದಲಾಗುತ್ತವೆ ಮತ್ತು ಹೀಗಾಗಿ ವಿಭಿನ್ನ ವಿಶಿಷ್ಟವಾದ ಎಲೆ ಬಣ್ಣಗಳು.
259,"ನೀವು ಕೊಠಡಿ ಮರಳಿ ಪಡೆದಾಗ, ನೀವು ಬೇಯಿಸಿದ ಎಲೆ ಕುರ್ಚಿಯ ಮೇಲೆ ಕುಳಿತು, ಒಂದು ಮಾಂತ್ರಿಕ ಪ್ರಾಣಿಗಳ ವೀಕ್ಷಿಸಬೇಕು."
260,ಕರ್ಪುರದ ಜ್ಯೋತಿ ನಾನು ಎಲೆ ತಂಗಿ ॥
261,"ಹಳ್ಳಿಗಳಲ್ಲಿ ಎಲೆ ಮರೆ ಕಾಯಿಯಂತೆ ಇರುವ ಕಲಾವಿದರನ್ನು ಗುರುತಿಸಿ, ಹಳ್ಳಿ ಸೊಗಡಿನ ಜನಪದ ಕಲೆ ಉಳಿಸುವ ಅಗತ್ಯವಿದೆ ಎಂದು ಜಾನಪದ ಕಲಾವಿದ ಗುರುಬಸಯ್ಯ ಬೃಹನ್ಮಠ ಹೇಳಿದರು."
262,ಪಂಪಾ ನದಿ ತೀರದಲ್ಲಿ ಫ್ರೀ ವೆಡ್ಡಿಂಗ್​ ಫೋಟೋಗಾಗಿ ಜೋಡಿಗಳು ದೋಣಿ ಮೇಲೆ ಬಾಳೆ ಎಲೆ ಹಿಡಿದುಕೊಂಡು ಫೋಟೋಶೂಟ್​ ಮಾಡಿಸಿಕೊಳ್ಳುತ್ತಿದ್ದರು
263,"ಪ್ರಸ್ತುತ ಉದ್ಭವಿಸಿತು, ಎಲೆ ಮತ್ತು ಬೆಳೆದ ಮೂಲ ಸೆಲರಿ."
264,ಸಾಮಾನ್ಯವಾಗಿ ಹಿಂದಿನ ಕಾಲದಲ್ಲಿ ಊಟ ಅದ ತಕ್ಷಣ ಎಲೆ ಅಡಿಕೆ ಅನ್ನು ಹಾಕಿಕೊಳ್ಳುತ್ತಿದ್ದರು ಇದರಿಂದ ಕೂಡ ಆ ಕಾಲದಲ್ಲಿ ಹಲವಾರು ಸಮಸ್ಯೆಗಳು ಬರಲಿಲ್ಲ.
265,"ಪಿಟೀಲು ಎಲೆ ಅಂಜೂರದ ಕಾಡಿನಿಂದ ಬಂದಿದ್ದು, ಆದ್ದರಿಂದ ನಿಮ್ಮ ಮರದ ಪ್ರಕಾಶಮಾನವಾದ ಬಾತ್ರೂಮ್ ಸೂಕ್ತ ಸ್ಥಳವಾಗಿದೆ."
266,"ಕೊನೆಯಲ್ಲಿ, ಸಬ್ಬಸಿಗೆ (ಪರೀಕ್ಷಿಸಬಹುದು ಒಣಗಿಸಿ), ಮತ್ತು ಬೇ ಎಲೆ ಸೇರಿಸಿ."
267,ಮುಂಗಾರು ಹಾಗೂ ಹಿಂಗಾರು ಸಾಧಾರಣ ಆಗಿದ್ದರೂ ಮಾವಿನ ಗಿಡಗಳು ಚೆನ್ನಾಗಿ ಚಿಗುರಿ ಎಲೆ ಬಿಟ್ಟಿದ್ದವು.
268,"ಹೆಸರು ಬೆಳೆಗೆ ಎಲೆ ಮುಟುರು ರೋಗ ಹಾಗೂ ನುಸಿ ಪೀಡೆ ರೋಗಗಳು ಬಂದು, ಹೆಸರು ಬಳ್ಳಿಯ ಎಲೆಗಳು ಮುದುಡಿ ನೆಲಕ್ಕೆ ಬೀಳುತ್ತಿವೆ."
269,"ದೊಡ್ಡ ಎಲೆ ಮೇಪಲ್ ಜೊತೆಗೆ, ನೀವು ಒರೆಗಾನ್ ಮೇಪಲ್, ಬಿಗ್ಲೀಫ್ ಮ್ಯಾಪಲ್ ಅಥವಾ ಬ್ರಾಡ್ಲೀಫ್ ಮೇಪಲ್ ಎಂಬ ಮರದನ್ನೂ ನೋಡಬಹುದು."
270,"ನಾನು ಅದನ್ನು ಕೆಂಪು ಮತ್ತು ಹಸಿರು ಬಣ್ಣಕ್ಕೆ ಆದ್ಯತೆ ನೀಡುತ್ತೇನೆ, ಆದರೆ ಮುಂದಿನ ಹಂತವು ಕಲ್ಪನೆಯನ್ನು ಅಭಿವೃದ್ಧಿಪಡಿಸುವುದರ ಮೂಲಕ, ಎಲೆ ಸಿರೆಗಳ ನೇರ ರೇಖೆಗಳನ್ನು ತೊಡೆದುಹಾಕುತ್ತದೆ."
271,ಅಲ್ಲದೆ ಹೀಗೆಯೇ ಬೇ ಎಲೆ ಬಳಕೆಗೆ ಹೋಲುವ ಅಪ್ಲಿಕೇಶನ್ ಆಯ್ಕೆಗಳನ್ನು ಹೊಂದಿದೆ.
272,"ತಾಲ್ಲೂಕಿನಲ್ಲಿ ಕಸಬಾ, ಗೋಣಿಬೀಡು, ಬಣಕಲ್‌, ಬಾಳೂರು ಹಾಗೂ ಕಳಸ ರೈತ ಸಂಪರ್ಕ ಕೇಂದ್ರ ವ್ಯಾಪ್ತಿಯಲ್ಲಿ ಸುಮಾರು 6500 ಎಕರೆ ಪ್ರದೇಶದಲ್ಲಿ ಭತ್ತವನ್ನು ಬೆಳೆಯಲಾಗಿದ್ದು, ತಾಲ್ಲೂಕಿನಾದ್ಯಂತ ಅಲ್ಲಲ್ಲಿ ಕೊಳವೆ ಹುಳು, ಎಲೆ ಸುರುಳಿ ಹುಳು, ಕಾಂಡ ಕೊರಕಹುಳು ಹಾಗೂ ಕಂಬಳಿ ಹುಳುಗಳ ಬಾಧೆ ಕಂಡು ಬರುತ್ತಿದೆ."
273,ಈ ಶಿಷ್ಯ ಒಂದೊಂದು ಹೆಜ್ಜೆ ನದಿಯಲ್ಲಿ ಇಟ್ಟಾಗಲೂ ಒಂದೊಂದು ಕಮಲದ ಎಲೆ ನದಿಯಮೇಲೆ ಕಾಣುತ್ತಿದೆ.
274,ಎಲೆ ಎದೆಯೆ.
275,ನಂತರ ಮೊದಲೇ ಕಲಸಿಕೊಂಡಿರುವ ಮಾಂಸಕ್ಕೆ ಪಲಾವ ಎಲೆ ಮತ್ತು ಮೊದಲೇ ತೆಗೆದಿಟ್ಟುಕೊಂಡಿರುವ ತೆಂಗಿನ ಕಾಯಿಯ ಹಾಲನ್ನು ಬೆರೆಸಿ ಕುದಿಸಿ ಅದು ಸ್ವಲ್ಪ ಬೆಂದಮೇಲೆ ಅದಕ್ಕೆ ತಯಾರಿದ ಮಸಾಲೆಯನ್ನು ಬೆರೆಸಿ ಹಾಗೂ ಗೋಡಂಬಿ ಪೆಸ್ಟ್ ಅನ್ನು ಸೇರಿಸಿ ತದನಂತರ ಅದಕ್ಕೆ ಗರಂ ಮಸಾಲಾ ಪುಡಿಯನ್ನು ಸೇರಿಸಿ ಚೆನ್ನಾಗಿ ಕುದಿಸಿ ಅದಕ್ಕೆ ಟೊಮೇಟ್ ಅನ್ನು ಹಾಕಿ ಚೆನ್ನಾಗಿ ಕುದಿಸಿ ನಂತರ ಅದರ ಮೇಲೆ ಕೊತ್ತೊಂಬರಿ ಸೊಪ್ಪನ್ನು ಚಿಕ್ಕದಾಗಿ ಕತ್ತರಿಸಿ ಮೇಲೆ ಉದುರಿಸಿ ರುಚಿಗೆ ತಕ್ಕಷ್ಟು ಉಪ್ಪು ಬೆರೆಸಿದರೆ ರುಚಿ ರುಚಿಯಾದ ಕರಾವಳಿ ಶೈಲಿಯ ಕೋಳಿಸಾರು ಸವಿಯಲು ಸಿದ್ಧ.
276,ಒಂದು ಎಕರೆಯಲ್ಲಿ ಆರು ಟನ್‌ಗೆ ಆಗುವಷ್ಟು ಹಸಿರೆಲೆ ಗೊಬ್ಬರದ ಎಲೆ ಬೆಳೆಯಲು ಅವಕಾಶವಿದೆ.
277,"ಎಲೆ ಅಡಿಕೆ, ಕುಡಿಯಲು ಬಿಸಿ ನೀರು, ನಡುನಡುವೆ ಕಷಾಯ, ಟೀ."
278,ದೇಶದಲ್ಲಿ ಇರುವವರೆಗೂ ಇದು ಕೈಗೆಟುಕದ್ದಲ್ಲ ಎಂದು ಯೋಚಿಸುತ್ತಲೇ ಊಟದ ಬಾಳೆ ಎಲೆ ಮಡುಚಿದೆ.
279,"ಸ್ಟ್ರಾಬೆರಿ ಮೊಳಕೆ 2-3 ಪ್ರಬಲ ಎಲೆ ಮತ್ತು ಇಂತಹ ಕಪ್ ಅಥವಾ ಪಾತ್ರೆಯಲ್ಲಿ ಮುಚ್ಚಿದೆ ಬೇರುಗಳು, ಮಾರಾಟ ಇರಬೇಕು."
280,ಹತ್ತು ದಿನ ತುಳಸಿ ಎಲೆ ಜಗಿದು ನೀರು ಕುಡಿಯಬೇಕು.
281,"ಟ್ರಸ್ಟ್‌ನ ಸಂಚಾಲಕ ಸುಭಾಷ್ ಬಣಗಾರ್ ಪ್ರಾಸ್ತಾವಿಕವಾಗಿ ಮಾತನಾಡಿ, ಗ್ರಾಮೀಣ ಪ್ರದೇಶದಲ್ಲಿ ಎಲೆ ಮರೆಯ ಕಾಯಿಯಂತೆ ಇದ್ದು ಸಮಾಜ ಸೇವೆಯಲ್ಲಿ ತೊಡಗಿದವರನ್ನು ಗುರುತಿಸಿ, ಗೌರವಿಸುವುದು ಸೇರಿದಂತೆ, ಅನೇಕ ಸಾಮಾಜಿಕ ಚಟುವಟಿಕೆಗಳಲ್ಲಿ ತೊಡಗಲು ಈ ಟ್ರಸ್ಟ್‌ನ್ನು ಆರಂಭಿಸಲಾಗಿದೆ."
282,ಅದು ಬೇಸಿಗೆಯಲ್ಲಿ ಸಂಪೂರ್ಣ ಎಲೆ ಉದುರಿಸುವುದರಿಂದ ಬೆಂಕಿ ಬೀಳುತ್ತಿತ್ತು.
283,ಅದು ಎಲೆ ಒಂದಾದರೂ ಗುಣ ಹಲವು ಎಂಬಂತೆ ಆರೋಗ್ಯ ವರ್ಧಕವಂತೂ ಹೌದು.
284,ಅವರ ಸಹಕಾರದಿಂದ ನಮ್ಮ ಸಂಸ್ಥೆ ಎಲೆ ಮರೆ ಕಾಯಿಯಂತೆ ರಾಷ್ಟ್ರ ನಿರ್ಮಾಣ ಮಾಡುವ ಶಿಕ್ಷಕರನ್ನು ಗುರ್ತಿಸಿ ಸನ್ಮಾನಿಸಿದ್ದೇವೆ.
285,ಎಲೆ ಮತ್ತು ಬೇರು ಔಷಧಿಯಲ್ಲಿ ಉಪಯೋಗವಾಗುತ್ತವೆ.
286,ಹದಕ್ಕೆ ಬರುವ ಮುನ್ನ ಎಲೆ ಹಳದಿಯಾಗುವುದು
287,ಹೂವು ಎಲೆ ತೊಟ್ಟಿನ ಕಂಕುಳಲ್ಲಿ ಬಿಡುತ್ತವೆ.
288,"ಜಿಲ್ಲೆಯಲ್ಲಿ ಅಡಕೆ ಹಳದಿ ಎಲೆ ರೋಗಬಾಧಿತ ಪ್ರದೇಶಗಳ ವ್ಯಾಪ್ತಿ ಹಾಗೂ ತೀವ್ರತೆಗಳ ಅಂಕಿ ಅಂಶಗಳನ್ನು ನಿಖರವಾಗಿ ತಿಳಿಯಲು ಸಮಗ್ರ ಸಮೀಕ್ಷೆ ನಡೆಸಲು ನಿರ್ಧರಿಸಲಾಗಿದ್ದು, ಡಿಸೆಂಬರ್ ಕೊನೆಯ ವಾರದಲ್ಲಿ ಸಮೀಕ್ಷೆ ಆರಂಭಗೊಳ್ಳಲಿದೆ."
289,ಎಲೆ ಮಹಾಭವ್ಯದೆ
290,"ಗುಂಪಿನ ಎಲೆ ಛಾವಣಿಯ ದಟ್ಟವಾಗಿದ್ದು, ಇದರ ಕೆಳಗಡೆ ಯಾವ ಗಿಡವನ್ನು ಬೆಳೆಯಲು ಅವಕಾಶ ಕೊಡುವುದಿಲ್ಲ."
291,"ಯಾರೂ ಇಲ್ಲಿ ಕೈ ಕೈ ಮಿಲಾಯಿಸುವುದಿಲ್ಲ, ಎಲ್ಲರೂ ಎಲೆ ಕಲಸುವವರೇ."
292,"ಅವರು ಸಸ್ಯಾಹಾರಿ ಆಹಾರದಲ್ಲಿದ್ದಾರೆ: ಬೀಜಗಳು, ಸೋಯಾಬೀನ್ಗಳು, ಕುಂಬಳಕಾಯಿ, ಎಲೆ ಗ್ರೀನ್ಸ್, ಸಸ್ಯಜನ್ಯ ಎಣ್ಣೆ."
293,ಮುತ್ತ್ಯ ಮೂರು ತೆರೆದ ಸುರಿದು ಎಲೆ ಮಂತ್ರಿ | ನಿಮ್ಮ
294,ಹಿಂಗಾಗಿ ಬಾಜೂ ಯಾರೂ ಇಲ್ಲದಾಗ ಎಲೆ ಹಾಕಿಕೊಳ್ಳಬೇಕಾಗಿದೆ ಎಂದು ಅಡರಕಟ್ಟಿ ಗ್ರಾಮದ ಬಸವಣ್ಣೆಪ್ಪ ರೊಳ್ಳಿ ಹೇಳುತ್ತಾರೆ.
295,"ಅದು ರಕ್ತ thins ಕುದುರೆ ಚೆಸ್ಟ್ನಟ್, ಟಿಂಚರ್ ರಾಸ್ಪ್ಬೆರಿ ಎಲೆ ಮತ್ತು ಕೆಂಗಂದು, ನೆಲದ ದಾಲ್ಚಿನ್ನಿ (ಮೊಸರು ಸೇರಿಸಿ), Flaxseed ಮತ್ತು ಆಲಿವ್ ತೈಲ, ವೈನ್, ಶುಂಠಿ ಮತ್ತು ಬೆಳ್ಳುಳ್ಳಿ."
296,"ಇಲ್ಲಿ ಪ್ರಮುಖವಾಗಿ ನಿತ್ಯ ಹಸಿರು ಮತ್ತು ಅರೆ ನಿತ್ಯ ಹಸಿರು ಅರಣ್ಯ (ಕಾನು), ನಿತ್ಯ ಹಸಿರು ಮತ್ತು ಅರೆ ನಿತ್ಯ ಹಸಿರನ್ನುಳ್ಳ ನಶಿಸಿರುವ ಹಂತ, ಎಲೆ ಉದುರುವ ಕಾಡು, ಗಿಡ ಮತ್ತು ಮರಗುಳುಳ್ಳ ಹುಲ್ಲು ಬನಿ ಜಾಡಿ (ಹುಲ್ಲು ಗಾವಲು) ಎಂದು ಇಬ್ಭಾಗಿಸಬಹುದಾಗಿದೆ."
297,"ವೇಳೆ, ಹೊರತುಪಡಿಸಿ ಕಾಂಡ ಮತ್ತು ಎಲೆ ಮೊಗ್ಗಿನಿಂದ ಹೂಗಳು ಅಥವಾ ಹೂಗೊಂಚಲು ಆರಂಭ ಒಳಗೊಂಡಿದೆ, ಅದು ಉತ್ಪಾದಕ ಕರೆಯಲಾಗುತ್ತದೆ."
298,* 2 ಆಲೂಗೆಡ್ಡೆ * ಅರ್ಧ ಕೆಜಿ ಚಿಕನ್ * 2 ಕ್ಯಾರೆಟ್ * 3 ಕಡ್ಡಿ ಸಿಲೆರಿ * 2 ಈರುಳ್ಳಿ * 10 ಕಪ್ ನೀರು * 2 ಪಲಾವ್ ಎಲೆ * ಒಂದು ಚಮಚ ಕರಿಮೆಣಸಿನ ಪುಡಿ * ಅರ್ಧ ಕಪ್ ಜೋಳದ ಪುಡಿ * 2 ಚಮಚ ಉಪ್ಪು * ನಿಂಬೆ ಹಣ್ಣಿನ ರಸ * ಕೊತ್ತಂಬರಿ ಸೊಪ್ಪು
299,ತುತ್ತು ಮಾಡಿ ಉಣ್ಣಿಸಿದನು ಎಲೆ ಜೋಗಿ ೩
300,ಸೇಸೆಯಿಟ್ಟು ತಂದನೇನೆ ಎಲೆ ತಂಗಿ
301,"ವಿನ್ಯಾಸದ ನನ್ನ ಚಿಕಿತ್ಸೆಯಲ್ಲಿ, ನಾನು ಸಂಬಂಧಿತ ಎಲೆ ಗಾತ್ರ ಎಂದು ಉಲ್ಲೇಖಿಸಿದೆ."
302,"ಆ ನಂತರ ಅದರ ಮೇಲೆ ಕೊತ್ತಂಬರಿ, ಪುದೀನಾ ಎಲೆ ಉದುರಿಸಿ ಹುರಿಯಬೇಕು."
